title,price,link_item,index,discount,sales,category
MÁY HÚT SỮA ĐIỆN RẢNH TAY VÀ KHÔNG DÂY - FREEPRO 1 - FB1270BT,1.659.000₫,https://tiki.vn/may-hut-sua-dien-ranh-tay-va-khong-day-freepro-1-fb1270bt-p202338830.html?spid=254896853,1,-11%,,chamsocme
Máy hút sữa điện đơn Beurer BY40,1.485.000₫,https://tiki.vn/may-hut-sua-dien-don-beurer-by40-p11869793.html?spid=190703044,2,-5%,,chamsocme
"Combo Cốc hứng sữa Gen.1 100ml và Nút hoa chặn Haakaa. Chất liệu silicone cao cấp, an toàn. Không chứa BPA, PVC và phthalate",479.000₫,https://tiki.vn/combo-coc-hung-sua-silicone-gen-1-va-nut-hoa-chan-haakaa-p171060274.html?spid=171060276,3,-8%,Đã bán 1,chamsocme
Quần lót cạp cao kháng khuẩn cho mẹ (màu đen),33.000₫,https://tiki.vn/quan-lot-cap-cao-khang-khuan-cho-me-mau-den-p43768900.html?spid=57298048,4,-21%,,chamsocme
"Acne serum đánh bay mụn, sạch thâm sẹo, dưỡng trắng da Wonmom 20ml",240.000₫,https://tiki.vn/acne-serum-danh-bay-mun-sach-tham-seo-duong-trang-da-wonmom-20ml-p221251765.html?spid=260640662,5,-21%,,chamsocme
"Bộ chăm sóc tình mẫu tử giúp mẹ thơm, bé khỏe Wonmom ( 1 hộp thảo mộc xông cửa mình cho mẹ + 1 dầu tràm )",190.000₫,https://tiki.vn/bo-cham-soc-tinh-mau-tu-giup-me-thom-be-khoe-wonmom-1-hop-thao-moc-xong-vung-kin-cho-me-1-dau-tram-p221251704.html?spid=260640578,6,-21%,,chamsocme
Bộ đánh tan mỡ bụng lâu năm Wonmom ( 1 Gel gừng giảm eo + 1 Gen nịt bụng ),355.000₫,https://tiki.vn/bo-danh-tan-mo-bung-lau-nam-wonmom-1-gel-gung-giam-eo-1-gen-nit-bung-p221251742.html?spid=260669116,7,-5%,,chamsocme
Bộ tắm và tẩy tế bào chết toàn thân Wonmom ( 1 Scrub café tẩy toàn thân + 1 Sữa tắm cho mẹ ),290.000₫,https://tiki.vn/bo-tam-va-tay-te-bao-chet-toan-than-wonmom-1-scrub-cafe-tay-toan-than-1-sua-tam-cho-me-p221251829.html?spid=260667974,8,-14%,,chamsocme
Bộ dưỡng trắng da mặt chuyên sâu Wonmom ( 1 sữa rửa mặt + 1 serum vitamin C + 1 kem nghệ tươi ),560.000₫,https://tiki.vn/bo-duong-trang-da-mat-chuyen-sau-wonmom-1-sua-rua-mat-1-serum-vitamin-c-1-kem-nghe-tuoi-p221251639.html?spid=260795048,9,-11%,,chamsocme
"Bộ dưỡng đẩy mụn ẩn, dưỡng trắng hồng da mặt Wonmom (1 kem nghệ tươi+ 1 hộp xông mặt thảo dược)",305.000₫,https://tiki.vn/bo-duong-day-mun-an-duong-trang-hong-da-mat-wonmom-1-kem-nghe-tuoi-1-hop-xong-mat-thao-duoc-p221251663.html?spid=260667990,10,,,chamsocme
"ĐAI NỊT BỤNG THÔNG HƠI, GEN BỤNG, NỊT BỤNG GIẢM EO SIÊU TỐT",62.697₫,https://tiki.vn/dai-nit-bung-thong-hoi-gen-bung-nit-bung-giam-eo-sieu-tot-p17887136.html?spid=191132040,11,,,chamsocme
Áo lót bầu liền bản to ôm bầu ngực ALB06,122.550₫,https://tiki.vn/ao-lot-bau-lien-ban-to-om-bau-nguc-alb06-p91105294.html?spid=91105302,12,,Đã bán 1,chamsocme
Set 3 quần mặc trong váy cạp chéo chân ren cho bầu,104.000₫,https://tiki.vn/set-3-quan-mac-trong-vay-cap-cheo-chan-ren-cho-bau-p20204161.html?spid=57298702,13,,Đã bán 7,chamsocme
Thùng Đựng Cốp Sau 70 lít,266.000₫,https://tiki.vn/thung-dung-cop-sau-70-lit-p112587542.html?spid=163723158,14,,,chamsocme
Set 5 quần lot bầu cạp chéo cotton cao cấp - Màu ngẫu nhiên,87.000₫,https://tiki.vn/set-5-quan-lot-bau-cap-cheo-cotton-cao-cap-mau-ngau-nhien-p20695205.html?spid=79664624,15,,Đã bán 2,chamsocme
Bộ trắng da mặt và body toàn diện Wonmom ( Serum vitamin C + Kem nghệ tươi + Kem sữa nghệ toàn thân + Scrub café body ),990.000₫,https://tiki.vn/bo-trang-da-mat-va-body-toan-dien-wonmom-serum-vitamin-c-kem-nghe-tuoi-kem-sua-nghe-toan-than-scrub-cafe-body-p221251797.html?spid=221251798,16,,,chamsocme
"Bộ sạch mụn, trắng da mặt và body toàn diện Wonmom ( 1 Serum mụn + 1 Kem cấp ẩm + 1 Kem sữa nghệ + 1 Scrub cafe body )",990.000₫,https://tiki.vn/bo-sach-mun-trang-da-mat-va-body-toan-dien-wonmom-1-serum-mun-1-kem-cap-am-1-kem-sua-nghe-1-scrub-cafe-body-p221251671.html?spid=221251673,17,,,chamsocme
"Bộ trắng da, sạch mụn cao cấp Wonmom ( Sữa rửa mặt + Scrub nghệ + Kem cấp ẩm + Serum mụn + Mặt nạ nghệ + Xông mặt )",1.199.000₫,https://tiki.vn/bo-trang-da-sach-mun-cao-cap-wonmom-sua-rua-mat-scrub-nghe-kem-cap-am-serum-mun-mat-na-nghe-xong-mat-p221251874.html?spid=221251875,18,,,chamsocme
QUẦN LÓT BẦU ARCTIC HUNTER AH1,94.050₫,https://tiki.vn/quan-lot-bau-arctic-hunter-ah1-p58340624.html?spid=161944321,19,,,chamsocme
"Đai quấn muối có dây kéo, dùng đựng muối quấn bụng Wonmom ( 200g )",82.000₫,https://tiki.vn/dai-quan-muoi-co-day-keo-dung-dung-muoi-quan-bung-wonmom-200g-p221251734.html?spid=221251735,20,,Đã bán 1,chamsocme
Dụng cụ hút sữa cầm tay Pur + Quà tặng set 3 bình trữ sữa,635.000₫,https://tiki.vn/dung-cu-hut-sua-cam-tay-pur-qua-tang-set-3-binh-tru-sua-p143040738.html?spid=143040741,21,,,chamsocme
"Combo Cốc hứng sữa Gen.1 100ml và Nắp đậy Haakaa. Chất liệu silicone cao cấp, an toàn. Không chứa BPA, PVC và phthalate",479.000₫,https://tiki.vn/combo-coc-hung-sua-silicone-gen-1-100ml-va-nap-day-haakaa-p169850266.html?spid=169850267,22,,,chamsocme
Thảo mộc xông tắm sau sinh WonMom,48.000₫,https://tiki.vn/thao-moc-xong-tam-sau-sinh-wonmom-p197856324.html?spid=197856326,23,,Đã bán 7,chamsocme
Gối ôm chữ U đă năng cho bà bầu loại mới 2020 (giao màu ngẫu nhiên),155.652₫,https://tiki.vn/goi-om-chu-u-da-nang-cho-ba-bau-loai-moi-2020-giao-mau-ngau-nhien-p56690071.html?spid=142021801,24,,,chamsocme
Áo hút sữa rảnh tay cao cấp xuất xịn 100% cotton điều chỉnh kích cỡ,70.000₫,https://tiki.vn/ao-hut-sua-ranh-tay-cao-cap-xuat-xin-100-cotton-dieu-chinh-kich-co-p73214926.html?spid=272151920,25,,,chamsocme
đai nịt bụng định hình vòng eo 2 lớp,74.250₫,https://tiki.vn/dai-nit-bung-dinh-hinh-vong-eo-2-lop-p12297490.html?spid=57298468,26,,,chamsocme
Quần chip sexy giá bất ngờ,20.000₫,https://tiki.vn/quan-chip-sexy-gia-bat-ngo-p116776119.html?spid=116776125,27,,,chamsocme
Quần chip bầu,32.500₫,https://tiki.vn/quan-chip-bau-p89914691.html?spid=89914721,28,,,chamsocme
Đai gen bụng eo con kiến,800.000₫,https://tiki.vn/dai-gen-bung-eo-con-kien-p116776490.html?spid=116776649,29,,,chamsocme
Áo lót không gọng sexy cho mẹ _ Gladys,110.000₫,https://tiki.vn/ao-lot-khong-gong-sexy-cho-me-_-gladys-p80243172.html?spid=80243198,30,,,chamsocme
Đai gen bụng chống cuộn 345,200.000₫,https://tiki.vn/dai-gen-bung-chong-cuon-345-p116775678.html?spid=116775687,31,,,chamsocme
Quần lót chữ V BK673,41.600₫,https://tiki.vn/quan-lot-chu-v-bk673-p89916741.html?spid=89916746,32,,,chamsocme
Quần chip bầu cạp trễ su thông hơi cao cấp,30.000₫,https://tiki.vn/quan-chip-bau-cap-tre-su-thong-hoi-cao-cap-p116775523.html?spid=116775546,33,,,chamsocme
LÁ XÔNG CẢM LẠNH - HỘP LỚN,87.000₫,https://tiki.vn/la-xong-cam-lanh-hop-lon-p115892378.html?spid=115892379,34,,Đã bán 1,chamsocme
Áo Body 2 Trong 1 Kuku S7503 (Nịt Bụng Kèm Áo Ngực Cho Bé Bú) Size,324.000₫,https://tiki.vn/ao-body-2-trong-1-kuku-s7503-nit-bung-kem-ao-nguc-cho-be-bu-hong-p142298.html?spid=54756251,35,,,chamsocme
Dây dẫn khí máy hút sữa Beurer CSB511,22.000₫,https://tiki.vn/day-dan-khi-may-hut-sua-beurer-csb511-p106181267.html?spid=106181268,36,,,chamsocme
Sữa tắm thảo dược daopharm for women,190.000₫,https://tiki.vn/sua-tam-thao-duoc-daopharm-for-women-p203069340.html?spid=203069341,37,,,chamsocme
[NHẬT BẢN] Miếng Lót Thấm Sữa ChuChu Baby (130 pc),405.900₫,https://tiki.vn/nhat-ban-mieng-lot-tham-sua-chuchu-baby-130-pc-p94763908.html?spid=94763909,38,,,chamsocme
Áo Ngực CBTAQCT01 Áo Lót Cài Trước Quây Chống Tuột Nâng Ngực Cúp Ngang Không Gọng Cao Cấp Quyến Rũ Hở Lưng,24.000₫,https://tiki.vn/ao-nguc-cbtaqct01-ao-lot-cai-truoc-quay-chong-tuot-nang-nguc-cup-ngang-khong-gong-cao-cap-quyen-ru-ho-lung-p109979800.html?spid=109979911,39,,,chamsocme
Áo lót ống cotton vân mẫu mới nhất,70.000₫,https://tiki.vn/ao-lot-ong-cotton-van-mau-moi-nhat-p116776123.html?spid=116776130,40,,,chamsocme
