title,price,link_item,index,discount,sales,brand
"áo khoác nhung bomber màu nâu F4 26, áo bomber bóng chày hàn quốc F426, Áo khoác bóng chày bomber F426 nhung bông dày unisex nam/nữ",156.000₫,https://tiki.vn/ao-khoac-nhung-bomber-mau-nau-f4-26-ao-bomber-bong-chay-han-quoc-f426-ao-khoac-bong-chay-bomber-f426-nhung-bong-day-unisex-nam-nu-p176682850.html?spid=176682851,1,,Đã bán 1,Jinrinteen
"Áo Khoác dây kéo nỉ bông chữ thêu CIRCUM unisex (nam nữ mặc được), Áo Khoác Nỉ Unisex Thêu Chữ I Am Awake Áo Khoác Nam Nữ Tay Bồng Basic Cá Tính Hottrend, Áo khoác tay dài form rộng chữ thêu Awake",99.000₫,https://tiki.vn/ao-khoac-day-keo-ni-bong-chu-theu-circum-unisex-nam-nu-mac-duoc-ao-khoac-ni-unisex-theu-chu-i-am-awake-ao-khoac-nam-nu-tay-bong-basic-ca-tinh-hottrend-ao-khoac-tay-dai-form-rong-chu-theu-awake-p177941540.html?spid=177941541,2,,,Jinrinteen
"áo khoác bomber nhung, Varsity jacket nhung tăm unisex form rộng áo bomber 2 lớp ulzzang streetstyle nam nữ hottrend, Áo khoác nam nữ - Bomber jacket chất liệu nhung gân dày dặn form rộng rãi",156.000₫,https://tiki.vn/ao-khoac-bomber-nhung-varsity-jacket-nhung-tam-unisex-form-rong-ao-bomber-2-lop-ulzzang-streetstyle-nam-nu-hottrend-ao-khoac-nam-nu-bomber-jacket-chat-lieu-nhung-gan-day-dan-form-rong-rai-p171511880.html?spid=171511886,3,,,Jinrinteen
"Áo bomber nỉ IN DINER form rộng Unisex, Áo khoác bomber nỉ Cardigan bông trần dày dặn trẻ trung",123.000,https://tiki.vn/ao-bomber-ni-in-diner-form-rong-unisex-ao-khoac-bomber-ni-cardigan-bong-tran-day-dan-tre-trung-p171824704.html?spid=171824708,4,,,Jinrinteen
,,https://tiki.vn/ao-varsity-jacket-ao-khoac-cardigan-bomber-undertrap-unisex-phoi-bo-sieu-hot-p171824344.html?spid=171824365,5,,,Jinrinteen
"Áo khoác nữ áo nỉ chữ certain có mũ form rộng 3 màu chất dày dặn phù hợp các mùa trong năm , PHONG CÁCH DỄ THƯƠNG ĐÁNG YÊU DÀNH CHO NỮ",126.000₫,https://tiki.vn/ao-khoac-nu-certain-fammilyshop-2-non-sieu-xinh-chat-ni-pe-day-dan-form-dep-p171824406.html?spid=171824482,6,,,Jinrinteen
"Áo Khoác 2 Lớp Chất Da Lộn Phối Viền Áo Khoác Nhung Lì Form Rộng Cực Đẹp, chất dày dặn co dãn ngăn ngừa tia UV tiếp xúc trực tiếp với da",166.000₫,https://tiki.vn/ao-khoac-2-lop-chat-da-lon-phoi-vien-ao-khoac-nhung-li-form-rong-cuc-dep-p171824637.html?spid=171824651,7,,,Jinrinteen
"Áo sweater nỉ bông unisex in số 26 form rộng dài tay mặc cặp nam nữphù hợp phong cách hàn quốcÁo nỉ sweater cặp đôi nam nữ Yinxx, áo tay dài nỉ bông unisex, Áo Sweater nỉ form rộng chuẩn UNISEX OVERSIZE cực đẹp",100.000₫,https://tiki.vn/ao-sweater-ni-bong-unisex-in-so-26-form-rong-dai-tay-mac-cap-nam-nuphu-hop-phong-cach-han-quoc-p170440383.html?spid=170440391,8,,,Jinrinteen
"Áo khoác da lộn 2 lớp bomber croptop, logo thêu form 70kg, Áo Khoác Nhung Nữ Form Lửng Croptop Cao Cấp Thêu Logo Thời Trang, ÁO KHOÁC NHUNG GÂN NHUNG TĂM CROPTOP LỬNG CAO CẤP",156.000,https://tiki.vn/ao-khoac-da-lon-2-lop-bomber-croptop-logo-theu-form-70kg-ao-khoac-nhung-nu-form-lung-croptop-cao-cap-theu-logo-thoi-trang-ao-khoac-nhung-gan-nhung-tam-croptop-lung-cao-cap-p179932210.html?spid=179932218,9,,,Jinrinteen
,,https://tiki.vn/ao-hoodie-in-cun-newyork-ao-khoac-ni-ngoai-tay-phong-unisex-p153471834.html?spid=153471839,10,,,Jinrinteen
Áo Sweater Thêu Gấu Jelly Nỉ Ngoại Áo SWT Tay Phồng Chất Nỉ Unisex Mịn Đẹp,100.000₫,https://tiki.vn/ao-sweater-theu-gau-jelly-ni-ngoai-ao-swt-tay-phong-chat-ni-unisex-min-dep-p153471824.html?spid=153471837,11,,,Jinrinteen
Áo Sweater Nỉ Ngoại In Khủng Long Áo Swt Nỉ Tay Phồng Unisex In Sắc Nét,100.000,https://tiki.vn/ao-sweater-ni-ngoai-in-khung-long-ao-swt-ni-tay-phong-unisex-in-sac-net-p153471855.html?spid=153471859,12,,,Jinrinteen
,,https://tiki.vn/ao-hoodie-ni-dang-rong-bear-3d-nam-nu-mac-p153470709.html?spid=153470716,13,,,Jinrinteen
"ÁO HOODIE CHUI ĐẦU MÀU TRẮNG IN HÌNH BÁNH NGỌT SIÊU CUTE, PHONG CÁCH ĐÁNG YÊU",117.000₫,https://tiki.vn/ao-sweater-donut-ulzzang-unisex-pqk-p153470639.html?spid=153470645,14,,,Jinrinteen
"Áo khoác nỉ nam nữ form rộng có dây kéo ulzzang unisex nhiều mẫu chất nỉ bông cao cấp giá rẻ đẹp, style HÀN",100.000₫,https://tiki.vn/ao-khoac-ni-hoodie-nam-nu-form-rong-co-day-keo-ulzzang-unisex-nhieu-mau-lechau-aknhh01-chat-ni-bong-cao-cap-gia-re-dep-p162866593.html?spid=162866618,15,,,Jinrinteen
"Áo khoác bomber nỉ form rộng Unisex, Áo bomber nỉ Cardigan trần bông trẻ trung",95.000₫,https://tiki.vn/ao-khoac-bomber-ni-form-rong-unisex-ao-bomber-ni-cardigan-tran-bong-tre-trung-p162838292.html?spid=162838294,16,,,Jinrinteen
"ÁO THUN TAY NGẮN NAM NỮ IN CHỮ MISSUOT , 2 MÀU ĐEN TRẮNG, CỰC CHẤT, PHONG CÁCH XU HƯỚNG 2022",99.000₫,https://tiki.vn/ao-thun-tay-ngan-nam-nu-in-chu-missuot-2-mau-den-trang-cuc-chat-phong-cach-xu-huong-2022-p163550657.html?spid=163550659,17,,,Jinrinteen
,,https://tiki.vn/a-o-hoodie-essentials-tinowwear-chat-ni-bong-cotton-day-dan-co-kem-video-anh-that-ao-ni-hoodie-essential-ao-ni-bong-hoodie-unisex-nam-nu-hoodie-es-ni-bong-hang-dep-cao-cap-p136370065.html?spid=136370069,18,,,Jinrinteen
"Áo Khoác Bomber Dù 2 Lớp Thêu Chữ Form Rộng Unisex Nam Nữ Couple Ulzzang, Áo khoác dù bomber nam nữ unisex form rộng vải 2 lớp chất xịn, dày dặn",110.000₫,https://tiki.vn/ao-khoac-bomber-du-2-lop-theu-chu-form-rong-unisex-nam-nu-couple-ulzzang-p146515227.html?spid=146515249,19,,,Jinrinteen
"Áo Khoác Bomber Jackets Bóng Chày UNAL Chất Dù MERO 2 Lớp Form chuẩn Unisex Nam Nữ Couple Ulzzang, Áo khoác bomber jacket dù 2 lớp dày dặn - Áo bóng chày form rộng phối chữ Ulzzang nam nữ đều mặc được",108.000₫,https://tiki.vn/ao-khoac-bomber-jackets-bong-chay-unal-chat-du-mero-2-lop-form-chuan-unisex-nam-nu-couple-ulzzang-kun-p146515413.html?spid=146515459,20,,Đã bán 3,Jinrinteen
"Áo Khoác Bomber Dù 2 Lớp in L.A Print NO MORE LATE NIGHTS Form Rộng Unisex Nam Nữ Ulzzang, Áo khoác bóng chày dù",103.000₫,https://tiki.vn/ao-khoac-bomber-du-2-lop-in-l-a-print-no-more-late-nights-form-rong-unisex-nam-nu-ulzzang-kun-p146515257.html?spid=146515294,21,,,Jinrinteen
"Áo Khoác Bomber Jackets Chất Dù 2 Lớp in Chữ R Phối Tay Form Rộng Unisex Nam Nữ Ulzzang KUN, Áo bomber nam nữ, áo khoác bóng cháy chất gió 2 lớp hàng cao cấp",103.000₫,https://tiki.vn/ao-khoac-bomber-jackets-chat-du-2-lop-in-chu-r-phoi-tay-form-rong-unisex-nam-nu-ulzzang-kun-p146515183.html?spid=146515191,22,,Đã bán 1,Jinrinteen
"Áo Sweater Dáng Rộng Chữ Thêu HARRY POTTER [ nam nữ mặc ],Áo Sweater Chỉ Nổi Chữ Thêu Phong Cách Unisex Nam Nữ Dáng Rộng",98.000₫,https://tiki.vn/ao-sweater-dang-rong-chu-theu-harry-potter-pqk-nam-nu-mac-p166412267.html?spid=166412274,23,,,Jinrinteen
SÉT BỘ NỮ MẶC NHÀ FOM RỘNG HỌA TIẾT DÂU TAY XINH LUNG LINH,96.000₫,https://tiki.vn/set-bo-nu-mac-nha-fom-rong-hoa-tiet-dau-tay-xinh-lung-linh-p173626758.html?spid=173626785,24,,,Jinrinteen
Áo khoác Varisty unisex nam nữ giá siêu rẻ,155.000,https://tiki.vn/ao-khoac-varisty-unisex-nam-nu-gia-sieu-re-p173627473.html?spid=173627478,25,,,Jinrinteen
,,https://tiki.vn/ao-thun-phan-quang-7-mau-con-ech-form-duoi-70kg-form-rong-unisex-p173558305.html?spid=173558307,26,,,Jinrinteen
Áo khoác dù bomber nam nữ form rộng,103.000₫,https://tiki.vn/ao-khoac-du-bomber-nam-nu-form-rong-4young-bblv05-p185465772.html?spid=185465778,27,,,Jinrinteen
Áo khoác bomber nữ đẹp form rộng in họa tiết dễ thương phong cách Ulzzang,160.000₫,https://tiki.vn/ao-khoac-bomber-nu-dep-form-rong-in-hoa-tiet-de-thuong-phong-cach-ulzzang-4young-tp852-p185465530.html?spid=185465556,28,,,Jinrinteen
"Áo Khoác Dù Bomber 2 Lớp Form Lửng Logo In Chữ GB Lớn Phối Cúc Bấm, Kiểu Dáng Teen Năng Động, Áo khoác dù 2 lớp dáng croptop bomber in chữ GB nhiều màu dễ mix đồ form 38-55kg dành cho nữ",99.000₫,https://tiki.vn/ao-khoac-du-bomber-2-lop-form-lung-logo-in-chu-gb-lon-phoi-cuc-bam-kieu-dang-teen-nang-dong-ao-khoac-du-2-lop-dang-croptop-bomber-in-chu-gb-nhieu-mau-de-mix-do-form-38-55kg-danh-cho-nu-p185447902.html?spid=185447906,29,,,Jinrinteen
Áo khoác dù bomber nam nữ form rộng,103.000,https://tiki.vn/ao-khoac-du-bomber-nam-nu-form-rong-4young-bblv09-p185465522.html?spid=185465525,30,,,Jinrinteen
,,https://tiki.vn/set-bo-quan-ao-gau-hot-trend-chat-thun-mem-min-p187853540.html?spid=187853567,31,,,Jinrinteen
"Áo Hoodie Dáng Rộng WZS OFFICAL Pqk [ nam nữ mặc ], áo Hoodie Wzsoficall, áo khoác hoodie unisex phong cách hàn quốc ullzang, áo khoác hoodie chống nắng mũ rộng",100.000₫,https://tiki.vn/ao-hoodie-dang-rong-wzs-offical-pqk-nam-nu-mac-ao-hoodie-wzsoficall-ao-khoac-hoodie-unisex-phong-cach-han-quoc-ullzang-ao-khoac-hoodie-chong-nang-mu-rong-p187845751.html?spid=187845752,32,,,Jinrinteen
"Áo sweater nỉ bông dáng unisex form rộng GOOD VIBER, Áo sweater nỉ nam nữ , áo nỉ dài tay basic sweater, Áo Hoodie Ulzzang Unisex, áo thun tay dài unisex nỉ bông",109.000₫,https://tiki.vn/ao-sweater-ni-bong-dang-unisex-form-rong-good-viber-ao-sweater-ni-nam-nu-ao-ni-dai-tay-basic-sweater-ao-hoodie-ulzzang-unisex-ao-thun-tay-dai-unisex-ni-bong-p188837658.html?spid=188837662,33,,,Jinrinteen
"Áo khoác nhung bomber NỮ SIÊU ĐẸP , PHONG CÁCH MẪU MỚI NHẤT HIỆN NAY",159.000₫,https://tiki.vn/ao-khoac-nhung-bomber-nu-sieu-dep-phong-cach-mau-moi-nhat-hien-nay-p195301872.html?spid=195301892,34,,,Jinrinteen
"Áo khoác dù 2 lớp tay phối sọc siêu đẹp , tôn dáng phong cách hàn quốc MẪU MỚI NHẤT HIỆN NAY",92.000₫,https://tiki.vn/ao-khoac-du-2-lop-tay-phoi-soc-sieu-dep-ton-dang-phong-cach-han-quoc-mau-moi-nhat-hien-nay-p195301820.html?spid=195301870,35,,,Jinrinteen
,,https://tiki.vn/ao-khoac-du-bomber-unisex-cuc-dep-phong-cach-hottrend-2021-mau-moi-nhat-hien-nay-p195302184.html?spid=195302210,36,,,Jinrinteen
(HCM) ÁO KHOÁC NỈ HOODIES WHITE AD CHỐNG NẮNG HOTTREND,99.000₫,https://tiki.vn/hcm-ao-khoac-ni-hoodies-white-ad-chong-nang-hottrend-p195301738.html?spid=195301761,37,,,Jinrinteen
"ÁO KHOÁC NỈ NỮ,THIẾT KẾ MÀU SẮC XINH ĐỘNG,ĐẶC BIỆT LÀ CHẤT LIỆU VÃI THOÁNG MÁT",96.000₫,https://tiki.vn/ao-khoac-ni-nu-thiet-ke-mau-sac-xinh-dong-dac-biet-la-chat-lieu-vai-thoang-mat-lana-fashion-p195302521.html?spid=195302562,38,,,Jinrinteen
(HCM) Áo khoác thời trang mới dành cho các bạn trẻ thời trang đỉnh đỉnh MỚI NHẤT HIỆN NAY,99.000₫,https://tiki.vn/hcm-ao-khoac-thoi-trang-moi-danh-cho-cac-ban-tre-thoi-trang-dinh-dinh-moi-nhat-hien-nay-p195302509.html?spid=195302543,39,,,Jinrinteen
"Áo Khoác nỉ bông CLBANA phối Chữ Sau Lưng Dây Kéo form rộng unisex nam nữ Thu Đông Mẫu Hot, Áo Khoác Nỉ Hoodie Nam Nữ Khóa Zip Cotton Cao Cấp Unisex",100.000,https://tiki.vn/ao-khoac-ni-bong-clbana-phoi-chu-sau-lung-day-keo-form-rong-unisex-nam-nu-thu-dong-mau-hot-ao-khoac-ni-hoodie-nam-nu-khoa-zip-cotton-cao-cap-unisex-p196791418.html?spid=196791419,40,,,Jinrinteen
