,title,price,link_item,discount,sales,category,revenue
97,Áo Lót Bầu Sau Sinh Cho Con Bú Chống Chảy Xệ Cao Cấp Chất Liệu Cotton Alb06,170000,https://tiki.vn/ao-lot-bau-sau-sinh-cho-con-bu-chong-chay-xe-cao-cap-chat-lieu-cotton-alb06-p164582599.html?spid=164582647,,1.0,thoitrangbau,170000.0
98,Quần lót bầu cotton cạp cao có chun chỉnh bụng Ql02,169000,https://tiki.vn/quan-lot-bau-cotton-cap-cao-co-chun-chinh-bung-ql02-p164582396.html?spid=164582450,,1.0,thoitrangbau,169000.0
99,Vịt Phun Nước Bánh Xe Quay Đồ Chơi Cực Kỳ Hấp Dẫn Cho Bé,135000,https://tiki.vn/vit-phun-nuoc-banh-xe-quay-do-choi-cuc-ky-hap-dan-cho-be-p198123627.html?spid=198123628,,6.0,thoitrangbau,810000.0
100,"Áo Vắt Sữa, Áo Lót Hút Sữa Rảnh Tay Và Cho Con Bú 2 Trong 1 KUNBE Mặc Được Cả Ngày Thay Áo Ngực Thông Thường",89000,https://tiki.vn/ao-vat-sua-ao-lot-hut-sua-ranh-tay-va-cho-con-bu-2-trong-1-kunbe-mac-duoc-ca-ngay-thay-ao-nguc-thong-thuong-p75313942.html?spid=75313952,-41%,33.0,thoitrangbau,2937000.0
101,QUẦN BẦU JEAN PHONG CÁCH TRẺ TRUNG QBN1199,455000,https://tiki.vn/quan-bau-jean-phong-cach-tre-trung-qbn1199-p78892646.html?spid=78892656,-14%,6.0,thoitrangbau,2730000.0
102,CHÂN VÁY BẦU MÙA HÈ DÁNG XẾP LY XÒE QBN1181,325000,https://tiki.vn/chan-vay-bau-mua-he-dang-xep-ly-xoe-qbn1181-p253264784.html?spid=78625796,,13.0,thoitrangbau,4225000.0
103,"Quần bầu dài ống rộng, dáng suông có chun chỉnh bụng - quần bầu thiết kế cao cấp QB999",74340,https://tiki.vn/quan-bau-dai-ong-rong-dang-suong-co-chun-chinh-bung-quan-bau-thiet-ke-cao-cap-qb999-p146573739.html?spid=146573823,,6.0,thoitrangbau,446040.0
104,QUẦN BẦU BÒ CO GIÃN THOẢI-Quần Bầu Xinh Quần Jean Bầu Quần Baggy Bầu Trẻ Trung Năng Động,375000,https://tiki.vn/quan-bau-bo-co-gian-thoai-quan-bau-xinh-quan-jean-bau-quan-baggy-bau-tre-trung-nang-dong-p103097978.html?spid=166319731,,1.0,thoitrangbau,375000.0
105,"Váy bầu hoa nhí phong cách vintage, đầm bầu thiết kế siêu xinh V271",162540,https://tiki.vn/vay-bau-hoa-nhi-phong-cach-vintage-dam-bau-thiet-ke-sieu-xinh-v271-p146572445.html?spid=146572498,,1.0,thoitrangbau,162540.0
106,Quần Bầu Suông Ống Rộng Cạp Chéo AZ555 Chất Liệu Thun Gân Lên Dáng Cực Xinh Mặc Hè Siêu Mát,195000,https://tiki.vn/quan-bau-suong-ong-rong-cap-cheo-az555-chat-lieu-thun-gan-len-dang-cuc-xinh-mac-he-sieu-mat-p243059729.html?spid=243059747,,10.0,thoitrangbau,1950000.0
107,QUẦN LÓT GEN BỤNG CAO CẤP NHẬT BẢN SIÊU THON GỌN,21420,https://tiki.vn/quan-lot-gen-bung-cao-cap-nhat-ban-sieu-thon-gon-p146573846.html?spid=146573880,,2.0,thoitrangbau,42840.0
108,Áo Lót Nữ ĐÚC Không Gọng Nâng ngực mềm mại thoáng mát tôn vòng 1 gợi cảm quyến rũ cho phái đẹp,45360,https://tiki.vn/ao-lot-nu-duc-khong-gong-nang-nguc-mem-mai-thoang-mat-ton-vong-1-goi-cam-quyen-ru-cho-phai-dep-p146572220.html?spid=146572274,,3.0,thoitrangbau,136080.0
109,"Ngũ cốc lợi sữa Lạc Lạc Plus mới cao cấp 39 loại hạt giúp mẹ bổ sung vitamin và khoáng chất, canxi giúp xương chắc khỏe 600g (hộp 30 gói)",257140,https://tiki.vn/ngu-coc-loi-sua-lac-lac-plus-moi-cao-cap-39-loai-hat-giup-me-bo-sung-vitamin-va-khoang-chat-canxi-giup-xuong-chac-khoe-600g-hop-30-goi-p208299975.html?spid=208299976,,1.0,thoitrangbau,257140.0
110,Bộ đồ bầu mặc nhà và sau sinh NGỐ thun cotton (có vạt chéo co bé ti),134820,https://tiki.vn/bo-do-bau-mac-nha-va-sau-sinh-ngo-thun-cotton-co-vat-cheo-co-be-ti-p146574999.html?spid=146575133,,1.0,thoitrangbau,134820.0
111,Bộ đồ bầu Pink Quảng Châu Bầu và Sau Sinh Cộc Tay(Có mở nắp),134820,https://tiki.vn/bo-do-bau-pink-quang-chau-bau-va-sau-sinh-coc-tay-co-mo-nap-p146574534.html?spid=146574711,,1.0,thoitrangbau,134820.0
112,Quần bầu cạp chéo thể thao,86940,https://tiki.vn/quan-bau-cap-cheo-the-thao-p146572107.html?spid=146572119,,1.0,thoitrangbau,86940.0
113,quần bầu ống xớ chất dệt kim cao cấp,190260,https://tiki.vn/quan-bau-ong-xo-chat-det-kim-cao-cap-p146575504.html?spid=146575731,,1.0,thoitrangbau,190260.0
114,quần bầu có đáp bụng,74340,https://tiki.vn/quan-bau-co-dap-bung-p146574409.html?spid=146574519,,1.0,thoitrangbau,74340.0
115,Quần bầu lửng nâng mông,74340,https://tiki.vn/quan-bau-lung-nang-mong-p146573585.html?spid=146573626,,1.0,thoitrangbau,74340.0
116,"Xịt răng miệng Minion Gold Dr.maya hộp/50ml, Vệ sinh răng miệng ngăn ngừa sau răng cho bé từ 6 tháng tuổi",245000,https://tiki.vn/xit-rang-mieng-minion-gold-dr-maya-hop-50ml-ve-sinh-rang-mieng-ngan-ngua-sau-rang-cho-be-tu-6-thang-tuoi-p251512328.html?spid=235896730,,30.0,thoitrangbau,7350000.0
117,Quần đùi bầu. Quần đùi mặc váy cạp chéo,42000,https://tiki.vn/quan-dui-bau-quan-dui-mac-vay-cap-cheo-p143643415.html?spid=143643430,,5.0,thoitrangbau,210000.0
118,"Áo Lót, Áo Ngực Bầu Và Cho Con Bú Chất Mềm Mại Thoáng Mát",55000,https://tiki.vn/ao-lot-ao-nguc-bau-va-cho-con-bu-chat-mem-mai-thoang-mat-p127455590.html?spid=127455600,,2.0,thoitrangbau,110000.0
119,Quần bầu hè thu ngố QBD1520,285000,https://tiki.vn/quan-bau-he-thu-ngo-qbn1174-p258863197.html?spid=258863199,-42%,1.0,thoitrangbau,285000.0
120,QUẦN BẦU JEAN PHONG CÁCH TRẺ TRUNG DÁNG DÀI QBN1325,425000,https://tiki.vn/quan-bau-jean-phong-cach-tre-trung-dang-dai-qbn1325-p253382928.html?spid=253382934,,1.0,thoitrangbau,425000.0
121,Áo lót ngực bầu cho bé con bú LỤA TĂM không gọng nâng ngực đồ lót chip bà bầu A35,32000,https://tiki.vn/ao-lot-nguc-bau-cho-be-con-bu-lua-tam-khong-gong-nang-nguc-do-lot-chip-ba-bau-a35-p117973118.html?spid=192720943,,17.0,thoitrangbau,544000.0
122,Bộ lửng cotton mặc bầu và sinh,160000,https://tiki.vn/bo-lung-cotton-mac-bau-va-sinh-p92319029.html?spid=92319031,,1.0,thoitrangbau,160000.0
123,Dầu húng chanh Minion Gold 30mL,233000,https://tiki.vn/dau-hung-chanh-minion-gold-30ml-p235886538.html?spid=235886543,,2.0,thoitrangbau,466000.0
124,Váy bầu thiết kế cao cấp giả yếm full size 45-85kg,250000,https://tiki.vn/vay-bau-thiet-ke-cao-cap-gia-yem-full-size-45-85kg-p92320002.html?spid=273215200,,1.0,thoitrangbau,250000.0
125,"Quần mặc trong váy cho bà bầu chất cotton mềm mỏng thông hơi thoáng mát,dễ chịu có dây điều chỉnh vòng bụng QL05",169000,https://tiki.vn/quan-mac-trong-vay-cho-ba-bau-chat-cotton-mem-mong-thong-hoi-thoang-mat-de-chiu-co-day-dieu-chinh-vong-bung-ql05-p164582351.html?spid=164582390,,9.0,thoitrangbau,1521000.0
126,Quần lót bầu cạp chéo kháng khuẩn -quần lót nữ cotton chất đẹp cao cấp CS101,31000,https://tiki.vn/quan-lot-bau-cap-cheo-khang-khuan-quan-lot-nu-cotton-chat-dep-cao-cap-cs101-p148641356.html?spid=148641383,,3.0,thoitrangbau,93000.0
127,Quần baggy bầu đủ size 45-100kg chất cao cấp,200000,https://tiki.vn/quan-baggy-bau-du-size-45-100kg-chat-cao-cap-p92320183.html?spid=92320187,,8.0,thoitrangbau,1600000.0
128,"Váy ngủ, váy mặc nhà cộc tay dáng suông chất cotton mềm mát họa tiết hoạt hình dễ thương (KHÔNG KÈM TÚI) V285",69300,https://tiki.vn/vay-ngu-vay-mac-nha-coc-tay-dang-suong-chat-cotton-mem-mat-hoa-tiet-hoat-hinh-de-thuong-khong-kem-tui-v285-p146573631.html?spid=146573663,,10.0,thoitrangbau,693000.0
129,"XẢ LỖ VÁY BẦU, ĐẦM BẦU THIẾT KẾ",74340,https://tiki.vn/xa-lo-vay-bau-dam-bau-thiet-ke-p146573195.html?spid=146573247,,2.0,thoitrangbau,148680.0
130,QUẦN BẦU HÈ THU QUẦN BẦU LỬNG THÔ KAKI QBN07,295000,https://tiki.vn/quan-bau-he-thu-quan-bau-lung-tho-kaki-qbn07-p78954717.html?spid=78954727,,1.0,thoitrangbau,295000.0
131,Combo 4 Quần Lót cho Bà Bầu Và Sau Sinh Cạp Chéo Chất Cotton Mềm Mịn,148000,https://tiki.vn/combo-4-quan-lot-cho-ba-bau-va-sau-sinh-cap-cheo-chat-cotton-mem-min-p127456770.html?spid=127457281,,1.0,thoitrangbau,148000.0
132,5 chiếc quần lót giấy cao cấp - Quần lót giấy đẹp cho mẹ sau sinh,12000,https://tiki.vn/5-chiec-quan-lot-giay-cao-cap-quan-lot-giay-dep-cho-me-sau-sinh-p148640620.html?spid=148640662,,17.0,thoitrangbau,204000.0
133,"Ngũ cốc lợi sữa Lạc Lạc Plus mới cao cấp 39 loại hạt giúp mẹ bổ sung vitamin và khoáng chất, canxi giúp xương chắc khỏe 600g (hộp 30 gói)",257140,https://tiki.vn/ngu-coc-loi-sua-lac-lac-plus-moi-cao-cap-39-loai-hat-giup-me-bo-sung-vitamin-va-khoang-chat-canxi-giup-xuong-chac-khoe-600g-hop-30-goi-p209918256.html?spid=209918258,,1.0,thoitrangbau,257140.0
134,Đầm Bầu Tiểu Thư CB,285000,https://tiki.vn/dam-bau-tieu-thu-cb-p101747990.html?spid=101747991,,1.0,thoitrangbau,285000.0
135,Váy bầu thiết kế thời trang công sở,167000,https://tiki.vn/vay-bau-thiet-ke-thoi-trang-cong-so-p129494129.html?spid=129494145,,2.0,thoitrangbau,334000.0
136,"Quần Short, Tregging Bầu Mặc Hè Chất Liệu Thun Lạnh, Quần Tập Yoga Cho Phụ Nữ Mang Thai Có Chun Chỉnh Và Đáp Bụng",220000,https://tiki.vn/quan-short-tregging-bau-mac-he-chat-lieu-thun-lanh-quan-tap-yoga-cho-phu-nu-mang-thai-co-chun-chinh-va-dap-bung-p243058266.html?spid=243058268,,6.0,thoitrangbau,1320000.0
137,Bộ thể thao cho con bú sz L XL XXL ẢNH THẬT,344500,https://tiki.vn/bo-the-thao-cho-con-bu-sz-l-xl-xxl-anh-that-p95170304.html?spid=95170347,,1.0,thoitrangbau,344500.0
138,ẢNH THẬT ️Đầm cho con bú,247000,https://tiki.vn/anh-that-dam-cho-con-bu-p95173045.html?spid=95173060,,2.0,thoitrangbau,494000.0
139,️ẢNH THẬT️ Áo giữ nhiệt cho con bú,299000,https://tiki.vn/anh-that-ao-giu-nhiet-cho-con-bu-p95170847.html?spid=95171108,,2.0,thoitrangbau,598000.0
140,[ Combo 2 hộp ] ngũ cốc lợi sữa Lạc Lạc (39 loại hạt) 30 gói,515000,https://tiki.vn/combo-2-hop-ngu-coc-loi-sua-lac-lac-39-loai-hat-30-goi-p230110962.html?spid=230110963,,1.0,thoitrangbau,515000.0
141,Chân Váy Bầu Xếp Ly Azuno AZ44 Có Đáp Bụng Và Chun Chỉnh Bụng,185000,https://tiki.vn/chan-vay-bau-xep-ly-azuno-az44-co-dap-bung-va-chun-chinh-bung-p75330558.html?spid=75330562,,1.0,thoitrangbau,185000.0
142,"Áo bầu công sở mùa hè 2023, áo bà bầu, mleeshop",109000,https://tiki.vn/ao-bau-cong-so-mua-he-2023-ao-ba-bau-mleeshop-p254903232.html?spid=254903240,,1.0,thoitrangbau,109000.0
143,"Áo bầu xinh hàn quốc, áo babydoll bầu đẹp, MLEE SHOP",105000,https://tiki.vn/ao-bau-xinh-han-quoc-ao-babydoll-bau-dep-mlee-shop-p263589616.html?spid=254903317,,1.0,thoitrangbau,105000.0
144,Quần bầu Ngố Legging bầu cotton co giãn 4 chiều QBN1213,155000,https://tiki.vn/quan-bau-ngo-legging-bau-cotton-co-gian-4-chieu-qbn1213-p104807148.html?spid=104807162,,1.0,thoitrangbau,155000.0
145,Quần legging bầu nỉ thu đông mẫu mới siêu xinh,94000,https://tiki.vn/quan-legging-bau-ni-thu-dong-mau-moi-sieu-xinh-p88792143.html?spid=88792158,,3.0,thoitrangbau,282000.0
