title,price,link_item,index,discount,sales,category
ÁO THUN NỮ TRƠN ÔM BODY CỔ TRÒN NGẮN TAY,60.000₫,https://tiki.vn/ao-thun-nu-tron-om-body-co-tron-ngan-tay-p69050999.html?spid=80859527,1,-49%,Đã bán 5,aonu
Áo Kiểu Thời Trang JUNO Croptop Tay Phồng Xếp Ly Ngực JNAKI010,249.000₫,https://tiki.vn/ao-kieu-thoi-trang-juno-croptop-tay-phong-xep-ly-nguc-jnaki010-p204281165.html?spid=204281173,2,-50%,,aonu
Áo 2 Dây Cổ Đổ NHIHOUSE71 Chất Lụa Satin Loại 1 Hàng Thiết Kế Form Cực Chuẩn 45-58kg,130.000₫,https://tiki.vn/ao-2-day-co-do-nhihouse71-chat-lua-satin-loai-1-hang-thiet-ke-form-cuc-chuan-45-58kg-p92050793.html?spid=92050799,3,,Đã bán 2,aonu
"Áo croptop kiểu Hàn Quốc rộng tay lỡ nữ, áo thun ngắn cổ vuông form rộng điệu đà đen trắng mặc đi học đi chơi",97.900₫,https://tiki.vn/ao-croptop-kieu-han-quoc-rong-tay-lo-nu-ao-thun-ngan-co-vuong-form-rong-dieu-da-den-trang-mac-di-hoc-di-choi-p178509127.html?spid=178509135,4,,Đã bán 2,aonu
,,https://tiki.vn/ao-thun-nu-goking-nghe-thuat-cho-nhung-nguoi-phu-nu-tinh-te-p88092515.html?spid=88092561,5,-55%,,aonu
xả kho áo thun nữ tay lỡ phom rộng in hình hoạt hình trẻ trung năng động 60kg 68kg hàng bom giá rẻ,29.000₫,https://tiki.vn/xa-kho-ao-thun-nu-tay-lo-phom-rong-in-hinh-hoat-hinh-tre-trung-nang-dong-60kg-68kg-hang-bom-gia-re-p219456257.html?spid=219456259,6,,,aonu
Áo thun nữ form rộng Hàn Quốc vải dày mềm mịn thoáng mát ATNK1478,24.000₫,https://tiki.vn/ao-thun-nu-form-rong-han-quoc-vai-day-mem-min-thoang-mat-atnk1478-p76317560.html?spid=76317643,7,,Đã bán 18,aonu
Áo sơ mi dài tay chống nắng nữ Columbia Silver Ridge Utility - 2033343010,695.000₫,https://tiki.vn/ao-so-mi-dai-tay-chong-nang-nu-columbia-silver-ridge-utility-2033343010-p263654063.html?spid=263654072,8,-35%,,aonu
Áo sơ mi trung niên vai rúm mềm mại,193.000,https://tiki.vn/ao-so-mi-trung-nien-vai-rum-mem-mai-p96924391.html?spid=96924395,9,,,aonu
,,https://tiki.vn/ao-thun-croptop-body-tron-tay-ngan-dang-om-co-size-lon-ulzzang-mm-p198740893.html?spid=198740901,10,,,aonu
Áo thun Teeworld Why Fall In Love When You Can Fall Asleep Nam Nữ Unisex,299.000₫,https://tiki.vn/ao-thun-teeworld-why-fall-in-love-when-you-can-fall-asleep-nam-nu-unisex-p186305135.html?spid=186305139,11,,Đã bán 23,aonu
Áo Kiểu Hở Ngực Hở Vai Chất Thun Co Dãn Siêu Mát Hàng Cao Cấp,119.000,https://tiki.vn/ao-kieu-ho-nguc-ho-vai-chat-thun-co-dan-sieu-mat-hang-cao-cap-p190301511.html?spid=190301521,12,,,aonu
,,https://tiki.vn/ao-nu-kieu-theu-hoa-tiet-doc-dao-ao-nu-co-tron-chat-dui-mat-min-ao-dui-trang-xinh-mau-moi-dui-viet-dvale20-p162259588.html?spid=162259589,13,,,aonu
ÁO THUN NỮ IN HÌNH THÁP THỜI TRANG NHIỀU MÀU,19.000₫,https://tiki.vn/ao-thun-nu-in-hinh-thap-thoi-trang-nhieu-mau-p108568543.html?spid=205346198,14,,,aonu
Áo Kiểu Nữ Cổ V Viền NT6308N1,165.000₫,https://tiki.vn/ao-kieu-nu-co-v-vien-nt6308n1-p11184999.html?spid=57032132,15,,,aonu
Sơ mi Nữ - Áo Sơ Mi Tiểu Thư Chất Kate Siêu Đẹp,89.000₫,https://tiki.vn/so-mi-nu-ao-so-mi-tieu-thu-chat-kate-sieu-dep-p170876454.html?spid=170876455,16,,Đã bán 1,aonu
Áo sơ mi nữ form rộng tay ngắn chuẩn form hàn quốc trẻ trung năng động vải lạu mềm mại ít nhăn-MURN02,90.000₫,https://tiki.vn/ao-so-mi-nu-form-rong-tay-ngan-chuan-form-han-quoc-tre-trung-nang-dong-vai-lau-mem-mai-it-nhan-murn02-p192947717.html?spid=192947729,17,,,aonu
,,https://tiki.vn/ao-thun-body-nu-tay-dai-phong-cach-141-p106482822.html?spid=138873995,18,,,aonu
Aó thun CÁ SẤU MÈ - in theo yêu cầu- RẺ NHẤT SÓC SƠN,99.000₫,https://tiki.vn/ao-thun-ca-sau-me-in-theo-yeu-cau-re-nhat-soc-son-p129737746.html?spid=129737749,19,,,aonu
"Áo croptop ôm tay dài kiểu gợi cảm nữ OZENKA, áo crt mặc thu đông đẹp vải cotton đen trắng size dưới 55 kg",82.000₫,https://tiki.vn/ao-croptop-om-tay-dai-kieu-goi-cam-nu-ozenka-ao-crt-mac-thu-dong-dep-vai-cotton-den-trang-size-duoi-55-kg-p244332298.html?spid=244332306,20,,,aonu
"Áo croptop trễ vai tay xoè dài nữ OZENKA , áo crt kiểu cổ rộng chất thun gân mềm mịn mát 100% cotton đen trắng",59.000₫,https://tiki.vn/ao-croptop-tre-vai-tay-xoe-dai-nu-ozenka-ao-crt-kieu-co-rong-chat-thun-gan-mem-min-mat-100-cotton-den-trang-p195241832.html?spid=195241836,21,,,aonu
Áo Kiểu Nữ CCHATTay Nữ Hoàng Dáng Ôm Chất Xốp Cao Cấp Mềm Nhẹ 53FNX8014PT,259.000₫,https://tiki.vn/ao-kieu-nu-cchattay-nu-hoang-dang-om-chat-xop-cao-cap-mem-nhe-53fnx8014pt-p251257406.html?spid=251257414,22,,,aonu
Áo sơ mi kiểu nữ họa tiết 2022,145.000₫,https://tiki.vn/ao-so-mi-kieu-nu-hoa-tiet-2022-p192859971.html?spid=192860005,23,,,aonu
Áo Thun Cá Sấu Nữ Có Cổ -Màu trắng(45-75kg),96.000₫,https://tiki.vn/ao-thun-ca-sau-nu-co-co-mau-trang-45-75kg-p174379639.html?spid=174379667,24,,,aonu
Áo sơ mi ngắn tay nữ Columbia Silver Ridge Utility - 2033364101,745.000,https://tiki.vn/ao-so-mi-ngan-tay-nu-columbia-silver-ridge-utility-2033364101-p263651154.html?spid=263651158,25,,,aonu
,,https://tiki.vn/ao-croptop-body-tay-ngan-dang-om-hoa-tiet-in-hoa-hong-kieu-retro-han-quoc-thoi-trang-cho-nu-doc-dao-ca-tinh-p221223512.html?spid=221223514,26,,,aonu
"Áo Trung Niên Nữ Đẹp A93 - Áo ngủ mặc nhà kiểu thời trang cho người lớn tuổi, trung tuổi, cho mẹ, bà thu đông, mùa hè sang trọng cao cấp giá rẻ Bigsize, cỡ lớn, cho người mập - Shop áo lẻ trung niên dài tay U40 U50 U60 U70 U80",118.000₫,https://tiki.vn/ao-trung-nien-nu-dep-a93-ao-ngu-mac-nha-kieu-thoi-trang-cho-nguoi-lon-tuoi-trung-tuoi-cho-me-ba-thu-dong-mua-he-sang-trong-cao-cap-gia-re-bigsize-co-lon-cho-nguoi-map-shop-ao-le-trung-nien-dai-tay-u40-u50-u60-u70-u80-p220683846.html?spid=220683866,27,,Đã bán 4,aonu
"Áo kiểu nữ chất voan phối nơ xinh xắn - thích hợp mặc đi làm, dạo phố, form dáng chuẩn",185.000₫,https://tiki.vn/ao-kieu-nu-chat-voan-phoi-no-xinh-xan-thich-hop-mac-di-lam-dao-pho-form-dang-chuan-p109514154.html?spid=109514163,28,,Đã bán 8,aonu
Áo sơ mi nữ form rộng tay cộc chất thô,250.000₫,https://tiki.vn/ao-so-mi-nu-form-rong-tay-coc-chat-tho-lahstore-p200721001.html?spid=200721007,29,,Đã bán 1,aonu
HÀNG NHẬP - ÁO KIỂU VOAN GẤM CỔ V REN,390.000,https://tiki.vn/hang-nhap-ao-kieu-voan-gam-co-v-ren-p164286548.html?spid=164286550,30,,,aonu
,,https://tiki.vn/ao-kieu-nu-trung-nien-theu-hoa-tang-me-form-rong-bigsize-chat-lieu-dui-cao-cap-mem-nhe-mat-nesa-shop-akh-66-p249566206.html?spid=249566230,31,,,aonu
Áo Kiểu Nữ Cổ V Viền NT6308N,165.000₫,https://tiki.vn/ao-kieu-nu-co-v-vien-nt6308n-p11184495.html?spid=57032133,32,,,aonu
Áo thun nữ ngắn tay phong cách Hàn Quốc TLG 352TI 2(đen),38.900₫,https://tiki.vn/ao-thun-nu-ngan-tay-phong-cach-han-quoc-tlg-352ti-2-den-p145108894.html?spid=145109131,33,,,aonu
"Áo Đũi Nữ, Áo Kiểu Trung Niên Cho Mẹ Mặc Nhà Mùa Hè Chất Vải Thoáng Mát Mềm Nhẹ ARCTIC HUNTER AH19",199.000₫,https://tiki.vn/ao-dui-nu-ao-kieu-trung-nien-cho-me-mac-nha-mua-he-chat-vai-thoang-mat-mem-nhe-arctic-hunter-ah19-p189408223.html?spid=189408310,34,,Đã bán 5,aonu
Áo Thun Nữ Thời Trang HNOSS Lệch Vai Phối Ngọc HNATH033,199.000,https://tiki.vn/ao-thun-nu-thoi-trang-hnoss-lech-vai-phoi-ngoc-hnath033-p208217401.html?spid=208217411,35,,,aonu
,,https://tiki.vn/so-mi-lua-co-duc-vat-tron-zr-suong-3-mau-p169276977.html?spid=169276979,36,,,aonu
"Áo sơ mi nữ trung niên, áo kiểu cho phụ nữ trung niên hàng quảng châu cao cấp",230.000₫,https://tiki.vn/ao-so-mi-nu-trung-nien-ao-kieu-cho-phu-nu-trung-nien-hang-quang-chau-cao-cap-p202490993.html?spid=202491050,37,,Đã bán 3,aonu
"Áo thun nữ dài tay trung niên, Thiết kế mới chất xneo thêu hoa cực đẹp",129.000₫,https://tiki.vn/ao-thun-nu-dai-tay-trung-nien-thiet-ke-moi-chat-xneo-theu-hoa-cuc-dep-p153554024.html?spid=153554442,38,,Đã bán 1,aonu
Áo thun nữ cổ tròn form suông vừa in chữ SanFrancisco thun 4 chiều từ 40-55kg,89.000₫,https://tiki.vn/ao-thun-nu-co-tron-form-suong-vua-in-chu-sanfrancisco-thun-4-chieu-tu-40-55kg-p249257112.html?spid=249257122,39,,Đã bán 1,aonu
"Áo kiểu nữ - Màu hồng phấn,XXL",121.000,https://tiki.vn/ao-kieu-nu-p106223544.html?spid=106223554,40,,Đã bán 1,aonu
