title,price,link_item,index,discount,sales,category
Áo Sơ Mi Nhung Gân Form Rộng Nữ Ullzang,150.000₫,https://tiki.vn/ao-so-mi-nhung-gan-nq30_store-form-rong-nu-ullzang-p126210067.html?spid=126210083,1,-52%,Đã bán 19,aonu
(HÀNG SẴN) Áo Kiểu Nữ Trung Niên Lịch Sự SM64 - Hàng Quảng Châu Cao Cấp,225.000₫,https://tiki.vn/hang-san-ao-kieu-nu-trung-nien-lich-su-sm64-hang-quang-chau-cao-cap-p125021334.html?spid=125021454,2,,Đã bán 18,aonu
Áo sơ mi nữ tay dài form rộng trơn trẻ trung nặng động vải lụa mềm mịn-MUD03,100.000₫,https://tiki.vn/ao-so-mi-nu-tay-dai-form-rong-tron-tre-trung-nang-dong-vai-lua-mem-min-mud03-p187315703.html?spid=187315741,3,,Đã bán 35,aonu
Áo Kiểu Nữ Tay Loa Hoa Nhí MS0093A,180.000,https://tiki.vn/ao-kieu-nu-tay-loa-hoa-nhi-ms0093a-p7595886.html?spid=7595894,4,-43%,,aonu
,,https://tiki.vn/ao-thun-nu-thoi-trang-juno-co-yem-lai-cheo-jnath004-p189699933.html?spid=189699996,5,-21%,,aonu
Áo sơ mi nữ,89.000₫,https://tiki.vn/ao-so-mi-nu-p106223347.html?spid=205344086,6,-38%,,aonu
Áo hai dây lưng chữ U croptop có đệm ngực nâng đỡ vải Cotton tự nhiên co giãn tốt thoáng mát mã VAA0376,129.000₫,https://tiki.vn/ao-hai-day-lung-chu-u-croptop-co-dem-nguc-nang-do-vai-cotton-tu-nhien-co-gian-tot-thoang-mat-ma-vaa0376-p222655852.html?spid=222655874,7,-46%,Đã bán 9,aonu
áo sơ mi nữ kiểu croptop cộc tay cổ đức phối nẹp gấu bản to tay phồng cá tính,75.000₫,https://tiki.vn/ao-so-mi-nu-kieu-croptop-coc-tay-co-duc-phoi-nep-gau-ban-to-tay-phong-ca-tinh-p242618478.html?spid=242618482,8,-38%,Đã bán 2,aonu
"áo phông nữ, áo thun cánh dơi sát nách cổ tròn 3 màu",49.000₫,https://tiki.vn/ao-phong-nu-ao-thun-canh-doi-sat-nach-co-tron-3-mau-p130893736.html?spid=271433861,9,-42%,Đã bán 3,aonu
,,https://tiki.vn/full-tag-co-va-tay-ao-ao-phong-nam-nu-form-rong-tay-lo-vai-chat-cotton-min-mat-kita-unisex-mau-here-come-bear-full-size-p168799862.html?spid=180509412,10,,,aonu
"Áo sơ mi nữ form rộng cổ tầu chất thô đũi, thời trang phong cách trẻ",250.000₫,https://tiki.vn/ao-so-mi-nu-form-rong-co-tau-chat-tho-dui-thoi-trang-phong-cach-tre-p129821343.html?spid=129821359,11,,Đã bán 39,aonu
"Áo sơ mi nữ form rộng cổ tầu chất thô đũi, thời trang phong cách trẻ",259.000,https://tiki.vn/ao-so-mi-nu-form-rong-co-tau-chat-tho-dui-lahstore-thoi-trang-phong-cach-tre-p77702083.html?spid=77702091,12,,,aonu
,,https://tiki.vn/ao-lua-hoa-trung-nien-nu-tay-lo-pha-voan-kieu-dang-sang-trong-ao-kieu-nu-trung-nien-p217765370.html?spid=217765392,13,,,aonu
"Áo kiểu nữ cổ tròn trễ vai tay bồng dễ thương ArcticHunter, thời trang thương hiệu chính hãng",279.000₫,https://tiki.vn/ao-kieu-nu-co-tron-tre-vai-tay-bong-de-thuong-arctichunter-thoi-trang-thuong-hieu-chinh-hang-p217428802.html?spid=217428810,14,,Đã bán 4,aonu
Áo Kiểu Nữ Chạy Chỉ Chun Trễ Vai Dáng Ôm Chất Voan Cao Cấp 11ADV2009OT,179.000₫,https://tiki.vn/ao-kieu-nu-chay-chi-chun-tre-vai-dang-om-chat-voan-cao-cap-11adv2009ot-p242107016.html?spid=242107048,15,,Đã bán 32,aonu
Áo Sơ Mi Nữ Dài Tay Phối Họa Tiết Dấu X EMEREY LUXURY Chất Vải Kate Đẹp Thời Trang Nữ Cao Cấp,125.000₫,https://tiki.vn/ao-so-mi-nu-dai-tay-phoi-hoa-tiet-dau-x-emerey-luxury-chat-vai-kate-dep-thoi-trang-nu-cao-cap-p202223535.html?spid=202223548,16,,Đã bán 5,aonu
Áo Sơ Mi Nữ Form Rộng In Họa Tiết Phong Cách Hàn Quốc Chất Liệu Voan Lụa Chống Nhăn Thời Trang Cao Cấp Thương Hiệu CHANDI 2021 NT06,220.000,https://tiki.vn/ao-so-mi-nu-form-rong-in-hoa-tiet-phong-cach-han-quoc-chat-lieu-voan-lua-chong-nhan-thoi-trang-cao-cap-thuong-hieu-chandi-2021-nt06-p87003608.html?spid=87003610,17,,,aonu
,,https://tiki.vn/ao-thun-nu-tay-lo-form-rong-dang-suong-co-tron-in-hinh-chuon-chuon-m93-p70818660.html?spid=70818664,18,,,aonu
Áo sơ mi nữ cộc tay dáng cánh dơi cá tính,79.000₫,https://tiki.vn/ao-so-mi-nu-coc-tay-dang-canh-doi-ca-tinh-p111694609.html?spid=111694611,19,,Đã bán 268,aonu
ÁO GIỮ NHIỆT PHỐI REN CỔ VÀ TAY SIÊU XINH,106.000₫,https://tiki.vn/ao-giu-nhiet-phoi-ren-co-va-tay-sieu-xinh-p74362435.html?spid=176032714,20,,,aonu
RẬP GIẤY MẪU A444 - RẬP ÁO SƠ MI CỔ ĐỨC TAY DÀI MS(KHÔNG PHẢI BÁN ÁO),99.000₫,https://tiki.vn/rap-giay-mau-a444-rap-ao-so-mi-co-duc-tay-dai-ms-khong-phai-ban-ao-p271849850.html?spid=271849865,21,,,aonu
"Áo sơ mi nữ cổ tầu bổ trụ tay lỡ ArcticHunter, chất đũi lụa mềm mát, thời trang phong cách trẻ",159.000₫,https://tiki.vn/ao-so-mi-nu-co-tau-bo-tru-tay-lo-arctichunter-chat-dui-lua-mem-mat-thoi-trang-phong-cach-tre-p89662122.html?spid=89662142,22,,Đã bán 41,aonu
Áo len polo tay dài dệt kim kẻ sọc ngang - Áo thun len dài tay Quảng Châu,109.000₫,https://tiki.vn/ao-len-polo-tay-dai-det-kim-ke-soc-ngang-ao-thun-len-dai-tay-quang-chau-p177315352.html?spid=177315358,23,,Đã bán 12,aonu
"Áo thun nữ cổ tròn tay dài vải cotton đẹp, dễ mặc dễ phối đồ, mặc bốn mùa",39.000₫,https://tiki.vn/ao-thun-nu-co-tron-tay-dai-vai-cotton-dep-de-mac-de-phoi-do-mac-bon-mua-p192218631.html?spid=271434032,24,,Đã bán 7,aonu
Áo sơ mi nữ ngắn tay xanh đen phối viền vàng mẫu WN01 Thời trang nữ công sở Thiết kế trẻ trung thanh lịch,105.000,https://tiki.vn/ao-so-mi-nu-ngan-tay-xanh-den-phoi-vien-vang-mau-wn01-thoi-trang-nu-cong-so-thiet-ke-tre-trung-thanh-lich-p140465855.html?spid=140465859,25,,,aonu
,,https://tiki.vn/ao-thun-nu-thai-lan-8a-p204288571.html?spid=204288579,26,,,aonu
Áo thun tay lỡ form rộng unisex - Áo phông nam nữ oversize - T shirt gấu bearbrick kaws,49.000₫,https://tiki.vn/ao-thun-tay-lo-form-rong-unisex-ao-phong-nam-nu-oversize-t-shirt-gau-bearbrick-kaws-p146458748.html?spid=146458752,27,,Đã bán 5,aonu
Áo Thun Polo Nữ Trơn Phông Basic Tay Ngắn Cổ Bẻ Cotton Trẻ trung đơn giản 6 Màu Trắng Đen Cam Vàng - Hanlly Fashion A21,39.000₫,https://tiki.vn/ao-thun-polo-nu-tron-phong-basic-tay-ngan-co-be-cotton-tre-trung-don-gian-6-mau-trang-den-cam-vang-hanlly-fashion-a21-p95293996.html?spid=205363279,28,,,aonu
"Xe đạp, mã G85. Hãy tỏa sáng như kim cương, qua chiếc áo thun Goking siêu hot cho nam nữ trẻ em, áo phông cặp đôi, gia đình, đội nhóm",69.000₫,https://tiki.vn/xe-dap-ma-g85-ao-thun-nu-nam-in-sieu-dep-ao-phong-thoat-nhiet-goking-hang-hieu-cao-cap-p164545513.html?spid=249302990,29,,Đã bán 6,aonu
Áo Bà Ba Màu - Không Quần,75.000₫,https://tiki.vn/ao-ba-ba-mau-khong-quan-p225963137.html?spid=225963579,30,,Đã bán 3,aonu
,,https://tiki.vn/ao-thun-co-do-sao-vang-viet-nam-hang-tot-cao-cap-p113257265.html?spid=113257289,31,,,aonu
Áo Thun Kiểu Trễ Vai Buộc Nơ Dáng Ôm Chất Vải Co Giãn Mềm Mịn 13TNC2009OT,179.000₫,https://tiki.vn/ao-thun-kieu-tre-vai-buoc-no-dang-om-chat-vai-co-gian-mem-min-13tnc2009ot-p263969336.html?spid=263969360,32,,Đã bán 1,aonu
Áo thun tay lỡ form rộng - phông nam nữ cotton oversize - T shirt Vernichten xanh dương - 2N Unisex,49.000₫,https://tiki.vn/ao-thun-tay-lo-form-rong-phong-nam-nu-cotton-oversize-t-shirt-vernichten-xanh-duong-2n-unisex-p174008999.html?spid=174009001,33,,Đã bán 2,aonu
Áo Thun Nữ Thời Trang HNOSS Tay Ngắn In Chữ HNATH039,199.000₫,https://tiki.vn/ao-thun-nu-thoi-trang-hnoss-tay-ngan-in-chu-hnath039-p253277627.html?spid=253277637,34,,,aonu
Áo thun tay lỡ form rộng - phông nam nữ cotton oversize - T shirt Think - 2N Unisex,49.000₫,https://tiki.vn/ao-thun-tay-lo-form-rong-phong-nam-nu-cotton-oversize-t-shirt-think-2n-unisex-p176426597.html?spid=176426603,35,,Đã bán 1,aonu
,,https://tiki.vn/ao-thun-dirtycoins-retro-t-shirt-p174237800.html?spid=174237830,36,,,aonu
MLB - Áo sweater phom suông tay dài Classic Monogram Overfit 3AKPM0126,5.890.000₫,https://tiki.vn/mlb-ao-sweater-phom-suong-tay-dai-classic-monogram-overfit-3akpm0126-50bks-p205239537.html?spid=205239558,37,,,aonu
Áo Thun Nữ Aaa Jeans Cao Cấp Organic Cotton,249.000₫,https://tiki.vn/ao-thun-nu-aaa-jeans-cao-cap-organic-cotton-p84709814.html?spid=272425588,38,,Đã bán 40,aonu
ÁO SƠ MI LỤA CỔ PETER PAN CÓ NƠ THẮT (RỜI) AM01,169.000₫,https://tiki.vn/ao-so-mi-lua-co-peter-pan-co-no-that-roi-am01-p171323296.html?spid=171323300,39,,,aonu
Áo Sơ Mi Nữ Thời Trang JUNO Oversize Thân Sau Cutout JNASM005,149.000,https://tiki.vn/ao-so-mi-nu-thoi-trang-juno-oversize-than-sau-cutout-jnasm005-p189699954.html?spid=189699986,40,,,aonu
