title,price,link_item,index,discount,sales,category
Áo Thun Ngắn Tay Có Cổ Nữ Giordano Polo 05311232,210.000₫,https://tiki.vn/ao-thun-ngan-tay-co-co-nu-giordano-polo-05311232-p176211302.html?spid=176211334,1,-61%,Đã bán 9,aonu
Áo phông nam nữ form rộng 2N Unisex thun cotton in hình thỏ raglan màu trắng/xám đất,109.000₫,https://tiki.vn/ao-phong-nam-nu-form-rong-2n-unisex-thun-cotton-in-hinh-tho-raglan-mau-trang-xam-dat-p271421536.html?spid=271421540,2,-25%,Đã bán 1,aonu
Áo thun Unisex 20We Basic Tee phông trơn nam nữ RP_01 tay lỡ oversize form rộng 4 màu,24.000₫,https://tiki.vn/ao-thun-unisex-phong-tron-nam-nu-rp_01-tay-lo-oversize-form-rong-4-mau-p110751447.html?spid=115772036,3,,Đã bán 276,aonu
áo nữ cổ bẻ - phong cách trẻ trung năng động cho các chị nhà mình (T51),129.000,https://tiki.vn/ao-nu-co-be-phong-cach-tre-trung-nang-dong-cho-cac-chi-nha-minh-t51-p134381351.html?spid=134383438,4,,,aonu
,,https://tiki.vn/ao-kieu-nu-cong-so-co-vuong-phoi-nut-thiet-ke-thoi-trang-eden-nut-go-trang-tri-tay-phong-asm187-p198240389.html?spid=198240393,5,,,aonu
"Áo sơ mi nữ dài tay vạt tôm chất đũi nhẹ, thoáng mát nhiều màu",95.000₫,https://tiki.vn/ao-so-mi-nu-dai-tay-vat-tom-chat-dui-nhe-thoang-mat-nhieu-mau-p111695417.html?spid=111695423,6,-66%,Đã bán 220,aonu
Áo Sơ Mi Trắng Nữ Tay Ngắn Cộc Tay Mola Somi Công Sở Đi Học ĐI Làm Màu Trắng Đen Kem Hàng Thiết Kế Cao Cấp Không Nhăn,180.000₫,https://tiki.vn/ao-so-mi-trang-nu-tay-ngan-coc-tay-mola-somi-cong-so-di-hoc-di-lam-mau-trang-den-kem-hang-thiet-ke-cao-cap-khong-nhan-p165236773.html?spid=165236909,7,-67%,Đã bán 15,aonu
Áo ba lỗ cổ V dệt kim mềm mịn áo thun Quảng Châu 2022 cao cấp,85.000₫,https://tiki.vn/ao-ba-lo-co-v-det-kim-mem-min-ao-thun-quang-chau-2022-cao-cap-p189750140.html?spid=189750142,8,-36%,Đã bán 3,aonu
Áo Sơ Mi Nữ Ngắn Tay Công Sở Thời Trang PONIVA Cao Cấp Không Nhăn Không Xù,125.000,https://tiki.vn/ao-so-mi-nu-ngan-tay-cong-so-khong-nhan-khong-xu-p105951430.html?spid=105952210,9,-16%,,aonu
,,https://tiki.vn/ao-kieu-eliz-tay-phong-sang-trong-p50401550.html?spid=50401560,10,-10%,,aonu
Áo Thun 3 Lỗ Nữ Sát Nách Vải Cotton 100% Co Giãn 4 Chiều Cao Cấp Samantha SN115 SALLY BOUTIQUE,135.000₫,https://tiki.vn/ao-thun-3-lo-nu-sat-nach-vai-cotton-co-gian-4-chieu-cao-cap-samantha-sally-sn115-p197743329.html?spid=247304844,11,,Đã bán 7,aonu
Áo Sơ Mi Nữ Nơ Cổ Viền Nổi Bật MS0075A,190.000,https://tiki.vn/ao-so-mi-nu-no-co-vien-noi-bat-ms0075a-p7618176.html?spid=7618178,12,,,aonu
,,https://tiki.vn/ao-croptop-om-nu-tay-lo-co-cao-cai-khuy-goi-cam-ozenka-crt-kieu-han-quoc-thun-100-cotton-tu-nhien-den-trang-duoi-55kg-p195241850.html?spid=195241864,13,,,aonu
"Áo Khoác Sơ Mi nhung, áo sơ mi nhung, áo khoác ngoài sơ mi, áo khoác sơ mi from rộng, áo sơ mi unisex, áo khoác sơ mi ulzzang phong cách hàn quốc, áo khoác sơ mi đẹp, áo sơ mi quảng châu",160.000₫,https://tiki.vn/ao-khoac-so-mi-nhung-ao-so-mi-nhung-ao-khoac-ngoai-so-mi-ao-khoac-so-mi-from-rong-ao-so-mi-unisex-ao-khoac-so-mi-ulzzang-phong-cach-han-quoc-ao-khoac-so-mi-dep-ao-so-mi-quang-chau-p91753672.html?spid=91753692,14,,,aonu
Áo Thun Ba Lỗ Nữ Sát Nách Cotton 4 Chiều In Hình Con Mèo SN105 Sally Boutique,135.000₫,https://tiki.vn/ao-thun-ba-lo-nu-sat-nach-cotton-4-chieu-in-con-meo-cat-sally-sn105-mac-dep-ton-dang-ket-hop-voi-nhieu-trang-phuc-khac-p197743338.html?spid=197743369,15,,Đã bán 2,aonu
ÁO SƠ MI TRUNG NIÊN CAO CẤP- ÁO KIỂU TRUNG NIÊN IN HOA SANG TRONG_ÁO NỮ TRUNG NIÊN,199.000₫,https://tiki.vn/ao-so-mi-trung-nien-cao-cap-ao-kieu-trung-nien-in-hoa-sang-trong_ao-nu-trung-nien-p126524410.html?spid=126524441,16,,Đã bán 2,aonu
Áo Sơ Mi Tay Dài Nữ Giordano 05340038,887.000,https://tiki.vn/ao-so-mi-tay-dai-nu-giordano-mau-tim-05340038-p139603365.html?spid=198747159,17,,,aonu
,,https://tiki.vn/ao-thun-vat-nhun-xoan-bung-co-gian-mem-min-22tdc2038ot-p225911014.html?spid=225911018,18,,,aonu
Áo đũi lụa sát nách Vicci cao cấp nhiều màu,50.000₫,https://tiki.vn/ao-dui-lua-sat-nach-vicci-cao-cap-nhieu-mau-p56333616.html?spid=56333628,19,,Đã bán 84,aonu
Áo sơ mi cổ trụ tay lỡ dáng xuông thời trang Hàn Quốc ( mã A25),186.000₫,https://tiki.vn/ao-so-mi-co-tru-tay-lo-dang-xuong-thoi-trang-han-quoc-ma-a25-p179418058.html?spid=179418195,20,,Đã bán 20,aonu
"áo kiểu nữ cổ yếm hở vai 2 lớp kèm dây đai, áo babydoll bánh bèo trẻ trung",74.000₫,https://tiki.vn/ao-kieu-nu-co-yem-ho-vai-2-lop-kem-day-dai-ao-babydoll-banh-beo-tre-trung-p230229959.html?spid=230229961,21,,Đã bán 12,aonu
Áo Sơ Mi Linen Nữ Giordano 05340005,310.000₫,https://tiki.vn/ao-so-mi-linen-nu-giordano-05340005-p249291533.html?spid=249291539,22,,Đã bán 1,aonu
Áo phông kẻ nhỏ_áo thun nữ,44.000₫,https://tiki.vn/ao-phong-ke-nho_ao-thun-nu-p115770370.html?spid=115770400,23,,Đã bán 1,aonu
Áo thun nữ form rộng tay lỡ oversize hoa mất cánh peace unisex - thời trang nam nữ hot trend,21.000₫,https://tiki.vn/ao-thun-nu-form-rong-tay-lo-oversize-hoa-mat-canh-peace-unisex-thoi-trang-nam-nu-hot-trend-p52051393.html?spid=108968076,24,,Đã bán 27,aonu
Áo kiểu công sở cổ vuông phối hoa thời trang Eden - ASM216,279.000,https://tiki.vn/ao-kieu-cong-so-co-vuong-phoi-hoa-thoi-trang-eden-asm216-p271392849.html?spid=271392851,25,,Đã bán 1,aonu
,,https://tiki.vn/ao-ba-ba-mau-khong-quan-ma-am-p225962882.html?spid=225962986,26,,,aonu
"Áo sơ mi nữ form rộng kiểu tay lỡ cổ tròn NeSa Shop, chất liệu Đũi tơ thấm hút mồ hôi, áo sơ mi nữ nhiều màu, SMH.34",140.000₫,https://tiki.vn/ao-so-mi-nu-form-rong-kieu-tay-lo-co-tron-nesa-shop-chat-lieu-dui-to-tham-hut-mo-hoi-ao-so-mi-nu-nhieu-mau-smh-34-p146635373.html?spid=205169502,27,,Đã bán 156,aonu
"Áo ba lỗ croptop cá tính có mút ngực, áo bra nữ",79.000₫,https://tiki.vn/ao-ba-lo-croptop-ca-tinh-co-mut-nguc-ao-bra-nu-p217765397.html?spid=217765404,28,,Đã bán 2,aonu
Áo len dệt kim nữ tay ngắn - Áo thun nữ kiểu kẻ sọc ngũ sắc sinh động trẻ trung hàng thiết kế Quảng Châu cao,118.000₫,https://tiki.vn/ao-len-det-kim-nu-tay-ngan-ao-thun-nu-kieu-ke-soc-ngu-sac-sinh-dong-tre-trung-hang-thiet-ke-quang-chau-cao-p201422968.html?spid=201422994,29,,Đã bán 4,aonu
Áo kiểu nữ thời trang Eden cổ xếp li - ASM163,279.000,https://tiki.vn/ao-kieu-nu-thoi-trang-eden-co-xep-li-asm163-p146267358.html?spid=146267362,30,,,aonu
,,https://tiki.vn/ao-so-mi-soc-nhi-no-co-theu-hoa-ao14-p115467346.html?spid=115467350,31,,,aonu
Áo Croptop 3 Lỗ Cổ Lọ Sát Nách A5138,29.000₫,https://tiki.vn/ao-croptop-3-lo-co-lo-sat-nach-a5138-p149097532.html?spid=203499510,32,,Đã bán 7,aonu
Áo sơ mi nữ Giấu Nút tay dài phối voan mỏng,151.000₫,https://tiki.vn/ao-so-mi-nu-giau-nut-tay-dai-phoi-voan-mong-p70607255.html?spid=70607267,33,,Đã bán 40,aonu
"Áo sơ mi linen nữ form rộng trẻ trung ArcticHunter, thời trang thương hiệu chính hãng",250.000₫,https://tiki.vn/ao-so-mi-linen-nu-form-rong-tre-trung-arctichunter-thoi-trang-thuong-hieu-chinh-hang-p182601565.html?spid=182601571,34,,Đã bán 27,aonu
Áo Sơ Mi Nữ Ngắn Tay Màu Trơn Thời Trang Công Sở Thanh Lịch PONIVA Chất Liệu Mềm Mại Thấm Hút Mồ Hôi Tốt,90.000₫,https://tiki.vn/ao-so-mi-nu-ngan-tay-mau-tron-thoi-trang-cong-so-thanh-lich-poniva-chat-lieu-mem-mai-tham-hut-mo-hoi-tot-p140465042.html?spid=140465049,35,,,aonu
,,https://tiki.vn/ao-so-mi-nhung-gan-mat-cuoi-form-rong-unisex-nam-nu-phong-cach-han-quoc-ulzzang-p137666729.html?spid=157072290,36,,,aonu
Áo Sơ Mi Nữ Form Dài Che Quần Cá Tính SM013 MayHomes,139.500₫,https://tiki.vn/ao-so-mi-nu-form-dai-che-quan-ca-tinh-sm013-mayhomes-p37975688.html?spid=37975696,37,,Đã bán 108,aonu
Áo Croptop Nữ Thun Trơn 3 Lỗ Ôm Body Sát Nách Kiểu Khoét Hở Lưng Có Độn Mút Ngực Không Tay Sexy Crop Top CRT 2021 Ba Lỗ,89.000₫,https://tiki.vn/ao-croptop-nu-thun-tron-3-lo-om-body-sat-nach-kieu-khoet-ho-lung-co-don-mut-nguc-khong-tay-sexy-crop-top-crt-2021-ba-lo-p113617402.html?spid=113617419,38,,Đã bán 1,aonu
áo sơ mi nữ áo sơ mi dài tay vạt tôm nhiều màu chất đũi,90.000₫,https://tiki.vn/ao-so-mi-nu-ao-so-mi-dai-tay-vat-tom-nhieu-mau-chat-dui-p113926163.html?spid=113926165,39,,Đã bán 40,aonu
"Áo kiểu nữ họa tiết hoa nhí tay phồng cổ tròn sang trọng - nhiều size và màu, form dáng chuẩn thích hợp mặc đi làm hoặc dự tiệc",178.000,https://tiki.vn/ao-kieu-nu-hoa-tiet-hoa-nhi-tay-phong-co-tron-sang-trong-nhieu-size-va-mau-form-dang-chuan-thich-hop-mac-di-lam-hoac-du-tiec-p89153420.html?spid=89153432,40,,,aonu
