title,price,link_item,index,discount,sales,brand
"Đầm Caro Kẻ Sọc Haint Boutique, Váy Công Sở Cao Cấp Thiết Kế Xoè Phù Hợp Đi Dự Tiệc Cưới, Đi Chơi D27",199.000₫,https://tiki.vn/dam-caro-ke-soc-haint-boutique-vay-cong-so-cao-cap-thiet-ke-xoe-phu-hop-di-du-tiec-cuoi-di-choi-d27-p161390270.html?spid=161390272,1,-33%,,HaintBoutique
"Đầm linen nữ, váy công sở họa tiết lạ 2 túi chéo, thời trang nữ phong cách hàn quốc Haint Boutique Da184",245.000₫,https://tiki.vn/dam-vay-babydoll-ulzzang-hoa-nhi-xep-ly-phong-cach-han-quoc-haint-boutique-da184-p193011914.html?spid=222666137,2,-12%,Đã bán 1,HaintBoutique
"Áo kiểu nữ cổ tròn ngắn tay form rộng, chất đũi mềm mát, dễ chịu khi mặc Haint Boutique Ale41",140.000₫,https://tiki.vn/ao-kieu-nu-co-tron-ngan-tay-form-rong-chat-dui-mem-mat-de-chiu-khi-mac-haint-boutique-ale41-p263297838.html?spid=263297848,3,-12%,Đã bán 2,HaintBoutique
"Váy nữ trễ vai hoa nhí phong cách vintage bánh bèo, Đầm tiểu thư ulzzang dáng xòe dự tiệc Da102",199.000,https://tiki.vn/vay-nu-tre-vai-hoa-nhi-phong-cach-vintage-banh-beo-dam-tieu-thu-ulzzang-dang-xoe-du-tiec-da102-p175212169.html?spid=175212171,4,,,HaintBoutique
,,https://tiki.vn/dam-suong-so-mi-linen-tay-coc-tre-trung-thoi-trang-phong-cach-han-quoc-da74-p183558911.html?spid=183558923,5,-48%,,HaintBoutique
Đầm mặc nhà 2 dây Haint Boutique thiết kế đuôi cá kẻ nhỏ trẻ trung Vn07,199.000₫,https://tiki.vn/dam-mac-nha-2-day-haint-boutique-thiet-ke-duoi-ca-ke-nho-tre-trung-vn07-p87749250.html?spid=87749258,6,,Đã bán 12,HaintBoutique
"Đầm 2 dây mặc nhà,đồ ngủ họa tiết Haint Boutique nhiều hình lựa chọn",119.000₫,https://tiki.vn/dam-2-day-mac-nha-do-ngu-hoa-tiet-haint-boutique-nhieu-hinh-lua-chon-p102738899.html?spid=102738931,7,,Đã bán 2,HaintBoutique
Đầm suông nữ tay ren hoa xinh xắn 36,199.000₫,https://tiki.vn/dam-suong-nu-tay-ren-hoa-xinh-xan-36-p29911199.html?spid=29911209,8,-12%,Đã bán 58,HaintBoutique
"Đầm sơ mi nữ Haint Boutique, đầm công sở thiết kế kẻ caro to dáng xoè Da27",202.000,https://tiki.vn/dam-so-mi-nu-haint-boutique-dam-cong-so-thiet-ke-ke-caro-to-dang-xoe-da27-p76465927.html?spid=76465929,9,,Đã bán 1,HaintBoutique
,,https://tiki.vn/quan-kaki-nu-ong-suong-ca-tinh-p52614327.html?spid=72840333,10,-12%,,HaintBoutique
Quần alibaba chất đẹp Haint Boutique QT29,114.000₫,https://tiki.vn/quan-alibaba-chat-dep-haint-boutique-qt29-p54384437.html?spid=56399399,11,-12%,Đã bán 30,HaintBoutique
Đầm len dự tiệc sang chảnh Haint Boutique 06,263.000,https://tiki.vn/dam-len-du-tiec-sang-chanh-haint-boutique-06-p72181762.html?spid=72181764,12,,,HaintBoutique
,,https://tiki.vn/quan-kaki-basic-unisex-p68758967.html?spid=70864092,13,-12%,,HaintBoutique
"Quần nữ,quần nỉ nữ ống bó chun 2 màu mẫu mới QN03",87.000₫,https://tiki.vn/quan-nu-quan-ni-nu-ong-bo-chun-2-mau-mau-moi-qn03-p129382063.html?spid=129382065,14,-17%,Đã bán 1,HaintBoutique
Áo ren hoa nữ cao cấp ale43th,239.000₫,https://tiki.vn/ao-ren-hoa-nu-cao-cap-ale43th-p7810782.html?spid=56526819,15,-12%,Đã bán 2,HaintBoutique
"Đầm linen nữ cổ bèo màu tím siêu xinh, phong cách cổ điển quý phái, chất liệu linen cao cấp HB62",281.000₫,https://tiki.vn/dam-linen-nu-co-beo-mau-tim-sieu-xinh-phong-cach-co-dien-quy-phai-chat-lieu-linen-cao-cap-hb62-p250063002.html?spid=250063004,16,-48%,Đã bán 2,HaintBoutique
Quần tây nữ ống rộng Ulzzang Quảng Châu QDV7,140.000,https://tiki.vn/quan-tay-nu-ong-rong-ulzzang-quang-chau-qdv7-p68046455.html?spid=76160404,17,,,HaintBoutique
,,https://tiki.vn/so-mi-nu-ao-so-mi-nu-hoa-tiet-caro-sm22-p136041328.html?spid=136041330,18,-12%,,HaintBoutique
"Đầm linen nữ dáng suông dài, cổ sơ mi tay ngắn, chất đũi mát phong cách ulzzang Hàn Quốc Da75",263.000₫,https://tiki.vn/dam-linen-nu-dang-suong-dai-co-so-mi-tay-ngan-chat-dui-mat-phong-cach-ulzzang-han-quoc-da75-p183560007.html?spid=183560011,19,-20%,Đã bán 1,HaintBoutique
Đầm suông nữ hình sao phối ren db10,166.000₫,https://tiki.vn/dam-suong-nu-hinh-sao-phoi-ren-db10-p3732057.html?spid=56397199,20,-12%,Đã bán 1,HaintBoutique
"Áo kiểu nữ, áo đũi nữ tay lỡ cổ V phối màu nhẹ nhàng Ale12",131.000₫,https://tiki.vn/ao-kieu-nu-ao-dui-nu-tay-lo-co-v-phoi-mau-nhe-nhang-ale12-p124554387.html?spid=124554393,21,,Đã bán 2,HaintBoutique
Áo sơ mi nữ cổ V 2 màu be trắng,131.000₫,https://tiki.vn/ao-so-mi-nu-co-v-2-mau-be-trang-p90642289.html?spid=90642303,22,-18%,,HaintBoutique
"Áo sơ mi trắng công sở thiết kế cổ V, tay dài voan dài nữ tính CS67",159.000₫,https://tiki.vn/ao-so-mi-trang-cong-so-thiet-ke-co-v-tay-dai-voan-dai-nu-tinh-cs67-p195938547.html?spid=195938553,23,,Đã bán 4,HaintBoutique
Quần ống suông khóa sườn cao cấp HB21,159.000₫,https://tiki.vn/quan-ong-suong-khoa-suon-cao-cap-hb21-p49031919.html?spid=56602117,24,,Đã bán 10,HaintBoutique
Đầm suông nữ thu đông mẫu mới họa tiết màu trẻ trung da66,249.000,https://tiki.vn/dam-suong-nu-thu-dong-mau-moi-hoa-tiet-mau-tre-trung-da66-p110202382.html?spid=110202520,25,-12%,,HaintBoutique
,,https://tiki.vn/ao-len-nu-day-mua-dong-am-ap-al02-vang-p73832670.html?spid=73832671,26,,,HaintBoutique
"Đầm maxi nữ, đầm thun nữ cổ V xoắn ngực gợi cảm, phong cách trẻ trung HB32",158.000₫,https://tiki.vn/dam-maxi-nu-dam-thun-nu-co-v-xoan-nguc-goi-cam-phong-cach-tre-trung-hb32-p257856114.html?spid=257856118,27,,,HaintBoutique
Áo len nữ thiết kế dài tay ấm áp phối viền cổ xinh mẫu mới thu đông,175.000₫,https://tiki.vn/ao-len-nu-al18-p120789870.html?spid=120789876,28,,Đã bán 9,HaintBoutique
Áo Blazer Linen Nữ Dài Tay 1 Lớp Mẫu Mới Phong Cách Hàn Quốc Áo Vest Blazer Nữ Khoác Ngoài Chất Linen Cao Cấp Haint Boutique Bz03,263.000₫,https://tiki.vn/ao-blazer-linen-nu-dai-tay-1-lop-mau-moi-phong-cach-han-quoc-ao-vest-blazer-nu-khoac-ngoai-chat-linen-cao-cap-haint-boutique-bz03-p199101108.html?spid=199101110,29,,Đã bán 1,HaintBoutique
QUẦN ỐNG SUÔNG CẠP CAO,105.000,https://tiki.vn/quan-ong-suong-cap-cao-p86773372.html?spid=86773399,30,,Đã bán 1,HaintBoutique
,,https://tiki.vn/quan-tay-quan-au-suong-nu-cong-so-haint-boutique-qt26-p50691053.html?spid=56422564,31,,,HaintBoutique
Sơ mi kẻ sọc tay lỡ Sm05,159.000₫,https://tiki.vn/so-mi-ke-soc-tay-lo-sm05-p21573190.html?spid=21573194,32,,Đã bán 14,HaintBoutique
Chân váy tầng JEESSE SKIRT,149.000₫,https://tiki.vn/chan-vay-tang-jeesse-skirt-p44325965.html?spid=56906282,33,,Đã bán 5,HaintBoutique
Sơ mi nữ dài tay màu xanh rêu trơn arctic hunter 172,131.000₫,https://tiki.vn/so-mi-nu-dai-tay-mau-xanh-reu-tron-arctic-hunter-172-p47146942.html?spid=47146952,34,,Đã bán 6,HaintBoutique
"Áo Len Dài Tay Cổ Tròn Thời Trang Hàn Quốc Cho Nữ Haint Boutique, Áo len Cổ Tròn Dài Tay Pha Ren Xinh HB50",158.000,https://tiki.vn/ao-len-dai-tay-co-tron-thoi-trang-han-quoc-cho-nu-haint-boutique-ao-len-co-tron-dai-tay-pha-ren-xinh-hb50-p194207963.html?spid=194207964,35,,,HaintBoutique
,,https://tiki.vn/ao-so-mi-nu-tay-dai-tron-cao-cap-p21974482.html?spid=50323794,36,,,HaintBoutique
"Áo gile dệt kim cổ V chất len mỏng mềm phong cách Hàn, Thời Trang Thu Đông Haint Boutique Hb04",129.000₫,https://tiki.vn/ao-gile-det-kim-co-v-chat-len-day-mem-min-phong-cach-han-thoi-trang-thu-dong-haint-boutique-hb04-p193381493.html?spid=193381499,37,,Đã bán 2,HaintBoutique
Áo Sơ Mi Nữ Công Sở Phối Sọc Kẻ Thời Trang,263.000₫,https://tiki.vn/ao-so-mi-nu-cong-so-phoi-soc-ke-thoi-trang-p67140947.html?spid=67140949,38,,Đã bán 14,HaintBoutique
Áo len trơn dài tay thu đông Haint Boutique AL03,175.000₫,https://tiki.vn/ao-len-tron-dai-tay-thu-dong-haint-boutique-al03-p42496477.html?spid=205052924,39,,,HaintBoutique
Đầm len nữ 2 dây bèo ngực dáng xoè xinh xắn Haint Boutique Da13,175.000,https://tiki.vn/dam-len-nu-2-day-beo-nguc-dang-xoe-xinh-xan-haint-boutique-da13-p72496939.html?spid=72496941,40,,,HaintBoutique
