title,price,link_item,index,discount,sales,category
Sữa Dê Hikid 700g (1-9 tuổi) - Nhập khẩu Hàn Quốc,559.000₫,https://tiki.vn/sua-de-hikid-700g-1-9-tuoi-nhap-khau-han-quoc-p126414590.html?spid=126414595,1,-40%,Đã bán 4,dinhduongchobe
Sữa Bột Vinamilk Dielac Alpha 1 - Hộp Thiếc 900g,250.000₫,https://tiki.vn/sua-bot-vinamilk-dielac-alpha-1-hop-thiec-900g-p11341356.html?spid=149273118,2,-35%,Đã bán 43,dinhduongchobe
"Dầu Mè Đen Nguyên Chất Bảo Tâm (Dầu Mè Nguyên Chất, Dầu Vừng Đen Nguyên Chất) – Sản xuất từ Hạt Mè Đen Thuần Chủng Tự nhiên, Cao cấp - Nấu Canh, Trộn Salad, Cho bé Ăn Dặm - Hàng Chính Hãng – 500 ml",268.000₫,https://tiki.vn/dau-me-den-nguyen-chat-bao-tam-dau-me-nguyen-chat-dau-vung-den-nguyen-chat-san-xuat-tu-hat-me-den-thuan-chung-tu-nhien-cao-cap-nau-canh-tron-salad-cho-be-an-dam-hang-chinh-hang-500-ml-p11194478.html?spid=11194479,3,-10%,Đã bán 67,dinhduongchobe
Sữa bột ngôi sao nhỏ Little Étoile số 3 (1-3 tuổi) 800g,680.000₫,https://tiki.vn/sua-bot-ngoi-sao-nho-little-etoile-so-3-1-3-tuoi-800g-p150980864.html?spid=150980865,4,-41%,Đã bán 18,dinhduongchobe
Men vi sinh cho bé Alphavit Enteromina USA Pharma cung cấp 2 tỉ lợi khuẩn giúp tiêu hóa và hấp thu tốt- Hộp 20 ống,54.000₫,https://tiki.vn/men-vi-sinh-cho-be-alphavit-enteromina-usa-pharma-cung-cap-2-ti-loi-khuan-giup-tieu-hoa-va-hap-thu-tot-hop-20-ong-p253265580.html?spid=253265581,5,-5%,,dinhduongchobe
Combo 10 hộp Sữa đêm ngũ cốc vị lê và chuối Agusha 200ml/hộp,184.730₫,https://tiki.vn/combo-10-ho-p-sua-dem-ngu-coc-vi-le-va-chuoi-agusha-200ml-ho-p-p200723482.html?spid=200723483,6,-62%,,dinhduongchobe
Thùng 12 hộp Sữa bột công thức Semper Nutradefense Baby 2 400g/hộp,3.680.640₫,https://tiki.vn/thu-ng-12-ho-p-sua-bo-t-cong-thu-c-semper-nutradefense-baby-2-400g-ho-p-p204002765.html?spid=204002766,7,-52%,,dinhduongchobe
Sữa Bột Morinaga Hagukumi Số 1 (320g),195.500₫,https://tiki.vn/sua-bot-morinaga-hagukumi-so-1-320g-p8066299.html?spid=50069383,8,-5%,Đã bán 4,dinhduongchobe
"Sữa bột Arti Gain đỏ Nutifood 900G -Suy dinh dưỡng,chậm lớn, biếng ăn",265.000₫,https://tiki.vn/sua-bot-arti-gain-do-nutifood-900g-suy-dinh-duong-cham-lon-bieng-an-p252859179.html?spid=252859180,9,-52%,Đã bán 2,dinhduongchobe
Thùng sữa dinh dưỡng trái cây Smarta Grow hương Dâu (180ml x 48 hộp),333.000₫,https://tiki.vn/thung-sua-dinh-duong-trai-cay-smarta-grow-huong-dau-180ml-x-48-hop-p126034763.html?spid=126034764,10,-62%,Đã bán 27,dinhduongchobe
"Siro hỗ trợ giảm ho cho trẻ từ 2 tuổi Brauer Manuka Honey Úc giảm ho, ngứa và rát cổ họng, làm mát và dịu cổ họng, tăng sức đề kháng - OZ Slim Store",264.000₫,https://tiki.vn/siro-ho-tro-giam-ho-cho-tre-tu-2-tuoi-brauer-manuka-honey-uc-giam-ho-ngua-va-rat-co-hong-lam-mat-va-diu-co-hong-tang-suc-de-khang-oz-slim-store-p272365658.html?spid=272365660,11,,Đã bán 25,dinhduongchobe
"Sữa Nhật cho bé tăng cân 1-3 tuổi Meiji Hỗ trợ hệ tiêu hóa tốt, hấp thụ dưỡng chất hiệu quả, phát triển chiều cao, cân nặng, trí não - Massel Official",605.000₫,https://tiki.vn/sua-nhat-cho-be-tang-can-1-3-tuoi-meiji-ho-tro-he-tieu-hoa-tot-hap-thu-duong-chat-hieu-qua-phat-trien-chieu-cao-can-nang-tri-nao-massel-official-p271556299.html?spid=124631356,12,,Đã bán 9,dinhduongchobe
"Combo 3 Hộp Sữa Hạt Miwako Vị Gạo Hộp 700g Malaysia, Sữa Thực Vật Hữu Cơ Dành Cho Bé Từ 1 Tuổi Dị Ứng Đạm Bò, Giảm Táo Bón - miwako",1.567.500₫,https://tiki.vn/tang-may-doc-the-song-ngu-combo-3-hop-sua-hat-miwako-vi-gao-hop-700g-malaysia-sua-thuc-vat-huu-co-danh-cho-be-tu-1-tuoi-di-ung-dam-bo-giam-tao-bon-p246162937.html?spid=262795820,13,,Đã bán 2,dinhduongchobe
"Sữa cho trẻ 1 - 3 tuổi Meiji Nhật giàu dưỡng chất kèm DHA giúp phát triển cân đối chiều cao, cân nặng, trí não trẻ - Massel Official",585.000₫,https://tiki.vn/sua-cho-tre-so-sinh-1-3-tuoi-meiji-nhat-giau-duong-chat-kem-dha-giup-phat-trien-can-doi-chieu-cao-can-nang-tri-nao-tre-massel-official-p271556758.html?spid=271556760,14,,Đã bán 5,dinhduongchobe
"Siro hỗ trợ giảm ho cho trẻ từ 2 tuổi Brauer Manuka Honey Úc giảm ho, ngứa và rát cổ họng, làm mát và dịu cổ họng, tăng sức đề kháng - OZ Slim Store",264.000₫,https://tiki.vn/siro-ho-tro-giam-ho-cho-tre-tu-2-tuoi-brauer-manuka-honey-uc-giam-ho-ngua-va-rat-co-hong-lam-mat-va-diu-co-hong-tang-suc-de-khang-oz-slim-store-p272367067.html?spid=105621385,15,,Đã bán 2,dinhduongchobe
Sữa bột MEGACARE GOLD IQ 1 - Mega Milky,395.000₫,https://tiki.vn/sua-bot-megacare-gold-iq-1-mega-milky-p201295920.html?spid=201295921,16,,,dinhduongchobe
"Wellbaby Multi-vitamin dang lỏng, cho trẻ em dưới 4 tháng",280.000₫,https://tiki.vn/wellbaby-multi-vitamin-dang-long-cho-tre-em-duoi-4-thang-p113572363.html?spid=113572367,17,,Đã bán 5,dinhduongchobe
"Hartus Immunity siro tăng sức đề kháng cho bé, nâng miễn dịch cho trẻ - nhập khẩu chính hãng từ Châu Âu.",280.000₫,https://tiki.vn/hartus-immunity-siro-tang-suc-de-khang-cho-be-nang-mien-dich-cho-tre-nhap-khau-chinh-hang-tu-chau-au-p242178602.html?spid=242178603,18,,Đã bán 3,dinhduongchobe
Combo 2 Gói Cháo Gạo Koshihikari Ăn Dặm Matsuya,133.000₫,https://tiki.vn/combo-2-goi-chao-gao-koshihikari-an-dam-matsuya-p53442635.html?spid=54034413,19,,Đã bán 6,dinhduongchobe
Sản Phẩm Dinh Dưỡng Nestle Nutren Junior (850g),635.000₫,https://tiki.vn/san-pham-dinh-duong-nestle-nutren-junior-850g-p175466027.html?spid=175466028,20,,Đã bán 27,dinhduongchobe
Sữa non Colostrum Powder Premium Gold 1+ 800g (dành cho trẻ 0-12 tháng tuổi),539.000₫,https://tiki.vn/sua-non-colostrum-powder-premium-gold-1-800g-danh-cho-tre-0-12-thang-tuoi-p90460789.html?spid=90460790,21,,Đã bán 12,dinhduongchobe
Sữa Non Natrumax Baby 1-10 tuổi (800g),750.000₫,https://tiki.vn/sua-non-natrumax-baby-800g-p16220993.html?spid=16220994,22,,Đã bán 10,dinhduongchobe
BRAUER BABY & CHILD IMMUNITY SUPPORT 100ML,335.000₫,https://tiki.vn/brauer-baby-child-immunity-support-100ml-p208885987.html?spid=208885988,23,,,dinhduongchobe
"Avisure ZiO kẽm sinh học cho bé biếng ăn, chậm tăng cân 20ml",195.000₫,https://tiki.vn/avisure-zio-kem-sinh-hoc-cho-be-bieng-an-cham-tang-can-20ml-p262476809.html?spid=262476810,24,,,dinhduongchobe
Combo 2 hộp Avisure Safoli - Zio Sắt Kẽm Sinh Học cho bé,365.000₫,https://tiki.vn/combo-2-hop-avisure-safoli-zio-sat-kem-sinh-hoc-cho-be-p262470162.html?spid=262470163,25,,Đã bán 2,dinhduongchobe
"Dầu ăn dặm Pro-Sachi Omega 369 từ thực vật, 100% nguyên chất, (100ml/chai)",168.000₫,https://tiki.vn/dau-an-dam-nguyen-chat-pro-sachi-omega-369-chai-100ml-p207500163.html?spid=207500165,26,,,dinhduongchobe
Bánh nhân kem ốc quế Glico cho bé Nhật Bản,90.000₫,https://tiki.vn/banh-nhan-kem-oc-que-glico-cho-be-nhat-ba-n-p263990351.html?spid=263990352,27,,,dinhduongchobe
Sữa Kendamil Toddler số 3 900g (1 - 3 tuổi) - Nhập khẩu Vương quốc Anh,629.000₫,https://tiki.vn/sua-kendamil-toddler-so-3-900g-1-3-tuoi-nhap-khau-vuong-quoc-anh-p126259993.html?spid=126259995,28,,Đã bán 58,dinhduongchobe
Sữa Hikid Premium 600g cho bé từ 1 - 9 tuổi,550.000₫,https://tiki.vn/sua-hikid-premium-600g-1-9-tuoi-nhap-khau-han-quoc-p126358126.html?spid=263765056,29,,,dinhduongchobe
"Combo 3 lon sữa OraCare Growplus lon 900g - Giúp phát triển chiều cao, Trí não, Thị giác, dành cho trẻ từ 1-10 tuổi",1.191.000₫,https://tiki.vn/combo-3-lon-sua-oracare-growplus-lon-900g-giup-phat-trien-chieu-cao-tri-nao-thi-giac-danh-cho-tre-tu-1-10-tuoi-p203066132.html?spid=203066133,30,,,dinhduongchobe
Combo 3 lon Sữa Bột Vinamilk Dielac Grow Plus 1+ ( 1400g / Hộp Thiếc),1.625.000₫,https://tiki.vn/combo-3-lon-sua-bot-vinamilk-dielac-grow-plus-1-1400g-hop-thiec-p273377262.html?spid=273377263,31,,,dinhduongchobe
Combo 3 Sữa bột PURELAC 2 800g nhập khẩu New Zealand,2.550.000₫,https://tiki.vn/combo-3-sua-bot-purelac-2-800g-nhap-khau-new-zealand-p104921467.html?spid=104921469,32,,,dinhduongchobe
Combo 2 Hộp Sữa Morinaga Chilmil (850g),860.000₫,https://tiki.vn/combo-2-hop-sua-morinaga-chilmil-850g-p502049.html?spid=55922529,33,,Đã bán 2,dinhduongchobe
"Siro bổ sung Vitamin D3, tăng hấp thu canxi và đề kháng cho trẻ BABYKID CALCIUM PLUS - Hộp 20 ống",110.000₫,https://tiki.vn/siro-bo-sung-vitamin-d3-tang-hap-thu-canxi-va-de-khang-cho-tre-babykid-calcium-plus-hop-20-ong-p272846056.html?spid=272846057,34,,,dinhduongchobe
Sữa Bột IQ-GROW Dinh Dưỡng Giúp Phát Triển Chiều Cao Và Trí Não_Sunbaby_IQ321,367.000₫,https://tiki.vn/sua-bot-iq-grow-dinh-duong-giup-phat-trien-chieu-cao-va-tri-nao_sunbaby_iq321-p140424546.html?spid=140424547,35,,,dinhduongchobe
Sữa dê công thức DG-3 GOAT MILK GROWING - UP FORMULA,359.000₫,https://tiki.vn/sua-de-cong-thuc-dg-3-goat-milk-growing-up-formula-p3527301.html?spid=45859733,36,,Đã bán 136,dinhduongchobe
Combo 3 lon Sữa bột UC2 Platinum Grow Plus 1+ lon 800g (Cho Trẻ Từ 1 Tuổi Trở Lên),1.045.000₫,https://tiki.vn/combo-3-lon-sua-bot-uc2-platinum-grow-plus-1-lon-800g-cho-tre-tu-1-tuoi-tro-len-p273266662.html?spid=273266663,37,,,dinhduongchobe
Bộ 2 Hộp Sữa Hikid Premium tăng trưởng chiếu cao tối đa - Hàng Nội địa Hàn,1.100.000₫,https://tiki.vn/bo-2-hop-sua-hikid-premium-tang-truong-chieu-cao-toi-da-hang-noi-dia-han-p40743887.html?spid=263583737,38,,,dinhduongchobe
"[MUA 2 TẶNG 1] Sữa bột dinh dưỡng IQ GROW phát triển chiều cao, trí não vượt trội cho trẻ (900g) Sunbaby",820.000₫,https://tiki.vn/mua-2-tang-1-sua-bot-dinh-duong-iq-grow-phat-trien-chieu-cao-tri-nao-vuot-troi-cho-tre-900g-sunbaby-p272856258.html?spid=272856259,39,,,dinhduongchobe
Dầu Sachi omega 3 trẻ em,379.000₫,https://tiki.vn/dau-sachi-omega-3-tre-em-p35355623.html?spid=35355624,40,,Đã bán 26,dinhduongchobe
