title,price,link_item,index,discount,sales,category
"Gia vị rắc cơm 6 vị 30 gói, nội địa Nhật Bản",69.000₫,https://tiki.vn/gia-vi-rac-com-6-vi-30-goi-noi-dia-nhat-ban-p13428892.html?spid=13428893,1,-36%,Đã bán 1.0k,dinhduongchobe
"Canxi cho bé Hartus, thêm D3 và Vitamin K2, siro Hatus cho trẻ 4, 6 tháng 1 tuổi tăng chiều cao, Can xi nước d3k2",185.000₫,https://tiki.vn/canxi-cho-be-hartus-them-d3-va-vitamin-k2-siro-hatus-cho-tre-4-6-thang-1-tuoi-tang-chieu-cao-can-xi-nuoc-d3k2-p124775556.html?spid=124775557,2,-5%,Đã bán 95,dinhduongchobe
"Omega-3 Úc Cho Bé Healthy Care Gummy Omega-3 Dạng Kẹo Dẻo Giúp Phát Triển Não Bộ Tăng Khả Năng Nhận Thức, Tập Trung Và Ghi Nhớ Tăng Hệ Miễn Dịch, Bổ Cho Tim Và Mắt – Hộp 250 Viên",349.600₫,https://tiki.vn/omega-3-uc-cho-be-healthy-care-gummy-omega-3-dang-keo-deo-giup-phat-trien-nao-bo-tang-kha-nang-nhan-thuc-tap-trung-va-ghi-nho-tang-he-mien-dich-bo-cho-tim-va-mat-hop-250-vien-p119320681.html?spid=139270950,3,-56%,Đã bán 40,dinhduongchobe
Kẹo Dẻo Happy Vitamin Kids Giúp Tăng Sức Đề Kháng Cho Trẻ - Hộp 80 Viên,200.000₫,https://tiki.vn/keo-deo-happy-vitamin-kids-bo-sung-khoang-chat-p181695190.html?spid=181695191,4,-13%,Đã bán 11,dinhduongchobe
"Sữa tăng cân cho trẻ 1-3 tuổi Meiji Nhật giàu dưỡng chất kèm DHA giúp phát triển cân đối chiều cao, cân nặng, trí não trẻ - OZ Slim Store",420.000₫,https://tiki.vn/sua-tang-can-cho-tre-1-3-tuoi-meiji-nhat-giau-duong-chat-kem-dha-giup-phat-trien-can-doi-chieu-cao-can-nang-tri-nao-tre-oz-slim-store-p272310041.html?spid=272310043,5,-18%,Đã bán 56,dinhduongchobe
Cháo Ăn Dặm Mabu Hạt Vỡ (400g),99.000₫,https://tiki.vn/chao-an-dam-mabu-hat-vo-400g-p805326.html?spid=811162,6,-31%,Đã bán 1.6k,dinhduongchobe
"Sữa Kid Essentials - Sữa Úc Nestlé Health Science Cho Trẻ Biếng Ăn, Chậm Tăng Cân 800g - Bao Bì Mới [NHẬP KHẨU CHÍNH HÃNG]",616.000₫,https://tiki.vn/nhap-khau-chinh-hang-singapore-hsd-2023-sua-kid-essentials-cho-tre-bieng-an-cham-tang-can-850g-p149253521.html?spid=149253522,7,-19%,Đã bán 56,dinhduongchobe
2 Hộp Sữa Bột Meiji 1-3 Growing Up Formula (800g),930.000₫,https://tiki.vn/2-hop-sua-bot-meiji-1-3-growing-up-formula-800g-p45551664.html?spid=45551665,8,-9%,Đã bán 193,dinhduongchobe
Cháo Tươi Gà Nấm Đông Cô Cây Thị Mở Gói Ăn Ngay 260G,22.950₫,https://tiki.vn/chao-tuoi-ga-nam-dong-co-cay-thi-mo-goi-an-ngay-260g-p180238461.html?spid=180238462,9,-15%,Đã bán 120,dinhduongchobe
Bộ 2 Lon Sữa Meiji lon Số 0 dành Cho Bé Từ 0-12 tháng tuổi - Nội địa Nhật Bản,1.190.000₫,https://tiki.vn/bo-2-lon-sua-meiji-lon-so-0-danh-cho-be-tu-0-12-thang-tuoi-noi-dia-nhat-ban-p53329879.html?spid=167461729,10,-17%,Đã bán 5,dinhduongchobe
Combo Đủ Vị Cháo Tươi Dinh Dưỡng Cây Thị,237.000₫,https://tiki.vn/combo-du-vi-chao-tuoi-dinh-duong-cay-thi-p68909222.html?spid=68909223,11,-27%,Đã bán 323,dinhduongchobe
Sữa non COLOSBABY GOLD 1+ (800G),510.349₫,https://tiki.vn/sua-non-colosbaby-gold-1-800g-p16326038.html?spid=16326039,12,-18%,Đã bán 141,dinhduongchobe
"Siro Tăng Đề Kháng Suvactif Immunité: Thực Phẩm Bảo Vệ Sức Khỏe Cho Trẻ Từ 6 Tháng Tuổi Chính Hãng Pháp, Giúp Tăng Miễn Dịch, Ngừa Bệnh Về Đường Hô Hấp, Hết Ốm Vặt, Cải Thiện Tình Trạng Biếng Ăn, Chậm Lớn.",311.000₫,https://tiki.vn/suvactif-immunite-tang-cuong-mien-dich-cho-tre-tu-6-thang-p51544071.html?spid=51544072,13,-18%,Đã bán 107,dinhduongchobe
Sữa Bột Namyang I Am Mother 2 400g,375.000₫,https://tiki.vn/sua-bot-namyang-i-am-mother-2-400g-p44959822.html?spid=67317225,14,-16%,Đã bán 72,dinhduongchobe
Sữa non COLOSBABY GOLD 2+ (800G),510.349₫,https://tiki.vn/sua-non-colosbaby-gold-2-800g-p16571803.html?spid=16571804,15,-27%,Đã bán 55,dinhduongchobe
Cháo Tươi Hải Sản Thập Cẩm Cây Thị Mở Gói Ăn Ngay 240G,23.760₫,https://tiki.vn/chao-tuoi-hai-san-thap-cam-cay-thi-mo-goi-an-ngay-260g-p180290433.html?spid=180290434,16,-18%,Đã bán 125,dinhduongchobe
Cháo Tươi Bào Ngư Nấm Bào Ngư Cây Thị,31.450₫,https://tiki.vn/chao-tuoi-bao-ngu-nam-bao-ngu-cay-thi-p68920900.html?spid=68920901,17,-22%,Đã bán 449,dinhduongchobe
Dầu Óc Chó cho bé ăn dặm Maguzt nguyên chất,56.800₫,https://tiki.vn/dau-oc-cho-cho-be-an-dam-maguzt-nguyen-chat-p113625694.html?spid=113625696,18,-35%,Đã bán 107,dinhduongchobe
Cốm Chất Xơ Dân Khang BobBaby Hỗ Trợ Bổ Sung Chất Xơ Cho Bé Hộp 20 Gói x 5g,135.000₫,https://tiki.vn/com-chat-xo-dan-khang-bobbaby-ho-tro-bo-sung-chat-xo-cho-be-hop-20-goi-x-5g-p271312558.html?spid=271312559,19,,Đã bán 11,dinhduongchobe
Cháo Tươi Gà Ác Đậu Xanh Cây Thị,22.525₫,https://tiki.vn/chao-tuoi-ga-ac-dau-xanh-cay-thi-p6464025.html?spid=6464027,20,,Đã bán 2.1k,dinhduongchobe
Cháo Tươi Cá Lóc Đậu Xanh Cây Thị,20.400₫,https://tiki.vn/chao-tuoi-ca-loc-dau-xanh-cay-thi-p6464021.html?spid=6464023,21,,Đã bán 1.9k,dinhduongchobe
Combo 3 gói Gà Ác Tiềm thương hiệu Cây Thị,166.000₫,https://tiki.vn/combo-3-goi-ga-ac-tiem-thuong-hieu-cay-thi-p25092501.html?spid=25092505,22,,Đã bán 102,dinhduongchobe
"Canxi sinh học Bestical bổ sung canxi xương chắc khỏe , cao vượt trội",269.000₫,https://tiki.vn/canxi-sinh-hoc-bestical-bo-sung-canxi-xuong-chac-khoe-cao-vuot-troi-p270067389.html?spid=270067390,23,,Đã bán 7,dinhduongchobe
Bột Ăn Dặm Vinamilk Ridielac Cá Hồi Bông Cải Xanh (200g),65.000₫,https://tiki.vn/bot-an-dam-vinamilk-ridielac-ca-hoi-bong-cai-xanh-200g-p2563681.html?spid=149970571,24,,Đã bán 30,dinhduongchobe
Sữa Glico Icreo Follow Up Milk (Icreo Số 1) Lon 820g,479.000₫,https://tiki.vn/sua-glico-icreo-follow-up-milk-icreo-so-1-lon-820g-p146518348.html?spid=184221075,25,,Đã bán 35,dinhduongchobe
Sữa non Nutricare ColosCare 1+ tăng cường hệ miễn dịch (850g),429.000₫,https://tiki.vn/sua-non-nutricare-coloscare-1-tang-cuong-he-mien-dich-800g-p102760894.html?spid=102760895,26,,Đã bán 38,dinhduongchobe
Lốc nước yến cho bé Nunest Kid vị Dâu/Chuối (6 lọ x 70ml),189.000₫,https://tiki.vn/loc-nuoc-yen-cho-be-nunest-kid-vi-dau-chuoi-6-lo-x-70ml-p10992256.html?spid=10992258,27,,Đã bán 165,dinhduongchobe
Sữa bột Enfagrow A+ NeuroPro 4 với 2’-FL HMO cho trẻ từ 2 – 6 tuổi – 1.7kg,871.000₫,https://tiki.vn/sua-bot-enfagrow-a-neuropro-4-voi-2-fl-hmo-cho-tre-tu-2-6-tuoi-1-7kg-p115483214.html?spid=115483215,28,,Đã bán 284,dinhduongchobe
Sữa Bột Friso mum Gold Hương Vani (400g),220.000₫,https://tiki.vn/sua-bot-friso-mum-gold-huong-vani-400g-p969617.html?spid=95075278,29,,Đã bán 80,dinhduongchobe
"Combo 2 lon sữa bột dinh dưỡng công thức HiPP 1 Organic Combiotic chất lượng hữu cơ, hỗ trợ, tăng cường sức khoẻ hệ miễn dịch, bổ sung omega 3,6 (DHA&ARA) dành cho trẻ dưới 6 tháng tuổi (2lonx800g)",1.460.000₫,https://tiki.vn/combo-2-lon-sua-bot-dinh-duong-cong-thuc-hipp-1-organic-combiotic-chat-luong-huu-co-ho-tro-tang-cuong-suc-khoe-he-mien-dich-bo-sung-omega-3-6-dha-ara-danh-cho-tre-duoi-6-thang-tuoi-2lonx800g--p116519923.html?spid=116519924,30,,Đã bán 88,dinhduongchobe
Sữa bột Enfagrow A2 Neuropro 3 cho trẻ từ 1 - 6 tuổi – 350g,284.000₫,https://tiki.vn/sua-bot-enfagrow-a2-neuropro-3-cho-tre-tu-1-6-tuoi-350g-p95082970.html?spid=95082971,31,,Đã bán 752,dinhduongchobe
"[HSD_T5.2024] Dinh dưỡng 100% Trái cây nghiền Organic HiPPiS Lê, Táo",60.000₫,https://tiki.vn/dinh-duong-100-trai-cay-nghien-organic-hippis-le-tao-p95035901.html?spid=95035902,32,,Đã bán 239,dinhduongchobe
Viên kẹo bổ sung canxi và vitamin D thơm ngon Ostelin Ostelin Kids Calcium & Vitamin D3 nhập khẩu Úc 90 viên,261.000₫,https://tiki.vn/vien-keo-bo-sung-canxi-va-vitamin-d-thom-ngon-ostelin-ostelin-kids-calcium-vitamin-d3-nhap-khau-uc-90-vien-p56960573.html?spid=56960574,33,,Đã bán 237,dinhduongchobe
Sữa bột công thức HiPP 1 Organic Combiotic 800g,730.000₫,https://tiki.vn/sua-bot-cong-thuc-hipp-1-organic-combiotic-800g-p95035798.html?spid=95035800,34,,Đã bán 203,dinhduongchobe
Cháo Ăn Dặm Mabu Nguyên Hạt (900g),199.000₫,https://tiki.vn/chao-an-dam-mabu-nguyen-hat-900g-p805618.html?spid=811168,35,,Đã bán 1.6k,dinhduongchobe
Dinh dưỡng đóng lọ ăn dặm Trái cây nhiệt đới HiPP Organic 125g,45.000₫,https://tiki.vn/dinh-duong-dong-lo-an-dam-trai-cay-nhiet-doi-hipp-organic-125g-p95035841.html?spid=95035843,36,,Đã bán 313,dinhduongchobe
Sữa Bột Meiji 0-1 Infant Formula (800g),538.000₫,https://tiki.vn/sua-bot-meiji-0-1-infant-formula--800g--p105356858.html?spid=273915386,37,,,dinhduongchobe
Sữa bột công thức HiPP 3 Organic Combiotic 800g,720.000₫,https://tiki.vn/sua-bot-cong-thuc-hipp-3-organic-combiotic-800g-p95035802.html?spid=95035804,38,,Đã bán 715,dinhduongchobe
Sữa bột Nestlé NAN SupremePro 2 Hộp 4x16g với 5HMO & đạm Gentle Optipro nhập khẩu từ Đức,79.000₫,https://tiki.vn/sua-bot-nestle-nan-supremepro-2-hop-4x16g-voi-5hmo-dam-gentle-optipro-nhap-khau-tu-duc-p270652074.html?spid=270652076,39,,Đã bán 12,dinhduongchobe
Sữa Pediasure Úc 850gr Nắp Tím vị Vani Bổ Sung Dưỡng Chất Cho Bé,744.000₫,https://tiki.vn/sua-pediasure-uc-850gr-nap-tim-vi-vani-bo-sung-duong-chat-cho-be-p271960307.html?spid=271960309,40,,Đã bán 3,dinhduongchobe
