title,price,link_item,index,discount,sales,brand
Combo viên rửa bát finish Classic 100V + muối rửa bát finish 1.2kg + Nước làm bóng alio 1 lít dùng cho máy rửa bát,106.900₫,https://tiki.vn/combo-vien-ru-a-ba-t-finish-classic-100v-muoi-ru-a-ba-t-finish-1-2kg-nuoc-lam-bong-alio-1-li-t-dung-cho-may-rua-bat-p121326409.html?spid=125753194,1,,,finish
Combo viên rửa bát Finish Quantum 25 viên + Muối rửa bát Finish 1kg chính hãng,249.000₫,https://tiki.vn/combo-vien-rua-bat-finish-quantum-25-vien-muoi-rua-bat-finish-1kg-chinh-hang-p253307361.html?spid=270971722,2,,,finish
Viên rửa bát Finish Quantum 100 viên - Hàng chính hãng [12 chức năng,199.000₫,https://tiki.vn/vien-rua-bat-finish-quantum-100-vien-hang-chinh-hang-12-chuc-nang-p205422914.html?spid=273308239,3,,Đã bán 1,finish
Muối rửa bát Finish loại 4kg,109.000,https://tiki.vn/muoi-rua-bat-finish-loai-4kg-p134760203.html?spid=134760215,4,,,finish
,,https://tiki.vn/gel-rua-chen-bat-finish-classic-1-5-lit-finish-eu-p102522666.html?spid=252159878,5,,,finish
Viên rửa bát Finish Quantum 100 viên - Hàng chính hãng [12 chức năng],698.857₫,https://tiki.vn/vien-rua-bat-finish-quantum-100-vien-hang-chinh-hang-12-chuc-nang-re-vo-dich-p121315471.html?spid=127599494,6,,,finish
Viên vệ sinh máy rửa bát Finish vỉ 3 viên - Chính hãng,99.000₫,https://tiki.vn/vien-ve-sinh-may-rua-bat-finish-vi-3-vien-chinh-hang-p121316272.html?spid=127339318,7,,Đã bán 10,finish
Viên rửa chén bát Finish Quantum 60 viên - Hàng chính hãng [12 chức năng],368.999₫,https://tiki.vn/vien-rua-chen-bat-finish-quantum-60-vien-hang-chinh-hang-12-chuc-nang-re-vo-dich-p121315599.html?spid=127599979,8,,,finish
Nước làm bóng Finish 400ml,65.000₫,https://tiki.vn/nuoc-lam-bong-finish-400ml-p37888837.html?spid=207294094,9,,,finish
,,https://tiki.vn/vien-rua-bat-finish-classic-100-vien-hop-huong-chanh-p41898490.html?spid=206146170,10,,,finish
"Viên rửa bát Finish Classic 100 viên/ hộp - Hương Chanh, Nhập khẩu EU",339.000₫,https://tiki.vn/vien-rua-bat-finish-classic-100-vien-hop-huong-chanh-nhap-khau-eu-p71893580.html?spid=206147055,11,,,finish
Viên rửa chén cao cấp FINISH Classic - Dành cho máy - Nhập khẩu từ Đức,299.000,https://tiki.vn/vien-rua-chen-cao-cap-finish-classic-danh-cho-may-nhap-khau-tu-duc-p126126413.html?spid=141656052,12,,,finish
,,https://tiki.vn/-hcm-nuoc-lam-bong-chen-bat-finish-eco-0-400ml-chai-p205376849.html?spid=126107535,13,,,finish
Combo 02 Hộp Muối Rửa Chén Bát Finish Salt - Hộp 4KG,718.000₫,https://tiki.vn/combo-02-hop-muoi-rua-chen-bat-finish-salt-hop-4kg-p253350142.html?spid=270925827,14,,,finish
Combo Viên Finish 80 Viên + Muối Finish 1.5kg + Nước làm bóng Finish 750ml,499.000₫,https://tiki.vn/combo-vien-finish-80-vien-muoi-finish-1-5kg-nuoc-lam-bong-finish-750ml-p134759977.html?spid=271013458,15,,,finish
Viên rửa chén bát Finish Quantum siêu cao cấp dùng cho máy,199.000₫,https://tiki.vn/vien-rua-chen-bat-finish-quantum-sieu-cao-cap-dung-cho-may-p121326368.html?spid=127836692,16,,,finish
"Combo viên rửa bát Finish hộp 500 viên + hộp muối Finish 1,2kg + chai nước làm bóng alio 1000 ml",139.000,https://tiki.vn/combo-vien-rua-bat-finish-hop-500-vien-hop-muoi-finish-1-2kg-chai-nuoc-lam-bong-alio-1000-ml-p121326376.html?spid=134405689,17,,,finish
,,https://tiki.vn/vien-rua-bat-finish-classic-100-vien-nhap-khau-chinh-hang-p169737124.html?spid=270981187,18,,,finish
Chai gel rửa bát dùng cho máy 1500 ml,295.000₫,https://tiki.vn/chai-gel-rua-bat-dung-cho-may-1500-ml-p205505697.html?spid=205505700,19,,Đã bán 1,finish
Nước làm bóng Finish 800ml - 4 chức năng,189.000₫,https://tiki.vn/nuoc-lam-bong-finish-800ml-4-chuc-nang-p206293113.html?spid=146847157,20,,,finish
Gel rửa chén bát Finish All In One Max 650ml Shine & Protect,198.000₫,https://tiki.vn/gel-rua-chen-bat-finish-all-in-one-max-650ml-shine-protect-p121315567.html?spid=184240187,21,,,finish
Nước làm bóng Finish 1150ml tặng túi zip 3 kẹo Senjaku Nhật Bản,169.000₫,https://tiki.vn/nuoc-lam-bong-finish-1150ml-tang-tui-zip-3-keo-senjaku-nhat-ban-p205293495.html?spid=208499382,22,,Đã bán 41,finish
hộp 100 viên rửa chén finish,339.000₫,https://tiki.vn/hop-100-vien-rua-chen-finish-p121325851.html?spid=126712789,23,,,finish
Bộ 3 viên rửa bát finish 110 viên + Nước làm bóng finish 750 ml+muối finish 1.2kg dùng cho máy rửa bát chén,568.675₫,https://tiki.vn/bo-3-vien-rua-bat-finish-110-vien-nuoc-lam-bong-finish-750-ml-muoi-finish-1-2kg-dung-cho-may-rua-bat-chen-p121325841.html?spid=146518404,24,,,finish
Viên rửa bát Finish 77 viên hương chanh + Nước làm bóng finish 1150ml dùng cho máy rửa bát,519.000,https://tiki.vn/vien-rua-bat-finish-77-vien-huong-chanh-nuoc-lam-bong-finish-1150ml-dung-cho-may-rua-bat-p56597536.html?spid=57941815,25,,,finish
,,https://tiki.vn/vien-rua-bat-finish-combo-10-vien-dung-thu-p121326026.html?spid=126246050,26,,,finish
Dung dịch tẩy rửa máy rửa chén Finish Dishwasher Cleaner Lemon 250ml QT006774 - hương chanh,99.000₫,https://tiki.vn/dung-dich-tay-rua-may-rua-chen-finish-dishwasher-cleaner-lemon-250ml-qt006774-huong-chanh-p52778380.html?spid=56602538,27,,Đã bán 41,finish
Combo nước làm bóng bát finish 800ml+viên rửa bát finish quantum max 36 viên dùng cho máy rửa bát,399.000₫,https://tiki.vn/combo-nuoc-lam-bong-bat-finish-800ml-vien-rua-bat-finish-quantum-max-36-vien-dung-cho-may-rua-bat-p51953696.html?spid=133868549,28,,,finish
combo 3 chai Nước làm bóng bát finish 1150ml dùng cho máy (1150x3=3.450ml),660.000₫,https://tiki.vn/combo-3-chai-nuoc-lam-bong-bat-finish-1150ml-dung-cho-may-1150x3-3-450ml-p51856064.html?spid=51856065,29,,Đã bán 20,finish
"Túi 36 viên rửa chén Finish Quantum Max Dishwasher Tablets Apple Lime Blast QT09447 - hương chanh, táo",209.098,https://tiki.vn/tui-36-vien-rua-chen-finish-quantum-max-dishwasher-tablets-apple-lime-qt09447-huong-chanh-tao-p52788513.html?spid=126115994,30,,,finish
,,https://tiki.vn/combo-vien-rua-bat-finish-quantum-40-vien-muoi-finish-1-2kg-nuoc-lam-bong-finish-750ml-p133563799.html?spid=136803022,31,,,finish
Combo Dầu làm bóng finish 750ml+Viên rửa bát Finish All in one 90v hương chanh dùng cho Máy rửa bát,690.000₫,https://tiki.vn/combo-dau-lam-bong-finish-750ml-vien-rua-bat-finish-all-in-one-90v-huong-chanh-dung-cho-may-rua-bat-p55471880.html?spid=128876961,32,,,finish
Viên rửa bát finish All in one 90 viên+Dung dịch nước làm bóng finish 750ml+Muối rửa bát chén finish 1.2kg cho Máy rửa bát,619.000₫,https://tiki.vn/vien-rua-bat-finish-all-in-one-90-vien-dung-dich-nuoc-lam-bong-finish-750ml-muoi-rua-bat-chen-finish-1-2kg-cho-may-rua-bat-p55672160.html?spid=128877293,33,,Đã bán 1,finish
viên rửa chén finish quantum túi 120 viên (hàng Đức )Viên rửa bát chén siêu cao cấp,699.000₫,https://tiki.vn/vien-rua-chen-finish-quantum-tui-120-vien-hang-duc-vien-rua-bat-chen-sieu-cao-cap-p205471685.html?spid=271956161,34,,Đã bán 1,finish
Viên rửa bát Finish Classic 110 viên/ hộp,278.000,https://tiki.vn/vien-rua-bat-finish-classic-110-vien-hop-p119718887.html?spid=190515124,35,,,finish
,,https://tiki.vn/sieu-re-bot-rua-bat-finish-huong-chanh-2-5kg-hang-moi-su-dung-cho-may-rua-bat-san-xuat-eu-p121327238.html?spid=125755249,36,,,finish
"Nước làm bóng và khô chén, đĩa Finish Dishwasher Shine & Dry Lemon 800ml QT004996 - hương chanh",158.666₫,https://tiki.vn/nuoc-lam-bong-va-kho-chen-dia-finish-dishwasher-shine-dry-lemon-800ml-qt004996-huong-chanh-p52790037.html?spid=125687401,37,,,finish
Viên vệ sinh máy rửa bát Finish vỉ 4 Viên - HANOIMART,145.000₫,https://tiki.vn/vien-ve-sinh-may-rua-bat-finish-vi-4-vien-hanoimart-p57385894.html?spid=206140447,38,,Đã bán 7,finish
combo treo khử mùi + hộp 100 viên rủă chén bát finish allin1,109.500₫,https://tiki.vn/combo-treo-khu-mui-hop-100-vien-rua-chen-bat-finish-allin1-p121325890.html?spid=141655601,39,,,finish
Tinh dầu treo khử mùi máy rửa chén Finish Dishwasher Freshener Odor Stop 60x QT017393,99.000₫,https://tiki.vn/tinh-dau-treo-khu-mui-may-rua-chen-finish-dishwasher-freshener-odor-stop-60x-qt017393-p53830007.html?spid=63236817,40,,,finish
