title,price,link_item,index,discount,sales,brand
Áo chống nắng nữ dáng NGẮN nhiều màu ịn xò,130.000₫,https://tiki.vn/ao-chong-nang-nu-dang-ngan-nhieu-mau-in-xo-p91868693.html?spid=169491460,1,,,LQluxury
Quần ống rôngj Kẻ Sọc Caro form siêu đẹp,99.000₫,https://tiki.vn/quan-ong-rongj-ke-soc-caro-form-sieu-dep-p88248701.html?spid=163476175,2,,Đã bán 1,LQluxury
Combo 02 áo hai dây cotton,79.000₫,https://tiki.vn/combo-02-ao-hai-day-cotton-p20458789.html?spid=109325014,3,,,LQluxury
Đai nịt bụng 2 lớp giảm eo cao cấp - da,54.000₫,https://tiki.vn/dai-nit-bung-2-lop-giam-eo-cao-cap-da-p20552017.html?spid=193602606,4,,,LQluxury
,,https://tiki.vn/bo-5-quan-lot-dung-mot-lan-cho-nu-p50550466.html?spid=109325667,5,,,LQluxury
Áo choàng chống nắng toàn thân cao cấp G..U,175.000₫,https://tiki.vn/ao-choang-chong-nang-toan-than-cao-cap-g-u-p95542925.html?spid=184908875,6,,,LQluxury
"Áo chống nắng G.U thông hơi, dáng ngắn, chống tia UV hiệu quả",80.000₫,https://tiki.vn/ao-chong-nang-g-u-thong-hoi-dang-ngan-chong-tia-uv-hieu-qua-p85350979.html?spid=220656576,7,,,LQluxury
Áo choàng chống nắng thông hơi nữ - siêu phẩm của mùa nắng,70.000₫,https://tiki.vn/ao-choang-chong-nang-thong-hoi-nu-sieu-pham-cua-mua-nang-p112691596.html?spid=121657106,8,,,LQluxury
Áo Croptop Ngắn Tay Với Thiết Kế Ôm Dáng Gợi Cảm Dành Cho Nữ,52.000₫,https://tiki.vn/ao-croptop-ngan-tay-voi-thiet-ke-om-dang-goi-cam-danh-cho-nu-p58056905.html?spid=92857055,9,,,LQluxury
