title,price,link_item,index,discount,sales,category
Hộp Sữa Bột Morinaga Chilmil Số 2 (850g) Dành cho trẻ từ 6 -36 tháng tuổi,449.000₫,https://tiki.vn/hop-sua-bot-morinaga-chilmil-so-2-850g-danh-cho-tre-tu-6-36-thang-tuoi-p36630087.html?spid=50070180,1,-57%,Đã bán 29,dinhduongchobe
"Sữa non cho bé từ 1-9 tuổi Ildong Plus 2 Hàn Bổ sung dinh dưỡng giúp phát triển trí não, xương, răng, tăng sức đề kháng, tiêu hóa tốt - Massel Official",278.000₫,https://tiki.vn/sua-non-cho-tre-tuoi-tu-1-den-9-ildong-foodis-plus-2-nk-han-quoc-chua-ham-luong-chat-dinh-duong-cao-giup-phat-trien-tri-nao-xuong-rang-va-thi-luc-tang-he-mien-dich-tao-he-tieu-hoa-khoe-manh-p119617207.html?spid=119617208,2,-57%,Đã bán 16,dinhduongchobe
"Sữa cho trẻ sơ sinh, trẻ nhỏ 0-36 tháng tuổi Meiji Nhật giàu dưỡng chất kèm DHA giúp phát triển cân đối chiều cao, cân nặng, trí não cho bé - OZ Slim Store",527.000₫,https://tiki.vn/sua-cho-tre-so-sinh-tre-nho-0-36-thang-tuoi-meiji-nhat-giau-duong-chat-kem-dha-giup-phat-trien-can-doi-chieu-cao-can-nang-tri-nao-cho-be-oz-slim-store-p272336907.html?spid=219157267,3,-16%,Đã bán 43,dinhduongchobe
Combo 10 Gói Súp Dinh Dưỡng Cây Thị,251.000₫,https://tiki.vn/combo-10-goi-sup-dinh-duong-cay-thi-p171039372.html?spid=171039373,4,-52%,Đã bán 28,dinhduongchobe
Sữa bột Vinamilk ColosGold 1 800g (cho trẻ từ 0 - 1 tuổi),480.000₫,https://tiki.vn/sua-bot-vinamilk-colosgold-1-800g-cho-tre-tu-0-1-tuoi-p202739495.html?spid=243010361,5,-63%,,dinhduongchobe
Sữa Bột Vinamilk Dielac Alpha Gold IQ Step 1 - Hộp Thiếc 800g,355.000₫,https://tiki.vn/sua-bot-vinamilk-dielac-alpha-gold-iq-step-1-hop-thiec-800g-p183284483.html?spid=183284484,6,-20%,,dinhduongchobe
Combo 3 Gói Cháo Gạo Koshihikari Ăn Dặm Matsuya,212.000₫,https://tiki.vn/combo-3-goi-chao-gao-koshihikari-an-dam-matsuya-p53442644.html?spid=54034422,7,-5%,Đã bán 4,dinhduongchobe
"Sữa tăng chiều cao A2 tách kem, canxi cao Skim Milk Powder high in Calcium phát triển xương ở trẻ, chống loãng xương ở người lớn - Massel Official",465.000₫,https://tiki.vn/sua-tang-chieu-cao-a2-tach-kem-canxi-cao-skim-milk-powder-high-in-calcium-phat-trien-xuong-o-tre-chong-loang-xuong-o-nguoi-lon-massel-official-p270859267.html?spid=121006789,8,-63%,Đã bán 41,dinhduongchobe
"Vitamin tổng hợp cho trẻ Brauer Multivitamin Úc hỗ trợ trẻ phát triển cân đối, tăng sức đề kháng, giảm biếng ăn, giúp trẻ ngủ ngon - OZ Slim Store",351.000₫,https://tiki.vn/vitamin-tong-hop-cho-tre-brauer-multivitamin-uc-ho-tro-tre-phat-trien-can-doi-tang-suc-de-khang-giam-bieng-an-giup-tre-ngu-ngon-oz-slim-store-p272374816.html?spid=105328499,9,-5%,Đã bán 8,dinhduongchobe
Sữa Công Thức Hữu Cơ Bước 2 Bellamy's Organic (900g),850.000₫,https://tiki.vn/sua-cong-thuc-huu-co-buoc-2-bellamy-s-organic-900g-p37597298.html?spid=99719062,10,-5%,Đã bán 6,dinhduongchobe
[MUA 1 TẶNG 1 XE ĐỒ CHƠI] KHI MUA 1 Nutrigen Supra Syrup - Siro Bổ Sung Dinh Dưỡng Và Vi Chất cho trẻ em,279.200₫,https://tiki.vn/nutrigen-supra-syrup-siro-bo-sung-dinh-duong-va-vi-chat-cho-tre-em-p94763734.html?spid=94763735,11,-10%,Đã bán 13,dinhduongchobe
Bánh ăn dặm PAPAFOOD PAPAPUFFS FINGERS - 100% Nguyên Liệu Hữu Cơ,65.000₫,https://tiki.vn/banh-an-dam-papafood-papapuffs-fingers-100-nguyen-lieu-huu-co-p249823385.html?spid=249823386,12,-20%,Đã bán 1,dinhduongchobe
"Combo 3 Viên Uống Nature’s Way Kids Smart Phát Triển Trí Tuệ, Bứt Phá Chiều Cao Cho Bé Từ 2 Tuổi",1.390.000₫,https://tiki.vn/combo-3-vien-uong-nature-s-way-kids-smart-phat-trien-tri-tue-but-pha-chieu-cao-cho-be-tu-2-tuoi-p159385210.html?spid=159385211,13,,Đã bán 10,dinhduongchobe
Thùng sữa công thức pha sẵn dành cho bé Suy dinh dưỡng - thấp - còi loại 110ml,427.000₫,https://tiki.vn/thung-sua-cong-thuc-pha-san-danh-cho-be-suy-dinh-duong-thap-coi-loai-110ml-p273577725.html?spid=273577726,14,,,dinhduongchobe
ENZYMAX KIDS - Giúp bé hấp thu chất dinh dưỡng tốt hơn (Hộp 50 gói),750.000₫,https://tiki.vn/enzymax-kids-giup-be-hap-thu-chat-dinh-duong-tot-hon-hop-50-goi-p215705161.html?spid=215705162,15,,Đã bán 2,dinhduongchobe
"Sữa bột Nutri Plus WEIGHT GAIN dinh dưỡng đầy đủ, cân đối hấp thụ dưỡng chất tăng cân cho người gầy 900G-Nutri Plus NWG",340.000₫,https://tiki.vn/sua-bot-nutri-plus-weight-gain-dinh-duong-day-du-can-doi-hap-thu-duong-chat-tang-can-cho-nguoi-gay-900g-nutri-plus-nwg-p101976744.html?spid=101976745,16,,Đã bán 6,dinhduongchobe
Thực phẩm bảo vệ sức khỏe Fitobimbi D3+K2,290.000₫,https://tiki.vn/thuc-pham-bao-ve-suc-khoe-fitobimbi-d3-k2-p89746138.html?spid=89746139,17,,Đã bán 3,dinhduongchobe
"FITOBIMBI APPETITO, 200ml, Siro ăn ngon cho bé, trẻ em của Ý - Y Dược Xanh",340.000₫,https://tiki.vn/mua-fitobimbi-appetito-200ml-siro-an-ngon-cho-be-tre-em-y-duoc-xanh-p248370715.html?spid=248370717,18,,,dinhduongchobe
"SBPS ColosBaby IQ Gold giúp bé phát triển trí não, miễn dịch khỏe, phát triển toàn diện /lốc 4 hộp 180ml - VitaDairy",65.192₫,https://tiki.vn/sbps-colosbaby-iq-gold-180ml-loc-4-hop-p230041849.html?spid=230041850,19,,,dinhduongchobe
Colos Opti 0+ 800g,408.044₫,https://tiki.vn/colos-opti-0-800g-p230053885.html?spid=230053886,20,,,dinhduongchobe
Thùng sữa nước Nutricare Care 100 Gold - phát triển toàn diện cho trẻ từ 1 tuổi (180ml x 48 hộp),580.000₫,https://tiki.vn/thung-sua-nuoc-nutricare-care-100-gold-phat-trien-toan-dien-cho-tre-tu-1-tuoi-180ml-x-48-hop-p10930948.html?spid=46252922,21,,Đã bán 44,dinhduongchobe
Sữa bột Vinamilk YOKOGOLD 2 850g (cho trẻ từ 1 - 2 tuổi),480.000₫,https://tiki.vn/sua-bot-vinamilk-yokogold-2-850g-cho-tre-tu-1-2-tuoi-p37141760.html?spid=52672814,22,,Đã bán 2,dinhduongchobe
"Combo 2 Hộp Sữa Hạt Miwako A+ Vị Vani & Vị Gạo Hộp 700g Nhập Khẩu Malaysia, Sữa Hữu Cơ Cho Bé Từ 1 Tuổi Dị Ứng Đạm Bò Chậm Nói Giúp Phát Triển Trí Não Chiều Cao Tặng Quạt Tích Điện Mini",574.750₫,https://tiki.vn/tang-may-doc-the-song-ngu-combo-2-hop-sua-hat-miwako-a-vi-vani-vi-gao-hop-700g-nhap-khau-malaysia-sua-huu-co-cho-be-tu-1-tuoi-di-ung-dam-bo-cham-noi-giup-phat-trien-tri-nao-chieu-cao-p247681719.html?spid=271967084,23,,,dinhduongchobe
Brauer Hỗ Trợ Hệ Miễn Dịch Cho Trẻ Sơ Sinh & Trẻ Nhỏ - Baby & Child Immunity Support Oral Liquid 100ml - QuaTangMe Extaste,264.000₫,https://tiki.vn/brauer-ho-tro-he-mien-dich-cho-tre-so-sinh-tre-nho-baby-child-immunity-support-oral-liquid-100ml-p270884316.html?spid=48092980,24,,Đã bán 78,dinhduongchobe
Thùng sữa uống dinh dưỡng vị chua Nutricare Metacare Yoyo Hương dâu (110ml x 48 hộp),229.000₫,https://tiki.vn/thung-sua-uong-dinh-duong-vi-chua-nutricare-metacare-yoyo-huong-dau-110ml-x-48-hop-p117970432.html?spid=117970435,25,,Đã bán 26,dinhduongchobe
"Combo 5 Hộp Sữa Công Thức Hữu Cơ Miwako A+ Vị Vani 700g (3.5Kg) Nhập Khẩu Malaysia, Sữa Hạt Cho Bé Từ 1-6 Tuổi Giúp Phát Triển Trí Não Chiều Cao Tặng Máy Xay Hạt",2.945.000₫,https://tiki.vn/tang-thung-mo-hinh-dong-vat-combo-5-hop-sua-cong-thuc-huu-co-miwako-a-vi-vani-700g-3-5kg-nhap-khau-malaysia-sua-hat-cho-be-tu-1-6-tuoi-giup-phat-trien-tri-nao-chieu-cao-p221264678.html?spid=252165921,26,,Đã bán 3,dinhduongchobe
[TẶNG SET DÊ BÔNG] COMBO 2 lon Sữa dê Kabrita số 3 cho trẻ trên 24 tháng - Lon 800g,1.760.000₫,https://tiki.vn/tang-set-de-bong-combo-2-lon-sua-de-kabrita-so-3-cho-tre-tren-24-thang-lon-800g-p272392865.html?spid=272392866,27,,Đã bán 1,dinhduongchobe
Sữa bột Hismart số 2_Cho bé từ 6-12 tháng tuổi - xuất xứ 100% New Zeland - 400g,325.000₫,https://tiki.vn/sua-bot-hismart-so-2_cho-be-tu-6-12-thang-tuoi-xuat-xu-100-new-zeland-400g-p192103960.html?spid=192103961,28,,,dinhduongchobe
Bánh ăn dặm Long Giang -vị Bí Đỏ,25.000₫,https://tiki.vn/banh-an-dam-long-giang-vi-bi-do-p205263633.html?spid=205263634,29,,Đã bán 1,dinhduongchobe
[Quà tặng không bán] 03 gói Siro ăn ngon MINION HAPPY DR.MAYA,99.000₫,https://tiki.vn/qua-tang-khong-ban-03-goi-siro-an-ngon-minion-happy-dr-maya-p249669633.html?spid=249669634,30,,,dinhduongchobe
"Vitamin K2 + D3 Drop bổ sung vitamin cho Trẻ Sơ Sinh, Bé Mọc Răng Chậm, Còi Xương – Dr.Life",225.000₫,https://tiki.vn/vitamin-k2-d3-drop-bo-sung-vitamin-cho-tre-so-sinh-be-moc-rang-cham-coi-xuong-dr-life-p262023213.html?spid=262023214,31,,,dinhduongchobe
Viên nhai bổ sung kẽm và vitamin C Healthy Care Kids Chewable 60 viên vị dâu,340.000₫,https://tiki.vn/vien-nhai-bo-sung-kem-va-vitamin-c-healthy-care-kids-chewable-60-vien-vi-dau-p263567116.html?spid=263567117,32,,,dinhduongchobe
(Tặng quà cho bé )Bestical bổ sung canxi và vitamin d3k2 giúp tăng chiều cao vượt trội cho bé,290.000₫,https://tiki.vn/tang-qua-cho-be-bestical-bo-sung-canxi-va-vitamin-d3k2-giup-tang-chieu-cao-vuot-troi-cho-be-p242105919.html?spid=242105923,33,,Đã bán 3,dinhduongchobe
Sữa Bột Morinaga Chilmil Số 2 (850g),449.000₫,https://tiki.vn/sua-bot-morinaga-chilmil-so-2-850g-p8066188.html?spid=50064997,34,,Đã bán 7,dinhduongchobe
"Sữa bột Colos Gain 0+ 800g giúp bé tăng cân hiệu quả, giảm táo bón, miễn dịch khỏe - VitaDairy",410.400₫,https://tiki.vn/sua-bot-tang-can-nhanh-colos-gain-0-800g-lon-p204027859.html?spid=204027860,35,,,dinhduongchobe
COMBO 2 GÓI BỘT DINH DƯỠNG ĂN DẶM CHO TRẺ EM THÀNH RÂU - 1KG,78.000₫,https://tiki.vn/02-tui-bot-min-tong-hop-thanh-rau-500g-p35240513.html?spid=35240514,36,,Đã bán 385,dinhduongchobe
COMBO 2 HỘP BỘT ĂN DẶM RIDIELAC GOLD 3 VỊ NGỌT - HỘP GIẤY 200G,118.000₫,https://tiki.vn/combo-2-hop-bot-an-dam-ridielac-gold-3-vi-ngot-hop-giay-200g-p26730966.html?spid=54618968,37,,Đã bán 37,dinhduongchobe
FITOBIMBI OMEGA JUNIOR – SIRO THẢO DƯỢC CHUẨN HÓA CHÂU ÂU HỖ TRỢ PHÁT TRIỂN NÃO BỘ VÀ THỊ GIÁC CHO TRẺ (30ML),390.000₫,https://tiki.vn/fitobimbi-omega-junior-siro-thao-duoc-chuan-hoa-chau-au-ho-tro-phat-trien-nao-bo-va-thi-giac-cho-tre-30ml-p48324723.html?spid=86024484,38,,Đã bán 35,dinhduongchobe
Trái cây nghiền các vị Semper 90g dành cho bé từ 6 tháng trở lên,49.600₫,https://tiki.vn/trai-cay-nghien-cac-vi-semper-90g-danh-cho-be-tu-6-thang-tro-len-p269951935.html?spid=269951941,39,,,dinhduongchobe
Siro Ăn Ngon BaBy Plus-Cải Thiện Tình Trạng Biếng Ăn Giúp Bé Tăng Cân Khỏe Mạnh,358.000₫,https://tiki.vn/siro-an-ngon-baby-plus-cai-thien-tinh-trang-bieng-an-giup-be-tang-can-khoe-manh-p98103420.html?spid=113788577,40,,Đã bán 102,dinhduongchobe
