title,price,link_item,index,discount,sales,brand
Bộ quần áo lửng bé gái họa tiết Hoa Hồng Leo tím cotton - AICDBGI8APR9 - AIN Closet,155.000₫,https://tiki.vn/bo-quan-ao-lung-be-gai-hoa-tiet-hoa-hong-leo-tim-cotton-aicdbgi8apr9-ain-closet-p217740479.html?spid=217740489,1,-33%,,AIN_Closet
Bộ quần áo Dài tay ngắn bé gái họa tiết bánh Donut Gấu Trúc Vàng cotton - AICDBG1KGZCE - AIN Closet,155.000₫,https://tiki.vn/bo-quan-ao-dai-tay-ngan-be-gai-hoa-tiet-banh-donut-gau-truc-vang-cotton-aicdbg1kgzce-ain-closet-p271995477.html?spid=271995481,2,-26%,,AIN_Closet
Đầm bé gái họa tiết Lá oval đỏ xô tole - AICDBGSYEUIK - AIN Closet,155.000₫,https://tiki.vn/dam-be-gai-hoa-tiet-la-oval-do-xo-tole-aicdbgsyeuik-ain-closet-p184857915.html?spid=184857917,3,-28%,Đã bán 2,AIN_Closet
Bộ quần áo Ngắn bé gái họa tiết Cún Hồng Sweet cotton - AICDBGBTFMZC - AIN Closet,155.000,https://tiki.vn/bo-quan-ao-ngan-be-gai-hoa-tiet-cun-hong-sweet-cotton-aicdbgbtfmzc-ain-closet-p271946840.html?spid=271946846,4,,,AIN_Closet
,,https://tiki.vn/bo-quan-ao-ngan-be-gai-hoa-tiet-hoa-chuon-chuon-hong-cotton-aicdbgtxjg32-ain-closet-p242411048.html?spid=242411050,5,,,AIN_Closet
Bộ quần áo Dài tay ngắn bé gái họa tiết Cúc Baby Cam xô muslin - AICDBGD4DEVS - AIN Closet,155.000₫,https://tiki.vn/bo-quan-ao-dai-tay-ngan-be-gai-hoa-tiet-cuc-baby-cam-xo-muslin-aicdbgd4devs-ain-closet-p273301225.html?spid=273301235,6,-26%,,AIN_Closet
Áo khoác có nón bé gái họa tiết Tim đỏ thun da cá - AICDBGMY8T2Q - AIN Closet,175.000₫,https://tiki.vn/ao-khoac-co-non-be-gai-hoa-tiet-tim-do-thun-da-ca-aicdbgmy8t2q-ain-closet-p142320614.html?spid=142320626,7,-19%,Đã bán 2,AIN_Closet
Bộ quần áo Bà ba Lửng unisex cho bé hoa văn Vân Gỗ Vàng Rêu gấm - AICDBTKUQGPZ - AIN Closet,155.000₫,https://tiki.vn/bo-quan-ao-ba-ba-lung-unisex-cho-be-hoa-van-van-go-vang-reu-gam-aicdbtkuqgpz-ain-closet-p271995500.html?spid=271995504,8,-31%,,AIN_Closet
Bộ quần áo ngắn bé gái họa tiết Hoa Cẩm tú trắng nền hồng linen xước - AICDBG6YPTDY - AIN Closet,145.000,https://tiki.vn/bo-quan-ao-ngan-be-gai-hoa-tiet-hoa-cam-tu-trang-nen-hong-linen-xuoc-aicdbg6yptdy-ain-closet-p174030493.html?spid=174030505,9,,,AIN_Closet
,,https://tiki.vn/dam-be-gai-hoa-tiet-nang-tien-hoa-vang-cotton-aicdbg4kn2ep-ain-closet-p273916077.html?spid=273916087,10,,,AIN_Closet
Bộ quần áo Dài bé gái họa tiết Gấu Koala cam xô sợi tre - AICDBG017MID - AIN Closet,155.000₫,https://tiki.vn/bo-quan-ao-dai-be-gai-hoa-tiet-gau-koala-cam-xo-soi-tre-aicdbg017mid-ain-closet-p271140767.html?spid=271140771,11,-26%,,AIN_Closet
Bộ quần áo Dài bé gái họa tiết Cầu Vồng Cam xô sợi tre - AICDBGJ3EGKF - AIN Closet,155.000,https://tiki.vn/bo-quan-ao-dai-be-gai-hoa-tiet-cau-vong-cam-xo-soi-tre-aicdbgj3egkf-ain-closet-p272619378.html?spid=272619390,12,,,AIN_Closet
,,https://tiki.vn/bo-ao-vay-ngan-be-gai-hoa-tiet-hoa-3d-hong-cotton-aicdbgfspp0n-ain-closet-p262635830.html?spid=262635836,13,,,AIN_Closet
Set Áo váy bé gái Dân Quốc họa tiết Bé Hoa Vàng - AICDBGJWF2V9 - AIN Closet,230.000₫,https://tiki.vn/set-ao-vay-be-gai-dan-quoc-hoa-tiet-be-hoa-vang-aicdbgjwf2v9-ain-closet-p273850919.html?spid=273850937,14,-19%,,AIN_Closet
Bộ Áo Dài bé gái họa tiết hoa Vân Anh Hồng lụa tơ - AICDBGT7ZGMQ - AIN Closet,260.000₫,https://tiki.vn/bo-ao-dai-be-gai-hoa-tiet-hoa-van-anh-hong-lua-to-aicdbgt7zgmq-ain-closet-p273497479.html?spid=273497485,15,-22%,,AIN_Closet
Bộ quần áo ngắn bé gái họa tiết Hoa Sứ vàng xanh linen xước - AICDBGNOSE1N - AIN Closet,145.000₫,https://tiki.vn/bo-quan-ao-ngan-be-gai-hoa-tiet-hoa-su-vang-xanh-linen-xuoc-aicdbgnose1n-ain-closet-p170877584.html?spid=170877587,16,-26%,Đã bán 9,AIN_Closet
Bộ quần áo Bà ba Lửng unisex cho bé hoa văn Vân Gỗ Cam Gạch gấm - AICDBTM8L8OQ - AIN Closet,155.000,https://tiki.vn/bo-quan-ao-ba-ba-lung-unisex-cho-be-hoa-van-van-go-cam-gach-gam-aicdbtm8l8oq-ain-closet-p271995462.html?spid=271995470,17,,,AIN_Closet
,,https://tiki.vn/bo-quan-ao-ba-ba-lung-unisex-cho-be-hoa-van-van-go-xanh-hai-quan-gam-aicdbtwhokjv-ain-closet-p271995537.html?spid=271995548,18,,,AIN_Closet
Bộ quần áo bé gái họa tiết Hoa vàng xám cotton - AICDBGUZJUHT - AIN Closet,145.000₫,https://tiki.vn/bo-quan-ao-be-gai-hoa-tiet-hoa-vang-xam-cotton-aicdbguzjuht-ain-closet-p112169036.html?spid=112169043,19,-17%,,AIN_Closet
Bộ quần áo ngắn bé gái họa tiết dây Bi đen nơ xanh - AICDBGUIMQCB - AIN Closet,190.000₫,https://tiki.vn/bo-quan-ao-ngan-be-gai-hoa-tiet-day-bi-den-no-xanh-aicdbguimqcb-ain-closet-p158867789.html?spid=158867793,20,-38%,Đã bán 3,AIN_Closet
Bộ quần áo ngắn bé gái Họa tiết Quả việt quất hồng - AICDBGK9S9QQ - AIN Closet,185.000₫,https://tiki.vn/bo-quan-ao-ngan-be-gai-hoa-tiet-qua-viet-quat-hong-aicdbgk9s9qq-ain-closet-p107420578.html?spid=107420580,21,-25%,Đã bán 24,AIN_Closet
Bộ quần áo ngắn bé gái họa tiết Chanh đỏ quần váy cotton - AICDBGZYQMND - AIN Closet,120.000₫,https://tiki.vn/bo-quan-ao-ngan-be-gai-hoa-tiet-chanh-do-quan-vay-cotton-aicdbgzyqmnd-ain-closet-p196582231.html?spid=196582239,22,-25%,Đã bán 3,AIN_Closet
Đầm Sườn xám bé gái họa tiết Thỏ Mặt Trăng viền đỏ cotton - AICDBTWLJTC2 - AIN Closet,195.000₫,https://tiki.vn/dam-suon-xam-be-gai-hoa-tiet-tho-mat-trang-vien-do-cotton-aicdbtwljtc2-ain-closet-p273679704.html?spid=273679717,23,,,AIN_Closet
Đầm Sườn Xám bé gái họa tiết Thôn Nữ Hàn Quốc đũi tơ - AICDBGEPSW65 - AIN Closet,195.000₫,https://tiki.vn/dam-suon-xam-be-gai-hoa-tiet-thon-nu-han-quoc-dui-to-aicdbgepsw65-ain-closet-p273565975.html?spid=273565983,24,,,AIN_Closet
Áo khoác bé gái Cúc xanh kaki mềm - AICDBG6YZYSQ - AIN Closet,230.000,https://tiki.vn/ao-khoac-be-gai-cuc-xanh-kaki-mem-aicdbg6yzysq-ain-closet-p94790055.html?spid=94790057,25,-23%,,AIN_Closet
,,https://tiki.vn/bo-quan-ao-dai-be-gai-hoa-tiet-banh-quy-gau-nen-vang-xo-soi-tre-aicdbgiolot2-ain-closet-p273916121.html?spid=273916129,26,-26%,,AIN_Closet
Bộ quần áo ngắn bé gái dây họa tiết Hoa hồng lanh lụa - AICDBGQX79WQ - AIN Closet,135.000₫,https://tiki.vn/bo-quan-ao-ngan-be-gai-day-hoa-tiet-hoa-hong-lanh-lua-aicdbgqx79wq-ain-closet-p107420639.html?spid=107420643,27,-24%,Đã bán 6,AIN_Closet
Bộ quần áo ngắn bé gái họa tiết Gấu Vàng Sinh Nhật cotton - AICDBGEL7JWA - AIN Closet,145.000₫,https://tiki.vn/bo-quan-ao-ngan-be-gai-hoa-tiet-gau-vang-sinh-nhat-cotton-aicdbgel7jwa-ain-closet-p255109774.html?spid=255109776,28,,,AIN_Closet
Đầm bé gái họa tiết Gấu Làm Vườn Nơ Cam cotton - AICDBGS9PEJR - AIN Closet,175.000₫,https://tiki.vn/dam-be-gai-hoa-tiet-gau-lam-vuon-no-cam-cotton-aicdbgs9pejr-ain-closet-p271541747.html?spid=271541749,29,,,AIN_Closet
Đầm tay lỡ bé gái họa tiết Tiên Nữ Nơ Vàng cotton - AICDBG8HGXW3 - AIN Closet,195.000,https://tiki.vn/dam-tay-lo-be-gai-hoa-tiet-tien-nu-no-vang-cotton-aicdbg8hgxw3-ain-closet-p273372096.html?spid=273372101,30,-38%,,AIN_Closet
,,https://tiki.vn/bo-quan-ao-ngan-be-gai-dau-xanh-sat-nach-thun-cotton-aicdbgrx6w0y-ain-closet-p180298547.html?spid=180298561,31,-30%,,AIN_Closet
Bộ quần áo Dài có nón unisex cho bé hoạ tiết Kẻ Cam Carrot thun da cá - AICDBTS1CSAQ - AIN Closet,165.000₫,https://tiki.vn/bo-quan-ao-dai-co-non-unisex-cho-be-hoa-tiet-ke-cam-carrot-thun-da-ca-aicdbts1csaq-ain-closet-p272732550.html?spid=272732560,32,-26%,,AIN_Closet
Bộ quần áo dài bé gái họa tiết Thỏ Tuyết trắng thun trần bông - AICDBGFOV1UG - AIN Closet,155.000₫,https://tiki.vn/bo-quan-ao-dai-be-gai-hoa-tiet-tho-tuyet-trang-thun-tran-bong-aicdbgfov1ug-ain-closet-p205974483.html?spid=205974498,33,,Đã bán 2,AIN_Closet
Bộ quần áo ngắn bé gái họa tiết Cầu vồng viền cam cotton - AICDBGQBYS94 - AIN Closet,155.000₫,https://tiki.vn/bo-quan-ao-ngan-be-gai-hoa-tiet-cau-vong-vien-cam-cotton-aicdbgqbys94-ain-closet-p192548550.html?spid=192548558,34,,Đã bán 1,AIN_Closet
Bộ quần áo dài bé gái họa tiết Hoa Thỏ quần hồng cotton - AICDBGYGQOH7 - AIN Closet,155.000,https://tiki.vn/bo-quan-ao-dai-be-gai-hoa-tiet-hoa-tho-quan-hong-cotton-aicdbgygqoh7-ain-closet-p244308798.html?spid=244308814,35,-31%,,AIN_Closet
,,https://tiki.vn/bo-quan-ao-dai-be-gai-hoa-tiet-cham-beo-vang-thun-cotton-aicdbgh0l6bp-ain-closet-p191436363.html?spid=191436372,36,-26%,,AIN_Closet
Bộ áo váy ngắn bé gái họa tiết Hoa cúc Lobelia chân váy nâu cotton boi dệt - AICDBGCJWVJM - AIN Closet,165.000₫,https://tiki.vn/bo-ao-vay-ngan-be-gai-hoa-tiet-hoa-cuc-lobelia-chan-vay-nau-cotton-boi-det-aicdbgcjwvjm-ain-closet-p160392348.html?spid=160392358,37,-31%,,AIN_Closet
Bộ quần áo dài bé gái họa tiết Tim trắng nền cam cotton - AICDBGMC5D20 - AIN Closet,155.000₫,https://tiki.vn/bo-quan-ao-dai-be-gai-hoa-tiet-tim-trang-nen-cam-cotton-aicdbgmc5d20-ain-closet-p189552567.html?spid=189552573,38,,Đã bán 4,AIN_Closet
Bộ quần áo Ngắn unisex cho bé họa tiết Doraemon Xanh xô muslin - AICDBTKMBRWT - AIN Closet,155.000₫,https://tiki.vn/bo-quan-ao-ngan-unisex-cho-be-hoa-tiet-doraemon-xanh-xo-muslin-aicdbtkmbrwt-ain-closet-p273497341.html?spid=273497349,39,,,AIN_Closet
Đầm Hanbok cách tân bé gái họa tiết Hoa xanh tơ ánh nhủ - AICDBGMAEG4B - AIN Closet,250.000,https://tiki.vn/dam-hanbok-cach-tan-be-gai-hoa-tiet-hoa-xanh-to-anh-nhu-aicdbgmaeg4b-ain-closet-p212990934.html?spid=212990944,40,,,AIN_Closet
