title,price,link_item,index,discount,sales,brand
Khăn thay thế cho robot hút bụi Xiaomi Mi Robot Vacuum Mop 2 Pro - Hàng Chính Hãng,250.000₫,https://tiki.vn/khan-thay-the-cho-robot-hut-bui-xiaomi-mi-robot-vacuum-mop-2-pro-hang-chinh-hang-p269893301.html?spid=269893328,1,-50%,,Xiaomi
"Nồi cơm điện cao tần áp suất Xiaomi gen 3 mới thông minh 3L, 4L, nấu nhanh 40 phút IH Rice Cooker - Hàng chính hãng",1.600.000₫,https://tiki.vn/noi-com-dien-cao-tan-ap-suat-xiaomi-gen-3-moi-thong-minh-3l-4l-nau-nhanh-40-phut-ih-rice-cooker-p273664087.html?spid=273664116,2,,,Xiaomi
Bộ 2 Chổi Quét Góc Thay Thế Cho Robot Hút Bụi Xiaomi Vacuum Mop 2 - Hàng Chính Hãng,199.000₫,https://tiki.vn/bo-2-choi-quet-goc-thay-the-cho-robot-hut-bui-xiaomi-vacuum-mop-2-hang-chinh-hang-p272304599.html?spid=272304600,3,,,Xiaomi
Máy hút bụi cầm tay diệt khuẩn Mijia hàng Chính hãng,808.000,https://tiki.vn/may-hut-bui-cam-tay-diet-khuan-xiaomi-mijia-lam-sach-triet-de-tia-uv-khu-99-vi-khuan-may-hut-bui-giuong-nem-sofa-p242153697.html?spid=242153698,4,,Đã bán 1,Xiaomi
,,https://tiki.vn/luoi-dao-thay-the-cho-tong-do-xiaomi-enchen-boost-hang-nhap-khau-p97619562.html?spid=97619566,5,,,Xiaomi
