title,price,link_item,index,discount,sales,category
Quần Short Nam Kaki Vicero 6 Màu Phong Cách Hàn Quốc,159.000₫,https://tiki.vn/quan-short-nam-kaki-vicero-6-mau-phong-cach-han-quoc-p79470965.html?spid=79471023,1,-47%,Đã bán 43,quannam
Quần jean Nam dài cao cấp có size 28-32 . Vải dày và co giãn,168.900₫,https://tiki.vn/quan-jean-nam-dai-cao-cap-co-size-28-32-vai-day-va-co-gian-p271495760.html?spid=271495768,2,,Đã bán 1,quannam
Quần short jean nam xanh đen vải đẹp Q393 Muidoi | quần nam | quần short nam - 30,114.000₫,https://tiki.vn/quan-short-jean-nam-xanh-den-vai-dep-q393-muidoi-quan-nam-quan-short-nam-30-p15506108.html?spid=15506109,3,-12%,Đã bán 37,quannam
QUẦN SHORT NAM WINFA TỪ 50-95KG - 3 MÀU,109.000,https://tiki.vn/qua-n-short-nam-winfa-tu-50-95kg-3-mau-p15358828.html?spid=15358850,4,-10%,,quannam
,,https://tiki.vn/quan-linh-tui-hop-han-quoc-cuc-dep-quan-kaki-linh-ran-ri-chat-vai-kaki-quan-jogger-kaki-ran-ri-linh-nam-tui-hop-quan-jogger-kaki-co-gian-hoat-tiet-linh-cao-cap-quan-kaki-dai-basic-nam-nu-linh-p148680632.html?spid=148680636,5,-2%,,quannam
"Quần thể thao nam BAT 3 sọc nỉ dày dặn, quần dài nam thu đông co giãn trẻ trung thời trang",79.000₫,https://tiki.vn/quan-the-thao-nam-bat-3-soc-ni-day-dan-quan-dai-nam-thu-dong-co-gian-tre-trung-thoi-trang-p145758159.html?spid=165592318,6,,,quannam
Quần tây học sinh cấp 1 cấp 2,69.000₫,https://tiki.vn/quan-tay-hoc-sinh-cap-1-cap-2-p79672735.html?spid=79672750,7,,Đã bán 42,quannam
Viettien - Quần jeans nam smart casual 6Q7127-7123,720.000₫,https://tiki.vn/viettien-quan-jeans-nam-smart-casual-6q7127-7123-p155705074.html?spid=155705098,8,,Đã bán 4,quannam
Viettien - Quần tây màu đen regulat fit 8P4037,540.000,https://tiki.vn/viettien-quan-tay-mau-den-regulat-fit-8p4037-p94878988.html?spid=94879016,9,,,quannam
,,https://tiki.vn/viettien-quan-jeans-nam-dai-mau-xanh-6s7058-phom-regular-fit-may-vua-khong-om-sat-khong-rong-p273398590.html?spid=273398598,10,,,quannam
Quần Short Kaki Nam Cao Cấp QKK01 - Nâu đất,99.000₫,https://tiki.vn/quan-short-kaki-nam-cao-cap-qkk01-p42407437.html?spid=42407497,11,,Đã bán 4,quannam
Quần Jeans nam form ôm JN22SS05-SL - JEAN,800.000,https://tiki.vn/quan-jeans-nam-form-om-jn22ss05-sl-p185232479.html?spid=185232491,12,,,quannam
,,https://tiki.vn/quan-ngu-nam-thun-cotton-hoa-tiet-de-thuong-qshop-qc173-p213498438.html?spid=213498448,13,,,quannam
Quần short thun nam phối sọc hông Phúc An N0001 màu xám,63.000₫,https://tiki.vn/quan-short-thun-nam-phoi-soc-hong-phuc-an-n0001-mau-xam-co-big-size-p7707600.html?spid=7707606,14,,Đã bán 284,quannam
Quần DirtyCoins Gothic Double Knee Pants - Green,699.000₫,https://tiki.vn/gothic-double-knee-pants-green-p220672393.html?spid=220672397,15,,,quannam
Quần jean nam trung niên ống suông co giãn,248.000₫,https://tiki.vn/quan-jean-nam-trung-nien-ong-suong-co-gian-p12208691.html?spid=48875332,16,,Đã bán 61,quannam
Quần Bò Nam Đen Trơn Dáng Skinny Phong Cách Đơn Giản Trẻ Trung SQ602A,149.000,https://tiki.vn/quan-bo-nam-den-tron-dang-skinny-phong-cach-don-gian-tre-trung-sq602a-p74959458.html?spid=74959460,17,,,quannam
,,https://tiki.vn/quan-au-tay-trung-nien-nam-cao-cap-ong-xuong-dung-chat-vai-anh-ytali-xuat-du-chau-au-p164052545.html?spid=164052697,18,,,quannam
"Quần/Quần dài nam, size lớn, phong cách Hàn Quốc, kiểu dáng rộng rãi TA144",250.486₫,https://tiki.vn/quan-dai-nam-size-lon-phong-cach-han-quoc-kieu-dang-rong-rai-ta144-p52082513.html?spid=52082535,19,,Đã bán 6,quannam
Quần Short Kaki Nam Thời Trang Cao Cấp,89.000₫,https://tiki.vn/quan-short-kaki-nam-thoi-trang-cao-cap-p37873875.html?spid=58796431,20,,Đã bán 2,quannam
OWEN - Quần âu nam Owen Slimfit chất Nano màu xanh navy kẻ ô chìm 23489,562.500₫,https://tiki.vn/owen-quan-au-nam-owen-slimfit-mau-xanh-navy-ke-soc-tre-trung-p106886537.html?spid=106886562,21,,,quannam
Viettien - Quần Jeans nam dài phom Regular may rộng Màu Xanh 6S7039 - Jeans xanh,823.200₫,https://tiki.vn/viettien-quan-jeans-nam-dai-phom-regular-may-rong-mau-xanh-6s7039-p273398809.html?spid=273398821,22,,,quannam
Quần Jogger Kaki Nam Dáng Thể Thao Chất Lượng Cao,85.000₫,https://tiki.vn/quan-jogger-kaki-nam-dang-the-thao-chat-luong-cao-p19777718.html?spid=24608130,23,,Đã bán 316,quannam
Quần tây âu nam chống nhăn co dãn 4 chiều . - Đen - 33,85.000₫,https://tiki.vn/quan-tay-au-nam-chong-nhan-co-dan-4-chieu-den-33-p34512411.html?spid=72109001,24,,Đã bán 80,quannam
Quần Đùi Nam Túi Hộp Lưng Thun Big Size 100kg Kaki Xịn,165.000,https://tiki.vn/quan-dui-nam-tui-hop-lung-thun-100kg-quan-sot-nam-freeship-p177711941.html?spid=177711947,25,,Đã bán 3,quannam
,,https://tiki.vn/quan-short-jean-nam-co-size-dai-tu-45kg-den-100kg-quan-ngo-nam-bigsize-nh-shop-p105260567.html?spid=199608323,26,,,quannam
Quần đũi dài nam ống suông Form Slimfit dáng âu Tanoshi,149.250₫,https://tiki.vn/quan-nam-quan-dui-dai-nam-ong-suong-form-slimfit-dang-au-tanoshi-p117832638.html?spid=117832648,27,,,quannam
"Quần short đùi nam vải dù, hàng nhập Quảng Châu",20.000₫,https://tiki.vn/quan-short-dui-nam-vai-du-hang-nhap-quang-chau-p111587511.html?spid=111588017,28,,Đã bán 17,quannam
"Vải may quần tây nam nữ, may vest cao cấp Liên Phương, co giãn tốt, mặc mát, không nhăn- 0168",889.000₫,https://tiki.vn/vai-may-quan-tay-nam-nu-may-vest-cao-cap-lien-phuong-co-gian-tot-mac-mat-khong-nhan-0168-p199239556.html?spid=199239558,29,,,quannam
"Vải may quần tây nam nữ, may vest cao cấp Liên Phương, co giãn tốt, mặc mát, không nhăn- 0059",889.000,https://tiki.vn/vai-may-quan-tay-nam-nu-may-vest-cao-cap-lien-phuong-co-gian-tot-mac-mat-khong-nhan-0059-p197089434.html?spid=197089436,30,,,quannam
,,https://tiki.vn/vai-may-quan-tay-nam-nu-may-vest-cao-cap-lien-phuong-co-gian-tot-mac-mat-khong-nhan-0050-p196283705.html?spid=196283707,31,,,quannam
Quần jogger nỉ da cá ống suông bo gấu Unisex kiểu dáng thể thao siêu hot thời trang 297,69.000₫,https://tiki.vn/quan-jogger-ni-da-ca-ong-suong-bo-gau-unisex-kieu-dang-the-thao-sieu-hot-thoi-trang-297-p194447300.html?spid=194447309,32,,Đã bán 1,quannam
Quần jeans nam form ôm JN22FH26-SL - JEAN,900.000₫,https://tiki.vn/quan-jeans-nam-form-om-jn22fh26-sl-p206132481.html?spid=206132493,33,,,quannam
Viettien - Quần kaki nam màu be có 1ly 6R6021 regular,665.000₫,https://tiki.vn/viettien-quan-kaki-nam-mau-be-co-1ly-6r6021-regular-p182139764.html?spid=182139766,34,,Đã bán 2,quannam
"Quần beggy jean nam, quần jean ống suông thời trang cao cấp Julido Store, mẫu mới MS02",159.000,https://tiki.vn/quan-beggy-jean-nam-quan-jean-ong-suong-thoi-trang-cao-cap-julido-store-mau-moi-ms02-p260114682.html?spid=260114690,35,,,quannam
,,https://tiki.vn/quan-jean-nam-xanh-bac-julido-store-chat-jean-co-dan-4-chieu-ton-dang-nam-tinh-bc5678-34-p74280109.html?spid=74280110,36,,,quannam
Quần thun nam dài jogger Sans401 chất vải mát co giãn thoải mái đẹp năng động thời trang cá tính giá rẻ bo ống chun,79.999₫,https://tiki.vn/quan-thun-nam-dai-jogger-sans401-chat-vai-mat-co-gian-thoai-mai-dep-nang-dong-thoi-trang-ca-tinh-gia-re-bo-ong-chun-p273083433.html?spid=273083441,37,,,quannam
Quần shorts đi biển nam SQ211 Xanh,119.000₫,https://tiki.vn/quan-shorts-di-bien-nam-sq211-xanh-p24428960.html?spid=24428966,38,,Đã bán 18,quannam
Quần jean nam cao cấp nhập khấu dáng slimfit body cực chuẩn LE511_Màu xanh tím than,139.000₫,https://tiki.vn/quan-jean-nam-cao-cap-nhap-khau-dang-slimfit-body-cuc-chuan-le511_mau-xanh-tim-than-p16549881.html?spid=28601125,39,,Đã bán 6,quannam
quần short nam kaki lưng thun vải thái,125.000,https://tiki.vn/quan-short-nam-kaki-lung-thun-vai-thai-p49492883.html?spid=106239708,40,,,quannam
