title,price,link_item,index,discount,sales,brand
Combo 2 Quần shorts thể thao nam dạng sọt sport đùi chất thun lạnh 4 chiều cao cấp phù hợp tập gym hay mặc nhà màu trắng và đen DUI-P101 - tặng 1 khẩu trang chống nắng,89.000₫,https://tka.tiki.vn/pixel/pixel?data=Ka5VnBcFrHpoXLj7pKtbBNGJnuXIpiub5xW59hdhGcTh4CXejEE60BiuC16RzHeGQ6W7o5VEkGUEXFIhQrWAFFOn-4tmuVKePZNCZ2lVICEislPncbHYGToWldxQ49Ky_b4cxzf-PM0wDaRt-nTgfKaGz5SLORUsxduk1XdO2uob1vlh5F7x-iOREkJ2rMW1TNzMQZrBBygyTub0gT5egvPgZW0zd22rxh9vnsusUmOr25ZVj8wSL43x-6ohps2k52gywWzyzEBoNlh_CvGvYuVp6PBCTJ5zNmWNZEue7Z0noz50di7dUN_bsYqJMOYeqZIGHADS874fIV98DnO42h_vIMx5Xh9u9hQQncMIWIykhcjBvHk-5Nzs7h3uzx50_tSzlhw33FiuXtRuZsStOVKQqKQ05YQ2sDrFgg9krNWa3p_ycdR2ExSWt5Eh3diLnM45ayenIMXSTwfcmY2EGcUzTU1OaPjGPKLvb4dB7VP4NHGORtx0gkmzbBGNqWB0C54aqWbybCGujkHrDOV8GG_S0rUDmNtmatfvWlTFae1kbmvJaE4Qjm7CK3dRl-TTeLYhnLfcqBcBiiMi3pn-4ylfnqOQjVIe0miZ7L18ZkuQne2lhUUgYAljdYEP0ImcEV14aTRIGvkU7fShsD0sJLPuEicDtA9eu7Zi4rTdvI2vcgWlNM5la6fQBrGdLUZ3NZizmcxqrLLgW0de-wOhWdWzh8VhNnNyZqqt5qGQPkU_MyYqu32dRWGIK6NUm4pEu1iFpkvCDZz6edoltIGcBmvsbuBV2_3CsOgYdx-KggHeyBNasNuKVUjYNmuI0EBjH4WVwSSG-xAejaVOuLUUlQG2sLFic8-GX8-DkMb1cU5meI8l5x9K-ZvFyHBE6_PsA-82cHDGAIN3bp3DWSlc44tXuYPldXwZnkqwZeY9ubLxHMx9X9PrMoXnws2vMLNf7F0JX_vngu5A36yAndWaLTpKRJwBmxs0fL4yn9xnlh5gjM6QdBoMES5-f926P_HY1A0u9k8xW1nuws0MnG7fwNkyM9zcVedxay4B-pUiUwLZMDKEIRY3nJs1LMqplq3i6cEXdbBWkq-KLIN43S6nU-lUmBRzw6rOamzo_00VqxqnoJ3Tf4cdz4ucMJfovfBJbjZUzGaKCu0HniwzJubZjLvdR0y6i3gvzBX0jAqFWEqRkf6d11vrBLrdbH3flJMV2ScQsjwRDh8hozUfGEMqdPebKZCskx95p-1nz_Vy5REDJvbxh1qveiu2qEde-VoyG7eNB0dh6JnXexhG2-r4OSctUIt0zrP_W9-siU5_gXc_7uC_mU87WCGSJqyAYLLCTSdeiKJt4By9abZ7Lgn-wojrnXPmkbmjWbm75S599iIgkJIhuhkvm5s43ZSuCq-HNhQQAQvq5TBiQ91UQGO0&reqid=XlQpFI5L04IJGGhz&type=CLICK&pos=1,1,-32%,Đã bán 540,Doka
"Combo 3 Áo Thun nam HÀNG HIỆU đa phong cách - ĐB3QC16 (Chọn Màu)- Vải thun cotton có điểm đặc biệt, thân thiện với làn da, co giãn và khả năng thấm hút tốt",189.000₫,https://tka.tiki.vn/pixel/pixel?data=HbVRm30gZFAbdji1ZOc9H6owiMmMtVOCg32Ipu727ueZvR6syk2udohd8yS-osUX3ChsMICctPEVk0xjD6hkdTmNQKByupqTBF5bdpkyDlLONVUyLjctQ7F10xGdqXLEjY94m65Gs6jz4ZHhB8jHWpoXf0euiIlCM3ngSYgEnFo2A27gqGB1Rh4wQ6KA8FCSgFbW4Wlet7HYzVCKk27lVXsDgtaJL4NqhwJbXwfzlmv7alyV4OzTixeVyaET9Zp8AoF76HXGF0XB3hR8xxrvLrJMV-XWmtq1H1qhK6LfcRDw8NgG-tctWydpnE5iNuf05vvwhcCsitWwWn28ewr2XlJdgjp3eSHySpUNq6pgVu-8PCpBPJUdfbzdjHwLwd_I4m1caJgKOazjokpxnZbnryJAD_b2nsZibbqFV9cc8hGnoKBGvDRrP6d225WpGS9FFpBQOwIPLqHSEu9nwPkN7fjrXYZJ1jPU9WQkmpXGL6HkXi0HwX9721pN2RNdTizkukJK2hv5YQ-JTCEf-rZPHJojyqrEL1TZI5GLz3XaU3vkVOII7Tg3pd8aI42qX41QseUqwKhUcuUFvo_GfF4Af3-2WTW78F8z6OKMayqiO6w3_VrD0kNiZwXJUpS-4A7bvsQXRrnPPkZISR9uEdZSO_ljbZIqJhfCxeCefMwvKv3-end1z_Oiz3Pe57br7wK9Zgr-pzwBi-hCHdUQSq9nSFBtZ7UFAINr5re3u397bbhIkz3FtBQnQnAhjsDwLSgDT0Kgz0-VlFg1hDV0w-Rh8dSIuQ0N5ztRbYZdLAPAsEisPRdgmIRqB1IG3lJEudC3NC8b851PVS1uZ81dppcLnsWjRZuxrZ_j3_BfWLvgre5ogMuPPA_Se-7tgHPeYFFnJBc2qAYEzNvsubjbpWJTp3GTOXuRGsH23-FMgwrA3cw9xYruktRJjdv5Grj1bsmdoKDY1f2yti9IHmNApJ-QF49pEKEOfPj2l8h5X62-JCJsT_atN6ZcTbyxksFO8vT_wc3ElmiikhqawtAtIeBiOAOIUwDg8T-6AN7tj41fqX2u4BA17PRiMZdQbB-cOmKe_OXl0KiE_6FQatMyhurz1IDl_5sCs438nUwNu0bvYaib2yBQiYFEnA3fiQy2oiLE1drx9LwSOfCq8XI3j1O003NtUduyQEnCRla1TjnStcNiqUSGoOOsFOSAgstas8JY2sW3LtMMaVlb-jxgnJkDKqv8wbW50sYSXa5tTTx2qdp9Pn6_C0SHgQ2BAWPe_5lenEK3KHRWGA7N4N7CaQ&reqid=XlQpFI5L04IJGGhz&type=CLICK&pos=2,2,-37%,Đã bán 554,Doka
"Combo 3 Áo Thun nam HÀNG HIỆU đa phong cách - ĐB3QC16 (Chọn Màu)- Vải thun cotton có điểm đặc biệt, thân thiện với làn da, co giãn và khả năng thấm hút tốt",189.000₫,https://tiki.vn/combo-3-ao-thun-nam-mau-moi-logo-truo-c-ngu-c-db3qc16-p22610869.html?spid=23503249,3,-37%,Đã bán 554,Doka
Áo khoác nam áo gió vải dù DOKA STORE cao cấp 2 lớp chống nắng tia UV và chống nước khoát phong cách Hàn Quốc - PS21,128.000,https://tiki.vn/ao-khoac-du-nam-chong-nang-truoc-nuoc-cao-cap-ps21-p76121693.html?spid=76121699,4,,,Doka
,,https://tiki.vn/ao-khoac-nam-chong-nang-gio-thu-dong-doka-dbls102-chat-lieu-du-giu-am-cao-cap-mau-den-mau-xanh-den-mau-xanh-reu-p17912482.html?spid=48541088,5,,,Doka
Combo 2 Quần shorts thể thao nam dạng sọt sport đùi chất thun lạnh 4 chiều cao cấp phù hợp tập gym hay mặc nhà màu trắng và đen DUI-P101 - tặng 1 khẩu trang chống nắng,79.000₫,https://tiki.vn/combo-2-quan-shorts-the-thao-nam-dang-sot-sport-dui-chat-thun-lanh-4-chieu-cao-cap-phu-hop-tap-gym-hay-mac-nha-mau-trang-va-den-dui-p101-tang-1-khau-trang-chong-nang-p50347611.html?spid=50348115,6,-39%,Đã bán 540,Doka
Combo 7 Quần lót nam tam giác cotton xịn nhiều lưng có size lớn màu ngẫu nhiên cao cấp mặc cực thoãi mái underwear SỊP HN7,68.700₫,https://tiki.vn/combo-7-quan-lot-nam-tam-giac-cotton-xin-nhieu-lung-co-size-lon-mau-ngau-nhien-cao-cap-mac-cuc-thoai-mai-underwear-sip-hn7-p38496061.html?spid=38496140,7,-49%,Đã bán 670,Doka
Áo khoác nam áo gió vải dù ( Tặng quần lót hàng hiệu ) DOKA STORE cao cấp 2 lớp chống nắng tia UV và chống nước khoát phong cách Hàn Quốc DF20,145.000₫,https://tiki.vn/ao-khoac-nam-chong-nang-gio-thu-dong-chat-lieu-du-giu-am-cao-cap-chon-mau-p74536479.html?spid=74536487,8,-3%,Đã bán 498,Doka
"Quần Short Lửng Nam Kaki (Tặng kèm quần lót thái) Vải Cotton Mềm Mịn Lưng Thun Đai Quần Có Dây Chun Kéo, Dễ Dàng Điều Chỉnh Phù Hợp Co Giãn Cao Cấp DKQKN26",74.000₫,https://tiki.vn/quan-short-lung-nam-kaki-vai-mem-min-lung-thun-dai-quan-co-day-chun-keo-de-dang-dieu-chinh-phu-hop-co-gian-cao-cap-dkqkn26-p247444319.html?spid=249487120,9,,,Doka
,,https://tiki.vn/ao-thun-nam-ca-sa-u-ma-u-mo-i-combo-2-a-o-dbm215-p75329276.html?spid=180396670,10,,,Doka
Quần kaki dài nam ( Tặng 1 dây nịt da cao cấp ) chất vải mềm mịn chống nhăn co giãn chuẩn phong cách thời trang Doka DKMQKK01,199.000₫,https://tiki.vn/quan-kaki-dai-nam-chat-vai-mem-min-chong-nhan-co-gian-chuan-phong-cach-thoi-trang-doka-dkmqkk01-p220668927.html?spid=220668929,11,-20%,Đã bán 64,Doka
Áo khoác da nam Biker lót lông cổ bẻ cao cấp Dokafashion DAD5,319.000,https://tiki.vn/ao-khoac-da-nam-biker-lot-du-co-be-cao-cap-dokafashion-dad5-p273501645.html?spid=273501653,12,,Đã bán 1,Doka
,,https://tiki.vn/ao-thun-nam-co-be-co-tru-thuong-hieu-doka-4-chieu-cao-cap-8-mau-thiet-ke-tay-ngan-tre-trung-khoe-khoan-duong-may-ti-mi-p52251333.html?spid=54619755,13,,,Doka
Áo khoác da nam lót lông siêu ấm cao cấp DAD32,319.000₫,https://tiki.vn/ao-khoac-da-nam-lot-long-sieu-am-cao-cap-dk31-p197602003.html?spid=197602011,14,-47%,Đã bán 8,Doka
Combo 10 Quần lót nam tam giác cotton xịn nhiều lưng có size lớn màu ngẫu nhiên cao cấp mặc cực thoãi mái underwear SỊP HN10,118.000₫,https://tiki.vn/combo-10-quan-lot-nam-tam-giac-cotton-xin-nhieu-lung-co-size-lon-mau-ngau-nhien-cao-cap-mac-cuc-thoai-mai-underwear-sip-hn10-p36239714.html?spid=36461241,15,-58%,Đã bán 184,Doka
"Áo Thun Nam Cổ Bẻ Doka 4 Chiều Cao Cấp, Trẻ Trung",89.000₫,https://tiki.vn/ao-thun-nam-co-be-doka-4-chieu-cao-cap-tre-trung-xanh-co-vit-p52229237.html?spid=52229241,16,-40%,Đã bán 4,Doka
Áo khoác dù nam chống nắng mưa gió lạnh dáng dứng - DCVS103,135.000,https://tiki.vn/ao-khoa-c-du-nam-chong-nang-mua-gio-lanh-dang-dung-cau-vai-dcvs103-p40934060.html?spid=40936214,17,,,Doka
,,https://tiki.vn/ao-khoac-nam-chong-nang-gio-thu-dong-doka-dbls101-chat-lieu-du-giu-am-cao-cap-co-3-mau-den-xanh-den-xanh-reu-p17911356.html?spid=48534643,18,,,Doka
Áo khoác phao nam giữ ấm chóng gió lạnh mùa thu đông thương hiệu doka,284.000₫,https://tiki.vn/ao-phao-nam-vai-dep-phao08-p8915134.html?spid=8915144,19,-37%,Đã bán 29,Doka
Quần Short Nam Kaki Vải Mềm Mịn Lưng Thun Có Dây Chun Kéo Co Giãn Cao Cấp PSQKN26,88.800₫,https://tiki.vn/quan-short-nam-kaki-vai-mem-min-lung-thun-co-day-chun-keo-co-gian-cao-cap-psqkn26-p247447754.html?spid=247447790,20,-40%,Đã bán 6,Doka
Combo 2 Quần shorts thể thao nam ( Tặng 1 áo thun nam ngẫu nhiên theo cân nặng ) dạng sọt sport đùi chất thun lạnh 4 chiều cao cấp phù hợp tập gym hay mặc nhà màu trắng và đen DUI-P101,179.000₫,https://tiki.vn/combo-2-quan-shorts-the-thao-nam-dang-sot-sport-dui-chat-thun-lanh-4-chieu-cao-cap-phu-hop-tap-gym-hay-mac-nha-mau-trang-va-den-dui-p101-p47815627.html?spid=47815633,21,-30%,Đã bán 816,Doka
Quần shorts thể thao nam dạng sọt sport đùi chất thun lạnh 4 chiều cao cấp phù hợp tập gym hay mặc nhà có màu trắng và đen DUI-P101,75.000₫,https://tiki.vn/quan-shorts-the-thao-nam-dang-sot-sport-dui-chat-thun-lanh-4-chieu-cao-cap-phu-hop-tap-gym-hay-mac-nha-co-mau-trang-va-den-dui-p101-p47811534.html?spid=47811540,22,-35%,Đã bán 1.2k,Doka
"Áo Thun Nam Cổ Bẻ Cao Cấp DOKA, Chất liệu thun cá sấu 4 chiều ngoại nhập ( Nhiều màu )",93.000₫,https://tiki.vn/ao-thun-nam-co-be-cao-cap-doka-chat-lieu-thun-ca-sau-4-chieu-ngoai-nhap-nhieu-mau-p56506181.html?spid=56506227,23,-45%,Đã bán 24,Doka
Quần kaki nam chất vải mềm mịn chống nhăn co giãn chuẩn phong cách thời trang Doka DKQK38,246.000₫,https://tiki.vn/quan-kaki-nam-chat-vai-mem-min-chong-nhan-co-gian-chuan-phong-cach-thoi-trang-doka-dkqk38-p272230583.html?spid=272230592,24,-38%,,Doka
"Áo Thun nam mẫu mới logo trước ngực, combo 3 áo - ĐB3QC11",279.000,https://tiki.vn/ao-thun-nam-mau-moi-logo-truo-c-ngu-c-combo-3-a-o-db3qc11-p22559742.html?spid=23474532,25,,,Doka
,,https://tiki.vn/ao-khoac-da-nam-lot-long-thoi-trang-cao-cap-ps30-p197605382.html?spid=197605386,26,,,Doka
Combo 2 Quần shorts thể thao nam dạng sọt sport đùi chất thun lạnh 4 chiều cao cấp phù hợp tập gym hay mặc nhà màu trắng và đen DUI-P101 (tặng 1 ví),149.000₫,https://tiki.vn/combo-2-quan-shorts-the-thao-nam-dang-sot-sport-dui-chat-thun-lanh-4-chieu-cao-cap-phu-hop-tap-gym-hay-mac-nha-mau-trang-va-den-dui-p101-tang-1-vi-p47818905.html?spid=47818907,27,-42%,Đã bán 69,Doka
"Áo Thun Nam Cổ Bẻ Doka 4 Chiều Cao Cấp, Trẻ Trung (Nhiều Màu)",93.000₫,https://tiki.vn/ao-thun-nam-co-be-doka-4-chieu-cao-cap-tre-trung-nhieu-mau-p52251398.html?spid=52251418,28,-22%,Đã bán 134,Doka
Quần Short Jean Nam 03 Màu Cơ Bản Form Chuẩn Đẹp Có BigSize Từ 45KG - 90KG DKJean6,118.000₫,https://tiki.vn/quan-short-jean-nam-03-mau-co-ban-form-chuan-dep-co-bigsize-tu-45kg-90kg-dkjean6-p202736884.html?spid=202736886,29,-46%,Đã bán 3,Doka
"Quần lót nam cao cấp thun lạnh (Dành cho các bạn từ 47-85kg), Co giãn 4 chiều cực tốt",24.000₫,https://tiki.vn/quan-lot-nam-cao-cap-thun-lanh-danh-cho-cac-ban-tu-47-85kg-co-gian-4-chieu-cuc-tot-p56873562.html?spid=56873570,30,,,Doka
,,https://tiki.vn/ao-thun-nam-mau-moi-logo-truo-c-ngu-c-combo-3-a-o-db3qc14-p22610806.html?spid=23468548,31,,,Doka
Áo khoác da nam lộn lót lông vải mền mịn có túi trong DKD01,237.000₫,https://tiki.vn/ao-khoac-da-nam-lon-lot-long-vai-men-min-co-tui-trong-dkd01-p272241781.html?spid=272241793,32,-41%,Đã bán 1,Doka
"Bộ 3 quần lót nam cao cấp thun lạnh (Dành cho các bạn từ 47-85kg), Co giãn 4 chiều cực tốt",58.000₫,https://tiki.vn/bo-3-quan-lot-nam-cao-cap-thun-lanh-danh-cho-cac-ban-tu-47-85kg-co-gian-4-chieu-cuc-tot-p56877277.html?spid=56877279,33,-61%,Đã bán 10,Doka
"Áo Thun nam cá sấu mẫu mới, combo 4 áo - ĐB437",396.000₫,https://tiki.vn/ao-thun-nam-ca-sa-u-ma-u-mo-i-combo-4-a-o-db437-p22774390.html?spid=58019780,34,-36%,Đã bán 107,Doka
"Áo Thun nam mẫu mới, ĐB2QC03",189.000,https://tiki.vn/ao-thun-nam-ca-sa-u-ma-u-mo-i-db2qc03-p22759410.html?spid=23462521,35,,,Doka
,,https://tiki.vn/ao-khoac-da-nam-co-be-p273512583.html?spid=273512593,36,,,Doka
Áo khoác kaki nam thêu logo thời trang Hàn Quốc DAK14,199.000₫,https://tiki.vn/ao-khoac-kaki-nam-theu-logo-thoi-trang-han-quoc-dak14-p273512297.html?spid=273512309,37,-33%,,Doka
Áo khoác da nam Biker lót dù cao cấp ( Đen ) DK07,349.000₫,https://tiki.vn/ao-khoac-da-nam-biker-lot-du-cao-cap-den-dk07-p272245151.html?spid=272245157,38,-42%,Đã bán 1,Doka
"Áo thun nam cổ bẻ Doka co giản 4 chiều hàng cao cấp xuất khẩu DK119 ( Xanh môn, Xanh dương, Xám đậm )",299.000₫,https://tiki.vn/ao-thun-nam-co-be-doka-co-gian-4-chieu-hang-cao-cap-xuat-khau-dk119-xanh-mon-xanh-duong-xam-dam-p57306401.html?spid=57306431,39,-49%,Đã bán 4,Doka
Combo 2 Quần shorts thể thao nam dạng sọt sport đùi chất thun lạnh 4 chiều cao cấp phù hợp tập gym hay mặc nhà màu trắng và đen DUI-P101 (tặng 1 nón),149.000,https://tiki.vn/combo-2-quan-shorts-the-thao-nam-dang-sot-sport-dui-chat-thun-lanh-4-chieu-cao-cap-phu-hop-tap-gym-hay-mac-nha-mau-trang-va-den-dui-p101-tang-1-non-p47817097.html?spid=47817103,40,,,Doka
,,https://tiki.vn/combo-2-quan-short-ni-da-ca-2-tui-va-lung-thun-day-rut-qc-02-chat-lieu-ni-mem-mai-duong-may-tinh-te-thiet-ke-hop-thoi-trang-nhieu-mau-p55892441.html?spid=56098542,41,,,Doka
Áo khoác da nam lót lông siêu ấm cao cấp cấp DAD26,319.000₫,https://tiki.vn/ao-khoac-da-nam-lot-long-sieu-am-cao-cap-cap-dk28-p197601289.html?spid=197601293,42,-47%,,Doka
