title,price,link_item,index,discount,sales,category
Bộ Áo Thun Đôi Milk & You Màu Trắng Nam Nữ M,225.000₫,https://tiki.vn/bo-ao-thun-doi-milk-you-mau-trang-nam-nu-p11095683.html?spid=11095748,1,,,dodoi
Bộ Áo Thun Đôi Love Like Crazy Màu Trắng Nam Nữ S,159.000₫,https://tiki.vn/bo-ao-thun-doi-love-like-crazy-mau-trang-nam-nu-p11097154.html?spid=11097170,2,,,dodoi
Bộ Áo Thun Đôi Mèo Boy Màu Trắng Nam Nữ XXL,159.000₫,https://tiki.vn/bo-ao-thun-doi-meo-boy-mau-trang-nam-nu-p11100021.html?spid=11100103,3,,,dodoi
Bộ Áo Thun Đôi Chipi Dâu Rể Funny Màu Trắng Nam Nữ,159.000,https://tiki.vn/bo-ao-thun-doi-chipi-dau-re-funny-mau-trang-nam-nu-p11098591.html?spid=11098651,4,,,dodoi
,,https://tiki.vn/bo-ao-thun-doi-cho-deo-kinh-cute-mau-trang-nam-nu-p11105019.html?spid=11105117,5,,,dodoi
Bộ Áo Thun Đôi Mickey Mouse Màu Trắng Nam Nữ,159.000₫,https://tiki.vn/bo-ao-thun-doi-mickey-mouse-mau-trang-nam-nu-p11120259.html?spid=11120273,6,,Đã bán 6,dodoi
Bộ Áo Thun Đôi Chipi Cặp Đôi Ngộ Nghĩnh Màu Trắng Nam Nữ,159.000₫,https://tiki.vn/bo-ao-thun-doi-chipi-cap-doi-ngo-nghinh-mau-trang-nam-nu-p11103339.html?spid=11103415,7,,Đã bán 3,dodoi
Bộ Áo Thun Đôi Meow Cute Màu Trắng Nam Nữ,159.000₫,https://tiki.vn/bo-ao-thun-doi-meow-cute-mau-trang-nam-nu-p11104602.html?spid=11104626,8,,,dodoi
Đồ đôi đi biển cho gia đình - HÀNG LOẠI 1- giá 1 bộ luôn quần và áo,109.000,https://tiki.vn/do-doi-di-bien-cho-gia-dinh-hang-loai-1-gia-1-bo-luon-quan-va-ao-p248270882.html?spid=248272539,9,,,dodoi
,,https://tiki.vn/ao-thun-nam-nu-couple-khung-long-heart-gia-chi-bao-gom-1-ao-giao-mau-ngau-nhien-p97866669.html?spid=97866695,10,,,dodoi
(HOT) BST Áo sơ mi đôi họa tiết cao cấp | sơ mi cặp nam nữ đẹp (giá 1 áo) | Áo Chất Store,99.000₫,https://tiki.vn/hot-bst-ao-so-mi-doi-hoa-tiet-cao-cap-so-mi-cap-nam-nu-dep-gia-1-ao-ao-chat-store-p90416853.html?spid=273449703,11,,,dodoi
"Áo Thun cặp Nam-Nữ in HÌNH MÈO_ THỎ cực dễ thương , thích hợp cho các cặp đôi trẻ trung, năng động, cho các nhóm bạn đi đêm, đi phượt, bão, nhìn đã mắt, bao ngầu, bao chất",110.000,https://tiki.vn/ao-thun-cap-nam-nu-in-hinh-meo_-tho-cuc-de-thuong-thich-hop-cho-cac-cap-doi-tre-trung-nang-dong-cho-cac-nhom-ban-di-dem-di-phuot-bao-nhin-da-mat-bao-ngau-bao-chat-p68888060.html?spid=79662972,12,,,dodoi
,,https://tiki.vn/a-o-gia-di-nh-a-o-nho-m-di-bie-n-do-doi-p207329799.html?spid=207329817,13,,,dodoi
"Áo Đôi Nỉ Nam Nữ MM05, Áo Đôi Có Mũ In Hình Ghép Tim ý Nghĩa, Vải Nỉ Bông In Hình Dễ Thương - HAI TRẮNG",129.000₫,https://tiki.vn/ao-doi-ni-nam-nu-mm05-ao-doi-co-mu-in-hinh-ghep-tim-y-nghia-vai-ni-bong-in-hinh-de-thuong-p248326786.html?spid=248326790,14,,,dodoi
"Đồ Đôi Nỉ Có Mũ MM18, Áo Đôi Nam Nữ In Khủng Long Cắn Đuôi ý Nghĩa, Vải Nỉ Bông In Hình Dễ Thương - HAI TRẮNG",129.000₫,https://tiki.vn/do-doi-ni-co-mu-mm18-ao-doi-nam-nu-in-khung-long-can-duoi-y-nghia-vai-ni-bong-in-hinh-de-thuong-p248326608.html?spid=248326620,15,,,dodoi
"Áo Đôi Đẹp Nam Nữ Mùa Hè TT02, Áo Đôi Với Người Yêu In Đệ Xếp ý Nghĩa - HAI TRẮNG",98.000₫,https://tiki.vn/ao-doi-dep-nam-nu-mua-he-tt02-ao-doi-voi-nguoi-yeu-in-de-xep-y-nghia-p248327817.html?spid=248327819,16,,,dodoi
"Áo Đôi Phông Rộng TT18, Áo Thun Nam Nữ In Nhịp Tim ý Nghĩa - HAI TRẮNG",98.000₫,https://tiki.vn/ao-doi-phong-rong-tt18-ao-thun-nam-nu-in-nhip-tim-y-nghia-p248326843.html?spid=248326845,17,,,dodoi
,,https://tiki.vn/ao-doi-dep-nam-nu-mua-he-tt17-ao-doi-voi-nguoi-yeu-in-neu-em-di-y-nghia-p248326890.html?spid=248326892,18,,,dodoi
"Pin Tiểu AA và AAA Dùng Cho Nhiều Sản Phẩm Siêu Bền, Dung Lượng Cao",2.500₫,https://tiki.vn/pin-tieu-aa-va-aaa-dung-cho-nhieu-san-pham-sieu-ben-dung-luong-cao-p203694844.html?spid=205229711,19,,Đã bán 11,dodoi
Vỏ Gối Chống Trào Ngược Cho Bé Cao Cấp Thiết Kế 2 Khóa Kéo Thông Minh,159.000₫,https://tiki.vn/vo-goi-chong-trao-nguoc-cho-be-cao-cap-thiet-ke-2-khoa-keo-thong-minh-p204425750.html?spid=272457946,20,,,dodoi
Áo thun đôi cộc tay nam nữ chữ TONY kèm mũ ATN699,175.000₫,https://tiki.vn/ao-thun-doi-coc-tay-nam-nu-chu-tony-kem-mu-atn699-p188127448.html?spid=188127454,21,,,dodoi
Hộp kim chỉ đa năng 55 món - Hộp lớn,50.000₫,https://tiki.vn/hop-kim-chi-da-nang-55-mon-hop-lon-p145093525.html?spid=145093528,22,,Đã bán 6,dodoi
Áo đôi nam nữ đẹp ️️ Đồ cặp đôi dễ thương chụp ảnh cưới đi biển nam nữ Hàn Quốc Couple AV54,299.000₫,https://tiki.vn/ao-doi-nam-nu-dep-freeship-do-cap-doi-de-thuong-chup-anh-cuoi-di-bien-nam-nu-han-quoc-couple-av54-p96238451.html?spid=100528697,23,,Đã bán 5,dodoi
Áo thun BÔC ĐẦU PHAN QUANG 7 MÀU áo đôi nam nữ tay lỡ form rộng unisex,51.000₫,https://tiki.vn/ao-thun-boc-dau-phan-quang-7-mau-ao-doi-nam-nu-tay-lo-form-rong-unisex-p100532050.html?spid=100532053,24,,,dodoi
"áo điệu viền bèo 1665 - xanh dương,freesize dưới 55kg",200.000,https://tiki.vn/ao-dieu-vien-beo-1665-p192384978.html?spid=192385001,25,,,dodoi
,,https://tiki.vn/ao-da-p212602777.html?spid=212602778,26,,,dodoi
Áo đôi: Đầm vải lệch vai họa tiết + Somi nam phối hợp,400.000₫,https://tiki.vn/ao-doi-dam-vai-lech-vai-hoa-tiet-somi-nam-phoi-hop-p105336910.html?spid=105336979,27,,,dodoi
"áo dạ 2 màu mã a23 - Đen,freesize dưới 65kg",535.500₫,https://tiki.vn/ao-da-2-mau-ma-a23-p192386578.html?spid=192386580,28,,,dodoi
Áo Thun Cặp Đôi In Logo Tim Xanh Đơn Gỉan,89.000₫,https://tiki.vn/ao-thun-cap-doi-in-logo-tim-xanh-don-gian-p202486124.html?spid=202486216,29,,,dodoi
Hoodie Unisex nam nữ,300.000,https://tiki.vn/hoodie-unisex-nam-nu-p105337557.html?spid=105338870,30,,,dodoi
,,https://tiki.vn/vay-doi-so-mi-nam-dap-ren-co-size-xxl-nam-p105336708.html?spid=105337084,31,,,dodoi
Áo gia đình thun cá sấu,158.000₫,https://tiki.vn/ao-gia-dinh-thun-ca-sau-p149068026.html?spid=149068145,32,,,dodoi
Áo thun gia đình giá rẻ size 8-100kg,136.500₫,https://tiki.vn/ao-thun-gia-dinh-gia-re-size-8-100kg-p149069129.html?spid=149069174,33,,,dodoi
"Áo thun đôi áo thun nữ nam áo cặp nam nữ, áo tình nhân nam nữ, áo tay lỡ nam nữ, áo bigsize nam nữ",110.000₫,https://tiki.vn/ao-thun-doi-ao-thun-nu-nam-ao-cap-nam-nu-ao-tinh-nhan-nam-nu-ao-tay-lo-nam-nu-ao-bigsize-nam-nu-p106655850.html?spid=106655868,34,,Đã bán 2,dodoi
Áo thun polo cổ bẻ xanh (có bán lẻ),100.000,https://tiki.vn/ao-thun-polo-co-be-xanh-co-ban-le-p105337289.html?spid=105337532,35,,,dodoi
,,https://tiki.vn/quan-doi-di-bien-xinh-xan-p248271453.html?spid=248271734,36,,,dodoi
Áo thun tay dài viền đen tay túi (có bán lẻ),120.000₫,https://tiki.vn/ao-thun-tay-dai-vien-den-tay-tui-co-ban-le-p105336405.html?spid=105336486,37,,,dodoi
Áo Thun Gia Đình Tay Ngắn Cầu Vòng 7 Màu,26.100₫,https://tiki.vn/ao-thun-gia-dinh-tay-ngan-cau-vong-7-mau-p202486076.html?spid=202486198,38,,,dodoi
Áo Lớp - Đồng Phục - Bùng Nổ Đạp Đổ Thách Thức,25.000₫,https://tiki.vn/ao-lop-dong-phuc-bung-no-dap-do-thach-thuc-p105550285.html?spid=105551291,39,,,dodoi
Áo Get out of my life ÁO THUN IN CHỮ FORM RỘNG BASIC ĐI HỌC ĐI CHƠI UNISEX,81.000₫,https://tiki.vn/ao-get-out-of-my-life-ao-thun-in-chu-form-rong-basic-di-hoc-di-choi-unisex-p193095715.html?spid=193095719,40,,,dodoi
