title,price,link_item,index,discount,sales,brand
"Nồi Nấu Lẩu Điện Mini 3 Tầng Đa Năng Bear DHG-B25V1 (Bản Quốc Tế)(2.5L) (Kèm Lồng Hấp), nấu , hấp, lẩu, Chiên, Xào hầm )- Hàng chính hãng",807.500₫,https://tiki.vn/noi-nau-lau-dien-mini-3-tang-da-nang-bear-dhg-b25v1-ban-quoc-te-2-5l-kem-long-hap-nau-hap-lau-chien-xao-ham-p188691948.html?spid=271916424,1,-5%,,Bear
"Nồi nấu chậm đa năng Bear DDZ-C10V1 - Đa chức năng, nhiều phụ kiện - Hàng chính hãng",1.190.000₫,https://tiki.vn/noi-nau-cham-da-nang-bear-ddz-c10v1-da-chuc-nang-nhieu-phu-kien-hang-chinh-hang-p270117036.html?spid=270117037,2,-5%,,Bear
"Máy xay sinh tố đa năng 3 cối xay Bear xay sinh tố, xay thịt, xay đồ ăn dặm, Anh Lam Store - Hàng nhập khẩu",759.050₫,https://tiki.vn/may-xay-sinh-to-da-nang-3-coi-xay-bear-xay-sinh-to-xay-thit-xay-do-an-dam-anh-lam-store-p248703792.html?spid=248703794,3,,,Bear
"Máy xay thực phẩm đa năng Bear QSJ-C03B1 - Chế biến thực phẩm nhanh, gọn và hiệu quả - Hàng chính hãng",799.000,https://tiki.vn/may-xay-thuc-pham-da-nang-bear-qsj-c03b1-che-bien-thuc-pham-nhanh-gon-va-hieu-qua-hang-chinh-hang-p270123196.html?spid=270123197,4,,,Bear
,,https://tiki.vn/noi-nau-da-nang-bear-dhg-b25z1-2-5l-co-long-hap-p105731992.html?spid=105731997,5,,,Bear
"Ấm Siêu Tốc 1,7L Bear Công Suất Lớn, Bình Đun Nước Nóng Nhanh, Bền Bỉ ZDH-Q17B1 - Hàng Chính Hãng Bảo Hành 18 Tháng",690.000₫,https://tiki.vn/am-pha-tra-sieu-toc-1-7l-bear-cong-suat-lon-binh-dun-nuoc-nong-nhanh-ben-bi-zdh-q17b1-p248939556.html?spid=248939557,6,-11%,,Bear
"Máy Xay Thịt Bear 2.5L Đa Năng Xay Tỏi Ớt, Xay Đồ Ăn Dặm Cho Bé Động Cơ Mạnh Mẽ - QSJ-C04R8S - Hàng Chính Hãng Bảo Hành 18 Tháng",250.000₫,https://tiki.vn/may-xay-thit-bear-2-5l-da-nang-xay-toi-ot-xay-do-an-dam-cho-be-dong-co-manh-me-qsj-c04r8s-p248939525.html?spid=248939534,7,,,Bear
Máy Hút Chân Không Thực Phẩm Bear Hàn Miêng Túi Áp Suất Mạnh - VS-B01V1 - Hàng Chính Hãng Bảo Hành 18 Tháng,1.490.000₫,https://tiki.vn/may-hut-chan-khong-thuc-pham-bear-han-mieng-tui-ap-suat-manh-vs-b01v1-p249035873.html?spid=249035874,8,,,Bear
Nồi điện đa năng Bear DRG-E15P2 1.6L - Hàng chính hãng,512.000,https://tiki.vn/noi-dien-da-nang-bear-drg-e15p2-1-6l-hang-chinh-hang-p273640342.html?spid=273640343,9,,,Bear
,,https://tiki.vn/may-xay-sinh-to-cam-tay-bear-llj-b03c1-dung-tich-300ml-luoi-dao-kep-xay-manh-de-mang-theo-su-dung-hang-chinh-hang-p273171128.html?spid=273171129,10,-5%,,Bear
"Máy phun sương tạo ẩm Bear JSQ-C50Q1 - Dung tích 4.5L, Dùng cho phòng diện tích 25-35m2, Không tiếng ồn - Bản Quốc tế, Hàng chính hãng",759.000₫,https://tiki.vn/may-phun-suong-tao-am-bear-jsq-c50q1-dung-tich-4-5l-dung-cho-phong-dien-tich-25-35m2-khong-tieng-on-ban-quoc-te-p273667683.html?spid=273667684,11,-10%,,Bear
"Bàn ủi hơi nước cầm tay Bear GTJ-A12Z2 - Công suất 1200W, nhanh nóng chỉ trong 30s, lực phun hơi nước mạnh - HÀNG CHÍNH HÃNG",999.000,https://tiki.vn/ban-ui-hoi-nuoc-cam-tay-bear-gtj-a12z2-cong-suat-1200w-nhanh-nong-chi-trong-30s-luc-phun-hoi-nuoc-manh-hang-chinh-hang-p273927763.html?spid=273927764,12,-51%,,Bear
,,https://tiki.vn/may-xay-sinh-to-mini-bear-llj-e05j1-dung-tich-350ml-kem-coc-giu-nhiet-inox-num-van-dieu-chinh-toc-do-hang-chinh-hang-p273929089.html?spid=273929090,13,-8%,,Bear
Máy xay đa năng Bear QSJ-B02U2 - Hàng chính hãng,699.000₫,https://tiki.vn/may-xay-da-nang-bear-qsj-b02u2-hang-chinh-hang-p180380697.html?spid=180380698,14,-50%,Đã bán 4,Bear
"Máy vắt cam Bear CZJ-A04B1 - Tiện dụng, nhanh gọn, chống rỉ - Hàng chính hãng",499.000₫,https://tiki.vn/may-vat-cam-bear-czj-a04b1-tien-dung-nhanh-gon-chong-ri-hang-chinh-hang-p270126936.html?spid=270126937,15,,,Bear
"Nồi Lẩu Điện Đa Năng BEAR DHG-B25B2 (2,5L) – Sản Phẩm HOT. HÀNG CHÍNH HÃNG",860.000₫,https://tiki.vn/noi-lau-dien-da-nang-dhg-b25b2-2-5l-san-pham-hot-p253525878.html?spid=253525879,16,,,Bear
"Máy xay thịt Bear QSJ-B02U2, dung tích 600ml, Anh Lam Store - Hàng nhập khẩu",499.000,https://tiki.vn/may-xay-thit-bear-qsj-b02u2-dung-tich-600ml-anh-lam-store-p248703727.html?spid=248703728,17,-33%,,Bear
,,https://tiki.vn/bep-lau-nuong-da-nang-bear-dkl-c12d1-da-dang-phong-cach-nau-nuong-cung-bep-lau-nuong-bear-hang-chinh-hang-p270120585.html?spid=270120645,18,-41%,,Bear
"Combo Nồi Nấu Chậm 1,6L SUBE002 + Máy Xay Ăn Dặm 0,3L B03V2chưng yến dinh dưỡng, tiện dụng - Hàng Chính Hãng",1.648.250₫,https://tiki.vn/combo-noi-nau-cham-1-6l-sube002-may-xay-an-dam-0-3l-b03v2-nau-chao-chung-yen-do-an-dam-dinh-duong-tien-dung-hang-chinh-hang-p176151029.html?spid=217739868,19,-25%,,Bear
"Máy xay thịt Bear 2.5L QSJ-C04R8S, máy xay tỏi ớt, xay thịt siêu nhanh- Hàng chính hãng",677.000₫,https://tiki.vn/may-xay-thit-bear-2-5l-qsj-c04r8s-may-xay-toi-ot-xay-thit-sieu-nhanh-hang-chinh-hang-p197718630.html?spid=247669225,20,,,Bear
"Máy Xay Sinh Tố Đa Năng BEAR BL-B35V1 Công Suất 50W Chống Ồn, Tiện Lợi Dùng Pin Sạc, Nhỏ Gọn - HÀNG CHÍNH HÃNG",442.000₫,https://tiki.vn/may-xay-sinh-to-da-nang-bear-bl-b35v1-cong-suat-50w-chong-on-tien-loi-dung-pin-sac-nho-gon-hang-chinh-hang-p176057479.html?spid=176057480,21,-16%,Đã bán 126,Bear
"Nồi hấp 3 tầng đa năng Bear DZG-CA2D1 - Dung tích 12L, 6 chức năng nấu, Cài đặt hẹn giờ - Hàng chính hãng, Bản quốc tế",1.090.000₫,https://tiki.vn/noi-hap-3-tang-da-nang-bear-dzg-ca2d1-dung-tich-12l-6-chuc-nang-nau-cai-dat-hen-gio-hang-chinh-hang-ban-quoc-te-p273669520.html?spid=273669521,22,-27%,,Bear
Máy Xay Sinh Tố Đa Năng 3 Trong 1 BEAR BL-B10V2 - Hàng Chính Hãng,588.000₫,https://tiki.vn/may-xay-sinh-to-da-nang-3-trong-1-bear-bl-b10v2-hang-chinh-hang-p124631929.html?spid=197206334,23,,Đã bán 31,Bear
Nồi Áp Suất Điện Tử Đa Năng BEAR YLB-A50M1 5L Áp Suất 70KPa Công Suất 900W Bản Quốc Tế - Hàng Chính Hãng,1.749.000₫,https://tiki.vn/noi-ap-suat-dien-tu-da-nang-bear-ylb-a50m1-5l-ap-suat-70kpa-cong-suat-900w-ban-quoc-te-hang-chinh-hang-p166051915.html?spid=166051916,24,,,Bear
"Bình Đun Nước Thông Minh Kiêm Chưng Yến, Nấu Chè Sâm Bổ Lượng, Thuốc Bắc Và Pha Trà Đa Năng BEAR YSH-C15Q5 Dung Tích 1.5 Lít Công Suất 1000W - Hàng Chính Hãng",1.048.800,https://tiki.vn/may-chung-yen-nau-che-sam-bo-luong-thuoc-bac-va-pha-tra-da-nang-bear-ysh-c15q5-1-5l-cong-suat-1000w-ban-quoc-te-hang-chinh-hang-p166079879.html?spid=221222681,25,,,Bear
,,https://tiki.vn/may-nuong-banh-mi-sandwich-bear-dsl-601-p270051968.html?spid=271780803,26,,,Bear
"Nồi Chiên Không Dầu Bear 10L Kiểu Dáng Lò Chiên, Công Nghệ Air Bomb Chiên Không Dầu - A15V1 - Hàng Chính Hãng Bảo hành 18 Tháng",3.990.000₫,https://tiki.vn/noi-chien-khong-dau-bear-10l-kieu-dang-lo-chien-cong-nghe-air-bomb-chien-khong-dau-a15v1-hang-chinh-hang-bao-hanh-18-thang-p248651442.html?spid=248651452,27,,,Bear
Máy xay thực phẩm Bear QSJ-B01P1- Hàng chính hãng,699.000₫,https://tiki.vn/may-xay-thuc-pham-bear-qsj-b01p1-hang-chinh-hang-p192276543.html?spid=192276544,28,,Đã bán 1,Bear
Nồi cơm điện Bear DFB-B12W1 - Hàng nhập khẩu chính hãng,640.000₫,https://tiki.vn/noi-com-dien-bear-dfb-b12w1-hang-nhap-khau-chinh-hang-p271972338.html?spid=271966664,29,,,Bear
Máy đánh trứng cầm tay Bear DDQ-B01F7 - Hàng Chính Hãng,479.000,https://tiki.vn/may-danh-trung-cam-tay-bear-ddq-b01f7-hang-chinh-hang-p273302230.html?spid=273302231,30,,,Bear
,,https://tiki.vn/noi-lau-dien-da-nang-bear-dhg-c40m1-dung-tich-4l-dung-de-chien-xao-hap-luoc-hang-chinh-hang-p200679125.html?spid=200679126,31,,,Bear
Máy Phun Sương Tạo Ẩm Bear Bộ Lọc Ion Bạc Diệt Khuẩn JSQ-C45U1 - Hàng chính hãng,690.000₫,https://tiki.vn/may-phun-suong-tao-am-bear-bo-loc-ion-bac-diet-khuan-jsq-c45u1-hang-chinh-hang-p213954258.html?spid=213954259,32,,,Bear
Nồi nấu chậm đa năng Bear DDZ-A08T8 - Hàng chính hãng,472.000₫,https://tiki.vn/noi-nau-cham-da-nang-bear-ddz-a08t8-hang-chinh-hang-p273640662.html?spid=273640676,33,,,Bear
Nồi cơm điện tử Bear DFB-P50E1 - Hàng Chính Hãng,1.490.000₫,https://tiki.vn/noi-com-dien-tu-bear-dfb-p50e1-hang-chinh-hang-p271693424.html?spid=271693425,34,,,Bear
Nồi nấu chậm Bear 0.8 lít DDZ-A08T8 - Hàng chính hãng,799.000,https://tiki.vn/noi-nau-cham-bear-0-8-lit-ddz-a08t8-hang-chinh-hang-p208740637.html?spid=208740639,35,,,Bear
,,https://tiki.vn/noi-nau-cham-0-8l-bear-sube001-phien-ban-quoc-te-kem-long-hap-hang-chinh-hang-p75619883.html?spid=248590753,36,,,Bear
"Bếp điện từ Bear DCL-A22Q5 - 8 mức nhiệt độ, Màn hình cảm ứng, Công suất 2000W - Hàng chính hãng, Bản Quốc tế",1.090.000₫,https://tiki.vn/bep-dien-tu-bear-dcl-a22q5-8-muc-nhiet-do-man-hinh-cam-ung-cong-suat-2000w-hang-chinh-hang-ban-quoc-te-p273669442.html?spid=273669443,37,,,Bear
Máy xay nấu đa năng cách âm Bear PBJ-B06S2 - Hàng chính hãng,2.339.000₫,https://tiki.vn/may-xay-nau-da-nang-cach-am-bear-pbj-b06s2-hang-chinh-hang-p197496648.html?spid=197496649,38,,,Bear
Máy Xay Thực Phẩm Mini Bear LLJ-B03C1 - Phiên Bản Quốc Tế - Hàng Chính Hãng,659.000₫,https://tiki.vn/may-xay-thuc-pham-mini-bear-llj-b03c1-phien-ban-quoc-te-hang-chinh-hang-p77284900.html?spid=201390597,39,,Đã bán 1,Bear
"Máy nhào bột tự động Bear DM-B50V1 - Trộn tự động, đa năng - Hàng nhập khẩu",1.780.000,https://tiki.vn/may-nhao-bot-tu-dong-bear-dm-b50v1-tron-tu-dong-da-nang-hang-nhap-khau-p167442349.html?spid=273161339,40,,,Bear
