title,price,link_item,index,discount,sales,category
Quần Short Nữ Năng Động,69.000₫,https://tiki.vn/quan-short-nu-nang-dong-p16255494.html?spid=115765629,1,,Đã bán 2,quannu
Quần short ống rộng cạp cao lưng thun màu đen CRQ014,83.700₫,https://tiki.vn/quan-short-ong-rong-cap-cao-lung-thun-mau-den-crq014-p155181508.html?spid=155181543,2,,Đã bán 1,quannu
Quần Jogger Basic Ulzzang Unisex Jogger Trơn Dây Rút Lai Ống Rộng Màu Trắng - MM,120.900₫,https://tiki.vn/quan-jogger-basic-ulzzang-unisex-jogger-tron-day-rut-lai-ong-rong-mau-trang-mm-p153981111.html?spid=153981117,3,,Đã bán 2,quannu
DOTTIE - Quần túi hộp lưng thấp - Beige - Q0306,549.000,https://tiki.vn/dottie-quan-tui-hop-lung-thap-beige-q0306-p249204108.html?spid=249204112,4,,,quannu
,,https://tiki.vn/quan-jeans-nu-ong-loe-dai-lung-sieu-cao-p252712606.html?spid=252712676,5,,,quannu
Quần Jeans Nữ Lưng Cao Co Giãn Siêu đẹp,249.000₫,https://tiki.vn/quan-jeans-nu-lung-cao-co-gian-sieu-dep-p252713212.html?spid=252713234,6,,,quannu
"Quần Jean dài cạp cao, quần jean dài ống suông, quần jean nữ phong cách ulzzang_J12",149.000₫,https://tiki.vn/quan-jean-dai-cap-cao-quan-jean-dai-ong-suong-quan-jean-nu-phong-cach-ulzzang_j12-p193243478.html?spid=193243501,7,,,quannu
Quần tuxedo phong cách hip hop Mã: QD1825 - ĐEN,255.000₫,https://tiki.vn/quan-tuxedo-phong-cach-hip-hop-ma-qd1825-den-p12330724.html?spid=12330725,8,,,quannu
Quần lanh DÀI Alibaba_Vũ điệu cuộc sống,69.000₫,https://tiki.vn/quan-lanh-dai-alibaba_vu-dieu-cuoc-song-p51041066.html?spid=83607382,9,,,quannu
,,https://tiki.vn/quan-ke-caro-moi-dang-suong-ong-rong-unisex-quan-cuttlotes-ke-caro-ong-rong-p81932390.html?spid=84913461,10,,,quannu
Quần short nữ giả váy chỉ nổi siêu Hot_m096 ulzzang nữ tính,89.000₫,https://tiki.vn/quan-short-nu-gia-vay-chi-noi-sieu-hot_m096-ulzzang-nu-tinh-mau-den-trang-be-nau-tay-aloha-p193893556.html?spid=193893568,11,,,quannu
"Quần đùi mặc nhà nữ ,Quần short nữ cạp chun có dây buộc chất đũi mát mặc đi biển, đi chơi mùa hè HB36",131.000,https://tiki.vn/quan-dui-mac-nha-nu-quan-short-nu-cap-chun-co-day-buoc-chat-dui-mat-mac-di-bien-di-choi-mua-he-hb36-p176885835.html?spid=176885851,12,,,quannu
,,https://tiki.vn/quan-legging-nu-cap-lien-dui-lung-ngo-chat-thun-cao-cap-phong-cach-tre-trung-12xnc2002ob-p254141755.html?spid=270790407,13,,,quannu
Quần jogger nữ bo gấu vải đũi xước siêu mát Quần bo ống nữ mùa hè Banamo Fashion 826,91.000₫,https://tiki.vn/quan-jogger-nu-bo-gau-vai-dui-xuoc-sieu-mat-quan-bo-ong-nu-mua-he-banamo-fashion-826-p121473630.html?spid=121473661,14,,Đã bán 3,quannu
Quần Suông Trắng From Dài Thanh Lịch Cho Quý Cô Công Sở,124.000₫,https://tiki.vn/quan-suong-trang-from-dai-thanh-lich-cho-quy-co-cong-so-p101532122.html?spid=101532409,15,,Đã bán 1,quannu
Quần jeans ống đứng nữ lưng cao Aaa Jeans Xanh Sky,499.000₫,https://tiki.vn/quan-jeans-ong-dung-nu-lung-cao-aaa-jeans-xanh-sky-p203986620.html?spid=203986624,16,,Đã bán 2,quannu
quần tây nữ cao cấp hàng nhập,135.000,https://tiki.vn/quan-tay-nu-cao-cap-hang-nhap-p30704368.html?spid=56383691,17,,,quannu
,,https://tiki.vn/quan-jeans-dai-ong-suong-nu-giordano-05410015-p206335407.html?spid=206335411,18,,,quannu
"Quần short đũi thêu chữ chất mềm mịn, dày dặn",43.700₫,https://tiki.vn/quan-short-dui-theu-chu-chat-mem-min-day-dan-p106602272.html?spid=111198822,19,,Đã bán 153,quannu
Bộ lanh ngố_Bộ lanh lửng mặc nhà mùa hè,199.000₫,https://tiki.vn/bo-lanh-ngo_bo-lanh-lung-mac-nha-mua-he-p263100680.html?spid=263100698,20,,,quannu
Quần vải ống loe xẻ trước cạp cao dáng xinh thời trang Banamo Fashion quần loe xẻ gấu 435,98.000₫,https://tiki.vn/quan-vai-ong-loe-xe-truoc-cap-cao-dang-xinh-thoi-trang-banamo-fashion-quan-loe-xe-gau-435-p183745169.html?spid=183745269,21,,Đã bán 2,quannu
QUẦN JEAN BAGGY ĐEN RÁCH CẠP CAO TÔN DÁNGmã 3130,128.700₫,https://tiki.vn/quan-jean-baggy-den-rach-cap-cao-ton-dangma-3130-p92663932.html?spid=92663963,22,,,quannu
Quần kẻ caro ống rộng dáng suông phong cách thời trang,108.000₫,https://tiki.vn/quan-ke-caro-ong-rong-dang-suong-phong-cach-thoi-trang-p104407005.html?spid=104407013,23,,,quannu
yếm bò khuy chân siêu đẹp,155.000₫,https://tiki.vn/yem-bo-khuy-chan-sieu-dep-p119904375.html?spid=119904379,24,,,quannu
Quần KaKi Nam Nữ Co Giãn Ống Rộng Dáng Công Sở Thiết Kế Lưng Thun Dáng 4 Màu Đen Kem Xám Xanh Rêu - TÂM SHOP,68.000₫,https://tiki.vn/quan-kaki-nam-nu-co-gian-ong-rong-dang-cong-so-thiet-ke-lung-thun-dang-4-mau-den-kem-xam-xanh-reu-tam-shop-p249233749.html?spid=249233783,25,,,quannu
,,https://tiki.vn/quan-baggy-nu-lung-v-tui-coi-truoc-6-mau-quan-tay-nu-cong-so-chat-tuyet-mua-thoi-trang-banamo-fashion-8328-p196332243.html?spid=196332296,26,,,quannu
Quần Ống Rộng Lưng Cao Cá Tính Theo Phong Cách Hàn Quốc C33,98.000₫,https://tiki.vn/quan-ong-rong-lung-cao-ca-tinh-theo-phong-cach-han-quoc-c33-p110897663.html?spid=110898694,27,,Đã bán 1,quannu
"Quần đùi nữ, Quần Nữ, Quần short nữ, Quần kaki túi hộp ( Mát - Nhẹ Như Không)",58.000₫,https://tiki.vn/quan-dui-nu-quan-nu-quan-short-nu-quan-kaki-tui-hop-mat-nhe-nhu-khong-p113065078.html?spid=141963532,28,,Đã bán 4,quannu
Quần Jean Nữ Ống Loe Lưng Cao Co Giãn Trơn Dài Quá Gót Gấu Thường CT Jeans,500.000₫,https://tiki.vn/quan-jean-nu-ong-loe-lung-cao-co-gian-tron-dai-qua-got-gau-thuong-ct-jeans-p180866825.html?spid=180866841,29,,,quannu
Quần Baggy Nữ Công Sở Cao Cấp LUPERI Vải Không Nhăn Không Xù Không Cắn Chỉ LFQD285,545.000,https://tiki.vn/quan-baggy-nu-cong-so-cao-cap-luperi-vai-khong-nhan-khong-xu-khong-can-chi-lfqd285-p168310277.html?spid=168310291,30,,,quannu
,,https://tiki.vn/quan-baggy-vat-3-cuc-lech-hang-thiet-ke_-ma-157-p104664986.html?spid=104665283,31,,,quannu
"Quần Ống Rộng MAKKA cạp cao thắt dây cực xinh, quần tây công sở suông dài MAKKA",189.000₫,https://tiki.vn/quan-ong-rong-makka-cap-cao-that-day-cuc-xinh-quan-tay-cong-so-suong-dai-makka-p194446149.html?spid=194446209,32,,,quannu
Quần ống loe dáng suông cạp cao chất nhung tăm hàng thiết kế thời trang Banamo Fashion quần loe nhung tăm 451,198.000₫,https://tiki.vn/quan-ong-loe-dang-suong-cap-cao-chat-nhung-tam-hang-thiet-ke-thoi-trang-banamo-fashion-quan-loe-nhung-tam-451-p198199548.html?spid=198199566,33,,,quannu
quần ống rộng khóa trước màu tím chất tuyết mưa,84.000₫,https://tiki.vn/quan-ong-rong-khoa-truoc-mau-tim-chat-tuyet-mua-p93045907.html?spid=110458951,34,,Đã bán 8,quannu
Quần Legging Giả Jean - Ảnh Thật,79.000₫,https://tiki.vn/quan-legging-gia-jean-anh-that-p150225993.html?spid=150226017,35,,,quannu
,,https://tiki.vn/quan-cong-so-nu-cap-cao-ong-xe-thoi-trang-eden-q014-p106119755.html?spid=106119769,36,,,quannu
Quần Kaki nữ xinh sắn - QUẦN kAKI NỮ TRƠN,110.000₫,https://tiki.vn/quan-kaki-nu-xinh-san-quan-kaki-nu-tron-p78542234.html?spid=78542247,37,,,quannu
Quần Jeans Lụa Nữ Màu Đen Thêu Lưng Thời Trang,351.000₫,https://tiki.vn/quan-jeans-lua-nu-mau-den-theu-lung-thoi-trang-p83605828.html?spid=83605872,38,,Đã bán 3,quannu
Quần legging nữ đẹp hàn quốc mã TT17 kiểu dáng bó ống chất liệu vải cao cấp cho dân văn phòng đi làm,134.000₫,https://tiki.vn/quan-legging-nu-dep-han-quoc-ma-tt17-kieu-dang-bo-ong-chat-lieu-vai-cao-cap-cho-dan-van-phong-di-lam-p74261410.html?spid=92020395,39,,,quannu
Quần suông ống rộng - đen,99.000₫,https://tiki.vn/quan-suong-ong-rong-den-p16991402.html?spid=96446407,40,,,quannu
