title,price,link_item,index,discount,sales,category
️QUẦN LEGGING NÂNG MÔNG ️,70.000₫,https://tiki.vn/quan-legging-nang-mong-p150226399.html?spid=150226413,1,-60%,,quannu
Quần Suông Nữ Thời Trang HNOSS Phối Lai Nẹp Trụ HNQDA021,199.000₫,https://tiki.vn/quan-suong-nu-thoi-trang-hnoss-phoi-lai-nep-tru-hnqda021-p204988872.html?spid=204988889,2,,,quannu
Quần xuông ống rộng thắt nơ 1 bên loại đẹp 972,101.000₫,https://tiki.vn/quan-xuong-ong-rong-that-no-1-ben-loai-dep-972-p194832935.html?spid=194832968,3,,,quannu
Quần legging nữ chất thoáng mát (Đen Nhám),75.000₫,https://tiki.vn/quan-legging-nu-chat-thoang-mat-den-nham-p17474777.html?spid=17474778,4,,,quannu
,,https://tiki.vn/quan-cartoon-quan-cullotes-ong-rong-hoa-cuc-quan-jogger-cartoon-pant-unisex-quan-hoat-hinh-cartoon-dai-ong-rong-lung-thun-quan-loang-in-boong-cuc-kieu-3d-de-thuong-p83857389.html?spid=83857390,5,,,quannu
Quần shorts jean thời trang,165.000₫,https://tiki.vn/qua-n-shorts-jean-tho-i-trang-p83605581.html?spid=83605641,6,,,quannu
Quần bò thêu hoa dáng baggy thụng hàng cao cấp xuất khẩu QB04 bao đẹp,650.000₫,https://tiki.vn/quan-bo-theu-hoa-dang-baggy-thung-hang-cao-cap-xuat-khau-qb04-bao-dep-p90321983.html?spid=90321997,7,,Đã bán 1,quannu
Quần jean baggy nữ thêu hoa hàng cao cấp xuất khẩu QB02 bao đẹp,315.000₫,https://tiki.vn/quan-jean-baggy-nu-theu-hoa-hang-cao-cap-xuat-khau-qb02-bao-dep-p90323583.html?spid=90323776,8,,,quannu
Quần Jogger Cam Neon,290.000,https://tiki.vn/quan-jogger-cam-neon-p32687110.html?spid=32687113,9,,,quannu
,,https://tiki.vn/quan-vien-trang-umi-p26305902.html?spid=76374762,10,,,quannu
Quần short jeans nữ lưng cao tôn dáng,165.000₫,https://tiki.vn/qua-n-short-jeans-nu-lung-cao-ton-da-ng-p83604545.html?spid=83604551,11,,Đã bán 2,quannu
Qần Jeans Nữ Lưng Cao Phối Túi Trước Thời Trang JN019,249.000,https://tiki.vn/qua-n-jeans-nu-lung-cao-pho-i-tu-i-truo-c-tho-i-trang-jn019-p45151522.html?spid=45151530,12,,,quannu
,,https://tiki.vn/quan-jean-quan-bo-lung-nu-co-bigsize-p69453125.html?spid=69453144,13,,,quannu
Quần Jeans Nữ Lưng màu Xám đen,315.000₫,https://tiki.vn/quan-jeans-nu-lung-mau-xam-den-p83606339.html?spid=83606343,14,,Đã bán 10,quannu
Quần jeans kaki nữ rách gối màu trắng,315.000₫,https://tiki.vn/quan-jeans-kaki-nu-rach-goi-mau-trang-p83605701.html?spid=83605809,15,,,quannu
Quần shorts jeans kaki nữ co giãn màu trắng,195.000₫,https://tiki.vn/qua-n-shorts-jeans-kaki-nu-co-gia-n-ma-u-tra-ng-p83604996.html?spid=83605046,16,,,quannu
Quần short jean nữ rách kết hạt 2 bên,315.000,https://tiki.vn/qua-n-short-jean-nu-ra-ch-ke-t-ha-t-2-ben-p83606658.html?spid=83606663,17,,Đã bán 4,quannu
,,https://tiki.vn/quan-gia-vay-chu-a-chat-sieu-min-dg11-p37967456.html?spid=81570468,18,,,quannu
Quần jeans 9 tấc nữ rách 2 bên,169.000₫,https://tiki.vn/qua-n-jeans-9-ta-c-nu-ra-ch-2-ben-p83607177.html?spid=83607189,19,,Đã bán 1,quannu
Quần Jeans Nữ Ống Loe Dài Co Giãn Tôn Dáng,199.900₫,https://tiki.vn/quan-jeans-nu-ong-loe-dai-co-gian-ton-dang-p83605888.html?spid=83606158,20,,Đã bán 1,quannu
Quần Kaki Trơn Lưng Thun Màu Hồng - Quần Kaki Basic Pant Unisex Pink - MM,122.000₫,https://tiki.vn/quan-kaki-tron-lung-thun-mau-hong-quan-kaki-basic-pant-unisex-pink-mm-p107370300.html?spid=107370306,21,,,quannu
Quần Dài Không Li De Leah - Ghi Xanh (Size,750.000₫,https://tiki.vn/quan-dai-khong-li-de-leah-ghi-xanh-p5501177.html?spid=5501181,22,,Đã bán 4,quannu
"QUAN KAKI OM NỮ - Vàng bò,Xxxl 50-58kg",110.000₫,https://tiki.vn/quan-kaki-om-nu-p154200656.html?spid=154200802,23,,Đã bán 1,quannu
Quần dập ly dài Hàn Quốc size 40-70kg,111.000₫,https://tiki.vn/quan-dap-ly-dai-han-quoc-size-40-70kg-p154205746.html?spid=154205774,24,,,quannu
Quần Jeans Ống Rộng Size S M L QJ002 / Ống Suông Lưng Cao Qua Rốn - Không Giãn - ĐEN TRƠN,255.000,https://tiki.vn/quan-jeans-ong-rong-size-s-m-l-qj002-ong-suong-lung-cao-qua-ron-khong-gian-den-tron-p155183964.html?spid=155184083,25,,,quannu
,,https://tiki.vn/quan-short-nu-lung-thun-vai-thun-bigsize-mau-den-crq31-p155193225.html?spid=155193306,26,,,quannu
Quần short ống rộng cạp cao lưng thun màu đen CRQ014,83.700₫,https://tiki.vn/quan-short-ong-rong-cap-cao-lung-thun-mau-den-crq014-p155191880.html?spid=155191979,27,,,quannu
"QUẦN ĐŨI ỐNG RỘNG DÀI - Màu ngẫu nhiên,65 ký trở xuống",111.000₫,https://tiki.vn/quan-dui-ong-rong-dai-p154203357.html?spid=154203400,28,,,quannu
Quần cotton chấm bi 9 tấc,133.500₫,https://tiki.vn/quan-cotton-cham-bi-9-tac-p154205899.html?spid=154205991,29,,,quannu
Quần Hoạt Hình Dài Ống Rộng Cartoon Pant Oversize Ulzzang Unisex - MM,165.000,https://tiki.vn/quan-hoat-hinh-dai-ong-rong-cartoon-pant-oversize-ulzzang-unisex-mm-p155764883.html?spid=155764891,30,,,quannu
,,https://tiki.vn/quan-hoat-hinh-dai-ong-rong-vu-tru-among-us-cartoon-pant-v2-oversize-ulzzang-unisex-mm-p155657967.html?spid=155657971,31,,,quannu
QUẦN ỐNG RỘNG SỌC,66.000₫,https://tiki.vn/quan-ong-rong-soc-p154202135.html?spid=154202185,32,,Đã bán 3,quannu
Quần vải ống rộng siêu hot,198.000₫,https://tiki.vn/quan-vai-ong-rong-sieu-hot-p114379416.html?spid=170105192,33,,,quannu
"Quần Jeans Nữ, Quần Bò Nữ Lưng Cao Màu Đen Đính Nút Gấu Co giãn Cao Cấp",320.000₫,https://tiki.vn/quan-jeans-nu-quan-bo-nu-lung-cao-mau-den-dinh-nut-gau-co-gian-cao-cap-p273069766.html?spid=273069770,34,,,quannu
Quần Jeans Nữ Ống Loe Dài Chít Thân Màu Xám,199.900,https://tiki.vn/quan-jeans-nu-ong-loe-dai-chit-than-mau-xam-p208771831.html?spid=208771841,35,,,quannu
,,https://tiki.vn/quan-jogger-nu-ca-tinh-tui-hop-p118151014.html?spid=135558215,36,,,quannu
"Quần baggy nữ lưng cao cạp liền Homieyl cao cấp, quân tây nữ cạp cao công sở chất vải đẹp",145.000₫,https://tiki.vn/quan-baggy-nu-lung-cao-cap-lien-homieyl-cao-cap-quan-tay-nu-cap-cao-cong-so-chat-vai-dep-p125139863.html?spid=162617410,37,,Đã bán 1,quannu
"Quần Jeans Nữ, quần bò nữ ống loe dài màu trắng và đen",249.000₫,https://tiki.vn/quan-jeans-nu-quan-bo-nu-ong-loe-dai-mau-trang-va-den-p252713162.html?spid=252713211,38,,,quannu
Quần Jeans Nữ Ống Loe Dài Tuyệt Đẹp,299.000₫,https://tiki.vn/quan-jeans-nu-ong-loe-dai-tuyet-dep-p252712592.html?spid=252712630,39,,,quannu
Quần Jeans Nữ Ống Loe Dài Thời Trang Siêu hot,249.000,https://tiki.vn/qua-n-jeans-nu-o-ng-loe-da-i-tho-i-trang-sieu-hot-p252713521.html?spid=252713541,40,,,quannu
