,title,price,link_item,index,discount,sales,category
2,Váy Bầu Hè Dáng Suông Thiết Kế Đi Chơi Sang Chảnh HD2627 Honey Mommy Đầm Bầu Công Sở Ngắn Tay,338.000₫,https://tiki.vn/vay-bau-he-dang-suong-thiet-ke-di-choi-sang-chanh-hd2627-honey-mommy-dam-bau-cong-so-ngan-tay-p95584325.html?spid=95584400,3,,,thoitrangbau
3,váy hoa nhí sang chảnh cho con bú,507.000,https://tiki.vn/vay-hoa-nhi-sang-chanh-cho-con-bu-p95171481.html?spid=95171524,4,,,thoitrangbau
4,,,https://tiki.vn/v01-vay-tieu-thu-cho-con-bu-sz-m-xxl-kem-anh-that-p95171332.html?spid=95171359,5,,,thoitrangbau
5,váy nhung phối voan hoa sang chảnh KÈM ẢNH THẬT,468.000₫,https://tiki.vn/vay-nhung-phoi-voan-hoa-sang-chanh-kem-anh-that-p95170419.html?spid=95170479,6,,,thoitrangbau
6,Váy cho con bú sz s-XL,507.000₫,https://tiki.vn/vay-cho-con-bu-sz-s-xl-p95170985.html?spid=95171107,7,,,thoitrangbau
7,Váy sang chảnh cho con bú KÈM ẢNH THẬT SHOP CHỤP,507.000₫,https://tiki.vn/vay-sang-chanh-cho-con-bu-kem-anh-that-shop-chup-p95172955.html?spid=95173162,8,,,thoitrangbau
8,Váy cánh tiên tím cho con ti ẢNH THẬT,507.000,https://tiki.vn/vay-canh-tien-tim-cho-con-ti-anh-that-p95171119.html?spid=95171150,9,,,thoitrangbau
9,,,https://tiki.vn/ao-len-loang-cho-con-bu-anh-that-p95171403.html?spid=95171678,10,,,thoitrangbau
10,Váy voan chấm bi màu đen khoá dọc con bú sz S-Xl,481.000₫,https://tiki.vn/vay-voan-cham-bi-mau-den-khoa-doc-con-bu-sz-s-xl-p95173759.html?spid=95173904,11,,,thoitrangbau
11,V01 Váy tiểu thư cho con bú sz m-xxl,507.000,https://tiki.vn/v01-vay-tieu-thu-cho-con-bu-sz-m-xxl-p95172843.html?spid=95173306,12,,,thoitrangbau
12,,,https://tiki.vn/vay-cham-tim-cho-con-bu-sz-m-2xl-kem-anh-va-video-that-p95172549.html?spid=95172559,13,,,thoitrangbau
13,Combo váy cho khách sỉ,2.500.000₫,https://tiki.vn/combo-vay-cho-khach-si-p164047336.html?spid=164047344,14,,,thoitrangbau
14,Set áo yếm cho con bú,507.000₫,https://tiki.vn/set-ao-yem-cho-con-bu-p95170791.html?spid=95170814,15,,,thoitrangbau
15,SẴN Váy chấm bi cho con ti sz S-XL,494.000₫,https://tiki.vn/san-vay-cham-bi-cho-con-ti-sz-s-xl-p95172988.html?spid=95173011,16,,,thoitrangbau
16,SẴN Váy cho con ti size S- XL,442.000,https://tiki.vn/san-vay-cho-con-ti-size-s-xl-p95173798.html?spid=95173944,17,,,thoitrangbau
17,,,https://tiki.vn/vay-hoa-cuc-xinh-cho-con-bu-video-anh-that-p95173230.html?spid=95173625,18,,,thoitrangbau
18,Bộ đồ bầu và sau sinh LỬNG ĐŨI họa tiết hoa quả ngộ nghĩnh siêu mềm mát BĐ829,157.500₫,https://tiki.vn/bo-do-bau-va-sau-sinh-lung-dui-hoa-tiet-hoa-qua-ngo-nghinh-sieu-mem-mat-bd829-p146574228.html?spid=146574274,19,,,thoitrangbau
19,Bộ đồ bầu mặc nhà và sau sinh NGỐ thun cotton (có vạt chéo co bé ti),134.820₫,https://tiki.vn/bo-do-bau-mac-nha-va-sau-sinh-ngo-thun-cotton-co-vat-cheo-co-be-ti-p146574999.html?spid=146575133,20,,Đã bán 1,thoitrangbau
20,Quần bầu cạp cao,50.000₫,https://tiki.vn/quan-bau-cap-cao-p198737019.html?spid=198737027,21,,,thoitrangbau
21,"Váy bầu chất lụa siêu mềm mát, đầm bầu mùa hè thiết kế cổ V công chúa đi đám cưới, dự tiệc siêu xinh V272",161.280₫,https://tiki.vn/vay-bau-chat-lua-sieu-mem-mat-dam-bau-mua-he-thiet-ke-co-v-cong-chua-di-dam-cuoi-du-tiec-sieu-xinh-v272-p146572624.html?spid=146572639,22,,,thoitrangbau
22,BỘ ĐỒ BẦU CÓ nhiều SIZE,85.000₫,https://tiki.vn/bo-do-bau-co-nhieu-size-p105799821.html?spid=105799892,23,,,thoitrangbau
23,"Bộ đồ bầu NGỐ mặc trước và sau sinh hình SAO, phong cách Hàn Quốc mặc nhà và sau sinh BL812",142.380₫,https://tiki.vn/bo-do-bau-ngo-mac-truoc-va-sau-sinh-hinh-sao-phong-cach-han-quoc-mac-nha-va-sau-sinh-bl812-p146572565.html?spid=146572625,24,,,thoitrangbau
24,Váy cho con bú sz M-XXL ẢNH THẬT,338.000,https://tiki.vn/vay-cho-con-bu-sz-m-xxl-anh-that-p95171229.html?spid=95171250,25,,,thoitrangbau
25,,,https://tiki.vn/vay-ngu-2-day-duoi-ca-co-dem-nguc-tang-kem-bit-mat-v2d88-p146574489.html?spid=146574762,26,,,thoitrangbau
26,váy hoa nhí cho con bú KÈM ẢNH THẬT (form nhỏ tăng 1sz),455.000₫,https://tiki.vn/vay-hoa-nhi-cho-con-bu-kem-anh-that-form-nho-tang-1sz-p95172798.html?spid=95172822,27,,,thoitrangbau
27,Bộ đồ bầu Pink Quảng Châu Bầu và Sau Sinh Cộc Tay(Có mở nắp),134.820₫,https://tiki.vn/bo-do-bau-pink-quang-chau-bau-va-sau-sinh-coc-tay-co-mo-nap-p146574534.html?spid=146574711,28,,Đã bán 1,thoitrangbau
28,BỘ ĐỒ BẦU VÀ SAU SINH CÓ CHỖ MỞ CHO BÉ BÚ,170.000₫,https://tiki.vn/bo-do-bau-va-sau-sinh-co-cho-mo-cho-be-bu-p105799114.html?spid=105799126,29,,,thoitrangbau
29,"Đầm bầu xuông chất liệu vải thun mát, mịn, co giãn tốt không xù lông cho bầu từ 50kg đến 75kg. Cao 1m57 qua gối 5-8cm",155.000,https://tiki.vn/dam-bau-xuong-chat-lieu-vai-thun-mat-min-co-gian-tot-khong-xu-long-cho-bau-tu-50kg-den-75kg-cao-1m57-qua-goi-5-8cm-p99869781.html?spid=99869795,30,,,thoitrangbau
30,,,https://tiki.vn/ao-bau-kieu-xinh-dep-tre-trung-p167244008.html?spid=167244016,31,,,thoitrangbau
31,Combo 03 Áo Ngực bầu và cho con bú mở cúc ngang,89.250₫,https://tiki.vn/combo-03-ao-nguc-bau-va-cho-con-bu-mo-cuc-ngang-p167244037.html?spid=167244052,32,,,thoitrangbau
32,Quần lót bầu set 4 chiếc,150.000₫,https://tiki.vn/quan-lot-bau-set-4-chiec-p198737420.html?spid=198737424,33,,,thoitrangbau
33,Váy BẦU SIZE TO 70KG,110.000₫,https://tiki.vn/vay-bau-size-to-70kg-p105799692.html?spid=105799733,34,,,thoitrangbau
34,Bộ bầu vải tôn - vải lanh loại tốt không nhăn rút,165.000,https://tiki.vn/bo-bau-vai-ton-vai-lanh-loai-tot-khong-nhan-rut-p167244000.html?spid=167244002,35,,,thoitrangbau
35,,,https://tiki.vn/dam-bau-to-dui-hoa-tiet-hoa-nhi-xinh-xan-tu-50kg-den-70kg-do-lai-p99870283.html?spid=99870301,36,,,thoitrangbau
36,Hàng HotÁo Thun Tự Thiết Kế Unisex Phong Cách Nhật Bản Ánh Trăng ĐỏCực Chất,150.000₫,https://tiki.vn/hang-hotao-thun-tu-thiet-ke-unisex-phong-cach-nhat-ban-anh-trang-docuc-chat-p91971477.html?spid=91971530,37,,,thoitrangbau
37,Váy Bầu Hè Ngắn Tay Cổ Sen Phối Tay Bèo Váy Bầu Thời Trang HD2613 Honey Mommy,149.000₫,https://tiki.vn/vay-bau-he-ngan-tay-co-sen-phoi-tay-beo-vay-bau-thoi-trang-hd2613-honey-mommy-p95583784.html?spid=95583854,38,,,thoitrangbau
38,Quần bầu cạp chéo thể thao,86.940₫,https://tiki.vn/quan-bau-cap-cheo-the-thao-p146572107.html?spid=146572119,39,,Đã bán 1,thoitrangbau
39,QUẦN LÓT BẦU SU CAO CẤP SIÊU MỊN MÁT,41.650₫,https://tiki.vn/quan-lot-bau-su-cao-cap-sieu-min-mat-p167244158.html?spid=167244164,40,,,thoitrangbau
0,Quần lót bầu và sau sinh su thông hơi cao cấp,42.500₫,https://tiki.vn/quan-lot-bau-va-sau-sinh-su-thong-hoi-cao-cap-p167244110.html?spid=167244139,1,,,thoitrangbau
1,BỘ KẺ ĐỒ BẦU VÀ SAU SINH (VẢI KHÔNG CO GIÃN MẶC MÙA THU ĐÔNG ),110.000₫,https://tiki.vn/bo-ke-do-bau-va-sau-sinh-vai-khong-co-gian-mac-mua-thu-dong-p105799677.html?spid=105799699,2,,,thoitrangbau
2,QUẦN TẤT BẦU MỎNG CÓ CHUN ĐIỀU CHỈNH,80.100₫,https://tiki.vn/si-le-quan-tat-bau-mong-co-chun-dieu-chinh-p135900986.html?spid=135900991,3,,,thoitrangbau
3,Quần Bầu thời trang ỐNG RỘNG CHẤT THUN TĂM mềm QBT2021,111.000,https://tiki.vn/quan-bau-thoi-trang-ong-rong-chat-thun-tam-mem-qbt2021-p148637168.html?spid=148637192,4,,,thoitrangbau
4,,,https://tiki.vn/combo-4-quan-lot-bau-cotton-cao-cap-quan-mac-trong-vay-mac-bau-va-sau-sinh-cs101-p148639995.html?spid=148640119,5,,,thoitrangbau
5,BỘ TOLE LANH BẦU CÓ NHIỀU SIZE,170.000₫,https://tiki.vn/bo-tole-lanh-bau-co-nhieu-size-p105800397.html?spid=105800446,6,,,thoitrangbau
6,quần bầu ống xớ chất dệt kim cao cấp,190.260₫,https://tiki.vn/quan-bau-ong-xo-chat-det-kim-cao-cap-p146575504.html?spid=146575731,7,,Đã bán 1,thoitrangbau
7,#BỘ ĐỒ LANH BIGSIZE CHO MẸ BỈM SỮA VÀ MẸ SAU SINH,150.000₫,https://tiki.vn/bo-do-lanh-bigsize-cho-me-bim-sua-va-me-sau-sinh-p105799151.html?spid=105799225,8,,,thoitrangbau
8,Váy bầu thời trang MYE412 chấm bi,195.000,https://tiki.vn/vay-bau-thoi-trang-mye412-cham-bi-p89912550.html?spid=89912559,9,,,thoitrangbau
9,,,https://tiki.vn/ao-lot-bau-loai-tron-cuc-mo-mac-ca-sau-sinh-cho-con-bu-p146573480.html?spid=146573534,10,,,thoitrangbau
10,(Được mua 10) Quần lót bầu COTTON an toàn cho mẹ nhiều màu sắc QL9005,30.240₫,https://tiki.vn/duoc-mua-10-quan-lot-bau-cotton-an-toan-cho-me-nhieu-mau-sac-ql9005-p146574223.html?spid=146574244,11,,,thoitrangbau
11,Quần bầu nâng mông hít hót,81.900₫,https://tiki.vn/quan-bau-nang-mong-hit-hot-p146574393.html?spid=146574417,12,,,thoitrangbau
12,,,https://tiki.vn/bo-bau-va-sau-sinh-cotton-cho-me-50-67kg-p93245876.html?spid=93245931,13,,,thoitrangbau
13,Bộ đồ bầu dài tay mặc bầu và sau sinh cổ bèo tiểu thư BD919,157.500₫,https://tiki.vn/bo-do-bau-dai-tay-mac-bau-va-sau-sinh-co-beo-tieu-thu-bd919-p146574465.html?spid=146574501,14,,,thoitrangbau
14,Váy chấm bi đỏ khoá dọc cho con bú sz SML,156.000₫,https://tiki.vn/vay-cham-bi-do-khoa-doc-cho-con-bu-sz-sml-p95174206.html?spid=95174407,15,,,thoitrangbau
15,Áo bầu tơ đũi mềm mát phối chân ren xinh xắn cho bầu từ 50kg đến 70kg,135.000₫,https://tiki.vn/ao-bau-to-dui-mem-mat-phoi-chan-ren-xinh-xan-cho-bau-tu-50kg-den-70kg-p99869782.html?spid=99869824,16,,,thoitrangbau
16,"Áo bầu bự ký vải voan mát rượi xinh xắn, đáng yêu cho bầu từ 75kg đến 100kg",145.000,https://tiki.vn/ao-bau-bu-ky-vai-voan-mat-ruoi-xinh-xan-dang-yeu-cho-bau-tu-75kg-den-100kg-p99870170.html?spid=99870202,17,,,thoitrangbau
17,,,https://tiki.vn/quan-bau-sooc-bo-mem-co-dap-bung-va-chun-dieu-chinh-sb3079-p146574141.html?spid=146574179,18,,,thoitrangbau
18,Đầm bầu xuông thun mát mềm mịn trẻ trung phù hợp cho bầu từ 50kg đến 75kg,155.000₫,https://tiki.vn/dam-bau-xuong-thun-mat-mem-min-tre-trung-phu-hop-cho-bau-tu-50kg-den-75kg-p99870011.html?spid=99870095,19,,,thoitrangbau
19,Váy lụa chữ A (vải mặc hè rất mát ),80.000₫,https://tiki.vn/vay-lua-chu-a-vai-mac-he-rat-mat-p105800110.html?spid=105800223,20,,,thoitrangbau
20,Bộ đồ mặc nhà dài tay chất cotton mềm mịn họa tiết hình thú dễ thương BD931,81.900₫,https://tiki.vn/bo-do-mac-nha-dai-tay-chat-cotton-mem-min-hoa-tiet-hinh-thu-de-thuong-bd931-p146575118.html?spid=146575476,21,,,thoitrangbau
21,Áo Bầu Thêu Hoa Lớn (ảnh thật) A11,107.100₫,https://tiki.vn/ao-bau-theu-hoa-lon-anh-that-a11-p146575868.html?spid=146575883,22,,,thoitrangbau
22,quần bầu có đáp bụng,74.340₫,https://tiki.vn/quan-bau-co-dap-bung-p146574409.html?spid=146574519,23,,Đã bán 1,thoitrangbau
23,ÁO LÓT CHO CON BÚ THÔNG HƠI THÁI,35.000₫,https://tiki.vn/ao-lot-cho-con-bu-thong-hoi-thai-p107279326.html?spid=107279341,24,,,thoitrangbau
24,SÉT 5 CHIẾC QUẦN LÓT BẦU CỰC XINH TÚI ZIP 9005,144.900,https://tiki.vn/set-5-chiec-quan-lot-bau-cuc-xinh-tui-zip-9005-p146575422.html?spid=146575544,25,,,thoitrangbau
25,,,https://tiki.vn/ao-bau-cong-so-dai-tay-co-so-mi-sieu-xinh-vai-soi-tre-sieu-thoang-cho-me-bau-mac-di-lam-di-dao-pho-cuc-xinh-a126-p146572295.html?spid=146572327,26,,,thoitrangbau
26,Váy bầu – váy thiết kế dài tay chất nhung mềm mại cổ thắt nơ xinh xắn V334,148.000₫,https://tiki.vn/vay-bau-vay-thiet-ke-dai-tay-chat-nhung-mem-mai-co-that-no-xinh-xan-v334-p148637302.html?spid=148637344,27,,,thoitrangbau
27,Quần bầu lửng nâng mông,74.340₫,https://tiki.vn/quan-bau-lung-nang-mong-p146573585.html?spid=146573626,28,,Đã bán 1,thoitrangbau
28,Váy 2 dây dáng suông đẹp - Váy ngủ bầu có nấc điều chỉnh phía sau lưng V286,79.380₫,https://tiki.vn/vay-2-day-dang-suong-dep-va-y-ngu-ba-u-co-na-c-die-u-chi-nh-phi-a-sau-lung-v286-p146573440.html?spid=146573547,29,,,thoitrangbau
29,"ÁO BẦU THUN TRẺ TRUNG A178, ÁO BẦU ĐI CHƠI, ĐI LÀM",145.500,https://tiki.vn/ao-bau-thun-tre-trung-a178-ao-bau-di-choi-di-lam-p252639893.html?spid=252639907,30,,,thoitrangbau
30,,,https://tiki.vn/set-bo-do-bau-di-choi-thoang-mat-bl152-p252640055.html?spid=252640099,31,,,thoitrangbau
31,Đầm bầu giả yếm kaki thanh lịch công sở V885,390.000₫,https://tiki.vn/da-m-ba-u-gia-ye-m-kaki-thanh-li-ch-cong-so-v885-p252639670.html?spid=252639693,32,,,thoitrangbau
32,"Xịt răng miệng Minion Gold Dr.maya hộp/50ml, Vệ sinh răng miệng ngăn ngừa sau răng cho bé từ 6 tháng tuổi",245.000₫,https://tiki.vn/xit-rang-mieng-minion-gold-dr-maya-hop-50ml-ve-sinh-rang-mieng-ngan-ngua-sau-rang-cho-be-tu-6-thang-tuoi-p251512328.html?spid=235896730,33,,Đã bán 30,thoitrangbau
33,Váy bầu thiết kế công sở dự tiệc mùa hè suông sơ mi chất linen mát B61,259.000₫,https://tiki.vn/vay-bau-thiet-ke-cong-so-du-tiec-mua-he-suong-so-mi-chat-linen-mat-b61-p185989466.html?spid=185989468,34,,,thoitrangbau
34,"Áo choàng cho con bú, áo choàng khi đi ra ngoài",55.000₫,https://tiki.vn/ao-choang-cho-con-bu-ao-choang-khi-di-ra-ngoai-p89210257.html?spid=89210259,35,,,thoitrangbau
35,,,https://tiki.vn/quan-dui-bau-mac-trong-vay-cao-cap-p163581366.html?spid=163581376,36,,,thoitrangbau
36,Quần đùi bầu. Quần đùi mặc váy cạp chéo,42.000₫,https://tiki.vn/quan-dui-bau-quan-dui-mac-vay-cap-cheo-p143643415.html?spid=143643430,37,,Đã bán 5,thoitrangbau
37,Váy bầu thiết kế xinh ren Aidenshop đầm bầu thời trang sau sinh sang chảnh,250.000₫,https://tiki.vn/vay-bau-thiet-ke-xinh-ren-aidenshop-dam-bau-thoi-trang-sau-sinh-sang-chanh-p184766135.html?spid=184766176,38,,,thoitrangbau
38,Bộ bầu đẹp,132.000₫,https://tiki.vn/bo-bau-dep-p129497405.html?spid=129497410,39,,,thoitrangbau
39,ĐẦM BẦU XINH XẮN,294.000,https://tiki.vn/dam-bau-xinh-xan-p129498702.html?spid=129498737,40,,,thoitrangbau
0,Bộ đồ sau sinh thời trang chất lụa satin,210.000₫,https://tiki.vn/bo-do-sau-sinh-thoi-trang-chat-lua-satin-p129498697.html?spid=129498709,1,,,thoitrangbau
1,Đầm xinh bầu dáng suông đuôi cá chất cotton mát cộc tay mùa hè 2021 maternity dress,199.000₫,https://tiki.vn/dam-xinh-bau-dang-suong-duoi-ca-chat-cotton-mat-coc-tay-mua-he-2021-maternity-dress-p129493158.html?spid=129493188,2,,,thoitrangbau
2,Đầm bầu công sở dáng suông chất lụa mùa hè cộc tay màu xanh và kem,167.000₫,https://tiki.vn/dam-bau-cong-so-dang-suong-chat-lua-mua-he-coc-tay-mau-xanh-va-kem-p129493297.html?spid=129493323,3,,,thoitrangbau
3,Váy bầu đẹp mùa hè dáng suông chất phông mát váy bầu cộc tay,167.000,https://tiki.vn/vay-bau-dep-mua-he-dang-suong-chat-phong-mat-vay-bau-coc-tay-p129501105.html?spid=129501110,4,,,thoitrangbau
4,,,https://tiki.vn/ao-bau-thu-dong-chat-len-pha-da-xinh-nhieu-mau-p129493983.html?spid=129493995,5,,,thoitrangbau
5,BỘ BẦU ĐẸP CHẤT COTTON,189.000₫,https://tiki.vn/bo-bau-dep-chat-cotton-p129496841.html?spid=129496864,6,,,thoitrangbau
6,Bộ bầu Pink mặc nhà chất cotton bộ đồ lửng bầu,137.000₫,https://tiki.vn/bo-bau-pink-mac-nha-chat-cotton-bo-do-lung-bau-p129499672.html?spid=129499682,7,,,thoitrangbau
7,Váy bầu thời trang suông chất lụa nhẹ mát,263.000₫,https://tiki.vn/vay-bau-thoi-trang-suong-chat-lua-nhe-mat-p129495063.html?spid=129495075,8,,,thoitrangbau
8,VÁY BẦU COTTON 70KG,179.000,https://tiki.vn/vay-bau-cotton-70kg-p129499670.html?spid=129499681,9,,,thoitrangbau
9,,,https://tiki.vn/vay-bau-cong-so-phoi-so-mi-trang-dam-bau-dep-40-65kg-p129499626.html?spid=129499636,10,,,thoitrangbau
10,Bộ sau sinh,189.000₫,https://tiki.vn/bo-sau-sinh-p129499725.html?spid=129499753,11,,,thoitrangbau
11,Áo bầu thời trang,210.000,https://tiki.vn/ao-bau-thoi-trang-p129498949.html?spid=129498969,12,,,thoitrangbau
12,,,https://tiki.vn/bo-bau-mac-nha-ngo-va-sau-sinh-co-khoa-ti-chat-tho-lua-mem-p129494488.html?spid=129494533,13,,,thoitrangbau
13,Váy bầu dáng dài,315.000₫,https://tiki.vn/vay-bau-dang-dai-p129497996.html?spid=129498008,14,,,thoitrangbau
14,Váy bầu thiết kế dáng suông chất ren đẹp(48-70kg)kèm video,273.000₫,https://tiki.vn/vay-bau-thiet-ke-dang-suong-chat-ren-dep-48-70kg-kem-video-p129495730.html?spid=129495741,15,,,thoitrangbau
15,VÁY BẦU COTTON,273.000₫,https://tiki.vn/vay-bau-cotton-p129496528.html?spid=129496547,16,,,thoitrangbau
16,Bộ đồ sau sinh,210.000,https://tiki.vn/bo-do-sau-sinh-p129496549.html?spid=129496578,17,,,thoitrangbau
17,,,https://tiki.vn/chan-vay-bau-va-quan-tat-p129499414.html?spid=129499425,18,,,thoitrangbau
18,Váy bầu xinh thu đông Aidenshop đầm bầu thời trang nhung 45-70kg,242.000₫,https://tiki.vn/vay-bau-xinh-thu-dong-aidenshop-dam-bau-thoi-trang-nhung-45-70kg-p129499555.html?spid=129499572,19,,,thoitrangbau
19,Váy bầu thời trang thiết kế Aidenshop đầm bầu công sở Chất len mịn dáng dài,294.000₫,https://tiki.vn/vay-bau-thoi-trang-thiet-ke-aidenshop-dam-bau-cong-so-chat-len-min-dang-dai-p129499545.html?spid=129499547,20,,,thoitrangbau
20,"Áo Lót, Áo Ngực Bầu Và Cho Con Bú Chất Mềm Mại Thoáng Mát",55.000₫,https://tiki.vn/ao-lot-ao-nguc-bau-va-cho-con-bu-chat-mem-mai-thoang-mat-p127455590.html?spid=127455600,21,,Đã bán 2,thoitrangbau
21,"Quần lót bầu cotton, quần lót bà bầu cạp chéo túi zip, MLEESHOP",32.000₫,https://tiki.vn/quan-lot-bau-hang-cao-cap-chat-dep-mat-day-dan-p251755620.html?spid=251755673,22,,,thoitrangbau
22,Áo Bầu Công Sở | Áo Kiểu Bầu | Quần Áo Bầu Đẹp | Đồ Bầu Đẹp,145.000₫,https://tiki.vn/ao-bau-cong-so-ao-kieu-bau-quan-ao-bau-dep-do-bau-dep-p209611022.html?spid=207314164,23,,,thoitrangbau
23,"Baggy bầu công sở đẹp, quần áo bầu thời trang, MLEE SHOP",125.000₫,https://tiki.vn/baggy-bau-cong-so-dep-quan-ao-bau-thoi-trang-mlee-shop-p254903377.html?spid=254903393,24,,,thoitrangbau
24,"Đầm bầu thu họa tiết hoa nhí, váy bầu mùa thu đẹp, MLEE SHOP",179.000,https://tiki.vn/dam-bau-dam-thiet-ke-dam-hoa-dang-dai-suong-chat-vai-dui-han-2-lop-mem-nhe-thoang-mat-p254903305.html?spid=254903315,25,,,thoitrangbau
25,,,https://tiki.vn/combo-3-ao-lot-bau-p159241650.html?spid=159241661,26,,,thoitrangbau
26,COMBO 5 QUẦN LÓT BẦU KHÁNG KHUẨN CAO CẤP,119.000₫,https://tiki.vn/combo-5-quan-lot-bau-khang-khuan-cao-cap-p159241628.html?spid=159241639,27,,,thoitrangbau
27,"Quần Lót Bầu cạp chéo (CS101 ) coton siêu sịn, siêu đáng yêu",29.000₫,https://tiki.vn/quan-lot-bau-cap-cheo-cs101-coton-sieu-sin-sieu-dang-yeu-p159242138.html?spid=159242149,28,,,thoitrangbau
28,ÁO LÓT BẦU KẾT HỢP CHO CON BÚ,49.500₫,https://tiki.vn/ao-lot-bau-ket-hop-cho-con-bu-p205233510.html?spid=205233520,29,,,thoitrangbau
29,"áo bầu kiểu, áo bà bầu đẹp",119.000,https://tiki.vn/ao-bau-kieu-ao-ba-bau-dep-p254903255.html?spid=254903260,30,,,thoitrangbau
30,,,https://tiki.vn/ao-bau-gia-re-ao-bau-cong-so-p254903333.html?spid=254903351,31,,,thoitrangbau
31,"áo bầu công sở, áo sơ mi bầu chất đũi mát lạnh, MLEE",109.000₫,https://tiki.vn/ao-bau-cong-so-ao-so-mi-bau-chat-dui-mat-lanh-mlee-p254903364.html?spid=254903370,32,,,thoitrangbau
32,Áo babydoll bầu công sở mùa hè,125.000₫,https://tiki.vn/ao-babydoll-bau-cong-so-mua-he-p254903483.html?spid=254903491,33,,,thoitrangbau
33,"Đầm bầu, Váy sau sinh cho con bú_set váy 2 chi tiết kẻ kazo dạ len",352.000₫,https://tiki.vn/dam-bau-vay-sau-sinh-cho-con-bu_set-vay-2-chi-tiet-ke-kazo-da-len-p75590190.html?spid=75590192,34,,,thoitrangbau
34,Áo bầu thu đông thun cotton họa tiết cute AB1199,339.000,https://tiki.vn/ao-bau-thu-dong-thun-cotton-hoa-tiet-cute-ab1199-p141469596.html?spid=141469604,35,,,thoitrangbau
35,,,https://tiki.vn/ao-bau-thu-dong-ao-len-bau-abl87-p141567979.html?spid=141567981,36,,,thoitrangbau
36,Áo bầu giữ nhiệt thu đông cotton AB1117,237.000₫,https://tiki.vn/ao-bau-giu-nhiet-thu-dong-cotton-ab1117-p141217098.html?spid=141217100,37,,,thoitrangbau
37,Áo bầu thu đông dáng dài thun cotton AB1197,339.000₫,https://tiki.vn/ao-bau-thu-dong-dang-dai-thun-cotton-ab1197-p141388247.html?spid=141388255,38,,,thoitrangbau
38,Combo 3 Quần lót bà bầu vạc xéo,134.000₫,https://tiki.vn/combo-3-quan-lot-ba-bau-vac-xeo-p124983229.html?spid=186254242,39,,,thoitrangbau
39,SÉT BỘ QUẦN ÁO BẦU VỚI ÁO XUÔNG+ QUẦN XUÔNG FORM RỘNG RÃI AB3117,295.000,https://tiki.vn/set-bo-quan-ao-bau-voi-ao-xuong-quan-xuong-form-rong-rai-ab3117-p259563010.html?spid=259563030,40,,,thoitrangbau
0,SÉT YẾM BẦU MÙA HÈ-THU CỰC YÊU QBY115,550.000₫,https://tiki.vn/set-yem-bau-mua-he-thu-cuc-yeu-qby115-p258820584.html?spid=258820593,1,-38%,,thoitrangbau
1,Quần bầu hè thu ngố QBD1520,285.000₫,https://tiki.vn/quan-bau-he-thu-ngo-qbn1174-p258863197.html?spid=258863199,2,-42%,Đã bán 1,thoitrangbau
2,QUẦN BẦU HÈ THU CHÂN VÁY HÈ THU DÁNG DÀI QBV-QBN1087,355.000₫,https://tiki.vn/quan-bau-he-thu-chan-vay-he-thu-dang-dai-qbv-qbn1087-p262463147.html?spid=262463149,3,-41%,,thoitrangbau
3,Đầm bầu sơ mi công sở dáng dài DR3122,435.000,https://tiki.vn/dam-bau-so-mi-cong-so-dang-dai-dr3122-p262450718.html?spid=262450722,4,,,thoitrangbau
4,,,https://tiki.vn/ao-so-mi-bau-mua-he-thu-dang-rong-ab3138-p262718236.html?spid=262718252,5,,,thoitrangbau
5,QUẦN BẦU JEAN PHONG CÁCH TRẺ TRUNG DÁNG DÀI QBN1325,425.000₫,https://tiki.vn/quan-bau-jean-phong-cach-tre-trung-dang-dai-qbn1325-p253382928.html?spid=253382934,6,,Đã bán 1,thoitrangbau
6,Áo bầu thu đông denim sơ mi dáng dài AB1201,325.000₫,https://tiki.vn/ao-bau-thu-dong-denim-so-mi-dang-dai-ab1201-p141474609.html?spid=141474611,7,,,thoitrangbau
7,QUẦN BẦU HÈ THU- QUẦN NGỐ ĐÙI JEAN NĂNG ĐỘNG QBN1215,365.000₫,https://tiki.vn/quan-bau-he-thu-quan-ngo-dui-jean-nang-dong-qbn1215-p258863184.html?spid=258863190,8,,,thoitrangbau
8,Quần bầu hè thu JEAN dáng ngố đùi phong cách trẻ trung QBN1355,355.000,https://tiki.vn/quan-bau-he-thu-jean-dang-ngo-dui-phong-cach-tre-trung-qbn1355-p253284861.html?spid=253284865,9,,,thoitrangbau
9,,,https://tiki.vn/dam-bau-thun-cotton-dang-dai-dr3121-p262450664.html?spid=262450672,10,,,thoitrangbau
10,QUẦN BẦU HÈ THU KẺ Ô VUÔNG QBS1420,395.000₫,https://tiki.vn/quan-bau-he-thu-ke-o-vuong-qbs1420-p255143799.html?spid=255143811,11,,,thoitrangbau
11,Quần bầu xuông thun cotton dáng lỡ xẻ cá tính QBS1414,285.000,https://tiki.vn/quan-bau-xuong-thun-cotton-dang-lo-xe-ca-tinh-qbs1414-p253391628.html?spid=253391632,12,,,thoitrangbau
12,,,https://tiki.vn/quan-bau-jean-dang-lo-cuc-xinh-qbn1345-p255165000.html?spid=255165014,13,,,thoitrangbau
13,Quần bầu jean XUÔNG sành điệu QBN1343-QBN1342,435.000₫,https://tiki.vn/quan-bau-jean-xuong-sanh-dieu-qbn1343-qbn1342-p258201445.html?spid=258201491,14,,,thoitrangbau
14,Áo lót ngực bầu cho bé con bú LỤA TĂM không gọng nâng ngực đồ lót chip bà bầu A35,32.000₫,https://tiki.vn/ao-lot-nguc-bau-cho-be-con-bu-lua-tam-khong-gong-nang-nguc-do-lot-chip-ba-bau-a35-p117973118.html?spid=192720943,15,,Đã bán 17,thoitrangbau
15,Bộ mở nắp ngực cho mẹ sau sinh,69.000₫,https://tiki.vn/bo-mo-nap-nguc-cho-me-sau-sinh-p101252938.html?spid=101252960,16,,,thoitrangbau
16,quần dài bầu suông đũi,180.000,https://tiki.vn/quan-dai-bau-suong-dui-p92320769.html?spid=92320772,17,,,thoitrangbau
17,,,https://tiki.vn/set-yem-ke-bau-vay-thiet-ke-p92322091.html?spid=92322108,18,,,thoitrangbau
18,Bộ lửng cotton mặc bầu và sinh,160.000₫,https://tiki.vn/bo-lung-cotton-mac-bau-va-sinh-p92319029.html?spid=92319031,19,,Đã bán 1,thoitrangbau
19,Váy bầu thiết kế đen chân ren,320.000₫,https://tiki.vn/vay-bau-thiet-ke-den-chan-ren-p92319621.html?spid=92319627,20,,,thoitrangbau
20,Đầm bầu (yếm + áo ) hoa,135.000₫,https://tiki.vn/dam-bau-yem-ao-hoa-p92319270.html?spid=92319276,21,,,thoitrangbau
21,Váy ren bầu,350.000₫,https://tiki.vn/vay-ren-bau-p92320102.html?spid=92320104,22,,,thoitrangbau
22,Quần bầu nâng mông,156.000₫,https://tiki.vn/quan-bau-nang-mong-p92320269.html?spid=92320297,23,,,thoitrangbau
23,tất bầu dày vừa có chun chỉnh bụng dày dặn,117.000₫,https://tiki.vn/tat-bau-day-vua-co-chun-chinh-bung-day-dan-p92320228.html?spid=92320238,24,,,thoitrangbau
24,Bộ đồ bầu mùa hè tay bồng chất đũi hàn freesize từ 45 đến 70kg,167.000,https://tiki.vn/bo-do-bau-mua-he-tay-bong-chat-dui-han-freesize-tu-45-den-70kg-p103097352.html?spid=116458788,25,,,thoitrangbau
25,,,https://tiki.vn/do-bo-bau-lung-co-tim-2-mau-do-ngu-ba-bau-sau-sinh-cho-con-bu-ti-quan-ao-bau-cho-me-thoi-trang-mua-he-bigsize-p114404023.html?spid=114404100,26,,,thoitrangbau
26,"Áo phông bầu cộc tay, đồ sau sinh cho con bú ti - Quần áo thời trang Quảng Châu mùa hè đẹp giá rẻ Bigsize",168.000₫,https://tiki.vn/ao-phong-bau-coc-tay-do-sau-sinh-cho-con-bu-ti-quan-ao-thoi-trang-quang-chau-mua-he-dep-gia-re-bigsize-p248774633.html?spid=248774680,27,,,thoitrangbau
27,"Váy bầu, đầm bầu thu đông nơ tiểu thư 2 màu",259.000₫,https://tiki.vn/vay-bau-dam-bau-thu-dong-no-tieu-thu-2-mau-p114404694.html?spid=114404909,28,,,thoitrangbau
28,Pijama bầu sau sinh cho con bú ti - Đồ bộ ngủ Pizama đẹp mặc nhà CÁO - Quần áo thời trang Pyjama dài tay giá rẻ Bigsize,199.000₫,https://tiki.vn/pijama-bau-sau-sinh-cho-con-bu-ti-do-bo-ngu-pizama-dep-mac-nha-cao-quan-ao-thoi-trang-pyjama-dai-tay-gia-re-bigsize-p270692706.html?spid=270692740,29,,,thoitrangbau
