,title,price,link_item,index,discount,sales,category
8,Vây dự tiệc sang chảnh cho con bú ẢNH THẬT SHOP CHỤP,468.000,https://tiki.vn/vay-du-tiec-sang-chanh-cho-con-bu-anh-that-shop-chup-p95173005.html?spid=95173022,9,,,thoitrangbau
9,,,https://tiki.vn/vay-voan-cho-con-bu-sz-m-2xl-p95171295.html?spid=95171316,10,,,thoitrangbau
10,VAY BAU kèm ành thật,490.000₫,https://tiki.vn/vay-bau-kem-anh-that-p164047202.html?spid=164047205,11,,,thoitrangbau
11,"Bộ bầu, kết hợp sau sinh cho con ti dài tay Sz: M-5XL",468.000,https://tiki.vn/bo-bau-ket-hop-sau-sinh-cho-con-ti-dai-tay-sz-m-5xl-p95172065.html?spid=95172111,12,,,thoitrangbau
12,,,https://tiki.vn/vay-phoi-tay-luoi-cho-con-bu-p95174093.html?spid=95174280,13,,,thoitrangbau
13,SẴN Váy cho con ti size M L,507.000₫,https://tiki.vn/san-vay-cho-con-ti-size-m-l-p95172672.html?spid=95172823,14,,,thoitrangbau
14,COMBO 10 QUẦN LEGING BẦU,850.000₫,https://tiki.vn/combo-10-quan-leging-bau-p105800111.html?spid=105800149,15,,,thoitrangbau
15,Váy Bầu Yếm 2 Dây Dáng Xòe Váy Bầu Hè Ngắn Tay Dáng Dài Đi Chơi Đi Làm HD2618 Honey Mommy Đầm Bầu Yếm Mùa Hè Vải Mát,165.000₫,https://tiki.vn/vay-bau-yem-2-day-dang-xoe-vay-bau-he-ngan-tay-dang-dai-di-choi-di-lam-hd2618-honey-mommy-dam-bau-yem-mua-he-vai-mat-p95583882.html?spid=95583898,16,,,thoitrangbau
16,váy len body cho con bú 2 màu,429.000,https://tiki.vn/vay-len-body-cho-con-bu-2-mau-p95171267.html?spid=95171318,17,,,thoitrangbau
17,,,https://tiki.vn/vay-voan-cham-bi-cao-cap-sz-s-xl-kemvideo-va-anh-that-p95171970.html?spid=95171999,18,,,thoitrangbau
18,Váy cho con búẢNH THẬT SHOP CHỤP,468.000₫,https://tiki.vn/vay-cho-con-bu-anh-that-shop-chup-p95171753.html?spid=95171758,19,,,thoitrangbau
19,Váy cho con ti sz M L XL Xxl KÈM ẢNH THẬT,416.000₫,https://tiki.vn/vay-cho-con-ti-sz-m-l-xl-xxl-kem-anh-that-p95171155.html?spid=95171181,20,,,thoitrangbau
20,"Váy, đầm bầu voan cho con bú ẢNH THẬT",429.000₫,https://tiki.vn/vay-dam-bau-voan-cho-con-bu-anh-that-p95173660.html?spid=95173690,21,,,thoitrangbau
21,váy nhung cho con bú️KÈM ẢNH THẬT,455.000₫,https://tiki.vn/vay-nhung-cho-con-bu-kem-anh-that-p95173090.html?spid=95173620,22,,,thoitrangbau
22,Quần tất bầu lót lông - Mùa đông không lạnh,183.000₫,https://tiki.vn/quan-tat-bau-lot-long-mua-dong-khong-lanh-p148641854.html?spid=148641859,23,,,thoitrangbau
23,ÁO BẦU SIZE TO - ÁO BẦU SIZE LỚN CAO CẤP,188.000₫,https://tiki.vn/ao-bau-size-to-ao-bau-size-lon-cao-cap-p127367049.html?spid=127367121,24,,,thoitrangbau
24,️HOT HOT️Áo lót có gọng siêu nâng ngực cho con bú,253.500,https://tiki.vn/hot-hot-ao-lot-co-gong-sieu-nang-nguc-cho-con-bu-p95173332.html?spid=95173439,25,,,thoitrangbau
25,,,https://tiki.vn/legging-bau-meo-co-gian-4-chieu-lot-long-p107279178.html?spid=107279216,26,,,thoitrangbau
26,Váy Bầu đẹp mùa Hè Thiết Kế Chất Cotton Chấm Bi Dáng Xuông,155.000₫,https://tiki.vn/vay-bau-dep-mua-he-thiet-ke-chat-cotton-cham-bi-dang-xuong-p89912811.html?spid=89912824,27,,,thoitrangbau
27,#Áo bầu công sở size to,50.000₫,https://tiki.vn/ao-bau-cong-so-size-to-p105799348.html?spid=105799368,28,,,thoitrangbau
28,Áo Bầu Thời Trang Công Sở Đẹp Xinh,128.000₫,https://tiki.vn/ao-bau-thoi-trang-cong-so-dep-xinh-p127367252.html?spid=127367271,29,,,thoitrangbau
29,CÁC MẪU VÁY BẦU SIZE NHỎ (vải mặc mùa đông),100.000,https://tiki.vn/cac-mau-vay-bau-size-nho-vai-mac-mua-dong-p105799332.html?spid=105799346,30,,,thoitrangbau
30,,,https://tiki.vn/quan-lot-bau-hang-cao-cap-cap-cheo-chat-dep-mat-day-dan-ql6967-p148638245.html?spid=148638270,31,,,thoitrangbau
31,BỘ LANH SAU SINH CHẤT ĐẸP,105.000₫,https://tiki.vn/bo-lanh-sau-sinh-chat-dep-p107279087.html?spid=107279180,32,,,thoitrangbau
32,Váy bầu dài tay sơ mi dáng suông Thu đông thiết kế thời trang cao cấp v226,137.000₫,https://tiki.vn/vay-bau-dai-tay-so-mi-dang-suong-thu-dong-thiet-ke-thoi-trang-cao-cap-v226-p148640189.html?spid=148640243,33,,,thoitrangbau
33,Quần đùi mặc trong váy cạp chéo ren mẫu mới DV5767,41.580₫,https://tiki.vn/quan-dui-mac-trong-vay-cap-cheo-ren-mau-moi-dv5767-p146575311.html?spid=146575345,34,,,thoitrangbau
34,Quần Mặc Váy Bầu có chun điều chỉnh mềm mịn co giãn 4 chiều - QVB01,38.000₫,https://tiki.vn/quan-mac-vay-bau-co-chun-dieu-chinh-quan-mac-dam-bau-chat-cotton-mem-mat-p185842210.html?spid=185842233,35,,,thoitrangbau
35,,,https://tiki.vn/quan-bau-jean-baggy-form-rong-thoai-mai-p146572267.html?spid=146572476,36,,,thoitrangbau
36,1 Áo Ngực Cho Con Bú Cotton Cúc Tháo Cúp Ngực,61.600₫,https://tiki.vn/1-ao-nguc-cho-con-bu-cotton-cuc-thao-cup-nguc-p177712333.html?spid=177712341,37,,,thoitrangbau
37,Combo 5 quần lót bầu cạp chéo thông hơi siêu thoáng mát,186.000₫,https://tiki.vn/combo-5-quan-lot-bau-cap-cheo-thong-hoi-sieu-thoang-mat-p148640150.html?spid=148640184,38,,,thoitrangbau
38,"váy bầu dáng suông đuôi cá thiết kế đẹp, sang chảnh chất mát mịn V210 (kèm ảnh thật)",137.340₫,https://tiki.vn/vay-bau-dang-suong-duoi-ca-thiet-ke-dep-sang-chanh-chat-mat-min-v210-kem-anh-that-p146572253.html?spid=146572289,39,,,thoitrangbau
39,váy bầu dáng suông cổ đức v204,137.340,https://tiki.vn/vay-bau-dang-suong-co-duc-v204-p146574332.html?spid=146574352,40,,,thoitrangbau
0,XẢ LỖ váy cho con ti sz sm,193.700₫,https://tiki.vn/xa-lo-vay-cho-con-ti-sz-sm-p95173206.html?spid=95173680,1,,,thoitrangbau
1,"Bộ đồ bầu, bộ ngủ 2 dây bản to thiết kế kẻ karo mặc mùa hè siêu mát BĐ833",98.280₫,https://tiki.vn/bo-do-bau-bo-ngu-2-day-ban-to-thiet-ke-ke-karo-mac-mua-he-sieu-mat-bd833-p146574263.html?spid=146574337,2,,,thoitrangbau
2,QUẦN BẦU GIẢ JEAN - LEGGING BẦU JEAN,86.940₫,https://tiki.vn/quan-bau-gia-jean-legging-bau-jean-p146574045.html?spid=146574060,3,,,thoitrangbau
3,BỘ THÔ BẦU QUẦN LỬNG NHIỀU SIZE,150.000,https://tiki.vn/bo-tho-bau-quan-lung-nhieu-size-p105800473.html?spid=105800499,4,,,thoitrangbau
4,,,https://tiki.vn/vay-bau-vai-tho-hoa-nhi-cac-mau-p105799991.html?spid=105800008,5,,,thoitrangbau
5,"Bộ đồ bầu ĐÙI chất thun sữa siêu mềm mát, bộ đồ thiết kế cổ V có chun chỉnh mặc bầu và sau sinh cho bé ti BĐ827",119.700₫,https://tiki.vn/bo-do-bau-dui-chat-thun-sua-sieu-mem-mat-bo-do-thiet-ke-co-v-co-chun-chinh-mac-bau-va-sau-sinh-cho-be-ti-bd827-p146572139.html?spid=146572198,6,,,thoitrangbau
6,QUẦN LÓT BẦU THÔNG HƠI CAO CẤP,41.650₫,https://tiki.vn/quan-lot-bau-thong-hoi-cao-cap-p167244027.html?spid=167244043,7,,,thoitrangbau
7,Quần Bầu Đùi ren Mặc trong váy xuất xưởng,36.540₫,https://tiki.vn/quan-bau-dui-ren-mac-trong-vay-xuat-xuong-p146572152.html?spid=146572169,8,,,thoitrangbau
8,"Đầm bầu công sở 70 KÝ ,VẢI LỤA HÌNH SIÊU NHẸ VÀ VẢI LỤA MÀU , CHẤM CÁT ĐẸP",110.000,https://tiki.vn/dam-bau-cong-so-70-ky-vai-lua-hinh-sieu-nhe-va-vai-lua-mau-cham-cat-dep-p105799927.html?spid=105799951,9,,,thoitrangbau
9,,,https://tiki.vn/quan-bau-cong-so-hang-dep-kem-video-anh-that-377-p146574713.html?spid=146574787,10,,,thoitrangbau
10,Bộ đồ bầu mặc bầu và sau sinh kate thái khoá mở cho bé ti,124.740₫,https://tiki.vn/bo-do-bau-mac-bau-va-sau-sinh-kate-thai-khoa-mo-cho-be-ti-p146574586.html?spid=146575230,11,,,thoitrangbau
11,SET 4 QUẦN LÓT BẦU COTTON CẠP CHÉO DỄ THƯƠNG - HÀNG CHUẨN CAO CẤP,186.150,https://tiki.vn/set-4-quan-lot-bau-cotton-cap-cheo-de-thuong-hang-chuan-cao-cap-p167244024.html?spid=167244029,12,,,thoitrangbau
12,,,https://tiki.vn/ao-lot-cho-con-bu-ab012-sieu-dep-p107279141.html?spid=107279308,13,,,thoitrangbau
13,Bộ đồ sau sinh,69.000₫,https://tiki.vn/bo-do-sau-sinh-p114682408.html?spid=114682447,14,,Đã bán 1,thoitrangbau
14,Váy bầu thu đông thiết kế dáng suông siêu sang chảnh V244,143.000₫,https://tiki.vn/vay-bau-thu-dong-thiet-ke-dang-suong-sieu-sang-chanh-v244-p148641701.html?spid=148641715,15,,,thoitrangbau
15,Quần Bầu Baggy VẢI CẠP CHÉO Cao Cấp có chun chỉnh cho mẹ bầu QB296,84.420₫,https://tiki.vn/quan-bau-baggy-vai-cap-cheo-cao-cap-co-chun-chinh-cho-me-bau-qb296-p146574554.html?spid=146574589,16,,,thoitrangbau
16,(Có size đại) Bộ Pink bầu và sau sinh chất đẹp,179.000,https://tiki.vn/co-size-dai-bo-pink-bau-va-sau-sinh-chat-dep-p107279140.html?spid=107279323,17,,,thoitrangbau
17,,,https://tiki.vn/vay-nu-vay-ngu-2-day-ban-to-mua-he-cuc-ki-thoai-mai-v284-p146572924.html?spid=146573027,18,,,thoitrangbau
18,Bộ thô sau sinh chất đẹp,139.000₫,https://tiki.vn/bo-tho-sau-sinh-chat-dep-p107278979.html?spid=107279016,19,,,thoitrangbau
19,XẢ HÀNG Váy suông 4c cho con bú sz s-xl,128.700₫,https://tiki.vn/xa-hang-vay-suong-4c-cho-con-bu-sz-s-xl-p95172477.html?spid=95172987,20,,,thoitrangbau
20,ẢNH THẬT SHOP CHỤP ️áo nỉ cho con bú ti,227.500₫,https://tiki.vn/anh-that-shop-chup-ao-ni-cho-con-bu-ti-p95173524.html?spid=95173527,21,,,thoitrangbau
21,Váy Bầu Lanh Lụa 2 dây hàng loại 1,79.380₫,https://tiki.vn/vay-bau-lanh-lua-2-day-hang-loai-1-p146575531.html?spid=146575720,22,,,thoitrangbau
22,Váy lanh bầu 4 KHUY có túi - Đầm bầu sát nách mặc ngủ và mặc nhà dễ thương V4K,94.500₫,https://tiki.vn/vay-lanh-bau-4-khuy-co-tui-dam-bau-sat-nach-mac-ngu-va-mac-nha-de-thuong-v4k-p146572218.html?spid=146572378,23,,,thoitrangbau
23,ĐẦM BẦU VÀ KÉO KHÓA CHO CON BÚ CHẤT THUN LẠNH V273,300.000₫,https://tiki.vn/dam-bau-va-keo-khoa-cho-con-bu-chat-thun-lanh-v273-p252639737.html?spid=252639744,24,,,thoitrangbau
24,Váy cho con bú,598.000,https://tiki.vn/vay-cho-con-bu-p95170889.html?spid=95171023,25,,,thoitrangbau
25,,,https://tiki.vn/da-m-ba-u-suong-linen-nu-co-tron-ngan-tay-nhun-eo-b81-p185645656.html?spid=185645658,26,,,thoitrangbau
26,Quần lót bầu cạp chéo loại đẹp,42.000₫,https://tiki.vn/quan-lot-bau-cap-cheo-loai-dep-p143642598.html?spid=143642615,27,,,thoitrangbau
27,Váy bầu đẹp thiết kế công sở dáng suông chất đũi cộc tay màu hồng,167.000₫,https://tiki.vn/vay-bau-dep-thiet-ke-cong-so-dang-suong-chat-dui-coc-tay-mau-hong-p129497528.html?spid=129497539,28,,,thoitrangbau
28,Váy bầu thời trang thiết kế voan hoa màu tím tay cánh tiên 3 tầng,158.000₫,https://tiki.vn/vay-bau-thoi-trang-thiet-ke-voan-hoa-mau-tim-tay-canh-tien-3-tang-p129491779.html?spid=129491781,29,,,thoitrangbau
29,Váy bầu thời trang thiết kế dáng suông dạo phố chất lụa mát màu hồng mùa hè 2021,158.000,https://tiki.vn/vay-bau-thoi-trang-thiet-ke-dang-suong-dao-pho-chat-lua-mat-mau-hong-mua-he-2021-p129494316.html?spid=129494321,30,,,thoitrangbau
30,,,https://tiki.vn/vay-bau-cotton-dep-p129499514.html?spid=129499521,31,,,thoitrangbau
31,Bộ đồ bầu chất mát nhiều màu,126.000₫,https://tiki.vn/bo-do-bau-chat-mat-nhieu-mau-p129499550.html?spid=129499573,32,,,thoitrangbau
32,Bộ bầu và sau sinh dài tay hàng chuẩn loại 1,263.000₫,https://tiki.vn/bo-bau-va-sau-sinh-dai-tay-hang-chuan-loai-1-p129500530.html?spid=129500532,33,,,thoitrangbau
33,Bộ đồ sau sinh dài tay,158.000₫,https://tiki.vn/bo-do-sau-sinh-dai-tay-p129500503.html?spid=129500505,34,,,thoitrangbau
34,VÁY BẦU XINH,189.000,https://tiki.vn/vay-bau-xinh-p129496610.html?spid=129496616,35,,,thoitrangbau
35,,,https://tiki.vn/vay-bau-dep-dang-suong-a-thoi-trang-chat-voan-2-lop-mau-hong-sat-nach-p129495692.html?spid=129495701,36,,,thoitrangbau
36,Váy bầu công sở thời trang đẹp suông A,168.000₫,https://tiki.vn/vay-bau-cong-so-thoi-trang-dep-suong-a-p129492428.html?spid=129492431,37,,,thoitrangbau
37,"Chân váy bầu chất umi đẹp(kèm ảnh thật,80kg trở xuống)",210.000₫,https://tiki.vn/chan-vay-bau-chat-umi-dep-kem-anh-that-80kg-tro-xuong-p129492452.html?spid=129492465,38,,,thoitrangbau
38,Váy bầu suông thời trang chất lụa tơ 40-65kg,42.000₫,https://tiki.vn/vay-bau-suong-thoi-trang-chat-lua-to-40-65kg-p129493839.html?spid=129493873,39,,,thoitrangbau
39,Váy bầu suông thời trang chất cotton,189.000,https://tiki.vn/vay-bau-suong-thoi-trang-chat-cotton-p129499733.html?spid=129499743,40,,,thoitrangbau
0,Bộ bầu mặc nhà chất đẹp 40-70kg,168.000₫,https://tiki.vn/bo-bau-mac-nha-chat-dep-40-70kg-p129491997.html?spid=129492035,1,,,thoitrangbau
1,Váy bầu xinh chất cotton dáng suông dài đuôi cá,158.000₫,https://tiki.vn/vay-bau-xinh-chat-cotton-dang-suong-dai-duoi-ca-p129499667.html?spid=129499671,2,,,thoitrangbau
2,VÁY BẦU ĐẸP CHẤT MÁT THỜI TRANG SUÔNG,263.000₫,https://tiki.vn/vay-bau-dep-chat-mat-thoi-trang-suong-p129494522.html?spid=129494621,3,,,thoitrangbau
3,BỘ BẦU ĐẸP CHẤT LỤA CAO CẤP CÓ CHUN CHỈNH NHIỀU MÀU,126.000,https://tiki.vn/bo-bau-dep-chat-lua-cao-cap-co-chun-chinh-nhieu-mau-p129492565.html?spid=129492591,4,,,thoitrangbau
4,,,https://tiki.vn/vay-bau-phong-mua-he-coc-tay-thiet-ke-thoi-trang-dang-dai-chat-cotton-dep-freesize-40-65kg-maternity-dress-p129495151.html?spid=129495167,5,,,thoitrangbau
5,VÁY BẦU DÁNG DÀI 45-70kg,179.000₫,https://tiki.vn/vay-bau-dang-dai-45-70kg-p129494125.html?spid=129494135,6,,,thoitrangbau
6,BỘ LANH BẦU CHẤT ĐẸP,168.000₫,https://tiki.vn/bo-lanh-bau-chat-dep-p129498110.html?spid=129498120,7,,,thoitrangbau
7,Quần bò bầu đẹp,168.000₫,https://tiki.vn/quan-bo-bau-dep-p129499746.html?spid=129499755,8,,,thoitrangbau
8,BỘ BẦU ĐẸP CHẤT MÁT 40-68kg,168.000,https://tiki.vn/bo-bau-dep-chat-mat-40-68kg-p129498917.html?spid=129498927,9,,,thoitrangbau
9,,,https://tiki.vn/gen-bung-dai-nit-bung-dai-nit-nguc-cai-rat-chat-p179503787.html?spid=179503791,10,,,thoitrangbau
10,Váy bầu xinh thiết kế Aidenshop dáng suông màu trắng đính hoa đen,147.000₫,https://tiki.vn/vay-bau-xinh-thiet-ke-aidenshop-dang-suong-mau-trang-dinh-hoa-den-p129491798.html?spid=129491802,11,,,thoitrangbau
11,"Bộ đồ sau sinh cực đẹp, cotton 100% có chỗ mở cho con bú, quần có chun tăng chỉnh",479.000,https://tiki.vn/bo-do-sau-sinh-cuc-dep-cotton-100-co-cho-mo-cho-con-bu-quan-co-chun-tang-chinh-p90600292.html?spid=90600968,12,,,thoitrangbau
12,,,https://tiki.vn/mua-4-tang-1-ngu-coc-loi-sua-lac-lac-plus-moi-cao-cap-39-loai-hat-giup-me-bo-sung-vitamin-va-khoang-chat-canxi-giup-xuong-chac-khoe-600g-hop-30-goi-p208613606.html?spid=208613607,13,,,thoitrangbau
13,ÁO LÓT THÔNG HƠI CHO BẦU VÀ MẸ CHO CON BÚ,45.000₫,https://tiki.vn/ao-lot-thong-hoi-cho-bau-va-me-cho-con-bu-p159242285.html?spid=159242293,14,,,thoitrangbau
14,quần bầu - quần công sở dành cho bà bầu,67.000₫,https://tiki.vn/quan-bau-quan-cong-so-danh-cho-ba-bau-p207314195.html?spid=207314209,15,,,thoitrangbau
15,Quần Lót Cotton Co Giãn Thoải Mái Dành Cho Mẹ Bầu,29.000₫,https://tiki.vn/quan-lot-cotton-co-gian-thoai-mai-danh-cho-me-bau-p207314165.html?spid=207314181,16,,,thoitrangbau
16,"Áo bigsize bầu đẹp, áo bầu công sở form to, MLEE SHOP ĐỒ BẦU",155.000,https://tiki.vn/ao-bigsize-bau-dep-ao-bau-cong-so-form-to-mlee-shop-do-bau-p254903278.html?spid=254903288,17,,,thoitrangbau
17,,,https://tiki.vn/ao-bau-han-quoc-dep-chat-dui-mat-lanh-ao-ba-bau-mua-he-mlee-shop-p254903356.html?spid=254903358,18,,,thoitrangbau
18,Quần bò bầu dáng baggy cao cấp (đủ size đến 90kg),155.000₫,https://tiki.vn/quan-bo-bau-dang-baggy-cao-cap-du-size-den-90kg-p254903173.html?spid=254903175,19,,,thoitrangbau
19,"Quần lót bầu, quần lót cạp chéo dành cho mẹ bầu",45.000₫,https://tiki.vn/quan-lot-bau-quan-lot-cap-cheo-danh-cho-me-bau-p159241651.html?spid=159241662,20,,,thoitrangbau
20,"Áo bầu xếp ly dáng trẻ trung mẫu mới, áo dập ly form suông, size 40-70kg, mặc được suốt thai kì & sau sinh, MLEESHOP",99.000₫,https://tiki.vn/ao-bau-xep-ly-dang-tre-trung-mau-moi-ao-dap-ly-form-suong-size-40-70kg-mac-duoc-suot-thai-ki-sau-sinh-mleeshop-p270069342.html?spid=270069350,21,,,thoitrangbau
21,Bộ quần áo cotton cho mẹ sau sinh có lật cho con bú,98.000₫,https://tiki.vn/bo-quan-ao-cotton-cho-me-sau-sinh-co-lat-cho-con-bu-p90365463.html?spid=166009107,22,,,thoitrangbau
22,Áo bầu thu đông thun cotton dày dặn ấm áp AB1200,330.000₫,https://tiki.vn/ao-bau-thu-dong-thun-cotton-day-dan-am-ap-ab1200-p141472500.html?spid=141472502,23,,,thoitrangbau
23,Áo bầu thu đông cotton AB1192,302.000₫,https://tiki.vn/ao-bau-thu-dong-cotton-ab1192-p141258648.html?spid=141258654,24,,,thoitrangbau
24,CHÂN VÁY BẦU MÙA HÈ DÁNG DÀI CHẤT COTTON QBN1257,385.000,https://tiki.vn/chan-vay-bau-mua-he-dang-dai-chat-cotton-qbn1257-p109711715.html?spid=109711721,25,,,thoitrangbau
25,,,https://tiki.vn/dam-bau-nu-xinh-xan-p101235017.html?spid=101235019,26,,,thoitrangbau
26,CHÂN VÁY BẦU THU ĐÔNG DÁNG NGẮN SÀNH ĐIỆU QBN1186,355.000₫,https://tiki.vn/chan-vay-bau-thu-dong-dang-ngan-sanh-dieu-qbn1186-p78890544.html?spid=78890552,27,,,thoitrangbau
27,ĐẦM BẦU HÈ THU COTTON DUYÊN DÁNG KIỂU DÁNG TRẺ TRUNG DR2586,305.000₫,https://tiki.vn/dam-bau-he-thu-cotton-duyen-dang-kieu-dang-tre-trung-dr2586-p78946170.html?spid=78946176,28,,Đã bán 4,thoitrangbau
28,QUẦN SÓC PHỐI REN NỮ TÍNH QBN1114,295.000₫,https://tiki.vn/quan-soc-phoi-ren-nu-tinh-qbn1114-p78970565.html?spid=78970583,29,,Đã bán 1,thoitrangbau
29,QUẦN BẦU HÈ THU DÁNG NGỐ ĐÙI ÔM XINH XẮN QBN1242,195.000,https://tiki.vn/quan-bau-he-thu-dang-ngo-dui-om-xinh-xan-qbn1242-p113198107.html?spid=113198116,30,,Đã bán 1,thoitrangbau
30,,,https://tiki.vn/quan-bau-he-thu-chat-vai-phong-cach-cong-so-tre-trung-qbn1234-p113166038.html?spid=113166042,31,,,thoitrangbau
31,Áo bầu thu đông thun cotton nhấn ly tay điệu AB1208,358.000₫,https://tiki.vn/ao-bau-thu-dong-thun-cotton-nhan-ly-tay-dieu-ab1208-p141480037.html?spid=141480041,32,,,thoitrangbau
32,QUẦN JEAN NGỐ ĐÙI BẦU DÁNG DÀI QBD1511,330.500₫,https://tiki.vn/quan-jean-ngo-dui-bau-dang-dai-qbd1511-p258863121.html?spid=258863129,33,,,thoitrangbau
33,QUẦN BẦU JEAN DÁNG BAGGY QBN1141,425.000₫,https://tiki.vn/quan-bau-jean-dang-baggy-qbn1141-p253389019.html?spid=253389027,34,,,thoitrangbau
34,QUẦN BẦU HÈ THU NGỐ CHẤT COTTON THUN SIÊU MÁT MÙA HÈ QBN1251,250.000,https://tiki.vn/quan-bau-he-thu-ngo-chat-cotton-thun-sieu-mat-mua-he-qbn1251-p255109730.html?spid=255109736,35,,,thoitrangbau
35,,,https://tiki.vn/chan-vay-bau-mua-he-jean-mem-sanh-dieu-qbn1133-qbv1606-p253286132.html?spid=253286140,36,,,thoitrangbau
36,Bộ Bầu Và Sau Sinh Cotton Cho Mẹ 50-67kg,65.000₫,https://tiki.vn/bo-bau-va-sau-sinh-cotton-cho-me-50-67kg-p101253552.html?spid=101253606,37,,,thoitrangbau
37,Bộ lanh lụa cúc giữa cho mẹ bầu và sau sinh,129.000₫,https://tiki.vn/bo-lanh-lua-cuc-giua-cho-me-bau-va-sau-sinh-p101252820.html?spid=101252824,38,,Đã bán 1,thoitrangbau
38,váy bi bầu dáng baby doll- Đầm bầu,199.000₫,https://tiki.vn/vay-bi-bau-dang-baby-doll-dam-bau-p92357924.html?spid=92357935,39,,,thoitrangbau
39,váy bầu cổ viền,199.000,https://tiki.vn/vay-bau-co-vien-p92322063.html?spid=92322066,40,,,thoitrangbau
0,Váy bầu Quảng Châu hồng nhạt,320.000₫,https://tiki.vn/vay-bau-quang-chau-hong-nhat-p92322236.html?spid=92322266,1,-12%,,thoitrangbau
1,Baggy bầu công sở cạp V mới nhất 2021,200.000₫,https://tiki.vn/baggy-bau-cong-so-cap-v-moi-nhat-2021-p92322166.html?spid=92322201,2,-12%,Đã bán 1,thoitrangbau
2,Váy bầu chấm bi nơ ngực,150.000₫,https://tiki.vn/vay-bau-cham-bi-no-nguc-p92322488.html?spid=92322511,3,-12%,,thoitrangbau
3,Quần tất 3D bầu ( nhìn như đi tất mỏng nhưng lại là dày ),150.000,https://tiki.vn/quan-tat-3d-bau-nhin-nhu-di-tat-mong-nhung-lai-la-day-p92320724.html?spid=92320726,4,,,thoitrangbau
4,,,https://tiki.vn/quan-ni-bau-dang-bom-co-chun-p92319075.html?spid=92319077,5,,,thoitrangbau
5,váy cotton bầu dáng suông,230.000₫,https://tiki.vn/vay-cotton-bau-dang-suong-p92319513.html?spid=92319514,6,,,thoitrangbau
6,Váy chun ngực cánh tiên,199.000₫,https://tiki.vn/vay-chun-nguc-canh-tien-p92319589.html?spid=92319590,7,,,thoitrangbau
7,Váy bầu thiết kế nơ cổ đức GIẢ YẾM v101,350.000₫,https://tiki.vn/vay-bau-no-co-duc-gia-yem-p205894372.html?spid=205894379,8,,,thoitrangbau
8,Sơ mi kẻ hàng Quảng Châu,250.000,https://tiki.vn/so-mi-ke-hang-quang-chau-p92319464.html?spid=273214761,9,,Đã bán 1,thoitrangbau
9,,,https://tiki.vn/dam-bau-dep-ke2001-vay-bau-sat-nach-chat-voan-lua-hai-lop-mau-hong-p162330900.html?spid=218750939,10,,,thoitrangbau
10,Đầm 2 dây tone màu tím xinh xẻo,160.000₫,https://tiki.vn/dam-2-day-tone-mau-tim-xinh-xeo-p195148744.html?spid=195148745,11,,,thoitrangbau
11,Túi zíp quần bà bầu cao cấp (monmonshop24h),32.000₫,https://tiki.vn/tui-zip-quan-ba-bau-cao-cap-monmonshop24h-p97009940.html?spid=108202202,12,,,thoitrangbau
12,,,https://tiki.vn/bo-do-bau-sau-sinh-cho-con-bu-ti-xo-nhat-tho-dui-cuc-mat-pijama-bau-sau-sinh-quan-ao-bau-mac-nha-mua-he-dep-bigsize-p114404626.html?spid=114405600,13,,,thoitrangbau
13,Váy bầu xinh công sở COTTON 2 MÀU - Đầm bầu sau sinh cho con bú ti - Đầm bầu cho mẹ thời trang đẹp dự tiệc Bigsize,280.000₫,https://tiki.vn/vay-bau-xinh-cong-so-cotton-2-mau-dam-bau-sau-sinh-cho-con-bu-ti-dam-bau-cho-me-thoi-trang-dep-du-tiec-bigsize-p114404709.html?spid=114404925,14,,,thoitrangbau
14,"Bộ đồ bầu CỔ BÈO - Đồ sau sinh cho con bú ti dài tay, quần áo cho mẹ thời trang đẹp mặc nhà Cotton mùa hè giá rẻ Bigsize NEW",159.000₫,https://tiki.vn/bo-do-bau-co-beo-do-sau-sinh-cho-con-bu-ti-dai-tay-quan-ao-cho-me-thoi-trang-dep-mac-nha-cotton-mua-he-gia-re-bigsize-2022-p191576367.html?spid=191576376,15,,,thoitrangbau
15,(Giá huỷ diệt) Quần mặc trong váy bầu,46.800₫,https://tiki.vn/gia-huy-diet-quan-mac-trong-vay-bau-p92318957.html?spid=98565305,16,,,thoitrangbau
16,Áo lót bầu và sau sinh cho con bú cotton kẻ thoáng mát co giãn ALB05,170.000,https://tiki.vn/ao-lot-bau-va-sau-sinh-cho-con-bu-cotton-ke-thoang-mat-co-gian-alb05-p164582527.html?spid=164582538,17,,,thoitrangbau
17,,,https://tiki.vn/quan-short-bau-lua-chan-ren-mac-nha-mua-he-co-chun-chinh-va-dap-bung-chat-mat-danh-cho-phu-nu-mang-thai-p243057976.html?spid=243057980,18,,,thoitrangbau
18,"Đầm bầu sơ mi kẻ sọc thoáng khí thời trang ,Váy bầu nữ dáng suông tay lỡ Da132",269.000₫,https://tiki.vn/dam-bau-so-mi-ke-soc-thoang-khi-thoi-trang-vay-bau-nu-dang-suong-tay-lo-da132-p164582570.html?spid=164582608,19,,,thoitrangbau
19,Váy Bầu Đầm Bầu Xinh Thun Trơn A1740,175.000₫,https://tiki.vn/vay-bau-dam-bau-xinh-thun-tron-a1740-p109312645.html?spid=112227386,20,,,thoitrangbau
20,Đầm bầu thun dáng rộng co giãn 4 chiều DB03,175.000₫,https://tiki.vn/dam-bau-thun-dang-rong-co-gian-4-chieu-db03-p106304089.html?spid=106304179,21,,,thoitrangbau
21,"Đầm bầu suông linen cổ tròn ngắn tay mặc hè, chất linen tự nhiên mềm mát Haint Boutique B84",246.000₫,https://tiki.vn/dam-bau-suong-linen-co-tron-ngan-tay-mac-he-chat-linen-tu-nhien-mem-mat-haint-boutique-b84-p185353545.html?spid=185353551,22,,Đã bán 3,thoitrangbau
22,Khăn Choàng Tắm Cho Bé Sơ Sinh Có Mũ Siêu Mềm Thấm Hút Tốt An Toàn Cho Trẻ Em,99.000₫,https://tiki.vn/khan-choang-tam-cho-be-so-sinh-co-mu-sieu-mem-tham-hut-tot-an-toan-cho-tre-em-p207033145.html?spid=207033173,23,,Đã bán 4,thoitrangbau
23,QUẦN LÓT BẦU ĐÙI - QUẦN LÓT ĐÙI CẠP CHÉO - COTTON 100,53.000₫,https://tiki.vn/quan-lot-bau-dui-quan-lot-dui-cap-cheo-cotton-100-p167244001.html?spid=167244007,24,,,thoitrangbau
24,CHUYEN SI: Quần lót bầu,180.000,https://tiki.vn/chuyen-si-quan-lot-bau-p122234969.html?spid=122234995,25,,,thoitrangbau
25,,,https://tiki.vn/quan-tat-bau-day-vua-co-chun-chinh-p146572990.html?spid=146573016,26,,,thoitrangbau
26,BỘ ĐỒ BẦU áo BABYDOLL quần ống rộng bo gấu trẻ trung năng động BĐ932,144.900₫,https://tiki.vn/bo-do-bau-ao-babydoll-quan-ong-rong-bo-gau-tre-trung-nang-dong-bd932-p146573286.html?spid=146573328,27,,,thoitrangbau
27,Đầm bầu voan hoa nhí,159.000₫,https://tiki.vn/dam-bau-voan-hoa-nhi-p99869898.html?spid=99869909,28,,,thoitrangbau
28,Đầm bầu công sở thiết kế dáng suông tầng freesize dưới 70kg,165.000₫,https://tiki.vn/dam-bau-cong-so-thiet-ke-dang-suong-tang-freesize-duoi-70kg-p89912269.html?spid=89912271,29,,,thoitrangbau
29,Chân váy bầu chất đẹp có đáp KA215,266.500,https://tiki.vn/chan-vay-bau-chat-dep-co-dap-ka215-p89912650.html?spid=89912657,30,,,thoitrangbau
30,,,https://tiki.vn/bo-lanh-lua-mo-nap-nguc-cho-me-bau-va-sau-sinh-p93246125.html?spid=93246127,31,,,thoitrangbau
31,Váy Bầu Thời Trang Thiết Kế Chất Cotton Đẹp,279.500₫,https://tiki.vn/vay-bau-thoi-trang-thiet-ke-chat-cotton-dep-p89912272.html?spid=89912274,32,,,thoitrangbau
32,Váy bầu hè hở vai chấm bi màu hồng YA1705 Đàm bầu thời trang thiết kế chất lụa freesize dưới 65kg,292.500₫,https://tiki.vn/vay-bau-he-ho-vai-cham-bi-mau-hong-ya1705-dam-bau-thoi-trang-thiet-ke-chat-lua-freesize-duoi-65kg-p89912540.html?spid=89912593,33,,,thoitrangbau
33,Váy Bầu Thun Cotton Váy Bầu Có Cổ Thêu Ngực Váy Bầu Hè Dáng Suông Ngắn Tay HD2620 Honey Mommy Đầm Bầu Mùa Hè Đi Chơi,390.000₫,https://tiki.vn/vay-bau-thun-cotton-vay-bau-co-co-theu-nguc-vay-bau-he-dang-suong-ngan-tay-hd2620-honey-mommy-dam-bau-mua-he-di-choi-p95583788.html?spid=95583805,34,,,thoitrangbau
