,title,price,link_item,index,discount,sales,category
0,COMBO 2 HỘP Ngũ Cốc Bầu Lạc Lạc Plus 30 gói 600g Tặng quà cho bé,507.400₫,https://tka.tiki.vn/pixel/pixel?data=cBvHhpKtg4GuEQzegqETlO9BqKG4EaKd8xA48XdJXwPyGKhEvTRwTfLpfrqdbBHKgtb4-DM0UHKsL_Hi94vBCmNvWtnhwuzSuCrBpH4vNfOb4M_Z6Pfchv7YusUpD1tRYE15migHe2516bAthyYHu4LKWPpkMbBGMsolQN2YpS_B-_yINto-sFn1Rf4uyl9lTzEmPBURIgVa4EX7O_Kcuy9tVzvB_xlP1o1uEaeAUea74SNR0L5keSeninLTQPGPZTVqrRKmIS9S4sD-cc95F3GttxO5kqyDyLkiUdMnoRTf7-QuPCPv97nV6cAlQMsYH_fP2B_npqAK9DJ-hrfGOYed0IKjUa0EupYDMJwSo_ldJLzO35nsQl3SfIr7-8QxGnhCqkn4GJj4WhmRq91cPbaF56U0SB37spwwzglD-b6HQjriJe0EJO6c3TDTudCWpBp54eu3mhd2xHcsBFOgQGuX30iOm3QUPnjcScBC1d0dBqCJxozrDGHvWMRxgOdeIGZdZA2Zn27YtgcgJlYNztAc5QWTZIcnz4_dmaf07qBraKtNPZ79vRl1EWB4hC2cN9MY6wrw9a3MeBsxuEbhuKU2Ir3Y_8EtKJxrzY2wnWdDeOQ0E5_s_icu_jIlBPSsRO9JcAcVSixMoqFrfDwk0-NJ39JWT0UzPl73yWzbgVXGOnuWW6NjaQOgYvogCSz0-GdwQZk_PQuyEw7D0pqPS5a_eLA86WlWsLlyqh5L8t_jY3uj7_tRIqy1VpRKBCdOGhajnbNQUGnWM7MdQniaCibNbC9dAAbF4WskZ8ykjOAnKoKryfb0abQ7Hxb7YKke9ECul36l2LbWuQ7jjQCaKCzNKXI4NfbPA_vfFvqiEzQ_eAeYCbP2ZAwmTBCG5qmI2eKl2KDVn-deIH9RtmdqpZoXnMR0tZow6cERh-f4LDA2FkKQ966tJMyZeFd-9_Vc_kKHnUUFIMavU5z3A-SiQBadGEJvqHL7KD-z4eDvWoDAikfS2aQET--YxjPpnycQ_YBJe1fl2Ulsh9PMI8TVjfobdkQ68-bsoALBEcMorgrF2nLxAPxbTZ0uMhgOBYAqqqjbK5u4UVwyjoA_9Yy4INI&reqid=rgYakNazGpWcgJfq&type=CLICK&pos=1,1,-14%,Đã bán 5,thoitrangbau
1,"Ngũ cốc bầu siêu dinh dưỡng Lạc Lạc giảm ốm nghén, giúp xương của bé phát triển toàn diện, vào con nhiều hơn vào mẹ",257.140₫,https://tka.tiki.vn/pixel/pixel?data=lMgz83QQLfY_ZqeTxe5c5NAHAU6hMS32GYrpp8vTF6yZ4vlHtJ_AtTj5ftxxk6Qtc8UImXlUK6q7odmb7oITdoZry7yusgWr1gVUli4yfDT67lwKqchkvThrJ-RjoacIleEv69jcFO-qoDYWN76Dj8D-eiybw6DNuiUqWZoxo4uFwLPXvVZVzLXkwqd5bRoqXx58XXReyl8RhaXecxZzTqFqbjSfdXhgD8uOBMOerq4tS6tzM4DtwPiRJxTlagtyobodBuFMa7u8Nm3NOZoDnfGX64My2nIcSPhLptVNRBLzCG87GZS3yKSirFCNtUdewxx29YdCgsMgCbK6w1TMxuGKbnjEyhkSe7gi2LPEKeAEU5_VlgLXhZx5aepriXxKiUHCDfj-SHMRFVK3yKePIQ0lKcVkOCremY8O7dcIJM9EeZYoKMVLCdB5VqR5lfgaNAHa2whGSI6nEL8qlPRuCre1P2i3utecihxjYRVsoxlK1Z7_YrVRQftbdYUkCbvJlMUqxApiL5amhHYetYgu5xCdoygpO4A1R0LL6OmxCgGkMpHmtL1JhXp4zSguf1_zomtrap6vcEwYBMXPt6fSQhXjun1CMdhZPYkRDjDLh4P9pAOwlfADXmxb9UDExq1Q_RysKE7EDnBBoAkyNJzYnMfkvXTSPaOqqw0mTintXtanwuuwlWzGgXnETJfJfNeN4M4HNKbeblZKx7AX5CJNDgQ4tOJWrq0DVIYDbP5MkU_dJpOfQo5uUuTsrg2tdzOflNLhKJ9V9IEfbhMuP8Wk2CzacGD5-4JAtXNe3hOzMsnU0MxZHpSqJIQYMU5M8HGLe5X6eZtg6Y5a_hHZrYZKCczEmBrQRi6bQZKFS1imr8E_I3OvLf2lzXcmUs1sd5KpVQtfUahUIpua2u50vvm-F2OhR3VzwCa9MUwW2Brx_HBukObqm1dpewlvrxpWSDSNRhZhiIihPjszC_H419litQ9KkGxxb05HUMqZK0Yv7EaacAdVVxXyHV3uAGPnUrITx7ANoG_14IBJ-RW46-Mo3rlZQfJVVEX9ziTTz0RoK-dkogMDysseXn-oZaM8SKmaFcvQqO525-TkHCPP6iV7Hq5Ff2fxdlG-8568ujINIICV5ptVnQOwCckGVkUzuJOJbP8nAsliQ7ChY3FMRBzEA8nP&reqid=rgYakNazGpWcgJfq&type=CLICK&pos=2,2,-14%,Đã bán 30,thoitrangbau
2,"Ngũ cốc lợi sữa Lạc Lạc Plus mới cao cấp 39 loại hạt giúp mẹ bổ sung vitamin và khoáng chất, canxi giúp xương chắc khỏe 600g (hộp 30 gói)",515.000₫,https://tka.tiki.vn/pixel/pixel?data=fVFfaCUZW51jXxNQZV4GpayLXtakuri9vyBX3zPy249X8l1r4W-X632ZegpLwuvC61djz9HLQ5YvyzBJEQLWGae7agXH3NsKOYHeXLt4xV5X439fUzej8lJSeAs9AIAzrAaI3yiAuAV1ZYxexqFi57NNw7ujvau_6nLWwdv0rvIsEmmP8Q19rByEo-JLUWPVsH6MUN5PcnFMoHYCF2V2ZX3lFbMni4DG1LSkmB24MfDgZCD6yJr13OJbNdVY8Srs_sF_ETsJCrsi4Ixo5cZAKZxOkmJrT26G2bs5epAHx3VXeMF4crl-pKxLWfLW9Xh-D-UzcdzszpOqpapecgjUpxjoEdINPhkS39eO9iC7uSVKpvbuNGG9NSurEIxdz7epBbiqnpV3Bl66atHg9U8K0KQinUi_MwvDoJtL7ZGKXrWSbstd4sKEmFx_JFDqUJiZiQs2Kqpg-CXM8M-B8T2DABvNZk14-UQ7cwBB_Ak7a3qSmAv35t89ehRYMo4ZPAceypPnO1uP9zmoh19U0k4tXsUmaR_kgFY3QQyPJx2rYfoJZRaAoUqqtnJkM6J1g7FUEK_MmFafhXc-tRp1L_aUp5t1m9wUcVuPyRiG5MB7wqFLWq2LkB8bAVHqOaGCJQc9zs9iLdoeGr-PJ7viXSB3AV6KimcXxf9ila4kI9W7VHxZ9aKjNjkwaTBWbo6qvLJ6EN9C53zg_aMPqSy0nkQUJ4RcagGBXeXvDKVZFLDmeutm-uIMVqRoKfo0QsqdA8QnMspt5auvDjSmHL8zg6lv9H3YqjUCho7loDWJjjaB4keW9qHMaDLghoP5O2BASHSz7JK-fpXI0PtbfGDeWpDOnEcWJ5Hx9vAHYBcGjc8RYuV-uXOuMmCpnDsSnLoNZyvPBqBVXDI4D58y2j4EX-xX-Qro3i9TxAuGY600rZMQwdun9_Fma9dggNVH_rG4KWdlxkoGCuzni8O1g_k-B0QGVw7L0fNe1mNzrsCYiwLdEaZiof1iL7t-tYTv4_rBrFqasOniRD8IjdLHyQs5ngJRhUOyQM6QCnSQa8Fv2PSsN_cB5DjYoXaKQebk9qOSxXgwbnvUaZsdl38sFdApjFUH8IfZIhD3nND2wFPZ-B_mN_jqnjqXxTcD0yetD79PcWQc9OGRtKUsmmU&reqid=rgYakNazGpWcgJfq&type=CLICK&pos=3,3,-14%,Đã bán 1,thoitrangbau
3,Áo lót bầu- áo lót cho con bú chống chảy xệ mặc bầu và sau sinh AL06,66.000₫,https://tiki.vn/ao-lot-bau-ao-lot-cho-con-bu-chong-chay-xe-mac-bau-va-sau-sinh-al06-p148640368.html?spid=148640418,4,-14%,Đã bán 48,thoitrangbau
4,QUẦN BẦU CÓ ĐÁP BỤNG - QUẦN LEGGING BẦU CÓ ĐÁP BỤNG,74.340₫,https://tiki.vn/quan-bau-co-dap-bung-quan-legging-bau-co-dap-bung-p146573650.html?spid=146573667,5,-2%,Đã bán 9,thoitrangbau
5,Quần bầu dài legging cạp chéo co giãn thoải mái hàng đẹp QB1111,75.000₫,https://tiki.vn/quan-bau-dai-legging-cap-cheo-co-gian-thoai-mai-hang-dep-qb1111-p148639723.html?spid=148639812,6,,Đã bán 13,thoitrangbau
6,Quần mặc váy bầu quần đùi mặc trong váy bầu cạp chéo màu đen màu da chất cotton mát,45.000₫,https://tiki.vn/quan-mac-vay-bau-quan-dui-mac-trong-vay-bau-cap-cheo-mau-den-mau-da-chat-cotton-mat-p86050510.html?spid=147326963,7,,Đã bán 3,thoitrangbau
7,Quần Bầu Ống Rộng Dáng Suông AZ29 Chất Liệu Lụa Băng Siêu Mát Cho Phụ Nữ Mang Thai Mùa Hè Có Đáp Và Chun Chỉnh Bụng Tiện Lợi,230.000₫,https://tiki.vn/quan-bau-ong-rong-dang-suong-az29-chat-lieu-lua-bang-sieu-mat-cho-phu-nu-mang-thai-mua-he-co-dap-va-chun-chinh-bung-tien-loi-p243057726.html?spid=243057732,8,,Đã bán 5,thoitrangbau
8,Quần bầu mặc trong váy dành cho bà bầu chất cotton trơn xuất xưởng loại đep,31.500₫,https://tiki.vn/quan-bau-mac-trong-vay-danh-cho-ba-bau-chat-cotton-tron-xuat-xuong-loai-dep-p146574871.html?spid=146574907,9,,Đã bán 35,thoitrangbau
9,"Áo Lót Cho Con Bú Chống Chảy Xệ, Áo Ngực Cho Mẹ Bầu sieu hot",66.780₫,https://tiki.vn/ao-lot-cho-con-bu-chong-chay-xe-ao-nguc-cho-me-bau-sieu-hot-p146572239.html?spid=146572531,10,,Đã bán 11,thoitrangbau
10,"Quần bầu cạp chéo - Thoải mái hơn, tiện lợi hơn",74.340₫,https://tiki.vn/quan-bau-cap-cheo-thoai-mai-hon-tien-loi-hon-p146574315.html?spid=146574330,11,,Đã bán 16,thoitrangbau
11,Quần Bầu Đùi Mặc Trong Váy Cạp Chéo Ren,39.060₫,https://tiki.vn/quan-bau-dui-mac-trong-vay-cap-cheo-ren-p146574791.html?spid=146574833,12,,Đã bán 3,thoitrangbau
12,Bộ đồ mặc nhà sau sinh MLURE cotton dài tay thiết kế lật ti tiện lợi BD943,148.000₫,https://tiki.vn/bo-do-mac-nha-sau-sinh-mlure-cotton-dai-tay-thiet-ke-lat-ti-tien-loi-bd943-p148637233.html?spid=148637261,13,,Đã bán 2,thoitrangbau
13,áo bầu thời trang mẫu mới,129.000₫,https://tiki.vn/ao-bau-thoi-trang-mau-moi-p98367140.html?spid=191515375,14,,Đã bán 1,thoitrangbau
14,Combo đồ lót bầu 2 áo thông hơi 5 quần,233.100₫,https://tiki.vn/combo-do-lot-bau-2-ao-thong-hoi-5-quan-p146574948.html?spid=146575148,15,,Đã bán 1,thoitrangbau
15,Thanh lý - Bộ sau sinh kéo khóa ngực tiện lợi cho mẹ,125.000₫,https://tiki.vn/thanh-ly-bo-sau-sinh-keo-khoa-nguc-tien-loi-cho-me-p87270512.html?spid=87270606,16,,Đã bán 3,thoitrangbau
16,5 chiếc quần lót giấy cao cấp hàng đẹp,11.340₫,https://tiki.vn/5-chiec-quan-lot-giay-cao-cap-hang-dep-p146572401.html?spid=146572483,17,,Đã bán 15,thoitrangbau
17,Quần lót bầu cạp chéo cotton nhiều màu sắc QL001,13.734₫,https://tiki.vn/quan-lot-bau-cap-cheo-cotton-nhieu-mau-sac-ql001-p146575378.html?spid=146575443,18,,Đã bán 15,thoitrangbau
18,Quần bầu ỐNG SỚ LỬNG thời trang chất đũi nhật siêu mát có chun chỉnh bụng QBOSL 1000,56.700₫,https://tiki.vn/quan-bau-ong-so-lung-thoi-trang-chat-dui-nhat-sieu-mat-co-chun-chinh-bung-qbosl-1000-p146575276.html?spid=146575310,19,,Đã bán 4,thoitrangbau
19,Bộ đồ bầu pizama cổ bẻ chất kate thái thiết kế khóa ngực cho bé ti BPJM930,124.740₫,https://tiki.vn/bo-do-bau-pizama-co-be-chat-kate-thai-thiet-ke-khoa-nguc-cho-be-ti-bpjm930-p146572505.html?spid=146572749,20,,Đã bán 1,thoitrangbau
20,Combo đồ lót bầu 3 áo thông hơi 3 quần,214.200₫,https://tiki.vn/combo-do-lot-bau-3-ao-thong-hoi-3-quan-p146572282.html?spid=146572331,21,,Đã bán 2,thoitrangbau
21,COMBO 2 HỘP Ngũ Cốc Bầu Lạc Lạc Plus 30 gói 600g Tặng quà cho bé,507.400₫,https://tiki.vn/combo-2-hop-ngu-coc-bau-lac-lac-plus-30-goi-600g-tang-qua-cho-be-p230124352.html?spid=230124353,22,,Đã bán 5,thoitrangbau
22,"Quần lót bầu cạp chéo phối ren mềm mại siêu xinh, thoáng mát QL9090",33.000₫,https://tiki.vn/quan-lot-bau-cap-cheo-phoi-ren-mem-mai-sieu-xinh-thoang-mat-ql9090-p148636981.html?spid=148637019,23,,Đã bán 17,thoitrangbau
23,Bộ Đồ bầu thun cotton dài vạt chéo mặc bầu và sau sinh,149.940₫,https://tiki.vn/bo-do-bau-thun-cotton-dai-vat-cheo-mac-bau-va-sau-sinh-p146574753.html?spid=146574873,24,,Đã bán 1,thoitrangbau
24,Áo lót bầu thông hơi - Áo ngực mở cúc ngang mặc sau sinh AL183,34.000₫,https://tiki.vn/ao-lot-bau-thong-hoi-ao-nguc-mo-cuc-ngang-mac-sau-sinh-al183-p148639214.html?spid=148639317,25,,Đã bán 6,thoitrangbau
25,Quần bầu len giữ nhiệt sọc thể thao (1135),95.760₫,https://tiki.vn/quan-bau-len-giu-nhiet-soc-the-thao-1135-p146572791.html?spid=146572927,26,,Đã bán 2,thoitrangbau
26,"ĐỒ LÓT BẦU COMBO 3 ÁO LÓT BẦU VÀ 3 QUẦN LÓT BẦU KHÁNG KHUẨN, Đồ bầu MLEE",209.000₫,https://tiki.vn/do-lot-bau-combo-3-ao-va-3-quan-lot-bau-khang-khuan-p159242057.html?spid=159242062,27,,Đã bán 2,thoitrangbau
27,Váy bầu công sở thiết kế sang chảnh,230.000₫,https://tiki.vn/vay-bau-cong-so-thiet-ke-sang-chanh-p113590391.html?spid=113590399,28,,,thoitrangbau
28,Váy Bầu Có Cổ Kẻ Caro Dáng Suông Váy Bầu Hè Tay Ngắn Đi Chơi HD2818 Honey Mommy Đầm Bầu Mùa Hè Công Sở Đi Làm,338.000₫,https://tiki.vn/vay-bau-co-co-ke-caro-dang-suong-vay-bau-he-tay-ngan-di-choi-hd2818-honey-mommy-dam-bau-mua-he-cong-so-di-lam-p95584047.html?spid=95584238,29,,,thoitrangbau
29,"Áo Lót Bầu và Cho Con Bú Chống Chảy Xệ, Áo Lót Cho Mẹ Bầu Siêu Hót",91.000₫,https://tiki.vn/ao-lot-bau-va-cho-con-bu-chong-chay-xe-ao-lot-cho-me-bau-sieu-hot-p127456522.html?spid=127456998,30,,Đã bán 11,thoitrangbau
30,"Váy bầu thời trang,Đầm bầu thiết kế công sở dáng suông chất linen tự nhiên mát B72",299.000₫,https://tiki.vn/vay-bau-thoi-trang-dam-bau-thiet-ke-cong-so-dang-suong-chat-linen-tu-nhien-mat-b72-p185990019.html?spid=185990027,31,,,thoitrangbau
31,"Ngũ cốc bầu siêu dinh dưỡng Lạc Lạc giảm ốm nghén, giúp xương của bé phát triển toàn diện, vào con nhiều hơn vào mẹ",98.000₫,https://tiki.vn/ngu-coc-bau-sieu-dinh-duong-lac-lac-giam-om-nghen-giup-xuong-cua-be-phat-trien-toan-dien-vao-con-nhieu-hon-vao-me-p251510055.html?spid=251510074,32,,Đã bán 30,thoitrangbau
32,Quần Lót Bà Bầu và Sau Sinh Cạp Chéo Chất Cotton Hàng Loại 1,39.000₫,https://tiki.vn/quan-lot-ba-bau-va-sau-sinh-cap-cheo-chat-cotton-hang-loai-1-p127456365.html?spid=127456455,33,,Đã bán 3,thoitrangbau
33,Áo bầu đẹp phong cách tiểu thư,230.000₫,https://tiki.vn/ao-bau-dep-phong-cach-tieu-thu-p113589717.html?spid=113589754,34,,,thoitrangbau
34,Quần lót bầu THÔNG HƠI CẠP CHÉO VIỀN REN xinh xắn siêu sịn mịn QL01,169.000₫,https://tiki.vn/quan-lot-bau-thong-hoi-cap-cheo-vien-ren-xinh-xan-sieu-sin-min-ql01-p164582691.html?spid=164582721,35,,,thoitrangbau
35,Váy Bầu Yếm 2 Dây Dáng Xòe Cộc Tay Dáng Dài Đi Chơi Đi Làm HD2618 Honey Mommy Đầm Bầu Yếm Mùa Hè Vải Mát,325.000₫,https://tiki.vn/vay-bau-yem-2-day-dang-xoe-coc-tay-dang-dai-di-choi-di-lam-hd2618-honey-mommy-dam-bau-yem-mua-he-vai-mat-p95583949.html?spid=95583954,36,,,thoitrangbau
36,Váy Bầu Hè Cộc Tay Dáng Suông Thiết Kế Đi Chơi Sang Chảnh HD2627 Honey Mommy Đầm Bầu Công Sở,175.000₫,https://tiki.vn/vay-bau-he-coc-tay-dang-suong-thiet-ke-di-choi-sang-chanh-hd2627-honey-mommy-dam-bau-cong-so-p95584185.html?spid=95584195,37,,,thoitrangbau
37,"ĐẦM BẦU , VÁY BẦU CÔNG SỞ YẾM HẢI QUÂN ( có kèm áo thun )",380.000₫,https://tiki.vn/dam-bau-vay-bau-cong-so-yem-hai-quan-co-kem-ao-thun-p163581385.html?spid=163581387,38,,Đã bán 2,thoitrangbau
38,Đầm cho con bú sz m l xl xxl,377.000₫,https://tiki.vn/dam-cho-con-bu-sz-m-l-xl-xxl-p95173370.html?spid=95173416,39,,Đã bán 1,thoitrangbau
39,Áo ngực bầu- Áo lót bầu và cho con bú mở cúc ngang tiện lợi AL2092,32.000₫,https://tiki.vn/ao-nguc-bau-ao-lot-bau-va-cho-con-bu-mo-cuc-ngang-tien-loi-al2092-p148641488.html?spid=148641502,40,,Đã bán 17,thoitrangbau
40,Quần bầu có chun chỉnh chất NHUNG TĂM dáng bo chân dày dặn siêu ấm kiểu dáng trẻ trung năng động QB1282,129.000₫,https://tiki.vn/quan-bau-co-chun-chinh-chat-nhung-tam-dang-bo-chan-day-dan-sieu-am-kieu-dang-tre-trung-nang-dong-qb1282-p148639543.html?spid=148639619,41,,Đã bán 5,thoitrangbau
41,Váy sơ mi lụa hàn quốc cho con bú ẢNH thật,559.000₫,https://tiki.vn/vay-so-mi-lua-han-quoc-cho-con-bu-anh-that-p95173487.html?spid=95173507,42,,Đã bán 2,thoitrangbau
42,Quần lót bầu quần mặc váy bầu bắt chéo chất cotton cao cấp,39.648₫,https://tiki.vn/quan-lot-bau-quan-mac-vay-bau-bat-cheo-chat-cotton-cao-cap-p120856775.html?spid=120856813,43,,Đã bán 11,thoitrangbau
0,Áo sơ mi form thụng cá tính cho các nàng bầu AB3142,225.000₫,https://tiki.vn/ao-so-mi-form-thung-ca-tinh-cho-cac-nang-bau-ab3142-p262851542.html?spid=262851566,1,-12%,,thoitrangbau
1,"Bồ Đồ Bầu Sau Sinh Lửng pha kẻ Mặc Hè Cho Mẹ, Bộ Lửng Cottong Chất Mát, Tiện Lợi",149.000₫,https://tiki.vn/bo-do-bau-sau-sinh-lung-pha-ke-mac-he-cho-me-bo-lung-cottong-chat-mat-tien-loi-p126881586.html?spid=160889756,2,,,thoitrangbau
2,"Áo bầu CÔNG SỞ kéo khóa cánh tiên, chất cotton thấm hút mồ hôi có size 48->72kg",125.000₫,https://tiki.vn/ao-bau-cong-so-keo-khoa-canh-tien-chat-cotton-tham-hut-mo-hoi-co-size-48-72kg-p103098404.html?spid=116458867,3,,Đã bán 1,thoitrangbau
3,Bộ đồ bầu sau sinh cho con bú ti YUKATA KIMONO - Đồ bộ bầu đẹp mặc nhà - Quần áo bầu thời trang cho mẹ giá rẻ Bigsize 2022,196.000,https://tiki.vn/bo-do-bau-sau-sinh-cho-con-bu-ti-yukata-kimono-do-bo-bau-dep-mac-nha-quan-ao-bau-thoi-trang-cho-me-gia-re-bigsize-2022-p191576423.html?spid=191576437,4,,,thoitrangbau
4,,,https://tiki.vn/quan-tat-bau-mong-sk-p95247435.html?spid=95247445,5,,,thoitrangbau
5,Đầm bầu chất cotton sát nách dáng dài db17,175.000₫,https://tiki.vn/dam-bau-chat-cotton-sat-nach-dang-dai-db17-p106304226.html?spid=106304252,6,,,thoitrangbau
6,"Đầm Bầu Mặc Nhà, Váy Bầu Mùa Hè Pha Ren Hoạ Tiết Hình Sao DB10",219.000₫,https://tiki.vn/dam-bau-mac-nha-vay-bau-mua-he-pha-ren-hoa-tiet-hinh-sao-db10-p164582398.html?spid=164582420,7,,Đã bán 1,thoitrangbau
7,"Áo lót bầu, áo ngực bầu cho con bú, cúc mở, chống chảy xệ, dây mảnh, nhẹ, êm ALB02",170.000₫,https://tiki.vn/ao-lot-bau-ao-nguc-bau-cho-con-bu-cuc-mo-chong-chay-xe-day-manh-nhe-em-alb02-p164582512.html?spid=164582525,8,,,thoitrangbau
8,Đầm bầu nữ chất thun mềm co giãn theo kích thước cơ thể DB20,175.000,https://tiki.vn/dam-bau-nu-chat-thun-mem-co-gian-theo-kich-thuoc-co-the-db20-p106304846.html?spid=106304930,9,,,thoitrangbau
9,,,https://tiki.vn/combo-2-quan-dui-mac-vay-ba-bau-cotton-p83669038.html?spid=83669043,10,,,thoitrangbau
10,Vỏ Gối Ôm Cho Bé Sơ Sinh Đa Năng Chữ U Chống Giật Mình Chống Méo Bẹp Đầu Chất Liệu Cao Cấp Siêu Tiện Lợi,115.000₫,https://tiki.vn/vo-goi-om-cho-be-so-sinh-da-nang-chu-u-chong-giat-minh-chong-meo-bep-dau-chat-lieu-cao-cap-sieu-tien-loi-p197696005.html?spid=197696027,11,,,thoitrangbau
11,"Bộ đồ bầu sau sinh Con CÁ mặc nhà, Chất thoáng mát, rộng rãi, dễ cho bé ty BD913",157.500,https://tiki.vn/bo-do-bau-sau-sinh-con-ca-mac-nha-chat-thoang-mat-rong-rai-de-cho-be-ty-bd913-p146574278.html?spid=146574299,12,,,thoitrangbau
12,,,https://tiki.vn/tong-hop-cac-bo-tho-bau-size-45-ky-p105799213.html?spid=105799229,13,,,thoitrangbau
13,BỘ ĐỒ BẦU THỜI TRANG XINH ĐẸP,175.000₫,https://tiki.vn/bo-do-bau-thoi-trang-xinh-dep-p167243993.html?spid=167243997,14,,,thoitrangbau
14,QUẦN BẦU DÀI - LEGGING BẦU DÀI HÌNH MÈO (CT 555),99.540₫,https://tiki.vn/quan-bau-dai-legging-bau-dai-hinh-meo-ct-555-p146574442.html?spid=146574471,15,,Đã bán 3,thoitrangbau
15,Đầm bầu và sau sinh cho con ti vải thun mát mịn 75kg đổ lại,149.000₫,https://tiki.vn/dam-bau-va-sau-sinh-cho-con-ti-vai-thun-mat-min-75kg-do-lai-p99869829.html?spid=99869872,16,,,thoitrangbau
16,"Bộ THÔ bầu và sau sinh(vải thô dầy mặc mùa xuân,thu ,đông )",154.000,https://tiki.vn/bo-tho-bau-va-sau-sinh-vai-tho-day-mac-mua-xuan-thu-dong-p105799254.html?spid=105799282,17,,,thoitrangbau
17,,,https://tiki.vn/vay-bau-thiet-ke-vay-bau-cong-so-hd4806-honey-mommy-p95583786.html?spid=95583829,18,,,thoitrangbau
18,"Đầm Bầu Váy Bầu cao cấp dáng Xuông Chất Lụa Hàn Mềm, siêu mát Thấm Mồ Hôi Tốt, 3 size từ 40 đến 70Kg",230.000₫,https://tiki.vn/dam-bau-vay-bau-cao-cap-dang-xuong-chat-lua-han-mem-sieu-mat-tham-mo-hoi-tot-3-size-tu-40-den-70kg-p113590403.html?spid=113590421,19,,,thoitrangbau
19,VT09 VÁY SHOVLC CHO CON TI KÈM ẢNH THẬT,325.000₫,https://tiki.vn/vt09-vay-shovlc-cho-con-ti-kem-anh-that-p95170525.html?spid=95170589,20,,,thoitrangbau
20,ĐẦM BẦU DẬP LY DÁNG XUÔNG RỘNG (45-75kg),279.500₫,https://tiki.vn/dam-bau-dap-ly-dang-xuong-rong-45-75kg-p89912311.html?spid=89912352,21,,,thoitrangbau
21,VT06 Váy thun real cars cho con bú ( kèm ảnh thật),702.000₫,https://tiki.vn/vt06-vay-thun-real-cars-cho-con-bu-kem-anh-that-p95172002.html?spid=95172015,22,,,thoitrangbau
22,Váy len dáng dài khoá dọc cho con tiẢNH THẬT,318.500₫,https://tiki.vn/vay-len-dang-dai-khoa-doc-cho-con-ti-anh-that-p95173849.html?spid=95174043,23,,Đã bán 1,thoitrangbau
23,Váy voan hoa Quảng châu cho con ti ẢNH THẬT,468.000₫,https://tiki.vn/vay-voan-hoa-quang-chau-cho-con-ti-anh-that-p95171932.html?spid=95171946,24,,,thoitrangbau
24,Jumsuit cho con búKÈM ẢNH THẬT,325.000,https://tiki.vn/jumsuit-cho-con-bu-kem-anh-that-p95171137.html?spid=95171160,25,,,thoitrangbau
25,,,https://tiki.vn/vay-caro-cho-con-bu-kem-anh-that-p95173711.html?spid=95174143,26,,,thoitrangbau
26,"Đầm bầu, Váy cho con bú️ẢNH VIDEO THẬT",377.000₫,https://tiki.vn/dam-bau-vay-cho-con-bu-anh-video-that-p95170831.html?spid=95170888,27,,,thoitrangbau
27,Váy thun đen cho con bú,377.000₫,https://tiki.vn/vay-thun-den-cho-con-bu-p95171138.html?spid=95171281,28,,,thoitrangbau
28,v30 váy trễ vai cho con bú,377.000₫,https://tiki.vn/v30-vay-tre-vai-cho-con-bu-p95171114.html?spid=95171180,29,,,thoitrangbau
29,Váy bầu dáng suông phối ren lưới cá tính w160,238.140,https://tiki.vn/vay-bau-dang-suong-phoi-ren-luoi-ca-tinh-w160-p146575250.html?spid=146575469,30,,,thoitrangbau
30,,,https://tiki.vn/vay-bau-hoa-nhi-co-sen-vay-bau-cong-so-dang-xoe-di-lam-di-choi-hd2816-honey-mommy-dam-bau-hoa-nhi-p95583865.html?spid=95584043,31,,,thoitrangbau
31,Váy cho con bú sz SML,377.000₫,https://tiki.vn/vay-cho-con-bu-sz-sml-p95174205.html?spid=95174375,32,,Đã bán 2,thoitrangbau
32,Vây hoa sang chảnh cho con bú sz S- XXL ẢNH THẬT SHOP CHỤP,377.000₫,https://tiki.vn/vay-hoa-sang-chanh-cho-con-bu-sz-s-xxl-anh-that-shop-chup-p95172578.html?spid=95172602,33,,Đã bán 2,thoitrangbau
33,V36 Váy hoa cổ nơ cho con bú,377.000₫,https://tiki.vn/v36-vay-hoa-co-no-cho-con-bu-p95171361.html?spid=95171385,34,,,thoitrangbau
34,ẢNH THẬT️váy nhung cổ ren cho con bú,377.000,https://tiki.vn/anh-that-vay-nhung-co-ren-cho-con-bu-p95173532.html?spid=95173549,35,,,thoitrangbau
35,,,https://tiki.vn/dam-hoa-cho-con-bu-anh-that-p95172701.html?spid=95172724,36,,,thoitrangbau
36,Váy bầu đuôi cá phối ren w127,254.520₫,https://tiki.vn/vay-bau-duoi-ca-phoi-ren-w127-p146572882.html?spid=146572918,37,,,thoitrangbau
37,SẴN Váy áo tim cho con ti khoá dọc sz M-2Xl,442.000₫,https://tiki.vn/san-vay-ao-tim-cho-con-ti-khoa-doc-sz-m-2xl-p95172875.html?spid=95172921,38,,,thoitrangbau
38,VÁY MÈO KÍNH PHỐI CHÂN REN CHO CON BÚ ️ảnh thật️,364.000₫,https://tiki.vn/vay-meo-kinh-phoi-chan-ren-cho-con-bu-anh-that-p95173019.html?spid=95173183,39,,,thoitrangbau
39,SẴN Set áo váy có khoá ngang cho con bú siêu tiện lợi,416.000,https://tiki.vn/san-set-ao-vay-co-khoa-ngang-cho-con-bu-sieu-tien-loi-p95172466.html?spid=95172484,40,,,thoitrangbau
0,Áo xám cho con ti sz m-2xl,247.000₫,https://tiki.vn/ao-xam-cho-con-ti-sz-m-2xl-p95171179.html?spid=95171207,1,,,thoitrangbau
1,Váy Bầu Len Cao Cổ Thiết Kế Cao Cấp HD4635 Honey Mommy,235.000₫,https://tiki.vn/vay-bau-len-cao-co-thiet-ke-cao-cap-hd4635-honey-mommy-p95583790.html?spid=95583815,2,,,thoitrangbau
2,KÈM ẢNH THẬT Váy len đỏ cho con bú,494.000₫,https://tiki.vn/kem-anh-that-vay-len-do-cho-con-bu-p95173482.html?spid=95173933,3,,,thoitrangbau
3,Đầm cho con bú sz s-xlẢNH VIDEO THẬT,468.000,https://tiki.vn/dam-cho-con-bu-sz-s-xl-anh-video-that-p95174255.html?spid=95174417,4,,,thoitrangbau
4,,,https://tiki.vn/vay-bau-chat-dui-lua-sieu-mem-mat-dam-bau-mua-he-thiet-ke-dinh-hat-phoi-duoi-ca-xinh-yeu-v269-p146572655.html?spid=146572671,5,,,thoitrangbau
5,áo lông cừu cho con bú,481.000₫,https://tiki.vn/ao-long-cuu-cho-con-bu-p95170657.html?spid=95170689,6,,,thoitrangbau
6,Váy voan bi cho con ti sz m-2xl,416.000₫,https://tiki.vn/vay-voan-bi-cho-con-ti-sz-m-2xl-p95171622.html?spid=95171645,7,,,thoitrangbau
7,Babydoll voan 2 lớp cho con bú sz S-XL KÈM ẢNH THẬT,416.000₫,https://tiki.vn/babydoll-voan-2-lop-cho-con-bu-sz-s-xl-kem-anh-that-p95170381.html?spid=95170459,8,,,thoitrangbau
8,váy nhũ body cho con bú️ ẢNH THẬT SH CHỤP,364.000,https://tiki.vn/vay-nhu-body-cho-con-bu-anh-that-sh-chup-p95172040.html?spid=95172093,9,,,thoitrangbau
9,,,https://tiki.vn/anh-that-ao-thun-cho-con-bu-p95172035.html?spid=95172305,10,,,thoitrangbau
10,"Váy bầu, cho con bú sau sinh KÈM ẢNH THẬT",351.000₫,https://tiki.vn/vay-bau-cho-con-bu-sau-sinh-kem-anh-that-p95172806.html?spid=95172944,11,,,thoitrangbau
11,Váy thun thụng cho con ti ẢNH THẬT,351.000,https://tiki.vn/vay-thun-thung-cho-con-ti-anh-that-p95173546.html?spid=95173559,12,,,thoitrangbau
12,,,https://tiki.vn/vay-bau-cong-so-dang-xuong-duoi-ca-2-tang-p113590404.html?spid=113590415,13,,,thoitrangbau
13,QUẦN JEAN BẦU CAO CẤP,226.000₫,https://tiki.vn/quan-jean-bau-cao-cap-p127367013.html?spid=127367024,14,,,thoitrangbau
14,️váy body len kèm đai cho con bú,377.000₫,https://tiki.vn/vay-body-len-kem-dai-cho-con-bu-p95173664.html?spid=95173812,15,,,thoitrangbau
15,"Đầm bầu thiết kế Dreamama, Đầm baby doll, đầm big size, đầm bầu đẹp, đầm dáng dài",420.000₫,https://tiki.vn/dam-bau-thiet-ke-dreamama-dam-baby-doll-dam-big-size-dam-bau-dep-dam-dang-dai-p110942416.html?spid=110942418,16,,,thoitrangbau
16,Combo váy cho khách sỉ,2.500.000,https://tiki.vn/combo-vay-cho-khach-si-p164047044.html?spid=164047050,17,,,thoitrangbau
17,,,https://tiki.vn/vay-tim-do-cho-con-bu-sz-m-l-xl-xxl-p95170671.html?spid=95170702,18,,,thoitrangbau
18,VIDEO+ẢNH THẬTđầm cho con bú,429.000₫,https://tiki.vn/video-anh-that-dam-cho-con-bu-p95172870.html?spid=95173062,19,,,thoitrangbau
19,váy tiểu thư thiết kế khoá cho con bú ẢNH THẬT SHOP CHỤP,559.000₫,https://tiki.vn/vay-tieu-thu-thiet-ke-khoa-cho-con-bu-anh-that-shop-chup-p95173182.html?spid=95173682,20,,,thoitrangbau
20,️CAO CẤP️ Váy trắng cao cấp cho con ti sz sml,585.000₫,https://tiki.vn/cao-cap-vay-trang-cao-cap-cho-con-ti-sz-sml-p95170636.html?spid=95170667,21,,,thoitrangbau
21,"Đầm bầu thiết kế Dreamama, đầm baby doll, đầm bầu đẹp, đầm bầu công sở, đầm big size",390.000₫,https://tiki.vn/dam-bau-thiet-ke-dreamama-dam-baby-doll-dam-bau-dep-dam-bau-cong-so-dam-big-size-p111102571.html?spid=111102573,22,,,thoitrangbau
22,SẴN Váy suông gấm trắng coa khoá ngang cho con bú,325.000₫,https://tiki.vn/san-vay-suong-gam-trang-coa-khoa-ngang-cho-con-bu-p95173880.html?spid=95174007,23,,,thoitrangbau
23,Váy bầu dáng xuông phối đen trăng VTK50,238.140₫,https://tiki.vn/vay-bau-dang-xuong-phoi-den-trang-vtk50-p146573220.html?spid=146573232,24,,,thoitrangbau
24,Váy bầu công sở chấm bi cổ sen trắng,230.000,https://tiki.vn/vay-bau-cong-so-cham-bi-co-sen-trang-p113589656.html?spid=113589674,25,,,thoitrangbau
25,,,https://tiki.vn/dam-bau-xuong-chat-lieu-lua-phap-mat-min-thoai-mai-cho-bau-tu-70kg-den-100kg-p99870259.html?spid=99870278,26,,,thoitrangbau
26,Váy Bầu Công Sở Dài Tay Màu Đỏ Cổ Yếm HD4636 Honey Mommy Đầm Bầu Công Sở Tay Dài Đi Làm Đi Tiệc Đi Chơi,214.500₫,https://tiki.vn/vay-bau-cong-so-dai-tay-mau-do-co-yem-hd4636-honey-mommy-dam-bau-cong-so-tay-dai-di-lam-di-tiec-di-choi-p95583715.html?spid=95583842,27,,,thoitrangbau
27,Đầm Bầu Đẹp Dáng Suông Siêu Xinh,292.500₫,https://tiki.vn/dam-bau-dep-dang-suong-sieu-xinh-p89912487.html?spid=89912516,28,,,thoitrangbau
