,title,price,link_item,index,discount,sales,category
6,váy hoa cho con bú( form bé tăng 1 sz),325.000₫,https://tiki.vn/vay-hoa-cho-con-bu-form-be-tang-1-sz-p95173658.html?spid=95174074,7,,,thoitrangbau
7,Váy Bầu Voan LụaBaby Doll VTK22,238.140₫,https://tiki.vn/vay-bau-voan-luababy-doll-vtk22-p146574734.html?spid=146574784,8,,,thoitrangbau
8,"Đầm bầu thiết kế Dreamama, đầm bầu dáng suông, đầm bầu công sở, đầm bầu đẹp, đầm big size.",250.000,https://tiki.vn/dam-bau-thiet-ke-dreamama-dam-bau-dang-suong-dam-bau-cong-so-dam-bau-dep-dam-big-size-p109764017.html?spid=109764018,9,,,thoitrangbau
9,,,https://tiki.vn/xa-hang-vay-cho-con-ti-anh-that-cam-thuong-p95170635.html?spid=95170659,10,,,thoitrangbau
10,COMBO VÁY LANH BẦU -5 VÁY,350.000₫,https://tiki.vn/combo-vay-lanh-bau-5-vay-p105799967.html?spid=105799975,11,,,thoitrangbau
11,Váy bầu công sở thu đông dáng suông cổ nơ phối tay trắng táp viền vai nơ cổ,230.000,https://tiki.vn/vay-bau-cong-so-thu-dong-dang-suong-co-no-phoi-tay-trang-tap-vien-vai-no-co-p113589731.html?spid=113589784,12,,,thoitrangbau
12,,,https://tiki.vn/vay-bau-thiet-ke-dang-maxi-chat-lieu-thun-ke-co-gian-p113590445.html?spid=113590454,13,,,thoitrangbau
13,Váy Bầu Sơ Mi Kèm Đai Thắt Eo Váy Bầu Công Sở Dáng Dài HD4602 Honey Mommy (Đai buộc),208.000₫,https://tiki.vn/vay-bau-so-mi-kem-dai-that-eo-vay-bau-cong-so-dang-dai-hd4602-honey-mommy-dai-buoc-p95584248.html?spid=95584343,14,,,thoitrangbau
14,VT02 Váy thun trẻ trung năng động cho con bú,377.000₫,https://tiki.vn/vt02-vay-thun-tre-trung-nang-dong-cho-con-bu-p95172345.html?spid=95172448,15,,,thoitrangbau
15,Váy dạ twet cổ bèo tơ siu xinh ️ẢNH VIDEO SHOP CHỤP,351.000₫,https://tiki.vn/vay-da-twet-co-beo-to-siu-xinh-anh-video-shop-chup-p95170905.html?spid=95171408,16,,,thoitrangbau
16,ĐẦM BẦU VÁY BẦU DÁNG SUÔNG ĐUÔI CÁ DƯỚI 70kg,253.500,https://tiki.vn/dam-bau-vay-bau-dang-suong-duoi-ca-duoi-70kg-p89912285.html?spid=89912287,17,,,thoitrangbau
17,,,https://tiki.vn/vay-bau-thiet-ke-duoi-ca-den-trang-w128-p146574947.html?spid=146575038,18,,,thoitrangbau
18,SẴN Váy có khoá dọc cho con bú freesz,325.000₫,https://tiki.vn/san-vay-co-khoa-doc-cho-con-bu-freesz-p95173471.html?spid=95173604,19,,,thoitrangbau
19,ẢNH THẬT️ Váy cho con bú mùa hè,377.000₫,https://tiki.vn/anh-that-vay-cho-con-bu-mua-he-p95170179.html?spid=95170204,20,,,thoitrangbau
20,Váy cho con búẢNH VIDEO THẬT,377.000₫,https://tiki.vn/vay-cho-con-bu-anh-video-that-p95171425.html?spid=95171672,21,,,thoitrangbau
21,Combo 2 áo lót bầu thông hơi + 5 quần chip bầu,227.000₫,https://tiki.vn/combo-2-ao-lot-bau-thong-hoi-5-quan-chip-bau-p148641349.html?spid=148641355,22,,Đã bán 1,thoitrangbau
22,BỘ BẦU CHẤT NỈ DA CÁ CÓ MŨ,238.800₫,https://tiki.vn/bo-bau-chat-ni-da-ca-co-mu-p107278966.html?spid=107278973,23,,,thoitrangbau
23,Váy bầu thiết kế dáng xuông phối tay trắng,230.000₫,https://tiki.vn/vay-bau-thiet-ke-dang-xuong-phoi-tay-trang-p113590254.html?spid=113590289,24,,,thoitrangbau
24,"Đầm bầu xinh, Đầm bầu đuôi cá dập ly M&M MM206",335.000,https://tiki.vn/dam-bau-xinh-dam-bau-duoi-ca-dap-ly-m-m-mm206-p83777747.html?spid=83777758,25,,,thoitrangbau
25,,,https://tiki.vn/set-10-quan-lot-ba-bau-cuc-xinh-tui-zip-9005-p146573348.html?spid=146573378,26,,,thoitrangbau
26,SALE Váy thun cho con bú ẢNH VIDEO THẬT,325.000₫,https://tiki.vn/sale-vay-thun-cho-con-bu-anh-video-that-p95173066.html?spid=95173093,27,,,thoitrangbau
27,váy hoa cho con bú V18,325.000₫,https://tiki.vn/vay-hoa-cho-con-bu-v18-p95170701.html?spid=95170754,28,,,thoitrangbau
28,Quần bầu sooc chất dạ quảng châu cao cấp có chun chỉnh bụng,215.460₫,https://tiki.vn/quan-bau-sooc-chat-da-quang-chau-cao-cap-co-chun-chinh-bung-p146572678.html?spid=146572740,29,,,thoitrangbau
29,Vây dạ twet cho con bú( form nhỏ tăng 1sz) ẢNH THẬT SHOP CHỤP,377.000,https://tiki.vn/vay-da-twet-cho-con-bu-form-nho-tang-1sz-anh-that-shop-chup-p95173790.html?spid=95173945,30,,,thoitrangbau
30,,,https://tiki.vn/v32-vay-tre-vai-cho-con-bu-p95170634.html?spid=95170656,31,,,thoitrangbau
31,Combo váy cho con bú 2000g,1.690.000₫,https://tiki.vn/combo-vay-cho-con-bu-2000g-p95170351.html?spid=95170366,32,,,thoitrangbau
32,váy hoa cổ ren cho con bú,416.000₫,https://tiki.vn/vay-hoa-co-ren-cho-con-bu-p95170790.html?spid=95171060,33,,,thoitrangbau
33,Combo bo sau sinh 1060,1.378.000₫,https://tiki.vn/combo-bo-sau-sinh-1060-p93245994.html?spid=93246003,34,,,thoitrangbau
34,Váy bầu thời trang thiết kể cổ tròn phối V về đủcác màu cho các Mom lựa chọn,230.000,https://tiki.vn/vay-bau-thoi-trang-thiet-ke-co-tron-phoi-v-ve-ducac-mau-cho-cac-mom-lua-chon-p113590238.html?spid=113590345,35,,,thoitrangbau
35,,,https://tiki.vn/v06-vay-voan-hoa-nhi-xanh-se-cho-con-ti-p95174094.html?spid=95174291,36,,,thoitrangbau
36,VT03 Váy polo quảng châu màu đen cho con ti,377.000₫,https://tiki.vn/vt03-vay-polo-quang-chau-mau-den-cho-con-ti-p95170248.html?spid=95170337,37,,,thoitrangbau
37,Combo vay bau,670.000₫,https://tiki.vn/combo-vay-bau-p164044661.html?spid=164044671,38,,,thoitrangbau
38,"Váy bầu sau sinh công sở MÙA HÈ dambauxinh-BBA943 cổ bẻ dáng suông, chất lụa thái mềm mát Freesize (40-65kg)",331.500₫,https://tiki.vn/vay-bau-sau-sinh-cong-so-mua-he-dambauxinh-bba943-co-be-dang-suong-chat-lua-thai-mem-mat-freesize-40-65kg-p89912434.html?spid=89912451,39,,,thoitrangbau
39,váy nhung đỏ cho con bú,377.000,https://tiki.vn/vay-nhung-do-cho-con-bu-p95170710.html?spid=95170723,40,,,thoitrangbau
0,combo 1 áo bầu AD122 + 1 quần legging có đáp bụng 456,220.500₫,https://tiki.vn/combo-1-ao-bau-ad122-1-quan-legging-co-dap-bung-456-p146574981.html?spid=146575304,1,,,thoitrangbau
1,VIEO ẢNH THẬT váy dạ cho con bú,507.000₫,https://tiki.vn/vieo-anh-that-vay-da-cho-con-bu-p95171641.html?spid=95171669,2,,,thoitrangbau
2,Váy bầu phối buộc nơ cổ có khóa mở sau sinh cho bé ti w101,238.140₫,https://tiki.vn/vay-bau-phoi-buoc-no-co-co-khoa-mo-sau-sinh-cho-be-ti-w101-p146575068.html?spid=146575248,3,,,thoitrangbau
3,Váy cho con bú KÈM ẢNH THẬT,429.000,https://tiki.vn/vay-cho-con-bu-kem-anh-that-p95171903.html?spid=95171931,4,,,thoitrangbau
4,,,https://tiki.vn/vay-cho-con-bu-p95170617.html?spid=95170650,5,,,thoitrangbau
5,váy len body cho con bú ️ẢNH THẬT SHOP CHỤP,468.000₫,https://tiki.vn/vay-len-body-cho-con-bu-anh-that-shop-chup-p95170160.html?spid=95170206,6,,Đã bán 2,thoitrangbau
6,SẴN Maxi voan có khoá 2 bên mở cho con bú sz S-xl,455.000₫,https://tiki.vn/san-maxi-voan-co-khoa-2-ben-mo-cho-con-bu-sz-s-xl-p95170235.html?spid=95170242,7,,,thoitrangbau
7,"Váy bầu xinh, đầm bầu yếm kèm áo thun Ms1564",199.000₫,https://tiki.vn/vay-bau-xinh-dam-bau-yem-kem-ao-thun-ms1564-p83777751.html?spid=83777757,8,,,thoitrangbau
8,Váy thiết kế cho con bú sang chảnh,468.000,https://tiki.vn/vay-thiet-ke-cho-con-bu-sang-chanh-p95171962.html?spid=95171976,9,,,thoitrangbau
9,,,https://tiki.vn/vay-len-gia-yem-co-beo-cho-con-bu-kem-anh-that-p95174314.html?spid=95174381,10,,,thoitrangbau
10,"VT06 Váy bầu, sau sinh cho con bú KÈM ẢNH THẬT",240.500₫,https://tiki.vn/vt06-vay-bau-sau-sinh-cho-con-bu-kem-anh-that-p95172570.html?spid=95172703,11,,,thoitrangbau
11,️ẢNH THẬT️ĐẦM MƯA PHỐI TAY LƯỚI ĐÍNH NGỌC CHO CON BÚ,429.000,https://tiki.vn/anh-that-dam-mua-phoi-tay-luoi-dinh-ngoc-cho-con-bu-p95172252.html?spid=95172272,12,,,thoitrangbau
12,,,https://tiki.vn/anh-that-dam-cho-con-ti-p95173698.html?spid=95173868,13,,,thoitrangbau
13,Áo cho con ti sz m-2xl,247.000₫,https://tiki.vn/ao-cho-con-ti-sz-m-2xl-p95172287.html?spid=95172339,14,,Đã bán 2,thoitrangbau
14,Áo len gấu hồng cho con bú ️ẢNH THẬT SHOP CHỤP,429.000₫,https://tiki.vn/ao-len-gau-hong-cho-con-bu-anh-that-shop-chup-p95171547.html?spid=95172053,15,,,thoitrangbau
15,Đồ bộ bầu kết hợp sau sinh chất mát,227.500₫,https://tiki.vn/do-bo-bau-ket-hop-sau-sinh-chat-mat-p89912300.html?spid=89912340,16,,,thoitrangbau
16,Váy khoá cho con bú ️KÈM ẢNH THẬT,455.000,https://tiki.vn/vay-khoa-cho-con-bu-kem-anh-that-p95171522.html?spid=95171579,17,,,thoitrangbau
17,,,https://tiki.vn/vay-bau-p164047416.html?spid=164047421,18,,,thoitrangbau
18,combo 1 áo bầu AD122 + 1 quần legging cạp chéo cotton co giãn thoải mái QB1111,204.120₫,https://tiki.vn/combo-1-ao-bau-ad122-1-quan-legging-cap-cheo-cotton-co-gian-thoai-mai-qb1111-p146575186.html?spid=146575285,19,,,thoitrangbau
19,VÁY BẦU CHO CON BÚ SAU SINH️KÈM ẢNH THẬT,325.000₫,https://tiki.vn/vay-bau-cho-con-bu-sau-sinh-kem-anh-that-p95172262.html?spid=95172290,20,,Đã bán 1,thoitrangbau
20,V28 váy retro đỏ cho con bú️ẢNH THẬT,546.000₫,https://tiki.vn/v28-vay-retro-do-cho-con-bu-anh-that-p95173099.html?spid=95173109,21,,,thoitrangbau
21,Váy cho con bua màu đen sz 45-65kg ẢNH THẬT,416.000₫,https://tiki.vn/vay-cho-con-bua-mau-den-sz-45-65kg-anh-that-p95170360.html?spid=95170427,22,,,thoitrangbau
22,Váy len phối chân ren khoá ngang cho con bú️KÈM ẢNH THẬT,442.000₫,https://tiki.vn/vay-len-phoi-chan-ren-khoa-ngang-cho-con-bu-kem-anh-that-p95171423.html?spid=95171438,23,,,thoitrangbau
23,Váy suông phối ren cho con bú ẢNH THẬT,416.000₫,https://tiki.vn/vay-suong-phoi-ren-cho-con-bu-anh-that-p95173767.html?spid=95173923,24,,,thoitrangbau
24,Váy cho con ti mùa hè KÈM ẢNH THẬT,468.000,https://tiki.vn/vay-cho-con-ti-mua-he-kem-anh-that-p95172835.html?spid=95173291,25,,,thoitrangbau
25,,,https://tiki.vn/quan-lot-bau-cap-cheo-khang-khuan-chat-coton-chat-luong-loai-1-ql001-p148637521.html?spid=148637543,26,,,thoitrangbau
26,váy len cho con bú,507.000₫,https://tiki.vn/vay-len-cho-con-bu-p95171848.html?spid=95171899,27,,,thoitrangbau
27,váy cho con bú ẢNH THẬT,559.000₫,https://tiki.vn/vay-cho-con-bu-anh-that-p95171687.html?spid=95171876,28,,,thoitrangbau
28,Váy len hàng đẹp cho con bú,507.000₫,https://tiki.vn/vay-len-hang-dep-cho-con-bu-p95173000.html?spid=95173417,29,,,thoitrangbau
29,Váy tiểu thư khoá mở cho con bú KÈM ẢNH THẬT,494.000,https://tiki.vn/vay-tieu-thu-khoa-mo-cho-con-bu-kem-anh-that-p95172119.html?spid=95172140,30,,,thoitrangbau
30,,,https://tiki.vn/vay-bau-thiet-ke-dai-tay-thu-dong-mac-bau-va-sau-sinh-v232-p146572297.html?spid=146572314,31,,,thoitrangbau
31,Váy Bầu chấm bi cổ bèo V51,132.300₫,https://tiki.vn/vay-bau-cham-bi-co-beo-v51-p146573542.html?spid=146573594,32,,,thoitrangbau
32,ÁO BẦU TAY LỠ SIZE NHỎ,50.000₫,https://tiki.vn/ao-bau-tay-lo-size-nho-p105799608.html?spid=105799665,33,,,thoitrangbau
33,"Váy bầu xinh chất lụa, siêu mát, đầm bầu thiết kế chun ngực sành điệu mặc đi làm đi chơi đều xinh V267",150.000₫,https://tiki.vn/vay-bau-xinh-chat-lua-sieu-mat-dam-bau-thiet-ke-chun-nguc-sanh-dieu-mac-di-lam-di-choi-deu-xinh-v267-p148638680.html?spid=148638700,34,,,thoitrangbau
34,Váy bầu thời trang 45 ký -60 ký,80.000₫,https://tiki.vn/vay-bau-thoi-trang-45-ky-60-ky-p105799291.html?spid=105799315,35,,,thoitrangbau
35,,,https://tiki.vn/ao-lot-cho-con-bu-tron-p146573156.html?spid=146573200,36,,,thoitrangbau
36,Váy Bầu Hè Công Sở Tay Voan Đính Hoa Ngực Sang Chảnh HD2610 Honey Mommy Đầm Bầu Công Sở Hè,155.000₫,https://tiki.vn/vay-bau-he-cong-so-tay-voan-dinh-hoa-nguc-sang-chanh-hd2610-honey-mommy-dam-bau-cong-so-he-p95583993.html?spid=95584021,37,,,thoitrangbau
37,Quần lót bầu cạp chéo túi zip QL9005,30.240₫,https://tiki.vn/quan-lot-bau-cap-cheo-tui-zip-ql9005-p146573288.html?spid=146573311,38,,,thoitrangbau
38,Quần lót bầu thun coton cạp chéo sexy gợi cảm túi zip cao cấp mặc trong váy dễ thương,30.000₫,https://tiki.vn/quan-lot-bau-thun-coton-cap-cheo-sexy-goi-cam-tui-zip-cao-cap-mac-trong-vay-de-thuong-p148639343.html?spid=148639385,39,,,thoitrangbau
39,VÁY LEN BODY HÀNG QUẢNG CHÂU CHO CON TI ️ảnh thật,468.000,https://tiki.vn/vay-len-body-hang-quang-chau-cho-con-ti-anh-that-p95171142.html?spid=95171305,40,,,thoitrangbau
0,Bộ đồ bầu và sau sinh dài tay HELLO TAI THỎ chất cotton co giãn cực kì thoải mái BD929,94.500₫,https://tiki.vn/bo-do-bau-va-sau-sinh-dai-tay-hello-tai-tho-chat-cotton-co-gian-cuc-ki-thoai-mai-bd929-p146575201.html?spid=146575335,1,,,thoitrangbau
1,Váy lanh SIZE TO CHO NGƯỜI BẦU VÀ NGƯỜI BÉO,85.000₫,https://tiki.vn/vay-lanh-size-to-cho-nguoi-bau-va-nguoi-beo-p105799108.html?spid=105799149,2,,,thoitrangbau
2,Bộ bầu vải lụa cao cấp - mịn mát - dễ thương,175.000₫,https://tiki.vn/bo-bau-vai-lua-cao-cap-min-mat-de-thuong-p167244115.html?spid=167244148,3,,,thoitrangbau
3,Váy bầu BIG SIZE 80KÝ,160.000,https://tiki.vn/vay-bau-big-size-80ky-p105800402.html?spid=105800459,4,,,thoitrangbau
4,,,https://tiki.vn/dam-bau-thun-xuong-3-mau-dang-rong-phu-hop-bau-50kg-den-90kg-p99870277.html?spid=99870293,5,,,thoitrangbau
5,SẴN Áo ba lỗ cho con ti sz M-2xl,195.000₫,https://tiki.vn/san-ao-ba-lo-cho-con-ti-sz-m-2xl-p95173669.html?spid=95173702,6,,,thoitrangbau
6,Quần Đùi Bầu Trơn Mặc Trong váy ất xưởng,32.760₫,https://tiki.vn/quan-dui-bau-tron-mac-trong-vay-at-xuong-p146575530.html?spid=146575567,7,,,thoitrangbau
7,Bộ cho con ti,195.000₫,https://tiki.vn/bo-cho-con-ti-p95174010.html?spid=95174224,8,,,thoitrangbau
8,XẢ KHO bộ TOLE ( lanh ) bầu hàng sau sinh,135.000,https://tiki.vn/xa-kho-bo-tole-lanh-bau-hang-sau-sinh-p105799352.html?spid=105799361,9,,Đã bán 1,thoitrangbau
9,,,https://tiki.vn/quan-bau-cap-cheo-soc-the-thao-kem-anh-that-p146575445.html?spid=146575478,10,,,thoitrangbau
10,Quần Bầu Baggy xuất xưởng( chất tuyết mưa),74.340₫,https://tiki.vn/quan-bau-baggy-xuat-xuong-chat-tuyet-mua-p146574473.html?spid=146574667,11,,,thoitrangbau
11,"Quần bầu legging mèo Hàn Quốc - trẻ trung, hiện đại",76.860₫,https://tiki.vn/quan-bau-legging-meo-han-quoc-tre-trung-hien-dai-p146575511.html?spid=146575546,12,,,thoitrangbau
12,,,https://tiki.vn/quan-lot-bau-va-sau-sinh-cap-cheo-chat-su-duc-thong-hoi-khang-khuan-do-lot-chip-ba-bau-bigsize-p185841989.html?spid=185842033,13,,,thoitrangbau
13,Váy bầu sơ mi kẻ caro cúc thật HD4804 Honey Mommy,185.000₫,https://tiki.vn/vay-bau-so-mi-ke-caro-cuc-that-hd4804-honey-mommy-p95584287.html?spid=95584289,14,,,thoitrangbau
14,Bộ đồ sau sinh MLURE chất cotton loại 1 mềm mát thiết kế lật ti siêu hot BD943,157.500₫,https://tiki.vn/bo-do-sau-sinh-mlure-chat-cotton-loai-1-mem-mat-thiet-ke-lat-ti-sieu-hot-bd943-p146572758.html?spid=146572772,15,,,thoitrangbau
15,Chân váy bầu xòe xếp ly thoải mái tiện lợi có chun chỉnh KÈM QUẦN LÓT BÊN TRONG,91.980₫,https://tiki.vn/chan-vay-bau-xoe-xep-ly-thoai-mai-tien-loi-co-chun-chinh-kem-quan-lot-ben-trong-p146574660.html?spid=146574838,16,,,thoitrangbau
16,"(80-120cm)ÁO LÓT FORM TO CHO CON BÚ NÂNG NGỰC AB016 (có video, ảnh thật)",80.100₫,https://tiki.vn/80-120cm-ao-lot-form-to-cho-con-bu-nang-nguc-ab016-co-video-anh-that-p135900956.html?spid=135900969,17,,,thoitrangbau
17,,,https://tiki.vn/quan-bau-sooc-jean-rach-cao-cap-co-chun-va-cuc-dieu-chinh-bsr-45-p146573828.html?spid=146573939,18,,,thoitrangbau
18,Quần bầu có đáp bụng bigsize( 85-95kg),77.490₫,https://tiki.vn/quan-bau-co-dap-bung-bigsize-85-95kg-p146572937.html?spid=146572962,19,,,thoitrangbau
19,Quần bầu legging len mèo hàn quốc,81.900₫,https://tiki.vn/quan-bau-legging-len-meo-han-quoc-p146573127.html?spid=146573223,20,,,thoitrangbau
20,Váy lụa 2 dây satin mát mẻ thời trang mùa hè cho phái nữ -V2D290,132.300₫,https://tiki.vn/vay-lua-2-day-satin-mat-me-thoi-trang-mua-he-cho-phai-nu-v2d290-p146571779.html?spid=146571892,21,,,thoitrangbau
21,Bộ đồ bầu dài tay CHẤT THUN SỮA họa tiết hoạt hình xinh xắn mặc bầu và sau sinh BD940,146.160₫,https://tiki.vn/bo-do-bau-dai-tay-chat-thun-sua-hoa-tiet-hoat-hinh-xinh-xan-mac-bau-va-sau-sinh-bd940-p146572692.html?spid=146572747,22,,,thoitrangbau
22,Quần Bầu Công Sở UMI - ảnh thật,124.740₫,https://tiki.vn/quan-bau-cong-so-umi-anh-that-p146572997.html?spid=146573038,23,,,thoitrangbau
23,SET BỘ ĐỒ BẦU ĐI CHƠI THOÁNG MÁT BL151,350.000₫,https://tiki.vn/set-bo-do-bau-di-choi-thoang-mat-bl151-p252639660.html?spid=252639671,24,,,thoitrangbau
24,"Đầm bầu nữ dáng dài, Váy bầu sát nách chất thun xếp ly B16",199.000,https://tiki.vn/dam-bau-nu-dang-dai-vay-bau-sat-nach-chat-thun-xep-ly-b16-p183521218.html?spid=183521220,25,,,thoitrangbau
25,,,https://tiki.vn/vay-bau-thoi-trang-p134358068.html?spid=134358108,26,,,thoitrangbau
26,Áo lót cho con bú cúc bấm tiện lợi A05,99.000₫,https://tiki.vn/ao-lot-cho-con-bu-cuc-bam-tien-loi-ab05-p183700323.html?spid=183700329,27,,Đã bán 1,thoitrangbau
27,Đầm bầu 3 màu siêu xinh,220.000₫,https://tiki.vn/dam-bau-3-mau-sieu-xinh-p186144618.html?spid=186144625,28,,,thoitrangbau
28,Quần bầu SOOC ĐŨI siêu mịn mát có chun và cúc điều chỉnh SĐX,56.700₫,https://tiki.vn/quan-bau-sooc-dui-sieu-min-mat-co-chun-va-cuc-dieu-chinh-sdx-p146574433.html?spid=146574543,29,,Đã bán 2,thoitrangbau
29,Bộ sau sinh cúc giữa màu hồng,99.000₫,https://tiki.vn/bo-sau-sinh-cuc-giua-mau-hong-p93246370.html?spid=114933516,30,,,thoitrangbau
30,,,https://tiki.vn/vay-suong-xep-li-bau-bi-bon-chen-thoai-mai-40-70kg-p129496361.html?spid=129496371,31,,,thoitrangbau
31,BỘ SAU SINH THÔ THỜI TRANG CÓ ĐỦ SIZE,210.000₫,https://tiki.vn/bo-sau-sinh-tho-thoi-trang-co-du-size-p129493595.html?spid=129493598,32,,,thoitrangbau
32,Váy bầu thiết kế dáng dài(hàng mới về),147.000₫,https://tiki.vn/vay-bau-thiet-ke-dang-dai-hang-moi-ve-p129497945.html?spid=129497968,33,,,thoitrangbau
33,Áo len bầu thời trang,315.000₫,https://tiki.vn/ao-len-bau-thoi-trang-p129496715.html?spid=129496720,34,,,thoitrangbau
34,"Váy bầu đẹp dáng thời trang công sở,dự tiệc chất ren cao cấp pregnant dress mom",84.000₫,https://tiki.vn/vay-bau-dep-dang-thoi-trang-cong-so-du-tiec-chat-ren-cao-cap-pregnant-dress-mom-p129496369.html?spid=129496395,35,,,thoitrangbau
35,,,https://tiki.vn/vay-bau-xinh-chun-nguc-2-lop-40-65kg-p129498500.html?spid=129498507,36,,,thoitrangbau
36,ĐẦM BẦU TRƯỚC VÀ SAU SINH DÁNG DÀI,199.000₫,https://tiki.vn/dam-bau-truoc-va-sau-sinh-dang-dai-p129496717.html?spid=129496723,37,,,thoitrangbau
37,"Váy len bầu thời trang suông (kèm ảnh thật,video)",368.000₫,https://tiki.vn/vay-len-bau-thoi-trang-suong-kem-anh-that-video-p129499651.html?spid=129499660,38,,,thoitrangbau
38,Đầm bầu xinh thiết kế cổ ren cộc tay dáng suông nhiều màu mùa hè 2021,163.000₫,https://tiki.vn/dam-bau-xinh-thiet-ke-co-ren-coc-tay-dang-suong-nhieu-mau-mua-he-2021-p129492145.html?spid=129492155,39,,,thoitrangbau
39,BỘ SAU SINH CHẤT MÁT,189.000,https://tiki.vn/bo-sau-sinh-chat-mat-p129500737.html?spid=129500741,40,,,thoitrangbau
0,Váy bầu xinh công sở và sau sinh thiết kế suông 45-70kg,209.000₫,https://tiki.vn/vay-bau-xinh-cong-so-va-sau-sinh-thiet-ke-suong-45-70kg-p129494750.html?spid=129494787,1,-45%,,thoitrangbau
1,Váy bầu xinh thời trang thiết kế dáng babydoll kẻ sọc mùa hè,42.000₫,https://tiki.vn/vay-bau-xinh-thoi-trang-thiet-ke-dang-babydoll-ke-soc-mua-he-p129494875.html?spid=129494884,2,,,thoitrangbau
2,Váy bầu đẹp chất mịn (40-68kg),273.000₫,https://tiki.vn/vay-bau-dep-chat-min-40-68kg-p129494957.html?spid=129494989,3,,,thoitrangbau
3,"Váy bầu thời trang chất lụa mát thêu hoa sát nách,đầm bầu mùa hè",158.000,https://tiki.vn/vay-bau-thoi-trang-chat-lua-mat-theu-hoa-sat-nach-dam-bau-mua-he-p129496699.html?spid=129496711,4,,,thoitrangbau
4,,,https://tiki.vn/chan-vay-bau-dang-but-chi-chat-umi-co-dap-bung-p129495475.html?spid=129495483,5,,,thoitrangbau
5,Váy bầu suông thời trang,231.000₫,https://tiki.vn/vay-bau-suong-thoi-trang-p129493418.html?spid=129493433,6,,,thoitrangbau
6,Đầm bầu xinh thiết kế Aidenshop đầm bầu thời trang suông A freesize 40-65kg VB1,157.000₫,https://tiki.vn/dam-bau-xinh-thiet-ke-aidenshop-dam-bau-thoi-trang-suong-a-freesize-40-65kg-vb1-p129499622.html?spid=129499631,7,,,thoitrangbau
7,"Váy bâu thời trang dạo phố chất voan 2 lớp dạng cổ yếm đi biển,đi chơi",189.000₫,https://tiki.vn/vay-bau-thoi-trang-dao-pho-chat-voan-2-lop-dang-co-yem-di-bien-di-choi-p129492869.html?spid=129492877,8,,,thoitrangbau
8,Váy bầu thời trang đầm bầu thu đông,273.000,https://tiki.vn/vay-bau-thoi-trang-dam-bau-thu-dong-p129496187.html?spid=129496200,9,,,thoitrangbau
9,,,https://tiki.vn/vay-bau-xinh-dang-suong-babydoll-thoi-trang-ke-soc-mua-he-freesize-40-65kg-dam-bau-cong-so-p129493193.html?spid=129493197,10,,,thoitrangbau
10,Váy bầu đầm bầu đẹp dáng suông chất umi 45-65kg,263.000₫,https://tiki.vn/vay-bau-dam-bau-dep-dang-suong-chat-umi-45-65kg-p129496531.html?spid=129496539,11,,,thoitrangbau
11,Quần lót bầu chất cotton loại 1 chính hãng Thái lan,35.000₫,https://tiki.vn/quan-lot-bau-chat-cotton-loai-1-chinh-hang-thai-lan-p120856949.html?spid=120857020,12,,,thoitrangbau
12,,,https://tiki.vn/quan-lot-bau-bat-cheo-hang-tui-zip-khang-khuan-cao-cap-chat-cotton-day-dan-tham-mo-hoi-p120856770.html?spid=120856883,13,,,thoitrangbau
13,Váy dạ bầu ( váy mặc Đông ),60.000₫,https://tiki.vn/vay-da-bau-vay-mac-dong-p105799242.html?spid=105799265,14,,,thoitrangbau
14,"Váy Bầu Ngủ Dáng Suông, Đầm Ngủ Mặc Nhà Họa Tiết Dễ Thương Chất Liệu Cotton Co Giãn Thoải Mái Freesize dưới 72kg( họa tiết ngẫu nhiên)",49.000₫,https://tiki.vn/vay-bau-ngu-dang-suong-dam-ngu-mac-nha-hoa-tiet-de-thuong-chat-lieu-cotton-co-gian-thoai-mai-freesize-duoi-72kg-hoa-tiet-ngau-nhien-p214084310.html?spid=214084311,15,,Đã bán 37,thoitrangbau
15,"Áo bầu thiết kế dập li Quảng châu, Áo Bầu mùa hè công sở vải voan lạnh dập ly, Size 40-70kg",115.000₫,https://tiki.vn/ao-bau-thiet-ke-dap-li-quang-chau-ao-bau-mua-he-cong-so-vai-voan-lanh-dap-ly-p254903206.html?spid=254903210,16,,,thoitrangbau
16,COMBO 2 ÁO LÓT BẦU VÀ 2 QUẦN LÓT BẦU,129.000,https://tiki.vn/combo-2-ao-lot-bau-va-2-quan-lot-bau-p159241680.html?spid=159241708,17,,,thoitrangbau
17,,,https://tiki.vn/quan-lot-bau-cotton-an-toan-cho-me-nhieu-mau-sac-p159242116.html?spid=159242183,18,,,thoitrangbau
18,ĐỒ LÓT BẦU COMBO 1 ÁO LÓT BẦU VÀ 1 QUẦN LÓT BẦU,65.000₫,https://tiki.vn/do-lot-bau-combo-1-ao-lot-bau-va-1-quan-lot-bau-p159242091.html?spid=159242102,19,,,thoitrangbau
19,"Yếm bầu bigsize cao cấp, đầm bầu yếm công sở sét rời, MLEE SHOP",265.000₫,https://tiki.vn/yem-bau-bigsize-cao-cap-dam-bau-yem-cong-so-set-roi-mlee-shop-p254903282.html?spid=254903294,20,,,thoitrangbau
20,ÁO LÓT BẦU VÀ CHO CON BÚ HÀNG THÁI LAN,35.000₫,https://tiki.vn/ao-lot-bau-va-cho-con-bu-hang-thai-lan-p159242221.html?spid=159242250,21,,,thoitrangbau
21,"Baggy bầu công sở đẹp, quần bầu đi làm, MLEESHOP",155.000₫,https://tiki.vn/baggy-bau-cong-so-dep-quan-bau-di-lam-mleeshop-p254903325.html?spid=254903330,22,,,thoitrangbau
22,"Áo bầu xinh babydoll, Quần Áo Bà Bầu, MLEE SHOP",109.000₫,https://tiki.vn/ao-so-mi-bau-p254903505.html?spid=254903507,23,,,thoitrangbau
23,QUẦN BẦU ĐẸP,69.000₫,https://tiki.vn/quan-bau-dep-p159241816.html?spid=159241858,24,,,thoitrangbau
24,ẢNH THẬT SHOP CHỤP Váy cho con bú sz m-2xl,338.000,https://tiki.vn/anh-that-shop-chup-vay-cho-con-bu-sz-m-2xl-p95172746.html?spid=95172998,25,,,thoitrangbau
25,,,https://tiki.vn/quan-bau-sang-chanh-di-choi-qdd42-p252639936.html?spid=252639971,26,,,thoitrangbau
26,VÁY BẦU CAO CẤP kẻ cổ nơ,320.000₫,https://tiki.vn/vay-bau-cao-cap-ke-co-no-p92322313.html?spid=92322329,27,,,thoitrangbau
27,Quần mèo bầu lót lông siêu ấm full size tới 80kg,160.000₫,https://tiki.vn/quan-meo-bau-lot-long-sieu-am-full-size-toi-80kg-p92322381.html?spid=92322402,28,,,thoitrangbau
28,"Váy bầu tằm đũi - Nâu bò,Free size 45-70kg",220.000₫,https://tiki.vn/vay-bau-tam-dui-p92322766.html?spid=92322872,29,,,thoitrangbau
29,thanh lý váy bầu ( váy gửi là ảnh bìa hoặc inbox),128.700,https://tiki.vn/thanh-ly-vay-bau-vay-gui-la-anh-bia-hoac-inbox-p92319587.html?spid=92319588,30,,,thoitrangbau
30,,,https://tiki.vn/quan-legging-bau-p92320355.html?spid=92320400,31,,,thoitrangbau
31,quần bầu siêu đẹp có đáp bụng,150.000₫,https://tiki.vn/quan-bau-sieu-dep-co-dap-bung-p92319972.html?spid=92320000,32,,,thoitrangbau
32,Bộ kẻ chất mát bầu,156.000₫,https://tiki.vn/bo-ke-chat-mat-bau-p92319895.html?spid=92319907,33,,,thoitrangbau
33,Sơ mi trắng bầu,150.000₫,https://tiki.vn/so-mi-trang-bau-p92319028.html?spid=92319067,34,,Đã bán 1,thoitrangbau
34,"Váy suông phối bèo, ngực lưới ren, đầm xuông rộng đuôi cá 3 màu mã V159 - Michi's house",255.000,https://tiki.vn/vay-suong-phoi-beo-nguc-luoi-ren-dam-xuong-rong-duoi-ca-3-mau-ma-v159-michi-s-house-p172500401.html?spid=172500405,35,,,thoitrangbau
35,,,https://tiki.vn/vay-suong-beo-lech-duoi-ca-dam-xuong-rong-freesize-tay-phong-freesize-3-mau-ma-v164-michi-s-house-p172500327.html?spid=172500331,36,,,thoitrangbau
