,title,price,link_item,discount,sales,category,revenue
716,"Áo sơ mi nữ Linen tưng chính phẩm Premium ArcticHunter, thời trang hè thu 2023",299000,https://tiki.vn/ao-so-mi-nu-linen-tung-chinh-pham-premium-arctichunter-thoi-trang-he-thu-2023-p248609519.html?spid=248609533,,1.0,aonu,299000.0
717,ÁO NỮ KIỂU TAY DÀI CÀI 4 NÚT,143000,https://tiki.vn/ao-nu-kieu-tay-dai-cai-4-nut-p58421604.html?spid=58421612,,7.0,aonu,1001000.0
718,Áo croptop Hiền Trần BOUTIQUE cổ vuông cộc tay vải thun ôm body crotop nữ cotton co giãn tốt,136000,https://tiki.vn/ao-croptop-hien-tran-boutique-co-vuong-coc-tay-vai-thun-om-body-crotop-nu-cotton-co-gian-tot-p181712764.html?spid=181712770,,5.0,aonu,680000.0
719,Áo kiểu nữ tay phồng phối nút thời trang Eden - ASM189,279000,https://tiki.vn/ao-kieu-nu-tay-phong-phoi-nut-thoi-trang-eden-asm189-p204330122.html?spid=204330126,,5.0,aonu,1395000.0
720,"Áo thun nữ thời trang HNOSS form body in chữ ""Take to heart"" HNATH028",199000,https://tiki.vn/ao-thun-nu-thoi-trang-hnoss-form-body-in-chu-take-to-heart-hnath028-p194784636.html?spid=194784640,,1.0,aonu,199000.0
721,Áo kiểu công sở cổ nơ tay ngắn thời trang Eden - ASM191,279000,https://tiki.vn/ao-kieu-cong-so-co-no-tay-ngan-thoi-trang-eden-asm191-p208405777.html?spid=208405779,,6.0,aonu,1674000.0
722,"Áo croptop cổ lọ hở vai tay dài , crt ôm body thun gân 100% cotton đen trắng free size dưới 50kg mặc đi chơi",71500,https://tiki.vn/ao-croptop-co-lo-ho-vai-tay-dai-crt-om-body-thun-gan-100-cotton-den-trang-free-size-duoi-50kg-mac-di-choi-p142994343.html?spid=142994350,,23.0,aonu,1644500.0
723,"Aó kiểu nữ - họa tiết thêu, chất đũi (SP18)",151000,https://tiki.vn/ao-kieu-nu-hoa-tiet-theu-chat-dui-sp18-p195915771.html?spid=195915787,-23%,12.0,aonu,1812000.0
724,Áo kiểu nữ họa tiết chấm bi xinh xắn,138000,https://tiki.vn/ao-kieu-nu-hoa-tiet-cham-bi-xinh-xan-p75579594.html?spid=75579600,,23.0,aonu,3174000.0
725,Áo nữ cổ cách điệu xinh xắn HATI - AKN845,228000,https://tiki.vn/ao-nu-co-cach-dieu-xinh-xan-hati-akn845-p50729207.html?spid=50729211,-49%,16.0,aonu,3648000.0
726,Áo kiểu phối ren cổ nhún bèo cách điệu NT6238N2,237000,https://tiki.vn/ao-kieu-phoi-ren-co-nhun-beo-cach-dieu-nt6238n2-p10932595.html?spid=10932601,-23%,13.0,aonu,3081000.0
727,Áo sơ mi nữ công sở in hoa trẻ trung,150000,https://tiki.vn/ao-so-mi-nu-cong-so-in-hoa-tre-trung-lahstore-p186580967.html?spid=186580985,,4.0,aonu,600000.0
728,"Áo trắng nữ sinh tay lỡ, sơ mi công sở, tay cách điệu nhẹ nhàng, vải KT Silk mềm, đồng phục học sinh",106000,https://tiki.vn/ao-trang-nu-sinh-tay-lo-so-mi-cong-so-tay-cach-dieu-nhe-nhang-vai-kt-silk-mem-dong-phuc-hoc-sinh-p177652438.html?spid=177652464,,5.0,aonu,530000.0
729,Áo Thun DirtyCoins Logo T-shirt,299000,https://tiki.vn/ao-thun-dirtycoins-logo-t-shirt-p215901817.html?spid=271921017,,2.0,aonu,598000.0
730,(HÀNG SẴN) Áo Lanh Cotton Nữ Thêu Hoa Mùa Hè SM25 - Hàng Quảng Châu Cao Cấp,195000,https://tiki.vn/hang-san-ao-lanh-cotton-nu-theu-hoa-mua-he-sm25-hang-quang-chau-cao-cap-p255474432.html?spid=255474444,,1.0,aonu,195000.0
731,ÁO SƠ MI HOA NỮ TRUNG NIÊN-ÁO KIỂU TRUNG NIÊN TAY LỠ CHO BÀ CHO MẸ,220000,https://tiki.vn/ao-so-mi-hoa-nu-trung-nien-ao-kieu-trung-nien-tay-lo-cho-ba-cho-me-p115769231.html?spid=115769252,,8.0,aonu,1760000.0
732,Áo thun nữ dài tay chất liệu cao cấp khử mùi,78000,https://tiki.vn/ao-thun-nu-dai-tay-chat-lieu-cao-cap-khu-mui-p33257846.html?spid=138618171,,6.0,aonu,468000.0
733,Áo trễ vai nữ thiêu hoa dành cho người mập,150000,https://tiki.vn/ao-tre-vai-nu-thieu-hoa-danh-cho-nguoi-map-p52254550.html?spid=52254560,,6.0,aonu,900000.0
734,Áo thun Nữ croptop cổ tròn tay ngắn 7 màu cotton lạnh chất đẹp siêu co giãn chống bai xù,75000,https://tiki.vn/ao-thun-nu-croptop-co-tron-tay-ngan-7-mau-cotton-lanh-chat-dep-sieu-co-gian-chong-bai-xu-p252657874.html?spid=252657912,,27.0,aonu,2025000.0
735,"Áo kiểu nữ cổ bổ trụ tay lỡ trẻ trung ArcticHunter, chất vải đũi lụa mềm mát, thời trang phong cách trẻ",179000,https://tiki.vn/ao-kieu-nu-co-bo-tru-tay-lo-tre-trung-arctichunter-chat-vai-dui-lua-mem-mat-thoi-trang-phong-cach-tre-p108930746.html?spid=108930764,,4.0,aonu,716000.0
736,Áo hai dây ba lỗ nữ chất vải Viscose tự nhiên mềm mại mát lạnh mặc mùa hè mã VAA0416,99000,https://tiki.vn/ao-hai-day-ba-lo-nu-chat-vai-viscose-tu-nhien-mem-mai-mat-lanh-mac-mua-he-ma-vaa0416-p263348586.html?spid=263348610,,2.0,aonu,198000.0
737,"Áo 2 dây nữ basic 4LOVA chất liệu lụa cao cấp nhiều màu đẹp quyến rũ, sang trọng",85000,https://tiki.vn/ao-2-day-nu-basic-4lova-chat-lieu-lua-cao-cap-nhieu-mau-dep-quyen-ru-sang-trong-p198351522.html?spid=198351807,,1.0,aonu,85000.0
738,Áo sơ mi kẻ sọc trẻ trung dành cho người mập bụng,215000,https://tiki.vn/ao-so-mi-ke-soc-tre-trung-danh-cho-nguoi-map-bung-p37119288.html?spid=54443990,,29.0,aonu,6235000.0
739,"Áo sơ mi nữ Amazing, màu trắng, tay ngắn, vải KT silk, size từ 40-80kg",114000,https://tiki.vn/ao-so-mi-nu-amazing-mau-trang-tay-ngan-vai-kt-silk-size-tu-40-80kg-p102096536.html?spid=102096540,-23%,10.0,aonu,1140000.0
740,Áo Sơ Mi Nữ Dài Tay Họa Tiết Hoa Chéo,157000,https://tiki.vn/ao-so-mi-nu-dai-tay-hoa-tiet-hoa-cheo-p83159346.html?spid=83159381,,14.0,aonu,2198000.0
741,Áo thun Polo trơn nữ có cổ Phúc An 4054 có size lớn (big size),120000,https://tiki.vn/ao-thun-polo-tron-nu-co-co-phuc-an-4054-co-size-lon-big-size-p127583939.html?spid=127583941,,37.0,aonu,4440000.0
742,"Áo kiểu nữ kẻ sọc trễ vai điệu đà ArcticHunter, thời trang phong cách trẻ",99000,https://tiki.vn/ao-kieu-nu-ke-soc-tre-vai-dieu-da-arctichunter-thoi-trang-phong-cach-tre-p74208263.html?spid=74208273,,6.0,aonu,594000.0
743,Áo Croptop Áo Croptop Nữ Tay Ngắn Có Cổ Dáng Polo Siêu Xinh Mềm Mịn,165000,https://tiki.vn/ao-croptop-ao-croptop-nu-tay-ngan-co-co-dang-polo-sieu-xinh-mem-min-p135155284.html?spid=135155286,,1.0,aonu,165000.0
744,Xả áo body nữ cổ tròn dài tay áo thun nữ,31000,https://tiki.vn/xa-ao-body-nu-co-tron-dai-tay-ao-thun-nu-p114277365.html?spid=114277423,,5.0,aonu,155000.0
745,áo croptop cộc tay chất zip cotton cá tính,59000,https://tiki.vn/ao-croptop-coc-tay-chat-zip-cotton-ca-tinh-p107058752.html?spid=107058760,,16.0,aonu,944000.0
746,Áo Kiểu Tay Sẽ Sang Chảnh,115000,https://tiki.vn/ao-kieu-tay-se-sang-chanh-p14838021.html?spid=14838023,,44.0,aonu,5060000.0
747,Áo kiểu nữ phối nơ sang trọng thích hợp mặc dự tiệc hoặc đi làm,139000,https://tiki.vn/ao-kieu-nu-phoi-no-sang-trong-thich-hop-mac-du-tiec-hoac-di-lam-p78951184.html?spid=78951190,,22.0,aonu,3058000.0
748,Áo sơ mi nữ form rộng chất thô đũi,129000,https://tiki.vn/ao-so-mi-nu-form-rong-chat-tho-dui-p21362249.html?spid=58379123,,46.0,aonu,5934000.0
749,ÁO SƠ MI NỮ KIỂU - MẶC ĐƯỢC 2 KIỂU,125000,https://tiki.vn/ao-so-mi-nu-kieu-mac-duoc-2-kieu-p70330837.html?spid=70331055,,6.0,aonu,750000.0
750,ÁO CROPTOP 2 DÂY NỮ ĐA NĂNG ( ĐÃ CÓ MÚT CHỐNG SỐC KHI VẬN ĐỘNG ),205000,https://tiki.vn/ao-croptop-2-day-nu-da-nang-da-co-mut-chong-soc-khi-van-dong-p94149828.html?spid=94149832,,2.0,aonu,410000.0
751,"Áo sơ mi nữ công sở cổ V, áo sơ mi nữ ngắn tay họa tiết kẻ sọc đen trắng thời trang AH33",159000,https://tiki.vn/ao-so-mi-nu-cong-so-co-v-ao-so-mi-nu-ngan-tay-hoa-tiet-ke-soc-den-trang-thoi-trang-ah33-p182479286.html?spid=182479292,,1.0,aonu,159000.0
752,Áo thun Dico Mate T-Shirt,319000,https://tiki.vn/ao-thun-dico-mate-t-shirt-white-p174238217.html?spid=174238219,,5.0,aonu,1595000.0
753,F1144 Áo crop top cột dây chéo tay dài,175000,https://tiki.vn/f1144-ao-crop-top-cot-day-cheo-tay-dai-p176304602.html?spid=176304611,,1.0,aonu,175000.0
754,Áo thun nữ Haint Boutique áo form rộng màu sắc nổi bật A02,129000,https://tiki.vn/ao-thun-nu-haint-boutique-ao-form-rong-mau-sac-noi-bat-a02-p89963641.html?spid=89963653,,8.0,aonu,1032000.0
755,Áo Thun Sweater Nữ Kiểu Tay Dài Bo Trơn,120000,https://tiki.vn/ao-thun-sweater-nu-kieu-tay-dai-bo-tron-p76654209.html?spid=76654286,,13.0,aonu,1560000.0
756,Áo kiểu nữ Trung Niên UGETHER UPAR37 - Áo xanh đen họa tiết - size,300000,https://tiki.vn/ao-kieu-nu-trung-nien-ugether-upar37-ao-xanh-den-hoa-tiet-p20855172.html?spid=20855174,,4.0,aonu,1200000.0
757,Áo Cờ Đỏ Sao Vàng Cực Đẹp,99000,https://tiki.vn/ao-co-do-sao-vang-cuc-dep-p17622447.html?spid=190754384,,4.0,aonu,396000.0
758,Áo Thun Nữ Phối Cổ Màu,59000,https://tiki.vn/ao-thun-nu-phoi-co-mau-p14423025.html?spid=14423029,-12%,74.0,aonu,4366000.0
759,"Áo sơ mi nữ kiểu nữ cổ trụ, chất vải đũi cực mềm, mát, form chuẩn, thời trang phong cách trẻ trung Đũi Việt S172",158000,https://tiki.vn/ao-so-mi-nu-kieu-nu-co-tru-chat-vai-dui-cuc-mem-mat-form-chuan-thoi-trang-phong-cach-tre-trung-dui-viet-s172-p177704099.html?spid=177704111,-49%,2.0,aonu,316000.0
760,Áo Thun Cá Sấu Nữ Có Cổ -Màu Xanh Đen(45-75kg),96000,https://tiki.vn/ao-thun-ca-sau-nu-co-co-mau-xanh-den-45-75kg-p174379848.html?spid=174379855,-23%,7.0,aonu,672000.0
761,Áo Kiểu Nữ Dáng Suông Cổ V Xếp Chất Voan Cao Cấp Mềm Mịn 13ADV2005ST,309000,https://tiki.vn/ao-kieu-nu-dang-suong-co-v-xep-chat-voan-cao-cap-mem-min-13adv2005st-p270906826.html?spid=270906828,-78%,3.0,aonu,927000.0
762,Áo phông nam nữ form rộng 2N Unisex thun cotton in hình chú mèo thêu lông màu trắng/xanh,119000,https://tiki.vn/ao-phong-nam-nu-form-rong-2n-unisex-thun-cotton-in-hinh-chu-meo-theu-long-mau-trang-xanh-p272446864.html?spid=272446866,,1.0,aonu,119000.0
763,Áo Sơ Mi Nữ Tay Dài Dây Cổ Cột Nơ Nhiều Kiểu,121000,https://tiki.vn/ao-so-mi-nu-tay-dai-day-co-cot-no-nhieu-kieu-p46599026.html?spid=46599032,-32%,31.0,aonu,3751000.0
764,"Áo Kiểu Trễ Vai Dáng Ôm Body Chất Co Dãn, Áo Thun Gân Tăm Trễ Vai Dài Tay",99000,https://tiki.vn/ao-kieu-tre-vai-dang-om-body-chat-co-dan-ao-thun-gan-tam-tre-vai-dai-tay-p195636970.html?spid=195636980,,4.0,aonu,396000.0
765,Áo sơ mi nữ cổ tàu tay lỡ form rộng hàng đẹp nhiều màu trẻ trung phong cách,145000,https://tiki.vn/ao-so-mi-nu-co-tau-tay-lo-form-rong-hang-dep-nhieu-mau-tre-trung-phong-cach-p177315236.html?spid=177315238,,1.0,aonu,145000.0
766,ÁO SƠ MI NỮ NGẮN TAY CHẤT LỤA MỀM MỊN CỔ ÁO VIỀN REN NỔI CỰC XINH AM15,159000,https://tiki.vn/ao-so-mi-nu-ngan-tay-chat-lua-mem-min-co-ao-vien-ren-noi-cuc-xinh-am15-p171323294.html?spid=171323299,,2.0,aonu,318000.0
767,Áo Thun 3 Lỗ Nữ Vải Cotton Co Giãn 4 Chiều Mặc Đẹp Tôn Dáng May My Love SN112 Sally Boutique,135000,https://tiki.vn/ao-thun-3-lo-nu-sat-nach-vai-cotton-4-chieu-may-my-love-sally-sn112-p197742413.html?spid=197742474,,20.0,aonu,2700000.0
768,(HÀNG SẴN) Áo Len Dệt Kim Cổ POLO Cho Nữ AL21 - Hàng Quảng Châu Cao Cấp,235000,https://tiki.vn/hang-san-ao-len-det-kim-co-polo-cho-nu-al21-hang-quang-chau-cao-cap-p272040356.html?spid=272040362,,1.0,aonu,235000.0
769,(HÀNG SẴN) Áo Len Lót Lông Dày Ấm Giản Dị CHo Mẹ AL34 - Hàng Quảng Châu Cao Cấp,275000,https://tiki.vn/hang-san-ao-len-lot-long-day-am-gian-di-cho-me-al34-hang-quang-chau-cao-cap-p261967472.html?spid=261967476,,1.0,aonu,275000.0
770,Áo thun Giáng sinh Merry Christmas,92000,https://tiki.vn/ao-thun-giang-sinh-merry-christmas-p73939789.html?spid=73939791,,3.0,aonu,276000.0
771,Áo Sơ Mi Nữ Kiểu Công Sở Tay Lỡ Cổ Tròn 1 Nơ - mã SSL1232,102000,https://tiki.vn/ao-so-mi-nu-kieu-cong-so-tay-lo-co-tron-1-no-ma-ssl1232-p34668678.html?spid=34668680,,13.0,aonu,1326000.0
772,Áo Sơ MI Nữ Tay Dài Cổ Kiểu Nút Ngọc - Mã SSL1222,131000,https://tiki.vn/ao-so-mi-nu-tay-dai-co-kieu-nut-ngoc-ma-ssl1222-p18005285.html?spid=59047810,,3.0,aonu,393000.0
773,Áo 2 dây phi lụa form rộng freesize - Áo hai dây sexy gam màu basic,59000,https://tiki.vn/ao-2-day-phi-lua-form-rong-freesize-ao-hai-day-sexy-gam-mau-basic-p163831266.html?spid=163831280,,1.0,aonu,59000.0
774,Áo thun len tay hến nữ kiểu cổ lọ 3 phân dệt kim len lông thỏ siêu mềm mịn phong cách Hàn Quốc trẻ trung năng động,95000,https://tiki.vn/ao-thun-len-tay-hen-nu-kieu-co-lo-3-phan-det-kim-len-long-tho-sieu-mem-min-phong-cach-han-quoc-tre-trung-nang-dong-p201422936.html?spid=201422938,,15.0,aonu,1425000.0
775,Áo hai dây nữ có đệm ngực phong cách tối giản Nhật Bản tinh tế chất vải Modal tự nhiên thoáng mát nhiều màu mã VAA0154,98500,https://tiki.vn/ao-hai-day-nu-co-dem-nguc-phong-cach-toi-gian-nhat-ban-tinh-te-chat-vai-modal-tu-nhien-thoang-mat-nhieu-mau-ma-vaa0154-p155791304.html?spid=155791684,,9.0,aonu,886500.0
776,"Áo đũi nữ form rộng cổ trụ, thời trang phong cách trẻ",159000,https://tiki.vn/ao-dui-nu-form-rong-co-tru-lahstore-thoi-trang-phong-cach-tre-p75132959.html?spid=75132969,-45%,19.0,aonu,3021000.0
777,"SET ÁO SƠ MI + ÁO CROPTOP, set ulzzang kẻ caro áo sơ mi croptop, combo áo sơ mi croptop xuống phố, set áo croptop sơ mi sọc dài tay, Set áo sơmi nữ sọc tay phồng croptop",119000,https://tiki.vn/set-ao-so-mi-ao-croptop-set-ulzzang-ke-caro-ao-so-mi-croptop-combo-ao-so-mi-croptop-xuong-pho-set-ao-croptop-so-mi-soc-dai-tay-set-ao-somi-nu-soc-tay-phong-croptop-p137916735.html?spid=137916742,,7.0,aonu,833000.0
778,"Áo sơ mi nữ chấm bi cổ nơ tay loe điệ đà ArcticHunter, thời trang công sở - Đen",79000,https://tiki.vn/ao-so-mi-nu-cham-bi-co-no-tay-loe-die-da-arctichunter-thoi-trang-cong-so-den-p74207585.html?spid=74207591,-47%,1.0,aonu,79000.0
779,"Áo sơ mi nữ linen cổ tầu form rộng tay cánh dơi, thời trang phong cách trẻ",179000,https://tiki.vn/ao-so-mi-nu-linen-co-tau-form-rong-tay-canh-roi-lahstore-thoi-trang-phong-cach-tre-p76455046.html?spid=76455060,-11%,21.0,aonu,3759000.0
780,Áo Thun Rúm Lệch Chất Thun Cao Cấp Co Giãn Mềm Mịn 53TNC2007OT,159000,https://tiki.vn/ao-thun-rum-lech-chat-thun-cao-cap-co-gian-mem-min-53tnc2007ot-p242453071.html?spid=242453079,-12%,2.0,aonu,318000.0
781,Áo kiểu nữ sọc caro cổ chữ V vintage dễ thương RM008,179000,https://tiki.vn/ao-kieu-nu-soc-caro-co-chu-v-vintage-de-thuong-rm008-p34711579.html?spid=57657368,,21.0,aonu,3759000.0
782,Croptop Áo Thun Nữ Nhiều Màu Thời Trang 24h 2 Dây Sợi Bún Bản 1cm Thun Gân,24000,https://tiki.vn/croptop-ao-thun-nu-nhieu-mau-thoi-trang-24h-2-day-soi-bun-ban-1cm-thun-gan-p184815641.html?spid=184815756,,5.0,aonu,120000.0
783,Áo thun nữ MXM in chữ M cổ tròn cotton 4 chiều form ôm body cực tôn dáng ( ANU003 ),85000,https://tiki.vn/ao-thun-nu-mxm-in-chu-m-co-tron-cotton-4-chieu-form-om-body-cuc-ton-dang-anu003-p273263755.html?spid=39292650,,101.0,aonu,8585000.0
784,PUMA - Áo thun nữ tay ngắn Downtown Relaxed Graphic 535743,699000,https://tiki.vn/puma-ao-thun-nu-tay-ngan-downtown-relaxed-graphic-535743-99-p222570641.html?spid=222570649,,1.0,aonu,699000.0
785,áo croptop rớt vai voan tầng thời trang quyến rũ,45000,https://tiki.vn/ao-croptop-rot-vai-voan-tang-thoi-trang-quyen-ru-p133166418.html?spid=133166431,,10.0,aonu,450000.0
786,Áo sơ mi nữ công sở Haint Boutique thiết kế kẻ sọc tay dài SM43,158000,https://tiki.vn/ao-so-mi-nu-cong-so-haint-boutique-thiet-ke-ke-soc-tay-dai-sm43-p83190598.html?spid=83190618,,4.0,aonu,632000.0
787,"SƠ MI NỮ ĐŨI VIỆT, ÁO SƠ MI KẺ SỌC DÁNG RỘNG DÀI TAY STYLE HÀN QUỐC (hàng QC) - Ảnh thật",131000,https://tiki.vn/so-mi-nu-dui-viet-ao-so-mi-ke-soc-dang-rong-dai-tay-style-han-quoc-hang-qc-anh-that-p161390168.html?spid=161390172,,2.0,aonu,262000.0
788,Áo Nữ Kiểu Tay Loe Dễ Thương ANO05 MayHomes Áo Kiểu Thời Trang,129050,https://tiki.vn/ao-nu-kieu-tay-loe-de-thuong-ano05-mayhomes-ao-kieu-thoi-trang-p253127123.html?spid=253127127,,7.0,aonu,903350.0
789,"Áo sơ mi nữ trung niên cao cấp cổ tròn tay lỡ tặng mẹ chất liệu Linen thun form rộng bigsize NeSa Shop, SMH.62",219000,https://tiki.vn/ao-so-mi-nu-trung-nien-cao-cap-co-tron-tay-lo-tang-me-chat-lieu-linen-thun-form-rong-bigsize-nesa-shop-smh-62-p241788221.html?spid=241788229,,1.0,aonu,219000.0
790,Áo Thun Tay Lỡ Unisex Sadboiz SAD STORY màu ĐEN/TRẮNG/Nam nữ unisex,57000,https://tiki.vn/ao-thun-tay-lo-unisex-sadboiz-sad-story-mau-den-trang-nam-nu-unisex-p127050192.html?spid=185991632,,10.0,aonu,570000.0
791,"Áo kiểu, áo nữ, áo tay dài, áo uzzlang, áo Quảng Châu, áo tay dài uzzlang, áo nữ uzzlang, áo Paris thiết kế",220000,https://tiki.vn/ao-kieu-ao-nu-ao-tay-dai-ao-uzzlang-ao-quang-chau-ao-tay-dai-uzzlang-ao-nu-uzzlang-ao-paris-thiet-ke-p106655390.html?spid=106655416,,1.0,aonu,220000.0
792,"Áo croptop nữ tay dài trễ vai cổ v OZENKA , áo crt ôm body thun 100% cotton màu đen trắng gợi cảm dưới 55 kg",59000,https://tiki.vn/ao-croptop-nu-tay-dai-tre-vai-co-v-ozenka-ao-crt-om-body-thun-100-cotton-mau-den-trang-goi-cam-duoi-55-kg-p195241093.html?spid=195241099,,2.0,aonu,118000.0
793,"Áo Thun Croptop Nữ Form Body Thời Trang, Sexy",100000,https://tiki.vn/ao-thun-croptop-nu-form-body-thoi-trang-sexy-p95051365.html?spid=95051395,,13.0,aonu,1300000.0
794,"Áo ren lưới dài tay đi biển mặc ngoài bikini & croptop, dáng chui đầu dễ mặc, phom rộng sexy quyến rũ, chất ren dày dặn mịn đẹp | AR020",240000,https://tiki.vn/ao-ren-luoi-dai-tay-di-bien-mac-ngoai-bikini-croptop-dang-chui-dau-de-mac-phom-rong-sexy-quyen-ru-chat-ren-day-dan-min-dep-ar020-p92145013.html?spid=92145015,,2.0,aonu,480000.0
795,Áo croptop cộc tay chất cotton zip,39000,https://tiki.vn/ao-croptop-coc-tay-chat-cotton-zip-p108504438.html?spid=116143375,,45.0,aonu,1755000.0
796,Áo Sơ Mi Caro Tay Bồng Form Rộng Nam Nữ Ullzang,102000,https://tiki.vn/ao-so-mi-caro-nq30-tay-bong-form-rong-nam-nu-ullzang-p126210020.html?spid=126210038,,10.0,aonu,1020000.0
797,"Áo thun nữ trơn Gold Rhino 100% cotton, áo phông nữ trơn hàng xuất khẩu Nhật Bản QT1",179000,https://tiki.vn/ao-thun-nu-tron-gold-rhino-100-cotton-ao-phong-nu-tron-hang-xuat-khau-nhat-ban-qt1-p252125347.html?spid=252125472,,1.0,aonu,179000.0
798,"Áo giữ nhiệt nữ, áo thun dài tay thu đông cho nữ cổ cao xinh xắn",40000,https://tiki.vn/ao-giu-nhiet-nu-ao-thun-dai-tay-thu-dong-cho-nu-co-cao-xinh-xan-p130654467.html?spid=148545207,-21%,2.0,aonu,80000.0
799,DirtyCoins Áo Thun Academy Logo Wash Polo - Black,389000,https://tiki.vn/dirtycoins-ao-thun-academy-logo-wash-polo-black-p199553075.html?spid=247931352,-19%,4.0,aonu,1556000.0
800,"Áo thun lá cờ Việt Nam, mã VN9. Hãy tỏa sáng như kim cương, qua chiếc áo phông Goking siêu hot cho nam nữ trẻ em, ặp đôi, gia đình, đội nhóm",69000,https://tiki.vn/ma-vn9-ao-thun-la-co-viet-nam-ao-phong-cotton-goking-form-unisex-cho-nam-nu-doi-nhom-cong-ty-dong-phuc-cao-cap-p251305047.html?spid=251305071,-50%,11.0,aonu,759000.0
801,Set 2 món áo croptop dài tay khoét ngực kèm áo hai dây chất vải len tăm phong cách quyến rũ SKNHD2,190000,https://tiki.vn/set-2-mon-ao-croptop-dai-tay-khoet-nguc-kem-ao-hai-day-chat-vai-len-tam-phong-cach-quyen-ru-sknhd2-p173944930.html?spid=173944937,,1.0,aonu,190000.0
802,áo sơ mi nữ dài tay form rộng dáng dài kèm đai 2 màu,86000,https://tiki.vn/ao-so-mi-nu-dai-tay-form-rong-dang-dai-kem-dai-2-mau-p242618660.html?spid=242618662,,1.0,aonu,86000.0
803,"Áo Thun Trơn Nữ Cổ Tm Tay Ngắn Cổ Điển Form Vừa - Áo Thun Nữ Cổ Chữ V Basic 100% Cotton Thoáng Mát, Thấm Hút Mồ Hôi, Mềm Mát Giá Rẻ Nhiều Màu Free Size",49000,https://tiki.vn/ao-thun-tron-nu-co-tm-tay-ngan-co-dien-form-vua-ao-thun-nu-co-chu-v-basic-100-cotton-thoang-mat-tham-hut-mo-hoi-mem-mat-gia-re-nhieu-mau-free-size-p144355159.html?spid=144355167,,11.0,aonu,539000.0
804,"Áo Sơ Mi Kiểu Nữ LUPERI LFSM1203 Dáng Suông Dài Tay, Vải Voan Hàn Cao Cấp Mềm Mịn Không Co Nhăn, Họa Tiết Hoa Thanh Lịch",375000,https://tiki.vn/ao-so-mi-kieu-nu-luperi-lfsm1203-dang-suong-dai-tay-vai-voan-han-cao-cap-mem-min-khong-co-nhan-hoa-tiet-hoa-thanh-lich-p163562860.html?spid=163562868,,2.0,aonu,750000.0
805,Áo thun nữ dáng ôm cổ tròn tay ngắn dáng Croptop,115000,https://tiki.vn/ao-thun-nu-dang-om-co-tron-tay-ngan-dang-croptop-p242999708.html?spid=242999728,,3.0,aonu,345000.0
806,GOTI - Áo Sơ Mi Công Sở Nữ Dáng Rộng Kiểu Áo Sơ Mi Cổ V Đính Phụ Kiện - Áo Kiểu Công Sở Nữ Tay Dài Cao Cấp 3A11,219000,https://tiki.vn/goti-ao-so-mi-cong-so-nu-dang-rong-kieu-ao-so-mi-co-v-dinh-phu-kien-ao-kieu-cong-so-nu-tay-dai-cao-cap-3a11-p112094527.html?spid=112094579,,30.0,aonu,6570000.0
807,ÁO CHOÀNG VAI NỮ TÍNH HAI MÀU DỄ THƯƠNG,125000,https://tiki.vn/ao-choang-vai-nu-tinh-hai-mau-de-thuong-p133617522.html?spid=133617530,,7.0,aonu,875000.0
808,Áo kiểu bo ly thời trang,132000,https://tiki.vn/ao-kieu-bo-ly-thoi-trang-p32220315.html?spid=32220329,,42.0,aonu,5544000.0
809,Hàng thiết kế - Áo kiểu peplum công sở xếp ly eo phối túi giả thanh lịch - A56160 Xuất xứ: Việt Nam,290000,https://tiki.vn/hang-thiet-ke-ao-kieu-peplum-cong-so-xep-ly-eo-phoi-tui-gia-thanh-lich-a56160-xuat-xu-viet-nam-p173729549.html?spid=173729561,,4.0,aonu,1160000.0
810,"Áo Choàng Voan Thêu Hoa Đính Đá Lấp Lánh, Có Viền Ren, Cổ Tròn, Chất Liệu Mềm Mịn, Thướt Tha, , Tùy Chọn 2 Màu Thời Trang, Dễ Kết Hợp Với Các KiểuTrang Phục Cưới Hoặc Tham Gia Sự Kiện, Chụp Ảnh, Cài Tóc Đẹp Tạo Phong Cách Tự Tin, Quyến Rũ, Tôn Lên Các Nét",200000,https://tiki.vn/ao-choang-voan-theu-hoa-dinh-da-lap-lanh-co-vien-ren-co-tron-chat-lieu-mem-min-thuot-tha-tuy-chon-2-mau-thoi-trang-de-ket-hop-voi-cac-kieutrang-phuc-cuoi-hoac-tham-gia-su-kien-chup-anh-cai-toc-dep-tao-phong-cach-tu-tin-quyen-ru-ton-len-cac-net-dep-che-di-khuyet-diem-p74958957.html?spid=74958959,,1.0,aonu,200000.0
811,ÁO THUN NỮ DÀI TAY PHONG CÁCH THỂ THAO VẢI THUN LẠNH TỐT,99000,https://tiki.vn/ao-thun-nu-dai-tay-phong-cach-the-thao-vai-thun-lanh-tot-p74312158.html?spid=74312194,,1.0,aonu,99000.0
812,Áo sơ mi nữ công sở kiểu cổ tròn ngực khoét chữ V,115000,https://tiki.vn/ao-so-mi-nu-cong-so-kieu-co-tron-nguc-khoet-chu-v-p52303452.html?spid=52303454,,21.0,aonu,2415000.0
813,Áo croptop nữ tay lỡ me too 3 màu,77000,https://tiki.vn/ao-croptop-nu-tay-lo-from-rong-freesize-thun-cotton-mem-min-p146224171.html?spid=146224177,,2.0,aonu,154000.0
814,"Áo croptop polo cài khuy nhún giữa cộc tay nữ ozenka ,áo thun crt ngắn vạt bầu kiểu màu đen trắng mặc đi học đi chơi",79000,https://tiki.vn/ao-croptop-polo-cai-khuy-nhun-giua-coc-tay-nu-ozenka-ao-thun-crt-ngan-vat-bau-kieu-mau-den-trang-mac-di-hoc-di-choi-p244332280.html?spid=244332282,,1.0,aonu,79000.0
815,Áo thun nữ thể thao tay ngắn phối lưới lưng mở iBasic IBX133,179000,https://tiki.vn/ao-thun-nu-the-thao-tay-ngan-phoi-luoi-lung-mo-ibasic-ibx133-p204807934.html?spid=204807938,-40%,4.0,aonu,716000.0
816,Áo Sơ Mi Trắng Basic Dáng Suông Rộng Dạng Áo Lụa Nữ Đính Hạt Mặc Đi Làm Lịch Sự - CÔNG SỞ NỮ GOTI 3A25,219000,https://tiki.vn/goti-ao-so-mi-basic-dang-suong-rong-dang-ao-kieu-dinh-hat-mac-di-lam-lich-su-cong-so-nu-3a25-p143677169.html?spid=143677218,-4%,22.0,aonu,4818000.0
817,(ảnh thật) Áo ba lỗ phối ren cổ V siêu đẹp,118750,https://tiki.vn/anh-that-ao-ba-lo-phoi-ren-co-v-sieu-dep-p171816353.html?spid=171816359,,2.0,aonu,237500.0
818,"Áo sơ mi công sở nữ Linen tưng Premium tay cộc 2 túi ốp ngực trẻ trung, sang trọng ArcticHunter",259000,https://tiki.vn/ao-so-mi-cong-so-nu-linen-tung-premium-tay-coc-2-tui-op-nguc-tre-trung-sang-trong-arctichunter-p230000204.html?spid=230000218,-29%,1.0,aonu,259000.0
819,"THINK DIFFERENT, mã G66. Hãy tỏa sáng như kim cương, qua chiếc áo thun Goking siêu hot cho nam nữ trẻ em, áo phông cặp đôi, gia đình, đội nhóm",69000,https://tiki.vn/think-different-ma-g66-ao-thun-nu-nam-in-sieu-dep-ao-phong-thoat-nhiet-goking-hang-hieu-cao-cap-p164547927.html?spid=250904965,,11.0,aonu,759000.0
820,Áo tơ phối ren viền bèo cho nữ ATN418,222600,https://tiki.vn/ao-to-phoi-ren-vien-beo-cho-nu-atn418-p109934095.html?spid=109934298,,1.0,aonu,222600.0
821,Áo kiểu nhúng phong cách Pháp,115000,https://tiki.vn/ao-kieu-nhung-phong-cach-phap-p157216725.html?spid=164286362,,12.0,aonu,1380000.0
822,OLV - Áo Natalia Top in Beige,390000,https://tiki.vn/olv-ao-natalia-top-in-beige-p270245845.html?spid=270245847,,1.0,aonu,390000.0
823,Áo Thun Nữ Thời Trang JUNO Form Rộng In Hình Poodle JNATH041,249000,https://tiki.vn/ao-thun-nu-thoi-trang-juno-form-rong-in-hinh-poodle-jnath041-p257753632.html?spid=257753636,,1.0,aonu,249000.0
824,Áo thun trơn dài tay cổ tròn dáng ôm dễ mix đồ,97000,https://tiki.vn/ao-thun-tron-dai-tay-co-tron-dang-om-de-mix-do-p145981437.html?spid=145981441,,8.0,aonu,776000.0
825,Áo Sơ Mi Nữ Cà Vạt Giả Chất Tuytsi Cao Cấp 62FDS8009ST,159000,https://tiki.vn/ao-so-mi-nu-ca-vat-gia-chat-tuytsi-cao-cap-62fds8009st-p241760207.html?spid=241760209,,1.0,aonu,159000.0
826,Áo sơ mi họa tiết hoa nhí A4090 đủ size ảnh thật ( 40-90kg),122000,https://tiki.vn/a-o-so-mi-ho-a-tie-t-hoa-nhi-a4090-du-size-a-nh-tha-t-40-90kg-p175986418.html?spid=175986439,,1.0,aonu,122000.0
