,title,price,link_item,discount,sales,category,revenue
188,"Áo croptop cổ vuông vạt yếm , crt tay ngắn ôm đẹp thun gân 100% cotton free size dưới 52 kg màu đen trắng",71500,https://tiki.vn/ao-croptop-co-vuong-vat-yem-crt-tay-ngan-om-dep-thun-gan-100-cotton-free-size-duoi-52-kg-mau-den-trang-p142994964.html?spid=142995014,,10.0,aonu,715000.0
189,Áo Thun Nữ Tay Lỡ - Áo Phông Nam Nữ Form Rộng Freesize Vải Chất Cotton Mịn Mát Kita Unisex - Mẫu MISS OUT,120000,https://tiki.vn/ao-thun-nu-tay-lo-ao-phong-nam-nu-form-rong-freesize-vai-chat-cotton-min-mat-kita-unisex-mau-miss-out-p151554228.html?spid=151554234,,38.0,aonu,4560000.0
190,Áo sơ mi nữ cổ trụ kẻ sọc đen trắng trẻ trung sm13,159000,https://tiki.vn/ao-so-mi-nu-co-tru-ke-soc-den-trang-tre-trung-sm13-p106303771.html?spid=106303883,,5.0,aonu,795000.0
191,Áo kiểu nữ tay ngắn thời trang Eden phối nút bọc - ASM170,279000,https://tiki.vn/ao-kieu-nu-tay-ngan-thoi-trang-eden-phoi-nut-boc-asm170-p164227228.html?spid=164227232,,25.0,aonu,6975000.0
192,Áo Sơ Mi Công Sở Nữ Cổ Chữ v Vải Tở Nhung Xếp Ly Kèm Phụ Kiện GOTI 3099,219000,https://tiki.vn/ao-so-mi-cong-so-nu-co-chu-v-kem-phu-kien-o-co-goti-3099-p38073664.html?spid=38073670,,66.0,aonu,14454000.0
193,Áo thun nữ ngắn tay phong cách Hàn Quốc 206352,29000,https://tiki.vn/ao-thun-nu-ngan-tay-phong-cach-han-quoc-206352-p110165804.html?spid=115760794,,71.0,aonu,2059000.0
194,Áo kiểu nữ cổ tròn viền đơn giản dễ thương,29000,https://tiki.vn/ao-kieu-nu-co-tron-vien-don-gian-de-thuong-p91652010.html?spid=132003912,,9.0,aonu,261000.0
195,áo thun body nữ tay dài phong cách 141,75600,https://tiki.vn/ao-thun-body-nu-tay-dai-phong-cach-141-p112804409.html?spid=138873982,,13.0,aonu,982800.0
196,(HÀNG SẴN) Áo Kiểu Nữ Dài Tay Trung Niên SM62 - Hàng Quảng Châu Cao Cấp,265000,https://tiki.vn/hang-san-ao-kieu-nu-dai-tay-trung-nien-sm62-hang-quang-chau-cao-cap-p125020808.html?spid=125020898,,4.0,aonu,1060000.0
197,"Siêu giảm giá. Áo phông trơn GOKING form ôm đẹp cho nữ, chất liệu thun 100% cotton siêu thoáng mát. Áo phông nữ hàng hiệu cao cấp",99000,https://tiki.vn/ao-phong-tron-goking-form-om-dep-cho-nu-chat-lieu-thun-100-cotton-sieu-thoang-mat-p34316617.html?spid=44434900,,499.0,aonu,49401000.0
198,Áo thun tay lỡ form rộng unisex - Áo phông nam nữ oversize - T shirt the band,43000,https://tiki.vn/ao-thun-tay-lo-form-rong-unisex-ao-phong-nam-nu-oversize-t-shirt-the-band-p141835465.html?spid=174392902,,14.0,aonu,602000.0
199,"Áo thun croptop nữ tay lỡ , from rộng, freesize , thun cotton mềm mịn hình chú gấu",75000,https://tiki.vn/ao-croptop-nu-tay-lo-from-rong-freesize-thun-cotton-mem-min-p148910215.html?spid=148910218,,3.0,aonu,225000.0
200,Áo thun tay lỡ form rộng - phông nam nữ cotton oversize - T shirt gấu Biesuo - 2N Unisex,99000,https://tiki.vn/ao-thun-tay-lo-form-rong-phong-nam-nu-cotton-oversize-t-shirt-gau-biesuo-2n-unisex-p217176611.html?spid=217176615,,25.0,aonu,2475000.0
201,Áo thun nữ ngắn tay cúc đóng mở chất vải Modal (gỗ Sồi) mềm mại tự nhiên mát lạnh mặc mùa hè mã VAA0360,149000,https://tiki.vn/ao-thun-nu-ngan-tay-cuc-dong-mo-chat-vai-modal-go-soi-mem-mai-tu-nhien-mat-lanh-mac-mua-he-ma-vaa0360-p221276799.html?spid=221276805,,9.0,aonu,1341000.0
202,Áo Croptop Nữ Set croptop 2 món áo nữ SIÊU HOT,90000,https://tiki.vn/ao-croptop-nu-set-croptop-2-mon-ao-nu-sieu-hot-p89250904.html?spid=96187160,,3.0,aonu,270000.0
203,"Crazy sales. Áo phông nữ thoát nhiệt Nhật Bản GOKING. Áo thun nữ in hình đẹp cá tính, thành phần 100 cotton thoáng mát, thấm hút mồ hôi, đánh bay cơn nóng mùa hè",111000,https://tiki.vn/ao-thun-tinh-yeu-tho-va-gau-ao-phong-nu-thoat-nhiet-nhat-ban-goking-p31603723.html?spid=85085068,,89.0,aonu,9879000.0
204,Áo giữ nhiệt (có lót nỉ),69000,https://tiki.vn/ao-giu-nhiet-co-lot-ni-p128308160.html?spid=128309836,-12%,3.0,aonu,207000.0
205,Áo Thun Thể Thao Andromeda Cổ Sọc Vải Cá Sấu Mè Nhẹ Mát Đồng Phục Dùng Chung Nam Nữ,79000,https://tiki.vn/ao-thun-the-thao-andromeda-co-soc-vai-ca-sau-me-nhe-mat-dong-phuc-dung-chung-nam-nu-p184824964.html?spid=184825886,-50%,4.0,aonu,316000.0
206,"Áo sơ mi nữ Đũi Việt, áo sơ mi ngắn tay họa tiết xinh xắn SM69",219000,https://tiki.vn/ao-so-mi-nu-dui-viet-ao-so-mi-ngan-tay-hoa-tiet-xinh-xan-sm69-p155766564.html?spid=155766566,-69%,9.0,aonu,1971000.0
207,Áo thun nữ MXM cổ tròn ôm body cotton 4 chiều cực tôn dáng in chữ B.A.BE.S ( ANU006 ),85000,https://tiki.vn/ao-thun-nu-mxm-co-tron-om-body-cotton-4-chieu-cuc-ton-dang-in-chu-b-a-be-s-anu006-p273257889.html?spid=54657214,,49.0,aonu,4165000.0
208,Áo hai dây nữ có đệm ngực nâng đỡ vải Cotton tự nhiên thoáng mát co giãn mã VAA0396,149000,https://tiki.vn/ao-hai-day-nu-co-dem-nguc-nang-do-vai-cotton-tu-nhien-thoang-mat-co-gian-ma-vaa0396-p252675723.html?spid=252675739,-69%,3.0,aonu,447000.0
209,"Áo sơ mi nữ đũi lụa chấm bi xinh xắn ArcticHunter, thời trang thương hiệu chính hãng",150000,https://tiki.vn/ao-so-mi-nu-dui-lua-cham-bi-xinh-xan-arctichunter-thoi-trang-thuong-hieu-chinh-hang-p102473321.html?spid=102473323,,50.0,aonu,7500000.0
210,Áo thun nữ có cổ màu xanh biển phối viền ADINO vải polyester cotton không bai xù dáng công sở slimfit hơi ôm trẻ trung APN04,169000,https://tiki.vn/ao-thun-nu-co-co-mau-xanh-bien-phoi-vien-adino-vai-polyester-cotton-khong-bai-xu-dang-cong-so-slimfit-hoi-om-tre-trung-apn04-p200544254.html?spid=200544258,,5.0,aonu,845000.0
211,"Áo thun ba lỗ nữ sát nách style Hàn Quốc, co giãn 4 chiều SMILE-SALLY-SN101",121500,https://tiki.vn/ao-thun-ba-lo-nu-sat-nach-style-han-quoc-co-gian-4-chieu-smile-sally-sn101-p263414086.html?spid=263414290,,7.0,aonu,850500.0
212,"Áo công đoàn việt nam sơ mi nữ cộc tay basic,chất liệu pangzim liên doanh,logo sắc nét",340000,https://tiki.vn/ao-cong-doan-viet-nam-so-mi-nu-coc-tay-basic-chat-lieu-pangzim-lien-doanh-logo-sac-net-p261946372.html?spid=261946380,,2.0,aonu,680000.0
213,Áo kiểu nữ cổ vuông xinh xắn,135000,https://tiki.vn/ao-kieu-nu-co-vuong-xinh-xan-p78946352.html?spid=78946360,,27.0,aonu,3645000.0
214,Áo Thun Có Cổ Polo Nữ Trơn Giordano 05311018,519000,https://tiki.vn/ao-thun-co-co-polo-nu-tron-giordano-05311018-p199539045.html?spid=199539057,,6.0,aonu,3114000.0
215,"Áo kiểu nữ cổ tròn hở vai tay buộc nơ điệu đà, chất vải mềm mát, thời trang xuân hè 2021",89000,https://tiki.vn/ao-kieu-nu-co-tron-ho-vai-tay-buoc-no-dieu-da-chat-vai-mem-mat-thoi-trang-xuan-he-2021-p75410694.html?spid=75410698,,14.0,aonu,1246000.0
216,"Áo thun nữ cổ tim tay dài vải cotton đẹp, dễ mặc dễ phối đồ, mặc bốn mùa",84600,https://tiki.vn/ao-thun-nu-co-tim-tay-dai-vai-cotton-dep-de-mac-de-phoi-do-mac-bon-mua-p192217666.html?spid=192218470,,2.0,aonu,169200.0
217,Áo sơ mi nữ ngắn tay cổ bèo búp bê tiểu thư ulzzang,165000,https://tiki.vn/ao-so-mi-nu-ngan-tay-co-beo-bup-be-tieu-thu-ulzzang-p69193240.html?spid=73623839,,31.0,aonu,5115000.0
218,Áo thun tay dài trơn (nhiều màu) - Unisex nam nữ đều mặc được,79000,https://tiki.vn/ao-thun-tay-dai-tron-nhieu-mau-unisex-nam-nu-deu-mac-duoc-p82219874.html?spid=103286698,,8.0,aonu,632000.0
219,Áo Converse Nữ - 10022271_001,600000,https://tiki.vn/ao-converse-nu-10022271_001-p192113854.html?spid=192113862,,1.0,aonu,600000.0
220,"Áo thun unisex tay lỡ nam nữ form rộng, cổ tròn, oversize, cotton co giãn 4 chiều, họa tiết đa dạng, thoải mái khi mặc hàng ngày",49000,https://tiki.vn/ao-thun-unisex-form-rong-tay-lo-hoa-tiet-sieu-hot-p98084034.html?spid=205524030,,133.0,aonu,6517000.0
221,sơ mi trắng trơn,160000,https://tiki.vn/so-mi-trang-tron-p105327129.html?spid=105327138,,9.0,aonu,1440000.0
222,Áo voan hoa kiểu tay cánh rơi CBR06,199000,https://tiki.vn/ao-voan-hoa-kieu-tay-canh-roi-cbr06-p10607949.html?spid=58380518,,1.0,aonu,199000.0
223,Áo sơ mi nữ rộng dài tay phong cách hàn quốc trẻ trung năng động vải lụa mềm mịn -MURD05,100000,https://tiki.vn/ao-so-mi-nu-rong-dai-tay-phong-cach-han-quoc-tre-trung-nang-dong-vai-lua-mem-min-murd05-p189528669.html?spid=189528695,,6.0,aonu,600000.0
224,ÁO LƯỚI QUẢNG CHÂU XU HƯỚNG MÀU PASTEL THỜI THƯỢNG,55000,https://tiki.vn/ao-luoi-quang-chau-xu-huong-mau-pastel-thoi-thuong-p120519722.html?spid=120519748,-49%,3.0,aonu,165000.0
225,"Áo 2 dây gân tăm siêu ôm tạo dáng form ngực -Áo bra kiểu ống mix đồ siêu xinh, gam màu thời thượng",59000,https://tiki.vn/ao-2-day-gan-tam-sieu-om-tao-dang-form-nguc-ao-bra-kieu-ong-mix-do-sieu-xinh-gam-mau-thoi-thuong-p124238677.html?spid=124238700,,9.0,aonu,531000.0
226,ÁO CỔ TRÒN THẮT NƠ SAU LƯNG,115000,https://tiki.vn/ao-co-tron-that-no-sau-lung-p135289351.html?spid=135289363,,2.0,aonu,230000.0
227,ÁO GIỮ NHIỆT NHUNG PHA REN SIÊU SANG CHẢNH CHO NỮ,79000,https://tiki.vn/ao-giu-nhiet-nhung-pha-ren-sieu-sang-chanh-cho-nu-p139148145.html?spid=139148160,,1.0,aonu,79000.0
228,"Áo sơ mi nữ tay lỡ 2 túi ngực ArcticHunter chất vải Linen thô Hàn mềm mát trẻ trung, mềm mát",250000,https://tiki.vn/ao-so-mi-nu-tay-lo-2-tui-nguc-arctichunter-chat-vai-linen-tho-mem-mat-tre-trung-mem-mat-p247841575.html?spid=247841587,,3.0,aonu,750000.0
229,Áo Kiểu Nữ Tay Bèo Cổ V Chất Voan Phong Cách Trẻ Trung Thanh Lịch 12ANV2006ST,259000,https://tiki.vn/ao-kieu-nu-tay-beo-co-v-chat-voan-phong-cach-tre-trung-thanh-lich-12anv2006st-p263113412.html?spid=263113450,-60%,11.0,aonu,2849000.0
230,"Áo croptop tay ngắn cổ rộng ôm body nữ, áo crt kiểu hàn quốc đẹp màu đen trắng chất thun gân 100% cotton",64900,https://tiki.vn/ao-croptop-tay-ngan-co-rong-om-body-nu-ao-crt-kieu-han-quoc-dep-mau-den-trang-chat-thun-gan-100-cotton-p178509124.html?spid=178509129,,15.0,aonu,973500.0
231,"Áo thun in tay lỡ nữ freesize phông form rộng dáng Unisex - Ulzzang mặc cặp, nhóm, lớp chữ THE TRUTH UNTOLD BTS",58000,https://tiki.vn/ao-thun-in-tay-lo-nu-freesize-phong-form-rong-dang-unisex-ulzzang-mac-cap-nhom-lop-chu-the-truth-untold-bts-p71904104.html?spid=74546972,,45.0,aonu,2610000.0
232,"Áo thun dài tay cổ lọ , áo giữ nhiệt dáng ôm cổ cao ulzzang màu cơ bản nữ HOT",64000,https://tiki.vn/ao-thun-dai-tay-co-lo-ao-giu-nhiet-dang-om-co-cao-ulzzang-mau-co-ban-nu-hot-p113378976.html?spid=200719921,,5.0,aonu,320000.0
233,ÁO KIỂU NỮ THỜI TRANG,140000,https://tiki.vn/ao-kieu-nu-thoi-trang-p47240874.html?spid=47240894,,25.0,aonu,3500000.0
234,Sơ mi nữ tay lỡ xinh xắn Hati -S1381,98000,https://tiki.vn/so-mi-nu-tay-lo-xinh-xan-hati-s1381-p26271844.html?spid=26271854,,339.0,aonu,33222000.0
235,Áo Sơ Mi Nữ Form Rộng In Họa Tiết Phong Cách Hàn Quốc Chất Liệu Voan Lụa Chống Nhăn Thời Trang Cao Cấp Thương Hiệu CHANDI 2021 NT07,220000,https://tiki.vn/ao-so-mi-nu-form-rong-in-hoa-tiet-phong-cach-han-quoc-chat-lieu-voan-lua-chong-nhan-thoi-trang-cao-cap-thuong-hieu-chandi-2021-nt07-p87003752.html?spid=87003754,,21.0,aonu,4620000.0
236,Áo kiểu vạt lệch ALe25 - ALe25,157000,https://tiki.vn/ao-kieu-vat-lech-ale25-ale25-p133893028.html?spid=133893044,,1.0,aonu,157000.0
237,Áo sơ mi croptop caro đỏ,165000,https://tiki.vn/ao-so-mi-croptop-caro-do-p105327060.html?spid=105327067,,5.0,aonu,825000.0
238,"Áo phông, áo thun nam nữ form rộng tay lỡ Unisex BÉ GÁI CÔ ĐƠN Từ 50-70kg",49000,https://tiki.vn/-ao-phong-ao-thun-nam-nu-form-rong-tay-lo-unisex-be-ga-i-co-do-n-tu-50-70kg-p192459630.html?spid=116427519,,512.0,aonu,25088000.0
239,Áo thun local brand WAVELINES TEE form rộng tay lỡ - Thương hiệu SWEVN,423000,https://tiki.vn/ao-thun-local-brand-wavelines-tee-navy-form-rong-tay-lo-thuong-hieu-swevn-p270100085.html?spid=270238374,,3.0,aonu,1269000.0
240,"Áo Thun Dài Tay Cổ Tròn, Ống Tay Bo, Dáng Suông Chất Vải Mềm Mịn Freesize AT02",58000,https://tiki.vn/ao-thun-dai-tay-co-tron-ong-tay-bo-dang-suong-chat-vai-mem-min-freesize-at02-p112810572.html?spid=138609939,,34.0,aonu,1972000.0
241,ÁO THUN TRƠN CROPTOP TAY NGẮN DÁNG ÔM VẢI XỊN ĐẸP- ảnh thật sp,78000,https://tiki.vn/ao-thun-tron-croptop-tay-ngan-dang-om-vai-xin-dep-anh-that-sp-p84529116.html?spid=116141547,,27.0,aonu,2106000.0
242,Áo Sơ Mi Nữ Thời Trang JUNO Oversize Thân Sau Cutout JNASM005,544000,https://tka.tiki.vn/pixel/pixel?data=W63vomzjlfVjveV66yoFxmkxpsJuRailr70LzDx_UL6tGEB5UwG14G65Tpd-PSWyBxh4hXwFwLrk4ZdjPMlpmSFkRgh2niKxCynjjIviINyF09_RnxoETcuFBn33DiIX3c7izqJx4ZpJ7SmrVzFLNxOomiRFKaWG6XqCg3X5KM7HoJ53QUwOdGh62KwYcU9X1UdqTiBEy0RoGNOo6kvZ-Kxd7FggEPnzOMCKdaewIOwUpR7deJvM-aUUx0FOR-nJQ7eSuyTgCzrOcICIT9IQdo1J44aJ0eW6CKXOz4HuNK5NMxjW38CHieu_Pa1-58H0LWftYzbUopt9i6Vyt7aasx6LRlXTHWnAnE0ydZJyaIKaSd3F2T7X1egi2YohNbQRIxBrX-2h7eKabwrWuJHkCAJrWuipQmV5U-_WCalvjFQLwNLI3bPFP9EWY_x7Qai0fTQiH3NT_OPbVilVBFJNWFp6jAkHkcebPovW8VCBfN9Qjfg4eiucPKGOSGw6jNYaQrpRofg0D0lGVEXoMsoppe2wZnihklqsVWNKv8HzyO1WeGMslRHNoERzMu0sBh4l8GFg_YJOzjkPouBSyccT9xH3xXnwkvnV5GIyaZiKYHOdMdHPJhnBhXpJyuje8hNlMlbFnIA5ncrra6AMlxiOoFKGCJfEDaMN7s-RD923u9-7UPtsLojn9qoaE3vzAWBMZMMTHy_CxYz2ab_-yM4fWkVPqqURQKRkJbDLhDq0sMZ-gRP5Dpf0f8qLeYzXuGGRMmrc54x_fjUwbYKXtt9zeIV4Oail1Gom1e50LB5grcAKfAK2b9fcDl_z2GlnhZe3Ep20KmCFwwWqOfKEojJSURZn9T3nDU1KFEwAWVs-_B3kP5KhLp57Gd8KHqXfWG-bmG2zXkLmYvQrWij-NjYYFm2uDeCO82XQz8LOVimqrmHzybJ5OT32pl16hh4stcZ2Ac9-m4yn7AEvZ1cIeyVmHTGS0fKUQGB_HT-vjNGy6qwJq-D-OqvnpdTEE8CI907RsBZaqVK4GtVuJzmv8sOwIokwNG-NJTvdadK_uwZaeXGWMGnEMkTUAZbz-84yTeu5pRTQkQyhXzu57Txqmgtg93y5fMOJgYvYKwAcu1sxyWACp9oRqZwJ3r2iHyxVXRjZk6nSHM3j&reqid=LaI8kk5FyyFGr6IZ&type=CLICK&pos=42,,4.0,aonu,2176000.0
243,Áo thun tay lỡ form rộng - phông nam nữ cotton oversize - T shirt gấu đan len a - 2N Unisex,79000,https://tka.tiki.vn/pixel/pixel?data=BBzGeZRhuxZuL5DPQGt-bqWdtEqxf4apY2F8DyfJ6qzwXoIp-AU4oP_8G9qDmRNzmHgeKC7Mtosem-hr74GYMGg5CbnLWUthlYZt11-TQC1UnTD8EgBjlzGNoVdGuFNP1JDaZiYmUeC8D6MYKr7ydfNJIx8vhmV_lta4b0YEeyEFxYbscnzyNyCh6eXhU01ienqZcVEVpNSu1EWPtSHCZXWg-zKJDw9ovyFhh4zOtY98yLVI2PMpZpuoRCKGEsraV71RLt_PqOtpIzlS1jNSvZYfAN_Sgd7_dClMRFGjbih1-NLEj5CcWmc3XTlhXlJwefbXXipaBw9KiUSxO28vDeqMpCldGpc2tf-VaKOgN9lRiYPVMjQ1FZVA8lXDZbaDNowqbL8gukkFi-pEhI1vcHwSOy2v4Y-uWhpx4ON5tFNRSB0W0tnMSgWm00UdNrxYZ1Pdnj9oaeNA47r7l0j797J0vPJjM_xHEVpk6_9fvC_VWYZK7iRb5AB0xJ0yTB8Li45FD0M1hJ6lXKdDwGIg_dOd2JrO-InsmWggFA46zaGKxwH10WXAcHbTjhfXRp64j_NzcgeSLWvXRdnnBasa03KOxrFz_EZH-qOya-YEAV6Hw5TLAAE6gLO99y6_6kgOnB_qTJXgRwExFxEoZhGfaKK7xjGJEPM8pP4GmJzLOL-eF8tPd_-65mzRmciKq9XC6uUMlj0cbhExBqaSWPdzjSuh_SRQfJAOmxVoPi9tV9iSGZUbF3lUTAQNeZp8Hrv-wxjAWxKN5rIACBrVzgpwsl_svdKTrZL7FhTIOcuzlzXRrjqjlfdHO4jbdrVuRuJxdqeeFNhvvLGkRR4IgPdIhSaoFGqr-PAO9rge2FeYNWnihwMDrhAI6DtZzX1jR56fy-tVcIOLE9NILX7VAe4oRHitY4IqzPmiJn8wefw8dOkbF554epnuyGcmlFTFqesRkJIU2_j0AqZnoSUGGVZv4wVFDfwm8Tl-QC8CUZKuMMV4524b6NpU9-mI4PGDGjxF1rqbckDbFD46U4--B8Oo5nXkhkniu5BTcfEvE9Ph1tiTfgqbn7k7YSGTMMUHimWXmvWJVb6lgLxsEc21Ud3IL-0Yz0yVS2aA3oE2r-ySrG3oVOoF2KLZvSmbxIEl6rSjkSvZramSRwFYooRP&reqid=LaI8kk5FyyFGr6IZ&type=CLICK&pos=43,,75.0,aonu,5925000.0
244,Áo thun Nữ Áo phông nữ đơn giản thoải mái vải êm bền đẹp,29000,https://tiki.vn/ao-thun-nu-ao-phong-nu-don-gian-thoai-mai-vai-em-ben-dep-p19841529.html?spid=93278749,-5%,331.0,aonu,9599000.0
245,(HÀNG SẴN) Áo Thun Nữ Cổ Lọ Cotton Ngọt Ngào Quyến Rũ AL60 - Hàng Quảng Châu Cao Cấp,165000,https://tiki.vn/hang-san-ao-thun-nu-co-lo-cotton-ngot-ngao-quyen-ru-al60-hang-quang-chau-cao-cap-p125022315.html?spid=125023124,,26.0,aonu,4290000.0
246,Áo thun UNISEX nữ chữ kiểu,21000,https://tiki.vn/ao-thun-unisex-nu-chu-kieu-p20443808.html?spid=92744468,-12%,180.0,aonu,3780000.0
247,Áo thun tay lỡ form rộng - phông nam nữ cotton oversize - T shirt bad gipl a - 2N Unisex,49000,https://tiki.vn/ao-thun-tay-lo-form-rong-phong-nam-nu-cotton-oversize-t-shirt-bad-gipl-a-2n-unisex-p217176753.html?spid=217176776,-67%,1.0,aonu,49000.0
248,"Áo hai dây lụa cổ tim mặc trong vest, blazer xinh xắn chất lụa cao cấp mềm mịn, thoáng mát",127200,https://tka.tiki.vn/pixel/pixel?data=NszmuTOf_FfVLaWKC9iBXOrDh5Et2ZSjkjm1bmkJFqLuWxx4qFElG3jKs8HX1gK44xTtqRz8J4YuEILYzGR--NSPcrQV2U4U7gIdiYBg7uH4LCq2CxokMmcRXTOiKj14qHuWP5kAyN_sZ0l4Dg0V4AGQv3PGKiL4mkUaYGVrtf4SCHiM_3RhqmbzoMmMWOu_yfxOqqq6acq_m0xZOGwVkixLnd1Oo8zP8Scn9I5EO_CeozQRydXYlcU2qyTHiOY7bSJqq3XbH7ajVOlEBCIa9MoFh0ytnge9mmJXdXjntv_GsONPQGVDh3HOLUQ65PXRAWQcfS0sNSE0INszH6B1xfE-4Ozpj8uGavDFLOLs9Y0-31379noJNENNw2LjRPJVUlhBkhCBxpmiE9Vp-0oR4ao9wt_8hT1ves5Y-PxFe_K6UZHLDHAdvWuOP4IvkE5S6yxH1vOJtyCBQMQLGQMesfx9tFLlWAELAE3AzYKbreJEnmenPFVm8FVncWrxfZq1ZO_fPTH5EXSm9QykhNO--ubXHPT64ThIT61ghaZzjFUYIVsEAMxfGSIexKAAwyQcepOiMjzEFQwzUqmxjTayt5PjJlcQUFO-gLfF8h4MQds8lYOemFue6BspsRI0VG903N-6zeaR6ZH2_Q_hFiKbx-bIxVCTkkJQ_fDYual4f_rI6DzXHSJ9P7De_l0Pe0rVEfBQI3asZppT3jd0mDmzVpSJn6jTv4GZR-I_wYXXRBfLPKQJYnxBVifTU7i-sm_ElYy0nmPLTYcvZcNnoJ2i54MN5Y27e0-zIWmmdS624Ee-JTsufQLkWWHW_aA0mOoKAPusd_vYzRSRBDA5eZJ6FHTDDKrO9STrImacgj7-m8X3Abp3rLzgsaV-PDE3rHHbVM2-FD6ZJtxhe3T82UgKvycNf4ExKBD7QuXIfA5JzMn0A3g6fLEZxGZ-ABb7UAqdwas18Rh_Rof0V29TGhNvmekTFp69Z29GVTIdYwumD-cZiNbleaDx5PVkW7U_XUO_sA_OrTmxM5bL21373au9ln6fD7xXGIw2LGBeK9RWRz_2VpNTe_9f-iTCfOL1krt2pdlI6k0uxSyd5Q6vcONXP3KrhnxgYBsKhEE_E7QGJJjSJMkUOdIqrxJVBc6Pkubsh0X6GpuDPqKh1xW57rCKdyY99jG_-ueb79Q&reqid=LaI8kk5FyyFGr6IZ&type=CLICK&pos=55,-42%,1.0,aonu,127200.0
249,Áo ba lỗ nữ có đệm ngực nâng đỡ vải Viscose (gỗ tự nhiên) mềm mại thoáng mát tự nhiên 100% mã VAA0094,139000,https://tiki.vn/ao-ba-lo-nu-co-dem-nguc-nang-do-vai-viscose-go-tu-nhien-mem-mai-thoang-mat-tu-nhien-100-ma-vaa0094-p196378773.html?spid=196378869,,42.0,aonu,5838000.0
250,Áo sơ mi tay ngắn unisex phối túi vải nhung tăm thời trang tới 130kg,280000,https://tiki.vn/a-o-so-mi-tay-nga-n-unisex-pho-i-tu-i-va-i-nhung-tam-tho-i-trang-toi-130kg-p214691297.html?spid=214691299,-47%,2.0,aonu,560000.0
251,"Áo đũi nữ cổ tròn, thiết kế cơ bản dễ phối đồ, chất liêu đũi sịn mềm mát Đũi Việt DVALE40",149000,https://tiki.vn/ao-dui-nu-co-tron-thiet-ke-co-ban-de-phoi-do-chat-lieu-dui-sin-mem-mat-dui-viet-p261971534.html?spid=261971536,-50%,1.0,aonu,149000.0
252,Áo Sơmi Nữ Thời Trang JUNO Tay Dài Nắp Túi JNASM014,149000,https://tiki.vn/ao-somi-nu-thoi-trang-juno-tay-dai-nap-tui-jnasm014-p203076840.html?spid=203076842,,3.0,aonu,447000.0
253,Áo 2 dây nữ cổ tim lụa latin cao cấp mặt trong vest blazer storevanshop AO0003,142290,https://tka.tiki.vn/pixel/pixel?data=NXyH9cVNToWelbRhjdN7pKRMTWxKxbCPc2g5SKfd_fJS7h87jTChHrF5KxWQ29rkUjrwwpUNnEe1P4NWoY9gHocsfok_02qyGYB6u9r6jM3MBlolyn0TBD3nMHq4OZErp9gW5Mo9mUX_5KAdfuKlzYIjoneOc7nuNRgRMafsGpOV7dNm_0Hzde39phRtznztvyE9UOuux0MPeg50N9ujYZbLGUSr4R4Upo_IYbEUS5PN8xBGJAQjDeJ-BH10w_8LOVqp1OAcQDMORu2J-3IgXZehsWC3_4hwE7yFoJ-nCpwVsGYEYuXYN3nsLXDrXiMZZ7snsHAvKyOt-eDVdcTYrvWigGnvV4lhvTekqF6j4nJVRIt0XnqztlJomev6pQPRSUwK9EEE_E2SnJ3SZraqStqcrQ29cZWq4LhwjE_3nsV4cLSLb_txYlu4LtiSwQnAcWan6MV_J9cx3Bpzh5qM6ML8vcJHCdZ-QKon8b7P744pthGiiFKB-aNhVGfWxAdDa6RNUmlbLHSGZuuJO3GVjdtTsAC92zWbYxGLCzWqn6plqevE953xBxy8YfRMlEoEt593RSX_XFtm0tXeU2XSq5NLHB_IMuMheJ7xxXxn-3cNgXRzEJZ0ymtRwQzDjsGPKuFlI5j1zG8t-hGjN8IC6IkrTG4tbxzXWjloUNa3gaX1OI-ckBf0M8cpuGmyEdskDfaaz1TAFgf2cEMwpNT6GLx47SCJC3g4e3TaPQb9D2jpX9ivHcJyDy2NP8frpZkYl7KPnaEXxlAz_NRQlGawJA-3JaUIeEbq8YiTlh12n04ke5q8hdD-Q_ZYKZhUEmNrC107g-s1otK-2vnujgCiR38r785_F6c_s3VZGgPlJiyRZvvryq8DU4QkpBrqOmSxB3-Q62BfDa_UIGgPoTMtqYzqV-qFXOPCHXp2uIRMAM-WQo5ACihJnUc2l58PXFUQ2d2zQP8svIkEnsYcz8JuBNmr9tjV2pwBfP2eOwDm2hIO4mH3yWeyA5-9zf3lDNtOsykjYLVlbloejR9fo75kPxkZCHoAVmSeRDHje8i3dFw3kNe5w1wJtbyRs4A76WUiPHNyAsl-gZi2Tjdj2JqLfow-KkoH9aEhxm5gNL4VcHEBO1EQKTAWB4LxiSBXLibb-S9YtCEnVZOL-ZydsXWXxQ&reqid=LaI8kk5FyyFGr6IZ&type=CLICK&pos=62,-17%,1.0,aonu,142290.0
254,Áo thun Nữ croptop cổ tròn tay ngắn 7 màu cotton lạnh chất đẹp siêu co giãn chống bai xù,75000,https://tka.tiki.vn/pixel/pixel?data=K0kLiT8KHDNzwTLCUbKuL-8CuAucbRnlc84VtEh7ZwME8WUELpnLXiZui6lSlzh3j9RQq6YPwntyFxf94i_fIZdK1swAFxW72VtWncmHBpO7FLaQzfxiBzcletmxXWF0Eg_CDfUk2uv5Rd23C5Al0YnVNo6FZuMdspsb-noyLD9LpbucRtDuYFNgaLOUbsZ6X7vcyUYfTXHLQJb5EfIxVg6P27M2ihcH6FOltxe_Mt-nRqfk_WKInp3kLAUJIhq-8ABgULasV-ZIjN5h3o6-m8ife-Ymqz_7-BQms5BUZjxhw90BoAE5mB16gPqm8YVZXItrGbJD5CYWfWOGeC4ESSn0bD2XKDKP2jedxZDBFXR0JrRI76llNovRKHqqtJIAtNU0-0Muvob9kgSBoBr_1rpQvi4FeBb5nvzj4-SyFmV7BymBbI5OIKbguc4YL5KSyNTPpm4QSUwDlBLt5PQxGHXNu1lPTXrlTyH3THNtNt6N2fRogoU0W29FPY9AbRzWE-4wM0Vzyy9a-fZjMx3k8SFnC_7qnNY5gRWGpzQMgEhXz8dtVQAeozXuMsdVrxfQgJy0NvzpaZwxFjmR7DOqXwSvDkjuKc79waRli730TgVeDq7j6v5crfkAzgoUtH7GsdJVOJRgOMLNcfiL1d2JOokBUgbye3JYIKwLLiWd6gkHznN-qPH9Ra3SdF3XxwnhDtDkv-s7tDAzCTOt_Xw66rLdh7TIWpXsqldT1uwaOmQ7CQ_gcRmNwg1T8VcqP4DGKGJ1pdqralHuPJ7LJIoyqVdM33_1b9gieKfBF7pCHThXVOV-Oc4J3oeYrgnadUsDUyxbHmxZrW5EVRn_2zQ7QSGBIk42NN4_qqx6lsOEcbFZZTCXeqlhMBZt4-giI8rwhyvaeGPDKKUFAVo-5hJV-d7Dtgg8QsAtCtpSimjAsvHNvRfaxUFWpRBJsBiCGlKv2dwQw8pnxbhwEFiNRh3kd4ZRZB72rRssfp4IVHsuRy28yLJ2czJqLXj8K7rZalxAtvr_r4aamm5hh8GIcaS2IPn9S7C9ykbVco7zXbYarDLpBayr4IcChOFIDhlJKqR45hxUnkiVgpTDlZcA1jXxEKi6qVLY374LyzTjeE1XVVt4rm_wNRQ_-o7tuicgcY7oRM8OMHK398yEOH4&reqid=LaI8kk5FyyFGr6IZ&type=CLICK&pos=63,,27.0,aonu,2025000.0
255,Áo thun Nữ croptop cổ tròn tay ngắn 7 màu cotton lạnh chất đẹp siêu co giãn chống bai xù,75000,https://tka.tiki.vn/pixel/pixel?data=CUMkGgmFi5m1tQVL7Bm71ocdEkaICBrxvlPBv79UoLKv3wSzA_ye0PhJUq69QxVD9pBB3oBu3NsBV3aDngnySc06nRsXuRdkjU0D76z6YLwAolpSI5vJsphzMlmFa1haNdXKwznyhlgxH65fJqTX0FMnqmBL5QKHmA-3gcJ523r56ZsPVhI1yz8gcYdYKrOLhQUjzAN161ou3V6padSB3GpLjzwH2JvkgvRwBGHuhAmGgNY935vw7GoTxsdh_9zfPVslI64fpT5oLods8h5uuXlCjawvY8eBZrRHUJqEcOY1V9P6Y2zgTc4-gkK_dD4iKW6nImvy2ZeDvT6GDIaTtVbGlbbfS2A4mX9465cBAQlpPxM9e4S81M2ap7cAIhuza5-qBaslsDairdcVnkRDJx8EAGUpXT2C9LqrK4YuMB_M7RGZggrM4NVUGdqlSSQvv-89xN98Np1BqCmEzvaSK7EAJm6p90uAU80fiFsTLgJprUpn5ltLNtjGUVG3mWTbx3oDOQOW9vqkIUW5qp1RJ25CFgDyYpnWbCiY0KyWHwqwu5MSCXr1_c5VuAfGvNC-6GOeljcogAxPdwQpnsL5nzBnWEsMOCrZhU0A1i_afwN2nT6DdOvxZ9EN8SGptd6zRLK5KTsYCUrXujYokFs6A5OKSWxkX_LhfbJr5u-dYAWxJct0qkkz88FtI9u4Ev8xjWTEEgfea3tRnxB0xuO0BGKyZTv_h4Rxv9pAkVUpYeDToOKaQlsPJOBlgk7wga7yYCTTnOXpUJW6kc47T_QuWECIN-62-mv06eXtkueyS_m-EOeR5u6MkfvMh9mlwHERhXOvhY4vquqBk5vu6aDbNM_jOXXL382M_0Vzh3876SV5ES1RDsU1OoJHwdxLzkOP4kd5apDvtA3JG-TG729tbHZVM9amfh9Em0nckQZlmcnkOekhnWXF282GmUCtqfHHo3S63puuNhoSi4oDUj61nPOHsvtutv6WsNmCShltfI3OTUV46M94faPdYpdCHmfVANUhXMYCJzSW8hNNgWS31IwfSwNzxh-qiyOdyyi2IUEVZ_mouCacvJFGLtn6jNg__YjrT2CMI9xvQnI5N6egW7k9t6cZ9QsqA7KFsghO_MwTOZo3ILFCHDnBqXwaDV3F9z3xSY3DzxPOqVU&reqid=LaI8kk5FyyFGr6IZ&type=CLICK&pos=64,,22.0,aonu,1650000.0
256,Áo thun unisex tay lỡ form rộng - Phông Athletic,49000,https://tiki.vn/co-anh-that-ao-thun-unisex-tay-lo-form-rong-phong-athletic-p74370724.html?spid=74370726,,46.0,aonu,2254000.0
257,Áo sơ mi nữ Đũi Việt thiết kế tay lửng kẻ sọc cổ V Dv24,139000,https://tiki.vn/ao-so-mi-nu-dui-viet-thiet-ke-tay-lung-ke-soc-co-v-dv24-p83395649.html?spid=83395655,,21.0,aonu,2919000.0
258,"Áo kiểu nữ Đũi Việt, áo nữ form rộng, họa tiết hoa thêu ở ngực, phối đồ xinh DV18",131000,https://tiki.vn/ao-kieu-nu-dui-viet-ao-nu-form-rong-hoa-tiet-hoa-theu-o-nguc-phoi-do-xinh-dv18-p175425359.html?spid=175425375,,5.0,aonu,655000.0
259,Áo len tay lỡ vai bồng nhiều màu xinh xắn - LÊN DÁNG SIÊU XINH - TRẮNG,89000,https://tiki.vn/ao-len-tay-lo-vai-bong-nhieu-mau-xinh-xan-len-dang-sieu-xinh-p183039007.html?spid=183039015,,2.0,aonu,178000.0
260,"Áo giữ nhiệt nữ thun tăm thu đông cổ tròn Vicci co giãn 4 chiều, ôm sát cơ thể tạo vóc dáng thon gọn",115000,https://tiki.vn/ao-giu-nhiet-nu-thun-tam-thu-dong-co-tron-vicci-co-gian-4-chieu-om-sat-co-the-tao-voc-dang-thon-gon-p273159563.html?spid=273159619,,3.0,aonu,345000.0
261,Áo sơ mi nữ lụa họa tiết A4141 đủ size 40-90kg ( ảnh thật),120000,https://tiki.vn/ao-so-mi-nu-lua-hoa-tiet-a4141-du-size-40-90kg-anh-that-p196726189.html?spid=196726350,,7.0,aonu,840000.0
262,"Less People More Cats, mã logo.g266. Hãy tỏa sáng như kim cương, qua chiếc áo thun Goking siêu hot cho nam nữ trẻ em, áo phông cặp đôi, gia đình, đội nhóm",69000,https://tiki.vn/less-people-more-cats-ma-g266-ma-logo-g266-ao-thun-nam-nu-in-logo-dep-form-unisex-ao-phong-goking-hang-hieu-qua-tang-cao-cap-cho-gia-dinh-cap-doi-lop-nhom-doanh-nghiep-p251296030.html?spid=251296801,,5.0,aonu,345000.0
263,Áo thun màu đỏ tay lỡ form rộng - phông mặc Tết nam nữ cotton oversize - T shirt CREATED - 2N Unisex,49000,https://tiki.vn/ao-thun-mau-do-tay-lo-form-rong-phong-mac-tet-nam-nu-cotton-oversize-t-shirt-created-2n-unisex-p217176640.html?spid=217176644,,3.0,aonu,147000.0
264,Áo Thun Unisex Nam Nữ Cờ Mỹ American Flag T-Shirt 100% tagless cotton,20000,https://tiki.vn/ao-thun-unisex-nam-nu-co-my-american-flag-t-shirt-100-tagless-cotton-p95050539.html?spid=95050541,,91.0,aonu,1820000.0
265,"Áo sơ mi nữ hàn quốc, cổ trụ, chất vải đũi cực mềm, mát, form chuẩn, nhiều màu lựa chọn Đũi Việt DS99",131000,https://tiki.vn/ao-so-mi-nu-han-quoc-co-tru-chat-vai-dui-cuc-mem-mat-form-chuan-nhieu-mau-lua-chon-dui-viet-ds99-p173388913.html?spid=173388919,,8.0,aonu,1048000.0
266,"Áo sơ mi nữ form rộng LHAstore, chất thô đũi, thời trang trẻ",149000,https://tiki.vn/ao-so-mi-nu-form-rong-lhastore-chat-tho-dui-thoi-trang-tre-p36256630.html?spid=58379684,,75.0,aonu,11175000.0
