,title,price,link_item,discount,sales,category,revenue
0,"I love you, mã G98. Hãy tỏa sáng như kim cương, qua chiếc áo thun Goking siêu hot cho nam nữ trẻ em, áo phông cặp đôi, gia đình, đội nhóm",119000,https://tka.tiki.vn/pixel/pixel?data=r6sTGM5uKRSTppEaIaqweiVghycSgS6hQQ9s8z8dsmRnLHW0EgSDGMXgBpRLbaiHG541bo0UWuSBnxpobFtGK-GfrZUR-kWi38VytYWoC0kTPClrAlWpHFKI3isI1cW0uGDITYfE0xBph1p7QjxHET6_D40-7KEA_8uZpEWw2BO4vqLN9BteqEzbRIgIua8p8lpdzl1XMiDnhBrjkyGIdA85-YIsBXf1MROaZHsfJgJ1WxfqEDuEvAEEIeeNbCbjryAMmJ_Wx5WyBCVQCj2GakbWcyAyvauCAPRkGUhzbfzHPXNsClwPua3Cxul-kXRH6GdwXl7k5ysK4qtZgvBjVXYkn2DrooJ8ucYmJLSaGLFHEDUCDBRyiNbkFu5KkoiCl8WCitLn24GAubrkUpIns6xuXt43KKe3L2Ua-pb-YKal_W60BguYwoNahMGDQmrxD5ck9B1iIh3fTlcQrK75wMFmLB_KKljffPmhBhjgt_xzXfbhlK50bMemZCuKVHiaKT_rs-qx-bueub2Es_S8NUj0hIBk4wofC7-Dg3xzsHHHsbgw4Vczh6nzQLp5-YwDXOMEtBSJTxMW_9YOmJNBS2mBzhVnZk7HGw_-KcIhrB9YywBpCLrqZo87Zn3_XiaCnNpEbu6yEYxwY5HziFIZZ0oA6DWASsaFBNZ-uswEoofFga0yMkcX6dL9RLxbEt_5R5lfNqH6s17a3cSfKpux5PKfrt5R-gOOm4RVsLFh1e9aGEj160Gx1fMVptNlnwyiUE1bn0wuupd6gj3xZ5LezBfw56sN9bDxJHdw0sklFKDjLu4YS1XhcGqZHXmmooHmRF2iIiulevrMIcYj_PYn9iAzvLObQ98qjdC6WUmPgcFAUFsbuaiPuDYJiaopi_G94v1FKZQLLLkzbpor9g1vfYDIC8nXxIR-eDAfznAJbzJrGOHpyq397sAWy9LsRG9Z6d1IBbhVFAAQZ7j5uRGxtOPJQaU0QjLIYu7qaEgDtWJn9MZxQ3xlKmyauC710Nu9fBBQaQPpk-RgcfiotxfzM1fEXuwWMtQdrakE2JUHRGJKnMAkyLXLvAo-WNPICKElC0kU9HoXgIVedXLmwOyfV-vW9qIF&reqid=d73wsIrT6sCXrsDK&type=CLICK&pos=1,,35.0,aonu,4165000.0
1,"Cô gái thổ dân, mã G79. Hãy tỏa sáng như kim cương, qua chiếc áo thun Goking siêu hot cho nam nữ trẻ em, áo phông cặp đôi, gia đình, đội nhóm",69000,https://tka.tiki.vn/pixel/pixel?data=gELn6yQnYSajT0LVdTP3VOAkKA6aXCgRSJCJKJck8e9TXk3a__QJzNfOiYcFFFuhrzGJymJ4ndcgGaCkLSGn2Yi9AgjrmKlWi2FG8jOBvSs7BrricXEV8lDAvIR17_8VRzBNgBKOndHNbDvsBwuoyONEsTlnDEa5PMTC2mlMSZZqCv13BeuwFgb7O1rCzvTP39jULIqKRG9O1xe3anrXP1YNBKXnpuUiLgQF8EkYOcTLENff0cJTqymU-pd5qwSXS5xNgYk8gmNkfRpgVrgGofGD3IrrMIp3028mKDtuxDljAafVGfBWuTyOZgCD-cmG8-_XtA-Id5WE_3b6mi_YZbAOWzBjpbkgSLo480sa14deBsmknpo189BNKXqmMS4f6VpzzJ6oTTiGQ3bTX5a-be5oo5rAjofaU6xHfDjfaAFS4HF0xWNnmOtSlyBNGqH6p3_-PTQKS2A4_BBqC3hHCN9FZWoXqYdc8k2e9mt8-HAU_QDSt0nOG7qc97koigboJPWO56eKbpezZXFpPVSZghDapCY31yU-yMyQC5HmHti4ohptPbbazL05hp5iC7rdYkmFHWnyRwMZgH3rarFxoL9W2hn_bzra2j1ZGJvtgUoPpe-QiOopMau0njjdPyBaCa7uTdn7tckDK_T8JNpmyqGTyvFOvG2Z1SrQod3S0aIsoLK612qfQhhCDN5Q7GCzJRwPxDg_xwv0qHrL36vpFccUkK1AoJN1Kz8qyOlPlING98qppuotC3js0i19cf35vwnIhd604eBWucRvWI2j5CKTvVmQfWgAwT9HNJX015mWkcaUG_Kn7ao3S9ljCNfAbNUF50MUst8WCLKd9EzkJBg3RO4SLUPjBPx8FO-Ztqh_356Gza-sJDPfjaOUywnSzBaMTg2nsDXkHvHXdhhvojrc1-tGhFenVOLf6IxAnQQwbdFirSnz0js07ujhlnjk1KzVyE4hfR36boHOFIDDy7F64Bqa_Pg08dBNmTI-TYqA-xVGmjK2RZren-907KdfhpWqQE_pm2PHW6gdoD6buEVvwSC6XKYob_hMCvhrbugYQbgKohndI0zVp_vZzWgjOaqOh1th&reqid=d73wsIrT6sCXrsDK&type=CLICK&pos=3,-6%,11.0,aonu,759000.0
2,Áo len nữ cổ tròn ngắn tay hiện đại trẻ trung len dệt kim mềm mịn co giãn dán mã VAA0316,139000,https://tiki.vn/ao-len-nu-co-tron-ngan-tay-hien-dai-tre-trung-len-det-kim-mem-min-co-gian-dan-ma-vaa0316-p196378693.html?spid=196378726,,60.0,aonu,8340000.0
3,Áo len nữ cao cổ dài tay len dệt kim Quảng Châu mềm mịn co giãn mã VAA0348,159000,https://tiki.vn/ao-len-nu-cao-co-dai-tay-len-det-kim-quang-chau-mem-min-co-gian-ma-vaa0348-p204985388.html?spid=204985408,-31%,24.0,aonu,3816000.0
4,Áo thun nữ MXM cổ tròn form ôm body thun 4 chiều cực tôn dáng thêu chữ ( ANU012 ),87000,https://tiki.vn/ao-thun-nu-co-tron-form-om-body-thun-4-chieu-cuc-ton-dang-theu-chu-anu0012-p273249491.html?spid=55099670,-37%,176.0,aonu,15312000.0
5,"CHOPPERS, mã G100. Hãy tỏa sáng như kim cương, qua chiếc áo thun Goking 100% cotton siêu hot cho nam nữ trẻ em, áo phông cặp đôi, gia đình, đội nhóm",185000,https://tka.tiki.vn/pixel/pixel?data=0LS6Wp0KjOICaqqL8cRrJ9l4XUY21GLXFnHjC_bZboG_pVPY_5GzoOq84NevvIzS3dbEq-jflIYPrmUsslzBeRBSmW_R69qpxEtDbM1VL5oOCBQYB8a2v_6gwv_OR74ntDHl7OYZWw8bRd8MMgYaJLa8LFHkJVv4oZ77HHDKphrOTsPPhNDaGkeHK5-vIm756OS04tQcImv7lhzdJpmKgX653mmna0Ej2DhhDr0gU8au7dhCSJHzuFmw9RTI300I0-kvpYKs8QJX0wcTzOneVgolFk1TLsJidQOiTs8X163csJjMoxJcExjkE0f9sirKM3esKEGffhU1kSeKnA-R6fPMXBS5mMQfpKkeN_VsE5nnN3nqs2Oow6Ri4zbFNmV5i3vsXBINAy-FrU-R2qDy_90vKGbd2FQiLW7u4NHO9Yhel-ghI06-riG7J-0zM0kL5XEcEorueuu-Rkv1b-oq58ffO-EI9Fj8-yPHy4qkpVMKO8lV7N8aZ2vr9U0QQ0Dit3UTckv5EXRzPLK9f_vohJrAzEWpXAtsNqhcRJQFGUwKXj714_dx-p4JfWFz3uDb4443HlTnAX5hD85Lh05hKgDlOiRiSvGVr74Dq3JNYVMHVhmf1omuNnWiS3IM7-E8-_H16bdpf2SVrK9q2k2DkosaXlXC8AQMf4x4cC8tpSj-7qKvOZke10HAEqzBWwDcH4sWnt9kmh5Er5ap9ZNYCeYhLxrczI-CHf01oComtLoY4yejbPCegbI1wLpjnkadGX1aWvzGf1NPH487aXMGEg3LvUQamTDRrG9U9OsJbVV4YxWtB4PGMB3zNfdEsD00rlqs7EbrPicM1RDqyZyVOQfjDWV-yA-OoVeyz4RKvdltLb0VHMsZyu6EAwR4QeujyMgc1jqPbKVnhSYW-ciZfbWrq0Hl_bZ1g5TW3dAQP_1dusmRNpZOjgNXbFAkH93QMWeDe9SHsCTkRyrGHkjQVIay0To10hd6vKPOsSNfq0RJgclzNQ6uwyQUHREuRV0WNeFtDSPbqp_Yrs0PQOAjk5NUSaoLNLbeJaRotIDjNgkWLfxQUvhv_h1fEZ2lxR0d_WdJ36Z5xXbr1m5LKWssAIlP0dL2ZcCobQ4G8Mrj1tMt8pXxrYpNLTTmI02-yeI3TYYve6h5moDbPNJNpL3pmdvMUHLZpmMXERWGDfCbcknv6ZUf4dst-oEECqj9pWvOO3akc2qNdcqqlPG9m98WEQXYBNxMcC9_3UHWBrERMdq9B_CMxXo&reqid=d73wsIrT6sCXrsDK&type=CLICK&pos=11,,3.0,aonu,555000.0
6,"Áo giữ nhiệt nữ, áo thun dài tay thu đông cho nữ cổ cao màu đen ấm áp",35000,https://tiki.vn/ao-giu-nhiet-nu-ao-thun-dai-tay-thu-dong-cho-nu-co-cao-mau-den-am-ap-p130452530.html?spid=130452536,,226.0,aonu,7910000.0
7,Áo thun tay lỡ form rộng - phông nam nữ cotton oversize - T shirt gatin - 2N Unisex,79000,https://tiki.vn/ao-thun-tay-lo-form-rong-phong-nam-nu-cotton-oversize-t-shirt-gatin-2n-unisex-p217176740.html?spid=217176745,,81.0,aonu,6399000.0
8,"Life is a journey, mã G83. Hãy tỏa sáng như kim cương, qua chiếc áo thun Goking siêu hot cho nam nữ trẻ em, áo phông cặp đôi, gia đình, đội nhóm",69000,https://tiki.vn/life-is-a-journey-ma-g83-ao-thun-nu-nam-in-sieu-dep-ao-phong-thoat-nhiet-goking-hang-hieu-cao-cap-p164549480.html?spid=250964069,,21.0,aonu,1449000.0
9,"BREAK THE RULES, mã G45. Hãy tỏa sáng như kim cương, qua chiếc áo thun Goking siêu hot cho nam nữ trẻ em, áo phông cặp đôi, gia đình, đội nhóm",69000,https://tka.tiki.vn/pixel/pixel?data=4YWZTmd16Pf_hmVngX7bYgouba0-Kj_sOvaerLATHfGVqg9U5p2PcEMPQ10fyHxD9r5RWX5Mtck1Je_ieGkt-voUkiNqlTUOQT9Gj3OLMTJ6RcQXzg7tWGLSsOBRDEyT-IIGaxjdqhveBv5_MW2RPjfv58nb7EctMqRnC7zX7-70RjEv18GEdA5KrFyu_JDVzbl4h1Z65PBEXa_k5H1xlwuTDsHgPEJ7x6-dJMp5Jg5_nZd2jIsRhjaTxfqQM4MP0lSRgKeOWb-etaMPtOON06cgYzqeL6K9lvuuJNqijHcSs4VLWW2GRRdo-fFqAoJBGG0qModePMr1_RUaxAfzXNYX-QjkanoVBQp8Z7mmUmEYggZPYlPFh5BbPxDy7eGNWuTbJUoa8S3o85rXOb88iZRwKrUCXLncwfiiov8zWMXXwJ20AnXqqNMEfMb2sOTq9R8amRYKuQUVlquRRj2j7V18HMN8JmhniTzQeL-NiiUpWti2dlYtqiyKKcgC0oDBxj1pMOSP5TLq2o3MTW7J0NM6iUa1CoI26Ewdr_OyUT3m8TUo1qoJI1QjKk7daPVyCoPkQegBT3IjXk0HMnClT5oZH2Lf9Hq_1kPf9rnzCOL7qzG0TSxcZQJzufXlsiz2LKB5JDxGzEqFJ-mFOX3e2iU7RQ9-Q-6cCmiEgOth3NShpHLtunhl0gRAPI2YXGydd-RUtVMoaWEM5fJXMvPlztndpyUTQ3VMNs_zgvzc0ZqCQ9rrlLnbMa5nOXRG8jgb43aIfM_8--9BF7ZRgF_PC3FKa1dBIrlEj-S9FalcgtiNTTXerQhlonCBc64kd78gb_MeTXs0fiBkhuq44Z0B3rH6q_apF--haro49z-5e1acfgK-0MicwOOmHzP5lJtsk9NG_htlAj4uiUuyJnE0Ppxsdu1u9p8vpozy4V-aA1cMc3jmszZsjqaZpgujhLK02oOneHBACsG_4ogs2BVPrued4V0IOQnHHveHaF-HhPAP6kd1Ku-YbTMlSKrYPPpuE1PQJZuXREUSC9JO2RxgpjGq0Jr9lbaCwzSLl45NlNtblHfSALL4_bw4zFlHc3ulYad6QNqOcfkJM4kIOqLqRr8W9odCaeQks99Odp0EyWfybDv631tHcYXMXRMZXqFQAS3ihCKKm1yaB5RDT3qJpn3NJmweALvP7wZ6ER6pPT3tQfiX1Dj_HXtKmhiCMFWC8kAvD8TBTC-coWEpUeVH7UoCvkFtQD8T__w&reqid=d73wsIrT6sCXrsDK&type=CLICK&pos=21,,11.0,aonu,759000.0
10,"BELIEVE IN YOURSELF, mã G32. Hãy tỏa sáng như kim cương, qua chiếc áo thun Goking siêu hot cho nam nữ trẻ em, áo phông cặp đôi, gia đình, đội nhóm",119000,https://tka.tiki.vn/pixel/pixel?data=WCmPwHiI3qMvwalir5wrWeTwoUxu494rE7ZMuGAYrO0wb6gy094ZlDZLJ6nNfIf38KR6-lrnfAH3dQAsVGXW65wiWmcPchM51f4mjyJSUBytD1_frQwOiVVPZXBAv805f4QhBltcaPZup9JgrCaLMaX4MJxvJG34tGjLbPxf27uhr8aXGRDsvKHxSCPWcvKzZ6YrPqkuwRqCulTwadOegU8_wTL8BTURIHRGeV0Zi8jk7xuNty0avuHOmtL2RBvLGyyQCAy1o_SkwYDxKjnmYOlUKyELj9UDkeZFeLUBQY42l2q0rV7Vzfa1RCFK3sVYfeNjKXX0KPucpb8o8FTRjoMlP8no8dcr0XMg3MC6WV5rrGOQbWyvF5OAHhaklM8osnB1f9VwpcN93BEvRj9eksFBalxdpEImyWNNRian-kU0-Ie_d5w8DN3rsjb1uuLhZIEufuXGln0VKZr0J2ktvQFihlgaJeB4i72XJBliWLTXyO-zvWcuZSgbgkeHMfzGNRO4wW_XkpPhCYFJGo-9X2q0PW8bECWG_Lzn0tENqcI6467Bjka7rbba1iFKNMmt_EsR4BrzDF7_6jkw1mPd-JIBEgRpCMs-9U-5YX872t0hqTaPRW5mDzVl9eMmFsUHkuaS0b-ez_yqv9qOQwRhfqDeUmjqKUC0J5sCTnGW4-0Lv1fex5EAGgk1FM2bjAWXxTmu6IdG5__vcGT3JPUwSnBRFmtvcCgc7nSsntG6THFUk_9VgAMyd5eMoI0L3oqPF1SQVF2FTm3zQftJVGw0Pr97pCljh-O7GKTmZHVYfmiq07Zek7-9xkgpY-GHb9GWWebB2edS6DjylvoLYK1jEkf5VQz0SQ6cvv_nA3X7O92gaXqhqGi3ATEbAuYEKqraXdTFkSzrfWTZ34gjrMPQsh_zp6_JiGhr8XKyW7F8b11MvUdeXMCVXhSJJoPgYPSgGmy-F6lqx5e9npjQHDNLsHWpYVhkESUMmgsKZkTuXgGt_tXuFdJ4QsTnNEJbLjOjNoXWwgJPvLJhAQvxe_6lM6s4bZzCo09X_CHqjMxO38DyHLAzjXaZ2D6ugv4SlWSIm20-KDNpySCZJq_dghcTdFyKl8e8Dd-mv6oQgI9wfL-LRnlqO-UsdnW1O2aoHtOqhXGXMO0IyI0ngOZ4p97GwTXxB_YgBRBujNQx_Mh5qWQAhJWyFWiB8_l01zksaC53GqSE8JsysIemZDKA4eCGtsbpm21dLd5vpBVaN1jctyB-Ng&reqid=d73wsIrT6sCXrsDK&type=CLICK&pos=23,,13.0,aonu,1547000.0
11,Áo giữ nhiệt nữ thu đông cổ lọ vải cotton co giãn,30000,https://tiki.vn/ao-giu-nhiet-nu-thu-dong-co-lo-vai-cotton-co-gian-p145114938.html?spid=200719886,,13.0,aonu,390000.0
12,Áo thun giữ nhiệt lót nỉ cổ cao 3 phân hàng loại 1 - Màu,76000,https://tiki.vn/ao-thun-giu-nhiet-lot-ni-co-cao-3-phan-hang-loai-1-p72957463.html?spid=72957473,,54.0,aonu,4104000.0
13,Áo croptop cổ tròn dài tay chất thun co giãn dễ mix đồ freesize,39000,https://tiki.vn/ao-croptop-co-tron-dai-tay-chat-thun-co-gian-de-mix-do-freesize-p146252181.html?spid=203499455,,12.0,aonu,468000.0
14,GOTI - Áo Sơ Mi Công Sở Nữ Kiểu Áo Nữ Hàn Quốc Cổ Chữ V Kèm Phụ Kiện Ở Cổ - THỜI TRANG CÔNG SỞ 3A25,159000,https://tiki.vn/goti-ao-so-mi-cong-so-nu-kieu-ao-nu-han-quoc-co-chu-v-kem-phu-kien-o-co-thoi-trang-cong-so-3a25-p143687625.html?spid=143687661,,68.0,aonu,10812000.0
15,Áo thun unisex tay lỡ form rộng - Áo phông trái bơ,49000,https://tiki.vn/co-anh-that-ao-thun-unisex-tay-lo-form-rong-ao-phong-trai-bo-p73929481.html?spid=73929485,,117.0,aonu,5733000.0
16,Áo 2 Dây cotton Dáng Ôm Cho Nữ,50000,https://tiki.vn/ao-2-day-cotton-dang-om-cho-nu-p72478789.html?spid=95011568,,53.0,aonu,2650000.0
17,"Áo giữ nhiệt Motie siêu ấm co giãn tốt, kèm túi zip vàng",49500,https://tiki.vn/ao-giu-nhiet-motie-sieu-am-co-gian-tot-kem-tui-zip-vang-p105531738.html?spid=105531782,,3.0,aonu,148500.0
18,Áo thun tay dài form rộng unisex - Sweater cầu vòng,59000,https://tiki.vn/ao-thun-tay-dai-cau-vong-p68919015.html?spid=68919019,,34.0,aonu,2006000.0
19,Áo thun nữ ngắn tay đệm ngực nâng đỡ vải Viscose (gỗ tự nhiên) mềm mại thoáng mát mặc nhà mùa hè mã VAA0096,149000,https://tiki.vn/ao-thun-nu-ngan-tay-dem-nguc-nang-do-vai-viscose-go-tu-nhien-mem-mai-thoang-mat-mac-nha-mua-he-ma-vaa0096-p202622361.html?spid=202622393,,6.0,aonu,894000.0
20,Áo thun nữ MXM form rộng cổ tim in chữ Love Vacation thun 4 chiều từ 45-60kg ( ANU010 ),95000,https://tiki.vn/ao-thun-nu-mxm-form-rong-co-tim-in-chu-love-vacation-thun-4-chieu-tu-45-60kg-anu010-p249253365.html?spid=272368415,,19.0,aonu,1805000.0
21,"Áo Thun Nữ Cao Cấp Premium Cotton Sure Fashion, Mềm mại, Thoả mái, Thoáng khí, Nhẹ tênh, Kháng khuẩn, An toàn cho làn da, Bạn sẽ cảm nhận rất rõ ràng khi mặc sản phẩm Organic 100% cotton này",268000,https://tiki.vn/ao-thun-premium-cotton-sure-ao-thun-organic-cotton-thuong-hang-sieu-thoang-mat-sieu-tham-hut-sang-trong-va-lich-lam-cho-nam-va-nu-gia-san-pham-giam-den-50-cho-thoi-gian-trai-nghiem-san-pham-va-tang-ngay-1-uu-dai-tri-gia-100k-p273369075.html?spid=273369086,,10.0,aonu,2680000.0
22,"áo sơ mi nữ form rộng tay dài kiểu hàn, áo sơ mi nữ trắng 1 túi basic điệu đà",69000,https://tiki.vn/ao-so-mi-nu-form-rong-tay-dai-kieu-han-ao-so-mi-nu-trang-1-tui-basic-dieu-da-p152560118.html?spid=152560120,,97.0,aonu,6693000.0
23,Áo Thun Trơn Nam Nữ Nhiều Màu - THUN COTTON - Đủ Size ATT,50000,https://tiki.vn/ao-thun-tron-nam-nu-nhieu-mau-thun-cotton-du-size-att-p132131949.html?spid=132137238,,162.0,aonu,8100000.0
24,Áo thun tay lỡ form rộng - phông nam nữ cotton oversize - T shirt gấu đan len a - 2N Unisex,79000,https://tiki.vn/ao-thun-tay-lo-form-rong-phong-nam-nu-cotton-oversize-t-shirt-ga-u-dan-len-a-2n-unisex-p187644026.html?spid=187644032,,75.0,aonu,5925000.0
25,Áo đũi nữ form rộng fullsize M đến 2XL họa tiết thêu dễ mix đồ Đũi Việt DV17,131000,https://tiki.vn/ao-dui-nu-form-rong-fullsize-m-den-2xl-hoa-tiet-theu-de-mix-do-dui-viet-dv17-p160897698.html?spid=160897704,,27.0,aonu,3537000.0
26,"Bột màu nhuộm áo, quần, vải cotton 100",34000,https://tiki.vn/bot-mau-nhuom-ao-quan-vai-cotton-100-p263576709.html?spid=263576717,,40.0,aonu,1360000.0
27,Ngũ Cốc Bầu Lạc Lạc Plus 30 gói 600g Tặng quà cho bé,257140,https://tiki.vn/ao-ngu-coc-bau-lac-lac-plus-30-goi-p207290544.html?spid=207290545,,142.0,aonu,36513880.0
28,Áo Thun Nữ DOGA M116 Tone Màu Ngọt Ngàu Kiểu dáng Dễ Thương Phong Cách Hàn Quốc,99000,https://tiki.vn/m116-ao-thun-nu-tone-mau-ngot-ngao-p193760633.html?spid=193760637,,2.0,aonu,198000.0
29,Áo polo nữ ADINO màu ghi phối viền xẻ lai vải cotton co giãn dáng slimfit trẻ trung APN02,139000,https://tiki.vn/ao-polo-nu-adino-mau-ghi-phoi-vien-xe-lai-vai-cotton-co-gian-dang-slimfit-tre-trung-apn02-p146229717.html?spid=146229725,,63.0,aonu,8757000.0
30,Áo 2 Dây len Tăm có mút Mặc Trong Áo Vest Chất Vải đẹp Oxatyl M120,100000,https://tiki.vn/ao-2-day-len-tam-co-mut-mac-trong-ao-vest-chat-vai-dep-oxatyl-m120-p254141244.html?spid=254141250,,1.0,aonu,100000.0
31,"Áo 2 dây chất su lụa mát mịn kèm mút ngực, thiết kế siêu tinh tế - Áo tank top phong cách quý cô sành điệu",93000,https://tiki.vn/ao-2-day-chat-su-lua-mat-min-kem-mut-nguc-thiet-ke-sieu-tinh-te-ao-tank-top-phong-cach-quy-co-sanh-dieu-p152892655.html?spid=152892662,,1.0,aonu,93000.0
32,Áo sơ mi cổ nơ hoạ tiết chú ngựa dài tay siêu hót,282100,https://tiki.vn/ao-so-mi-co-no-hoa-tiet-chu-ngua-dai-tay-sieu-hot-p162601274.html?spid=162601280,,1.0,aonu,282100.0
33,Áo Thun 3 Lỗ Nữ 2 Chiếc Lá Vải Cotton Co Giãn 4 Chiều Mặc Đẹp Tôn Dáng Phong Cách Hàn Quốc SN121 Sally Boutique,135000,https://tiki.vn/ao-thun-tank-top-nu-2-chiec-la-vai-cotton-co-gian-4-chieu-mac-dep-thoai-mai-phong-cach-han-quoc-sally-sn121-p197742573.html?spid=197742692,,9.0,aonu,1215000.0
34,Áo thun tank top nữ - hàng nhập khẩu thương hiệu Everlast,150000,https://tiki.vn/ao-thun-tank-top-nu-hang-nhap-khau-thuong-hieu-everlast-p60749773.html?spid=60749817,,8.0,aonu,1200000.0
35,Áo Polo Nữ Coolmax Cộc Tay Cổ Dệt Dmax PL1S126-V909,425000,https://tiki.vn/ao-polo-nu-coolmax-coc-tay-co-det-dmax-pl1s126-v909-p252126089.html?spid=252126097,,1.0,aonu,425000.0
36,Áo hai dây nữ chất đẹp cực xinh ( ÁO 2 DÂY COTTON),38000,https://tiki.vn/ao-hai-day-nu-chat-dep-cuc-xinh-ao-2-day-cotton-p70895791.html?spid=138607955,,10.0,aonu,380000.0
37,"Crazy sale. Áo thun trơn nữ thoát nhiệt Nhật Bản GOKING, 100% cotton siêu thoáng mát, đánh bay cơn nóng mùa hè. Áo phông hàng hiệu cao cấp",99000,https://tiki.vn/ao-thun-tron-nu-thoat-nhiet-nhat-ban-goking-100-cotton-sieu-thoang-mat-danh-bay-con-nong-mua-he-p63057237.html?spid=63057249,,79.0,aonu,7821000.0
38,Áo sơ mi nữ cổng sở kiểu áo cột nơ cổ chữ v tay lật GOTI 3091,219000,https://tiki.vn/ao-so-mi-nu-cong-so-kieu-ao-cot-no-co-chu-v-tay-lat-goti-3091-p28700363.html?spid=105781848,,263.0,aonu,57597000.0
39,Áo Sơ Mi Nữ Kiểu Cổ Đức Mở V Phối Khăn Chất Lụa Mềm Mịn 53SNL2005ST,609000,https://tiki.vn/ao-so-mi-nu-kieu-co-duc-mo-v-phoi-khan-chat-lua-mem-min-53snl2005st-p247855788.html?spid=247855796,,1.0,aonu,609000.0
40,Áo sơ mi nữ cộc tay phồng cổ sen kiểu croptop siêu xinh,69000,https://tiki.vn/ao-so-mi-nu-coc-tay-phong-co-sen-kieu-croptop-sieu-xinh-p230202572.html?spid=230202576,,2.0,aonu,138000.0
41,Áo Sơ Mi Linen Dài Tay Nữ Giordano 05342009,940000,https://tiki.vn/ao-so-mi-linen-dai-tay-nu-giordano-05342009-p202834797.html?spid=202834811,,6.0,aonu,5640000.0
42,Áo Thun Ngắn Tay Có Cổ Nữ Giordano Polo 05311232,210000,https://tiki.vn/ao-thun-ngan-tay-co-co-nu-giordano-polo-05311232-p176211302.html?spid=176211334,-61%,9.0,aonu,1890000.0
43,Áo phông nam nữ form rộng 2N Unisex thun cotton in hình thỏ raglan màu trắng/xám đất,109000,https://tiki.vn/ao-phong-nam-nu-form-rong-2n-unisex-thun-cotton-in-hinh-tho-raglan-mau-trang-xam-dat-p271421536.html?spid=271421540,-25%,1.0,aonu,109000.0
44,Áo thun Unisex 20We Basic Tee phông trơn nam nữ RP_01 tay lỡ oversize form rộng 4 màu,24000,https://tiki.vn/ao-thun-unisex-phong-tron-nam-nu-rp_01-tay-lo-oversize-form-rong-4-mau-p110751447.html?spid=115772036,,276.0,aonu,6624000.0
45,"Áo sơ mi nữ dài tay vạt tôm chất đũi nhẹ, thoáng mát nhiều màu",95000,https://tiki.vn/ao-so-mi-nu-dai-tay-vat-tom-chat-dui-nhe-thoang-mat-nhieu-mau-p111695417.html?spid=111695423,-66%,220.0,aonu,20900000.0
46,Áo Sơ Mi Trắng Nữ Tay Ngắn Cộc Tay Mola Somi Công Sở Đi Học ĐI Làm Màu Trắng Đen Kem Hàng Thiết Kế Cao Cấp Không Nhăn,180000,https://tiki.vn/ao-so-mi-trang-nu-tay-ngan-coc-tay-mola-somi-cong-so-di-hoc-di-lam-mau-trang-den-kem-hang-thiet-ke-cao-cap-khong-nhan-p165236773.html?spid=165236909,-67%,15.0,aonu,2700000.0
47,Áo ba lỗ cổ V dệt kim mềm mịn áo thun Quảng Châu 2022 cao cấp,85000,https://tiki.vn/ao-ba-lo-co-v-det-kim-mem-min-ao-thun-quang-chau-2022-cao-cap-p189750140.html?spid=189750142,-36%,3.0,aonu,255000.0
48,Áo Thun 3 Lỗ Nữ Sát Nách Vải Cotton 100% Co Giãn 4 Chiều Cao Cấp Samantha SN115 SALLY BOUTIQUE,135000,https://tiki.vn/ao-thun-3-lo-nu-sat-nach-vai-cotton-co-gian-4-chieu-cao-cap-samantha-sally-sn115-p197743329.html?spid=247304844,,7.0,aonu,945000.0
49,Áo Thun Ba Lỗ Nữ Sát Nách Cotton 4 Chiều In Hình Con Mèo SN105 Sally Boutique,135000,https://tiki.vn/ao-thun-ba-lo-nu-sat-nach-cotton-4-chieu-in-con-meo-cat-sally-sn105-mac-dep-ton-dang-ket-hop-voi-nhieu-trang-phuc-khac-p197743338.html?spid=197743369,,2.0,aonu,270000.0
50,ÁO SƠ MI TRUNG NIÊN CAO CẤP- ÁO KIỂU TRUNG NIÊN IN HOA SANG TRONG_ÁO NỮ TRUNG NIÊN,199000,https://tiki.vn/ao-so-mi-trung-nien-cao-cap-ao-kieu-trung-nien-in-hoa-sang-trong_ao-nu-trung-nien-p126524410.html?spid=126524441,,2.0,aonu,398000.0
51,Áo đũi lụa sát nách Vicci cao cấp nhiều màu,50000,https://tiki.vn/ao-dui-lua-sat-nach-vicci-cao-cap-nhieu-mau-p56333616.html?spid=56333628,,84.0,aonu,4200000.0
52,Áo sơ mi cổ trụ tay lỡ dáng xuông thời trang Hàn Quốc ( mã A25),186000,https://tiki.vn/ao-so-mi-co-tru-tay-lo-dang-xuong-thoi-trang-han-quoc-ma-a25-p179418058.html?spid=179418195,,20.0,aonu,3720000.0
53,"áo kiểu nữ cổ yếm hở vai 2 lớp kèm dây đai, áo babydoll bánh bèo trẻ trung",74000,https://tiki.vn/ao-kieu-nu-co-yem-ho-vai-2-lop-kem-day-dai-ao-babydoll-banh-beo-tre-trung-p230229959.html?spid=230229961,,12.0,aonu,888000.0
54,Áo Sơ Mi Linen Nữ Giordano 05340005,310000,https://tiki.vn/ao-so-mi-linen-nu-giordano-05340005-p249291533.html?spid=249291539,,1.0,aonu,310000.0
55,Áo phông kẻ nhỏ_áo thun nữ,44000,https://tiki.vn/ao-phong-ke-nho_ao-thun-nu-p115770370.html?spid=115770400,,1.0,aonu,44000.0
56,Áo thun nữ form rộng tay lỡ oversize hoa mất cánh peace unisex - thời trang nam nữ hot trend,21000,https://tiki.vn/ao-thun-nu-form-rong-tay-lo-oversize-hoa-mat-canh-peace-unisex-thoi-trang-nam-nu-hot-trend-p52051393.html?spid=108968076,,27.0,aonu,567000.0
57,Áo kiểu công sở cổ vuông phối hoa thời trang Eden - ASM216,279000,https://tiki.vn/ao-kieu-cong-so-co-vuong-phoi-hoa-thoi-trang-eden-asm216-p271392849.html?spid=271392851,,1.0,aonu,279000.0
58,"Áo sơ mi nữ form rộng kiểu tay lỡ cổ tròn NeSa Shop, chất liệu Đũi tơ thấm hút mồ hôi, áo sơ mi nữ nhiều màu, SMH.34",140000,https://tiki.vn/ao-so-mi-nu-form-rong-kieu-tay-lo-co-tron-nesa-shop-chat-lieu-dui-to-tham-hut-mo-hoi-ao-so-mi-nu-nhieu-mau-smh-34-p146635373.html?spid=205169502,,156.0,aonu,21840000.0
59,"Áo ba lỗ croptop cá tính có mút ngực, áo bra nữ",79000,https://tiki.vn/ao-ba-lo-croptop-ca-tinh-co-mut-nguc-ao-bra-nu-p217765397.html?spid=217765404,,2.0,aonu,158000.0
60,Áo len dệt kim nữ tay ngắn - Áo thun nữ kiểu kẻ sọc ngũ sắc sinh động trẻ trung hàng thiết kế Quảng Châu cao,118000,https://tiki.vn/ao-len-det-kim-nu-tay-ngan-ao-thun-nu-kieu-ke-soc-ngu-sac-sinh-dong-tre-trung-hang-thiet-ke-quang-chau-cao-p201422968.html?spid=201422994,,4.0,aonu,472000.0
61,Áo Croptop 3 Lỗ Cổ Lọ Sát Nách A5138,29000,https://tiki.vn/ao-croptop-3-lo-co-lo-sat-nach-a5138-p149097532.html?spid=203499510,,7.0,aonu,203000.0
62,Áo sơ mi nữ Giấu Nút tay dài phối voan mỏng,151000,https://tiki.vn/ao-so-mi-nu-giau-nut-tay-dai-phoi-voan-mong-p70607255.html?spid=70607267,,40.0,aonu,6040000.0
63,"Áo sơ mi linen nữ form rộng trẻ trung ArcticHunter, thời trang thương hiệu chính hãng",250000,https://tiki.vn/ao-so-mi-linen-nu-form-rong-tre-trung-arctichunter-thoi-trang-thuong-hieu-chinh-hang-p182601565.html?spid=182601571,,27.0,aonu,6750000.0
64,Áo Sơ Mi Nữ Form Dài Che Quần Cá Tính SM013 MayHomes,139500,https://tiki.vn/ao-so-mi-nu-form-dai-che-quan-ca-tinh-sm013-mayhomes-p37975688.html?spid=37975696,,108.0,aonu,15066000.0
65,Áo Croptop Nữ Thun Trơn 3 Lỗ Ôm Body Sát Nách Kiểu Khoét Hở Lưng Có Độn Mút Ngực Không Tay Sexy Crop Top CRT 2021 Ba Lỗ,89000,https://tiki.vn/ao-croptop-nu-thun-tron-3-lo-om-body-sat-nach-kieu-khoet-ho-lung-co-don-mut-nguc-khong-tay-sexy-crop-top-crt-2021-ba-lo-p113617402.html?spid=113617419,,1.0,aonu,89000.0
66,áo sơ mi nữ áo sơ mi dài tay vạt tôm nhiều màu chất đũi,90000,https://tiki.vn/ao-so-mi-nu-ao-so-mi-dai-tay-vat-tom-nhieu-mau-chat-dui-p113926163.html?spid=113926165,,40.0,aonu,3600000.0
67,THỜI TRANG ÁO CÔNG SỞ NỮ - ÁO SƠ MI TRẮNG BASIC RỘNG KIỂU ÁO SƠ MI MẶC ĐI LÀM LỊCH SỰ 3A18 3A19,209000,https://tiki.vn/goti-thoi-trang-ao-cong-so-nu-ao-so-mi-trang-basic-rong-kieu-ao-so-mi-mac-di-lam-lich-su-ao-lua-nu-cao-cap-3a18-3a19-p99998242.html?spid=99998252,-5%,84.0,aonu,17556000.0
68,"Áo hai dây cổ tim nữ vải Modal tự nhiên 100% thân thiện, mặc thoáng mát co giãn thoải mái mã VAA0072",159000,https://tiki.vn/ao-hai-day-co-tim-nu-vai-modal-tu-nhien-100-than-thien-mac-thoang-mat-co-gian-thoai-mai-ma-vaa0072-p163927418.html?spid=209350798,,16.0,aonu,2544000.0
69,Áo Polo Nữ YODY Phối Nẹp Thoải Mái Năng Động Chất Liệu Cafe Khử Mùi Tốt - APN3700,299000,https://tiki.vn/ao-polo-nu-yody-phoi-nep-thoai-mai-nang-dong-chat-lieu-cafe-khu-mui-tot-apn3700-p116150095.html?spid=116150839,-50%,235.0,aonu,70265000.0
70,Áo nữ trắng tinh kiểu cổ oval tay phồng xinh xắn,115000,https://tiki.vn/ao-nu-trang-tinh-kieu-co-oval-tay-phong-xinh-xan-p53206600.html?spid=171508934,-46%,5.0,aonu,575000.0
71,Áo Sơ Mi Nữ Dài Tay Kẻ Sọc Thời Trang Công Sở Thanh Lịch PONIVA Chất Liệu Mềm Mại Thấm Hút Mồ Hôi Tốt,114000,https://tiki.vn/ao-so-mi-nu-dai-tay-ke-soc-thoi-trang-cong-so-thanh-lich-poniva-chat-lieu-mem-mai-tham-hut-mo-hoi-tot-p140462950.html?spid=140463221,,3.0,aonu,342000.0
72,"Áo sơ mi nữ dài tay công sở in hoa ArcticHunter, thời trang trẻ, thương hiệu chính hãng",99000,https://tiki.vn/ao-so-mi-nu-dai-tay-cong-so-in-hoa-arctichunter-thoi-trang-tre-thuong-hieu-chinh-hang-p46695130.html?spid=67406469,-17%,9.0,aonu,891000.0
73,Áo polo nữ màu trắng phối viền chìm ADINO vải cotton polyester mềm dáng slimfit công sở hơi ôm trẻ trung APN03,159000,https://tiki.vn/ao-polo-nu-adino-mau-trang-phoi-vien-chim-vai-cotton-co-gian-dang-slimfit-tre-trung-apn03-p121258407.html?spid=121258411,-7%,256.0,aonu,40704000.0
74,Áo sơ mi nữ kiểu công sở - tay lửng cổ V,102000,https://tiki.vn/ao-so-mi-nu-kieu-cong-so-tay-lung-co-v-p42463443.html?spid=42463445,,95.0,aonu,9690000.0
75,Áo kiểu Bigsize 60-85 ký,125000,https://tiki.vn/ao-kieu-bigsize-60-85-ky-p95136752.html?spid=95136780,,14.0,aonu,1750000.0
76,"Áo thun nữ vải cá sấu co giãn 4 chiều, kiểu may cao cấp cổ bẻ, tay bo, có xẻ lai - Màu hồng",81900,https://tiki.vn/ao-thun-nu-vai-ca-sau-co-gian-4-chieu-kieu-may-cao-cap-co-be-tay-bo-co-xe-lai-mau-hong-p105104035.html?spid=137951819,,2.0,aonu,163800.0
77,Áo Thun Nữ Tay Lỡ DOGA M94 Họa Tiết chữ V Form Rộng Dáng Suông Độc Đáo Cá Tính,100000,https://tiki.vn/ao-thun-nu-tay-lo-in-hoa-tiet-chu-v-form-rong-dang-suong-doc-dao-ca-tinh-m94-p70818826.html?spid=70818832,,55.0,aonu,5500000.0
78,"Áo thun nữ tay lỡ dáng rộng MẶT CƯỜI cute ( Vàng, Trắng )",69000,https://tiki.vn/ao-thun-nu-tay-lo-dang-rong-mat-cuoi-cute-vang-trang-p82748320.html?spid=82748508,,1.0,aonu,69000.0
79,Áo thun croptop form rộng tay lở Unisex màu trắng / đen CRA023,61750,https://tiki.vn/ao-thun-croptop-form-rong-tay-lo-unisex-mau-trang-den-cra023-p155182902.html?spid=155182912,,14.0,aonu,864500.0
80,Áo sơ mi nữ form rộng tay phồng ArcticHunter chất Linen tưng Hàn mềm mát,289000,https://tiki.vn/ao-so-mi-nu-form-rong-tay-phong-arctichunter-chat-linen-tung-han-mem-mat-p247407796.html?spid=247407808,,9.0,aonu,2601000.0
