,title,price,link_item,discount,sales,category,revenue
384,Áo thun lạnh giữ nhiệt nữ tay dài cổ 3 phân,30000,https://tiki.vn/ao-thun-lanh-giu-nhiet-nu-tay-dai-co-3-phan-p68239610.html?spid=127219837,,16.0,aonu,480000.0
385,"Dù ai hối tới hối lui, ế thêm năm nữa vẫn vui như thường. Mã: LV9. Hãy tỏa sáng như kim cương, qua chiếc áo thun Goking siêu hot cho nam nữ trẻ em, áo phông cặp đôi, gia đình, đội nhóm",168000,https://tiki.vn/du-ai-hoi-toi-hoi-lui-e-them-nam-nua-van-vui-nhu-thuong-ma-lv9-ao-thun-nu-dep-p164545375.html?spid=164545392,,3.0,aonu,504000.0
386,"Áo sơ mi nữ công sở thời trang SURI cổ sơ mi,áo thêu hoa trước ngực,tay lưới thật trẻ trung",99750,https://tiki.vn/ao-so-mi-nu-cong-so-thoi-trang-suri-co-so-mi-ao-theu-hoa-truoc-nguc-tay-luoi-that-tre-trung-p144629340.html?spid=144629358,,14.0,aonu,1396500.0
387,Áo Thun Ngắn Tay Cổ Tròn Nữ Giordano 05322376,146000,https://tiki.vn/ao-thun-ngan-tay-co-tron-nu-giordano-05322376-p203069355.html?spid=203069363,,8.0,aonu,1168000.0
388,"Áo 3 lỗ nữ thun gân croptop cổ lọ kiểu ôm, ba lỗ sát nách crt kiểu cổ điển tiện lợi, dạo phố, dự tiệc, thể thao, du lich",68000,https://tiki.vn/ao-3-lo-nu-thun-gan-croptop-co-lo-kieu-om-ba-lo-sat-nach-crt-kieu-co-dien-tien-loi-dao-pho-du-tiec-the-thao-du-lich-p144345515.html?spid=144345527,,10.0,aonu,680000.0
389,Áo thun nữ cổ tròn form rộng in hình gấu dễ thương thun cotton 4 chiều từ 45-60kg ( ANU080 ),99000,https://tiki.vn/ao-thun-nu-co-tron-form-rong-in-hinh-gau-de-thuong-thun-cotton-4-chieu-tu-45-60kg-anu080-p249463577.html?spid=249463588,,4.0,aonu,396000.0
390,Áo Sơ Mi Sọc Janet,117000,https://tiki.vn/ao-so-mi-soc-janet-p14837830.html?spid=14837834,-24%,126.0,aonu,14742000.0
391,Áo Sơ Mi Nữ Công Sở LB-21 - Trắng,159000,https://tiki.vn/ao-so-mi-nu-cong-so-lb-21-trang-p8050803.html?spid=56471789,-23%,82.0,aonu,13038000.0
392,"Áo thun Cổ Yếm Chéo, Áo Croptop Trễ Vai Thời Trang Nữ",138000,https://tiki.vn/ao-thun-co-yem-cheo-ao-croptop-tre-vai-thoi-trang-nu-p175433153.html?spid=175433171,-32%,1.0,aonu,138000.0
393,"BELIEVE IN YOURSELF, mã G32. Hãy tỏa sáng như kim cương, qua chiếc áo thun Goking siêu hot cho nam nữ trẻ em, áo phông cặp đôi, gia đình, đội nhóm",69000,https://tiki.vn/believe-in-yourself-ma-g32-ao-thun-nu-sieu-dep-ao-phong-nu-thoat-nhiet-goking-hang-hieu-p164082385.html?spid=248885334,-50%,13.0,aonu,897000.0
394,"Angel, mã G95. Hãy tỏa sáng như kim cương, qua chiếc áo thun Goking siêu hot cho nam nữ trẻ em, áo phông cặp đôi, gia đình, đội nhóm",69000,https://tiki.vn/angel-ma-g95-ao-thun-nu-in-sieu-dep-ao-phong-thoat-nhiet-goking-hang-hieu-cao-cap-p164546562.html?spid=249277216,,8.0,aonu,552000.0
395,"Áo ngắn tay mặc nhà vải Cotton lụa thoáng mát mềm mại, áo ngủ nữ mã VAA0439 - M10 Vàng đậm",89000,https://tiki.vn/ao-ngan-tay-mac-nha-vai-cotton-lua-thoang-mat-mem-mai-ao-ngu-nu-ma-vaa0439-p270801727.html?spid=270801784,,1.0,aonu,89000.0
396,Áo Thun Nam Nữ DAISY Chất Cotton Cao Cấp Dày Mịn Thoáng Mát Form Rộng Tay Lỡ Thời Trang Đường Phố Unisex,189000,https://tiki.vn/ao-thun-nam-nu-daisy-chat-cotton-cao-cap-day-min-thoang-mat-form-rong-tay-lo-thoi-trang-duong-pho-unisex-p252585702.html?spid=252585720,,1.0,aonu,189000.0
397,Áo Kiểu Nữ Hàn Quốc Dạng Áo Kiểu Tay Lỡ Phối Màu - Nhiều Màu GOTI 3A03,209000,https://tiki.vn/ao-kieu-nu-han-quoc-dang-ao-kieu-tay-lo-phoi-mau-nhieu-mau-goti-3a03-p73200262.html?spid=105644237,,53.0,aonu,11077000.0
398,Áo Sơ Mi Nữ Công Sở,104000,https://tiki.vn/ao-so-mi-nu-cong-so-p41664061.html?spid=82221747,,1.0,aonu,104000.0
399,Áo kiểu công sở cổ sen nhọn hai lá thời trang Eden - ASM202,279000,https://tiki.vn/ao-kieu-cong-so-co-sen-nhon-hai-la-thoi-trang-eden-asm202-p249263403.html?spid=249263405,,1.0,aonu,279000.0
400,Áo kiểu nữ dài tay phối viền sang trọng - thích hợp mặc đi làm mang đến vẻ thanh lịch sang trọng,143000,https://tiki.vn/ao-kieu-nu-dai-tay-phoi-vien-sang-trong-thich-hop-mac-di-lam-mang-den-ve-thanh-lich-sang-trong-p61280951.html?spid=61280969,,33.0,aonu,4719000.0
401,"Áo kiểu Judy cổ vuông phối nút sang trọng - form dáng chuẩn, dễ dàng mix cùng chân váy, quần mặc dự tiệc, đi làm",180000,https://tiki.vn/ao-kieu-judy-co-vuong-phoi-nut-sang-trong-form-dang-chuan-de-dang-mix-cung-chan-vay-quan-mac-du-tiec-di-lam-p196409068.html?spid=196409076,,3.0,aonu,540000.0
402,Áo Thun Nữ Cổ Lọ Tay Dài Giữ Nhiệt Vải Thun Cao Cấp Mềm Mịn Ôm Dáng - MSP T22,65000,https://tiki.vn/ao-thun-nu-co-lo-tay-dai-giu-nhiet-vai-thun-cao-cap-mem-min-om-dang-msp-t22-p98772287.html?spid=127220042,,8.0,aonu,520000.0
403,Áo phông nữ kiểu lệch tà - Áo thun nữ dáng ôm body tay ngắn chất thun cotton mềm mại trẻ trung phong cách,99000,https://tiki.vn/ao-phong-nu-kieu-lech-ta-ao-thun-nu-dang-om-body-tay-ngan-chat-thun-cotton-mem-mai-tre-trung-phong-cach-p176288942.html?spid=176288946,,1.0,aonu,99000.0
404,"M182. Áo 2 dây thun gân dáng dài sẵn đệm ngực, áo kiểu nữ đẹp sang chảnh mặc trong vest cá tính (có sẵn - miễn ship)",29000,https://tiki.vn/m182-ao-2-day-thun-gan-dang-dai-san-dem-nguc-ao-kieu-nu-dep-sang-chanh-mac-trong-vest-ca-tinh-co-san-mien-ship-p217781654.html?spid=271434094,,7.0,aonu,203000.0
405,Áo hai dây nữ dáng croptop ly ngực kiểu ôm vải co giãn,66000,https://tiki.vn/ao-hai-day-nu-dang-croptop-ly-nguc-kieu-om-vai-co-gian-p263303717.html?spid=263303742,,1.0,aonu,66000.0
406,Áo sơ mi nữ tay dài 2 túi vải Manggo Cao Cấp dày mềm mịn mát êm,121000,https://tiki.vn/ao-so-mi-nu-tay-dai-2-tui-vai-manggo-cao-cap-day-mem-min-mat-em-p145760525.html?spid=145760537,,20.0,aonu,2420000.0
407,Áo kiểu nữ công sở tay ngắn cổ nơ cách điệu thời trang Eden - ASM204,279000,https://tiki.vn/ao-kieu-nu-cong-so-tay-ngan-co-no-cach-dieu-thoi-trang-eden-asm204-p254073713.html?spid=254073719,,2.0,aonu,558000.0
408,Áo kiểu nữ caro cổ sen dán ngắn thời trang Eden - ASM179,279000,https://tiki.vn/ao-kieu-nu-caro-co-sen-dan-ngan-thoi-trang-eden-asm179-p191445889.html?spid=191445893,,27.0,aonu,7533000.0
409,Áo sơ mi nữ form rộng tay cánh rơi Linen tưng premium trẻ trung sang trọng ArcticHunter - Nâu đỏ,289000,https://tiki.vn/ao-so-mi-nu-form-rong-tay-canh-roi-linen-tung-premium-tre-trung-sang-trong-arctichunter-nau-do-p193536479.html?spid=193536483,,1.0,aonu,289000.0
410,"Áo kiểu cho nữ Sexy tay phồng ngắn xẻ , cổ chữ U trễ vai phong cách Hàn Quốc đáng yêu",216348,https://tiki.vn/ao-kieu-cho-nu-sexy-tay-phong-ngan-xe-co-chu-u-tre-vai-phong-cach-han-quoc-dang-yeu-p143185240.html?spid=143185370,,29.0,aonu,6274092.0
411,Áo polo nữ màu nâu phối viền chìm ADINO vải cotton polyester mềm dáng slimfit công sở hơi ôm trẻ trung APN03,159000,https://tiki.vn/ao-polo-nu-mau-nau-phoi-vien-chim-adino-vai-cotton-polyester-mem-dang-slimfit-cong-so-hoi-om-tre-trung-apn03-p213935328.html?spid=213935338,,2.0,aonu,318000.0
412,Áo Thun Nữ Ngắn Tay In Hình Printed Tee Giordano 05392213,350000,https://tiki.vn/ao-thun-nu-ngan-tay-in-hinh-printed-tee-giordano-05392213-p193316045.html?spid=193316055,,3.0,aonu,1050000.0
413,Combo Set Áo Khoác Sơ Mi Caro Unisex Kèm Áo Ống Nữ - Chất Vải Kate Cao Cấp Chuẩn Shop,96000,https://tiki.vn/combo-set-ao-khoac-so-mi-caro-unisex-kem-ao-ong-nu-chat-vai-kate-cao-cap-chuan-shop-p177702956.html?spid=189312029,,4.0,aonu,384000.0
414,"Áo thun phản quang bướm tay lỡ form rộng ( Đen, Trắng )",69000,https://tiki.vn/ao-thun-phan-quang-buom-tay-lo-form-rong-den-trang-p82743249.html?spid=82743396,-17%,5.0,aonu,345000.0
415,áo nữ - đũi xước tơ cổ tàu cho người đến dưới 80kg (A25),139000,https://tiki.vn/ao-nu-dui-xuoc-to-co-tau-cho-nguoi-den-duoi-80kg-a25-p126040429.html?spid=126041646,,32.0,aonu,4448000.0
416,Áo ba lỗ nữ thun gân dáng basic CT528,125000,https://tiki.vn/ao-ba-lo-nu-thun-gan-dang-basic-ct528-p217525282.html?spid=217525290,-40%,5.0,aonu,625000.0
417,Sơ mi nữ ngắn tay cổ trụ chui đầu 33,149000,https://tiki.vn/so-mi-nu-ngan-tay-co-tru-chui-dau-33-p35420037.html?spid=58329499,-23%,85.0,aonu,12665000.0
418,"Áo sơ mi nữ form rộng cổ tầu phát V tay lỡ 2 túi ốp ngực trẻ trung ArcticHunter, thời trang phong cách trẻ",159000,https://tiki.vn/ao-so-mi-nu-form-rong-co-tau-phat-v-tay-lo-2-tui-op-nguc-tre-trung-arctichunter-thoi-trang-phong-cach-tre-p113046240.html?spid=113046250,-16%,19.0,aonu,3021000.0
419,"Áo thun nữ gân tăm tay ngắn cổ tim MADELA có Bigsize , chất liệu thun tăm mềm mịn thoáng mát , kiểu dáng basic dễ phối đồi ,áo có nhiều màu và size để lựa chọn- AT02",100000,https://tiki.vn/ao-thun-nu-gan-tam-tay-ngan-co-tim-madela-co-bigsize-ao-thun-nu-gan-tam-co-v-dang-ngan-coptop-at02-p174621554.html?spid=174621919,,16.0,aonu,1600000.0
420,Áo kiểu nữ dáng suông phối nút bọc thời trang Eden - ASM155,279000,https://tiki.vn/ao-kieu-nu-dang-suong-phoi-nut-boc-thoi-trang-eden-asm155-p95200387.html?spid=99037928,-67%,16.0,aonu,4464000.0
421,Áo polo nữ ADINO màu xanh đen phối viền xẻ lai vải cotton co giãn dáng slimfit trẻ trung APN02,139000,https://tiki.vn/ao-polo-nu-adino-mau-xanh-den-phoi-vien-xe-lai-vai-cotton-co-gian-dang-slimfit-tre-trung-apn02-p146230660.html?spid=146230668,,97.0,aonu,13483000.0
422,Áo phông nam nữ form rộng 2N Unisex thun cotton in hình gấu Panda thêu lông màu trắng/xanh,119000,https://tiki.vn/ao-phong-nam-nu-form-rong-2n-unisex-thun-cotton-in-hinh-gau-panda-theu-long-mau-trang-xanh-p271419705.html?spid=271419707,,1.0,aonu,119000.0
423,"NEVER GIVE UP, mã G120. Hãy tỏa sáng như kim cương, qua chiếc áo thun Goking siêu hot cho nam nữ trẻ em, áo phông cặp đôi, gia đình, đội nhóm",69000,https://tiki.vn/never-give-up-ma-g120-ao-thun-nu-nam-in-sieu-dep-ao-phong-thoat-nhiet-goking-hang-hieu-cao-cap-p173088537.html?spid=249533246,,20.0,aonu,1380000.0
424,Áo Kiểu Nữ Phối Ren,300000,https://tiki.vn/ao-kieu-nu-phoi-ren-p15778466.html?spid=15778530,,7.0,aonu,2100000.0
425,"Áo croptop tay ngắn nữ ôm body Madela cổ tròn, chất liệu cotton mềm mịn thoải mái , kiểu dáng basic trẻ trung, năng động - ACTN03",59000,https://tiki.vn/ao-croptop-tay-ngan-nu-om-body-madela-croptop-nu-tron-ngan-tay-co-tron-dang-om-co-tron-actn03-p174622128.html?spid=174622201,,14.0,aonu,826000.0
426,Áo thun dệt kim nữ tay ngắn kiểu kẻ sọc ngũ sắc sinh động thiết kế Quảng Châu cao cấp,112000,https://tiki.vn/ao-thun-det-kim-nu-tay-ngan-kieu-ke-soc-ngu-sac-sinh-dong-thiet-ke-quang-chau-cao-cap-p191506467.html?spid=191506471,,9.0,aonu,1008000.0
427,ÁO CỔ TRÒN TAY NHÚN PHỒNG SIÊU XINH,122000,https://tiki.vn/ao-co-tron-tay-nhun-phong-sieu-xinh-p67991919.html?spid=67991931,,2.0,aonu,244000.0
428,Áo Sơ Mi Nữ Trắng,127400,https://tiki.vn/ao-so-mi-nu-trang-p15778396.html?spid=59377217,,35.0,aonu,4459000.0
429,Áo Sơ Mi Nữ Công Sở Căn Bản - trắng - NG001,115000,https://tiki.vn/ao-so-mi-nu-cong-so-can-ban-trang-ng001-p41622540.html?spid=41622542,,6.0,aonu,690000.0
430,ÁO VOAN TRỄ VAI NƠ TO ÁO TRỄ VAI,57000,https://tiki.vn/ao-voan-tre-vai-no-to-ao-tre-vai-p148701217.html?spid=148701218,,17.0,aonu,969000.0
431,"Áo Thun Nữ Cổ Tim Tay ngắn , Trẻ Trung, Mẫu Mới nhất",74260,https://tiki.vn/ao-thun-nu-co-tim-tay-ngan-tre-trung-mau-moi-nhat-p138753770.html?spid=138757597,,22.0,aonu,1633720.0
432,"Áo trễ vai, áo hở vai nữ đẹp bèo tay phồng rộng dễ thương, mặc đi chơi, siêu hot trend, aloha - Đen",57000,https://tiki.vn/ao-tre-vai-ao-ho-vai-nu-dep-beo-tay-phong-rong-de-thuong-mac-di-choi-sieu-hot-trend-aloha-p192182771.html?spid=192182775,,1.0,aonu,57000.0
433,(HÀNG SẴN) Áo Sơ Mi Voan Che Bụng Giảm Tuổi Trẻ Trung SM69 - Hàng Quảng Châu Cao Cấp,245000,https://tiki.vn/hang-san-ao-so-mi-voan-che-bung-giam-tuoi-tre-trung-sm69-hang-quang-chau-cao-cap-p253102850.html?spid=253102852,,1.0,aonu,245000.0
434,Áo Thun Nữ Sát Nách Cách Điệu 1 Bên Dây Bản To Dễ Thương Vải Cotton 65/35 Co Giãn Tốt Sally Boutique-3L03,90200,https://tiki.vn/ao-thun-nu-sat-nach-cach-dieu-1-ben-day-ban-to-de-thuong-vai-cotton-65-35-co-gian-tot-sally-boutique-3l03-p252603395.html?spid=252603397,,3.0,aonu,270600.0
435,Áo phông ngắn tay / áo thun trơn cổ tròn dáng ôm body nhiều màu freesize dễ mix đồ,85000,https://tiki.vn/ao-phong-ngan-tay-ao-thun-tron-co-tron-dang-om-body-nhieu-mau-freesize-de-mix-do-p145684805.html?spid=145684809,,73.0,aonu,6205000.0
436,Áo polo nữ ADINO màu đen phối viền xẻ lai vải cotton co giãn dáng slimfit trẻ trung APN02,139000,https://tiki.vn/ao-polo-nu-adino-mau-den-phoi-vien-xe-lai-vai-cotton-co-gian-dang-slimfit-tre-trung-apn02-p146225246.html?spid=146225256,,46.0,aonu,6394000.0
437,áo sơ mi caro tay ngắn nữ,59000,https://tiki.vn/ao-so-mi-caro-tay-ngan-nu-p170876622.html?spid=170876623,,10.0,aonu,590000.0
438,Áo len ba lỗ nữ cổ V gợi cảm trẻ trung chất len mềm min co giãn mã VAA0305,94500,https://tiki.vn/ao-len-ba-lo-nu-co-v-goi-cam-tre-trung-chat-len-mem-min-co-gian-ma-vaa0305-p196378521.html?spid=196378604,,21.0,aonu,1984500.0
439,Áo Kiểu Nữ Cổ V Bèo Thân Tà Peplum Chất Tuytsi Hàn Mềm Mịn 53ANS8002PT,309000,https://tiki.vn/ao-kieu-nu-co-v-beo-than-ta-peplum-chat-tuytsi-han-mem-min-53ans8002pt-p229715982.html?spid=229715992,-16%,82.0,aonu,25338000.0
440,Áo Thun Ngắn Tay Cổ Tròn Nữ Giordano 05322246,229000,https://tiki.vn/ao-thun-ngan-tay-co-tron-nu-giordano-05322246-p217473799.html?spid=217473809,-28%,5.0,aonu,1145000.0
441,"Bộ quần áo Blouse điều dưỡng nam nữ có viền xanh cho thực tập sinh - áo điều dưỡng, y tá có cầu vai xanh",96000,https://tiki.vn/bo-quan-ao-blouse-dieu-duong-nam-nu-co-vien-xanh-cho-thuc-tap-sinh-ao-dieu-duong-y-ta-co-cau-vai-xanh-p196184362.html?spid=196184995,-81%,3.0,aonu,288000.0
442,Áo thun nữ thể thao tay ngắn phối viền lưới iBasic IBX130,179000,https://tiki.vn/ao-thun-nu-the-thao-tay-ngan-phoi-vien-luoi-ibasic-ibx130-p204807935.html?spid=204808002,-55%,1.0,aonu,179000.0
443,"Áo thun logo lục sắc, mã logo-Goking1. Hãy tỏa sáng như kim cương, qua chiếc áo thun Goking siêu hot cho nam nữ trẻ em, áo phông cặp đôi, gia đình, đội nhóm",69000,https://tiki.vn/ao-thun-in-logo-goking-luc-sac-ma-logo-goking1-ao-phong-nu-thoat-nhiet-goking-hang-hieu-cao-cap-p164547366.html?spid=248807857,,6.0,aonu,414000.0
444,Áo Kiểu Phối Màu Bella,115000,https://tiki.vn/ao-kieu-phoi-mau-bella-p14841783.html?spid=14841795,,5.0,aonu,575000.0
445,"Áo sơ mi nữ trắng tay dài, đồng phục học sinh, đồng phục công sở, size từ 40-80kg, chất liệu KT Silk mềm mại",114000,https://tiki.vn/ao-so-mi-nu-trang-tay-dai-dong-phuc-hoc-sinh-dong-phuc-cong-so-size-tu-40-80kg-chat-lieu-kt-silk-mem-mai-p147896804.html?spid=147896808,,6.0,aonu,684000.0
446,"Áo Sơ Mi Nữ Trơn Dài Tay Cổ Trắng Mẫu JD698 Thời Trang Công Sở Trẻ Trung, Thanh Lịch",163000,https://tiki.vn/ao-so-mi-nu-tron-dai-tay-co-trang-mau-jd698-thoi-trang-cong-so-tre-trung-thanh-lich-p74539336.html?spid=74539348,,56.0,aonu,9128000.0
447,Áo Sơ Mi Nữ Sọc Cổ V Phối Tay Nơ BY3260,213000,https://tiki.vn/ao-so-mi-nu-soc-co-v-phoi-tay-no-by3260-p10532305.html?spid=13789894,,25.0,aonu,5325000.0
448,Áo 2 dây cổ V thon chất len lụa dệt kim tuyến mùa hè thoải mái HD01 Free size,87000,https://tiki.vn/ao-2-day-co-v-thon-chat-len-lua-det-kim-tuyen-mua-he-thoai-mai-hd01-free-size-p15319361.html?spid=27834024,,17.0,aonu,1479000.0
449,Áo len nữ dài tay kẻ xanh croptop hót hít (có ảnh thật trải sàn),115000,https://tiki.vn/ao-len-nu-dai-tay-ke-xanh-croptop-hot-hit-co-anh-that-trai-san-p204621191.html?spid=204621196,,6.0,aonu,690000.0
450,Áo sơ mi nữ form rộng tay bồng,129000,https://tiki.vn/ao-so-mi-nu-form-rong-tay-bong-p35229590.html?spid=57031373,,32.0,aonu,4128000.0
451,Áo Kiểu Nữ Dáng Ôm Phối Can Bán Nguyệt Chất Tuytsi Cao Cấp 53ANS8006OT,259000,https://tiki.vn/ao-kieu-nu-dang-om-phoi-can-ban-nguyet-chat-tuytsi-cao-cap-53ans8006ot-p253309723.html?spid=253309727,,1.0,aonu,259000.0
452,Áo Kiểu Nữ,115000,https://tiki.vn/ao-kieu-nu-p20909994.html?spid=172001974,,7.0,aonu,805000.0
453,GIGI - Áo sơ mi nữ tay ngắn phom suông phối túi hiện đại G1108T212264,290000,https://tiki.vn/gigi-ao-so-mi-nu-tay-ngan-phom-suong-phoi-tui-hien-dai-g1108t212264-63-p192358089.html?spid=192358102,-81%,1.0,aonu,290000.0
454,"Áo thun tay lỡ form rộng unisex, phông nam nữ oversize Einsicht 2N Unisex",49000,https://tiki.vn/ao-thun-tay-lo-form-rong-unisex-phong-nam-nu-oversize-einsicht-2n-unisex-p217176677.html?spid=217176689,-38%,10.0,aonu,490000.0
455,"Áo kiểu nữ tay buộc nơ cổ V xinh xắn - mặc đi làm, đi tiệc (2 màu) form dáng chuẩn - M",185000,https://tiki.vn/ao-kieu-nu-tay-buoc-no-co-v-xinh-xan-mac-di-lam-di-tiec-2-mau-form-dang-chuan-p109089209.html?spid=109089213,,6.0,aonu,1110000.0
456,Áo hai dây COTTON mặc trong áo Vest,50000,https://tiki.vn/ao-hai-day-cotton-mac-trong-ao-vest-p75661432.html?spid=89745374,,3.0,aonu,150000.0
457,"áo sơ mi nữ nam form rộng tay dài trắng 1 túi basic kiểu hàn, áo sơ mi unisex năng động trẻ trung",69000,https://tiki.vn/ao-so-mi-nu-nam-form-rong-tay-dai-trang-1-tui-basic-kieu-han-ao-so-mi-unisex-nang-dong-tre-trung-p242620496.html?spid=242620498,,1.0,aonu,69000.0
458,"Áo thun Nam Nữ Không cổ VOI VỚI THỎ CIMT-0024 mẫu mới cực đẹp, có size bé cho trẻ em / áo thun Anime Manga Unisex Nam Nữ, áo phông thiết kế cổ tròn basic cộc tay thoáng mát",50000,https://tiki.vn/ao-thun-nam-nu-khong-co-voi-voi-tho-cimt-0024-mau-moi-cuc-dep-co-size-be-cho-tre-em-ao-thun-anime-manga-unisex-nam-nu-ao-phong-thiet-ke-co-tron-basic-coc-tay-thoang-mat-p112707558.html?spid=112708631,-37%,14.0,aonu,700000.0
459,Áo Kiểu Nữ Phối Ren Hở Vai Tay Loe NT6278N1,165000,https://tiki.vn/ao-kieu-nu-phoi-ren-ho-vai-tay-loe-nt6278n1-p13582490.html?spid=56688789,,2.0,aonu,330000.0
460,Set áo len lưới cổ tim kèm áo yếm hàng QC mùa thu đông 2022,155000,https://tiki.vn/set-ao-len-luoi-co-tim-kem-ao-yem-hang-qc-mua-thu-dong-2022-p201802760.html?spid=201802766,,2.0,aonu,310000.0
461,Áo Thun Có Cổ Andromeda Cá Sấu 4 Chiều Màu Xanh Đen Nam Nữ,89000,https://tiki.vn/ao-thun-co-co-andromeda-ca-sau-4-chieu-mau-xanh-den-nam-nu-p184826684.html?spid=184826712,,4.0,aonu,356000.0
462,Áo thun tết gia đình màu đỏ đồng phục gia đình 3/4/5 người nổi bật thun cotton mềm mịn SGY156D,49000,https://tiki.vn/ao-thun-tet-xuan-mau-do-thun-cotton-day-dan-unisex-du-size-sgy156d-sgstore1-p132139806.html?spid=132140183,,1.0,aonu,49000.0
463,Áo Thun Andromeda Nam Nữ Phom Rộng Nhiều Màu Ngắn Tay Cổ Tròn,49000,https://tiki.vn/ao-thun-andromeda-nam-nu-phom-rong-nhieu-mau-ngan-tay-co-tron-p184823350.html?spid=184823465,,5.0,aonu,245000.0
464,áo croptop dệt kim len nữ tay ngắn cổ vuông phối màu thiết kế Quảng Châu trẻ trung phong cách,125000,https://tiki.vn/ao-croptop-det-kim-len-nu-tay-ngan-co-vuong-phoi-mau-thiet-ke-quang-chau-tre-trung-phong-cach-p189750154.html?spid=189750156,,3.0,aonu,375000.0
465,"Áo len nữ cổ tròn dài tay, áo len cardigan nữ chất len mềm mịn co giãn thời trang Hàn Quốc mặc mùa thu đông mã VAA0260",139000,https://tiki.vn/ao-len-nu-co-tron-dai-tay-ao-len-cardigan-nu-chat-len-mem-min-co-gian-thoi-trang-han-quoc-mac-mua-thu-dong-ma-vaa0260-p155792292.html?spid=273958013,,41.0,aonu,5699000.0
466,Áo thun tay lỡ form rộng - phông nam nữ cotton oversize - T shirt chữ unoffcall - 2N Unisex,79000,https://tiki.vn/ao-thun-tay-lo-form-rong-phong-nam-nu-cotton-oversize-t-shirt-chu-unoffcall-2n-unisex-p217176739.html?spid=217176743,,21.0,aonu,1659000.0
467,Áo thun tăm ba lỗ UNI.QLO Quảng Châu cho nữ ATN877,19000,https://tiki.vn/ao-thun-tam-ba-lo-uni-qlo-quang-chau-cho-nu-atn877-p270854151.html?spid=271726336,,12.0,aonu,228000.0
468,Áo ba lỗ croptop Ulzzang Quảng Châu ATB18,35000,https://tiki.vn/ao-ba-lo-croptop-ulzzang-quang-chau-atb18-p73390971.html?spid=95002653,,549.0,aonu,19215000.0
469,Áo thun cờ Việt Nam Áo Cờ Đỏ Sao Vàng Chất ĐẸP,30000,https://tiki.vn/ao-thun-co-viet-nam-ao-co-do-sao-vang-chat-dep-p70283690.html?spid=70283724,,247.0,aonu,7410000.0
470,"Áo Thun Nữ Cổ Tim Tay ngắn , Trẻ Trung, Mẫu Mới nhất",29000,https://tiki.vn/ao-thun-nu-co-tim-tay-ngan-tre-trung-mau-moi-nhat-p192216746.html?spid=271727488,,9.0,aonu,261000.0
471,"Áo phông, áo thun nam nữ form rộng tay lỡ Unisex BÉ GÁI CÔ ĐƠN Từ 50-70kg",49000,https://tiki.vn/ao-phong-ao-thun-nam-nu-form-rong-tay-lo-unisex-be-ga-i-co-do-n-tu-50-70kg-p95940103.html?spid=193639636,,512.0,aonu,25088000.0
472,Áo Thun Nữ Slepless Hàn Quốc,46400,https://tiki.vn/ao-thun-nu-slepless-han-quoc-p95010919.html?spid=95010929,,333.0,aonu,15451200.0
473,Áo thun nữ cổ tim trơn,29000,https://tiki.vn/ao-thun-nu-co-tim-tron-p82291729.html?spid=94483630,,109.0,aonu,3161000.0
474,Áo đũi nữ thêu họa tiết sao - trẻ trung năng động - cổ tàu thích hợp cả đi chơi và đi làm (SP18),188000,https://tiki.vn/ao-dui-nu-theu-hoa-tiet-sao-tre-trung-nang-dong-co-tau-thich-hop-ca-di-choi-va-di-lam-sp18-p179420435.html?spid=179420474,,42.0,aonu,7896000.0
475,"Áo kiểu nữ, áo phông in họa tiết hoa thời trang Haint Boutique,kín đáo,điệu đà,4 màu thanh nhã ALe18",131000,https://tiki.vn/ao-kieu-nu-ao-phong-in-hoa-tiet-hoa-thoi-trang-haint-boutique-kin-dao-dieu-da-4-mau-thanh-nha-ale18-p160545090.html?spid=160545104,,9.0,aonu,1179000.0
476,"Áo ba lỗ croptop nữ cổ bẻ khoét, dáng ôm nhẹ co dãn thoáng mát, áo sát nách dệt kim hot 2022",69000,https://tiki.vn/ao-ba-lo-croptop-nu-co-be-khoet-dang-om-nhe-co-dan-thoang-mat-ao-sat-nach-det-kim-hot-2022-p201672925.html?spid=201672933,,5.0,aonu,345000.0
477,"<BST Mới> Áo thun giữ nhiệt nữ dài tay cổ tròn Vicci vải Premium Cotton cao cấp co giãn, mềm mịn ôm dáng nhiều màu",119000,https://tiki.vn/bst-moi-ao-thun-giu-nhiet-nu-dai-tay-co-tron-vicci-vai-premium-cotton-cao-cap-co-gian-mem-min-om-dang-nhieu-mau-p198795306.html?spid=198795330,,8.0,aonu,952000.0
478,"Áo thun nữ cổ tim tay dài vải cotton đẹp, dễ mặc dễ phối đồ, mặc bốn mùa",49000,https://tiki.vn/ao-thun-nu-co-tim-tay-dai-vai-cotton-dep-de-mac-de-phoi-do-mac-bon-mua-p192216666.html?spid=271476035,,9.0,aonu,441000.0
479,Áo thun tay dài nữ form rộng - phông dài tay oversize thêu chữ xẻ tà - 2N Unisex,99000,https://tiki.vn/ao-thun-tay-dai-nu-form-rong-phong-dai-tay-oversize-theu-chu-xe-ta-2n-unisex-p249694129.html?spid=249694133,,6.0,aonu,594000.0
480,"Bộ Quần Áo Blouse CỘC TAY, Dáng Dài Ngang Mông NAM NỮ Cho Điều Dưỡng, Y tá ,Dược Sĩ, Vải Lon Nhật Và Thô Cotton (Giá Sỉ)",99000,https://tiki.vn/bo-quan-ao-blouse-coc-tay-dang-dai-ngang-mong-nam-nu-cho-dieu-duong-y-ta-duoc-si-vai-lon-nhat-va-tho-cotton-gia-si-p196184595.html?spid=196185525,,13.0,aonu,1287000.0
481,Áo thun giữ nhiệt dài tay cho nữ,25000,https://tiki.vn/ao-thun-giu-nhiet-dai-tay-cho-nu-p72475301.html?spid=127219916,,14.0,aonu,350000.0
482,Áo polo croptop kiểu len gân nữ tay ngắn dáng ôm body cổ bẻ dệt kim thời trang phong cách Hàn Quốc trẻ trung,96000,https://tiki.vn/ao-polo-croptop-kieu-len-gan-nu-tay-ngan-dang-om-body-co-be-det-kim-thoi-trang-phong-cach-han-quoc-tre-trung-p201423036.html?spid=201423051,,3.0,aonu,288000.0
483,"Áo sơ mi nữ công sở thời trang SURI lụa latin dài tay,thiết kế hiện đaị,cổ cách điệu,vai đính cúc ngọc",102900,https://tiki.vn/ao-so-mi-nu-cong-so-thoi-trang-suri-lua-latin-dai-tay-thiet-ke-hien-dai-co-cach-dieu-vai-dinh-cuc-ngoc-p144629514.html?spid=144629534,,7.0,aonu,720300.0
484,Áo Sơ Mi Nhung Gân Mặt Cười Form Rộng Unisex Nam Nữ Phong Cách Hàn Quốc Ulzzang,137000,https://tiki.vn/ao-so-mi-nhung-gan-mat-cuoi-form-rong-unisex-nam-nu-phong-cach-han-quoc-ulzzang-p134390163.html?spid=157071779,,27.0,aonu,3699000.0
485,Áo len lưới nữ tay dài dáng rộng khoác dệt kim kiểu cổ V đi biển thời trang hàng đẹp thiết kế Quảng Châu cao cấp,115000,https://tiki.vn/ao-len-luoi-nu-tay-dai-dang-rong-khoac-det-kim-kieu-co-v-di-bien-thoi-trang-hang-dep-thiet-ke-quang-chau-cao-cap-p193055701.html?spid=193055703,,3.0,aonu,345000.0
486,Áo sơ mi voan nữ,165000,https://tiki.vn/a-o-so-mi-voan-nu-p83606513.html?spid=83606527,,3.0,aonu,495000.0
487,"Áo sơ mi nữ cổ trụ linen tay lỡ trẻ trung, chất liện linen mềm mát, thời trang phong cách trẻ",219000,https://tiki.vn/ao-so-mi-nu-co-tru-linen-tay-lo-tre-trung-lahstore-chat-lien-linen-mem-mat-thoi-trang-phong-cach-tre-p76454379.html?spid=108643800,,57.0,aonu,12483000.0
488,"Áo sơ mi trắng dài tay, thiết kế xoắn ngực siêu xinh AM 10",159000,https://tiki.vn/ao-so-mi-trang-dai-tay-thiet-ke-xoan-nguc-sieu-xinh-am-10-p171323271.html?spid=171323289,,19.0,aonu,3021000.0
