,title,price,link_item,discount,sales,category,revenue
360,Đồ mặc nhà lửng cotton 5020,292000,https://tiki.vn/do-mac-nha-lung-cotton-5020-p111958478.html?spid=111958484,,27.0,dongu,7884000.0
361,Áo dài ngủ kiểu dáng dài sexy kèm quần lót,65000,https://tiki.vn/ao-dai-ngu-kieu-dang-dai-sexy-kem-quan-lot-p107155524.html?spid=107155530,,2.0,dongu,130000.0
362,Váy ngủ sườn xám ôm sát cơ thể gợi cảm,65000,https://tiki.vn/vay-ngu-suon-xam-om-sat-co-the-goi-cam-p96997409.html?spid=96997410,,5.0,dongu,325000.0
363,Váy Ngủ Nữ M03 Lụa Satin Trơn Dáng Xuông Liền Thân Hisexy,139000,https://tiki.vn/vay-ngu-nu-m03-lua-satin-tron-dang-xuong-lien-than-hisexy-p73910468.html?spid=73910490,,535.0,dongu,74365000.0
364,Đầm ngủ phối ren xuyên thấu kèm quần chip lọt khe Q48 - Váy ngủ ren cả đầm sexy gợi cảm - Đầm ngủ nữ - Váy ngủ nữ mạc nhà,109000,https://tiki.vn/dam-ngu-phoi-ren-xuyen-thau-kem-quan-chip-lot-khe-bt0110-vay-ngu-ren-ca-dam-sexy-goi-cam-dam-ngu-nu-vay-ngu-nu-mac-nha-p174522509.html?spid=174522519,,8.0,dongu,872000.0
365,Váy ngủ sơ mi có dây thắt eo kèm quần lót lọt khe cao cấp Q12 - Áo sơ mi ngủ xuyên thấu sexy - Aso sơ mi ngủ nữ - Đầm sơ mi ngủ,169000,https://tiki.vn/vay-ngu-so-mi-co-day-that-eo-kem-quan-lot-lot-khe-cao-cap-bt0174-ao-so-mi-ngu-xuyen-thau-sexy-aso-so-mi-ngu-nu-dam-so-mi-ngu-p176939612.html?spid=176939618,,4.0,dongu,676000.0
366,"Đồ ngủ sexy nữ Đồ ngủ hai dây có mút ngực chất phi hai dây chất mịn quyến rũ, 5",80000,https://tiki.vn/do-ngu-sexy-nu-do-ngu-hai-day-co-mut-nguc-chat-phi-hai-day-chat-min-quyen-ru-5-p124489754.html?spid=124489773,,39.0,dongu,3120000.0
367,Đồ Bộ Lụa Mai Ngô - Sóng - Cổ Bèo Tay Ngắn (P1),329000,https://tiki.vn/do-bo-lua-mai-ngo-song-co-beo-tay-ngan-p1-p120792691.html?spid=120792753,,1.0,dongu,329000.0
368,Đầm ngủ cosplay y tá cotton gồm 4 món,75000,https://tiki.vn/dam-ngu-cosplay-y-ta-cotton-gom-4-mon-p42591063.html?spid=42591071,,15.0,dongu,1125000.0
369,Đồ ngủ cosplay hầu gái mèo sexy gợi cảm,155000,https://tiki.vn/do-ngu-cosplay-hau-gai-meo-sexy-goi-cam-p96722529.html?spid=97819249,,8.0,dongu,1240000.0
370,Đồ bộ mặc nhà chất kate hàn,212500,https://tiki.vn/do-bo-mac-nha-chat-kate-han-p160203269.html?spid=160203293,,13.0,dongu,2762500.0
371,"Váy mặc nhà, váy ngủ nữ 2 dây họa tiết hình dâu 2 màu trắng và hồng V21",129000,https://tiki.vn/vay-mac-nha-vay-ngu-nu-2-day-hoa-tiet-hinh-dau-2-mau-trang-va-hong-v21-p109982103.html?spid=109982119,,21.0,dongu,2709000.0
372,"Bộ Đồ Mặc Nhà Cho Người Trung Niên, Người Lớn Tuổi NG14",290000,https://tiki.vn/bo-do-mac-nha-cho-nguoi-trung-nien-nguoi-lon-tuoi-ng14-p13412467.html?spid=13412473,,13.0,dongu,3770000.0
373,Mặt nạ hoá trang Halloween và dự tiệc có đèn,25000,https://tiki.vn/mat-na-hoa-trang-halloween-va-du-tiec-co-den-p181993354.html?spid=181993364,,5.0,dongu,125000.0
374,"Đầm ngủ nữ xinh, Đầm 2 dây nữ thiết kế đuôi cá mặc nhà",199000,https://tiki.vn/dam-2-day-nu-thiet-ke-ke-caro-duoi-ca-mac-nha-p133893611.html?spid=133893618,,3.0,dongu,597000.0
375,"Đồ bộ nữ,đồ ngủ mặc nhà lửng 9 tấc vải lụa mango BL 75 họa tiết hoa nhí dễ thương size 47-60kg",156450,https://tiki.vn/do-bo-nu-do-ngu-mac-nha-lung-9-tac-vai-lua-mango-bl-75-hoa-tiet-hoa-nhi-de-thuong-size-47-60kg-p171189128.html?spid=171189136,,7.0,dongu,1095150.0
376,ĐỒ BỘ QUẦN DÀI TAY NGẮN NHIHOUSE71 PIZAMA LỤA BÔNG CHÂN,179000,https://tiki.vn/do-bo-quan-dai-tay-ngan-nhihouse71-pizama-lua-bong-chan-p92048924.html?spid=92048940,,5.0,dongu,895000.0
377,Bộ đồ ngủ nữ vải Cotton lụa tự nhiên mềm mại thoáng mát mặc nhà mùa hè kiểu quần lửng mã VABD0113,149000,https://tiki.vn/bo-do-ngu-nu-vai-cotton-lua-tu-nhien-mem-mai-thoang-mat-mac-nha-mua-he-kieu-quan-lung-ma-vabd0113-p258805735.html?spid=258805739,-14%,5.0,dongu,745000.0
378,Bộ Đồ Ngủ Liền Thân Bodysuit Vô Cùng Sexy,99000,https://tiki.vn/bo-do-ngu-lien-than-bodysuit-vo-cung-sexy-p32670473.html?spid=47139586,,33.0,dongu,3267000.0
379,"Bộ đồ ngủ nữ lụa cao cấp (pijama) ngắn - Không nhăn, mát, sang chảnh -DNN001",200000,https://tiki.vn/bo-do-ngu-nu-lua-cao-cap-pijama-ngan-khong-nhan-mat-sang-chanh-dnn001-p46161240.html?spid=78916548,,17.0,dongu,3400000.0
380,"Đồ Mặc Nhà Cho Người Trung Niên, Đồ Bộ Nữ Dài Thời Trang Fom Rộng, Bigsize Thêu Hoa Chất Đũi Mát Mịn, May Kỹ, Vải Đẹp",200000,https://tiki.vn/do-mac-nha-cho-me-do-bo-nu-dai-trung-nien-theu-hoa-chat-dui-mat-min-may-ky-vai-dep-p77111967.html?spid=84574488,,6.0,dongu,1200000.0
381,"Bộ lông nữ mặc nhà hình gấu đáng yêu, Sét bộ đồ ngủ lông cừu siêu giữ nhiệt, Đồ bộ lông áo hoodie túi trước sang chảnh",179000,https://tiki.vn/bo-long-nu-mac-nha-hinh-gau-dang-yeu-set-bo-do-ngu-long-cuu-sieu-giu-nhiet-do-bo-long-ao-hoodie-tui-truoc-sang-chanh-p196004019.html?spid=196004029,,1.0,dongu,179000.0
382,"Đồ Mặc Ở Nhà Nữ Đùi Chất Lụa/Lanh/Tole - Bộ Quần Áo Ngủ Nữ 2 Dây Viền Ren Mặc Nhà Mùa Hè, Nhiều Mẫu Dễ Thương",459000,https://tiki.vn/do-mac-o-nha-nu-dui-chat-lua-lanh-tole-bo-quan-ao-ngu-nu-2-day-vien-ren-mac-nha-mua-he-nhieu-mau-de-thuong-p140361018.html?spid=147887916,,16.0,dongu,7344000.0
383,"Đồ Bộ Nữ Mặc Nhà Cho Người Trung Niên, Người Lớn Tuổi NG23 - Kem",290000,https://tiki.vn/do-bo-nu-mac-nha-cho-nguoi-trung-nien-nguoi-lon-tuoi-ng23-kem-p7360209.html?spid=7360225,,16.0,dongu,4640000.0
384,"Đồ Ngủ Nữ Pyjama Tay Dài Quần Dài HW1002 đồ ngủ nữ đẹp lụa Pháp cao cấp, mềm mịn,thoáng mát - RELAX",619000,https://tiki.vn/do-ngu-nu-pyjama-tay-dai-quan-dai-hw1002-do-ngu-nu-dep-lua-phap-cao-cap-mem-min-thoang-mat-relax-p184899491.html?spid=184899973,,19.0,dongu,11761000.0
385,Đầm ngủ phi lụa cao cấp WANNABE DNS38 váy ngủ 2 dây cúp ngực phủ 2 lớp tạo độ phồng giúp ngực căng tròn,420000,https://tiki.vn/dam-ngu-phi-lua-cao-cap-wannabe-dns38-phu-cup-don-gian-nhe-nhang-p168954595.html?spid=168954597,,1.0,dongu,420000.0
386,"Đồ bộ nữ,đồ ngủ mặc nhà vải lụa họa tiết hoa nhí siêu xinh",124950,https://tiki.vn/do-bo-nu-do-ngu-mac-nha-vai-lua-hoa-tiet-hoa-nhi-sieu-xinh-p148051363.html?spid=148051369,,1.0,dongu,124950.0
387,Đồ ngủ lưới Sexy gợi cảm,49000,https://tiki.vn/do-ngu-luoi-sexy-goi-cam-p74884034.html?spid=74884035,,45.0,dongu,2205000.0
388,Đồ ngủ Sexy Cosplay áo yêm Trung Hoa kèm áo choàng chuyên chụp ảnh Studio Bar sàn Trung Thu,102000,https://tiki.vn/do-ngu-sexy-cosplay-ao-yem-trung-hoa-kem-ao-choang-chuyen-chup-anh-studio-bar-san-trung-thu-p115281687.html?spid=125180547,,7.0,dongu,714000.0
389,Bộ Đồ Ngủ Quần Đùi Áo Hai Dây Cotton Có Đệm Ngực Liền CT142,167000,https://tiki.vn/bo-do-ngu-quan-dui-ao-hai-day-cotton-co-dem-nguc-lien-ct142-p84822380.html?spid=84823290,,6.0,dongu,1002000.0
390,Đồ Ngủ Sexy| Váy Ngủ Dễ Thương️️ Lụa Satin Quyến Rũ (H),69000,https://tiki.vn/do-ngu-sexy-vay-ngu-de-thuong-lua-satin-quyen-ru-h-p109858653.html?spid=104301479,,4.0,dongu,276000.0
391,Váy đầm ngủ ngắn tay cổ V đệm ngực vải Modal (gỗ Sồi) mềm mại thoáng mát mặc nhà mùa hè mã VAV0406,189000,https://tiki.vn/vay-dam-ngu-ngan-tay-co-v-dem-nguc-vai-modal-go-soi-mem-mai-thoang-mat-mac-nha-mua-he-ma-vav0406-p252861986.html?spid=252862018,,1.0,dongu,189000.0
392,Đồ bộ mặc ở nhà nữ - đồ bộ lửng nữ quần đen áo màu in hình hoa cúc siêu hot thun cotton loại 1 mát mịn size từ 40-63kg,99000,https://tiki.vn/do-bo-mac-o-nha-nu-do-bo-lung-nu-quan-den-ao-mau-in-hinh-hoa-cuc-sieu-hot-thun-cotton-loai-1-mat-min-size-tu-40-63kg-p97809494.html?spid=97809506,,44.0,dongu,4356000.0
393,Mặt nạ hóa trang sự kiện bữa tiệc Halloween - Màu đen,25000,https://tiki.vn/mat-na-hoa-trang-su-kien-bua-tiec-halloween-mau-den-p39367011.html?spid=39367012,,4.0,dongu,100000.0
394,Bộ đồ Pijama Bộ Ngủ - Đồ Mặc Nhà Kate Thái [HÀNG ĐẸP CHUẨN,103000,https://tiki.vn/bo-do-pijama-bo-ngu-do-mac-nha-kate-thai-hang-dep-chuan-p84988735.html?spid=87250171,-20%,4.0,dongu,412000.0
395,"Combo 2 váy/đầm ngủ chất liệu ren lưới gợi cảm, siêu mỏng thoáng khí LYEN005 ( màu ngẫu nhiên)",86400,https://tiki.vn/combo-2-vay-dam-ngu-chat-lieu-ren-luoi-goi-cam-sieu-mong-thoang-khi-lyen005-mau-ngau-nhien-p144874251.html?spid=174172443,-29%,6.0,dongu,518400.0
396,"Đồ ngủ cosplay sexy cúp ngực BD018, đồ ngủ gợi cảm, đồ lót sexy, đầm ngủ cosplay, Freesize",85000,https://tiki.vn/do-ngu-cosplay-sexy-cup-nguc-bd018-do-ngu-goi-cam-do-lot-sexy-dam-ngu-cosplay-freesize-p106588245.html?spid=106588248,,3.0,dongu,255000.0
397,Bộ đồ ngủ dây ngắn Pink Stull ren,335000,https://tiki.vn/bo-do-ngu-day-ngan-pink-stull-ren-p50928935.html?spid=51066423,,4.0,dongu,1340000.0
398,Đồ Bộ Lụa Mai Ngô - Quần Đùi Tay Cánh Dơi (Big Size) [60-80kg] (P2),349000,https://tiki.vn/do-bo-lua-mai-ngo-quan-dui-tay-canh-doi-big-size-60-80kg-p2-p91075573.html?spid=91075597,,1.0,dongu,349000.0
399,Bộ mặc nhà nữ bigsize thun mịn thoáng mát đồ ngủ BC10,94000,https://tiki.vn/bo-mac-nha-nu-bigsize-thun-min-thoang-mat-do-ngu-bc10-p147124086.html?spid=147124330,,6.0,dongu,564000.0
400,"Váy ngủ hai dây nữ, đầm ngủ hai dây bản to nữ tính chất vải lanh lụa rayon tự nhiên thoáng mát nhiều màu mã VAV0224",69000,https://tiki.vn/vay-ngu-hai-day-nu-dam-ngu-hai-day-ban-to-nu-tinh-chat-vai-lanh-lua-rayon-tu-nhien-thoang-mat-nhieu-mau-ma-vav0224-p155792392.html?spid=193060212,,15.0,dongu,1035000.0
401,Váy ngủ lụa hai dây chéo lưng phối ren sexy gợi cảm P30 - Đầm ngủ lụa phối ren quyến rũ - Đồ ngủ nữ sexy,199000,https://tiki.vn/vay-ngu-lua-hai-day-cheo-lung-phoi-ren-sexy-goi-cam-p30-dam-ngu-lua-phoi-ren-quyen-ru-do-ngu-nu-sexy-p193147356.html?spid=193147368,,6.0,dongu,1194000.0
402,Bộ quần áo ngắn cho mẹ họa tiết Hoa Mẫu đơn vàng đũi xược - AICDME4ERYUH - AIN Closet,300000,https://tiki.vn/bo-quan-ao-ngan-cho-me-hoa-tiet-hoa-mau-don-vang-dui-xuoc-aicdme4eryuh-ain-closet-p185004846.html?spid=185004850,,1.0,dongu,300000.0
403,ĐỒ BỘ LỤA LATIN - QUẦN DÀI TAY DÀI,180000,https://tiki.vn/do-bo-lua-latin-quan-dai-tay-dai-p126682432.html?spid=126682442,,1.0,dongu,180000.0
404,"Đồ ngủ gợi cảm dâu tây VN25, váy ngủ sexy, đầm ngủ gợi cảm, đồ ngủ cosplay, Freesize",135000,https://tiki.vn/do-ngu-goi-cam-dau-tay-vn25-vay-ngu-sexy-dam-ngu-goi-cam-do-ngu-cosplay-freesize-p106084948.html?spid=106084954,,4.0,dongu,540000.0
405,"Bộ Đồ Mặc Nhà Cho Người Trung Niên, Người Lớn Tuổi NG27H",290000,https://tiki.vn/bo-do-mac-nha-cho-nguoi-trung-nien-nguoi-lon-tuoi-ng27h-p13626946.html?spid=13626948,,1.0,dongu,290000.0
406,Váy Ngủ Sexy Gợi Cảm Xuyên Thấu,138000,https://tiki.vn/vay-ngu-sexy-goi-cam-xuyen-thau-p68359191.html?spid=101995098,,4.0,dongu,552000.0
407,Bộ đồ liền thân Cá Sấu (Khủng long) xanh,239000,https://tiki.vn/bo-do-lien-than-ca-sau-khung-long-xanh-p50004697.html?spid=113789765,,17.0,dongu,4063000.0
408,Váy đầm ngủ mặc ba lỗ chất vải Cotton lụa tự nhiên thoáng mát mềm mịn dáng chữ A rộng rãi mã VAV0251,159000,https://tiki.vn/vay-dam-ngu-mac-ba-lo-chat-vai-cotton-lua-tu-nhien-thoang-mat-mem-min-dang-chu-a-rong-rai-ma-vav0251-p251769067.html?spid=273951854,,5.0,dongu,795000.0
409,Bộ kẻ 2 mảnh siêu sexy 19225,35000,https://tiki.vn/bo-ke-2-manh-sieu-sexy-19225-p152632202.html?spid=152632214,-54%,1.0,dongu,35000.0
410,Đồ ngủ Sexy kiểu áo sơ mi che quần quyến rũ - Màu da,125000,https://tiki.vn/do-ngu-sexy-kieu-ao-so-mi-che-quan-quyen-ru-mau-da-p68962662.html?spid=68962663,,8.0,dongu,1000000.0
411,Bộ mặc nhà nữ phong cách bigsize đồ ngủ nữ thun mềm co giãn BC25,122000,https://tiki.vn/bo-mac-nha-nu-phong-cach-bigsize-do-ngu-nu-thun-mem-co-gian-bc25-p147123872.html?spid=147124321,,11.0,dongu,1342000.0
412,"BỘ PIJAMA NỮ DÀI TAY mẫu mới nhất, tông đỏ style Hàn QuốC - Shop Thủy Bông",504000,https://tiki.vn/bo-pijama-nu-dai-tay-mau-moi-nhat-tong-do-style-han-quoc-shop-thuy-bong-p82741216.html?spid=82741222,,15.0,dongu,7560000.0
413,Set đồ lót sexy Bodysuit,45000,https://tiki.vn/set-do-lot-sexy-bodysuit-p101889061.html?spid=101889062,,10.0,dongu,450000.0
414,"đồ bộ mặc nhà cao cấp, chất kate hàn",180000,https://tiki.vn/do-bo-mac-nha-cao-cap-p193370287.html?spid=193370297,,2.0,dongu,360000.0
415,Bộ đồ trung niên cho mẹ mặc nhà đi chơi - Chất co giãn thoáng mát B61,142000,https://tiki.vn/bo-do-trung-nien-cho-me-mac-nha-di-choi-chat-co-gian-thoang-mat-b61-p64279482.html?spid=64279506,,21.0,dongu,2982000.0
416,Đồ bộ bigsize - Đồ bộ trung niên - Bộ đồ trung niên mặc nhà bigsize Vicci DGD.02 thiết kế áo cộc quần dài chất liệu đũi cao cấp (dành cho người béo),139000,https://tiki.vn/do-bo-bigsize-do-bo-trung-nien-bo-do-trung-nien-mac-nha-bigsize-vicci-dgd-02-thiet-ke-ao-coc-quan-dai-chat-lieu-dui-cao-cap-danh-cho-nguoi-beo-p92387305.html?spid=92387317,,31.0,dongu,4309000.0
417,"[40kg - 80kg] Đồ Bộ Măc Nhà, Đồ Bộ Nữ Tole (Lanh) 2 Da Tay Quần Lỡ (Dài 85cm) Tay Ngắn Bigsize",165000,https://tiki.vn/40kg-80kg-do-bo-mac-nha-do-bo-nu-tole-lanh-2-da-tay-quan-lo-dai-85cm-tay-ngan-bigsize-p198799529.html?spid=198799613,,5.0,dongu,825000.0
418,Bộ ngủ lụa họa tiết dễ thương Q135 - Đồ ngủ lụa - Bộ quần áo ngủ,149000,https://tiki.vn/bo-ngu-lua-hoa-tiet-de-thuong-q135-do-ngu-lua-bo-quan-ao-ngu-p208055376.html?spid=208055382,,1.0,dongu,149000.0
419,Bộ ngủ 2 dây - BN2D,112800,https://tiki.vn/bo-ngu-2-day-bn2d-p51429179.html?spid=51429185,,3.0,dongu,338400.0
420,BỘ NGỦ 2 DÂY LỤA SATIN NHIHOUSE71 QUẦN LAI BÈO TẶNG KÈM BỊT MẮT ĐÁNG YÊU FREESIZE DƯỚI 60KG,109000,https://tiki.vn/bo-ngu-2-day-lua-satin-nhihouse71-quan-lai-beo-tang-kem-bit-mat-dang-yeu-freesize-duoi-60kg-p92048027.html?spid=92048058,,2.0,dongu,218000.0
421,[HCM] (60-75kg) Đồ bộ BIGSIZE satin TDQD. Đồ bộ satin BIGSIZE TDQD. Đồ bộ bigsize mặc nhà nữ. Đồ bộ bigsize mặc ngủ nữ. HÀNG MAY TRỰC TIẾP TẠI VIỆT NAM,169000,https://tiki.vn/60-75kg-do-bo-bigsize-satin-tdqd-do-bo-satin-bigsize-tdqd-do-bo-bigsize-mac-nha-nu-do-bo-bigsize-mac-ngu-nu-hang-may-truc-tiep-tai-viet-nam-p93232151.html?spid=93232187,,5.0,dongu,845000.0
422,Bộ ngủ lụa cao cấp ma SP 17122020 - Giao màu ngẫu nhiên - Freesize,280000,https://tiki.vn/bo-ngu-lua-cao-cap-ma-sp-17122020-giao-mau-ngau-nhien-freesize-p74404779.html?spid=78912744,,10.0,dongu,2800000.0
423,"Đồ Bộ Nữ Mặc Nhà Cho Người Trung Niên, Người Lớn Tuổi NG22K",250000,https://tiki.vn/do-bo-nu-mac-nha-cho-nguoi-trung-nien-nguoi-lon-tuoi-ng22k-p50400306.html?spid=50400308,,4.0,dongu,1000000.0
424,Đồ ngủ liền thân ren thun nóng bỏng TK3153,160000,https://tiki.vn/do-ngu-lien-than-ren-thun-nong-bong-tk3153-p167884848.html?spid=167884851,,2.0,dongu,320000.0
425,Set đầm ngủ kèm áo choàng xuyên thấu sexy BT4229 - Váy ngủ sexy - Đồ ngủ nữ,260000,https://tiki.vn/set-dam-ngu-kem-ao-choang-xuyen-thau-sexy-bt4229-vay-ngu-sexy-do-ngu-nu-p203728886.html?spid=203728892,,1.0,dongu,260000.0
426,Đồ bộ nữ cộc tay - Đồ bộ mặc nhà - Đồ ngủ mặc nhà nữ - Đồ bộ nữ lửng - Set bộ đũi mặc nhà nữ Vicci BDT.85 họa tiết quả Sơ ri,145000,https://tiki.vn/do-bo-nu-coc-tay-do-bo-mac-nha-do-ngu-mac-nha-nu-do-bo-nu-lung-set-bo-dui-mac-nha-nu-vicci-bdt-85-hoa-tiet-qua-so-ri-p104366948.html?spid=104366958,-23%,14.0,dongu,2030000.0
427,Set bộ ngủ mặc nhà siêu cute dễ thương cho các nàng,176000,https://tiki.vn/set-bo-nu-ao-hai-day-form-rong-quan-dui-p200559620.html?spid=214582420,,60.0,dongu,10560000.0
428,"Đồ bộ mặc nhà, đồ ngủ kiểu dáng Pijama chất liệu lụa cao cấp tay dài quần dài có túi hai bên tiện lợi phối viền ren bèo nhỏ tinh tế lịch sự H291",480000,https://tiki.vn/do-bo-mac-nha-do-ngu-kieu-dang-pijama-chat-lieu-lua-cao-cap-tay-dai-quan-dai-co-tui-hai-ben-tien-loi-phoi-vien-ren-beo-nho-tinh-te-lich-su-h291-p75626732.html?spid=80976353,-29%,2.0,dongu,960000.0
429,Váy ngủ sexy cosplay người hầu gái G64 siêu gợi cảm quyến rũ,150000,https://tiki.vn/vay-ngu-sexy-cosplay-nguoi-hau-gai-g64-sieu-goi-cam-quyen-ru-p103357280.html?spid=103357320,-54%,11.0,dongu,1650000.0
430,Bộ Cosplay váy ngủ sexy g43 – Bộ cosplay váy ngủ quyến rũ – Cosplay sexy quyến rũ – Váy ngủ sexy – Đầm ngủ sexy,168350,https://tiki.vn/bo-cosplay-vay-ngu-sexy-g43-bo-cosplay-vay-ngu-quyen-ru-cosplay-sexy-quyen-ru-vay-ngu-sexy-dam-ngu-sexy-p103358681.html?spid=103358897,,3.0,dongu,505050.0
431,Váy ngủ 2 dây lụa phối ren hở lưng kèm mút ngực sexy P23 - Đầm ngủ nữ gợi cảm - Đồ ngủ nữ sexy,249000,https://tiki.vn/vay-ngu-2-day-lua-phoi-ren-ho-lung-kem-mut-nguc-sexy-p23-dam-ngu-nu-goi-cam-do-ngu-nu-sexy-p193044566.html?spid=193044570,,4.0,dongu,996000.0
432,Đồ ngủ cosplay cô dâu sexy TK2941,300000,https://tiki.vn/do-ngu-cosplay-co-dau-sexy-tk2941-p150761371.html?spid=150761372,,3.0,dongu,900000.0
433,Bộ ngủ jum thun lạnh xẻ đáy hở lưng dây eo gợi cảm,75000,https://tiki.vn/bo-ngu-jum-thun-lanh-xe-day-ho-lung-day-eo-goi-cam-p214614728.html?spid=214614729,,1.0,dongu,75000.0
434,"Đồ bộ pijama lụa, đồ mặc nhà nữ VILADY - B126 kiệu quần đủi tay cộc họa tiết trơn phối ren sexy quyến rũ, chất liệu lụa Pháp ( lụa latin) cao cấp - Màu đỏ",319000,https://tiki.vn/bo-do-pyjama-mac-nha-nu-vilady-chat-lieu-lua-phap-cao-cap-quan-dui-tay-coc-hoa-tiet-tron-do-phoi-ren-b126-p174088913.html?spid=174088919,,4.0,dongu,1276000.0
435,"Đồ bộ nữ,đồ ngủ,đồ bộ mặc nhà lửng vải lụa phối tằm ý thời trang",131250,https://tiki.vn/do-bo-nu-mac-nha-lung-vai-lua-phoi-tam-y-thoi-trang-p115803495.html?spid=115803552,,1.0,dongu,131250.0
436,"Set đồ nữ,đồ bộ nữ,đồ ngủ mặc nhà vải lụa hoa nhí quần ống rộng thời trang",145950,https://tiki.vn/set-do-nu-do-bo-nu-do-ngu-mac-nha-vai-lua-hoa-nhi-quan-ong-rong-thoi-trang-p140775881.html?spid=140775942,,1.0,dongu,145950.0
437,Cosplay hầu gái sexy - Set váy ngủ sexy cosplay cô hầu bàn tạp dề trắng,145000,https://tiki.vn/cosplay-hau-gai-sexy-set-vay-ngu-sexy-cosplay-co-hau-ban-tap-de-trang-p110213897.html?spid=110213898,,7.0,dongu,1015000.0
438,Đồ bộ nữ - M ( 50 - 62kg) - M10,82000,https://tiki.vn/do-bo-nu-p108605107.html?spid=108605115,,79.0,dongu,6478000.0
439,Đồ ngủ cosplay y tá costume y tá sexy gợi cảm,45000,https://tiki.vn/do-ngu-cosplay-y-ta-costume-y-ta-sexy-goi-cam-p82124879.html?spid=110878537,,1.0,dongu,45000.0
440,Đồ Ngủ Sexy Áo Choàng Ngủ Hoa Đen Cao Cấp Freeship-Chất đẹp Kimono Mặc Nhà Đơn Giản(N44),99000,https://tiki.vn/do-ngu-sexy-ao-choang-ngu-hoa-den-cao-cap-freeship-chat-dep-kimono-mac-nha-don-gian-n44-p104302324.html?spid=109627781,,7.0,dongu,693000.0
441,"Sét Bộ Nữ SS22, Sét Đồ Nữ Đi Chơi Đẹp In Gấu Vàng, Sét Áo Vải Cotton, Hình In Sắc Nét Và Quần Kẻ Đen Cá Tính - LẺ ÁO",49000,https://tiki.vn/set-bo-nu-ss22-set-do-nu-di-choi-dep-in-gau-vang-set-ao-vai-cotton-hinh-in-sac-net-va-quan-ke-den-ca-tinh-p248327414.html?spid=248327418,,1.0,dongu,49000.0
442,"Đồ Ngủ Hai Dây Phối Ren Sexy Quyến Rũ Có Mút Ngực Thương Hiệu Baw, Chất Liệu Lụa Satin Mát Mịn DN20 (hình thật shop tự chụp)",78000,https://tiki.vn/do-ngu-hai-day-phoi-ren-sexy-quyen-ru-co-mut-nguc-thuong-hieu-baw-chat-lieu-lua-satin-mat-min-dn20-hinh-that-shop-tu-chup-p99679344.html?spid=99679346,,54.0,dongu,4212000.0
443,Bộ đồ Pijama nữ dài -vải siêu lụa cao cấp - Cực Kì Sang Chảnh,256000,https://tiki.vn/bo-do-pijama-nu-dai-vai-sieu-lua-cao-cap-cuc-ki-sang-chanh-p168769040.html?spid=168769041,,1.0,dongu,256000.0
444,[40-65kg] Đầm Ngủ Lụa Mai Ngô - Cổ Sơ Mi,369000,https://tiki.vn/40-65kg-dam-ngu-lua-mai-ngo-co-so-mi-p161978763.html?spid=161978767,,6.0,dongu,2214000.0
445,"Bộ đồ ngủ nữ mặc nhà vải Cotton tự nhiên mềm mịn thoáng mát, Bộ ba lỗ quần đùi mã VABD0280",149000,https://tiki.vn/bo-do-ngu-nu-mac-nha-vai-cotton-tu-nhien-mem-min-thoang-mat-bo-ba-lo-quan-dui-ma-vabd0280-p225972082.html?spid=270481112,,4.0,dongu,596000.0
446,Bộ nỉ nữ thể thao chất cotton da cá-đồ bộ mặc nhà thu đông hàng TK Cao Cấp,249000,https://tiki.vn/bo-ni-nu-the-thao-chat-cotton-da-ca-do-bo-mac-nha-thu-dong-hang-tk-cao-cap-p205518772.html?spid=205518808,,2.0,dongu,498000.0
447,"Đồ bộ nữ,đồ ngủ,đồ bộ mặc nhà 9 tấc vải đũi phối lụa thời trang",156450,https://tiki.vn/do-bo-nu-mac-nha-9-tac-vai-dui-phoi-lua-thoi-trang-p115810017.html?spid=115810069,,1.0,dongu,156450.0
448,Đồ mặc nhà Bigsize hình chuột mickey 55~70 kg,99000,https://tiki.vn/do-mac-nha-bigsize-firstnight-chuot-mickey-free-ship-do-bo-pijama-nu-bigsize-55-70-kg-p130015062.html?spid=130015072,-25%,10.0,dongu,990000.0
449,Áo choàng kimono lụa satin iBasic SW055,429000,https://tiki.vn/ao-choang-kimono-lua-satin-ibasic-sw055-p146637813.html?spid=193585189,,9.0,dongu,3861000.0
450,Bộ nỉ bông nữ siêu kute (ảnh thật) hàng VNXK,150000,https://tiki.vn/bo-ni-bong-nu-sieu-kute-anh-that-hang-vnxk-p104666295.html?spid=134956252,-24%,5.0,dongu,750000.0
451,Bộ Đồ Ngủ Lụa Tay Ngắn Basic Loirechic LPN07,325500,https://tiki.vn/bo-do-ngu-lua-tay-ngan-basic-loirechic-lpn07-p155283629.html?spid=155283639,,13.0,dongu,4231500.0
452,Đồ Ngủ pijama Phi Bóng Trơn Viền Chỉ Nhỏ - Nhiều Màu - CDANP20,189000,https://tiki.vn/do-ngu-pijama-phi-bong-tron-vien-chi-nho-nhieu-mau-cdanp20-p125099949.html?spid=125099959,,1.0,dongu,189000.0
453,Đầm ngủ kèm áo choàng chip lọt khe sexy BT42217 - Váy ngủ - Đồ ngủ - áo choàng,200000,https://tiki.vn/dam-ngu-kem-ao-choang-chip-lot-khe-sexy-bt42217-vay-ngu-do-ngu-ao-choang-p204053497.html?spid=204053509,,1.0,dongu,200000.0
454,Váy Ngủ Ren Xinh Đẹp Quyến RũChất Đẹp- Có Video Thật- Tặng Kèm Chip Xinh- Sale 50,109000,https://tiki.vn/vay-ngu-ren-xinh-dep-quyen-ru-chat-dep-co-video-that-tang-kem-chip-xinh-sale-50-p109860318.html?spid=104302206,,17.0,dongu,1853000.0
455,"Set bộ đùi mặc nhà, kiểu dáng dễ thương - hàng loại 1 cao cấp chất liệu mềm mại, thoáng mát",153000,https://tiki.vn/set-bo-dui-mac-nha-p137243811.html?spid=205708135,,43.0,dongu,6579000.0
456,Đồ Cosplay Nàng Dâu Gợi Cảm (Kèm Tất) - B.Lingerie,250000,https://tiki.vn/do-cosplay-nang-dau-goi-cam-kem-tat-b-lingerie-p270764449.html?spid=270764450,,1.0,dongu,250000.0
457,Váy ngủ Phi lụa tặng quần chip G23 – Váy ngủ quảng châu cao cấp – Váy ngủ sexy – Váy ngủ gợi cảm – Váy ngủ quyến rũ,143550,https://tiki.vn/vay-ngu-phi-lua-tang-quan-chip-g23-vay-ngu-quang-chau-cao-cap-vay-ngu-sexy-vay-ngu-goi-cam-vay-ngu-quyen-ru-p103357610.html?spid=103357747,,19.0,dongu,2727450.0
458,Set bikini 2 mảnh thiết kế lọt khe dây buộc siêu nhỏ - SMS193,69000,https://tiki.vn/set-bikini-2-manh-thiet-ke-lot-khe-day-buoc-sieu-nho-sms193-p271532252.html?spid=271532260,,5.0,dongu,345000.0
459,"Bộ Mặc Nhà Micky Đáng Yêu, Bộ Thu Đông Nữ Tay Dài",89000,https://tiki.vn/bo-mac-nha-micky-dang-yeu-bo-thu-dong-nu-tay-dai-p198501793.html?spid=198501803,,1.0,dongu,89000.0
460,Váy ngủ jum bó sát body sexy quyến rũ,49000,https://tiki.vn/vay-ngu-jum-bo-sat-body-sexy-quyen-ru-p87107824.html?spid=87107825,,6.0,dongu,294000.0
461,"Đầm 2 dây mặc nhà,đồ ngủ họa tiết Haint Boutique Vn15",110000,https://tiki.vn/dam-2-day-mac-nha-do-ngu-hoa-tiet-haint-boutique-vn15-p77565340.html?spid=108179911,,33.0,dongu,3630000.0
462,Đồ ngủ sexy 2 mảnh chấm bi mỏng manh,70200,https://tiki.vn/do-ngu-sexy-2-manh-cham-bi-mong-manh-p69785552.html?spid=174172226,,5.0,dongu,351000.0
463,Váy ngủ Sexy gợi cảm - chất voan thun sexy kèm quần lọt khe E3,133000,https://tiki.vn/vay-ngu-sexy-goi-cam-chat-voan-thun-sexy-kem-quan-lot-khe-e3-p103358660.html?spid=103358758,,5.0,dongu,665000.0
464,"Đồ bộ mặc nhà - Pijama cộc tay vải cotton 100% mềm mại, thoáng mát",395000,https://tiki.vn/do-bo-mac-nha-pijama-coc-tay-vai-cotton-100-mem-mai-thoang-mat-p167429583.html?spid=167429589,,2.0,dongu,790000.0
465,"Váy ngủ lụa phối ren dây yếm cao cấp Q13 - Đầm ngủ lụa sexy gợi cảm - Đồ ngủ nữ, Váy ngủ nữ",189000,https://tiki.vn/vay-ngu-lua-phoi-ren-day-yem-cao-cap-bt0042-dam-ngu-lua-sexy-goi-cam-do-ngu-nu-vay-ngu-nu-p170647470.html?spid=170647474,,10.0,dongu,1890000.0
466,Đồ ngủ cosplay ren phối nhung cao cấp Q510 - Đầm ngủ nữ cosplay sexy - Đồ ngủ mặc nhà,189000,https://tiki.vn/do-ngu-cosplay-ren-phoi-nhung-cao-cap-bt0225-dam-ngu-nu-cosplay-sexy-do-ngu-mac-nha-p180319209.html?spid=180319213,,4.0,dongu,756000.0
