,title,price,link_item,discount,sales,category,revenue
679,"Đồ ngủ sexy nữ hai 2 dây gợi cảm, bộ lụa mặc nhà nữ nhiều màu sang chảnh –USEEMI  đồ mặc nhà cao cấp",459000,https://tiki.vn/do-ngu-sexy-nu-hai-2-day-goi-cam-bo-lua-mac-nha-nu-nhieu-mau-sang-chanh-useemi-do-mac-nha-cao-cap-p183352770.html?spid=183352776,,1.0,dongu,459000.0
680,Đồ mặc nhà đồ lửng lụa cao cấp tay lỡ họa tiết hoa nhí dễ thương Nhã Dung Store siêu mát đủ size dưới 65kg,155000,https://tiki.vn/do-mac-nha-do-lung-lua-cao-cap-tay-lo-hoa-tiet-hoa-nhi-de-thuong-nha-dung-store-sieu-mat-du-size-duoi-65kg-p185495931.html?spid=185495939,,12.0,dongu,1860000.0
681,Bộ ngủ dễ thương chất liệu cotton cao cấp áo ngắn tay quần lửng,240000,https://tiki.vn/bo-ngu-de-thuong-chat-lieu-cotton-cao-cap-ao-ngan-tay-quan-lung-p148824631.html?spid=148824653,,3.0,dongu,720000.0
682,Đầm ngủ sexy mỏng kèm quần chip (SEXY MỎNG nhiều màu),30000,https://tiki.vn/dam-ngu-sexy-mong-kem-quan-chip-sexy-mong-nhieu-mau-p109859958.html?spid=104303250,,13.0,dongu,390000.0
683,"-Bộ đùi mặc nhà, bộ ngủ lụa dập ly 2 dây siêu mát chất đẹp",99000,https://tiki.vn/freeship-bo-dui-mac-nha-bo-ngu-lua-dap-ly-2-day-sieu-mat-chat-dep-p97566117.html?spid=97566121,,2.0,dongu,198000.0
684,"Đồ bộ nữ,đồ ngủ mặc nhà lửng 9 tấc vải lụa mango BL 76 họa tiết hoa nhí siêu cute size 47-60kg",156450,https://tiki.vn/do-bo-nu-do-ngu-mac-nha-lung-9-tac-vai-lua-mango-bl-76-hoa-tiet-hoa-nhi-sieu-cute-size-47-60kg-p171194594.html?spid=171194610,,1.0,dongu,156450.0
685,Đồ bộ mặc nhà chất đũi nhật mát mẻ cao cấp TNB75872,139000,https://tiki.vn/do-bo-mac-nha-chat-dui-nhat-mat-me-cao-cap-tnb75872-p70495050.html?spid=70495060,,47.0,dongu,6533000.0
686,"ĐỒ BỘ MẶC NHÀ THU ĐÔNG NỮ KIỂU CÔNG CHÚA, COTTON 100% THOÁNG MÁT, KHÔNG KÍCH ỨNG DA",467000,https://tiki.vn/do-bo-mac-nha-thu-dong-nu-kieu-cong-chua-cotton-100-thoang-mat-khong-kich-ung-da-p138557191.html?spid=138557203,,1.0,dongu,467000.0
687,Áo sơ mi trắng mặc ngủ dáng dài đuôi tôm sexy quyến rũ - SMS074,280000,https://tiki.vn/sms074-ao-so-mi-trang-mac-ngu-dang-dai-duoi-tom-sexy-quyen-ru-p271533022.html?spid=271533032,,1.0,dongu,280000.0
688,"Bộ Đồ Mặc Nhà Cho Người Trung Niên, Người Lớn Tuổi NGT01",490000,https://tiki.vn/bo-do-mac-nha-cho-nguoi-trung-nien-nguoi-lon-tuoi-ngt01-p13667235.html?spid=13667241,,10.0,dongu,4900000.0
689,"Set bộ mặc nhà ba lỗ in chữ áo tanktop cá tính (ảnh thật), Bộ đồ ba lỗ sát nách Cotton cao cấp, rộng rãi dùng để mặc nhà, đi tập gym dễ thướng, thoải mái",97000,https://tiki.vn/set-bo-3-mon-tanktop-chu-ka-closet-gom-ao-tanktop-quan-dui-ao-ba-lo-hot-chat-cotton-tham-hut-mo-hoi-p125638149.html?spid=125638157,,3.0,dongu,291000.0
690,Váy ngủ sexy g23- váy ngủ phi lụa- váy ngủ sexy gợi cảm - Đồ ngủ cô dâu - Váy ngủ màu trắng,151000,https://tiki.vn/vay-ngu-sexy-g23-vay-ngu-phi-lua-vay-ngu-sexy-goi-cam-do-ngu-co-dau-vay-ngu-mau-trang-p103356704.html?spid=103356747,,1.0,dongu,151000.0
691,Quần áo mặc nhà cotton 5651,295000,https://tiki.vn/quan-ao-mac-nha-cotton-5651-p263504742.html?spid=263504748,,1.0,dongu,295000.0
692,Set Đồ Ngủ Cosplay Gợi Cảm,199000,https://tiki.vn/set-do-ngu-cosplay-goi-cam-p44311295.html?spid=97819251,-21%,3.0,dongu,597000.0
693,Đầm Ngủ Nhiều Họa Tiết Dễ Thương Phong Cách Hàn Quốc Cho Bạn Gái,250000,https://tiki.vn/dam-ngu-nhieu-hoa-tiet-de-thuong-phong-cach-han-quoc-cho-ban-gai-p74728823.html?spid=74787603,-21%,30.0,dongu,7500000.0
694,Đồ ngủ cosplay áo bra kèm quân váy sexy gợi cảm P39 - Bộ ngủ cosplay kèm cài tóc quyến rũ cao cấp,299000,https://tiki.vn/do-ngu-cosplay-ao-bra-kem-quan-vay-sexy-goi-cam-p39-bo-ngu-cosplay-kem-cai-toc-quyen-ru-cao-cap-p193507707.html?spid=193507713,,1.0,dongu,299000.0
695,Váy ngủ ôm body phối nơ kèm mũ sexy P22 - Đầm ngủ nữ quyến rũ - Đồ ngủ mặc nhà,269000,https://tiki.vn/vay-ngu-om-body-phoi-no-kem-mu-sexy-p22-dam-ngu-nu-quyen-ru-do-ngu-mac-nha-p193044495.html?spid=193044499,,1.0,dongu,269000.0
696,Đồ Ngủ Sexy|Váy 2 Dây Ngủ Quyến Rũ️ ️ Chất Phi Bóng Mềm Mịn xinh Đẹp (H),119000,https://tiki.vn/do-ngu-sexy-vay-2-day-ngu-quyen-ru-chat-phi-bong-mem-min-xinh-dep-h-p109858919.html?spid=104302083,,34.0,dongu,4046000.0
697,Đồ Ngủ Mặc Nhà Bộ Đồ Ngủ Hisexy In Hoa Lụa Hàn Có Mút Ngực MS35,139000,https://tiki.vn/do-ngu-mac-nha-bo-do-ngu-hisexy-in-hoa-lua-han-co-mut-nguc-ms35-p124324831.html?spid=124326324,,227.0,dongu,31553000.0
698,Áo ngủ Voan mỎng Sexy CDAN01,35000,https://tiki.vn/ao-ngu-voan-mong-sexy-cdan01-p125100910.html?spid=125100917,,12.0,dongu,420000.0
699,[50-70kg] Đầm Ngủ Lụa Latin - Cao Cấp (P1),451500,https://tiki.vn/50-70kg-dam-ngu-lua-latin-cao-cap-p1-p146869450.html?spid=146869452,,4.0,dongu,1806000.0
700,Váy ngủ cosplay thỏ ren hông sexy BT42220 - Đầm ngủ - Đồ ngủ,240000,https://tiki.vn/vay-ngu-cosplay-tho-ren-hong-sexy-bt42220-dam-ngu-do-ngu-p204056619.html?spid=204056621,,1.0,dongu,240000.0
701,"Bộ Pijama lụa cao cấp Quảng Châu nhiều màu lựa chọn, chất vải lì mướt tay, mặc nhẹ tênh, cảm giác mát lạnh, size M,L,XL. Hàng bao đẹp",420000,https://tiki.vn/bo-pijama-lua-cao-cap-quang-chau-nhieu-mau-lua-chon-chat-vai-li-muot-tay-mac-nhe-tenh-cam-giac-mat-lanh-size-m-l-xl-hang-bao-dep-p86585612.html?spid=86585630,,7.0,dongu,2940000.0
702,"Đồ Bộ Pijama cộc tay chất vải cotton 100% tự nhiên thoáng mát, tông hồng cực kỳ tôn da, họa tiết hoa lá trẻ trung",474000,https://tiki.vn/do-bo-pijama-coc-tay-chat-vai-cotton-100-tu-nhien-thoang-mat-tong-hong-cuc-ky-ton-da-hoa-tiet-hoa-la-tre-trung-p138557164.html?spid=138557189,,2.0,dongu,948000.0
703,Váy ngủ ren mỏng gợi cảm - Màu hồng,39000,https://tiki.vn/vay-ngu-ren-mong-goi-cam-mau-hong-p45469247.html?spid=45469248,-20%,7.0,dongu,273000.0
704,"Đồ ngủ 2 mảnh cosplay hầu gái sexy, bộ đồ ngủ hóa trang giúp việc gợi cảm TK1753",164000,https://tiki.vn/do-ngu-2-manh-cosplay-hau-gai-sexy-bo-do-ngu-hoa-trang-giup-viec-goi-cam-tk1753-p107696035.html?spid=109347778,-30%,2.0,dongu,328000.0
705,"Đồ bộ mặc nhà unisex,đồ bộ đám mây siêu đẹp thích hợp mặc cặp chất thun cotton thoáng mát thời trang teen hè",95000,https://tiki.vn/do-bo-mac-nha-unisex-do-bo-dam-may-sieu-dep-thich-hop-mac-cap-chat-thun-cotton-thoang-mat-thoi-trang-teen-he-p109817177.html?spid=113641317,-12%,3.0,dongu,285000.0
706,Bikini bò sữa sexy cosplay cô nàng nóng bỏng có tất chân,156800,https://tiki.vn/bikini-bo-sua-sexy-cosplay-co-nang-nong-bong-co-tat-chan-p169231325.html?spid=169231326,,1.0,dongu,156800.0
707,Váy ngủ sexy voan thun màu trắng hàng quảng châu cao cấp tặng kèm quần lót lọt khe quyến rũ gợi cảm mặc nhà đẹp độc lạ,153000,https://tiki.vn/vay-ngu-sexy-voan-thun-mau-trang-hang-quang-chau-cao-cap-tang-kem-quan-lot-lot-khe-quyen-ru-goi-cam-mac-nha-dep-doc-la-p103359504.html?spid=103359748,,2.0,dongu,306000.0
708,Đồ ngủ cosplay nữ sinh trung học cực sexy gợi cảm,148000,https://tiki.vn/do-ngu-cosplay-nu-sinh-trung-hoc-cuc-sexy-goi-cam-p53630268.html?spid=125140943,,2.0,dongu,296000.0
709,Bodysuit nóng bỏng lụa phối ren cao cấp kèm khuy đáy. Giao hỏa tốc HCM,195000,https://tiki.vn/bodysuit-nong-bong-lua-phoi-ren-cao-cap-kem-khuy-day-giao-hoa-toc-hcm-p187746225.html?spid=187746231,,2.0,dongu,390000.0
710,Bộ Đồ Ngủ Lụa Basic Dáng Dài Thoải Mái Loirechic LPD06,508500,https://tiki.vn/bo-do-ngu-lua-basic-dang-dai-thoai-mai-loirechic-lpd06-p155269928.html?spid=155269946,,5.0,dongu,2542500.0
711,Bộ đồ mặc nhà nữ AH01,179000,https://tiki.vn/bo-do-mac-nha-nu-ah01-p78951403.html?spid=78951413,,14.0,dongu,2506000.0
712,Đồ Bộ Lụa Mai Ngô - Tay Cánh Dơi Quần Dài (P2),369000,https://tiki.vn/do-bo-lua-mai-ngo-tay-canh-doi-quan-dai-p2-p74565613.html?spid=74565619,,1.0,dongu,369000.0
713,Áo choàng ngủ trong suốt kèm đồ nội y,99000,https://tiki.vn/ao-choang-ngu-trong-suot-kem-do-noi-y-p68962527.html?spid=68962531,,9.0,dongu,891000.0
714,Đồ Ngủ Mặc Nhà Bộ Đầm Ngủ Hisexy In Hoa Lụa Hàn Có Mút Ngực MD35,139000,https://tiki.vn/do-ngu-mac-nha-bo-dam-ngu-hisexy-in-hoa-lua-han-co-mut-nguc-md35-p124324764.html?spid=124325638,,149.0,dongu,20711000.0
715,Đồ bộ ngủ mặc nhà thun cotton tay ngắn quần đùi siêu xinh,145000,https://tiki.vn/do-bo-ngu-mac-nha-thun-cotton-tay-ngan-quan-dui-sieu-xinh-p136939328.html?spid=136939360,,3.0,dongu,435000.0
716,Combo váy ngủ lụa kèm áo choàng mặc nhà sang trọng,750000,https://tiki.vn/combo-vay-ngu-lua-kem-ao-choang-mac-nha-sang-trong-p127310966.html?spid=127311008,,5.0,dongu,3750000.0
717,Đồ Ngủ Sexy|Váy Ngủ 2 Dây Gợi Cảm ️Lụa Satin Mềm Mịn Xinh Đẹp Nhất,155000,https://tiki.vn/do-ngu-sexy-vay-ngu-2-day-goi-cam-lua-satin-mem-min-xinh-dep-nhat-p124482641.html?spid=124482645,,7.0,dongu,1085000.0
718,Đồ Ngủ Liền Thân Gợi Cảm Sexy,69000,https://tiki.vn/do-ngu-lien-than-goi-cam-sexy-p68356747.html?spid=72554933,,5.0,dongu,345000.0
719,Váy ngủ lụa ren hông cao cấp Q09 - Váy ngủ 2 dây - Đầm ngủ sexy gợi cảm - Đồ ngủ mạc nhà,169000,https://tiki.vn/vay-ngu-lua-ren-hong-cao-cap-bt0068-vay-ngu-2-day-dam-ngu-sexy-goi-cam-do-ngu-mac-nha-p173758811.html?spid=173758819,,4.0,dongu,676000.0
720,Bộ Đồ Ngủ 2 Dây Basic BHDN01,239200,https://tiki.vn/bo-do-ngu-2-day-basic-bhdn01-p225914392.html?spid=225914408,,1.0,dongu,239200.0
721,Váy ngủ hai dây xuyên thấu chéo lưng sexy P24 - Đầm ngủ chéo lưng gợi cảm - Đồ ngủ sexy quyến rũ,189000,https://tiki.vn/vay-ngu-hai-day-xuyen-thau-cheo-lung-sexy-p24-dam-ngu-cheo-lung-goi-cam-do-ngu-sexy-quyen-ru-p193136269.html?spid=193136277,,3.0,dongu,567000.0
722,"Đồ bộ mặc nhà, bộ đồ thun quần dài áo tay dài in hình C033",96000,https://tiki.vn/do-bo-mac-nha-bo-do-thun-quan-dai-ao-tay-dai-in-hinh-c033-p58921383.html?spid=75166247,,96.0,dongu,9216000.0
723,ĐỒ BỘ CÁT HÀN PHA COTTON LOẠI 1 MH - 9 tất - freesize,92000,https://tiki.vn/do-bo-cat-han-pha-cotton-loai-1-mh-9-tat-freesize-p150067144.html?spid=162838800,,17.0,dongu,1564000.0
724,Đồ Bộ Ngủ Lụa Cao Cấp Trơn Hai Dây Quyến Rủ Gợi Cảm Có Hai Màu Xanh Đen và Đỏ Đô - DREAMY - DN02,187000,https://tiki.vn/do-bo-ngu-lua-cao-cap-tron-hai-day-quyen-ru-goi-cam-co-hai-mau-xanh-den-va-do-do-dreamy-dn02-p69674726.html?spid=69674732,-40%,51.0,dongu,9537000.0
725,Đồ bộ nữ Lụa Mango Size Lớn(58-75kg) tay dài quần dài BD11,175000,https://tiki.vn/do-bo-nu-lua-mango-size-lon-58-75kg-tay-dai-quan-dai-bd11-p216359712.html?spid=216359713,,1.0,dongu,175000.0
726,"Đồ bộ mặc nhà,đồ ngủ,đồ bộ nữ,đồ bộ lụa sát nách quần dài size đại họa tiết dễ thương",152250,https://tiki.vn/do-bo-mac-nha-lua-sat-nach-quan-dai-size-dai-hoa-tiet-de-thuong-p115809418.html?spid=115809469,-32%,5.0,dongu,761250.0
727,"Bô Thu Đông nữ tông màu trắng phối họa tiết hồng mặc auto trẻ trung, size M-2XL",504000,https://tiki.vn/bo-thu-dong-nu-tong-mau-trang-phoi-hoa-tiet-hong-mac-auto-tre-trung-size-m-2xl-p138557069.html?spid=138557087,,5.0,dongu,2520000.0
728,"Bộ Đồ Cho Người Trung Niên, Người Lớn Tuổi NGT05",590000,https://tiki.vn/bo-do-cho-nguoi-trung-nien-nguoi-lon-tuoi-ngt05-p13668054.html?spid=13668060,,9.0,dongu,5310000.0
729,Váy ngủ sexy gợi cảm VNS517 - váy ngủ mỏng đẹp,130670,https://tiki.vn/vay-ngu-sexy-goi-cam-vns517-vay-ngu-mong-dep-p187390726.html?spid=187390740,-35%,1.0,dongu,130670.0
730,Đầm ngủ bodysuit xẻ đáy sexy BT52230 - Váy ngủ bodysuit - Đồ ngủ nữ,190000,https://tiki.vn/dam-ngu-bodysuit-xe-day-sexy-bt52230-vay-ngu-bodysuit-do-ngu-nu-p203538232.html?spid=203538234,,2.0,dongu,380000.0
731,Váy ngủ sexy xuyên thấu jumsuit gợi cảm Q416 - Bộ đồ ngủ cosplay bodysuit phối ren bèo - Đầm ngủ nữ - Đồ ngủ mạc nhà,169000,https://tiki.vn/vay-ngu-sexy-xuyen-thau-jumsuit-goi-cam-bt0122-bo-do-ngu-cosplay-bodysuit-phoi-ren-beo-dam-ngu-nu-do-ngu-mac-nha-p174898320.html?spid=174898322,,5.0,dongu,845000.0
732,Đầm Ngủ Sexy|Váy Ngủ Sexy Gợi Cảm️FreeShip - Có Video Thât️Lụa Satin Mềm Mịn Quyến Rũ(H),83000,https://tiki.vn/dam-ngu-sexy-vay-ngu-sexy-goi-cam-freeship-co-video-that-lua-satin-mem-min-quyen-ru-h-p109802157.html?spid=104302546,,17.0,dongu,1411000.0
733,Bộ mặc nhà nữ thun cotton cổ chữ V trắng xanh,188000,https://tiki.vn/bo-mac-nha-nu-thun-cotton-co-chu-v-trang-xanh-p89480865.html?spid=89480867,,1.0,dongu,188000.0
734,Mặt nạ hoá trang lông vũ đính đá nhiều màu,55200,https://tiki.vn/mat-na-hoa-trang-long-vu-dinh-da-nhieu-mau-p55727248.html?spid=55727254,,3.0,dongu,165600.0
735,Đồ hóa trang cô hầu gái ngọt ngào cao cấp Nhật Bản,171600,https://tiki.vn/do-hoa-trang-co-hau-gai-ngot-ngao-cao-cap-nhat-ban-p169453453.html?spid=169453454,,5.0,dongu,858000.0
736,Đầm ngủ sexy DD MS618,105000,https://tiki.vn/dam-ngu-sexy-dd-ms618-p5572497.html?spid=9582695,,31.0,dongu,3255000.0
737,"Đồ Mặc Nhà, Đồ Bộ Nữ Đùi, Áo Dây Họa Tiết Dễ Thương Chất Tole, Lanh Thái Mát, Mịn - Màu 17",141550,https://tiki.vn/do-mac-nha-do-bo-nu-dui-ao-day-hoa-tiet-de-thuong-chat-tole-lanh-thai-mat-min-mau-17-p96278283.html?spid=96278285,,11.0,dongu,1557050.0
738,Bộ PIJAMA Lụa Cao Cấp Khí Chất Nữ Vương,289000,https://tiki.vn/bo-pijama-lua-cao-cap-khi-chat-nu-vuong-p168769184.html?spid=168769185,,2.0,dongu,578000.0
739,Áo choàng ngủ chất lụa nhiều màu gợi cảm + Quần lót lọt khe,75000,https://tiki.vn/ao-choang-ngu-chat-lua-nhieu-mau-goi-cam-quan-lot-lot-khe-p23253942.html?spid=23253947,,109.0,dongu,8175000.0
740,Váy ngủ sexy gợi cảm - Váy ngủ màu hường G32- Váy ngủ màu hồng - Đầm ngủ sexy - Bộ ngủ đẹp - Váy ngủ cap cấp,170000,https://tiki.vn/vay-ngu-sexy-goi-cam-vay-ngu-mau-huong-g32-vay-ngu-mau-hong-dam-ngu-sexy-bo-ngu-dep-vay-ngu-cap-cap-p85900585.html?spid=85900588,,4.0,dongu,680000.0
741,"Áo choàng ngủ sexy kèm quần lọt khe AO03 (tặng 1 mặt nạ cô nàng bí ẩn), Đầm ngủ cosplay gợi cảm, Freesize",75000,https://tiki.vn/ao-choang-ngu-sexy-kem-quan-lot-khe-ao03-tang-1-mat-na-co-nang-bi-an-dam-ngu-cosplay-goi-cam-freesize-p51045391.html?spid=106195896,,6.0,dongu,450000.0
742,Đầm ngủ sơ mi in hoa văn dễ thương Q157 - Váy ngủ sơ mi sexy - Đầm ngủ,189000,https://tiki.vn/dam-ngu-so-mi-in-hoa-van-de-thuong-q157-vay-ngu-so-mi-sexy-dam-ngu-p207914863.html?spid=207914869,,8.0,dongu,1512000.0
743,"DREAMY-DN09-Đồ Bộ Ngủ Lụa Cao Cấp, Đồ Mặc Nhà, Đồ Bộ Ngủ, Đồ Ngủ Lụa Phối Ren Ngực Quyến Rủ, Đồ Ngủ Gợi Cảm Sexy Tay cánh Tiên Phối Ren Ngực Màu Đen và Đỏ Đô",112200,https://tiki.vn/dreamy-dn09-do-bo-ngu-lua-cao-cap-do-mac-nha-do-bo-ngu-do-ngu-lua-phoi-ren-nguc-quyen-ru-do-ngu-goi-cam-sexy-tay-canh-tien-phoi-ren-nguc-mau-den-va-do-do-p71160416.html?spid=71160418,,47.0,dongu,5273400.0
744,"Bộ đồ ngủ nam nữ hình gấu trúc Pan Da Chất lông cừu Siêu Ấm Áp, Bộ mặc Nhà Unisex hình thú đáng yêu sang chảnh",195000,https://tiki.vn/bo-do-ngu-nam-nu-hinh-gau-truc-pan-da-chat-long-cuu-sieu-am-ap-bo-mac-nha-unisex-hinh-thu-dang-yeu-sang-chanh-p195301432.html?spid=195301440,-50%,1.0,dongu,195000.0
745,Set áo choàng + váy ngủ lụa dáng dài quá gối Hantu Sleepwear sang trọng đủ size 40-100kg,750000,https://tiki.vn/set-ao-choang-vay-ngu-lua-dang-dai-qua-goi-hantu-sleepwear-sang-trong-du-size-40-100kg-p127312513.html?spid=127312768,,1.0,dongu,750000.0
746,đồ bộ nữ chất kate hàn,190000,https://tiki.vn/do-bo-nu-chat-kate-han-p208269876.html?spid=208269940,-12%,3.0,dongu,570000.0
747,"Đồ bộ mặc nhà phi lụa Wannabe, bộ sọt bss06 tay áo phối ren nữ tính",420000,https://tiki.vn/do-bo-mac-nha-phi-lua-wannabe-bo-sot-bss06-tay-ao-phoi-ren-nu-tinh-p97551702.html?spid=114467599,,6.0,dongu,2520000.0
748,Đầm Ngủ Lụa Satin Cổ Sơ Mi (P1),229000,https://tiki.vn/dam-ngu-lua-satin-co-so-mi-p1-p105229699.html?spid=105229737,-27%,5.0,dongu,1145000.0
749,"Áo giữ nhiệt nữ dài tay cổ tròn Vicci vải cotton co giãn, mềm mịn ôm dáng màu",85000,https://tiki.vn/ao-giu-nhiet-nu-dai-tay-co-tron-vicci-vai-cotton-co-gian-mem-min-om-dang-p6991569.html?spid=7033277,,50.0,dongu,4250000.0
750,Váy ngủ lụa hai dây hở lưng sexy Q17 - Đầm ngủ nữ gợi cảm - đồ ngủ nử mặc nhà,189000,https://tiki.vn/vay-ngu-lua-hai-day-ho-lung-sexy-bt0033-dam-ngu-nu-goi-cam-do-ngu-nu-mac-nha-p169468021.html?spid=169468031,,3.0,dongu,567000.0
751,Bộ Đồ Ngủ Lụa Cao Cấp Lady Nature Miley Lingerie CSS0102,307000,https://tiki.vn/bo-do-ngu-lua-cao-cap-lady-nature-miley-lingerie-css0102-p95734532.html?spid=95734536,,8.0,dongu,2456000.0
752,"Đồ bộ Pyjama lụa, đồ mặc nhà nữ VILADY - B134 kiểu quần đùi tay cộc, họa tiết siêu dễ thương, chất liệu lụa Pháp ( lụa latin) - Màu cam",299000,https://tiki.vn/bo-do-pyjama-mac-nha-nu-vilady-lua-phap-cao-cap-quan-dui-tay-coc-nhieu-hoa-tiet-sieu-de-thuong-b123-p175816576.html?spid=175816580,,7.0,dongu,2093000.0
753,"Bộ Đồ Ngủ, Mặc Nhà Nữ Pijama - Vải Lụa Mango Loại 1 Cao Cấp, Nhiều Họa Tiết Dễ Thương - 02",228000,https://tiki.vn/bo-do-ngu-mac-nha-nu-pijama-vai-lua-mango-loai-1-cao-cap-nhieu-hoa-tiet-de-thuong-p270251892.html?spid=270251910,,114.0,dongu,25992000.0
754,Đồ ngủ hai dây phối ren chất mịn quyến rũ,139000,https://tiki.vn/do-ngu-hai-day-phoi-ren-chat-min-quyen-ru-p142811136.html?spid=142811142,,7.0,dongu,973000.0
755,"Đồ Bộ Ngủ Nữ Sét Đồ Pijama Mặc Nhà Họa Tiết Sọc Đáng Yêu, Chất Lụa Tạo Cảm Giác Êm Ái, Đảm Bảo Giặt Không Nhăn, Form Dưới 60kg Mặc Đẹp Thoải Mái",59000,https://tiki.vn/do-bo-ngu-nu-set-do-pijama-mac-nha-hoa-tiet-soc-dang-yeu-chat-lua-tao-cam-giac-em-ai-dam-bao-giat-khong-nhan-form-duoi-60kg-mac-dep-thoai-mai-p66836513.html?spid=66836519,,5.0,dongu,295000.0
756,Đồ Ngủ Nữ|Váy Ngủ Gợi Cảm️FreeShip - Tặng Quần Chip Xinh️ Voan Ren 2 Lớp Mềm Mịn Quyến Rũ (TL),109000,https://tiki.vn/vay-ngu-goi-cam-tl-p104303751.html?spid=104303758,,12.0,dongu,1308000.0
757,Bộ ngủ liền thân lưới cực SEXY,55000,https://tiki.vn/bo-ngu-lien-than-luoi-cuc-sexy-p107154444.html?spid=107154449,,15.0,dongu,825000.0
758,Đồ Ngủ Mặc Nhà Bộ Đồ Ngủ Lụa Satin Hisexy Không Mút Ngực MS03,139000,https://tiki.vn/do-ngu-mac-nha-bo-do-ngu-lua-satin-hisexy-khong-mut-nguc-ms03-p124324957.html?spid=124325828,,327.0,dongu,45453000.0
759,Đầm ngủ cosplay bodysuit liền thân ren hai dây sexy BT42215 - Váy ngủ sexy - Đồ ngủ sexy,200000,https://tiki.vn/dam-ngu-cosplay-bodysuit-lien-than-ren-hai-day-sexy-bt42215-vay-ngu-sexy-do-ngu-sexy-p204052361.html?spid=204052362,,4.0,dongu,800000.0
760,"BỘ ĐỒ NỮ BỘ ĐỒ MẶC NHÀ NỮ , ĐỒ BỘ THUN NỮ",108000,https://tiki.vn/bo-do-nu-bo-do-mac-nha-nu-do-bo-thun-nu-p90066421.html?spid=91750670,,5.0,dongu,540000.0
761,"Đồ Ngủ Pijama Ngắn Cộc Tay Quần Đùi Chất Kate Cao Cấp Loại 1, Sét Đồ Bộ Nữ Đẹp Mặc Nhà Thoáng Mát",140000,https://tiki.vn/do-ngu-pijama-ngan-coc-tay-quan-dui-chat-kate-cao-cap-loai-1-set-do-bo-nu-dep-mac-nha-thoang-mat-p121481013.html?spid=162161268,,12.0,dongu,1680000.0
762,Váy ngủ cao cấp phi lụa phối ren có mút ngực CDANP27,149000,https://tiki.vn/vay-ngu-cao-cap-phi-lua-phoi-ren-co-mut-nguc-cdanp27-p125097732.html?spid=125097738,,4.0,dongu,596000.0
763,"Bộ ngủ nhung liền thân bodysuit (kèm 1 tai thỏ nhung + 1 vòng cổ gắn nơ + 2 vòng tay + 4 kẹp vớ) vô cùng sexy BS04, Đồ ngủ cosplay gợi cảm, Freesize",149000,https://tiki.vn/bo-ngu-nhung-lien-than-bodysuit-kem-1-tai-tho-nhung-1-vong-co-gan-no-2-vong-tay-4-kep-vo-vo-cung-sexy-bs04-do-ngu-cosplay-goi-cam-freesize-p54497404.html?spid=54497408,,30.0,dongu,4470000.0
764,"Bộ Đồ Mặc Nhà Nữ Cho Người Trung Niên, Người Lớn Tuổi NG09 - Size",350000,https://tiki.vn/bo-do-mac-nha-nu-cho-nguoi-trung-nien-nguoi-lon-tuoi-ng09-p8447967.html?spid=8447969,,33.0,dongu,11550000.0
765,"Bộ mặc nhà linen form rộng sát nách trẻ trung ArcticHunter, chất vài linen mềm mát, thời trang thương hiệu chính hãng",289000,https://tiki.vn/bo-mac-nha-linen-form-rong-sat-nach-tre-trung-arctichunter-chat-vai-linen-mem-mat-thoi-trang-thuong-hieu-chinh-hang-p119238798.html?spid=119238806,,22.0,dongu,6358000.0
766,Váy ngủ nữ hai dây ren xẻ sau Q27 - Đầm ngủ hai dây sexy - Đồ ngủ hai dây gợi cảm,139000,https://tiki.vn/vay-ngu-nu-hai-day-ren-xe-sau-bt0015-dam-ngu-hai-day-sexy-do-ngu-hai-day-goi-cam-p168469880.html?spid=168469886,,4.0,dongu,556000.0
767,Váy ngủ ren xuyên thấu có mút ngực sexy Q116 - Váy ngủ 2 dây - Váy ngủ nữ - Đầm ngủ hai dây gợi cảm - Đồ ngủ mạc nhà,169000,https://tiki.vn/vay-ngu-ren-xuyen-thau-co-mut-nguc-sexy-bt0078-vay-ngu-2-day-vay-ngu-nu-dam-ngu-hai-day-goi-cam-do-ngu-mac-nha-p173891500.html?spid=173891504,,8.0,dongu,1352000.0
768,"Đồ bộ nữ B07 chất lụa đẹp có Size - Quần áo ngủ Pijama cộc tay mặc nhà mùa hè, xuân, thu cute hoạt hình họa tiết dễ thương giá rẻ",119000,https://tiki.vn/do-bo-nu-b07-chat-lua-dep-co-size-quan-ao-ngu-pijama-coc-tay-mac-nha-mua-he-xuan-thu-cute-hoat-hinh-hoa-tiet-de-thuong-gia-re-p262755529.html?spid=262755539,,3.0,dongu,357000.0
769,Set bộ ngủ 2 dây ren cực SEXY T189 GIAO HOẢ TỐC HCM,108000,https://tiki.vn/set-bo-ngu-2-day-ren-cuc-sexy-t189-giao-hoa-toc-hcm-p155706124.html?spid=155706149,,1.0,dongu,108000.0
770,Đầm ngủ hai dây+áo khoác RBI satin họa tiết,199000,https://tiki.vn/dam-ngu-hai-day-ao-khoac-rbi-satin-hoa-tiet-p109589012.html?spid=109589016,,1.0,dongu,199000.0
771,Đồ mặc nhà bigsize nữ phong cách bộ mặc nhà BC25,122000,https://tiki.vn/do-mac-nha-bigsize-nu-phong-cach-bo-mac-nha-bc25-p147123729.html?spid=147123841,,13.0,dongu,1586000.0
772,Đồ ngủ Cosplay học sinh xuyên thấu quyến rũ,149000,https://tiki.vn/do-ngu-cosplay-hoc-sinh-xuyen-thau-quyen-ru-p69192823.html?spid=82861273,,11.0,dongu,1639000.0
773,Set cosplay cô dâu kiểu dáng sexy xinh xắn G57,254800,https://tiki.vn/set-cosplay-co-dau-kieu-dang-sexy-xinh-xan-g57-p85905126.html?spid=85905132,,3.0,dongu,764400.0
774,Bộ mặc nhà lanh (tole) Vicci BST.086.6 vải chéo Hàn cao cấp quần ống sớ hoạ tiết,349000,https://tiki.vn/bo-mac-nha-lanh-tole-vicci-bst-086-6-vai-cheo-han-cao-cap-quan-ong-so-hoa-tiet-hoa-p16161641.html?spid=16161645,,19.0,dongu,6631000.0
775,Bộ Đồ Ngủ Lụa Cao Cấp Lady Nature Miley Lingerie CSS0202,319000,https://tiki.vn/bo-do-ngu-lua-cao-cap-lady-nature-miley-lingerie-css0202-p95889480.html?spid=95889482,,4.0,dongu,1276000.0
776,ĐỒ BỘ CÁT HÀN PHA COTTON LOẠI 1 - 9 tất - freesize,92000,https://tiki.vn/do-bo-cat-han-pha-cotton-loai-1-9-tat-freesize-p150046484.html?spid=162838957,,25.0,dongu,2300000.0
777,Váy Ngủ Kiểu Sơ Mi Kèm Thắt Lưng Kiểu Tay Lỡ CDAN73,139000,https://tiki.vn/vay-ngu-kieu-so-mi-kem-that-lung-kieu-tay-lo-cdan73-p125099955.html?spid=125099971,,2.0,dongu,278000.0
778,Đầm ngủ đẹp gợi cảm VNS284B-Váy ngủ sexy,159250,https://tiki.vn/dam-ngu-dep-goi-cam-vns284b-vay-ngu-sexy-p186447515.html?spid=186447545,,1.0,dongu,159250.0
779,"Đầm 2 dây mặc nhà,đồ ngủ họa tiết Haint Boutique nhiều hình lựa chọn",119000,https://tiki.vn/dam-2-day-mac-nha-do-ngu-hoa-tiet-haint-boutique-nhieu-hinh-lua-chon-p102738899.html?spid=102738931,,2.0,dongu,238000.0
780,"Set cosplay nàng hầu sexy, nóng bỏng- Kèm ảnh thật T119 GIAO HOẢ TỐC HCM",169000,https://tiki.vn/set-cosplay-nang-hau-sexy-nong-bong-kem-anh-that-t119-giao-hoa-toc-hcm-p155705524.html?spid=155705539,,1.0,dongu,169000.0
781,"Bộ Đồ Mặc Nhà Nữ Cho Người Trung Niên, Người Lớn Tuổi NG37 - Size",290000,https://tiki.vn/bo-do-mac-nha-nu-cho-nguoi-trung-nien-nguoi-lon-tuoi-ng37-p8448281.html?spid=8448285,,32.0,dongu,9280000.0
782,Bodystocking Tất Ngủ Toàn Thân,75000,https://tiki.vn/bodystocking-tat-ngu-toan-than-p12875659.html?spid=115269640,,5.0,dongu,375000.0
783,Váy ngủ hai dây đầm ngủ lụa có mút ngực mềm mịn đuôi xếp li ( tặng kèm bịt mắt ) MD32,139000,https://tiki.vn/vay-ngu-hai-day-dam-ngu-lua-co-mut-nguc-mem-min-duoi-xep-li-tang-kem-bit-mat-md32-p124323790.html?spid=124323976,,24.0,dongu,3336000.0
784,đồ bộ nữ vải kate,180000,https://tiki.vn/do-bo-nu-vai-kate-p210751877.html?spid=210751907,,2.0,dongu,360000.0
785,Bộ đồ ngủ Kimono phong cách Nhật Bản quyến rũ - Màu đen,135000,https://tiki.vn/bo-do-ngu-kimono-phong-cach-nhat-ban-quyen-ru-mau-den-p52304518.html?spid=52304519,,21.0,dongu,2835000.0
