,title,price,link_item,discount,sales,category,revenue
185,Đồ Ngủ Sexy Váy Ngủ Gợi Cảm 2 Dây ️Freeship- Hình Ảnh Thật️ Phi Lụa Satin Quyến Rũ,102000,https://tiki.vn/do-ngu-sexy-vay-ngu-goi-cam-2-day-freeship-hinh-anh-that-phi-lua-satin-quyen-ru-p109859929.html?spid=104301252,,30.0,dongu,3060000.0
186,Set ngủ Cosplay sexy lông đính đá,78000,https://tiki.vn/set-ngu-cosplay-sexy-long-dinh-da-p69514836.html?spid=174172216,-22%,1.0,dongu,78000.0
187,Đồ nữ mặc nhà thu đông cotton 8648,377000,https://tiki.vn/do-nu-mac-nha-thu-dong-cotton-8648-p72640579.html?spid=72640581,,15.0,dongu,5655000.0
188,"Đồ bộ mặc nhà, đồ ngủ nữ cách điệu vải đũi nhăn mềm kiểu dáng dễ thương dưới 70kg",99000,https://tiki.vn/do-bo-mac-nha-do-ngu-nu-cach-dieu-vai-dui-nhan-mem-kieu-dang-de-thuong-duoi-70kg-p114376606.html?spid=114376628,,113.0,dongu,11187000.0
189,Đồ Bộ Lụa Satin Cao Cấp Tay Dài Phối Hoa Ren,210500,https://tiki.vn/do-bo-lua-satin-cao-cap-tay-dai-phoi-hoa-ren-p120793238.html?spid=120793337,,4.0,dongu,842000.0
190,Bộ đồ ngủ hình thú bí ngô rơi đen 1913 liền thân lông mịn Pijama Động Vật Hoạt Hình cho trẻ em người lớn Cosplay,304000,https://tiki.vn/bo-do-ngu-hinh-thu-bi-ngo-roi-den-1913-lien-than-long-min-pijama-dong-vat-hoat-hinh-cho-tre-em-nguoi-lon-cosplay-p46473775.html?spid=46473789,,12.0,dongu,3648000.0
191,Váy Ngủ Ren Siêu Sexy Đồ Lót Nữ Sexy Váy Ngủ Ren Lưới Thắt Nơ Ngực Sexy,127000,https://tiki.vn/vay-ngu-ren-sieu-sexy-do-lot-nu-sexy-vay-ngu-ren-luoi-that-no-nguc-sexy-p111300767.html?spid=111300771,,2.0,dongu,254000.0
192,Đồ ngủ liền thân lưới sexy QQ117 - 1 MÀU FREESIZE,49000,https://tiki.vn/do-ngu-lien-than-luoi-sexy-qq117-1-mau-freesize-p48506396.html?spid=66541039,,18.0,dongu,882000.0
193,BỘ MẶC NHÀ PIZAMA LỤA NHIHOUSE71 QUẦN DÀI TAY NGẮN ÁO TRƠN PHỐI QUẦN HỌA TIẾT,179000,https://tiki.vn/bo-mac-nha-pizama-lua-nhihouse71-quan-dai-tay-ngan-ao-tron-phoi-quan-hoa-tiet-p92049016.html?spid=92049138,,1.0,dongu,179000.0
194,đồ nữ vải kate,180000,https://tiki.vn/do-nu-vai-kate-p210751916.html?spid=210751927,,1.0,dongu,180000.0
195,"Váy ngủ ngắn tay, đầm mặc nhà cổ V gợi cảm freesize vải lanh cotton lụa tự nhiên thoáng mát nhiều màu mã VAV0270",159000,https://tiki.vn/vay-ngu-ngan-tay-dam-mac-nha-co-v-goi-cam-freesize-vai-lanh-cotton-lua-tu-nhien-thoang-mat-nhieu-mau-ma-vav0269-p165613563.html?spid=165613565,,4.0,dongu,636000.0
196,Bộ Mặc Nhà Lụa Quần Đùi Áo Hai Dây Phối Ren CT064,231000,https://tiki.vn/bo-mac-nha-lua-quan-dui-ao-hai-day-phoi-ren-ct064-p84820130.html?spid=84820303,,3.0,dongu,693000.0
197,"Đồ bộ nữ,đồ ngủ mặc nhà lửng vải lụa họa tiết caro phối ren siêu cưng",125000,https://tiki.vn/do-bo-nu-do-ngu-mac-nha-lung-vai-lua-hoa-tiet-caro-phoi-ren-sieu-cung-p190591190.html?spid=190591237,,1.0,dongu,125000.0
198,Set đồ lót - đồ ngủ - váy ngủ Cosplay gợi cảm S10,45000,https://tiki.vn/set-do-lot-do-ngu-vay-ngu-cosplay-goi-cam-s10-p108493461.html?spid=111726145,,2.0,dongu,90000.0
199,Bộ đồ ngủ Pijama Pinkstull tay dài quần dài xanh cổ vịt,399000,https://tiki.vn/bo-do-ngu-pijama-pinkstull-tay-dai-quan-dai-xanh-co-vit-p98116100.html?spid=98116106,,3.0,dongu,1197000.0
200,Váy ngủ cổ V ren ngực sexy Q104 - Đầm ngủ ren ngực xẻ lai sexy gợi cảm,129000,https://tiki.vn/vay-ngu-co-v-ren-nguc-sexy-q104-dam-ngu-ren-nguc-xe-lai-sexy-goi-cam-p207809404.html?spid=207809410,,2.0,dongu,258000.0
201,Đầm Mặc Nhà 2 Dây Cotton Modal Miley Comfort Đen - DDS0102,315000,https://tiki.vn/dam-mac-nha-2-day-cotton-modal-miley-comfort-den-dds0102-p200997571.html?spid=200997579,,4.0,dongu,1260000.0
202,Bộ Đồ hình thú liền thân lông mịn Pijama dành Cho Người Lớn và Trẻ Em Hoạt Hình Cosplay,299000,https://tiki.vn/bo-do-hinh-thu-lien-than-long-min-pijama-danh-cho-nguoi-lon-va-tre-em-hoat-hinh-cosplay-p119669651.html?spid=119669753,,1.0,dongu,299000.0
203,Váy Ngủ Ren Xẻ Hông - Đỏ,115000,https://tiki.vn/vay-ngu-ren-xe-hong-do-p68481152.html?spid=89770741,-27%,5.0,dongu,575000.0
204,"Đồ bộ nữ,đồ ngủ,đồ bộ lửng 9 tấc vải lụa hoạ tiết hoa cúc siêu cưng",136500,https://tiki.vn/do-bo-nu-do-ngu-do-bo-lung-9-tac-vai-lua-hoa-tiet-hoa-cuc-sieu-cung-p115806344.html?spid=115806367,,1.0,dongu,136500.0
205,Sét áo tay dài cổ cài cúc bẻ cổ v quần đùi form rộng phong cách hàn quốc,139000,https://tiki.vn/set-ao-tay-dai-co-cai-cuc-be-co-v-quan-dui-form-rong-phong-cach-han-quoc-p192891185.html?spid=192891189,,2.0,dongu,278000.0
206,Áo Choàng Ngủ Lụa Satin Viền Ren Sang Trọng Vaperla,381250,https://tiki.vn/ao-choang-ngu-lua-satin-vien-ren-sang-trong-vaperla-p69240853.html?spid=69240861,,8.0,dongu,3050000.0
207,"Đồ bộ nữ, đồ ngủ mặc nhà lửng cổ vuông phối ren F21 tay cánh tiên vải lanh BL161 họa tiết dễ thương size 45-70kg",89000,https://tiki.vn/do-bo-nu-do-ngu-mac-nha-lung-co-vuong-phoi-ren-f21-tay-canh-tien-vai-lanh-bl161-hoa-tiet-de-thuong-size-45-70kg-p196761933.html?spid=196761957,,9.0,dongu,801000.0
208,"Bộ đồ ngủ nữ 2 dây mặc nhà Ohazo! mùa hè cực Cute, Mềm mại, Thoáng mát - AG202",59000,https://tiki.vn/bo-do-ngu-nu-2-day-mac-nha-ohazo-mua-he-cuc-cute-mem-mai-thoang-mat-ag202-p84892249.html?spid=84892257,,25.0,dongu,1475000.0
209,"Đồ bộ nữ,đồ bộ mặc nhà vải lụa chấm bi tay loe dây rút size 40-57kg",131250,https://tiki.vn/do-bo-nu-mac-nha-vai-lua-cham-bi-tay-loe-day-rut-size-40-57kg-p115812252.html?spid=115812323,,3.0,dongu,393750.0
210,Đồ Ngủ Sexy Nữ| Váy ngủ QUẢNG CHÂUFreeship-Có Ảnh Thật Đầm ngủ lua phối ren ngực đan dây hàng có sẵn (M21),198000,https://tiki.vn/do-ngu-sexy-nu-vay-ngu-quang-chau-freeship-co-anh-that-dam-ngu-lua-phoi-ren-nguc-dan-day-hang-co-san-m21-p124481891.html?spid=124481904,,1.0,dongu,198000.0
211,Váy Ngủ Ren Lưới Sexy - Đồ lót nữ sexy - Set đồ ngủ lụa ren ngực thêu hoạ tiết,113000,https://tiki.vn/vay-ngu-ren-luoi-sexy-do-lot-nu-sexy-set-do-ngu-lua-ren-nguc-theu-hoa-tiet-p97819171.html?spid=97819174,,5.0,dongu,565000.0
212,Váy ngủ trong suốt tặng kèm chip - Màu đen,69000,https://tiki.vn/vay-ngu-trong-suot-tang-kem-chip-mau-den-p68961288.html?spid=68961295,,19.0,dongu,1311000.0
213,Đầm Ngủ Mặc Nhà Lụa Satin Mặc Nhà Hisexy Không Mút Ngực M08,139000,https://tiki.vn/dam-ngu-mac-nha-lua-satin-mac-nha-hisexy-khong-mut-nguc-m08-p74888728.html?spid=74888828,,98.0,dongu,13622000.0
214,Váy ngủ bodysuit hai dây chéo lưng sexy Q524 - Đầm ngủ bodysuit nữ quyến rũ - Đồ ngủ nữ gợi cảm,159000,https://tiki.vn/vay-ngu-bodysuit-hai-day-cheo-lung-sexy-bt0233-dam-ngu-bodysuit-nu-quyen-ru-do-ngu-nu-goi-cam-p180380160.html?spid=180380162,,4.0,dongu,636000.0
215,BỘ NGỦ 2 DÂY GẤM SATIN DỆT CHỮ NỔI NHIHOUSE71 QUẦN LAI BÈO TẶNG KÈM BỊT MẮT ĐÁNG YÊU FREESIZE,145000,https://tiki.vn/bo-ngu-2-day-gam-satin-det-chu-noi-nhihouse71-quan-lai-beo-tang-kem-bit-mat-dang-yeu-freesize-p92061640.html?spid=92061720,,1.0,dongu,145000.0
216,đồ bộ mẵ nhà,170000,https://tiki.vn/do-bo-ma-nha-p186389540.html?spid=186389612,-32%,1.0,dongu,170000.0
217,Váy ngủ lụa phối ren sexy,281250,https://tiki.vn/vay-ngu-lua-phoi-ren-sexy-p21782527.html?spid=21782533,,12.0,dongu,3375000.0
218,Bodysuit nơ đỏ đáng yêu cực sexy | Món quà giáng sinh đêm noel. SHIP HOẢ TỐC TPHCM. Đồ ngủ cosplay sexy ThaoBonita,169000,https://tiki.vn/bodysuit-no-do-dang-yeu-cuc-sexy-mon-qua-giang-sinh-dem-noel-ship-hoa-toc-tphcm-do-ngu-cosplay-sexy-thaobonita-p155706433.html?spid=155706436,,1.0,dongu,169000.0
219,Đồ mặc nhà đồ ngủ cao cấp pijama cho nữ cottong lông thỏ màu hồng có cổ quần dài áo dài thu đông họa tiết dâu tây đáng yêu 2020,179000,https://tiki.vn/do-mac-nha-do-ngu-cao-cap-pijama-cho-nu-cottong-long-tho-mau-hong-co-co-quan-dai-ao-dai-thu-dong-hoa-tiet-dau-tay-dang-yeu-2020-p69170789.html?spid=82899450,,1.0,dongu,179000.0
220,Sét bộ đồ ngủ yếm trung hoa sexy,69000,https://tiki.vn/set-bo-do-ngu-yem-trung-hoa-sexy-p177211219.html?spid=177211221,,9.0,dongu,621000.0
221,Bộ độ mặc nhà trung niên Tole (lanh) Vicci BGD.08 áo cộc tay phối quần dài lưng thun in họa tiết,185000,https://tiki.vn/bo-do-mac-nha-trung-nien-tole-lanh-vicci-bgd-08-ao-coc-tay-phoi-quan-dai-lung-thun-in-hoa-tiet-p176293265.html?spid=176293297,,18.0,dongu,3330000.0
222,Váy ngủ lụa phối ren xẻ tà cao cấp ĐỦ MÀU ĐỦ SIZE,175000,https://tiki.vn/vay-ngu-lua-phoi-ren-xe-ta-cao-cap-du-mau-du-size-p76563546.html?spid=94655440,,102.0,dongu,17850000.0
223,Đầm ngủ hai dây dáng suông Q47 - Váy ngủ dể thương dáng suông- Đồ ngủ mặc nhà sexy,149000,https://tiki.vn/dam-ngu-hai-day-dang-suong-bt0029-vay-ngu-de-thuong-dang-suong-do-ngu-mac-nha-sexy-p169465046.html?spid=169465052,,17.0,dongu,2533000.0
224,"Bộ Quần Áo Ngủ Nữ 2 Dây Mặc Nhà Mùa Hè - Đồ Mặc Ở Nhà Nữ Đùi Chất Lụa/Lanh/Tole, Nhiều Mẫu Dễ Thương",161000,https://tiki.vn/bo-quan-ao-ngu-nu-2-day-mac-nha-mua-he-do-mac-o-nha-nu-dui-chat-lua-lanh-tole-nhieu-mau-de-thuong-p140416352.html?spid=140416362,,24.0,dongu,3864000.0
225,Váy ngủ hai dây lụa cao cấp Q43 - Đầm ngủ lụa satin xẻ tà - Váy ngủ lụa cao cấp - Đồ ngủ nữ,179000,https://tiki.vn/vay-ngu-hai-day-lua-cao-cap-bt0062-dam-ngu-lua-satin-xe-ta-vay-ngu-lua-cao-cap-do-ngu-nu-p173639456.html?spid=173639464,,9.0,dongu,1611000.0
226,"Bộ đồ nữ mặc nhà trung niên cho các bà, các mẹ - Bộ đồ ngủ lanh (tole) - Bộ mặc nhà trung niên vải lanh (tole) Vicci BGD.082, thiết kế áo cộc tay phối quần dài in hoạ tiết (Màu 7-8-9-10-11)",185000,https://tiki.vn/bo-do-nu-mac-nha-trung-nien-cho-cac-ba-cac-me-bo-do-ngu-lanh-tole-bo-mac-nha-trung-nien-vai-lanh-tole-vicci-bgd-082-thiet-ke-ao-coc-tay-phoi-quan-dai-in-hoa-tiet-mau-7-8-9-10-11-p95992964.html?spid=95992993,,76.0,dongu,14060000.0
227,Váy đầm ngủ ngắn tay có đệm ngực vải Modal (gỗ Sồi) mềm mại thoáng mát mặc nhà mùa hè mã VAV0104,189000,https://tiki.vn/vay-dam-ngu-ngan-tay-co-dem-nguc-vai-modal-go-soi-mem-mai-thoang-mat-mac-nha-mua-he-ma-vav0104-p189686533.html?spid=189686785,,6.0,dongu,1134000.0
228,"Sét bộ ngủ lông cừu hình gấu dày dặn siêu ấm, bộ mặc nhà lông cừu túi trước siêu ấm, sét đồ áo hoodie mũ siêu giữ nhiệt",185000,https://tiki.vn/set-bo-ngu-long-cuu-hinh-gau-day-dan-sieu-am-bo-mac-nha-long-cuu-tui-truoc-sieu-am-set-do-ao-hoodie-mu-sieu-giu-nhiet-p196005744.html?spid=196005746,,5.0,dongu,925000.0
229,"Váy ngủ 2 dây sexy tiện lợi (đầm ngủ 2 dây sexy) ,vải cotton 100% thoáng mát",342000,https://tiki.vn/vay-ngu-2-day-sexy-tien-loi-dam-ngu-2-day-sexy-vai-cotton-100-thoang-mat-p90603141.html?spid=90603170,,15.0,dongu,5130000.0
230,"quần áo nữ, đồ bộ",190000,https://tiki.vn/quan-ao-nu-do-bo-p203402113.html?spid=203402150,,3.0,dongu,570000.0
231,"Váy ngủ dây, váy mặc nhà chất vải mềm mịn, thoáng mát Vn01",166800,https://tiki.vn/vay-ngu-day-vay-mac-nha-chat-vai-mem-min-thoang-mat-vn01-p109982074.html?spid=109982088,,54.0,dongu,9007200.0
232,"Đồ Bộ Pijama Nữ Đồ Bộ Mặc Nhà Nữ Tay Ngắn, Quần Dài Chất Cao Cấp, Không Nhăn Form60kg Vừa Đẹp",69000,https://tiki.vn/do-bo-pijama-nu-do-bo-mac-nha-nu-tay-ngan-quan-dai-chat-mango-cao-cap-khong-nhan-form60kg-vua-dep-p125858532.html?spid=125858547,,7.0,dongu,483000.0
233,"Đồ Bộ Lụa/Lanh/Tole Đùi Mặc Ở Nhà Nữ - Bộ Quần Áo Ngủ Nữ Tay Cánh Tiên Mặc Mùa Hè, Nhiều Màu Dễ Thương",189000,https://tiki.vn/do-bo-lua-lanh-tole-dui-mac-o-nha-nu-bo-quan-ao-ngu-nu-tay-canh-tien-mac-mua-he-nhieu-mau-de-thuong-p137563715.html?spid=261024516,,57.0,dongu,10773000.0
234,đồ bộ mặc ở nhà chất kate hàn,212500,https://tiki.vn/do-bo-mac-o-nha-chat-kate-han-p157808999.html?spid=157809083,,7.0,dongu,1487500.0
235,"Đầm ngủ, Váy ngủ lụa Pháp (Lụa Latin) cao cấp VILADY - V150, phối ren ngực và lưng, xẻ đùi 2 bên (Màu Xanh rêu)",299000,https://tiki.vn/dam-ngu-vay-ngu-lua-phap-lua-latin-cao-cap-vilady-v150-phoi-ren-nguc-va-lung-xe-dui-2-ben-mau-xanh-reu-p190538352.html?spid=190538354,,12.0,dongu,3588000.0
236,Set Váy Ngủ Cosplay Bikini Sexy Gợi Cảm Độc Lạ Freebra Freesize (40~60kg),219000,https://tka.tiki.vn/pixel/pixel?data=n-C07-vn2fP2CxEecjb9KkhT-l7L0h-giLk1iwDUo-zUNlr3p6wHuJUIsQzYbPveEwba984NZ5QXqgZFurH3I0knapuZCBvveF2GdZuadD3ySii2-ZXhqkeahLnWaNKQrPmpEa4LdsOr3-YnsrCqUWmnPukJSX1v718CQOUtJS_-oD0URTJOH-WaZiQCvaM3-huVszfWH0qHA0VWxVDN8bhF5ZeQMVOYEEvCntaG99vCvyiCwGrXbjzbVZPGixSyzRUWy11SD69uIYxZsfAPG-S2e57BYiHKSdWZcEfjS2ilZqbeTHgAfLpQFElE4FCOJ-NRb50fHp4g9FX9WZLtyOzHFUbvurDfkIX8XNHQ-3HUO4lWYXZ46li6W4mMK0kplO5EIw2q1SQ0pbEnXWwqHyRwmD-dAUTw1IylvoTjPgya8JnWlkUKa05phDSk4TlwWaDBM0kram0p2oM_kOqMkpWxumSZKdwkBoEug0i176JYDflqepRZhvG_e-IBCRCMgAp5IVRiIvKsZZieZTViGo3cjLxG-dXdYV9LaE9km9WzgpiUkWZXE24B_gzFgPLZZ7njxyhQ3vvg7C0v92GJ_jy18UC-dYsefKWs_JqWK92pzUi7m1T0VOzAc50FW06vY5JW9yizOgSvszFyNZ4cgu0wBKgNcqIwCsBydkgZVQSE9Dq4KuHYiulwoFOaF3hI7PBQ-phBFkOz4y_EOQ_nzYER3ZfPFlqC7KGzt-9NK_dEFIrLz0PlhZgK9Cr_vwFhtloI_-PMwWAsStn3dZ-jm7zCzM-ow8xfviWKH3-xNGZZgWT0bHnHxfjFa99EBk_4fHFQOcMyiGpv93qT5J8tJ8-7txgXYzdWtUx-dot5y1sAsTF3NCfnnKZGCEQ4F9aLZdTQJS23Mh_Gg1tLXj06zfnO6EJ8xfPYP0Bj2_rrgG1AMHW2CwKv883peNcNGwOnrwZo8BD7OnveA9dSDXF0QaEtzUQVY48zelBsFxmHqZmTpAmmsjvtFCsqP7m0aVY6hLE9fiK9wPk_ThUjxpO8EEhPGuYJZ4dye_nnn3E1UMgKovMnj9ZgaOU6O582yJCxoRWURKzEDT5GuN8k5Az0B_Jy6m8GnjpDfRZY36C7ADGeDarIWkOnJlvV0s_1Uzjq1wzuOlvtesOgA3SiPav0deKgluNsOXdaPa_2y9x2PVw&reqid=SHwsFqvvbJiJGfB8&type=CLICK&pos=41,-50%,2.0,dongu,438000.0
237,Váy ngủ sexy váy ngủ mặc nhà ren mềm cổ sâu thắt nơ VN01-1082 váy ngủ 2 dây mềm êm (ib shop chọn màu váy),94000,https://tka.tiki.vn/pixel/pixel?data=vF6e8NyW6HK-GGh3qLbAa03DixJDeTXRVkhnHTldlFzbhlugvbVp8H4MhwFDoURFhKQ1prD_Ihr-nI472qcV-eYXSE6JhF8OmIRbHG50wVM_ESHrEsfika-wUVEQ1X9tPa8NHIWZFsqiFbpTHh88V1-GAcvsCIlgPca01-T2EfifQAELFtQx9Bw5YW75SnFOf8o7YfJvPwvk_g35POyHl32-_EDVfV6o4ucfvBtaipxp-sDfebqjR4GVnDylF_8gFi2AWFpOVh_zLi77D0QjVckH1vowilmd07hBptguIB_J-PBDlQxanmupL05EMFoj6MGoqoBKmS6Qc-ReP3EW2whbpIcb88NaQf80K9fOPEaKplF4JFV64C_JHqiW0EUZG06ZzCOVZyBrNFKoeh2L6U9feIqhAPQn_mHVHb_8dvo5Hl310W3Kv7Bu6FiTJJwoHp-pauVwGd4ILWB6sRZRbInOPr4GI2K0bQ8fwNJx7jwrNnmp2wrr811mQEjmts8rAMxKRI4W1SHC5rEK0U-C3wywVjIc2PM2fu1-EgksTkOUgRuZ5YKHa5KPo78t8EFBT0KJvURTlKsVItEs_6PM9TTOhv_gchTiB8szWiOhFGtCKWtajhmhX4eFXZPAkBcFjAdTZu-JcF7QLHt_1J-Eh460aIJLo2HdKBBWx0H9ECyKrsMioeDg8x4q9qjZXGiOywq_RESogEzYjUPoNDCj2HT80qeKnzm2vQ7ijRKsFo6WH1HsCbpHa5HboXAx7xcla0vE32698EAHEWAJuSh8Dr-wvEeXwKe7oNFH5_iVqS_QWsNCf0GMzs2wwb5Ip_MLYdKDyWY7loQxVPfC4lLbvlICac5DAhUQ90VmFutK_O3mscfDcaWKSbLxNQDvwkRVc7GiKnzPmc5z_Je-qekybuONMVvoNxNLDI8QKLKpYEt8THT-rb20ff6m8vzQ2kc1NpGES0XssUuVj_d-J44lrjDAQ4Rh7h-9w9G7r3f571L5mZrMqpzb0Zo1XZufEDrZp4X1-Vfm_MZIZWIfUvVeoVqS2Z6tl-bmY7I-ZIQ_trJuzryd44vB11zMdBA4XFDQF04I0QAhhy-jfcOqZBUZrOuZPy9ywIRYi6qUfaS5XHXSH6-DVxmtQp_thXcQGL44J7fzt_5l1RIheLJoV3gX_CEnP-R2waZ0aGRNU1UWzrbMX9CROA&reqid=SHwsFqvvbJiJGfB8&type=CLICK&pos=42,-22%,5.0,dongu,470000.0
238,"Bộ quần áo sát nách mặc nhà cho nữ vải lanh siêu mát, nhún bèo cách điệu",145000,https://tiki.vn/bo-quan-ao-sat-nach-mac-nha-cho-nu-vai-lanh-sieu-mat-nhun-beo-cach-dieu-p135002738.html?spid=135002888,-50%,3.0,dongu,435000.0
239,Set Váy Ngủ Live-action Cosplay Bikini Sexy Gợi Cảm Độc Lạ Freebra Freesize (40~60kg),169000,https://tiki.vn/set-vay-ngu-live-action-cosplay-bikini-sexy-goi-cam-doc-la-freebra-freesize-40-60kg-p273356753.html?spid=273356754,-20%,3.0,dongu,507000.0
240,"Váy ngủ nữ, váy lụa 2 dây VILADY - V127 dáng suông màu xanh rêu, chất liệu lụa Pháp cao cấp ( lụa latin)",199000,https://tiki.vn/vay-ngu-nu-vilady-lua-phap-cao-cap-mau-xanh-reu-dang-suong-v127-p173015547.html?spid=173015549,,203.0,dongu,40397000.0
241,Set Váy Ngủ Live-action Cosplay Bikini Sexy Gợi Cảm Độc Lạ Freebra Freesize (40~60kg),169000,https://tka.tiki.vn/pixel/pixel?data=z8DTrYjzIAO3F_x_m6TzWgPWfhTYa8wSvzdRqOfso1YiY6hvRW8yVVPmmJAsS_NoccRr-3ryy67cIbmQsAL7fEZhtkVioDEu6lJ160Qi2CKrJ_sOWnA232qNdrmf3q0sAG9037tHDbTZD7jsap6us51-F6jZaxRxmHJkjqArDN1-IErTZAy6dycwof9Hs9VkpFQEbmhp0jYq5zyA_wjOOp8Xd0AHABhHdOxLLAQcbHfCAW9aeqZV_tLKHrQLxMVg0odEoFtpIqneSfGGfXucbz9kaYaG8GK0LyLkKYHIPN5iYfSRG5qax9OT_AsNGNCwgmF1WUV-efR_PvYFRL4gAK1i4mjDXacfmhJXh2SPPdhV8t49-ARUrmloJZyZWvoR1TtKonR5VoAL1fNGACcBbsNuaJP98bTCI0WN9zcVbzwAcnZmCydVZc0LAN54HUNC89OAYke2rxG32MrnUghmrqfAHrK6U8eWOoBXOKX70qLVqiNmbykig_55Ak2FaYPh_4fRnWyqJo0CTwcXbHJ3iUCsubY9TUnuAkhPeOQnYc7ghtqCBEOeKbf_IDQEFGehT8WSW1fhEOat00_lR6pcuPEeNjGWQmiE7-oH5aXA0iDyFUh5TCOct9RVKT3ZhPCs39xH5pWaKx9MyGQMlFUR8qPr7ZgJ4f4DZ6aUn_Vz9SOBmNJ6GG6xrhzGS1KzpoGrfVF5dgZBmwMkqpNXXCeFM_ZgM7xBXKkCssShvUTdqaiL4ncEeSbv2v0cVKYEviV6Ihk-zSZLvXFIyk0z0VuVzBwK4Hh7YFs_siFKaks7yzgW2Wvq_aYqJB_Xg5zfYk5PGGcskSBwlB_im-u7xNLRld5kcyQ9Ur92NXWVWvpIAPATDiraBaZUEQlV6JFujdJtUrDzH_6lCgG0Q-SQQtlA07Ynb7xwCSfoaM4N-uIf12e0FZogLOM_FWtz2ThXN7Kq8adqumCY_6JcMFKTFACsA-FAeXyFGgdl42yLSl17LrJ-3d-olQcRsN_kkdrbf7zEeGcbvNoifUZ9t7X75i2afb4XqMQ6UvALlKKlmwotL6C8NbZ7mDbbuwbQXUBl_DXHl_DSZWkU2UAGX8zLVoZwXOCAQHQ11bpZskmKlgDRV-HKmVLCkTpSlH2_wYJfjOhwibfYKiAbUsFibXswKcccSfBO8XndHeGgb-xQiep-Az7nDPxFeRE0eluImKI&reqid=SHwsFqvvbJiJGfB8&type=CLICK&pos=51,,3.0,dongu,507000.0
242,Set Váy Ngủ Dây Nơ V1 Cosplay Bikini Sexy Gợi Cảm Độc Lạ Freebra Freesize (40~60kg),189000,https://tka.tiki.vn/pixel/pixel?data=JIl4C1zh1aB6VT1ISD10_11A6YEhz63p8xIzIdHghlBu8x9aavqoWpUpSFqKxJckn26GBIw0dAGPcZ_XFFwmLdGdh7I72AN7FueWMC3Mc9hD4RRrFOo41PQDMoMnXBC4btNKR7T0WUMSFrqAY7M9CDB8Xjn5V0J_FfaBpwWZy7a4u_0BLMWHf1hX39uyCE-ZNqc0cFYPtRfiGEsduUEhDSeGT-Lt3-gQe_RVXDGIoJD2bOkAiEmC6OqDsfabdPMKenhpwcnKEKWcjfE3JbsOhiburBzjzsApJShYXMPazKR1iwRaEuF9n_GuM3Ef9AZ6T9F_8fMceud5KsDNtPg_fJG98gutjHikWBS61aVle41PGSlkXvypi_yYS0YbnO3MDKV4JyfXy9blYV0ZW-rZFmzN2zHs9wr8n_5B8CLpuW8G4sSbi6LhrTpSNV5N9f04oXxulx92SYTAEe2kgpXcgUSS8LNZtS1RQqLiM7bmzLIBIEx9mAjE_GGK7157o29HdlxScP_-hVC4CksyCLuPbrVvAm7YB7XcuhmvgtuGXRgz_K_-KGlq_d5uucYaeQwIAOJWXepHlNccmy5OgXagI8cmB3k96897XWzvLSzW3kuviBEq7fAPLDNpnLoXFRvVqXElIictbZP0Z8sKEFxnINk6u212w7tzgM0e3FCnd2o2eWyVH4JY7qEY---1jekExnT4vuLeT7GPMeXAYO8vaDaZGIAsGjU-Rd28-DCuIBDNRro8hqxVLaW5D4ZyfXR45hR5d8kr0hYeffzHywmjYCex9Ikn_70dy7PVPu1AeL5qj9zdsxsFVzja_fbjbL9hQpGuVmtt-XDmL_bfaKaAtdYGx7z0glYQuewCklzwW_WJw_IEt5W5RAQB6p_X37YuGAmVdWgMPXIU4mbwNqQkTLNhn2WkwIQG8dFl4NnEy7pvK5lYdRaiMYkrdcxnvJbkNFXFMoC_K-ENmvygxVWz3APAUUKfqJavipnIgHluAUm54MimK1IQ9cZLcoQox8uhJ7J27NaQZnjQM37f9Au4c7v8OLIVPAtWKVUNvyqhTRGfJNhepYjSFRnaxjhDZLpoHF2OK9U3pzOrF5RROCodwaBQ3lzHcIJ2ulmu6VzbA03zj59z_eSff8WoXMtUbl-x05YkU2hGCUPX_6YkW2DWT4-ajUA_lp5mvuzZYUfA-s6vg9YTG8PDOgWj&reqid=SHwsFqvvbJiJGfB8&type=CLICK&pos=52,-50%,1.0,dongu,189000.0
243,Bộ đồ trung niên cho bà cho mẹ - đồ bộ thun lạnh-quần áo tặng mẹ,109000,https://tiki.vn/bo-do-trung-nien-cho-ba-cho-me-do-bo-thun-lanh-quan-ao-tang-me-p115769409.html?spid=115769462,-45%,45.0,dongu,4905000.0
244,Váy ngủ lụa xẻ người dây buộc hông,99000,https://tiki.vn/vay-ngu-lua-xe-nguoi-day-buoc-hong-p72606150.html?spid=102142031,-48%,51.0,dongu,5049000.0
245,Set Váy Ngủ Lưới Mỏng Ren Áo Choàng Ngủ Sexy 3 Chi Tiết Cao Cấp,179000,https://tiki.vn/set-vay-ngu-luoi-mong-ren-ao-choang-ngu-sexy-3-chi-tiet-cao-cap-p273261902.html?spid=53705156,-50%,80.0,dongu,14320000.0
246,"Đồ Bộ Nữ, Đồ Bộ Nữ Mặc Nhà, Đồ Bộ Nữ Gấm Xốp In Họa Tiết Siêu Sang, Đồ Bộ Ngủ Nữ, Đồ Bộ Nữ Dài, Đồ Ngủ Nữ Thoáng Mát Thương Hiệu Baw MM14 ( hình thật shop tự chụp)",159000,https://tiki.vn/do-bo-nu-do-bo-nu-mac-nha-do-bo-nu-gam-xop-in-hoa-tiet-sieu-sang-do-bo-ngu-nu-do-bo-nu-dai-do-ngu-nu-thoang-mat-thuong-hieu-baw-mm14-hinh-that-shop-tu-chup-p271124127.html?spid=271124141,,6.0,dongu,954000.0
247,"Váy đầm ngủ nữ mặc nhà, áo ngủ cúc đóng mở có túi chất liệu Cotton lụa tự nhiên thoáng mát mã VAV0389",169000,https://tiki.vn/vay-dam-ngu-nu-mac-nha-ao-ngu-cuc-dong-mo-co-tui-chat-lieu-cotton-lua-tu-nhien-thoang-mat-ma-vav0389-p249579279.html?spid=249579289,,2.0,dongu,338000.0
248,Đồ ngủ Kimono hồng hoa anh đào Nhật Bản,215000,https://tiki.vn/do-ngu-kimono-hong-hoa-anh-dao-nhat-ban-p68962248.html?spid=68962249,,3.0,dongu,645000.0
249,Đồ bộ ngủ nữ lụa 2 dây mặc nhà sexy quyến rũ vải satin cao cấp thoáng mát 4Lova,129000,https://tiki.vn/do-bo-ngu-nu-lua-2-day-mac-nha-sexy-quyen-ru-vai-satin-cao-cap-thoang-mat-4lova-p198350975.html?spid=198351064,,12.0,dongu,1548000.0
250,"Đồ bộ nữ,đồ ngủ,đồ bộ mặc nhà lửng vải lụa họa tiết caro siêu cưng",135450,https://tiki.vn/do-bo-nu-mac-nha-lung-vai-lua-hoa-tiet-caro-sieu-cung-p115810478.html?spid=115810600,,8.0,dongu,1083600.0
251,"Đồ Bộ Nữ, Đồ Bộ Nữ Mặc Nhà Quần, Đồ Bộ Nữ Vải Gân Quảng Châu Dày Dặn, Đồ Bộ Ngủ Nữ, Đồ Bộ Nữ Dài Siêu Hot Thương Hiệu Baw M27 ( hình thật shop tự chụp)",130000,https://tiki.vn/do-bo-nu-do-bo-nu-mac-nha-quan-do-bo-nu-vai-gan-quang-chau-day-dan-do-bo-ngu-nu-do-bo-nu-dai-sieu-hot-thuong-hieu-baw-m27-hinh-that-shop-tu-chup-p272103939.html?spid=272103941,,10.0,dongu,1300000.0
252,Bộ đồ ngủ kimono lụa cao cấp - Màu đỏ,129000,https://tiki.vn/bo-do-ngu-kimono-lua-cao-cap-mau-do-p68962580.html?spid=68962581,,3.0,dongu,387000.0
253,"Bộ đồ ngủ nữ cao cấp mặc không nhăn chất vải Tencel lụa tự nhiên, bộ đồ mặc nhà nữ phối ren quần dài mã VABD0196",249000,https://tiki.vn/bo-do-ngu-nu-cao-cap-mac-khong-nhan-chat-vai-tencel-lua-tu-nhien-bo-do-mac-nha-nu-phoi-ren-quan-dai-ma-vabd0196-p155789875.html?spid=155790147,,2.0,dongu,498000.0
254,Combo cosplay y tá 2023,85000,https://tiki.vn/combo-cosplay-y-ta-2023-p272044474.html?spid=272044504,,1.0,dongu,85000.0
255,Đồ bộ nữ mặc nhà chất đũi bộ áo sát nách quần lửng hoạ tiết caro dễ thương,150000,https://tiki.vn/do-bo-nu-mac-nha-chat-dui-bo-ao-sat-nach-quan-lung-hoa-tiet-caro-de-thuong-p196394949.html?spid=196394959,,1.0,dongu,150000.0
256,Set đồ cosplay hầu gái thiết kế bikini 1 mảnh phối ren sexy - SMS019,130000,https://tiki.vn/set-do-cosplay-hau-gai-thiet-ke-bikini-1-manh-phoi-ren-sexy-sms019-p271531980.html?spid=271532004,,2.0,dongu,260000.0
257,Set Váy Ngủ Ren Áo Choàng Ngủ Sexy 3 Chi Tiết,209000,https://tiki.vn/set-vay-ngu-ren-ao-choang-ngu-sexy-3-chi-tiet-p54046230.html?spid=54046231,,46.0,dongu,9614000.0
258,"BỘ MẶC NHÀ HÌNH TRÁI CÂY - BỘ NGỦ HỌA TIẾT HOA QUẢ, BỘ NGỦ NGẮN TAY HÌNH TRÁI BƠ MẶC MÙA HÈ, Bộ đồ ngủ thun nam nữ cộc tay QUẢ BƠ, đồ bộ in trái bơ, bộ đồ quả bơ, ĐỒ BỘ MẶC NHÀ FORM RỘNG / BỘ QUẦN ÁO NỮ / ĐỒ BỘ NỮ THUN COTTON",99000,https://tiki.vn/bo-mac-nha-hinh-trai-cay-bo-ngu-hoa-tiet-hoa-qua-bo-ngu-ngan-tay-hinh-trai-bo-mac-mua-he-bo-do-ngu-thun-nam-nu-coc-tay-qua-bo-do-bo-in-trai-bo-bo-do-qua-bo-do-bo-mac-nha-form-rong-bo-quan-ao-nu-do-bo-nu-thun-cotton-p97998034.html?spid=97998038,,56.0,dongu,5544000.0
259,"đồ bộ mặc nhà lụa hàn cực đẹp, chất lụa",185625,https://tiki.vn/do-bo-mac-nha-lua-han-cuc-dep-p178009367.html?spid=178009378,,3.0,dongu,556875.0
260,đồ bộ mặc nhà chất lụa hàn,225000,https://tiki.vn/do-bo-mac-nha-chat-lua-han-p165984354.html?spid=165984405,,7.0,dongu,1575000.0
261,"[HCM] (63-75kg, P1) Đồ bộ tole lửng bigsize. Đồ bộ bigsize tole lửng, Đồ bộ lửng tole bigsize. Đồ bộ bigsize lửng tole. Đồ bộ bigsize lanh lửng. Đồ bộ lửng lanh bigsize. tolelungbigsize1",129000,https://tiki.vn/63-75kg-lien-he-chon-them-mau-do-bo-tole-lung-bigsize-do-bo-bigsize-tole-lung-do-bo-lung-tole-bigsize-do-bo-bigsize-lung-tole-do-bo-bigsize-lanh-lung-do-bo-lung-lanh-bigsize-tolelungbigsize1-p100511593.html?spid=100511605,,6.0,dongu,774000.0
262,Đồ Bộ Lụa Mới -Tay Lửng Cánh Dơi Quần Dài (Phần 1),196800,https://tiki.vn/do-bo-lua-moi-tay-lung-canh-doi-quan-dai-phan-1-p120794085.html?spid=120794107,,1.0,dongu,196800.0
263,Váy ngủ 2 dây satin sexy kèm quần chip,125000,https://tiki.vn/vay-ngu-2-day-satin-sexy-kem-quan-chip-p68962304.html?spid=68962313,,6.0,dongu,750000.0
264,"Đồ bộ ngủ nữ SBORG bộ ngủ lụa latin cao cấp tay tiên mềm mịn phối bèo họa tiết bò sữa cute đáng yêu bigsize 45-60kg quà tặng Vợ, thoải mái mặc nhà, ngủ hoặc ra ngoài",199500,https://tiki.vn/do-bo-ngu-nu-sborg-bo-ngu-lua-latin-cao-cap-tay-tien-mem-min-phoi-beo-hoa-tiet-bo-sua-cute-dang-yeu-bigsize-45-60kg-qua-tang-vo-thoai-mai-mac-nha-ngu-hoac-ra-ngoai-p117108070.html?spid=117108090,,3.0,dongu,598500.0
265,"Bodysuit xẻ đáy siêu sexy (cao dưới m58, nặng dưới 48kg) GIAO HOẢ TỐC HCM",64000,https://tiki.vn/bodysuit-xe-day-sieu-sexy-cao-duoi-m58-nang-duoi-48kg-giao-hoa-toc-hcm-p145178968.html?spid=145178996,,1.0,dongu,64000.0
266,"Đồ ngủ nữ 2 dây mặc nhà dễ thương VILADY - B122 kiểu áo hai dây quần cộc màu hồng ruốc, chất liệu Lụa Pháp (lụa latin) mềm mát",179000,https://tiki.vn/do-ngu-nu-2-day-mac-nha-de-thuong-vilady-chat-lieu-lua-phap-mem-mat-ao-hai-day-quan-coc-mau-hong-ruoc-de-thuong-b122-p172667744.html?spid=172667748,-28%,30.0,dongu,5370000.0
