title,price,link_item,index,discount,sales,category
Áo Thun Polo Tay Dài Valentino Creations - VLST-22002-B-BL2,5.590.000₫,https://tiki.vn/ao-thun-polo-tay-dai-valentino-creations-vlst-22002-b-bl2-p273295154.html?spid=273295160,1,-50%,,aothun
Áo phông unisex nam nữ tay lỡ thun form rộng teen cổ tròn oversize cotton giá rẻ basic đen trắng tee pull TOM,45.000₫,https://tiki.vn/ao-phong-unisex-nam-nu-tay-lo-thun-form-rong-teen-co-tron-oversize-cotton-gia-re-basic-den-trang-tee-pull-tom-p117921773.html?spid=188837678,2,,Đã bán 17,aothun
Áo thun nam cộc tay trung niên-A2102,80.000₫,https://tiki.vn/ao-thun-nam-coc-tay-trung-nien-a2102-p260222494.html?spid=260222504,3,-11%,Đã bán 7,aothun
"Áo thun nam thể thao trơn, cổ tròn đẹp, trẻ trung, mặc thoáng mát, thấm hút tốt",69.000₫,https://tiki.vn/ao-thun-nam-the-thao-tron-co-tron-dep-tre-trung-mac-thoang-mat-tham-hut-tot-p72305922.html?spid=72305944,4,-45%,Đã bán 11,aothun
,,https://tiki.vn/ao-thun-polo-viet-nam-cao-cap-co-co-ngan-tay-vai-ca-sau-mat-khong-bong-xu-tre-trung-sang-trong-nang-dong-gucatin-p115560404.html?spid=115561901,5,,,aothun
Áo thun nam cổ tròn cao cấp lịch lãm in ngực-TSSTORE95,99.000₫,https://tiki.vn/ao-thun-nam-co-tron-cao-cap-lich-lam-in-nguc-tsstore95-p154998831.html?spid=154998886,6,-45%,Đã bán 4,aothun
Áo polo nam ADINO màu xanh đen vải cotton co giãn thiết kế basic trẻ trung PL42,159.000₫,https://tiki.vn/ao-polo-nam-adino-mau-xanh-den-vai-cotton-co-gian-thiet-ke-basic-tre-trung-pl42-p118985353.html?spid=118985361,7,-50%,Đã bán 14,aothun
Áo phông nam ngắn tay cao cấp đẹp cổ tròn chất vải cotton co giãn 4 chiều thoáng mát ZAVAS Z14,289.000₫,https://tiki.vn/ao-phong-nam-ngan-tay-cao-cap-dep-co-tron-chat-vai-cotton-co-gian-4-chieu-thoang-mat-zavas--z14-p136792823.html?spid=136792831,8,,Đã bán 179,aothun
đồ bộ dài tay cổ tàu nam trung niên cho bố,299.000,https://tiki.vn/do-bo-dai-tay-co-tau-nam-trung-nien-cho-bo-p271916649.html?spid=271916661,9,-10%,Đã bán 3,aothun
,,https://tiki.vn/ao-thun-nam-nu-vonesa-thoi-trang-cuc-chat-cotton-mem-min-ca-tinh-du-size-25-84-kg-a2-p115827824.html?spid=115827826,10,,,aothun
Áo Ba Lỗ Cổ Vuông Nam SZone,50.000₫,https://tiki.vn/ao-ba-lo-co-vuong-nam-szone-p55664211.html?spid=55664223,11,,Đã bán 66,aothun
"Áo polo thời trang nam, áo thun có cổ, thiết kế kiểu dáng trendy, dễ dàng phối đồ - FORMEN SHOP - FMPS202",350.000,https://tiki.vn/ao-polo-thoi-trang-nam-ao-thun-co-co-thiet-ke-kieu-dang-trendy-de-dang-phoi-do-formen-shop-fmps202-p205990136.html?spid=205990148,12,,,aothun
,,https://tiki.vn/ao-thun-nam-fasvin-vai-coolmax-mem-mat-co-gian-chat-dep-hang-nha-may-ts23572-hn-p253180440.html?spid=253180518,13,,,aothun
Mã G86. Áo thun cặp đôi tình yêu siêu đẹp. Áo phông thoát nhiệt GOKING hàng hiệu cao cấp,99.000₫,https://tiki.vn/ma-g86-ao-thun-cap-doi-tinh-yeu-sieu-dep-ao-phong-thoat-nhiet-goking-hang-hieu-cao-cap-p205992881.html?spid=205993075,14,,Đã bán 1,aothun
"Xe đạp, mã G85. Áo thun nam nữ in siêu đẹp. Áo phông thoát nhiệt GOKING hàng hiệu cao cấp",99.000₫,https://tiki.vn/xe-dap-ma-g85-ao-thun-nam-nu-in-sieu-dep-ao-phong-thoat-nhiet-goking-hang-hieu-cao-cap-p205993247.html?spid=205993802,15,,Đã bán 1,aothun
Áo Thun Nam Trung Niên Có Túi Loại Trơn Cổ Bẻ From Rộng Tay Lỡ An Phú DT034 Đủ Màu Size Từ 48-80kg,88.000₫,https://tiki.vn/ao-thun-nam-trung-nien-co-tui-loai-tron-co-be-from-rong-tay-lo-an-phu-dt034-du-mau-size-tu-48-80kg-p157944623.html?spid=157944642,16,,Đã bán 15,aothun
Quần ống rộng unisex Local Brand PARACHUTE CARGO PANTS chuẩn form tôn dáng - Thương hiệu SWE VN,605.000,https://tiki.vn/quan-ong-rong-unisex-local-brand-parachute-cargo-pants-chuan-form-ton-dang-thuong-hieu-swe-vn-p248267769.html?spid=248267771,17,,,aothun
,,https://tiki.vn/ma-g102-ao-thun-nam-nu-in-dau-ho-sieu-dep-ao-phong-thoat-nhiet-goking-hang-hieu-cao-cap-p172281846.html?spid=252032971,18,,,aothun
Áo Cộc tay nam tập gym body XXX nhập khẩu/Dễ phối/Tôn dáng,255.000₫,https://tiki.vn/ao-coc-tay-nam-tap-gym-body-xxx-nhap-khau-de-phoi-ton-dang-p272302162.html?spid=272302206,19,,,aothun
Áo thun nam Polo NOVELTY trơn màu cổ bo 210127N,417.000₫,https://tiki.vn/ao-thun-nam-polo-novelty-tron-mau-co-bo-210127n-p95293206.html?spid=95293208,20,,Đã bán 7,aothun
"Áo One Piece Luffy ATT-04, Áo thun Anime Manga One Piece Monkey D. Luffy Unisex Nam Nữ",40.000₫,https://tiki.vn/ao-one-piece-luffy-att-04-ao-thun-anime-manga-one-piece-monkey-d-luffy-unisex-nam-nu-p74540060.html?spid=79662603,21,,Đã bán 63,aothun
Dico Áo thun Lil Dino T-shirt,390.000₫,https://tiki.vn/dico-ao-thun-lil-dino-green-t-shirt-p224753435.html?spid=181568151,22,,Đã bán 6,aothun
ÁO BA LỖ NAM MẶC HÈ THOÁNG MÁT,139.000₫,https://tiki.vn/ao-ba-lo-nam-mac-he-thoang-mat-p163030376.html?spid=163030388,23,,Đã bán 4,aothun
"Áo Thun nam mẫu mới logo trước ngực, combo 3 áo - ĐB3QC17",279.000₫,https://tiki.vn/ao-thun-nam-mau-moi-logo-truo-c-ngu-c-combo-3-a-o-db3qc17-p22610896.html?spid=23468381,24,,Đã bán 4,aothun
Áo phông Đoàn Thanh niên Việt Nam chất đẹp form chuẩn,100.000,https://tiki.vn/ao-phong-doan-thanh-nien-viet-nam-chat-dep-form-chuan-p207269557.html?spid=207269593,25,,,aothun
,,https://tiki.vn/owen-ao-polo-nam-owen-chat-cotton-mau-xanh-navy-231362-ao-thun-ngan-tay-co-co-nam-p247511384.html?spid=247511392,26,,,aothun
Áo polo nam cổ bẻ 4 màu hình gấu phối viền cổ cá tính chất cá sấu cao cấp APL03 Micado,55.000₫,https://tiki.vn/ao-polo-nam-co-be-4-mau-hinh-gau-phoi-vien-co-ca-tinh-chat-ca-sau-cao-cap-apl03-micado-p169330109.html?spid=169330133,27,,Đã bán 2,aothun
Áo thun lót trắng nam loại đẹp cổ tròn,30.000₫,https://tiki.vn/ao-thun-lot-trang-nam-loai-dep-p217146525.html?spid=217146545,28,,Đã bán 25,aothun
Áo thun dài tay nam cổ bẻ màu xanh đen ALIGRO chất liệu Cotton cao cấp mềm nhẹ ALGAPD004,205.000₫,https://tiki.vn/ao-phong-dai-tay-algapd004-ol-p146632694.html?spid=146632696,29,,,aothun
Áo thun Polo lạnh trơn nam bigsize 80 - 140kg - trơn,175.000,https://tiki.vn/ao-thun-polo-lanh-tron-nam-bigsize-80-140kg-tron-p197223985.html?spid=197224508,30,,Đã bán 6,aothun
,,https://tiki.vn/ao-thun-ca-sau-soc-cao-cap-viet-phap-form-suong-chat-lieu-cotton-co-dan-va-tham-hut-mo-hoi-tot-8803-p272940872.html?spid=272940874,31,,,aothun
Áo Polo Nam Trơn Ngắn Tay Liquid Touch Polo Giordano 01012291,666.000₫,https://tiki.vn/ao-polo-nam-tron-ngan-tay-liquid-touch-polo-giordano-01012291-p261966135.html?spid=261966165,32,,,aothun
"Combo 2 Áo thun trơn basic, form unisex cho nam nữ. Áo phông hàng hiệu Goking, quà tặng cao cấp cho gia đình, cặp đôi, lớp nhóm, doanh nghiệp, người nước ngoài",259.000₫,https://tiki.vn/combo-2-ao-thun-nam-thoat-nhiet-nhat-ban-goking-p10919287.html?spid=10919327,33,,Đã bán 158,aothun
combo 3 thun 3 lỗ nam đẹp loại cotton loại 1 mềm mịn mát hút mồ hôi cực tốt,132.000₫,https://tiki.vn/combo-3-thun-3-lo-nam-dep-loai-cotton-loai-1-mem-min-mat-hut-mo-hoi-cuc-tot-p76705070.html?spid=93924853,34,,Đã bán 16,aothun
"Áo tanktop tập gym nam DO GYM SHOP chất thun cotton thoáng mát khi chơi thể thao, mặc nhà",149.000,https://tiki.vn/ao-tanktop-tap-gym-nam-do-gym-shop-chat-thun-cotton-thoang-mat-khi-choi-the-thao-mac-nha-p270252562.html?spid=270252574,35,,,aothun
,,https://tiki.vn/ao-thun-free-fire-co-tron-mau-trang-logo-rank-huyen-thoai-cuc-chat-p71344731.html?spid=71344733,36,,,aothun
ÁO THUN UNISEX NAM NỮ saigonese tôi la người sài gòn,155.000₫,https://tiki.vn/ao-thun-unisex-nam-nu-saigonese-toi-la-nguoi-sai-gon-p248670637.html?spid=248670796,37,,,aothun
Áo Thun Nam Cổ Polo Phối Màu Viền VTC,125.000₫,https://tiki.vn/ao-thun-nam-co-polo-phoi-mau-vien-vtc-p105951051.html?spid=105951842,38,,Đã bán 8,aothun
"Khi 2 ta về chung 1 nhà, mã LV1. Áo thun cặp đôi tình yêu siêu đẹp. Áo phông chụp ảnh cưới",99.000₫,https://tiki.vn/khi-2-ta-ve-chung-1-nha-ma-lv1-ao-thun-cap-doi-tinh-yeu-sieu-dep-ao-phong-chup-anh-cuoi-p205991477.html?spid=205991499,39,,,aothun
"Siêu giảm giá. Áo thun wash Nhật Bản thương hiệu GOKING không đụng hàng cho nam nữ, áo cặp đôi siêu đẹp",99.000₫,https://tiki.vn/ao-thun-wash-nhat-ban-thuong-hieu-goking-khong-dung-hang-cho-nam-nu-ao-cap-doi-sieu-dep-p61393910.html?spid=61393912,40,,,aothun
