title,price,link_item,index,discount,sales,brand
"Áo Bomber Nỉ LB Logo In Phối Màu Unisex Nam Nữ️, Áo Khoác Nỉ Bông In Đẹp LB Hot, Áo khoác bomber nữ in logo Bluck LB, chất nỉ dày dặn form rộng cá tính, Áo Khoác Bomber trắng cho nam nữ",100.000₫,https://tiki.vn/ao-bomber-ni-lb-logo-in-phoi-mau-unisex-nam-nu-ao-khoac-ni-bong-in-dep-lb-hot-p166412612.html?spid=166412619,1,,,NIU24
"Áo Khoác Bomber Nhung Tăm 2 Lớp Jacket Varsity Logo Thêu G Form rộng Unisex Nam Nữ Couple, Áo Khóac Form Rộng Nhung Tâm Jacket Varsity Graffiti V4, Áo Khóac Nhung Tâm Jacket Varsity Form Rộng Gonz",162.000₫,https://tiki.vn/ao-khoac-bomber-nhung-tam-2-lop-jacket-varsity-logo-theu-g-form-rong-unisex-nam-nu-couple-p166412545.html?spid=166412552,2,,,NIU24
"Áo Hoodie Tay Bồng In Audience Chất Đẹp Như Ảnh, Áo Khoác Nỉ Bông Tay Phồng In Sắc Nét Unisex Nam Nữ, áo khoác nỉ hoodie Form rộng ulzzang",105.000₫,https://tiki.vn/ao-hoodie-tay-bong-in-audience-chat-dep-nhu-anhao-khoac-ni-bong-tay-phong-in-sac-net-unisex-nam-nu-p140896636.html?spid=140896654,3,,,NIU24
Áo Hoodie Nam Nữ Phối Thân Thêu Chữ COLLEC 2023 Nón Rộng 2 lớp dày dặn nón đóng nút mẫu mới,170.000,https://tiki.vn/ao-hoodie-nam-nu-phoi-than-theu-chu-collec-2023-non-rong-2-lop-day-dan-non-dong-nut-mau-moi-p271652650.html?spid=271652658,4,,,NIU24
,,https://tiki.vn/ao-khoac-du-gio-2-lop-nam-nu-7zia-phoi-do-xanh-form-rong-phoi-mau-unisex-cuc-xin-gia-tot-p262301597.html?spid=262301603,5,,,NIU24
"Áo khoác nỉ nam form rộng đẹp in hinh chợ BẾN THÀNH sài gòn DOMINI mẫu mới, áo khoác hoodie chống nắng",107.000₫,https://tiki.vn/ao-khoac-ni-nam-form-rong-dep-in-hinh-cho-ben-thanh-sai-gon-domini-mau-moi-ao-khoac-hoodie-chong-nang-p262671795.html?spid=262671803,6,,,NIU24
Áo khoác chống nắng nữ len gân QC dây kéo cao nón to dây to tay xỏ ngón,188.000₫,https://tiki.vn/ao-khoac-chong-nang-nu-len-gan-qc-day-keo-cao-non-to-day-to-tay-xo-ngon-p272230672.html?spid=272230681,7,,,NIU24
"Áo HOODIE in ""EIGHT"" ( ảnh thật tại shop) / form unisex",160.000₫,https://tiki.vn/ao-hoodie-in-eight-anh-that-tai-shop-form-unisex-p270103245.html?spid=270103253,8,,,NIU24
Áo Khoác Nữ Len Gân Phối Tay Dây To Form Lững Đi Nắng Nón To Chất Vải Thoáng Mát,168.000,https://tiki.vn/ao-khoac-nu-len-gan-phoi-tay-day-to-form-lung-di-nang-non-to-chat-vai-thoang-mat-p271313905.html?spid=271313911,9,,,NIU24
,,https://tiki.vn/ao-khoac-hoodie-from-rong-ao-khoac-ni-ngoai-chong-nang-co-lop-trong-adiman-hinh-gau-p192650390.html?spid=192650398,10,,,NIU24
ÁO KHOÁC DÙ BÓNG CHÀY NỮ TM GYM 21 CHẤT VẢI DÀY FORM CHUẨN Y HÌNH KIỂU DÁNG BOMBER,103.000₫,https://tiki.vn/ao-khoac-du-bong-chay-nu-tm-gym-21-chat-vai-day-form-chuan-y-hinh-kieu-dang-bomber-wedo-p178584666.html?spid=178584677,11,,,NIU24
Áo Khoác Hoodie THISIS Vải Nỉ Kiêu Zip Kéo Phối Chữ Thêu Kèm Nón Rộng Phong Cách Ulzzang Hàn Quốc Hot Trend Mới,102.000,https://tiki.vn/ao-khoac-hoodie-thisis-vai-ni-kieu-zip-keo-phoi-chu-theu-kem-non-rong-phong-cach-ulzzang-han-quoc-hot-trend-moi-p185646263.html?spid=185646282,12,,,NIU24
,,https://tiki.vn/ao-khoac-bomber-unisex-theu-g-mat-cuoi-chat-nhung-tam-2-lop-theu-truoc-sau-p187511411.html?spid=187511417,13,,,NIU24
Áo Khoác Bomber Missout Form Rộng Unisex Chất Nhung Tăm 1 lớp thoáng mát,149.000₫,https://tiki.vn/ao-khoac-bomber-missout-form-rong-unisex-chat-nhung-tam-1-lop-thoang-mat-p187511343.html?spid=187511354,14,,,NIU24
Áo khoác bomber form rộng chất vải nhung tăm cao cấp thêu logo mây,171.600₫,https://tiki.vn/ao-khoac-bomber-form-rong-chat-vai-nhung-tam-cao-cap-theu-logo-may-p186435993.html?spid=186436006,15,,,NIU24
"Bộ mặc nhà nữ mùa hè sát nách , đồ bộ bigsize chất cotton",109.000₫,https://tiki.vn/bo-mac-nha-nu-mua-he-sat-nach-do-bo-bigsize-chat-cotton-gemmy-house-nst-p185993684.html?spid=185993694,16,,Đã bán 1,NIU24
Áo Khoác Dù Jacket ACOVER đen phối trắng - form rộng unisex GOLDEN DREAM 399,105.000,https://tiki.vn/ao-khoac-du-jacket-acover-den-phoi-trang-form-rong-unisex-golden-dream-399-p182587864.html?spid=182587909,17,,,NIU24
,,https://tiki.vn/ao-khoac-hoodie-form-rong-ao-khoac-unisex-chat-ni-ngoai-cao-cap-bong-boa-12canh-p186436091.html?spid=186436113,18,,,NIU24
Sét Bộ Thể Thao MAYBEE Phong Cách Unisex Form Rộng Nam / Nữ Chất Thun Cotton Kèm Ảnh Thật,109.000₫,https://tiki.vn/set-bo-the-thao-maybee-phong-cach-unisex-form-rong-nam-nu-chat-thun-cotton-kem-anh-that-p185993562.html?spid=185993577,19,,,NIU24
Áo Khoác Form Rộng Hoodie Crop OI OI Vải Nỉ Bông,109.000₫,https://tiki.vn/ao-khoac-form-rong-hoodie-crop-oi-oi-vai-ni-bong-tuni-store-p186352441.html?spid=186352457,20,,,NIU24
Áo Sơ Mi Tay Ngắn BUNNY Chất Kaki Chéo Phong Cách Ulzzang,109.000₫,https://tiki.vn/ao-so-mi-tay-ngan-bunny-chat-kaki-cheo-phong-cach-ulzzang-tuni-store-p186352421.html?spid=186352424,21,,,NIU24
Áo Khoác Jacket Form Rộng ACOVER Vải Dù Trượt Nước Phong Cách Ulzzang,109.000₫,https://tiki.vn/ao-khoac-jacket-form-rong-acover-vai-du-truot-nuoc-phong-cach-ulzzang-tuni-store-p186352463.html?spid=186352469,22,,,NIU24
Áo Hoodie Zip Kéo CBIANA Form Unisex Nam Nữ Nón 2 Lớp Trùm Đầu,106.000₫,https://tiki.vn/ao-hoodie-zip-keo-cbiana-form-unisex-nam-nu-non-2-lop-trum-dau-p198982977.html?spid=198982978,23,,,NIU24
Áo Khoác Jacket Form Rộng BOB Phong Cách Ulzzang,118.000₫,https://tiki.vn/ao-khoac-jacket-form-rong-bob-phong-cach-ulzzang-84unisex-p198978363.html?spid=198978378,24,,,NIU24
Áo Khoác Jacket Form Rộng CHOOSE Vải Dù Trượt Nước Phong Cách Ulzzang,162.000,https://tiki.vn/ao-khoac-jacket-form-rong-choose-vai-du-truot-nuoc-phong-cach-ulzzang-84unisex-p198978396.html?spid=198978427,25,,,NIU24
,,https://tiki.vn/ao-khoac-du-nu-nam-jacket-2-lop-ao-khoac-gio-ulzzang-bomber-unisex-senava-ak48-p199708173.html?spid=199708180,26,,,NIU24
Áo sweater xương ( 100% ảnh thật ),92.000₫,https://tiki.vn/ao-sweater-xuong-100-anh-that-p204847927.html?spid=204847940,27,,,NIU24
Áo Khoác Nỉ Lót Bông Dây Kéo in chữ GẤU form rộng ullzang Unisex shop,87.000₫,https://tiki.vn/ao-khoac-ni-lot-bong-day-keo-in-chu-adlv-gau-form-rong-ullzang-unisex-shopmap-p205080943.html?spid=205080951,28,,,NIU24
ÁO KHOÁC HOODIE NỈ NGOẠI (Ảnh Thật) họa tiết in số 1989 có 2 màu đen kem,95.000₫,https://tiki.vn/ao-khoac-hoodie-ni-ngoai-anh-that-hoa-tiet-in-so-1989-co-2-mau-den-kem-p197019148.html?spid=197019156,29,,,NIU24
Đồ Bộ Mặc Nhà NGCEST️ Set Bộ Nam Nữ Unisex Siêu Xinh,89.000₫,https://tiki.vn/do-bo-mac-nha-ngcest-set-bo-nam-nu-unisex-sieu-xinh-p195872749.html?spid=195872755,30,,,NIU24
,,https://tiki.vn/ao-khoac-ni-nu-hoa-tiet-tay-chay-soc-2-mau-xam-den-p196070013.html?spid=196070031,31,,,NIU24
Áo khoác sweater form rộng unisex chất vải nỉ ngoại cao cấp siêu đẹp,92.000₫,https://tiki.vn/ao-khoac-sweater-form-rong-unisex-chat-vai-ni-ngoai-cao-cap-sieu-dep-p196189394.html?spid=196189419,32,,,NIU24
Áo khoác hoodie form rộng áo khác nữ form rộng chất nỉ ngoại cao cấp,107.000₫,https://tiki.vn/ao-khoac-hoodie-form-rong-ao-khac-nu-form-rong-chat-ni-ngoai-cao-cap-faradiss-p196189673.html?spid=196189705,33,,,NIU24
Đồ Bộ Mặc Nhà Khủng Long Con ️ Set Bộ Nam Nữ Mặc Nhà Siêu Kute Cho Cặp Đôi,89.000₫,https://tiki.vn/do-bo-mac-nha-khung-long-con-set-bo-nam-nu-mac-nha-sieu-kute-cho-cap-doi-p195450542.html?spid=195450552,34,,,NIU24
Đồ Bộ Mặc Nhà In Gấu ️ Set Bộ Nam Nữ Mặc Nhà Cotton mịn đẹp,89.000₫,https://tiki.vn/do-bo-mac-nha-in-gau-set-bo-nam-nu-mac-nha-cotton-min-dep-p195450544.html?spid=195450556,35,,,NIU24
,,https://tiki.vn/ao-khoac-bomber-du-nu-in-chu-fn-kem-hinh-trai-tim-ulzzang-nam-nu-unisex-form-rong-hottrend-p195454145.html?spid=195454160,36,,,NIU24
ÁO KHOÁC DÙ FORM LỬNG PHỐI MÀU SIÊU XINH DÂY KÉO KIỂU DÁNG THỜI TRANG TIỆN LỢI,98.000₫,https://tiki.vn/ao-khoac-du-form-lung-phoi-mau-sieu-xinh-day-keo-kieu-dang-thoi-trang-tien-loi-p195453971.html?spid=195454060,37,,,NIU24
Áo Khoác Cardigan Unisex - Áo Cardigan form rộng Ulzzang phối Leng Fab,97.000₫,https://tiki.vn/ao-khoac-cardigan-unisex-ao-cardigan-form-rong-ulzzang-phoi-leng-fab-tp264-p195454255.html?spid=195454270,38,,,NIU24
Áo Khoác Bomber Nhung Lì Da Lộn 2 Lớp F6M8 Form Rộng Basic Nam Nữ Unisex Couple,143.000₫,https://tiki.vn/ao-khoac-bomber-nhung-li-da-lon-2-lop-f6m8-form-rong-basic-nam-nu-unisex-couple-tp483-p195454317.html?spid=195454381,39,,,NIU24
"SÉT BỘ THỂ THAO SÁT NÁCH NỮ GẤU HELLO JOY SIÊU XINH , CHẤT COTTON CO GIÃN 4 CHIỀU Mềm Mại",89.000₫,https://tiki.vn/set-bo-the-thao-sat-nach-nu-gau-hello-joy-sieu-xinh-chat-cotton-co-gian-4-chieu-mem-mai-tp21-p195453997.html?spid=195454061,40,,,NIU24
