title,price,link_item,index,discount,sales,brand
Áo Khoác Bomber Varsity Jacket Thêu Chữ R Raysoran Chất Nỉ Bông Mịn Đẹp,92.000₫,https://tiki.vn/ao-khoac-bomber-varsity-jacket-theu-chu-r-raysoran-chat-ni-bong-min-dep-p176405660.html?spid=176405664,1,,,NIU24
Áo Khoác Bomber Unisex 2 Lớp Thêu D Unisex Nam Nữ Chất Nhung Tăm Mịn Đẹp,159.000₫,https://tiki.vn/ao-khoac-bomber-unisex-2-lop-theu-d-unisex-nam-nu-chat-nhung-tam-min-dep-p176405696.html?spid=176405702,2,,,NIU24
Áo Khoác Nỉ Hoodie FE PINK PLANTE MOON Nam Nữ Ulzzang Unisex Dây Kéo Form Rộng 2 MÀU TRẮNG ĐEN SIÊU ĐẸP,90.000₫,https://tiki.vn/freeship-ao-khoac-hoodie-day-keo-form-rong-moon-ulzzang-anh-that-p176292329.html?spid=176292352,3,,,NIU24
Áo Khoác Nhẹ Nữ Tay Phồng Vải Da Lộn 2 Lớp Lót Dù Phối Zip Kéo Phong Cách Nhẹ Nhàng Nữ Tính Siêu Xinh Hot Trend Mới,165.000,https://tiki.vn/ao-khoac-nhe-nu-tay-phong-vai-da-lon-2-lop-lot-du-phoi-zip-keo-phong-cach-nhe-nhang-nu-tinh-sieu-xinh-hot-trend-moi-p176416910.html?spid=176416946,4,,,NIU24
,,https://tiki.vn/ao-khoac-nhung-li-ao-khoac-da-lon-2-lop-day-dan-logo-theu-form-rong-tay-bong-rat-xinh-nhu-anh-p176405667.html?spid=176405670,5,,,NIU24
Áo Khoác Hoodie Kiểu Zip Kéo Logo Thêu Chữ STR Có Nón Rộng Chất thun Nỉ Mềm Thời Trang Hot Trend Mới,102.000₫,https://tiki.vn/ao-khoac-hoodie-kieu-zip-keo-logo-theu-chu-str-co-non-rong-chat-thun-ni-mem-thoi-trang-hot-trend-moi-p176417300.html?spid=176417308,6,,,NIU24
Áo Khoác Bomber Nam Nữ Logo In Chữ G Phối Tay Trắng Chất Nỉ PE Cao Cấp Không Xù Kiểu Dáng Hot Trending,102.000₫,https://tiki.vn/ao-khoac-bomber-nam-nu-logo-in-chu-g-phoi-tay-trang-chat-ni-pe-cao-cap-khong-xu-kieu-dang-hot-trending-p176416211.html?spid=176416242,7,,,NIU24
"Áo Khoác Hoodie Quây Viền Tay Bồng Cao Cấp, Áo Nỉ Nữ Khóa Kéo Kèm Mũ 3 Màu",200.000₫,https://tiki.vn/ao-khoac-hoodie-quay-vien-tay-bong-cao-cap-ao-ni-nu-khoa-keo-kem-mu-3-mau-p176418134.html?spid=176418140,8,,,NIU24
Áo khoác nỉ nam nữ from rộng hình UNCOVERR Áo Khoác Hoodie Zip Day Form Rộng Unisex Vải Nỉ Bông Oversize Ulzaang,89.000₫,https://tiki.vn/ao-khoac-ni-nam-nu-from-rong-hinh-uncoverr-shopmap-p176292636.html?spid=176292651,9,,,NIU24
,,https://tiki.vn/a-o-khoa-c-cardigan-nu-theu-chu-r-cha-t-ni-da-y-da-n-so-c-tay-nam-nu-unisex-p176292824.html?spid=176292838,10,,,NIU24
"ÁO HOODIE NỈ NGOẠI BAO ĐẸP, BAO CHẤT HỌA TIẾT IN CHỮ CỰC ĐẸP 26",97.000₫,https://tiki.vn/free-ship-ao-hoodie-ni-ngoai-bao-dep-bao-chat-ho-a-tie-t-in-chu-cu-c-de-p-26-p176292511.html?spid=176292530,11,,,NIU24
Áo Khoác Bomber Unisex Ulzzang STURDUR Form Rộng Đẹp Nam Nữ,105.000,https://tiki.vn/ao-khoac-bomber-unisex-ulzzang-sturdur-form-rong-dep-nam-nu-p176405446.html?spid=176405449,12,,,NIU24
,,https://tiki.vn/ao-bomber-du-2-lop-ajn-28-unisex-nam-nu-ao-khoac-du-2-lop-chat-dep-in-sac-net-p176405259.html?spid=176405271,13,,,NIU24
Áo Bomber Dù 2 lớp logo Seven Unisex Nam Nữ Couple Hot Áo Khoác Dù bomber S,105.000₫,https://tiki.vn/ao-bomber-du-2-lop-logo-seven-unisex-nam-nu-couple-hot-ao-khoac-du-bomber-s-p176405476.html?spid=176405490,14,,,NIU24
Áo Bomber Dù 2 Lớp Ulzzang Chất Đẹp Các Mẫu Hotrend Áo Khoác Dù Unisex Form Rộng Size Nam Nữ,92.000₫,https://tiki.vn/ao-bomber-du-2-lop-ulzzang-chat-dep-cac-mau-hotrend-ao-khoac-du-unisex-form-rong-size-nam-nu-p176405504.html?spid=176405550,15,,,NIU24
"Áo khoác bomber nữ in logo Bluck LB, chất nỉ dày dặn form rộng cá tính",103.000₫,https://tiki.vn/ao-khoac-bomber-nu-in-logo-bluck-lb-chat-ni-day-dan-form-rong-ca-tinh-wedo-p176417467.html?spid=176417481,16,,,NIU24
Áo khoác loang màu chất PE mềm mịn,167.900,https://tiki.vn/ao-khoac-loang-mau-chat-pe-mem-min-p72746746.html?spid=72746748,17,,,NIU24
,,https://tiki.vn/ao-khoac-nhung-p73462128.html?spid=73462130,18,,,NIU24
Áo khoác thun nỉ ngoại quả trứng,117.900₫,https://tiki.vn/ao-khoac-thun-ni-ngoai-qua-trung-p72746730.html?spid=72746732,19,,Đã bán 1,NIU24
"Quần 1 sọc ống rộng, quần 1 sọc, quần ống rộng, quần nữ suông, quần nữ, quần nữ da cá, quần nữ rộng, Quần 1 sọc ống rộng cá tính",105.000₫,https://tiki.vn/quan-1-soc-ong-rong-quan-1-soc-quan-ong-rong-quan-nu-suong-quan-nu-quan-nu-da-ca-quan-nu-rong-quan-1-soc-ong-rong-ca-tinh-quan-nu-dep-p75440035.html?spid=75440041,20,,Đã bán 6,NIU24
combo 2 áo khoác dù đôi,230.000₫,https://tiki.vn/combo-2-ao-khoac-du-doi-p73495717.html?spid=73495725,21,,,NIU24
"Áo cadigan in hình Floral Fun ( Kèm Ảnh Thật), dành cho nam nữ kèm ảnh thật",92.000₫,https://tiki.vn/ao-cadigan-in-hinh-floral-fun-kem-anh-that-danh-cho-nam-nu-kem-anh-that-p84749531.html?spid=84749557,22,,,NIU24
"Áo hoodie nam nữ trơn unisex, chất nỉ dày dặn trẻ trung phong cách Ulzzang",82.000₫,https://tiki.vn/ao-hoodie-nam-nu-tron-unisex-chat-ni-day-dan-tre-trung-phong-cach-ulzzang-p84749644.html?spid=84749699,23,,Đã bán 2,NIU24
"Áo khoác nỉ trơn unisex, chất nỉ dày dặn trẻ trung dành cho nam nữ SUMMER SWEATER",101.000₫,https://tiki.vn/ao-khoac-ni-tron-unisex-chat-ni-day-dan-tre-trung-danh-cho-nam-nu-p84749483.html?spid=84749500,24,,,NIU24
Áo khoác nam nữ kaki 2 lớp in chữ WIND,160.000,https://tiki.vn/ao-khoac-nam-nu-kaki-2-lop-in-chu-wind-p84749161.html?spid=85141561,25,,,NIU24
,,https://tiki.vn/ao-khoac-du-in-p73495695.html?spid=73495703,26,,,NIU24
ÁO KHOÁC KAKI - ÁO BOMER TÚI HỘP ( Có Form Rộng XL ),172.000₫,https://tiki.vn/ao-khoac-kaki-ao-bomer-tui-hop-co-form-rong-xl-p87219140.html?spid=87219157,27,,,NIU24
Áo Khoác Bomber Bóng Chày Nhung Gân,175.000₫,https://tiki.vn/ao-khoac-bomber-bong-chay-nhung-gan-p87217585.html?spid=87217599,28,,Đã bán 1,NIU24
ÁO KHOÁC NỈ KHUY CÀI CADIGAN IN HOA CÚC NỮ MỚI,112.000₫,https://tiki.vn/ao-khoac-ni-khuy-cai-cadigan-in-hoa-cuc-nu-moi-p87216790.html?spid=87216803,29,,,NIU24
Áo Khoác Kaki Nhung Tăm ULLANG Form Rộng,162.000,https://tiki.vn/ao-khoac-kaki-nhung-tam-ullang-form-rong-p87217321.html?spid=87217341,30,,,NIU24
,,https://tiki.vn/ao-hoodie-original-3-mau-co-form-rong-p87218908.html?spid=87218918,31,,,NIU24
ÁO KHOÁC KAKI - ÁO JACKET BOMBER,170.400₫,https://tiki.vn/ao-khoac-kaki-ao-jacket-bomber-p87218253.html?spid=87218260,32,,,NIU24
Áo Khoác Nỉ Cardigan Ulzzang Thêu Cún Cực Xinh Form Rộng,100.000₫,https://tiki.vn/ao-khoac-ni-cardigan-ulzzang-theu-cun-cuc-xinh-form-rong-p87217043.html?spid=87217052,33,,,NIU24
Áo khoác dù có mũ in hoạ tiết mèo Nhật Bản,86.000₫,https://tiki.vn/ao-khoac-du-co-mu-in-hoa-tiet-meo-nhat-ban-p87216821.html?spid=87216859,34,,,NIU24
Áo Sweater - Áo Khoác Nỉ Nữ Nam Unisex Dâu Tây,112.000,https://tiki.vn/ao-sweater-ao-khoac-ni-nu-nam-unisex-dau-tay-p87218178.html?spid=87218207,35,,,NIU24
,,https://tiki.vn/ao-khoac-nhung-gan-form-rong-tay-canh-doi-p91753951.html?spid=91753971,36,,,NIU24
Áo Khoác Bóng Chày Form Rộng Thu Đông NAM NỮ,165.000₫,https://tiki.vn/ao-khoac-bong-chay-form-rong-thu-dong-nam-nu-p91754307.html?spid=91754311,37,,Đã bán 1,NIU24
Áo Khoác Dây Kéo Jacket Con Bò Sữa Unisex Form Rộng CHẤT NỈ NGOẠI DÀY DẶN CỰC ĐẸP CỰC NGẦU,120.700₫,https://tiki.vn/ao-khoac-day-keo-jacket-con-bo-sua-unisex-form-rong-p91753979.html?spid=91753985,38,,,NIU24
"Áo hoodie in hình EGG unisex, chất nỉ dày dặn trẻ trung dành cho nam nữ",101.000₫,https://tiki.vn/ao-hoodie-in-hinh-egg-unisex-chat-ni-day-dan-tre-trung-danh-cho-nam-nu-p84749564.html?spid=84749579,39,,Đã bán 1,NIU24
Áo Khoác Dù Nam Nữ Unisex ulzzang hàn quốc - Áo Khoác Jacket Bombers,100.000,https://tiki.vn/ao-khoac-du-nam-nu-unisex-ulzzang-han-quoc-ao-khoac-jacket-bombers-p101251863.html?spid=101251871,40,,Đã bán 1,NIU24
