,title,price,link_item,discount,sales,category,revenue
0,Áo hoodie nam nữ form rộng Unisex một màu in hoạt hình cá tính Hàn Quốc – FORMEN SHOP – FMGV034,129000,https://tka.tiki.vn/pixel/pixel?data=kFBrn5ts6eb4xaR1HGbP-LLWkP9wNaDzm7yS5tlG5djKW1-k9uQMhs_yBLz_y_8qwWMxmVo6hVvoTlSWvenDClCXedrWJMTNvjCkl8AgxJOA_OvUaiMAY0_vDdQ8QO_PSUyS94uItJ5ckcglA9ZImgmk_AtzmNj1jf30K4oRytY_AXv30ZqdPVOlRUCsvIX5wzuI3seEXnKl9-lBUWLLk-jst502eykPWn8joKWzvTU07rkajmJ4NC-4sy8K27cp8H7XMa8YUxHIUvrXO5x1MrBkEzEvpD19bF5eXoogUytDW94bQMcuvwaShyfmI_GxyF1Y47WiPjJxpE38N6FxnsdcThguGgdihGmN7uYvR83K3_zE03EU6jXZm-RNT_DW1dHf5CUc9MP1De7KYIovw5EP9WLF1yqWm0KpD57iJknwa2whWueoU6gW4OyEenRwjTA-HoISTXzPnkblYiE9G3vJxttcGtJLIoX4q6Zn42njE7pJojXwmJ-pmAPv27zELGPjP9utNquJbKG2JjKaKIeyNAIcu2whAjMsCiarNVytB5GY2CXSn54_qJhbsAkGowoQ7rlSP_N26McoW50YPQ22ouBAKbK3iUzz_IdM64aowrIqQNcZb7SXpew88NFt0nuVgIHyjpqONSvlAxc44FVhmGAEGavg_LpV97WNmz_Rd3xVwZY9NTo9KakbC2AUlt3xyjVAFicioim6qDVH8Xe6y9YezChCDiaBGYIUnRBGbK0jvP6ZUjNikBzgTJJPKPceeLjvW95B08DwRStFdrEv5cINy5Drnvos8R9u8_hhZIxG_ErH6DY3178V4rszBnLmiufTeOOzfqDuBASfkB1kGAb2LSbRllNp4GfuUmhc9hFEApYT3KzBOFWX7WuRQbMDc_o4Sj7szoY5WUJrFwVnGn6HAjgTF5yprmpJVccd3xUANqeetOBmghIjdy25S0kzQNFOdGJzTKhHt5ecL2Go5tCJpll23C-khQEgmd7xFT0JJ4XMSW4nQS1FWZKh0ChLmFIILD9pFAQJRwQLhb7A7JKdxl_ksGRNuk8ZhBR6pse8ED8g2g-ZxatTUjHjkWZAp1duxFwEdg&reqid=EvkUxVhBJ3ZPMvSW&type=CLICK&pos=1,-35%,923.0,aohoodie,119067000.0
1,Áo hoodie nam nữ form rộng Unisex một màu in hoạt hình cá tính Hàn Quốc – FORMEN SHOP – FMGV034,127000,https://tiki.vn/ao-hoodie-nam-nu-form-rong-unisex-mot-mau-in-hoat-hinh-ca-tinh-han-quoc-formen-shop-fmgv034-p71909603.html?spid=71909607,-36%,923.0,aohoodie,117221000.0
2,"Áo hoodie nỉ bông unisex Homies liền mũ có túi in hình UNFL, Áo hoodie unisex nam nữ nỉ Unfl Studio video thật tại Shop ,Áo nỉ bông ulzzang unisex nam nữ siêu đẹp, Áo khoác Nỉ Có Mũ Túi Bụng Phong Cách Hàn Quốc",100000,https://tiki.vn/ao-hoodie-ni-bong-unisex-homies-lien-mu-co-tui-in-hinh-unfl-ao-hoodie-unisex-nam-nu-ni-unfl-studio-video-that-tai-shop-ao-ni-bong-ulzzang-unisex-nam-nu-sieu-dep-ao-khoac-ni-co-mu-tui-bung-phong-cach-han-quoc-p146265626.html?spid=146265628,-30%,143.0,aohoodie,14300000.0
3,"Áo hoodie, áo sweater thời trang unisex, phong cách năng động, stye hàn quốc - FORMEN SHOP - GV",190000,https://tiki.vn/ao-hoodie-ao-sweater-thoi-trang-unisex-phong-cach-nang-dong-stye-han-quoc-formen-shop-gv-p207343688.html?spid=207343698,-30%,10.0,aohoodie,1900000.0
4,"Áo hoodie nam nữ form rộng siêu xinh , Áo khoác nam nữ nỉ có mũ phong cách",110000,https://tiki.vn/ao-hoodie-nam-nu-form-rong-sieu-xinh-ao-khoac-nam-nu-ni-co-mu-phong-cach-p141309645.html?spid=148697919,-30%,23.0,aohoodie,2530000.0
5,Áo khoác hoodie nam nữ vải nỉ xịn quảng châu mẫu mới 2021 Phuongnamshop20 nj20,115000,https://tiki.vn/ao-khoac-hoodie-nam-nu-vai-ni-xin-quang-chau-mau-moi-2021-phuongnamshop20-nj20-p165995243.html?spid=270813053,-30%,2.0,aohoodie,230000.0
6,Áo mũ Hoodie Unisex MonsterX Gấu X form rộng 5 màu nỉ bông cặp đôi nam nữ Oversize Ulzzang thu đông,105000,https://tiki.vn/ao-mu-hoodie-unisex-monsterx-gau-x-form-rong-5-mau-ni-bong-cap-doi-nam-nu-oversize-ulzzang-thu-dong-p137947751.html?spid=242841156,,3.0,aohoodie,315000.0
7,ÁO KHOÁC NỈ HOODIE NAM NỮ,95000,https://tiki.vn/ao-khoac-ni-hoodie-nam-nu-p131238555.html?spid=270143686,,1.0,aohoodie,95000.0
8,"Áo nỉ nam tuổi teen BIGFOX - MISS MEOW thu đông, áo sweater nam dài tay hình vẽ lên tường từ 39-51kg",155000,https://tiki.vn/ao-ni-nam-tuoi-teen-bigfox-miss-meow-thu-dong-ao-sweater-nam-dai-tay-hinh-ve-len-tuong-tu-39-51kg-p124239921.html?spid=124239925,,2.0,aohoodie,310000.0
9,"Áo hoodie Fafic big, Áo khoác hoodie form rộng nam nữ logo local brand unisex 100% premium cotton có mũ 2 lớp dày dặn ulzzang phong cách Hàn Quốc",140000,https://tiki.vn/ao-hoodie-fafic-big-ao-khoac-hoodie-form-rong-nam-nu-logo-local-brand-unisex-100-premium-cotton-co-mu-2-lop-day-dan-ulzzang-phong-cach-han-quoc-p272161921.html?spid=272161929,,2.0,aohoodie,280000.0
10,"Áo khoác Hoodie Nam, Hoodie Basic Unisex Nỉ From Rộng NÓN 2 LỚP PHẢN QUANG 7 MÀU, Áo Hoodie Nam Hoodie Nỉ Bông, Áo Hoodie Nam Nữ Unisex Form Rộng Thu Đông",127000,https://tiki.vn/ao-khoac-hoodie-nam-hoodie-basic-unisex-ni-from-rong-non-2-lop-phan-quang-7-mau-p140865502.html?spid=140865511,,4.0,aohoodie,508000.0
11,"Bộ Nỉ Nam Nữ Thu Đông Trơn HỌA TIẾT 4 SỌC BỐN SỌC - Thể Thao Mặc Nhà Unisex, Áo Khoác hoodie Dài Tay Quần Jogger",120000,https://tiki.vn/bo-ni-nam-nu-thu-dong-tron-hoa-tiet-4-soc-bon-soc-the-thao-mac-nha-unisex-ao-khoac-hoodie-dai-tay-quan-jogger-p262687692.html?spid=262687694,,1.0,aohoodie,120000.0
12,"Áo Hoodie nam - Chất liệu nỉ da cá mềm mịn , kiểu dáng trẻ trung, năng động, mặc là đẹp",97000,https://tiki.vn/ao-hoodie-nam-cha-t-lie-u-ni-da-ca-me-m-mi-n-kie-u-da-ng-tre-trung-nang-do-ng-ma-c-la-de-p-p122762684.html?spid=132709048,,28.0,aohoodie,2716000.0
13,Áo Khoác Hoodie SADTAGRAM BLACK & GREY (ảnh thật/ có sẳn),108000,https://tiki.vn/ao-khoac-hoodie-sadtagram-black-grey-anh-that-co-san-p199644868.html?spid=199644872,,2.0,aohoodie,216000.0
14,Áo Hoodie Nỉ Nam Nữ From Rộng Unisex In Dạ Quang Phát Sáng Hình Gấu Cực Hot Chất Nỉ Ngoại Dày Dặn (bear),109000,https://tiki.vn/ao-hoodie-ni-nam-nu-from-rong-unisex-in-da-quang-phat-sang-hinh-gau-cuc-hot-chat-ni-ngoai-day-dan-bear-p130029611.html?spid=189630460,,4.0,aohoodie,436000.0
15,"áo hoodie nam nữ, áo hoodie nữ, áo hoodie nam, áo hoodie ulzzang, áo hoodie unisex, Áo Hoodie Nỉ Bông Unisex Streetwear Lục Lăng ( unisex nam nữ đều mặc được)",100000,https://tiki.vn/ao-hoodie-nam-nu-ao-hoodie-nu-ao-hoodie-nam-ao-hoodie-ulzzang-ao-hoodie-unisex-ao-hoodie-ni-bong-unisex-streetwear-luc-lang-unisex-nam-nu-deu-mac-duoc-p75601328.html?spid=75601336,,83.0,aohoodie,8300000.0
16,Áo hoodie nam / áo hooodie nữ / áo hoodie form rộng / áo khoác nam có nón trùm đầu / áo hoodie cặp đôi / áo khoác cặp đôi in con hạc,59000,https://tiki.vn/ao-hoodie-nam-ao-hooodie-nu-ao-hoodie-form-rong-ao-khoac-nam-co-non-trum-dau-ao-hoodie-cap-doi-ao-khoac-cap-doi-in-con-hac-p81938009.html?spid=95002377,,48.0,aohoodie,2832000.0
17,Áo Hoodie nam nữ - Áo khoác Hoodie nam nữ Trắng chống nắng Unisex form rộng CỪU HỒNG nỉ bông ấm áp,88000,https://tiki.vn/ao-hoodie-nam-nu-ao-khoac-hoodie-nam-nu-trang-chong-nang-unisex-form-rong-cuu-hong-ni-bong-am-ap-p147931665.html?spid=186690618,,14.0,aohoodie,1232000.0
18,ÁO KHOÁC NỈ HOODIE GẤU NAM NỮ UNISEX - GIN STORE,114000,https://tiki.vn/ao-khoac-ni-hoodie-gau-nam-nu-unisex-gin-store-p89266198.html?spid=91534173,,64.0,aohoodie,7296000.0
19,Áo khoác nỉ bông cotton dày mịn - hoodie form rộng unisex slake- 2N Unisex,209000,https://tiki.vn/ao-khoac-ni-bong-cotton-day-min-hoodie-form-rong-unisex-slake-2n-unisex-p156000684.html?spid=156000688,,17.0,aohoodie,3553000.0
20,ÁO HOODIE NAM NỮ IN BƠ AVOCATO (NHIỀU MÀU),122000,https://tiki.vn/ao-hoodie-nam-nu-in-bo-avocato-nhieu-mau-p164986953.html?spid=164989319,,3.0,aohoodie,366000.0
21,Áo khoác nỉ bông cotton dày mịn - hoodie nam nữ form rộng unisex dấu chấm than - 2N Unisex,209000,https://tiki.vn/ao-khoac-ni-bong-cotton-day-min-hoodie-nam-nu-form-rong-unisex-dau-cham-than-2n-unisex-p176301614.html?spid=176301621,,13.0,aohoodie,2717000.0
22,"Áo sweater nam nữ dài tay phom rộng, Áo sweater form rộng nam nữ cổ tròn AD02 - MINHSTORE66",145000,https://tiki.vn/ao-sweater-nam-nu-dai-tay-phom-rong-ao-sweater-form-rong-nam-nu-co-tron-ad02-minhstore66-p214153022.html?spid=214153048,,1.0,aohoodie,145000.0
23,Áo Hoodie Among US [ HÀNG MỚI VỀ ] TRUST NO ONE Màu Đen Hình Xanh Có Nón Chất Vải Nỉ Bông Dầy Dặn Mềm Mịn Ấm Áp Form Đẹp Dành Cho Cả Nam Và Nữ,153000,https://tiki.vn/ao-hoodie-among-us-hang-moi-ve-trust-no-one-mau-den-hinh-xanh-co-non-chat-vai-ni-bong-day-dan-mem-min-am-ap-form-dep-danh-cho-ca-nam-va-nu-p75739871.html?spid=75739879,,49.0,aohoodie,7497000.0
24,Áo Sweater Nỉ Chui Trơn Nam Nữ Đều Mặc Được Dễ Dàng Phối Đồ,93000,https://tiki.vn/ao-sweater-ni-chui-tron-nam-nu-deu-mac-duoc-de-dang-phoi-do-p50602762.html?spid=59020560,,221.0,aohoodie,20553000.0
25,[VIDEO THẬT] Áo khoác nỉ Hoodie 2 màu đen be (unisex nam nữ đều mặc được),199000,https://tiki.vn/ao-hoodie-ni-ngoai-2-mau-den-be-unisex-nam-nu-deu-mac-duoc-p72193426.html?spid=74974864,,42.0,aohoodie,8358000.0
26,"Áo Khoác Local Brand Dây Kéo Form Rộng Xanh Rêu NEVERTHAT [ nam nữ mặc ], áo hoodie cặp đôi",157000,https://tiki.vn/ao-khoac-local-brand-day-keo-form-rong-xanh-reu-neverthat-nam-nu-mac-ao-hoodie-cap-doi-p271165896.html?spid=271165908,,1.0,aohoodie,157000.0
27,ÁO KHOÁC HOODIE. ÁO KHOÁT HOOIDE STICK NAM NỮ,101000,https://tiki.vn/ao-khoac-hoodie-ao-khoat-hooide-stick-nam-nu-p112990508.html?spid=112990534,,24.0,aohoodie,2424000.0
28,Áo Khoác Hoodie Heavy Màu Vàng [ TẶNG 1 NÓN HEAVY ] Chất Nỉ Mềm Mịn Kiểu Dáng Trẻ Trung Dành Cho Cả Nam Và Nữ Đủ Size Team Heavy,159000,https://tiki.vn/ao-khoac-hoodie-heavy-mau-vang-tang-1-non-heavy-chat-ni-mem-min-kieu-dang-tre-trung-danh-cho-ca-nam-va-nu-du-size-team-heavy-p75955335.html?spid=75955343,,69.0,aohoodie,10971000.0
29,ÁO KHOÁC NỈ HOODIE NAM NỮ FORM RỘNG PHỐI CHỮ,100000,https://tiki.vn/ao-khoac-ni-hoodie-nam-nu-form-rong-phoi-chu-p137220799.html?spid=155613338,,23.0,aohoodie,2300000.0
30,"Áo hoodie nam nữ in hình gấu le lưỡi,vải nỉ mềm mịn nón 2 lớp",89000,https://tiki.vn/ao-hoodie-nam-nu-in-hinh-gau-le-luoi-vai-ni-mem-min-non-2-lop-p204253282.html?spid=204253908,,4.0,aohoodie,356000.0
31,"Áo Hoodie phản quang 7 màu POKER form dưới 70kg decan in xịn, áo khoác hoodie unisex ulzzang quảng châu in hình ách cơ, áo hoodie nam nữ đều mặc được chống nắng, tranh mưa mặc đi đà lạt",125000,https://tiki.vn/ao-hoodie-phan-quang-7-mau-poker-form-duoi-70kg-decan-in-xin-ao-khoac-hoodie-unisex-ulzzang-quang-chau-in-hinh-ach-co-ao-hoodie-nam-nu-deu-mac-duoc-chong-nang-tranh-mua-mac-di-da-lat-p129228655.html?spid=129228665,,6.0,aohoodie,750000.0
32,Áo hoodie unisex màu trơn vải đẹp,98000,https://tiki.vn/ao-hoodie-unisex-mau-tron-vai-dep-p78555773.html?spid=78555787,,6.0,aohoodie,588000.0
33,ÁO HOODIE NAM NỮ VẢI NỈ POLY DÀY MỊN CHÉM QUẢ CHUỐI CÓ KHÓA KÉO Áo Khoác Nỉ Hoodie Zip Trắng Đen Nam Nữ Unisex-Jins Store,109000,https://tiki.vn/ao-hoodie-nam-nu-vai-ni-poly-day-min-qua-chuoi-co-khoa-keo-unisex-hoodie-nam-nu-p117900778.html?spid=117900792,,2.0,aohoodie,218000.0
34,"Áo hoodie nỉ oversize hàn quốc, Áo khoác hoodie Gấu Nasa Nhiều Màu Space Bear Tee Unisex, Áo hoodie hai chú gấu Polar Bear, Áo Hoodie phản quang 7 màu THE SPACE OF BEAR form dưới 70kg nam nữ đều mặc đượcdecan in xịn",125000,https://tiki.vn/ao-hoodie-ni-oversize-han-quoc-ao-khoac-hoodie-gau-nasa-nhieu-mau-space-bear-tee-unisex-ao-hoodie-hai-chu-gau-polar-bear-ao-hoodie-phan-quang-7-mau-the-space-of-bear-form-duoi-70kg-nam-nu-deu-mac-duocdecan-in-xin-p129453302.html?spid=129453308,,4.0,aohoodie,500000.0
35,Áo Hoodie Phong Cách Nam Màu Trơn Dễ Mặc - FMGV16_05,75000,https://tiki.vn/ao-hoodie-phong-cach-nam-mau-tron-de-mac-fmgv16_05-p44834030.html?spid=46213638,,132.0,aohoodie,9900000.0
36,Áo hoodie nam nữ trơn nhiều màu vải nỉ bông mềm mịn nón 2 lớp,79000,https://tiki.vn/ao-hoodie-nam-nu-tron-nhieu-mau-vai-ni-bong-mem-min-non-2-lop-p204251683.html?spid=204251808,,3.0,aohoodie,237000.0
37,"áo swear timhk truck, Áo dài tay NỈ BÔNG Unisex Sweater Ulzzang cặp đôi nam nữ form rộng oversize Hàn Quốc, áo sweater, áo hoodie, áo sweater nam, áo sweater nữ, áo sweater nam nữ đều mặc được, áo chui đầu",89000,https://tiki.vn/ao-swear-timhk-truck-ao-dai-tay-ni-bong-unisex-sweater-ulzzang-cap-doi-nam-nu-form-rong-oversize-han-quoc-ao-sweater-ao-hoodie-ao-sweater-nam-ao-sweater-nu-ao-sweater-nam-nu-deu-mac-duoc-ao-chui-dau-p197731600.html?spid=197731614,,16.0,aohoodie,1424000.0
38,"Áo Hoodie - Áo Khoác Nỉ Bông in Khủng Long Cute Form Rộng Unisex Nam Nữ, Áo hoodie form rộng unisex nỉ bông Tuyết thời trang nam nữ oversize ulzzang",93000,https://tiki.vn/ao-hoodie-ao-khoac-ni-bong-in-khung-long-cute-form-rong-unisex-nam-nu-item-p169347822.html?spid=169347835,,2.0,aohoodie,186000.0
39,"áo hoodie hoạt hình, áo hoodie cute, áo hoodie han quốc, áo hoodie cá tính, áo hoodie nam nữ, áo hoodie nữ, áo hoodie nam, áo hoodie ulzzang, áo hoodie unisex",100000,https://tiki.vn/ao-hoodie-hoat-hinh-ao-hoodie-cute-ao-hoodie-han-quoc-ao-hoodie-ca-tinh-ao-hoodie-nam-nu-ao-hoodie-nu-ao-hoodie-nam-ao-hoodie-ulzzang-ao-hoodie-unisex-p75945178.html?spid=75945184,,73.0,aohoodie,7300000.0
40,Áo Hoodies Titishop AKN546,99000,https://tiki.vn/ao-hoodies-titishop-akn546-p75707649.html?spid=75707655,,1.0,aohoodie,99000.0
41,Áo Hoodie chui đầu Nỉ Ngoại có nón,99000,https://tiki.vn/ao-hoodie-chui-dau-ni-ngoai-co-non-p56689582.html?spid=56689590,,1.0,aohoodie,99000.0
42,[ Ảnh Thật ] Áo hoodie nỉ bông in gấu nam nữ cặp đôi mặc siêu cute -form rộng khoác hoodie nam Unisex Hiền linh shop,100000,https://tiki.vn/anh-that-ao-hoodie-ni-bong-in-gau-nam-nu-cap-doi-mac-sieu-cute-form-rong-khoac-hoodie-nam-unisex-hien-linh-shop-p102753574.html?spid=105603279,,1.0,aohoodie,100000.0
43,Basic Hoodie In Grey,100000,https://tiki.vn/basic-hoodie-p25312941.html?spid=45165188,,11.0,aohoodie,1100000.0
44,Áo khoác thun nỉ ngoại in hình khủng long hoạt hình có dây kéo mới về,99000,https://tiki.vn/ao-khoac-thun-ni-ngoai-in-hinh-khung-long-hoat-hinh-co-day-keo-moi-ve-p73612429.html?spid=73612435,,2.0,aohoodie,198000.0
45,Áo Hoodie Nỉ lục giác 4 màu ( unisex nam nữ đều mặc được),119000,https://tiki.vn/ao-hoodie-ni-luc-giac-4-mau-unisex-nam-nu-deu-mac-duoc-p74852200.html?spid=75442619,,28.0,aohoodie,3332000.0
46,Hoodie tag Essential VIP nỉ bông/ Nam nữ unisex,139000,https://tiki.vn/hoodie-tag-essential-vip-ni-bong-nam-nu-unisex-p145311347.html?spid=148697898,,1.0,aohoodie,139000.0
47,Áo hoodie nam màu cam - Orange Hoodies,184000,https://tiki.vn/ao-hoodie-nam-mau-cam-orange-hoodies-p41104248.html?spid=76041946,,4.0,aohoodie,736000.0
48,Áo khoác DirtyCoins Special Letters Monogram Hoodie,539000,https://tiki.vn/ao-khoac-dirtycoins-special-letters-monogram-hoodie-p189892112.html?spid=189892114,,1.0,aohoodie,539000.0
49,"Áo Heavy Free Fire Áo Hoodie Màu Đen Có Mũ Chui Đầu Đủ Size Từ 22-90kg, Chất Liệu Nỉ Bông Mềm Mại, Kiểu Dáng Phù Hợp Cho Cả Nam Và Nữ, Hình In Sắc Nét, Không Phai Màu Kể Cả Khi Dùng Máy Giặt",159000,https://tiki.vn/ao-heavy-free-fire-ao-hoodie-mau-den-co-mu-chui-dau-du-size-tu-22-90kg-chat-lieu-ni-bong-mem-mai-kieu-dang-phu-hop-cho-ca-nam-va-nu-hinh-in-sac-net-khong-phai-mau-ke-ca-khi-dung-may-giat-p68474015.html?spid=68474017,,54.0,aohoodie,8586000.0
50,"ÁO HEAVY - ÁO KHOÁC HOOIDE Kiểu Dáng Hot Trend 2020 Chất Liệu Nỉ Bông Mềm Mịn Đủ Size Phù Hợp Dành Cho Cả Nam Và Nữ, Hình In Sắc Nét Không Phai Màu",162000,https://tiki.vn/ao-heavy-ao-khoac-hooide-kieu-dang-hot-trend-2020-chat-lieu-ni-bong-mem-min-du-size-phu-hop-danh-cho-ca-nam-va-nu-hinh-in-sac-net-khong-phai-mau-p68449087.html?spid=68449089,,42.0,aohoodie,6804000.0
51,Áo Hoodie In Hình Anime Học Viện Anh Hùng Thời Trang Cho Nam,129000,https://tiki.vn/ao-hoodie-in-hinh-anime-hoc-vien-anh-hung-thoi-trang-cho-nam-p166232147.html?spid=166232560,,1.0,aohoodie,129000.0
52,Bộ áo quần hoodie chất liệu nỉ bông cotton mềm mịn cao cấp,499000,https://tiki.vn/bo-ao-quan-hoodie-chat-lieu-ni-bong-cotton-mem-min-cao-cap-p208066289.html?spid=208066299,,1.0,aohoodie,499000.0
53,Áo Hoodie Chữ Sadboizvibes - Khoác Nỉ Có Nón Mũ 2 Lớp -Form Rộng Unisex Hàn Quốc Cặp Đôi Nam Nữ - Chống Nắng Thu Đông,94000,https://tiki.vn/ao-hoodie-chu-sadboizvibes-khoac-ni-co-non-mu-2-lop-form-rong-unisex-han-quoc-cap-doi-nam-nu-chong-nang-thu-dong-p202233784.html?spid=207008644,,1.0,aohoodie,94000.0
54,Áo hoodie nam nữ thun nỉ mềm mịn in hoạt hình siêu to thời trang cá tính năng động,102000,https://tiki.vn/ao-hoodie-nam-nu-thun-ni-mem-min-in-hoat-hinh-sieu-to-thoi-trang-ca-tinh-nang-dong-p114430186.html?spid=114430191,,1.0,aohoodie,102000.0
55,"Áo Hoodie Nỉ - Áo Khoác Nỉ Nam Nữ Unisex Nỉ BECHY 4 Màu Cực Hot, ÁO HOODIE GẤU BECHY, ÁO HOODIE UNISEX NAM NỮ ĐẦU MẶC ĐƯỢC, ÁO HOOIDE TAY PHỒNG ULZZANG, áo hoodie tránh mưa, chống nắng",99000,https://tiki.vn/ao-hoodie-ni-ao-khoac-ni-nam-nu-unisex-ni-bechy-4-mau-cuc-hot-ao-hoodie-gau-bechy-ao-hoodie-unisex-nam-nu-dau-mac-duoc-ao-hooide-tay-phong-ulzzang-ao-hoodie-tranh-mua-chong-nang-p91533035.html?spid=137251780,,14.0,aohoodie,1386000.0
56,"Áo SWEATER Trơn 4 Màu nỉ Ngoại Ulzzang Unisex, Áo Sweater Trơn Chất Nỉ Lót Bông in hình gấu dễ thương - Sweater Unisex, áo chui đầu nam nữ, áo thun tay dài chất nỉ ngoại",95000,https://tiki.vn/ao-sweater-tron-4-mau-ni-ngoai-ulzzang-unisex-p138491645.html?spid=138491660,,2.0,aohoodie,190000.0
57,Khoác nam Hoodie Eni -APKB163,99000,https://tiki.vn/khoac-nam-hoodie-eni-apkb163-p10190800.html?spid=45084349,,2.0,aohoodie,198000.0
58,Áo khoác Hoodie Unisex From Rộng HH2,99000,https://tiki.vn/ao-khoac-hoodie-unisex-from-rong-hh2-p11865885.html?spid=71934726,,9.0,aohoodie,891000.0
59,Áo Hoodie Trơn Nam Nữ Mặc Cặp Dáng Rộng Loại Đẹp Màu Đen Trắng HD101,95000,https://tiki.vn/ao-hoodie-tron-nam-nu-mac-cap-dang-rong-loai-dep-mau-den-trang-hd101-p141600670.html?spid=148001003,,7.0,aohoodie,665000.0
60,"Áo tay dài Mmlg We Tap Hood - Áo Hoodie Sweater cho nam, nữ, unisex",2380000,https://tiki.vn/ao-tay-dai-mmlg-we-tap-hood-ao-hoodie-sweater-cho-nam-nu-unisex-p205849327.html?spid=205849338,,1.0,aohoodie,2380000.0
61,ÁO KHOÁC NÌ NAM CHUI TRƠN CÓ TÚI,108000,https://tiki.vn/ao-khoac-ni-nam-chui-tron-co-tui-p69336992.html?spid=71198851,,1.0,aohoodie,108000.0
62,Áo Hoodie Trơn Màu Cam Cao Cấp Dáng Rộng Unisex Nam Nữ Mặc Được - MM - M,120000,https://tiki.vn/ao-hoodie-tron-mau-cam-cao-cap-dang-rong-unisex-nam-nu-mac-duoc-mm-p106395338.html?spid=106395340,,1.0,aohoodie,120000.0
63,"Áo Sweater Tay Dài Áo Sweater Nỉ Ngoại Chất Đẹp Unisex Nam Nữ, Áo Sweater Nỉ Unisex Tay Dài Form Rộng Nam Nữ Hai Màu Đen Trắng Cực Đẹp Áo Sweater, Áo nỉ chất cao cấp Ulzzang form unisex dài tay nam nữ",102000,https://tiki.vn/ao-sweater-tay-dai-ao-sweater-ni-ngoai-chat-dep-unisex-nam-nu-p136581415.html?spid=136581712,,3.0,aohoodie,306000.0
64,"Áo Hoodie Dáng Rộng plus size Phong Cách vintage Hàn Quốc Cho Nam Nữ, Áo khoác Hoodie In Chữ Thập Âu Mỹ Thời Trang Thu Đông Cho Cặp Đôi, Áo Hoodie Tay Dài In Chữ Tiếng Anh Thiết Kế Độc Đáo Thu Đông Cho Nam Và Nữ",99000,https://tiki.vn/ao-hoodie-dang-rong-plus-size-phong-cach-vintage-han-quoc-cho-nam-nu-ao-khoac-hoodie-in-chu-thap-au-my-thoi-trang-thu-dong-cho-cap-doi-ao-hoodie-tay-dai-in-chu-tieng-anh-thiet-ke-doc-dao-thu-dong-cho-nam-va-nu-p204832159.html?spid=204832165,,1.0,aohoodie,99000.0
65,ÁO HOODIE UNISEX IN HOT TREND CHẤT LIỆU NỈ BÔNG SIZE TỪ 35-70kg,144000,https://tiki.vn/ao-hoodie-unisex-in-hot-trend-chat-lieu-ni-bong-size-tu-35-70kg-p164986695.html?spid=164987534,,1.0,aohoodie,144000.0
66,Áo Khoác Hoodie Nỉ Ngoại In Gấu Forrm Rộng Unisex Nam Nữ,98000,https://tiki.vn/ao-khoac-hoodie-ni-ngoai-in-gau-forrm-rong-unisex-nam-nu-p128866892.html?spid=146906268,,1.0,aohoodie,98000.0
67,"Áo khoác hoodie nam size lớn, bigsize 90kg toi 130kg du mau",380000,https://tiki.vn/ao-khoac-hoodie-nam-size-lon-bigsize-90kg-toi-130kg-du-mau-p201623596.html?spid=201623635,,1.0,aohoodie,380000.0
68,ÁO HOODIE UNISEX Nam Nữ BASIC CAO CẤP ĐỦ MÀU FORM RỘNG Z8,75000,https://tiki.vn/ao-hoodie-unisex-nam-nu-basic-cao-cap-du-mau-form-rong-z8-p249254601.html?spid=249254728,,1.0,aohoodie,75000.0
69,"Áo hoodie nam, áo hoodie nữ, áo hoodie trơn, áo chồng cổ, áo chui đầu, áo sweater",100000,https://tiki.vn/ao-hoodie-nam-ao-hoodie-nu-ao-hoodie-tron-ao-chong-co-ao-chui-dau-ao-sweater-p74595908.html?spid=74595940,,9.0,aohoodie,900000.0
70,"ÁO HOODIE THUN NỈ IN HÌNH PHIM GIA ĐÌNH 1988 , PHONG CÁCH,CÁ TÌNH, MÀU SẮC DỄ MIX ĐỒ",123000,https://tiki.vn/ao-hoodie-ni-gia-dinh-ulzzang-unisex-pqk-p153470798.html?spid=153470805,,2.0,aohoodie,246000.0
71,"Hoodie trơn basic unisex, Áo mũ Hoodie Unisex nỉ bông trơn basic cặp đôi nam nữ Oversize Ulzzang Hàn Quốc thu đông form rộng 5 MÀU, Áo khoác Hoodie chui đầu nam nữ màu trơn form basic giá rẻ, áo khoác nam có mũ chùm đầu",92000,https://tiki.vn/hoodie-tron-basic-unisex-p144236494.html?spid=144236679,,13.0,aohoodie,1196000.0
72,Áo Hoodie Nỉ bông unisex TRƠN màu Xám/Xám xanh UNISEX/Nam nữ unisex ️ Jaystoree,100000,https://tiki.vn/ao-hoodie-ni-bong-unisex-tron-mau-xam-xam-xanh-unisex-nam-nu-unisex-jaystoree-p130867530.html?spid=161966752,,4.0,aohoodie,400000.0
73,"Áo hoodie unisex form rộng WIND Nỉ Ngoại 2020 Swag, áo hoodie ullzang WIND",90000,https://tiki.vn/ao-hoodie-unisex-form-rong-wind-ni-ngoai-2020-swag-ao-hoodie-ullzang-wind-p67996875.html?spid=72226959,,26.0,aohoodie,2340000.0
74,Áo Hoodies Titishop AKN557,99000,https://tiki.vn/ao-hoodies-titishop-akn557-p75707658.html?spid=75707662,,1.0,aohoodie,99000.0
75,Áo Hoodie Among US [ HÀNG MỚI VỀ ] TRUST NO ONE Màu Đen Hình Đỏ Chất Nỉ Dầy Dặn Hot Trend 2021,162000,https://tiki.vn/ao-hoodie-among-us-hang-moi-ve-trust-no-one-mau-den-hinh-do-chat-ni-day-dan-hot-trend-2021-p74463531.html?spid=74463533,,20.0,aohoodie,3240000.0
76,Áo hoodie trơn màu vàng bò Hot Trend,122000,https://tiki.vn/ao-hoodie-tron-mau-vang-bo-hot-trend-p164987513.html?spid=164987745,,1.0,aohoodie,122000.0
77,Áo Hoodie Nỉ Bông in Vũ Trụ - Form Rộng Unisex Nam Nữ ulzzang KUN,108000,https://tiki.vn/ao-hoodie-ni-bong-in-vu-tru-form-rong-unisex-nam-nu-ulzzang-kun-p137667393.html?spid=147329961,,1.0,aohoodie,108000.0
78,Sweater Nỉ Trơn - Áo Nỉ Dài Tay Unisex Form Rộng Thời Trang Nam Nữ Phong Cách Hàn Quốc,93000,https://tiki.vn/sweater-ni-tron-ao-ni-dai-tay-unisex-form-rong-thoi-trang-nam-nu-phong-cach-han-quoc-p143766628.html?spid=155603874,,1.0,aohoodie,93000.0
79,Áo Hoodie nỉ Couple nam nữ - Form rộng,106000,https://tiki.vn/ao-hoodie-ni-couple-nam-nu-form-rong-p134739638.html?spid=146241191,,3.0,aohoodie,318000.0
80,Áo khoác hoodie nam from rộng trend,245000,https://tiki.vn/ao-khoac-hoodie-nam-from-rong-trend-p149118488.html?spid=197186772,,1.0,aohoodie,245000.0
81,Áo sweater nỉ bông cotton dày mịn - hoodie form rộng unisex Murabed - 2N Unisex,199000,https://tiki.vn/ao-sweater-ni-bong-cotton-day-min-hoodie-form-rong-unisex-murabed-2n-unisex-p217176969.html?spid=217176971,,1.0,aohoodie,199000.0
82,Áo khoác Hoodie nam nữ KD132,99000,https://tiki.vn/ao-khoac-hoodie-nam-nu-kd132-p4952139.html?spid=44713946,,6.0,aohoodie,594000.0
83,"Áo Hoodie Nam Nữ , áo hoodie cặp Unisex form rộng, áo khoác hoodie đôi phong cách ulzzang, áo hoodie hàn quốc, áo khoác hoodie có mủ, áo hoodie đẹp",123700,https://tiki.vn/ao-hoodie-nam-nu-ao-hoodie-cap-unisex-form-rong-ao-khoac-hoodie-doi-phong-cach-ulzzang-ao-hoodie-han-quoc-ao-khoac-hoodie-co-mu-ao-hoodie-dep-p91753894.html?spid=91753899,,1.0,aohoodie,123700.0
84,Áo Hoodie Nỉ Bông BASIC WHITE Unisex,100000,https://tiki.vn/ao-hoodie-ni-bong-basic-white-unisex-p26297961.html?spid=45165771,,3.0,aohoodie,300000.0
85,Áo hoodie chất PE in hoạt hình,89000,https://tiki.vn/ao-hoodie-chat-pe-in-hoat-hinh-p72967416.html?spid=72967418,,2.0,aohoodie,178000.0
86,Hoodie Hồng Phấn Unisex Phom Thụng,97900,https://tiki.vn/hoodie-hong-phan-unisex-phom-thung-p70640552.html?spid=72586472,,1.0,aohoodie,97900.0
87,"Áo hoodie nam , áo hoodie nữ , áo hoodie vải nỉ ngoại",113000,https://tiki.vn/ao-hoodie-nam-ao-hoodie-nu-ao-hoodie-vai-ni-ngoai-ao-hoodie-ulzzang-ao-hoodie-unisex-ao-hoodie-nam-nu-deu-mac-duoc-p74768970.html?spid=74768974,,1.0,aohoodie,113000.0
88,Áo hoodie nỉ ngoại in chữ,99000,https://tiki.vn/ao-hoodie-ni-ngoai-in-chu-p72745833.html?spid=72745835,,6.0,aohoodie,594000.0
89,Áo khoác hoodie nam nữ nỉ,100000,https://tiki.vn/ao-khoac-hoodie-nam-nu-ni-p10187170.html?spid=48756480,,4.0,aohoodie,400000.0
90,Áo hoodie chất PE in hoạt hình,107900,https://tiki.vn/ao-hoodie-chat-pe-in-hoat-hinh-p73160924.html?spid=73160926,,5.0,aohoodie,539500.0
91,Áo Hoodie Trơn Màu Xanh Chuối Cao Cấp Dáng Rộng Unisex Nam Nữ Mặc Được - MM,120000,https://tiki.vn/ao-hoodie-tron-mau-xanh-chuoi-cao-cap-dang-rong-unisex-nam-nu-mac-duoc-mm-p106365376.html?spid=106365378,,1.0,aohoodie,120000.0
92,ÁO HOODIE THUN NỈ NGOẠI,126000,https://tiki.vn/ao-hoodie-thun-ni-ngoai-p73495795.html?spid=73495801,,1.0,aohoodie,126000.0
93,"Áo khoác Hoodie Nam, Hoodie Basic Unisex Nỉ From Rộng NÓN 2 LỚP PHẢN QUANG 7 MÀU, Áo Khoác Nỉ Hoodie Nam Nữ 2 Lớp Dày Dặn Cotton Phong Cách Hàn Quốc Free Size Dưới 70kg",129000,https://tiki.vn/ao-khoac-hoodie-nam-hoodie-basic-unisex-ni-from-rong-non-2-lop-phan-quang-7-mau-p138491656.html?spid=138491663,,3.0,aohoodie,387000.0
