,title,price,link_item,discount,sales,category,revenue
198,Sweater Heaven Phản Quang 7 Màu - Áo Nỉ Dài Tay Unisex Form Rộng Thời Trang Nam Nữ Phong Cách Hàn Quốc,140000,https://tiki.vn/sweater-heaven-phan-quang-7-mau-ao-ni-dai-tay-unisex-form-rong-thoi-trang-nam-nu-phong-cach-han-quoc-p143766852.html?spid=143767316,,1.0,aohoodie,140000.0
199,Áo hoodie form rộng fullsize từ 45 đến 85kg ( Mã M2),125800,https://tiki.vn/ao-hoodie-form-rong-fullsize-tu-45-den-85kg-ma-m2-p179412638.html?spid=179412675,,5.0,aohoodie,629000.0
200,"ÁO HOODIE NÓN NAM NỮ MÀU ĐEN VẢI NỈ POLY IN SÚNG NƯỚC Unisex hoodie,Áo Khoác Nỉ Hoodie In Datlity, Áo Khoác Nỉ Hoodie Unisex Nam Nữ Cao Cấp",100000,https://tiki.vn/ao-hoodie-non-nam-nu-mau-den-vai-ni-poly-in-sung-nuoc-unisex-hoodie-p117902589.html?spid=117902608,-34%,62.0,aohoodie,6200000.0
201,Áo Sweater Nam bigsize SST14,86000,https://tiki.vn/ao-sweater-nam-bigsize-sst14-p15777699.html?spid=45014980,,113.0,aohoodie,9718000.0
202,Áo Khoác Hoodie Form Rộng Unisex BABY Vải Nỉ Bông Dày Dặn màu ĐEN/TRẮNG Nam nữ unisex,125000,https://tiki.vn/ao-khoac-hoodie-form-rong-unisex-baby-vai-ni-bong-day-dan-mau-den-trang-nam-nu-unisex-p194502204.html?spid=201001129,,1.0,aohoodie,125000.0
203,áo hoodie nam nữ,100000,https://tiki.vn/ao-hoodie-nam-nu-p72967377.html?spid=72967383,,10.0,aohoodie,1000000.0
204,Áo nỉ Hoodie nam form rộng trơn nhiều màu sắc chất nỉ dày dặn chất lượng cao cấp,95000,https://tiki.vn/ao-ni-hoodie-nam-form-rong-tron-nhieu-mau-sac-chat-ni-day-dan-chat-luong-cao-cap-p131526584.html?spid=134555010,,9.0,aohoodie,855000.0
205,Áo Khoác Free Fire [ Tặng 1 Nón Heavy ] Chất Nỉ Màu Vàng Team Heavy Cực Đẹp Kiểu Dáng Hoodie Trẻ Trung Dễ Phối Đồ Phù Hợp Cho Cả Nam Và Nữ,177000,https://tiki.vn/ao-khoac-free-fire-tang-1-non-heavy-chat-ni-mau-vang-team-heavy-cuc-dep-kieu-dang-hoodie-tre-trung-de-phoi-do-phu-hop-cho-ca-nam-va-nu-p73595878.html?spid=73595880,,237.0,aohoodie,41949000.0
206,ÁO KHOÁC NỈ NAM CHUI CÓ NÓN,100000,https://tiki.vn/ao-khoac-ni-nam-chui-co-non-p59212863.html?spid=71198676,,16.0,aohoodie,1600000.0
207,Áo hoodie nam trơn cá tính,144000,https://tiki.vn/ao-hoodie-nam-tron-ca-tinh-p74556050.html?spid=74556052,,15.0,aohoodie,2160000.0
208,Áo Hoodie Dáng Rộng In Hình Anime Kaisen Satoru 2021Jujutsu,210000,https://tiki.vn/ao-hoodie-dang-rong-in-hinh-anime-kaisen-satoru-2021jujutsu-p166232163.html?spid=166232261,,1.0,aohoodie,210000.0
209,Áo Khoác Hoodie Nam Nữ Họa Tiết Chữ YES - NO Phản Quang Chất Nỉ Mềm Mịn Cao Cấp TP,103000,https://tiki.vn/ao-khoac-hoodie-nam-nu-hoa-tiet-chu-yes-no-phan-quang-chat-ni-mem-min-cao-cap-tp-p213690289.html?spid=213690295,,3.0,aohoodie,309000.0
210,Áo Hoodie Nỉ bông TAY ĐẤM màu Xám/Xanh/Kem/Đen UNISEX/Nam nữ unisex/ HOODIE TRƠN,76000,https://tiki.vn/ao-hoodie-ni-bong-tay-dam-mau-xam-xanh-kem-den-unisex-nam-nu-unisex-hoodie-tron-p249249801.html?spid=249249964,,1.0,aohoodie,76000.0
211,Áo khoác nỉ bông F426 hoodie zip unisex nam nữ (Ảnh thật/Có sẵn),106000,https://tiki.vn/ao-khoac-ni-bong-f426-hoodie-zip-unisex-nam-nu-anh-that-co-san-p199645001.html?spid=199645023,,6.0,aohoodie,636000.0
212,Áo Sweater Tay Dài From Rộng Nam GOAT MENSWEAR,590000,https://tiki.vn/ao-sweater-tay-dai-from-rong-nam-goat-menswear-p68977621.html?spid=68977623,,1.0,aohoodie,590000.0
213,ÁO SWEATER TRƠN,97000,https://tiki.vn/ao-sweater-tron-p46675937.html?spid=52354710,,38.0,aohoodie,3686000.0
214,Áo Thun Tay Dài Form Rộng Nam GOAT MENSWEAR,395000,https://tiki.vn/ao-thun-tay-dai-form-rong-ao-thun-sweater-nam-goat-menswear-p69674672.html?spid=69674678,,1.0,aohoodie,395000.0
215,Áo Hoodie Nỉ Nam Nữ From Rộng Unisex In Dạ Quang Phát Sáng Hình Gấu Cực Hot Chất Nỉ Ngoại Dày Dặn (Thought),109000,https://tiki.vn/ao-hoodie-ni-nam-nu-from-rong-unisex-in-da-quang-phat-sang-hinh-gau-cuc-hot-chat-ni-ngoai-day-dan-thought-p130029696.html?spid=139206260,,7.0,aohoodie,763000.0
216,Áo khoác hoodie nam nữ mặc được hình mặt cười cực đẹp,120000,https://tiki.vn/ao-khoac-hoodie-nam-nu-mac-duoc-hinh-mat-cuoi-cuc-dep-p181169393.html?spid=195947249,,8.0,aohoodie,960000.0
217,Áo hoodie nam nữ in chữ newyork vải nỉ bông mềm mịn nón 2 lớp,79000,https://tiki.vn/ao-hoodie-nam-nu-in-chu-newyork-vai-ni-bong-mem-min-non-2-lop-p204254543.html?spid=204254719,,1.0,aohoodie,79000.0
218,áo hoodie nam nữ,100000,https://tiki.vn/ao-hoodie-nam-nu-p73161713.html?spid=73161715,,55.0,aohoodie,5500000.0
219,Áo Hoodie Nỉ bông TRƠN màu XANH NEON/XANH NGỌC/XANH COBAN UNISEX/Nam nữ unisex/ HOODIE TRƠN,102000,https://tiki.vn/ao-hoodie-ni-bong-tron-mau-xanh-neon-xanh-ngoc-xanh-coban-unisex-nam-nu-unisex-hoodie-tron-p145977891.html?spid=189263420,,6.0,aohoodie,612000.0
220,Áo Converse - 10017032_001,1200000,https://tiki.vn/ao-converse-10017032_001-p188896270.html?spid=188896274,,1.0,aohoodie,1200000.0
221,"Áo hoodie nam , áo hoodie nữ , áo hoodie vải nỉ ngoại",99000,https://tiki.vn/ao-hoodie-nam-ao-hoodie-nu-ao-hoodie-vai-ni-ngoai-p74595868.html?spid=74595869,,10.0,aohoodie,990000.0
222,ÁO KHOÁC HOODIE IN CHỮ BẮT TREND MỚI NHẤT,95000,https://tiki.vn/ao-khoac-hoodie-in-chu-bat-trend-moi-nhat-p164985137.html?spid=189673512,,2.0,aohoodie,190000.0
223,"(ẢNH THẬT) ÁO SWEATER BÓNG CHÀY FORM RỘNG UNISEX THIẾT KẾ ĐỦ SIZE CHO CẢ NAM VÀ NỮ, ÁO HOODIE CHUI ĐẦU ULZZANG PHỐI VIỀN, Áo Nỉ Viền Cổ Tim Số 26 Ngược Chất Nỉ Ngoại Dày Mịn",99000,https://tiki.vn/anh-that-ao-sweater-bong-chay-form-rong-unisex-thiet-ke-du-size-cho-ca-nam-va-nu-ao-hoodie-chui-dau-ulzzang-phoi-vien-ao-ni-vien-co-tim-so-26-nguoc-chat-ni-ngoai-day-min-p125803035.html?spid=125803037,,28.0,aohoodie,2772000.0
224,"Áo Hoodie Chống nắng cho nam và nữ Có Mũ, Form Rộng unisex 4 Màu ulzzang, Áo Hoodie unisex lục giác",108000,https://tiki.vn/ao-hoodie-chong-nang-cho-nam-va-nu-co-mu-form-rong-unisex-4-mau-ulzzang-ao-hoodie-unisex-luc-giac-p81935376.html?spid=81935380,,11.0,aohoodie,1188000.0
225,Áo hoodie nam nữ nỉ bông cotton 100% cao cấp [Ảnh Thật,100000,https://tiki.vn/ao-hoodie-nam-nu-ni-bong-cotton-100-cao-cap-anh-that-p39978301.html?spid=45370887,,33.0,aohoodie,3300000.0
226,ÁO KHOÁC HOODIE SWEATER NAM NỮ,105000,https://tiki.vn/ao-khoac-hoodie-sweater-nam-nu-p159057895.html?spid=205289691,,1.0,aohoodie,105000.0
227,"Áo hoodie trắng Blackpink Born Pink giống Rosé JISOO JENNIE LISA chất nỉ tay dài, áo khoác hoodie chống nắng cho team nhóm, áo hoodie cặp đôi",106000,https://tiki.vn/ao-hoodie-trang-blackpink-born-pink-giong-rose-jisoo-jennie-lisa-chat-ni-tay-dai-ao-khoac-hoodie-chong-nang-cho-team-nhom-ao-hoodie-cap-doi-p270822373.html?spid=270822393,,1.0,aohoodie,106000.0
228,Áo hoodie nỉ ngoại ulzzang cặp đôi unisex nam nữ sweater local brand khoác zip choàng cardigan chống nắng BAN SUNLIGH,100000,https://tiki.vn/ao-hoodie-ni-ngoai-ulzzang-cap-doi-unisex-nam-nu-sweater-local-brand-khoac-zip-choang-cardigan-chong-nang-ban-sunligh-p117919410.html?spid=203606103,,2.0,aohoodie,200000.0
229,Áo Hoodie Basic nỉ bông Unisex màu hồng,100000,https://tiki.vn/ao-hoodie-basic-ni-bong-unisex-mau-hong-p50594819.html?spid=72310167,,12.0,aohoodie,1200000.0
230,Áo hoodie nam trơn ST03,93000,https://tiki.vn/ao-hoodie-nam-tron-st03-p44803061.html?spid=46212400,,12.0,aohoodie,1116000.0
231,"áo hoodie in lá bài, áo hoodie tết, áo hoodie lá bài, áo lá bài, áo hoodie đôi, áo hoodie nam, áo hoodie nữ",100000,https://tiki.vn/ao-hoodie-in-la-bai-ao-hoodie-tet-ao-hoodie-la-bai-ao-la-bai-ao-hoodie-doi-ao-hoodie-nam-ao-hoodie-nu-p76248179.html?spid=76248181,,1.0,aohoodie,100000.0
232,"Áo Khoác Hoodie Không Xù lông Dành Cho Nam Cho Nữ và cặp đôi, Chất Nỉ Form rộng in hình mèo và chuột Unisex, Áo khoác, áo hoodie unisex nam nữ nỉ ngoại form rộng Tom and Jerry",103000,https://tiki.vn/ao-khoac-hoodie-khong-xu-long-danh-cho-nam-cho-nu-va-cap-doi-chat-ni-form-rong-in-hinh-meo-va-chuot-unisex-ao-khoac-ao-hoodie-unisex-nam-nu-ni-ngoai-form-rong-tom-and-jerry-p80935753.html?spid=80935757,,6.0,aohoodie,618000.0
233,Áo hoodie con ngựa,126000,https://tiki.vn/ao-hoodie-con-ngua-p73495849.html?spid=73495855,,1.0,aohoodie,126000.0
234,"Áo hoodie nam nữ mặc . áo hoodie nam , áo hoodie cặp đôi , áo khoác hoodie nam , áo khoác nam vải nỉ ngoại dày mịn",92000,https://tiki.vn/ao-hoodie-nam-nu-mac-ao-hoodie-nam-ao-hoodie-cap-doi-ao-khoac-hoodie-nam-ao-khoac-nam-vai-ni-ngoai-day-min-p76676866.html?spid=76747409,,7.0,aohoodie,644000.0
235,Áo hoodie nam in chữ,173000,https://tiki.vn/ao-hoodie-nam-in-chu-p73815620.html?spid=73815624,,3.0,aohoodie,519000.0
236,Áo Hoodie Unisex Loại 1 Cực Đẹp HDT4,99000,https://tiki.vn/ao-hoodie-unisex-loai-1-cuc-dep-hdt4-p19692994.html?spid=29345546,,9.0,aohoodie,891000.0
237,Basic Hoodie In Black,95900,https://tiki.vn/basic-hoodie-in-black-p23643139.html?spid=45165764,,11.0,aohoodie,1054900.0
238,"[HÌNH THẬT 100%]Áo nam, áo hooadie nam mùa thu đông dáng unisex form rộng chất nỉ bông",92000,https://tiki.vn/hinh-that-100-ao-nam-ao-hooadie-nam-mua-thu-dong-dang-unisex-form-rong-chat-ni-bong-p68724670.html?spid=72587940,,4.0,aohoodie,368000.0
239,Áo hoodies sweater form to y hình HOẠ TIẾT,106000,https://tiki.vn/ao-hoodies-sweater-form-to-y-hinh-hoa-tiet-p158221265.html?spid=162733825,,1.0,aohoodie,106000.0
240,Áo Hoodie trơn Unisex Hàn Quốc(kèm ảnh thật),96000,https://tiki.vn/ao-hoodie-tron-unisex-han-quoc-kem-anh-that-p125633222.html?spid=125633232,,1.0,aohoodie,96000.0
241,ÁO KHOÁC SWEARTER FORM UNISEX NAM NỮ PHONG CÁCH HÀN QUỐC IN CHỮ M SIÊU ĐẸP (CÓ SẴN),97000,https://tiki.vn/ao-khoac-swearter-form-unisex-nam-nu-phong-cach-han-quoc-in-chu-m-sieu-dep-co-san-p175996933.html?spid=198871503,,4.0,aohoodie,388000.0
242,"Áo khoác HOODIES nữ FORM RỘNG , siêu xinh tôn dáng hottrend cho các bạn MẪU MỚI NHẤT HIỆN NAY",94090,https://tiki.vn/ao-khoac-hoodies-nu-form-rong-sieu-xinh-ton-dang-hottrend-cho-cac-ban-mau-moi-nhat-hien-nay-p195302689.html?spid=195302709,,2.0,aohoodie,188180.0
243,Áo khoác Hoodie phối cực Chất GA1,195000,https://tiki.vn/ao-khoac-hoodie-phoi-cuc-chat-ga1-p6348617.html?spid=44295041,,4.0,aohoodie,780000.0
244,Áo khoác vải nỉ big size nam 80 tới 130kg,320000,https://tiki.vn/ao-khoac-vai-ni-big-size-nam-80-toi-130kg-p205715636.html?spid=205715649,,1.0,aohoodie,320000.0
245,Áo thun unisex tay dài SADBOIZ SAD BOIZ SAD STORY Logo thêu cực hot 2021 || Hany shop,300000,https://tiki.vn/ao-thun-unisex-tay-dai-sadboiz-sad-boiz-sad-story-logo-theu-cuc-hot-2021-hany-shop-p151521513.html?spid=151521593,,1.0,aohoodie,300000.0
246,Áo Hoodie Unisex Dáng Hàn Quốc Thời Trang Nam Nữ In Hình Chú Bộ Đội Cực Đẹp - LZGV021,250000,https://tiki.vn/ao-hoodie-unisex-dang-han-quoc-thoi-trang-nam-nu-in-hinh-chu-bo-doi-cuc-dep-lzgv021-p68397920.html?spid=68397922,,8.0,aohoodie,2000000.0
247,Sweater Icon Lè Lưỡi Phản Quang 7 Màu - Áo Nỉ Dài Tay Unisex Form Rộng Thời Trang Nam Nữ Phong Cách Hàn Quốc,140000,https://tiki.vn/sweater-icon-le-luoi-phan-quang-7-mau-ao-ni-dai-tay-unisex-form-rong-thoi-trang-nam-nu-phong-cach-han-quoc-p143768557.html?spid=143768559,,1.0,aohoodie,140000.0
248,Áo Hoodie Among US TRUST NO ONE Màu Đen Hình Xanh Chất Nỉ Dầy Dặn Hot Trend,162000,https://tiki.vn/ao-hoodie-among-us-hang-moi-ve-trust-no-one-mau-den-hinh-xanh-chat-ni-day-dan-hot-trend-2021-p74485088.html?spid=74485098,,2.0,aohoodie,324000.0
249,ÁO SWEATER UNISEX IN TIGGER (NHIỀU MÀU),99000,https://tiki.vn/ao-sweater-unisex-in-tigger-nhieu-mau-p164986815.html?spid=164987910,,19.0,aohoodie,1881000.0
250,Áo Hoodie Nỉ Bông Unisex GẤU màu ĐEN/TAN Nam nữ unisex Áo Khoác Hoodie form rộng Jaystoree,113000,https://tiki.vn/ao-hoodie-ni-bong-unisex-gau-mau-den-tan-nam-nu-unisex-ao-khoac-hoodie-form-rong-jaystoree-p156936849.html?spid=156936857,,3.0,aohoodie,339000.0
251,Áo Hoddie Bò Sữa Nỉ Bông Form Rộng Unisex Nam Nữ - Áo Nỉ Hoodie Nam Nữ Couple Ulzzang KUN,96000,https://tiki.vn/a-o-hoddie-bo-su-a-ni-bong-form-rong-unisex-nam-nu-ao-ni-hoodie-nam-nu-couple-ulzzang-kun-p134389609.html?spid=162215145,,1.0,aohoodie,96000.0
252,Áo khoác nỉ bông RIPOFF hoodie zip unisex nam nữ (Ảnh thật/Có sẵn),89000,https://tiki.vn/ao-khoac-ni-bong-ripoff-hoodie-zip-unisex-nam-nu-anh-that-co-san-p195708177.html?spid=195708185,,2.0,aohoodie,178000.0
253,Áo hoodie nỉ bông HARSII màu TRẮNG/NÂU/XÁM CHÌ ️ Nam nữ unisex ️ Áo Khoác Hoodie form rộng Jaystoree,93000,https://tiki.vn/ao-hoodie-ni-bong-harsii-mau-trang-nau-xam-chi-nam-nu-unisex-ao-khoac-hoodie-form-rong-jaystoree-p194502327.html?spid=195872591,,2.0,aohoodie,186000.0
254,"Áo Nỉ Hoodie Travis Scott, Hoodie Nam Nữ Form Rộng Unisex, chất nỉ bông - Beshine Store",198000,https://tiki.vn/ao-ni-hoodie-travis-scott-hoodie-nam-nu-form-rong-unisex-chat-ni-bong-beshine-store-p144958973.html?spid=144959001,,7.0,aohoodie,1386000.0
255,Áo hoodie blackss in phản quang trắng unisex nam nữ,124000,https://tiki.vn/ao-hoodie-blackss-in-phan-quang-trang-unisex-nam-nu-p128129006.html?spid=215135851,,1.0,aohoodie,124000.0
256,ÁO KHOÁC HOODIES NAM NỮ FORM TO Y NHƯ HÌNH THỜI TRANG KING STORE,99000,https://tiki.vn/ao-khoac-hoodies-nam-nu-form-to-y-nhu-hinh-thoi-trang-lano-store-99-p113412761.html?spid=109417382,,2.0,aohoodie,198000.0
257,Áo Hoodie Nỉ Ngoại In Chữ Bloods,99000,https://tiki.vn/ao-hoodie-ni-ngoai-in-chu-bloods-p56689563.html?spid=56689567,,9.0,aohoodie,891000.0
258,Áo Hoodie Unisex Loại 1 Cực Đẹp HDC29,99000,https://tiki.vn/ao-hoodie-unisex-loai-1-cuc-dep-hdc29-p19693164.html?spid=31690160,,1.0,aohoodie,99000.0
259,ÁO HOODIE ÁO HOODID IN HÌNH LỤC GIÁC CHẤT VẢI NỈ NGOẠI,73000,https://tiki.vn/ao-hoodie-ao-hoodid-in-hinh-luc-giac-chat-vai-ni-ngoai-p90064653.html?spid=70669115,,5.0,aohoodie,365000.0
260,Áo Hoodie Unisex Loại 1 Cực Đẹp HDC29,99000,https://tiki.vn/ao-hoodie-unisex-loai-1-cuc-dep-hdc29-p19243659.html?spid=31690143,,4.0,aohoodie,396000.0
261,"Áo hoodie nam , áo hoodie nữ , áo hoodie vải nỉ ngoại, áo hoodie ulzzang, áo hoodie unisex",113000,https://tiki.vn/ao-hoodie-nam-ao-hoodie-nu-ao-hoodie-vai-ni-ngoai-ao-hoodie-ulzzang-ao-hoodie-unisex-p74763455.html?spid=74763456,,2.0,aohoodie,226000.0
262,Áo hoodies nam nữ họa tiết Tom and Jerry đình đám hot hit,73000,https://tiki.vn/ao-hoodies-nam-nu-hoa-tiet-tom-and-jerry-dinh-dam-hot-hit-p75544752.html?spid=76747438,,1.0,aohoodie,73000.0
263,ÁO SWEATER NỈ BÔNG THỜI TRANG THU ĐÔNG - GV026,150000,https://tiki.vn/ao-sweater-ni-bong-thoi-trang-gv026-p26628034.html?spid=95001963,,1.0,aohoodie,150000.0
264,Áo Hoodie Chất Vải Cotton Màu Trắng Trơn Có Đủ Size M L XL,99000,https://tiki.vn/ao-hoodie-chat-vai-cotton-mau-trang-tron-co-du-size-m-l-xl-p50581440.html?spid=51116620,,32.0,aohoodie,3168000.0
265,Áo Hoodie Original-Freesize dưới 70kg,100000,https://tiki.vn/ao-hoodie-original-freesize-duoi-70kg-p67996793.html?spid=71180541,,3.0,aohoodie,300000.0
266,Áo hoodie nỉ unisex form rộng FACLY nam nữ phong cách ulzzang,112000,https://tiki.vn/free-ship-hoan-xu-ao-hoodie-ni-unisex-form-rong-facly-nam-nu-phong-cach-ulzzang-wind-p117155031.html?spid=117155049,,4.0,aohoodie,448000.0
267,ÁO KHOÁC NỈ HOODIE. ÁO HOOIDE CHUI NAM NỮ,101000,https://tiki.vn/ao-khoac-ni-hoodie-ao-hooide-chui-nam-nu-p112990514.html?spid=112990524,,1.0,aohoodie,101000.0
268,Áo mũ Hoodie Unisex nỉ bông trơn basic cặp đôi nam nữ Oversize Ulzzang Hàn Quốc thu đông form rộng 5 MÀU,98000,https://tiki.vn/ao-mu-hoodie-unisex-ni-bong-tron-basic-cap-doi-nam-nu-oversize-ulzzang-han-quoc-thu-dong-form-rong-5-mau-p104268252.html?spid=107017479,,2.0,aohoodie,196000.0
269,"Áo khoác Hoodie Nam, Hoodie Basic Unisex Nỉ From Rộng NÓN 2 LỚP PHẢN QUANG 7 MÀU, Áo hoodie nam nữ, Áo sweater nỉ nam nữ from rộng Unisex chất nỉ ngoại 2 lớp dày dặn",123000,https://tiki.vn/ao-khoac-hoodie-nam-hoodie-basic-unisex-ni-from-rong-non-2-lop-phan-quang-7-mau-p140865472.html?spid=140865476,,1.0,aohoodie,123000.0
270,Áo Hoodie Trơn Màu Xám Đậm Cao Cấp Dáng Rộng Unisex Nam Nữ Mặc Được - MM,120000,https://tiki.vn/ao-hoodie-tron-mau-xam-dam-cao-cap-dang-rong-unisex-nam-nu-mac-duoc-mm-p106375647.html?spid=106375651,,7.0,aohoodie,840000.0
271,áo hoodie nam nữ,100000,https://tiki.vn/ao-hoodie-nam-nu-p73473251.html?spid=73473253,,2.0,aohoodie,200000.0
272,Áo hoodies sweater nam nữ dây kéo from to y hình phong cách FASHION,99000,https://tiki.vn/ao-hoodies-sweater-nam-nu-day-keo-from-to-y-hinh-phong-cach-lana-fashion-p195301564.html?spid=195301597,,1.0,aohoodie,99000.0
273,"Áo Hoodie Nỉ Bông In Chữ ABC Trước Ngực Có Mũ, Áo hoodie nỉ thêu chữ ABC phong cách basic dễ phối đồ dễ mặc, Áo Hoodies cặp đôi ABC Cao Cấp, Áo Khoác Hoodie Nam Nữ Họa Tiêt ABC Hot Trend street wear dáng rộng",99000,https://tiki.vn/ao-hoodie-ni-bong-in-chu-abc-truoc-nguc-co-mu-ao-hoodie-ni-theu-chu-abc-phong-cach-basic-de-phoi-do-de-mac-ao-hoodies-cap-doi-abc-cao-cap-ao-khoac-hoodie-nam-nu-hoa-tiet-abc-hot-trend-street-wear-dang-rong-p221225184.html?spid=221225190,,1.0,aohoodie,99000.0
274,Áo AMong Us Hoodie Màu Trắng Hình Đỏ Chất Liệu Nỉ Bông Dầy Dặn Mềm Mịn Kiểu Dáng Trẻ Trung Phù Hợp Dành Cho Cả Nam Và Nữ Đủ Size 19 - 99 kg,153000,https://tiki.vn/ao-among-us-hoodie-mau-trang-hinh-do-chat-lieu-ni-bong-day-dan-mem-min-kieu-dang-tre-trung-phu-hop-danh-cho-ca-nam-va-nu-du-size-19-99-kg-p75740914.html?spid=75740916,,7.0,aohoodie,1071000.0
275,Áo hoodie nam thiết kế siêu mạnh mẽ phá cách chất dày hịn hịn KMG,93000,https://tiki.vn/ao-hoodie-nam-thiet-ke-sieu-manh-me-pha-cach-chat-day-hin-hin-kmg-p98156785.html?spid=145757977,,1.0,aohoodie,93000.0
276,"Áo hoodie, áo sweater trơn nam nữ",99000,https://tiki.vn/ao-hoodie-ao-sweater-tron-nam-nu-p72747421.html?spid=72747425,-24%,51.0,aohoodie,5049000.0
277,ÁO HOODIE UNISEX CHỢ BẾN THÀNH Nam Nữ BASIC CAO CẤP,73000,https://tiki.vn/ao-hoodie-unisex-cho-ben-thanh-nam-nu-basic-cao-cap-p249248404.html?spid=249248470,-24%,1.0,aohoodie,73000.0
278,Áo khoác nỉ bông cotton dày mịn - hoodie form rộng unisex 1885 - 2N Unisex,209000,https://tiki.vn/ao-khoac-ni-bong-cotton-day-min-hoodie-form-rong-unisex-1885-2n-unisex-p217176750.html?spid=217176784,-28%,9.0,aohoodie,1881000.0
279,"Áo hoodie, áo sweater trơn nam nữ",85000,https://tiki.vn/ao-hoodie-ao-sweater-tron-nam-nu-p72741081.html?spid=72741087,-60%,19.0,aohoodie,1615000.0
280,Áo khoác nỉ bông cotton dày mịn - hoodie form rộng unisex 1971 - 2N Unisex,209000,https://tiki.vn/ao-khoac-ni-bong-cotton-day-min-hoodie-form-rong-unisex-1971-2n-unisex-p156000686.html?spid=156000701,-30%,5.0,aohoodie,1045000.0
281,(ĐU TREND) Áo Hoodie DREW Unisex Nam Nữ thu đông Nỉ Ngoại From Rộng,127000,https://tiki.vn/du-trend-ao-hoodie-drew-unisex-ulzzang-nam-nu-thu-dong-ni-ngoai-from-rong-p145243109.html?spid=205674709,,9.0,aohoodie,1143000.0
282,Áo nỉ Hoodie nỉ ngoại unisex trơn đủ màu (unisex nam nữ đều mặc được),78900,https://tiki.vn/ao-ni-hoodie-ni-ngoai-unisex-tron-du-mau-unisex-nam-nu-deu-mac-duoc-p77712586.html?spid=90464648,,26.0,aohoodie,2051400.0
283,Áo Khoác hoodie khóa kéo có nón form rộng Đen Khoá Kéo Siêu Hot 2023 dành cho nam và nữ,75400,https://tiki.vn/ao-khoac-hoodie-khoa-keo-co-non-form-rong-den-khoa-keo-sieu-hot-2023-danh-cho-nam-va-nu-p262516110.html?spid=262516112,,2.0,aohoodie,150800.0
284,áo hoodie from rộng Nam Nữ HD11,99000,https://tiki.vn/ao-hoodie-from-rong-nam-nu-hd11-p41276019.html?spid=42469609,,12.0,aohoodie,1188000.0
285,Áo Hoodie nam nữ trơn vải nỉ ( POLY ) cao cấp áo khoác unisex dáng rộng đẹp,97000,https://tiki.vn/ao-hoodie-nam-nu-tron-vai-ni-poly-cao-cap-ao-khoac-unisex-dang-rong-dep-p158138687.html?spid=176716020,,7.0,aohoodie,679000.0
286,Áo khoác nam nữ hoodie,115000,https://tiki.vn/ao-khoac-nam-nu-hoodie-p273187672.html?spid=273187674,,1.0,aohoodie,115000.0
287,"ÁO HOODIE TIẾNG NHẬT UNISEX, Áo Hoodie Chữ Nhật Unisex Form Rộng Tay Bồng, Áo Hoodie Nam Nữ Có Mũ Chữ Nhật, Áo Hoodie Chữ Nhật Có Mũ hình gấu, ÁO HOODIE ULZZANG UNISEX CHỮ NHẬT",100000,https://tiki.vn/ao-hoodie-tieng-nhat-unisex-ao-hoodie-chu-nhat-unisex-form-rong-tay-bong-ao-hoodie-nam-nu-co-mu-chu-nhat-ao-hoodie-chu-nhat-co-mu-hinh-gau-ao-hoodie-ulzzang-unisex-chu-nhat-p91533024.html?spid=91533028,,38.0,aohoodie,3800000.0
288,Combo Áo Khoác Hoodie Cặp -Couple Nam Nữ Trắng (Đen) -Trơn Nỉ Bông -Thời Trang Kactus Cao Cấp,165000,https://tiki.vn/combo-ao-khoac-hoodie-cap-couple-nam-nu-trang-den-tron-ni-bong-thoi-trang-kactus-cao-cap-p49655141.html?spid=51116631,,12.0,aohoodie,1980000.0
289,Áo Sweater Nam Nữ Form Rộng - nỉ chui thường không nón,86000,https://tiki.vn/ao-sweater-nam-nu-form-rong-ni-chui-thuong-khong-non-p78548052.html?spid=78548062,,25.0,aohoodie,2150000.0
290,Áo sweater thời trang nam nữ phong cách Basic in hoạt hình Kaws dễ thương - FORMENSHOP - FMGV036,119000,https://tiki.vn/ao-sweater-thoi-trang-nam-nu-phong-cach-basic-in-hoat-hinh-kaws-de-thuong---formenshop---fmgv036-p75929061.html?spid=75929063,,31.0,aohoodie,3689000.0
291,"Áo khoác hoodie unisex cotton hình Night camp, Áo Hoodie phản quang 7 màu ATNIGHT form dưới 70kg decan in xịn, áo hoodie nam nữ unisex ulzzang phông rộng quảng châu phong cách hàn quốc",115000,https://tiki.vn/ao-khoac-hoodie-unisex-cotton-hinh-night-camp-ao-hoodie-phan-quang-7-mau-atnight-form-duoi-70kg-decan-in-xin-ao-hoodie-nam-nu-unisex-ulzzang-phong-rong-quang-chau-phong-cach-han-quoc-p129459054.html?spid=129459056,,6.0,aohoodie,690000.0
292,"áO KHOÁC NỈ HOODIE. ÁO HOOIDE UNISEX NAM NỮ (ĐỦ SIZE M, L, XL)",102000,https://tiki.vn/ao-khoac-ni-hoodie-ao-hooide-unisex-nam-nu-du-size-m-l-xl-p103103964.html?spid=105220472,,1.0,aohoodie,102000.0
293,Sweater Nỉ Trơn - Áo Nỉ Dài Tay Unisex Form Rộng Thời Trang Nam Nữ Phong Cách Hàn Quốc,103000,https://tiki.vn/sweater-ni-tron-ao-ni-dai-tay-unisex-form-rong-thoi-trang-nam-nu-phong-cach-han-quoc-p144965154.html?spid=205674739,,3.0,aohoodie,309000.0
294,Áo Sweater Trơn Chất Nỉ Lót Bông Màu Xám Đậm - Sweater Unisex - MM,109000,https://tiki.vn/ao-sweater-tron-chat-ni-lot-bong-mau-xam-dam-sweater-unisex-mm-p108428506.html?spid=108428512,,1.0,aohoodie,109000.0
295,"Áo Hoodie Drew phản quang, Áo Hoodie nam nữ tay dài chất nỉ bông dày dặn, Áo hoodie in phản quang màu bạc thun nỉ ngoại decal in xịn form dưới 70kg, áo khoác hoodie nam nữ from rộng unisex ulzzang quảng châu cao cấp",128000,https://tiki.vn/ao-hoodie-drew-phan-quang-ao-hoodie-nam-nu-tay-dai-chat-ni-bong-day-dan-ao-hoodie-in-phan-quang-mau-bac-thun-ni-ngoai-decal-in-xin-form-duoi-70kg-ao-khoac-hoodie-nam-nu-from-rong-unisex-ulzzang-quang-chau-cao-cap-p129233676.html?spid=145613845,,3.0,aohoodie,384000.0
296,Áo Khoác Hoodie Màu Trắng Hình Xanh Among Us Chất Nỉ Mềm Mịn Dành Cho Cả Nam Và Nữ,155000,https://tiki.vn/ao-khoac-hoodie-mau-trang-hinh-xanh-among-us-chat-ni-mem-min-danh-cho-ca-nam-va-nu-p74747313.html?spid=74747321,,13.0,aohoodie,2015000.0
297,Áo Khoác HoodieTim Cặp Đôi Nam Nữ RẺ ĐẸP Áo Hoodie Unisex Nỉ Tay Dài Chống Nắng Tốt - Couple Xinh Kiểu Jacket,93000,https://tiki.vn/ao-khoac-hoodietim-cap-doi-nam-nu-freeship-re-dep-ao-hoodie-unisex-ni-tay-dai-chong-nang-tot-couple-xinh-kieu-jacket-p119321076.html?spid=143415862,,2.0,aohoodie,186000.0
298,"Áo hoodie len nam, chất len mềm mịn, thích hợp mùa đông, thời trang trẻ, phong cách Hàn Quốc",230000,https://tiki.vn/ao-hoodie-len-nam-lahstore-chat-len-mem-min-thich-hop-mua-dong-thoi-trang-tre-phong-cach-han-quoc-p37523077.html?spid=58383779,,6.0,aohoodie,1380000.0
299,Áo khoác nỉ bông cotton dày mịn - hoodie form rộng unisex represent - 2N Unisex,199000,https://tiki.vn/ao-khoac-ni-bong-cotton-day-min-hoodie-form-rong-unisex-represent-2n-unisex-p156000687.html?spid=156000702,,2.0,aohoodie,398000.0
300,Áo hoodie trơn khoá kéo,135000,https://tiki.vn/ao-hoodie-tron-khoa-keo-p84203064.html?spid=84203065,,8.0,aohoodie,1080000.0
301,Áo Hoodie Trơn Màu Trắng Cao Cấp Dáng Rộng Unisex Nam Nữ Mặc Được - MM,95000,https://tiki.vn/ao-hoodie-tron-mau-trang-cao-cap-dang-rong-unisex-nam-nu-mac-duoc-mm-p106317438.html?spid=163566815,,2.0,aohoodie,190000.0
302,Áo Hoodie Nỉ Ngoại Trơn Đủ Màu ( unisex nam nữ đều mặc được),98000,https://tiki.vn/ao-hoodie-ni-ngoai-tron-du-mau-unisex-nam-nu-deu-mac-duoc-p77712163.html?spid=78020527,-40%,26.0,aohoodie,2548000.0
303,Áo nỉ Hoodie GRAYS Áo hoodie nam nữ nỉ bông thu đông dày dặn,179000,https://tiki.vn/ao-ni-hoodie-grays-hogoto-shop-ao-hoodie-nam-nu-ni-bong-cotton-p146559695.html?spid=146559772,,1.0,aohoodie,179000.0
304,Áo Sweater Nam Nữ | Nỉ Bông Trắng Trơn Thời Trang Cao Cấp,97000,https://tiki.vn/ao-sweater-nam-nu-ni-bong-trang-tron-thoi-trang-cao-cap-p50680163.html?spid=51993442,,76.0,aohoodie,7372000.0
