,title,price,link_item,discount,sales,category,revenue
305,"Áo khoác hoodie Kill System So Sad oversize có nón nam nữ, vải nỉ bông chân cua phong cách unisex, Hoodie Nỉ Ngoại Too Young Toneso Sad Unisex Jacket form rộng tay bồng kiểu dáng đường phố hàn quốc",100000,https://tiki.vn/ao-khoac-hoodie-kill-system-so-sad-oversize-co-non-nam-nu-vai-ni-bong-chan-cua-phong-cach-unisex-hoodie-ni-ngoai-too-young-toneso-sad-unisex-jacket-form-rong-tay-bong-kieu-dang-duong-pho-han-quoc-p197720684.html?spid=197720690,,5.0,aohoodie,500000.0
306,Áo Hoodie form rộng có nón unisex chất nỉ bông dành cho nam và nữ kiểu dáng basic G5,77000,https://tiki.vn/ao-hoodie-form-rong-co-non-unisex-chat-ni-bong-danh-cho-nam-va-nu-kieu-dang-basic-g5-p249241045.html?spid=249241062,,1.0,aohoodie,77000.0
307,Áo Hoodie Nỉ Bông In Hình Form Unisex Nam Nữ,101000,https://tiki.vn/ao-hoodie-ni-bong-in-hinh-form-unisex-nam-nu-p193180803.html?spid=193180808,,9.0,aohoodie,909000.0
308,"Áo nỉ hoodie nam nữ in hình độc lạ form rộng hàn quốc dưới 70kg, chất nỉ mềm mịn, Áo nỉ hoodie nam nữ form rộng,Aó hoodie nam , áo hoodie nữ , áo khoác áo hoodie cặp đôi nam nữ mặc",100000,https://tiki.vn/ao-ni-hoodie-nam-nu-in-hinh-doc-la-form-rong-han-quoc-duoi-70kg-chat-ni-mem-min-ao-ni-hoodie-nam-nu-form-rong-ao-hoodie-nam-ao-hoodie-nu-ao-khoac-ao-hoodie-cap-doi-nam-nu-mac-p84558587.html?spid=84558599,,33.0,aohoodie,3300000.0
309,"Áo hoodie nam , áo hoodie nữ , áo hoodie cặp đôi / áo khoác nam nữ , áo khoác cặp đôi form rộng nam nữ mặc vải nỉ ngoại ko xù ko nhão",104000,https://tiki.vn/ao-hoodie-nam-ao-hoodie-nu-ao-hoodie-cap-doi-ao-khoac-nam-nu-ao-khoac-cap-doi-form-rong-nam-nu-mac-vai-ni-ngoai-ko-xu-ko-nhao-p81938111.html?spid=84565167,,7.0,aohoodie,728000.0
310,áo hoodie nam nữ,100000,https://tiki.vn/ao-hoodie-nam-nu-p73160915.html?spid=73160923,,6.0,aohoodie,600000.0
311,Áo Hoodie Trơn BASIC Form Rộng Vải Nỉ Cotton Lót Bông Unisex Ulzzang,105000,https://tiki.vn/ao-hoodie-tron-basic-form-rong-vai-ni-cotton-lot-bong-unisex-ulzzang-p177996622.html?spid=177996644,,6.0,aohoodie,630000.0
312,Áo Khoác Hoodie AMONG US Màu Trắng Hình Xanh TRUST NO ONE Chất Liệu Nỉ Mềm Mịn Hình In Sắc Nét Dành Cho Cả Nam Và Nữ,153000,https://tiki.vn/ao-khoac-hoodie-among-us-mau-trang-hinh-xanh-trust-no-one-chat-lieu-ni-mem-min-hinh-in-sac-net-danh-cho-ca-nam-va-nu-p75741374.html?spid=75741384,,14.0,aohoodie,2142000.0
313,"Áo khoác nam BIGFOX thu đông, áo hoodie nam tuổi teen dài tay hình mặt cười 45 - 65kg",165000,https://tiki.vn/ao-khoac-nam-bigfox-thu-dong-ao-hoodie-nam-tuoi-teen-dai-tay-hinh-mat-cuoi-45-65kg-p136715268.html?spid=136715276,,3.0,aohoodie,495000.0
314,SWE - Áo Hoodie có nón nam nữ KID HOODIE 100% nỉ bông thời trang chính hãng,682000,https://tiki.vn/swe-ao-hoodie-co-non-nam-nu-kid-hoodie-100-ni-bong-thoi-trang-chinh-hang-p208077328.html?spid=208077330,,3.0,aohoodie,2046000.0
315,"Áo khoác Hoodie Nam, Hoodie Basic Unisex Nỉ From Rộng NÓN 2 LỚP PHẢN QUANG 7 MÀU, Áo khoác Nỉ form rộng HÀN QUỐC,có nón và dây kéo HOODIE ZIP, 7 MÀU kiểu dáng UNISEX NAM NỮ",129000,https://tiki.vn/ao-khoac-hoodie-nam-hoodie-basic-unisex-ni-from-rong-non-2-lop-phan-quang-7-mau-p140865500.html?spid=140865507,,7.0,aohoodie,903000.0
316,"Áo Hoodie phản quang 7 màu CAOHEUSN form dưới 70kg decan in xịn, áo khoác hoodie in hình tam giác unisex dáng rộng quảng châu phong cách hàn quốc, áo hoodie nam, áo hoodie nữ",125000,https://tiki.vn/ao-hoodie-phan-quang-7-mau-caoheusn-form-duoi-70kg-decan-in-xin-ao-khoac-hoodie-in-hinh-tam-giac-unisex-dang-rong-quang-chau-phong-cach-han-quoc-ao-hoodie-nam-ao-hoodie-nu-p129427318.html?spid=129427324,,1.0,aohoodie,125000.0
317,"ÁO HOODIE NỈ MÀU XÁM, ĐEN, XANH RÊU TRƠN FORM UNISEX NAM NỮ",76500,https://tiki.vn/ao-hoodie-ni-mau-xam-den-xanh-reu-tron-form-unisex-nam-nu-p262513294.html?spid=262513296,,1.0,aohoodie,76500.0
318,Áo Khoác Hoodie Nỉ chống nắng Dành Cho Nam Cho Nữ Không Có Mũ Chất Nỉ Form rộng in hình Hộp Sữa Unisex,106000,https://tiki.vn/ao-khoac-hoodie-ni-chong-nang-danh-cho-nam-cho-nu-khong-co-mu-chat-ni-form-rong-in-hinh-hop-sua-unisex-p80622076.html?spid=80622084,,21.0,aohoodie,2226000.0
319,Áo Hoodie Nỉ - Áo Khoác Nỉ Nam Nữ Unisex MMF 2 Màu Cực Hot - Kèm DEAL Sốc,93000,https://tiki.vn/ao-hoodie-ni-ao-khoac-ni-nam-nu-unisex-mmf-2-mau-cuc-hot-kem-deal-soc-p137669862.html?spid=183371230,,2.0,aohoodie,186000.0
320,"Áo hoodie form rộng in hình cá tính nhiều màu, Áo Hoodie Dáng Rộng In Hình Kỳ Lân Phong Cách Hàn Quốc Năng Động, Áo khoác hoodie CONXINH hình in Con Lân thời trang",109000,https://tiki.vn/ao-hoodie-form-rong-in-hinh-ca-tinh-nhieu-mau-ao-hoodie-dang-rong-in-hinh-ky-lan-phong-cach-han-quoc-nang-dong-ao-khoac-hoodie-conxinh-hinh-in-con-lan-thoi-trang-p242132428.html?spid=242132446,,1.0,aohoodie,109000.0
321,"Áo khoác hoodie nam AKUBA form oversize, chất liệu dày dặn, bền màu 01C513",435000,https://tiki.vn/ao-khoac-hoodie-nam-akuba-form-oversize-chat-lieu-day-dan-ben-mau-01c513-p146222852.html?spid=146222872,,15.0,aohoodie,6525000.0
322,ÁO KHOÁC HOODIE NAM NƯ FORM RỘNG,93000,https://tiki.vn/ao-khoac-hoodie-nam-nu-form-rong-p104711546.html?spid=155611105,,1.0,aohoodie,93000.0
323,ÁO HOODIE MICKEY BIG HEART Nỉ Ngoại Cao Cấp - In Pet Siêu Bền Siêu Đẹp (HD6070 - Kèm Ảnh Thật) (TONI SHOP),139000,https://tiki.vn/ao-hoodie-mickey-big-heart-ni-ngoai-cao-cap-in-pet-sieu-ben-sieu-dep-hd6070-kem-anh-that-toni-shop-p263311555.html?spid=263311794,-30%,1.0,aohoodie,139000.0
324,Áo Khoác nỉ Hoodie màu trắng hình Among Us đỏ cực chất,158000,https://tiki.vn/ao-khoac-ni-hoodie-mau-trang-hinh-among-us-do-cuc-chat-p74763147.html?spid=74763151,,7.0,aohoodie,1106000.0
325,Áo Among Us [ SỐ LƯỢNG CÓ HẠN ] Hoodie Màu Đen Hình Đỏ dài tay chất nỉ cực đẹp 2021,155000,https://tiki.vn/ao-among-us-so-luong-co-han-hoodie-mau-den-hinh-do-dai-tay-chat-ni-cuc-dep-2021-p74729207.html?spid=74729209,,19.0,aohoodie,2945000.0
326,"(Hot Trend) Áo hoodie drew mẫu chữ, hoodie nam nữ unisex vải nỉ dày dặn",179000,https://tiki.vn/hot-trend-ao-hoodie-drew-mau-chu-hoodie-nam-va-nu-nc004-2it-shop-p145242919.html?spid=145242973,,1.0,aohoodie,179000.0
327,Áo hoodie nam trơn màu hồng phấn,99000,https://tiki.vn/ao-hoodie-nam-tron-mau-hong-phan-p41344968.html?spid=50451886,,49.0,aohoodie,4851000.0
328,Áo khoác hoodie xanh rêu in chữ EIGHT form rộng chống nắng vải nỉ lót bông nam nữ unisex,152000,https://tiki.vn/ao-khoac-hoodie-xanh-reu-in-chu-eight-form-rong-chong-nang-vai-ni-lot-bong-nam-nu-unisex-p270075161.html?spid=270075169,,2.0,aohoodie,304000.0
329,Áo Khoác Free Fire BooYah [ HÀNG MỚI VỀ ] Màu Đen Có Nón Kiểu Dáng Hoodie Cực Chất 2020,166000,https://tiki.vn/ao-khoac-free-fire-booyah-hang-moi-ve-mau-den-co-non-kieu-dang-hoodie-cuc-chat-2020-p70663864.html?spid=70663868,,64.0,aohoodie,10624000.0
330,Áo hoodie nam ấm áp in hình cá tính mẫu Hot thu đông,79000,https://tiki.vn/ao-hoodie-nam-am-ap-mua-dong-hot-2018-p6377083.html?spid=48723566,,23.0,aohoodie,1817000.0
331,"Áo hoodie essential , hollister Nam Nữ UNISEX - ÁO NỈ HOODIE NAM NỮ FROM RỘNG HÀN QUÔC",133000,https://tiki.vn/ao-hoodie-essential-hollister-nam-nu-unisex-ao-ni-hoodie-nam-nu-from-rong-han-quoc-p121319814.html?spid=148697940,,1.0,aohoodie,133000.0
332,"Áo hoodie nam, áo hoodie nữ, áo hoodie trơn, áo chồng cổ, áo chui đầu, áo sweater",103000,https://tiki.vn/ao-hoodie-nam-ao-hoodie-nu-ao-hoodie-tron-ao-chong-co-ao-chui-dau-ao-sweater-ao-hoodie-ulzzang-ao-hoodie-unisex-p74763477.html?spid=74763493,,12.0,aohoodie,1236000.0
333,"Áo hoodie nam, Áo hoodie trơn khoác nỉ sweat nỉ thu đông nam nữ",98000,https://tiki.vn/ao-hoodie-nam-ao-hoodie-tron-khoac-ni-sweat-ni-thu-dong-nam-nu-p139346513.html?spid=205683759,,3.0,aohoodie,294000.0
334,[VIDEO THẬT] Áo nỉ Hoodie Lục Lăng (unisex nam nữ đều mặc được),99000,https://tiki.vn/ao-ni-hoodie-luc-lang-unisex-nam-nu-deu-mac-duoc-p72193155.html?spid=75373058,,1.0,aohoodie,99000.0
335,Áo Hoodie Nỉ trơn đơn giản cá tính,49000,https://tiki.vn/ao-hoodie-ni-tron-don-gian-ca-tinh-p48622497.html?spid=48622503,,27.0,aohoodie,1323000.0
336,Áo khoác hoodie nỉ bông cotton dày mịn - hoodie form rộng unisex thỏ bunny,209000,https://tiki.vn/ao-khoac-hoodie-ni-bong-cotton-day-min-hoodie-form-rong-unisex-tho-bunny-p146458764.html?spid=146458772,,5.0,aohoodie,1045000.0
337,"Áo hoodies sweater nam nữ HOTTREND FORM RỘNG CÓ MŨ CỰC ĐẸP , DÀNH CHO CÁC BẠN TRẺ MẪU MỚI NHẤT HIỆN NAY",95000,https://tiki.vn/ao-hoodies-sweater-nam-nu-hottrend-form-rong-co-mu-cuc-dep-danh-cho-cac-ban-tre-mau-moi-nhat-hien-nay-p195302060.html?spid=195302099,,5.0,aohoodie,475000.0
338,"Áo Hoodie Họa Tiết Con Bò Sữa Cặp Nam Nữ Chất Nỉ PE Cotton Cao Cấp, Áo khoác Hoodie Zip Nỉ Bông Bò Sữa unisex nam nữ đều mặc được Có Clip Cận Chất, Áo hoodie nam / áo hooodie nữ /Áo Hoodie/ Áo Khoác Nỉ Bông Bò Sữa Form Rộng Unisex Nam Nữ HOT TREND 2021",100000,https://tiki.vn/ao-hoodie-hoa-tiet-con-bo-sua-cap-nam-nu-chat-ni-pe-cotton-cao-cap-ao-khoac-hoodie-zip-ni-bong-bo-sua-unisex-nam-nu-deu-mac-duoc-co-clip-can-chat-ao-hoodie-nam-ao-hooodie-nu-ao-hoodie-ao-khoac-ni-bong-bo-sua-form-rong-unisex-nam-nu-hot-trend-2021-p108359020.html?spid=108359021,,14.0,aohoodie,1400000.0
339,"(Video Ảnh Thật ) Áo hoodie THIS'S FACLY áo khoác nỉ form rộng Unisex Nam Nữ Couple đều được, Áo Hoodie tay phồng chất nỉ bông cực mịn chữ nhật - Form rộng Unisex Nam Nữ Couple đều mặc được",103000,https://tiki.vn/video-anh-that-ao-hoodie-this-s-facly-ao-khoac-ni-form-rong-unisex-nam-nu-couple-deu-duoc-ao-hoodie-tay-phong-chat-ni-bong-cuc-min-chu-nhat-form-rong-unisex-nam-nu-couple-deu-mac-duoc-p114415789.html?spid=114415795,,52.0,aohoodie,5356000.0
340,"Áo khoác Hoodie Nam, Hoodie Basic Unisex Nỉ From Rộng NÓN 2 LỚP PHẢN QUANG 7 MÀU, Áo Hoodie Nam Nữ oversize form rộng nam nữ phong cách ulzzang hàn quốc",127000,https://tiki.vn/ao-khoac-hoodie-nam-hoodie-basic-unisex-ni-from-rong-non-2-lop-phan-quang-7-mau-p140865474.html?spid=140865481,-40%,1.0,aohoodie,127000.0
341,[VIDEO THẬT] Áo nỉ Hoodie trơn đủ màu (unisex nam nữ đều mặc được),99000,https://tiki.vn/ao-ni-hoodie-tron-du-mau-unisex-nam-nu-deu-mac-duoc-p72192946.html?spid=75372830,-24%,5.0,aohoodie,495000.0
342,Áo khoác hoodie thời trang unisex New Balance LIFESTYLE HOODIES U ARCTICGR - UT23504AGY (form quốc tế),1257000,https://tiki.vn/ao-khoac-hoodie-thoi-trang-unisex-new-balance-lifestyle-hoodies-u-arcticgr-ut23504agy-form-quoc-te-p196954341.html?spid=196954353,-16%,1.0,aohoodie,1257000.0
343,Áo Hoodie Nam bigsize Đen SST12,99000,https://tiki.vn/ao-hoodie-nam-bigsize-den-sst12-p15777690.html?spid=44713451,-40%,29.0,aohoodie,2871000.0
344,Áo Hoodie Nam Nữ | Nỉ Cotton Đen Trơn Dáng Xuông | Chất Đẹp Cao Cấp,99000,https://tiki.vn/ao-hoodie-nam-nu-ni-cotton-den-tron-dang-xuong-chat-dep-cao-cap-p49762452.html?spid=51116612,-40%,69.0,aohoodie,6831000.0
345,Áo hoodie nam nữ thun nỉ ngoại in hoạt hình 3 chú gấu siêu đáng yêu,102000,https://tiki.vn/ao-hoodie-nam-nu-thun-ni-ngoai-in-hoat-hinh-3-chu-gau-sieu-dang-yeu-p117081402.html?spid=117081407,-50%,2.0,aohoodie,204000.0
346,Áo Hoodie Nỉ Bông Trơn Một Màu Cá Tính Phong Cách Hàn Quốc Năng Động - LZGV016,86000,https://tiki.vn/ao-hoodie-ni-bong-tron-mot-mau-ca-tinh-phong-cach-han-quoc-nang-dong-lzgv016-p67806400.html?spid=68397153,,9.0,aohoodie,774000.0
347,Áo Hoodie In Chữ THINKING THE SAME Chất Nỉ Dày Dặn Form Unisex - FMGV040,159000,https://tiki.vn/ao-hoodie-in-chu-thinking-the-same-chat-ni-day-dan-form-unisex-fmgv040-p75971224.html?spid=75971228,,11.0,aohoodie,1749000.0
348,"ÁO KHOÁC HOODIE NAM NỮ MÀU VÀNG VẢI NỈ DÀY HÌNH TOÁN HỌC REASONS Áo hoodie unisex khoác nỉ bông chui đầu nữ nón 2 lớp dày dặn chất lượng, Áo Nỉ Hoodie Nữ Nam Unisex ulzzang from rộng",123000,https://tiki.vn/ao-khoac-hoodie-nam-nu-mau-vang-vai-ni-day-hinh-toan-hoc-reasons-p117902307.html?spid=117902340,,2.0,aohoodie,246000.0
349,"Áo Khoác Nam Nữ Hoodie Gấu - In Phản Quang 7 Màu From Unisex, Áo khoác hoodie phản quang Gấu Teddy, Áo Hoodie Crush Thỏ/Gấu - Thỏ Bảy Màu, áo hoodie ulzzang nam nữ đều mặc được",129000,https://tiki.vn/ao-khoac-nam-nu-hoodie-gau-in-phan-quang-7-mau-from-unisex-ao-khoac-hoodie-phan-quang-gau-teddy-ao-hoodie-crush-tho-gau-tho-bay-mau-ao-hoodie-ulzzang-nam-nu-deu-mac-duoc-p129451322.html?spid=140123062,,8.0,aohoodie,1032000.0
350,Áo Khoác Hoodie Nỉ Bông in Tom & Jerry Form rộng Unisex Nam Nữ Couple Cực Đẹp,110000,https://tiki.vn/ao-khoac-hoodie-ni-bong-in-tom-jerry-form-rong-unisex-nam-nu-couple-cuc-dep-p137669032.html?spid=157143904,,3.0,aohoodie,330000.0
351,Áo hoodie nam nữ unisex cặp đôi Bến Thành dominion nỉ bông form rộng có mũ,75000,https://tiki.vn/ao-hoodie-nam-nu-unisex-cap-doi-ben-thanh-dominion-ni-bong-form-rong-co-mu-p262515690.html?spid=262515692,,1.0,aohoodie,75000.0
352,Áo Sweater Nam Nữ | Nỉ Bông Đen Chất Liệu Vải Cotton Trơn Đẹp Thời Trang Cao Cấp,93000,https://tiki.vn/ao-sweater-nam-nu-ni-bong-den-chat-lieu-vai-cotton-tron-dep-thoi-trang-cao-cap-p50685964.html?spid=51993444,,23.0,aohoodie,2139000.0
353,ÁO HOODIE THỜI TRANG NAM NỮ UNISEX FORM RỘNG HOẠT HÌNH CHẤT NỈ BÔNG PHONG CÁCH - LZGV034,250000,https://tiki.vn/ao-hoodie-thoi-trang-nam-nu-unisex-form-rong-hoat-hinh-chat-ni-bong-phong-cach-lzgv034-p71909719.html?spid=71909725,,4.0,aohoodie,1000000.0
354,Áo Sweater from rộng cao cấp,165000,https://tiki.vn/ao-sweater-from-rong-cao-cap-p44606987.html?spid=197211860,,1.0,aohoodie,165000.0
355,"Áo Khoác Hoodie Nam Nữ Form rộng chống nắng Có 4 Màu, Unisex hình Lập Phương Ulzzang 123SHOP",99000,https://tiki.vn/ao-khoac-hoodie-nam-nu-form-rong-chong-nang-co-4-mau-unisex-hinh-lap-phuong-ulzzang-123shop-p84471533.html?spid=84471571,,2.0,aohoodie,198000.0
356,"Áo Hoodie Nón Chui Trùm Đầu Nữ Nam Unisex Chất Vải Nỉ Bông PE Dày Mịn Hình Toán Học Reasons, Áo hoodie unisex khoác nỉ bông chui đầu nữ nón 2 lớp dày dặn chất lượng, Áo Nỉ Hoodie Nữ Nam Unisex ulzzang from rộng",89000,https://tiki.vn/ao-hoodie-non-chui-trum-dau-nu-nam-unisex-chat-vai-ni-bong-pe-day-min-hinh-toan-hoc-reasons-ao-hoodie-unisex-khoac-ni-bong-chui-dau-nu-non-2-lop-day-dan-chat-luong-ao-ni-hoodie-nu-nam-unisex-ulzzang-from-rong-p115119322.html?spid=115119338,,7.0,aohoodie,623000.0
357,"Áo hoodie nam , áo hoodie nữ , áo hoodie vải nỉ ngoại",100000,https://tiki.vn/ao-hoodie-nam-ao-hoodie-nu-ao-hoodie-vai-ni-ngoai-p74595877.html?spid=74595879,,3.0,aohoodie,300000.0
358,"Áo hoodie nỉ bông cotton mịn 100% không xù, dày dặn cao cấp form rộng unisex",299000,https://tiki.vn/ao-hoodie-ni-bong-cotton-min-100-khong-xu-day-dan-cao-cap-form-rong-unisex-p208066630.html?spid=208066641,-23%,2.0,aohoodie,598000.0
359,Áo Hoodie Trơn Màu Tím Cao Cấp Dáng Rộng Unisex Nam Nữ Mặc Được - MM - M,120000,https://tiki.vn/ao-hoodie-tron-mau-tim-cao-cap-dang-rong-unisex-nam-nu-mac-duoc-mm-p106361741.html?spid=106361743,,1.0,aohoodie,120000.0
360,"Áo Hoodie Chất Nỉ màu đỏ-Áo NỈ hàn Quốc,Áo khoác hoodie nỉ bông dưới 60kg - 4 màu Daski phong cách nelly ulzzang",117000,https://tiki.vn/ao-hoodie-chat-ni-mau-do-ao-ni-han-quoc-duoi-60kg-p117902781.html?spid=117902783,,1.0,aohoodie,117000.0
361,"áo hoodie hoạt hình, áo hoodie cute, áo hoodie hàn quốc",115000,https://tiki.vn/ao-hoodie-hoat-hinh-ao-hoodie-cute-ao-hoodie-han-quoc-p76098690.html?spid=76098696,,5.0,aohoodie,575000.0
362,Áo mũ Hoodie Unisex Phong Boutique Gấu X form rộng 5 màu nỉ bông cặp đôi nam nữ Oversize Ulzzang thu đông,117000,https://tiki.vn/ao-mu-hoodie-unisex-phong-boutique-gau-x-form-rong-5-mau-ni-bong-cap-doi-nam-nu-oversize-ulzzang-thu-dong-p137960335.html?spid=272417229,,1.0,aohoodie,117000.0
363,Áo hoodie nam nữ unisex cặp đôi sweater local brand hàn quốc cute khoác zip choàng cardigan chống nắng LILO AND STITCH SamMy96 Shop,96000,https://tiki.vn/ao-hoodie-nam-nu-unisex-cap-doi-sweater-local-brand-han-quoc-cute-khoac-zip-choang-cardigan-chong-nang-lilo-and-stitch-p117922814.html?spid=142210485,,6.0,aohoodie,576000.0
364,Aó khoác nam HOODIE AKN468,69000,https://tiki.vn/ao-khoac-nam-hoodie-akn468-xxl-p53707526.html?spid=53707532,,1.0,aohoodie,69000.0
365,áo hoodie from rộng Nam Nữ HD12,99000,https://tiki.vn/ao-hoodie-from-rong-nam-nu-hd12-p41275931.html?spid=42469607,,106.0,aohoodie,10494000.0
366,"áo hoodie in phản quan, áo hoodie ulzzang, áo hoodie cá tính, áo hoodie nam nữ đều mặc được",115000,https://tiki.vn/ao-hoodie-in-phan-quan-ao-hoodie-ulzzang-ao-hoodie-ca-tinh-ao-hoodie-nam-nu-deu-mac-duoc-p76255587.html?spid=76255589,,6.0,aohoodie,690000.0
367,Áo Hoodie Nam Nữ| Nỉ Cotton Trắng Trơn Dáng Xuông | Đủ Size S M L XL Cao Cấp,98000,https://tiki.vn/ao-hoodie-nam-nu-ni-cotton-trang-tron-dang-xuong-du-size-s-m-l-xl-cao-cap-p49346926.html?spid=51116611,,83.0,aohoodie,8134000.0
368,ÁO SWEATER UNISEX NAM NỮ IN LOGO GẤU BROWN VẢI NỈ BÔNG MỀM MỊN,69000,https://tiki.vn/ao-sweater-unisex-nam-nu-in-logo-gau-brown-vai-ni-bong-mem-min-p204249964.html?spid=204249983,,1.0,aohoodie,69000.0
369,"Áo bomber nam nữ hàng quảng châu, áo hoodie sweater nam nữ IB phối viền, áo cardigan nam nữ unisex from rộng phong cách hàn quốc",99000,https://tiki.vn/ao-bomber-nam-nu-hang-loi-mong-hoodie-sweater-nam-nu-hang-loi-ban-do-xa-dong-gia-99k-p134405915.html?spid=134405933,,3.0,aohoodie,297000.0
370,áo Hoodie THE WEIRD màu xám unisex ảnh thật SSSTore ( nam nữ mặc đều được),105000,https://tiki.vn/ao-hoodie-the-weird-mau-xam-unisex-anh-that-ssstore-nam-nu-mac-deu-duoc-p151841751.html?spid=177964349,,1.0,aohoodie,105000.0
371,Áo Hoodie Nỉ Cotton Trắng Trơn Đủ Size S M L XL Cao Cấp,99000,https://tiki.vn/ao-hoodie-ni-cotton-trang-tron-du-size-s-m-l-xl-cao-cap-p48584223.html?spid=51116610,,12.0,aohoodie,1188000.0
372,"Áo hoodie unisex ulzzang trơn LADOS - 9064 chất nỉ cotton dày dặn, ấm áp",249000,https://tiki.vn/ao-hoodie-unisex-ulzzang-tron-lados-9064-chat-ni-cotton-day-dan-am-ap-p163148914.html?spid=163148923,,2.0,aohoodie,498000.0
373,Áo hoodie nỉ bông form rộng unisex cotton mịn 100% không xù cao cấp form rộng unisex,299000,https://tiki.vn/ao-hoodie-ni-bong-form-rong-unisex-cotton-min-100-khong-xu-cao-cap-form-rong-unisex-p208066096.html?spid=208066102,,1.0,aohoodie,299000.0
374,Áo Sweater Áo nỉ da cá cổ tròn xuất Nhật chất cotton 100,92000,https://tiki.vn/ao-sweater-ao-ni-da-ca-co-tron-xuat-nhat-chat-cotton-100-p73157754.html?spid=85510900,,5.0,aohoodie,460000.0
375,Áo Hoodie Basic nỉ bông Unisex màu trắng,91000,https://tiki.vn/ao-hoodie-basic-ni-bong-unisex-mau-trang-p50594756.html?spid=70796275,,6.0,aohoodie,546000.0
376,Áo thun sweater nam nữ in quả cầu,93000,https://tiki.vn/ao-thun-sweater-nam-nu-in-qua-cau-p88737618.html?spid=97765464,,1.0,aohoodie,93000.0
377,Áo hoddie màu nam nữ,104000,https://tiki.vn/ao-hoddie-mau-nam-nu-p37170710.html?spid=43602018,,14.0,aohoodie,1456000.0
378,Áo Hoodie Nỉ Cotton Đen Trơn Đủ Size S M L XL Cao Cấp,99000,https://tiki.vn/ao-hoodie-ni-cotton-den-tron-du-size-s-m-l-xl-cao-cap-p48579478.html?spid=51116621,,84.0,aohoodie,8316000.0
