title,price,link_item,index,discount,sales,category
Quạt Trần Panasonic F-60TDN -Hàng Chính Hãng,4.690.000₫,https://tiki.vn/quat-tran-panasonic-f-60tdn-hang-chinh-hang-p21405584.html?spid=19742170,1,,Đã bán 5,thietbigiadinh
"Phụ kiện Robot Hút Bụi Roborock S7, S7 MaxV, S7 MaxV Ultra - Lọc Hepa, Chổi chính, Chổi cạnh, Khăn Lau, Túi đựng rác",25.000₫,https://tiki.vn/phu-kien-robot-hut-bui-roborock-s7-s7-maxv-s7-maxv-ultra-loc-hepa-choi-chinh-choi-canh-khan-lau-tui-dung-rac-p248342509.html?spid=248342524,2,-3%,Đã bán 42,thietbigiadinh
"Quạt thông gió gắn tường TICO kèm chớp chống hắt mưa biệt thự lắp cho lỗ chờ 20x20cm, chất liệu nhôm sơn tĩnh điện",615.000₫,https://tiki.vn/quat-thong-gio-gan-tuong-tico-kem-chop-chong-hat-mua-biet-thu-lap-cho-lo-cho-20x20cm-chat-lieu-nhom-son-tinh-dien-p137114259.html?spid=137114260,3,-10%,Đã bán 22,thietbigiadinh
"Máy hút bụi không dây Electrolux UltimateHome 300 EFP31315 - Hiệu suất cao, Làm sạch mọi ngóc ngách, Dễ dàng vệ sinh và bảo trì [Hàng chính hãng]",3.890.000,https://tiki.vn/may-hut-bui-khong-day-electrolux-ultimatehome-300-efp31315-hieu-suat-cao-lam-sach-moi-ngoc-ngach-de-dang-ve-sinh-va-bao-tri-hang-chinh-hang-p262305055.html?spid=262305056,4,-31%,Đã bán 1,thietbigiadinh
,,https://tiki.vn/tong-do-cat-toc-chuyen-nghiep-kemei-1996-p50328112.html?spid=72315718,5,,,thietbigiadinh
Máy lọc không khí tạo ẩm Daikin - MCK55TVM6 - Hàng Chính hãng,7.536.000₫,https://tiki.vn/may-loc-khong-khi-tao-am-daikin-mck55tvm6-chinh-hang-bh-12-thang-p179956040.html?spid=179956045,6,-31%,Đã bán 6,thietbigiadinh
Quạt mini cầm tay có gương 662 3 trong 1 hình heo siêu đáng yêu,30.955₫,https://tiki.vn/quat-mini-cam-tay-co-guong-662-3-trong-1-hinh-heo-sieu-dang-yeu-p21403199.html?spid=27827187,7,-50%,Đã bán 22,thietbigiadinh
Máy May Brother AS2730S - Hàng chính hãng,4.490.000₫,https://tiki.vn/may-may-brother-as2730s-hang-chinh-hang-p377077.html?spid=70032412,8,-9%,Đã bán 45,thietbigiadinh
"Cây nước nóng lạnh để bàn Nhật Bản WD1080E tiết kiệm điện, bình lọc tủ máy lọc nước nóng lạnh mini uống giữ nhiệt phích nước- Hàng Nhập Khẩu",1.040.000,https://tiki.vn/cay-nuoc-nong-lanh-de-ban-nhat-ban-fujie-wd1080e-tiet-kiem-dien-binh-loc-tu-may-loc-nuoc-nong-lanh-mini-uong-giu-nhiet-phich-nuoc-hang-nhat-khau-p196451759.html?spid=196451760,9,-45%,,thietbigiadinh
,,https://tiki.vn/tra-gop-0-robot-hut-bui-eufy-robovac-11s-t2108-by-anker-hut-bui-tu-dong-bao-hanh-12-thang-hang-phan-phoi-chinh-thuc-p253101198.html?spid=253101200,10,-39%,,thietbigiadinh
Máy lọc không khí ô tô xiaomi Eraclean CW-C02 - Hàng nhập khẩu,819.000₫,https://tiki.vn/may-loc-khong-khi-o-to-xiaomi-eraclean-cw-c02-hang-nhap-khau-p181958749.html?spid=181958753,11,-44%,Đã bán 28,thietbigiadinh
Quạt Đeo Cổ Mini Không Cánh WIND hình thú 2 bên siêu cute CS1330 - JL - GIAO NGẪU NHIÊN,117.900,https://tiki.vn/quat-deo-co-mini-khong-canh-wind-hinh-thu-2-ben-sieu-cute-cs1330-jl-giao-ngau-nhien-p261114359.html?spid=261114360,12,,Đã bán 10,thietbigiadinh
,,https://tiki.vn/may-loc-khong-khi-sharp-fp-j30e-b-p126735051.html?spid=126735052,13,,,thietbigiadinh
Máy lau sàn hút bụi tràn viền thông minh JETZT H13,5.490.000₫,https://tiki.vn/may-hut-bui-uot-va-kho-tran-vien-thong-minh-hang-chinh-hang-jetzt-series-h13-p199050206.html?spid=199050207,14,-23%,Đã bán 17,thietbigiadinh
"Máy Lau Sàn Hút Bụi Không Dây Cầm Tay DREAME T20 Thế Hệ Mới Pin Rời Thuận Tiện Sạc Điện Siêu Nhẹ, Thời Gian Làm Việc 90 Phút, Công Suất Cao 450 W Lực Hút 25KPa - Hàng Chính Hãng",6.589.000₫,https://tiki.vn/may-hut-bui-cam-tay-dreame-v9-cong-suat-400w-ap-suat-20-kpa-hang-chinh-hang-p183567234.html?spid=183567235,15,,Đã bán 3,thietbigiadinh
Lõi Hydrogen Alkaline Đại Việt nhập khẩu Hàn Quốc tạo ORP và kiềm cho nước + 2 cút nối nhanh,320.000₫,https://tiki.vn/loi-hydrogen-alkaline-dai-viet-nhap-khau-han-quoc-tao-orp-va-kiem-cho-nuoc-p59062465.html?spid=59062466,16,,Đã bán 21,thietbigiadinh
Máy hút bụi Dyson V12 Detect Slim - Hàng Chính Hãng,14.900.000,https://tiki.vn/may-hut-bui-dyson-v12-detect-slim-hang-chinh-hang-p192455954.html?spid=248910472,17,-36%,,thietbigiadinh
,,https://tiki.vn/quat-hut-am-tran-co-ong-dan-nanoco-ncv1520-c-ncv2020-c_hang-chinh-hang-p249768306.html?spid=249768308,18,,,thietbigiadinh
Cây Nước Nóng Lạnh Fujie WDX5GE - Xám - Hàng chính hãng,1.820.000₫,https://tiki.vn/cay-nuoc-nong-lanh-fujie-wdx5ge-xam-hang-chinh-hang-p521430.html?spid=1096966,19,-18%,Đã bán 8,thietbigiadinh
Quạt Tích Điện Gấp Gọn Mini XIAOMI 3LIFE 209/3LIFE 202 Phiên Bản 2023 Không Gian Sử Dụng 5-10 m2 Sử Dụng 4-7 Giờ Liên Tục - Hàng Nhập Khẩu,489.000₫,https://tiki.vn/quat-tich-dien-gap-gon-mini-xiaomi-3life-209-3life-202-phien-ban-2023-khong-gian-su-dung-5-10-m2-su-dung-9-gio-lien-tuc-hang-chinh-hang-cho-duyet-p270698529.html?spid=245881173,20,-23%,Đã bán 6,thietbigiadinh
Quạt Trần Panasonic F-60UFN - Hàng chính hãng,8.590.000₫,https://tiki.vn/quat-tran-panasonic-f-60ufn-hang-chinh-hang-p637558.html?spid=197540519,21,,Đã bán 1,thietbigiadinh
Phụ kiện Robot Hút Bụi Chổi Trụ Xiaomi Vacuum - Mop ESSENTIAL BRUSH (BHR4247TY) - Hàng chính hãng,190.000₫,https://tiki.vn/phu-kien-robot-hut-bui-choi-tru-xiaomi-vacuum-mop-essential-brush-bhr4247ty-hang-chinh-hang-p90107406.html?spid=90107407,22,,Đã bán 26,thietbigiadinh
Quạt trần đèn hiện đại HomeFan660,1.590.000₫,https://tiki.vn/quat-tran-den-hien-dai-homefan660-p25936884.html?spid=74307261,23,,Đã bán 15,thietbigiadinh
Máy lọc nước Nano Geyser ECO công nghệ lọc Nano - Hàng Chính Hãng,1.709.000₫,https://tiki.vn/may-loc-nuoc-nano-geyser-eco-8-cong-nghe-loc-nano-hang-chinh-hang-p175213250.html?spid=175213252,24,,Đã bán 31,thietbigiadinh
"Quạt Mini Tích Sạc Điện Gấp Gọn Đa Năng Để Bàn Làm Việc, 3 Chế Độ Gió Linh Hoạt - Quạt Gấp Gọn Điều Chỉnh Chiều Cao Q17 Giải pháp cho mùa hè Siêu tiện Ích",86.000₫,https://tiki.vn/quat-mini-tich-sac-dien-gap-gon-da-nang-de-ban-lam-viec-3-che-do-gio-linh-hoat-quat-gap-gon-dieu-chinh-chieu-cao-q17-giai-phap-cho-mua-he-sieu-tien-ich-p187284937.html?spid=187284941,25,,,thietbigiadinh
,,https://tiki.vn/may-loc-nuoc-pureit-delica-am-tu-bep-ro-11-000l-ur5440-hang-chinh-hang-p160759206.html?spid=160759207,26,,,thietbigiadinh
Quạt không cánh siêu mát an toàn UML-018 kèm điều khiển từ xa,1.299.000₫,https://tiki.vn/quat-khong-canh-sieu-mat-an-toan-uml-018-kem-dieu-khien-tu-xa-p109697407.html?spid=109697409,27,,Đã bán 41,thietbigiadinh
Máy Sấy Tóc Bổ Sung Ion Âm Tescom NTID45 (1650W),899.000₫,https://tiki.vn/may-say-toc-bo-sung-ion-am-tescom-ntid45-1650w-p727006.html?spid=727177,28,,Đã bán 106,thietbigiadinh
Quạt Sạc Tích Điện Mini QMN-F16 - Đeo Hông Thắt Lưng Tiện Lợi - Công Suất 4W - 3 Tốc Độ Gió - Có Video,169.000₫,https://tiki.vn/quat-sac-tich-dien-mini-qmn-f16-deo-hong-that-lung-tien-loi-cong-suat-4w-3-toc-do-gio-co-video-p176910422.html?spid=176910428,29,,Đã bán 6,thietbigiadinh
Máy hút bụi lực hút 14000Pa Gaabor VCW14M-WH01A màu trắng dòng YOUNG cho các bạn trẻ hiện đại - Hàng chính hãng,49.000₫,https://tiki.vn/may-hut-bui-luc-hut-14000pa-gaabor-vcw14m-wh01a-mau-trang-dong-young-cho-cac-ban-tre-hien-dai-hang-chinh-hang-p272077452.html?spid=273546519,30,,,thietbigiadinh
,,https://tiki.vn/ban-ui-hoi-nuoc-dung-tefal-it3420e0-1800w-hang-chinh-hang-p58546130.html?spid=69335421,31,,,thietbigiadinh
Quạt làm mát và lọc không khí Iruka I-99 - Hàng chính hãng,4.190.000₫,https://tiki.vn/quat-lam-mat-va-loc-khong-khi-iruka-i-99-hang-chinh-hang-p50820173.html?spid=50820174,32,,Đã bán 44,thietbigiadinh
"Máy Duỗi , Ép Tóc Mini Đa Năng Tiện Lợi Bàn Kẹp To An Toàn Dễ Dàng Sử Dụng MP035 (Màu Ngẫu Nhiên)",46.000₫,https://tiki.vn/may-duoi-ep-toc-mini-da-nang-tien-loi-ban-kep-to-an-toan-de-dang-su-dung-mp035-p48191840.html?spid=67033742,33,,Đã bán 17,thietbigiadinh
Máy Hút Bụi Không Dây Dyson V12 Detect Slim Total Clean - Hàng Chính Hãng,16.900.000₫,https://tiki.vn/may-hut-bui-khong-day-dyson-v12-detect-slim-total-clean-hang-chinh-hang-p242449692.html?spid=248910801,34,,,thietbigiadinh
Máy tạo nước kiềm cầm tay tốt cho tiêu hóa REWA RW-AK-1700 (Hàng chính hãng),1.939.030,https://tiki.vn/may-tao-nuoc-kiem-cam-tay-tot-cho-tieu-hoa-rewa-rw-ak-1700-p252418642.html?spid=252418643,35,,,thietbigiadinh
,,https://tiki.vn/ban-ui-hoi-nuoc-gap-gon-gaabor-gs1300m-pk01a-thiet-ke-cam-tay-nho-gon-de-thuong-cong-suat-1300w-hang-chinh-hang-p273396046.html?spid=273396047,36,,,thietbigiadinh
Màng Lọc Ro Rotex 75g - Dùng Cho Máy Lọc Nước Ro,117.000₫,https://tiki.vn/mang-loc-ro-rotex-75g-dung-cho-may-loc-nuoc-ro-p214909167.html?spid=214909168,37,,Đã bán 12,thietbigiadinh
Máy cạo râu 3 lưỡi Panasonic ES-SL41-S453 - Hàng Chính Hãng,1.395.000₫,https://tiki.vn/may-cao-rau-3-luoi-panasonic-es-sl41-s453-hang-chinh-hang-p44682283.html?spid=255223516,38,,Đã bán 161,thietbigiadinh
Máy lọc không khí xông tinh dầu Levoit LV-H128 - Hàng chính hãng,1.190.000₫,https://tiki.vn/may-loc-khong-khi-xong-tinh-dau-levoit-lv-h128-hang-chinh-hang-p272162972.html?spid=272162973,39,,Đã bán 1,thietbigiadinh
Máy Lọc Không Khí Xiaomi Mi Air Purifier 4 Pro Hàng chính hãng,990.000,https://tiki.vn/may-loc-khong-khi-xiaomi-mi-air-purifier-4-pro-hang-chinh-hang-p206561068.html?spid=206561070,40,,,thietbigiadinh
