title,price,link_item,index,discount,sales,category
Ghế Ngồi Ô Tô Trẻ Em Joie Steadi Coal,2.603.000₫,https://tiki.vn/ghe-ngoi-o-to-tre-em-joie-steadi-coal-p97956433.html?spid=97956434,1,-17%,Đã bán 72,dodungchobe
"Máy hút mũi cho trẻ em ,máy hút mũi điện 3 cấp độ hút tự động cầm tay không dây thông minh 3 đầu hút cho trẻ sơ sinh và trẻ nhỏ",588.000₫,https://tiki.vn/may-hut-mui-cho-tre-em-may-hut-mui-dien-3-cap-do-hut-tu-dong-cam-tay-khong-day-thong-minh-3-dau-hut-cho-tre-so-sinh-va-tre-nho-p251512989.html?spid=251512990,2,-41%,Đã bán 1,dodungchobe
Nút bịt ổ điện an toàn cho bé,1.000₫,https://tiki.vn/nut-bit-o-dien-an-toan-cho-be-p145550947.html?spid=171242635,3,-29%,Đã bán 626,dodungchobe
Gặm nướu tròn Richell Nhật Bản | Baby,149.000₫,https://tiki.vn/gam-nuou-tron-richell-p181462698.html?spid=181462709,4,-5%,Đã bán 14,dodungchobe
Bình sữa cổ hẹp PP vuông Pigeon 120ml/240ml,79.000₫,https://tiki.vn/binh-sua-co-hep-pp-vuong-pigeon-120ml-240ml-p104153016.html?spid=104153039,5,-8%,Đã bán 177,dodungchobe
Bình sữa Pigeon PP Plus thế hệ III Hình Thú,257.000₫,https://tiki.vn/binh-sua-pigeon-pp-plus-the-he-iii-hinh-thu-p197720463.html?spid=197720467,6,-10%,Đã bán 8,dodungchobe
"Nệm hơi nước Cao Su Non cho bé - Chiếu điều hòa, Chiếu cao su non cho bé - Mang lại giấc ngủ ngon cho con yêu",165.000₫,https://tiki.vn/nem-hoi-nuoc-cao-su-non-cho-be-chieu-dieu-hoa-chieu-cao-su-non-cho-be-mang-lai-giac-ngu-ngon-cho-con-yeu-p113359112.html?spid=192912476,7,-39%,Đã bán 8,dodungchobe
Ghế Ăn Dặm Cho bé tặng kèm chân cao,259.000₫,https://tiki.vn/ghe-an-dam-cho-be-tang-kem-chan-cao-p110756554.html?spid=273105031,8,-24%,Đã bán 5,dodungchobe
Xe tập đi cho bé đa năng 3 in 1 Có Khóa Bánh An Toàn- có nhạc và đèn led,325.000₫,https://tiki.vn/xe-tap-di-cho-be-da-nang-3-in-1-co-khoa-banh-an-toan-co-nhac-va-den-led-p249200386.html?spid=249200388,9,-8%,Đã bán 7,dodungchobe
Bộ khay ăn cho bé Bamboo Life BL040 hàng chính hãng từ sợi tre thiên nhiên Dụng cụ ăn dặm cho bé Bộ chén bát ăn dặm cho bé Đồ dùng ăn dặm cho bé,129.000₫,https://tiki.vn/bo-khay-an-cho-be-bamboo-life-bl040-hang-chinh-hang-tu-soi-tre-thien-nhien-dung-cu-an-dam-cho-be-bo-chen-bat-an-dam-cho-be-do-dung-an-dam-cho-be-p86780977.html?spid=92480688,10,-26%,Đã bán 380,dodungchobe
Dụng Cụ Hút Mũi - Vòi Hút - Pigeon,125.000₫,https://tiki.vn/dung-cu-hut-mui-voi-hut-pigeon-gcpg030171-p410735.html?spid=9669446,11,-17%,Đã bán 111,dodungchobe
"Ghế Ăn Dặm Kiêm Ghế Gội Đầu Cho Bé - Ghế Ngồi Đa Năng Cải Tiến, Hàng Đẹp, Giá Tốt Tại Shop Linh Giang",179.000₫,https://tiki.vn/ghe-an-dam-kiem-ghe-goi-dau-cho-be-ghe-ngoi-da-nang-cai-tien-hang-dep-gia-tot-tai-shop-linh-giang-p98686517.html?spid=173578764,12,-41%,Đã bán 5,dodungchobe
"Sữa tắm gội dạng bọt làm dịu da nhạy cảm, khô ngứa Aveeno Baby Soothing Relief 400ml",323.000₫,https://tiki.vn/sua-tam-goi-dang-bot-lam-diu-da-nhay-cam-kho-ngua-aveeno-baby-soothing-relief-400ml-p272855471.html?spid=272855472,13,-10%,Đã bán 1,dodungchobe
"Gối Cho Bé Sơ Sinh Cao Cấp Tila-Tila Mã TG01 Ruột Gối Làm Từ Thảo Mộc Tự Nhiên, Chất Liệu 100% Cotton Luôn Thoáng Mát Cho Trẻ, Chống Méo Đầu Bẹp Đầu - Hàng Chính Hãng",387.000₫,https://tiki.vn/goi-cho-be-so-sinh-cao-cap-tila-tila-ma-tg01-ruot-goi-lam-tu-thao-moc-tu-nhien-chat-lieu-100-cotton-luon-thoang-mat-cho-tre-chong-meo-dau-bep-dau-hang-chinh-hang-p85924541.html?spid=85924544,14,-41%,Đã bán 205,dodungchobe
"Medela - Trợ ti hỗ trợ cho trẻ bú, size S/M/L - Dùng cho các mẹ đầu ty bị nứt hoặc phẳng, tụt, ngắn - Giúp cho trẻ ngậm bú dễ dàng",370.000₫,https://tiki.vn/medela-tro-ti-ho-tro-cho-tre-bu-size-s-m-l-p176937904.html?spid=176937908,15,-35%,Đã bán 26,dodungchobe
"Set 5 Khăn Rửa Mặt 4 Lớp Sợi Tre Lụa Mềm, Thấm Hút Tốt, Kháng Khuẩn 100% Thương Hiệu Bonny (KT: 30x30 Cm)",95.000₫,https://tiki.vn/set-5-khan-rua-mat-4-lop-soi-tre-lua-mem-tham-hut-tot-khang-khuan-100-thuong-hieu-bonny-kt-30x30-cm-p97846795.html?spid=97846796,16,,Đã bán 577,dodungchobe
Địu Trẻ Em Aprica Pitta 39400,1.341.000₫,https://tiki.vn/diu-tre-em-aprica-pitta-p134146.html?spid=134150,17,,Đã bán 693,dodungchobe
Ghế Ăn Dặm Gấp Gọn Có Bánh Xe UMOO/ V-BaBy / Honper Điều Chỉnh Độ Cao 2 Cấp Độ - Hàng nhập khẩu,601.000₫,https://tiki.vn/ghe-an-dam-gap-gon-co-banh-xe-umoo-dieu-chinh-do-cao-2-cap-do-um-0491-hang-chinh-hang-p157016914.html?spid=201067954,18,,Đã bán 11,dodungchobe
Thau tắm trẻ em kèm tựa Notoro plus,279.200₫,https://tiki.vn/thau-tam-tre-em-kem-tua-notoro-plus-p155982261.html?spid=155982266,19,,Đã bán 16,dodungchobe
Ghế gội đầu cho bé từ 1-6 tuổi,115.000₫,https://tiki.vn/ghe-goi-dau-cho-be-tu-1-6-tuoi-p89653205.html?spid=111401314,20,,Đã bán 33,dodungchobe
Chiếu Điều Hòa Cao Su Non UNMEI Họa Tiết 5D Kèm Gối Cho Bé Yêu Hàng Loại Đẹp (KT 60x120cm),250.000₫,https://tiki.vn/chieu-dieu-hoa-cao-su-non-unmei-hoa-tiet-5d-kem-goi-cho-be-yeu-hang-loai-dep-kt-60x120cm-p264021429.html?spid=264021431,21,,Đã bán 4,dodungchobe
"Máy Tiệt Trùng Bình Sữa Mama’s Choice 5in1 Tích Hợp Chức Năng Sấy Khô Phụ Kiện và Hâm Sữa Cho Bé, BH Chính Hãng 12 Tháng",1.250.000₫,https://tiki.vn/may-tiet-trung-binh-sua-mama-s-choice-5in1-tich-hop-chuc-nang-say-kho-phu-kien-va-ham-sua-cho-be-bh-chinh-hang-12-thang-p23413563.html?spid=23413564,22,,Đã bán 297,dodungchobe
Xe tập đi cao cấp,320.000₫,https://tiki.vn/xe-tap-di-cao-cap-p24547214.html?spid=76469364,23,,Đã bán 55,dodungchobe
"Sữa Tắm, Dầu Gội 2in1 Bubchen Đức - Hương Thơm Tự Nhiên, Không Cay Mắt (hàng chuẩn Đức)",105.000₫,https://tiki.vn/sua-tam-dau-goi-2in1-bubchen-duc-huong-thom-tu-nhien-khong-cay-mat-hang-chuan-duc-p113623641.html?spid=189885764,24,,Đã bán 114,dodungchobe
Kem đánh răng cho bé Pigeon 45g - hương Nho/ hương Tự nhiên,95.000₫,https://tiki.vn/kem-danh-rang-cho-be-pigeon-45g-huong-nho-huong-tu-nhien-p104151434.html?spid=104151478,25,,Đã bán 99,dodungchobe
Núm Ty Philips Avent - Núm Vú Philips Avent - Thay Bình Sữa dòng Natural - Đủ Size 1 / 2 / 3 / 4 / Y Lỗ - Tặng 1 Khăn Sữa Gạc Vải thương hiệu Unmei,105.000₫,https://tiki.vn/num-ty-philips-avent-num-vu-philips-avent-thay-binh-sua-dong-natural-du-size-1-2-3-4-y-lo-tang-1-khan-sua-gac-vai-thuong-hieu-unmei-p172300775.html?spid=172300789,26,,Đã bán 70,dodungchobe
Ghế ngồi ô tô trẻ em Joie Spin 360,5.693.000₫,https://tiki.vn/ghe-ngoi-o-to-tre-em-joie-spin-360-p159824650.html?spid=159824654,27,,Đã bán 8,dodungchobe
"Gối cho bé bú, chống trào ngược dáng chữ D độc quyền - Thương hiệu Mothersbaby Hàn Quốc",1.300.000₫,https://tiki.vn/goi-cho-be-bu-chong-trao-nguoc-dang-chu-d-doc-quyen-thuong-hieu-mothersbaby-han-quoc-p270674787.html?spid=273431507,28,,Đã bán 3,dodungchobe
Túi Ủ Bình Sữa Thông Minh Cho Bé Warm Milk Di Động Giữ Nhiệt Hâm Nóng Bình Sữa Túi Hâm Sữa USB Giữ Ấm Bình Sữa Cầm Tay Túi Hâm Nóng Sữa Thức Ăn Sạc USb Giúp Giữ Nhiệt Sữa Lâu Dài Thiết Kế Nhỏ Gọn,219.000₫,https://tiki.vn/tui-u-binh-sua-thong-minh-cho-be-warm-milk-di-dong-giu-nhiet-ham-nong-binh-sua-tui-ham-sua-usb-giu-am-binh-sua-cam-tay-tui-ham-nong-sua-thuc-an-sac-usb-giup-giu-nhiet-sua-lau-dai-thiet-ke-nho-gon-p217506967.html?spid=212260634,29,,Đã bán 141,dodungchobe
Sữa tắm cho bé chiết xuất thảo dược Yaocare baby 250ml - DK Pharma,185.000₫,https://tiki.vn/tam-be-thao-duoc-yaocare-baby-p33934889.html?spid=33934890,30,,Đã bán 423,dodungchobe
Bỉm GOLDGI Nhật -Tã Dán Các Size S84/M66/ L56. Childs_day,375.000₫,https://tiki.vn/bim-goldgi-nhat-ta-dan-freeship-cac-size-s84-m66-l56-childs_day-p222451683.html?spid=222451685,31,,Đã bán 3,dodungchobe
Ghế gội đầu cho bé Holla 03151 - Hàng chính hãng,389.000₫,https://tiki.vn/ghe-goi-dau-cho-be-holla-03151-hang-chinh-hang-p176472306.html?spid=176472308,32,,Đã bán 38,dodungchobe
Núm vú cổ hẹp silicone siêu mềm Pigeon (2 cái/vỉ),92.000₫,https://tiki.vn/num-vu-co-hep-silicone-sieu-mem-pigeon-2-cai-vi-p104147948.html?spid=104147986,33,,Đã bán 336,dodungchobe
"Khăn Sữa Unmei Xuất Nhật Sợi Mịn, Dày 4 Lớp Dành Cho Bé Từ Sơ Sinh (Kích Thước 25x28cm) - Khăn Xô Loại Chất Lượng, Giao Mẫu Ngẫu Nhiên",75.000₫,https://tiki.vn/khan-sua-unmei-xuat-nhat-soi-min-day-4-lop-danh-cho-be-tu-so-sinh-kich-thuoc-25x28cm-khan-xo-loai-chat-luong-giao-mau-ngau-nhien-p200039871.html?spid=200039872,34,,Đã bán 7,dodungchobe
Dầu gội xả trẻ em Kodomo Pearly Pink Kids dành cho bé từ 6 tuổi trở lên 200ml,58.000₫,https://tiki.vn/dau-goi-xa-tre-em-kodomo-pearly-pink-kids-danh-cho-be-tu-6-tuoi-tro-len-200ml-p272267612.html?spid=272267613,35,,Đã bán 5,dodungchobe
Địu ngồi trẻ em cao cấp siêu mềm - siêu thoáng 4 tư thế Comfybaby CF119HC003 cho bé từ sơ sinh tới 36 tháng có mũ đỡ đầu,826.000₫,https://tiki.vn/diu-ngoi-tre-em-cao-cap-sieu-mem-sieu-thoang-4-tu-the-comfybaby-cf119hc003-cho-be-tu-so-sinh-toi-36-thang-co-mu-do-dau-p125393624.html?spid=125393627,36,,Đã bán 28,dodungchobe
"Tinh dầu dưỡng ẩm da em bé Herbaganic BabyHerb 50ml - Massage ngừa hăm tã, hương thơm dịu nhẹ, an toàn cho bé",253.000₫,https://tiki.vn/tinh-dau-duong-am-da-em-be-herbaganic-babyherb-50ml-massage-ngua-ham-ta-huong-thom-diu-nhe-an-toan-cho-be-p160488626.html?spid=160488627,37,,Đã bán 8,dodungchobe
Đai đi xe máy cho bé đảm bảo an toàn chống ngã ra sau,79.000₫,https://tiki.vn/dai-di-xe-may-cho-be-dam-bao-an-toan-chong-nga-ra-sau-p195873262.html?spid=271444422,38,,,dodungchobe
Máy hâm sữa Moaz Bébé MB-021,640.000₫,https://tiki.vn/may-ham-sua-moaz-bebe-mb-021-p60025996.html?spid=67084749,39,,Đã bán 9,dodungchobe
[Tặng Cetaphil Baby 50ml] Combo 2 Sữa tắm gội dịu lành cho bé Cetaphil Baby Gentle Wash & Shampoo 400ml/chai,442.000₫,https://tiki.vn/tang-cetaphil-baby-50ml-combo-2-sua-tam-goi-diu-lanh-cho-be-cetaphil-baby-gentle-wash-shampoo-400ml-chai-p271666487.html?spid=193263372,40,,Đã bán 2,dodungchobe
