title,price,link_item,index,discount,sales,category
Sữa tắm gội cho bé Lactacyd Milky 250ml,104.000₫,https://tiki.vn/sua-tam-goi-cho-be-lactacyd-milky-250ml-p109846489.html?spid=109846492,1,-5%,Đã bán 7,dodungchobe
"Cũi em bé bằng gỗ đã qua hấp sấy, cũi gỗ với các nan bo tròn cạnh cùng với 4 bánh xe có khóa an toàn cho bé yêu - giá xưởng",655.000₫,https://tiki.vn/cui-go-em-be-da-qua-hap-say-bo-tron-canh-gia-xuong-p54619198.html?spid=54619199,2,-18%,Đã bán 60,dodungchobe
Ghế Ngồi Ô Tô Zaracos Cusco 6406 Isofix Xoay 360 Độ,2.888.000₫,https://tiki.vn/ghe-ngoi-o-to-zaracos-cusco-6406-isofix-xoay-360-do-p106119146.html?spid=106119148,3,-13%,Đã bán 10,dodungchobe
"Dây bọt biển bọc cạnh bàn chống va đập, bịt góc bàn, ghế, tường, tủ, giường Chính hãng",56.050₫,https://tiki.vn/day-bot-bien-boc-canh-ban-chong-va-dap-bit-goc-ban-ghe-tuong-tu-giuong-chinh-hang-p75529967.html?spid=75529971,4,-23%,Đã bán 316,dodungchobe
Máy Hâm Sữa - Tiệt Trùng Bình Sữa Đa Năng Mum's Care Smarlov MC6803 Màu Trắng và Hồng Pastel - Cam Kết Chất Lượng,366.000₫,https://tiki.vn/bh-24-thang-1-doi-1-chinh-hang-may-ham-sua-tiet-trung-binh-sua-da-nang-mum-s-care-smarlov-mau-trang-va-hong-pastel-cam-ket-chat-luong-che-do-bh-so-1-thi-truong-p176832828.html?spid=176832832,5,-19%,Đã bán 13,dodungchobe
Ghế ăn umoo,435.000₫,https://tiki.vn/ghe-tap-an-dam-an-bot-da-nang-cao-cap-thiet-ke-han-quoc-3-nac-dieu-chinh-do-cao-p31698577.html?spid=76272589,6,-8%,Đã bán 86,dodungchobe
Nhiệt kế đo nhiệt độ nước tắm hình chú cá Chicco,150.000₫,https://tiki.vn/nhiet-ke-do-nhiet-do-nuoc-tam-hinh-chu-ca-chicco-p106912861.html?spid=106912871,7,-42%,Đã bán 12,dodungchobe
Kem đánh răng Colgate Batman 40g dành cho bé,23.000₫,https://tiki.vn/kem-danh-rang-colgate-batman-40g-danh-cho-be-p185262304.html?spid=185262305,8,-5%,Đã bán 277,dodungchobe
"Hút mũi Softtana - Đầu Silicon mềm, an toàn cho bé, không gây đau",49.000₫,https://tiki.vn/hut-mui-softtana-dau-hut-mui-tu-silicon-an-toan-cho-be-khong-gay-dau-p102019182.html?spid=102019184,9,-10%,Đã bán 12,dodungchobe
Combo 10 khăn sữa nhật 4 lớp loại nhỏ Kim Ngan chuột,39.150₫,https://tiki.vn/combo-10-khan-sua-nhat-4-lop-loai-nho-kim-ngan-chuot-p83669612.html?spid=83669616,10,-43%,Đã bán 71,dodungchobe
Bình nước đa năng UBMOM PPSU cho bé 260ml,395.000₫,https://tiki.vn/binh-nuoc-da-nang-ubmom-ppsu-cho-be-260ml-p243043843.html?spid=243043851,11,-10%,Đã bán 1,dodungchobe
Sữa Tắm Gội Chung Dành Cho Trẻ Sơ Sinh Bubchen 400ml,236.000₫,https://tiki.vn/sua-tam-goi-chung-danh-cho-tre-so-sinh-bubchen-400ml-p51714744.html?spid=51714745,12,-17%,Đã bán 12,dodungchobe
Combo 2 chai Sữa Tắm Gội cho bé Carrie Junior Yoghurt Hương Dưa Lưới Melon (700g/chai),312.000₫,https://tiki.vn/combo-2-chai-sua-tam-goi-cho-be-carrie-junior-yoghurt-huong-dua-luoi-melon-700g-chai-p268454812.html?spid=268454813,13,-10%,Đã bán 5,dodungchobe
Gối chống trào ngược Hinata Nhật Bản N04,1.865.000₫,https://tiki.vn/goi-chong-trao-nguoc-hinata-nhat-ban-n04-p193616684.html?spid=193616687,14,,Đã bán 7,dodungchobe
Combo 10 Cái bịt góc bàn,29.000₫,https://tiki.vn/combo-10-cai-bit-goc-ban-p4349765.html?spid=57400171,15,,Đã bán 172,dodungchobe
Khăn Tắm Baby Bear - Chất vải gạc xô sơ sinh 4 Lớp sợi dày - Túi 1 cái kích thước 75x95 cm,38.000₫,https://tiki.vn/combo-3-khan-tam-so-sinh-4-lop-soi-day-baby-bear-tui-1-cai-75x95-cm-p31262121.html?spid=31262122,16,,Đã bán 46,dodungchobe
Túi Tăm Chỉ Nha Khoa Oraltana (50 Cái),34.000₫,https://tiki.vn/tui-tam-chi-nha-khoa-oraltana-50-cai-p1341621.html?spid=43395528,17,,Đã bán 391,dodungchobe
Chắn cửa 1m,829.000₫,https://tiki.vn/chan-cua-1m-p112532342.html?spid=193322335,18,,Đã bán 1,dodungchobe
Bàn chải đánh răng Colgate họa tiết Batman dành cho trẻ,33.000₫,https://tiki.vn/ban-chai-danh-rang-colgate-hoa-tiet-batman-danh-cho-tre-p168479576.html?spid=168479577,19,,Đã bán 89,dodungchobe
"Cuộn Dây Bọc Biển Bọc Cạnh Bàn Chống Va Đập , Bịt Góc Bàn , Ghế , Tủ , Gường PaKaSa - Hàng Chính Hãng",59.000₫,https://tiki.vn/cuon-day-boc-bien-boc-canh-ban-chong-va-dap-bit-goc-ban-ghe-tu-guong-pakasa-hang-chinh-hang-p167469632.html?spid=167469634,20,,Đã bán 49,dodungchobe
"️ Sữa tắm, dầu gội 2in1 Bubchen 230ml - Đức cho bé đủ mùi hương",115.000₫,https://tiki.vn/sua-tam-dau-goi-2in1-bubchen-230ml-duc-cho-be-du-mui-huong-p170370626.html?spid=170371563,21,,Đã bán 29,dodungchobe
Sữa Tắm Gội Chung Dành Cho Trẻ Sơ Sinh Bubchen 400ml - N,239.000₫,https://tiki.vn/sua-tam-goi-chung-danh-cho-tre-so-sinh-bubchen-400ml-44725-p414607.html?spid=55089162,22,,Đã bán 32,dodungchobe
Tăm bông đầu tròn cho trẻ sơ sinh Chicco 0M+,95.000₫,https://tiki.vn/tam-bong-dau-tron-cho-tre-so-sinh-chicco-0m-p272125077.html?spid=272125078,23,,,dodungchobe
NỆM GỐI CHO BÉ ĐI HỌC VẢI KARA,247.000₫,https://tiki.vn/nem-goi-cho-be-di-hoc-vai-kara-p38063658.html?spid=38063670,24,,Đã bán 138,dodungchobe
Máy tiệt trùng sấy khô và hâm sữa đa năng Moaz Bebe MB-005,1.408.500₫,https://tiki.vn/may-tiet-trung-say-kho-va-ham-sua-da-nang-moaz-bebe-mb-005-p20239324.html?spid=244168137,25,,,dodungchobe
"Gối chống trào ngược 15 độ babylux (Mã BL12) - Phiên bản tiết kiệm, ngon bổ rẻ",243.000₫,https://tiki.vn/goi-chong-trao-nguoc-15-do-babylux-ma-bl12-phien-ban-tiet-kiem-ngon-bo-re-p159439336.html?spid=159439337,26,,Đã bán 28,dodungchobe
"Nôi ru ngủ thư giãn kết hợp ghế ngồi ăn dặm, đọc sách cho bé Mastela 8113/8114 chất liệu an toàn",2.290.000₫,https://tiki.vn/noi-ru-ngu-thu-gian-ket-hop-ghe-ngoi-an-dam-doc-sach-cho-be-mastela-8113-8114-chat-lieu-an-toan-p270652116.html?spid=270652118,27,,Đã bán 1,dodungchobe
Kéo cắt móng tay cho bé sơ sinh không phạm da bé kuku ku3034,89.100₫,https://tiki.vn/keo-cat-mong-tay-cho-be-so-sinh-khong-pham-da-be-kuku-ku3034-p108686057.html?spid=108686061,28,,Đã bán 15,dodungchobe
"Phấn Gạo Chống Hăm, Rôm, Sảy, Da Khô Hương Hoa Cỏ ReisCare Floral Sweet (50g)",64.900₫,https://tiki.vn/phan-rom-tinh-bot-gao-huong-hoa-co-reiscare-floral-sweet-50g-p1347579.html?spid=1347625,29,,Đã bán 261,dodungchobe
Khăn Lau Hạ Sốt Dr.Papie 3+ Cho Bé Hạ Nhiệt Giảm Sốt Ngăn Ngừa Co Giật,153.000₫,https://tiki.vn/khan-lau-ha-sot-dr-papie-3-cho-be-ha-nhiet-giam-sot-ngan-ngua-co-giat-p168183965.html?spid=168183966,30,,Đã bán 30,dodungchobe
Bình sữa sơ sinh dung tích 60ml Chicco,159.000₫,https://tiki.vn/binh-sua-so-sinh-dung-tich-60ml-chicco-p106913234.html?spid=106913240,31,,Đã bán 15,dodungchobe
"Bộ 4 Khóa Ngăn Kéo, Cửa Tủ An Toàn Cho Bé",26.976₫,https://tiki.vn/bo-4-khoa-ngan-keo-cua-tu-an-toan-cho-be-p34618011.html?spid=48279770,32,,Đã bán 21,dodungchobe
"Bộ 2 Khóa Gài Cửa Tủ Lạnh,Ngăn Kéo,Cửa Phòng An Toàn Cho Bé",14.978₫,https://tiki.vn/bo-2-khoa-gai-cua-tu-lanh-ngan-keo-cua-phong-an-toan-cho-be-p16509882.html?spid=48279764,33,,Đã bán 88,dodungchobe
Set 10 miếng lót chống thấm cho bé,44.000₫,https://tiki.vn/set-10-mieng-lot-chong-tham-cho-be-p109250672.html?spid=122095263,34,,,dodungchobe
Gối cao su non chống méo đầu cho bé sơ sinh,45.000₫,https://tiki.vn/goi-cao-su-non-chong-meo-dau-cho-be-so-sinh-p76557991.html?spid=188554143,35,,Đã bán 6,dodungchobe
Sữa Tắm Gội Pigeon 2 Trong 1 Tinh Chất Hạt Jojoba Dành Cho Da Nhạy Cảm (200ml),60.000₫,https://tiki.vn/sua-tam-goi-pigeon-2-trong-1-tinh-chat-hat-jojoba-danh-cho-da-nhay-cam-200ml-p1012696.html?spid=273337514,36,,,dodungchobe
Chăn đũi cho bé ngày hè,87.998₫,https://tiki.vn/chan-dui-cho-be-ngay-he-p19283829.html?spid=257830540,37,,,dodungchobe
Sữa Tắm Gội Trẻ Em Lactacyd Baby Gentle Care Bảo Vệ Dịu Nhẹ Cho Làn Da Nhạy Cảm 500ml,165.000₫,https://tiki.vn/sua-tam-goi-tre-em-lactacyd-baby-gentle-care-bao-ve-diu-nhe-cho-lan-da-nhay-cam-500ml-p192650438.html?spid=192650439,38,,Đã bán 100,dodungchobe
"Chăn ủ, Khăn quấn ủ, khăn choàng bế 2 Lớp cao cấp có mũ CUNCON cho bé sơ sinh | Chất liệu cao cấp 100% cotton dày dặn, ấm áp, mềm mại, an toàn cho bé yêu",137.000₫,https://tiki.vn/chan-u-khan-quan-u-khan-choang-be-2-lop-cao-cap-co-mu-cuncon-cho-be-so-sinh-chat-lieu-cao-cap-100-cotton-day-dan-am-ap-mem-mai-an-toan-cho-be-yeu-p207012592.html?spid=207012596,39,,Đã bán 5,dodungchobe
Combo 2 bình Pur Advanced 250ml + bình Pur 2 quai 250ml,401.000₫,https://tiki.vn/combo-2-binh-pur-advanced-250ml-binh-pur-2-quai-250ml-p143040763.html?spid=143040774,40,,,dodungchobe
