title,price,link_item,index,discount,sales,category
"Tấm lót chống thấm cỡ lớn (Size 120 x 80 cm) tiện lợi, an toàn cho bé, Nệm chống thấm cho bé, Tấm lót cũi, lót giường đa năng 3 lớp",105.000₫,https://tiki.vn/tam-lot-chong-tham-co-lon-size-120-x-80-cm-tien-loi-an-toan-cho-be-nem-chong-tham-cho-be-tam-lot-cui-lot-giuong-da-nang-3-lop-p208635215.html?spid=273084996,1,-16%,,dodungchobe
"Ga Chống Thấm, Ga Trải Giường, Thảm Chống Thấm Cotton (1.8x2m) Cho Em Bé (Màu ngẫu nhiên)",107.100₫,https://tiki.vn/ga-chong-tham-ga-trai-giuong-tham-chong-tham-cotton-1-8x2m-cho-em-be-mau-ngau-nhien-p15682403.html?spid=146937852,2,-15%,Đã bán 14,dodungchobe
"XE ĐẨY ĐÔI CHO BÉ CAO CẤP 2019 - Có mái che, bảo hiểm, để chân, giỏ đồ - xdd011 (giao màu ngẫu nhiên)",1.190.000₫,https://tiki.vn/xe-day-doi-cho-be-cao-cap-2019-co-mai-che-bao-hiem-de-chan-gio-do-xdd011-giao-mau-ngau-nhien-p35216210.html?spid=56248273,3,-21%,,dodungchobe
Combo nước rửa bình sữa chai + Dụng cụ vệ sinh bình sữa đa năng Wesser,173.400₫,https://tiki.vn/combo-nuoc-rua-binh-sua-dung-cu-ve-sinh-binh-sua-da-nang-wesser-p120553738.html?spid=120553739,4,-17%,Đã bán 11,dodungchobe
Sữa tắm Gội cho bé Carrie Junior hương Grapeberry 280g,71.000₫,https://tiki.vn/sua-tam-goi-cho-be-carrie-junior-huong-grapeberry-280g-p268494543.html?spid=268494547,5,-30%,,dodungchobe
"Miếng bịt góc bàn, cạnh tủ vuông bằng silicon an toàn cho bé vui chơi",6.800₫,https://tiki.vn/mieng-bit-goc-ban-canh-tu-vuong-bang-silicon-an-toan-cho-be-vui-choi-p109626587.html?spid=172540919,6,-15%,,dodungchobe
Ghế Ngồi Ô Tô Trẻ Em Joie Gemm Pebble,1.708.000₫,https://tiki.vn/ghe-ngoi-o-to-tre-em-joie-gemm-pebble-p97956454.html?spid=97956458,7,-44%,Đã bán 9,dodungchobe
"Máy đun siêu tốc, hâm nước pha sữa và giữ ấm nước điện tử Fatzbaby QUICK 4 - FB3514CY",790.000₫,https://tiki.vn/may-dun-sieu-toc-ham-nuoc-pha-sua-va-giu-am-nuoc-dien-tu-fatzbaby-quick-4-fb3514cy-p68871925.html?spid=79467881,8,-5%,Đã bán 8,dodungchobe
Ghế rung nhún chân cong cho bé sơ sinh,199.000₫,https://tiki.vn/ghe-rung-nhun-chan-cong-cho-be-so-sinh-p117033914.html?spid=117033916,9,-7%,Đã bán 15,dodungchobe
"Ghế ngồi xe Vision cho bé ( được chọn màu ) , GHẾ GA XẾP SẮT SƠN TĨNH ĐIỆN",199.500₫,https://tiki.vn/ghe-ngoi-xe-vision-cho-be-duoc-chon-mau-p184468177.html?spid=184468179,10,-17%,Đã bán 48,dodungchobe
"Áo yếm máng dài tay Cotton chống thấm nước cho bé tập ăn, tập vẽ Mastela",90.000₫,https://tiki.vn/ao-yem-mang-dai-tay-cotton-chong-tham-nuoc-cho-be-tap-an-tap-ve-mastela-p154703056.html?spid=154703107,11,-8%,Đã bán 177,dodungchobe
Bình Sữa Thủy Tinh Mô Phỏng Tự Nhiên Philips Avent SCF673/13,450.000₫,https://tiki.vn/binh-sua-thuy-tinh-philips-avent-scf673-13-120ml-p938006.html?spid=59139794,12,-29%,Đã bán 12,dodungchobe
Bộ 2 Cây Bấm Móng Tay Hình Thú Siêu Đáng Yêu - Món Quà Cute Ngộ Nghĩnh - Giao Màu Ngẫu Nhiên - Hàng Nhập Khẩu,19.990₫,https://tiki.vn/bo-2-cay-bam-mo-ng-tay-hinh-thu-sieu-da-ng-yeu-mo-n-qua-cute-ngo-nghi-nh-giao-ma-u-nga-u-nhien-ha-ng-nha-p-kha-u-p40923292.html?spid=81764823,13,-36%,Đã bán 2,dodungchobe
Ghế ngồi ô tô trẻ em Joie Trillo Dark Pewter,1.460.455₫,https://tiki.vn/ghe-ngoi-o-to-tre-em-joie-trillo-dark-pewter-p212555986.html?spid=212555987,14,-30%,Đã bán 1,dodungchobe
MÁY TIỆT TRÙNG SẤY KHÔ TIA UV VÀ BẢO QUẢN BÌNH SỮA MOAZ BÉBÉ MB – 023,3.380.000₫,https://tiki.vn/may-tiet-trung-say-kho-tia-uv-va-bao-quan-binh-sua-moaz-bebe-mb-023-p145827424.html?spid=145827475,15,,Đã bán 3,dodungchobe
Khăn sữa mềm chuột nhí 3 lớp 25x25 cm- Sunbaby,37.000₫,https://tiki.vn/khan-sua-chuot-nhi-sunbaby-p19374091.html?spid=19374092,16,,Đã bán 16,dodungchobe
Ga Chống Thấm Cao Cấp PT Họa Tiết Cherry,50.000₫,https://tiki.vn/ga-chong-tham-cao-cap-pt-hoa-tiet-cherry-p248799807.html?spid=248799864,17,,,dodungchobe
"Khăn sữa cao cấp xuất Nhật Mipbi 4 lớp (10 cái/Gói, kích thước 28x36cm)",81.000₫,https://tiki.vn/goi-10-cai-khan-sua-mipbi-4-lop-giao-mau-ngau-nhien-28-x-36-cm-p9985460.html?spid=19406119,18,,Đã bán 13,dodungchobe
[Made in Thailand] Dung Dịch Giặt Quần Áo Cho Bé D-Nee - Chai 960ml (Xanh),118.000₫,https://tiki.vn/made-in-thailand-dung-dich-giat-quan-ao-cho-be-d-nee-chai-960ml-xanh-p543137.html?spid=251863371,19,,,dodungchobe
"Nôi điện cho bé, nôi đưa rung tự động, nôi đa năng",1.471.550₫,https://tiki.vn/mb423-noi-dien-cho-be-noi-dua-rung-tu-dong-noi-da-nang-model-2022-p204005414.html?spid=204005419,20,,Đã bán 1,dodungchobe
Giường cũi nôi cho bé kích thước 1m2 có thể kéo dài thành giường 1m6 có bánh xe,1.989.000₫,https://tiki.vn/giuong-cui-noi-cho-be-kich-thuoc-1m2-co-the-keo-dai-thanh-giuong-1m6-p56316331.html?spid=56911293,21,,Đã bán 12,dodungchobe
"Máy báo khóc hiển thị hình ảnh, không dây, tần số sóng 2.4G Baby Monitor Plus- mbk02",1.150.000₫,https://tiki.vn/may-bao-khoc-baby-monitor-plus-mbk02-p48948612.html?spid=48948613,22,,Đã bán 65,dodungchobe
Mền lưới cho bé-Chăn lưới-mền lưới chống ngạt cho bé sơ sinh,84.630₫,https://tiki.vn/men-luoi-cho-be-chan-luoi-men-luoi-chong-ngat-cho-be-so-sinh-p83670274.html?spid=83670278,23,,Đã bán 40,dodungchobe
Tinh dầu tràm Huế Kim Vui 125ml - Tinh dầu dùng cho trẻ sơ sinh,190.000₫,https://tiki.vn/tinh-dau-tram-hue-kim-vui-125ml-tinh-dau-dung-cho-tre-so-sinh-p55461311.html?spid=55461312,24,,Đã bán 443,dodungchobe
Dụng cụ giữ bình sữa rảnh tay mẹ và bé The Beebo,456.000₫,https://tiki.vn/dung-cu-giu-binh-sua-ranh-tay-me-va-be-the-beebo-p98737608.html?spid=98737611,25,,,dodungchobe
Thảm lót chống thấm cho bé Hinata Nhật Bản TCT01 - 100% Cotton - Thoáng khí - Thấm hút tốt,214.500₫,https://tiki.vn/tham-lot-chong-tham-cho-be-hinata-nhat-ban-tct01-100-cotton-thoang-khi-tham-hut-tot-p81367172.html?spid=81367178,26,,Đã bán 7,dodungchobe
Ghế ngồi ô tô trẻ em Joie i-Spin Grow,10.980.000₫,https://tiki.vn/ghe-ngoi-o-to-tre-em-joie-i-spin-grow-p159824662.html?spid=159824666,27,,Đã bán 2,dodungchobe
"Lăn Bôi Vết Muỗi Đốt, Côn Trùng Cắn Chicco",238.280₫,https://tiki.vn/lan-boi-vet-muoi-dot-con-trung-can-chicco-p4140057.html?spid=101085187,28,,Đã bán 44,dodungchobe
Kem đánh răng dành cho trẻ em Flour Kin children infantil Toothpaste,98.000₫,https://tiki.vn/kem-danh-rang-danh-cho-tre-em-flour-kin-children-infantil-toothpaste-p207493245.html?spid=207493246,29,,Đã bán 7,dodungchobe
"Ghế Ăn Dặm Cho Bé Từ 9 - 24 Tháng Tuổi Bằng Gỗ Có Thể Điều Chỉnh Độ Cao, Gấp Gọn Nhẹ Nhàng, Dễ Dàng Di Chuyển - AS1016",760.000₫,https://tiki.vn/ghe-an-dam-cho-be-tu-9-24-thang-tuoi-bang-go-co-the-dieu-chinh-do-cao-gap-gon-nhe-nhang-de-dang-di-chuyen-as1016-p52409112.html?spid=106061832,30,,Đã bán 3,dodungchobe
Địu vải BUBI Gen 3 - 100% Cotton - Xám lông chuột,599.000₫,https://tiki.vn/diu-vai-bubi-gen-3-100-cotton-xam-long-chuot-p205737605.html?spid=205737614,31,,Đã bán 2,dodungchobe
Philips Avent Bình sữa PPSU thiết kế tự nhiên 330ml cho bé từ 6 tháng tuổi SCF583/10,795.000₫,https://tiki.vn/philips-avent-binh-sua-ppsu-thiet-ke-tu-nhien-330ml-cho-be-tu-6-thang-tuoi-scf583-10-p209414979.html?spid=209414980,32,,Đã bán 1,dodungchobe
Khay đựng úp bình sữa cho bé có nắp đậy Jupin,146.000₫,https://tiki.vn/khay-dung-up-binh-sua-cho-be-co-nap-day-jupin-p176124281.html?spid=207253007,33,,Đã bán 25,dodungchobe
GHẾ NGỒI ĂN DẶM CHO BÉ,112.000₫,https://tiki.vn/ghe-ngoi-an-dam-cho-be-giao-mau-ngau-nhien-p55535268.html?spid=57759539,34,,Đã bán 1,dodungchobe
"Ghế ăn dặm Đa năng cho Bé với 07 tính năng- 03 chế độ mang lại sự khác biệt, CÓ ĐỆM VÀ BÁNH XE- Màu Xanh dương",398.000₫,https://tiki.vn/ghe-an-dam-da-nang-cho-be-voi-07-tinh-nang-03-che-do-mang-lai-su-khac-biet-co-dem-va-banh-xe-mau-xanh-duong-p27243995.html?spid=205514853,35,,Đã bán 5,dodungchobe
"Bàn chải điện thông minh cho bé Lebenlang LBL3021,thiết kế đáng yêu, chống thấm nước IPX7, 3 chế độ, bảo hành 2 năm - hàng chính hãng",273.000₫,https://tiki.vn/ban-chai-dien-thong-minh-cho-be-lebenlang-lbl3021-thiet-ke-dang-yeu-chong-tham-nuoc-ipx7-3-che-do-bao-hanh-2-nam-hang-chinh-hang-p272621141.html?spid=272621145,36,,Đã bán 1,dodungchobe
TẤM LÓT CHỐNG THẤM 4 LỚP CHO BÉ SƠ SINH,42.000₫,https://tiki.vn/tam-lot-chong-tham-4-lop-cho-be-so-sinh-p50611960.html?spid=170155138,37,,Đã bán 3,dodungchobe
Ly Mag Mag Ống Hút Pigeon Phiên Bản 2021,173.000₫,https://tiki.vn/ly-mag-mag-ong-hut-pigeon-phien-ban-2021-p129710172.html?spid=129710180,38,,Đã bán 56,dodungchobe
Tấm Lót Chống Thấm 4 Lớp Cho Bé Sơ Sinh,38.000₫,https://tiki.vn/tam-lot-chong-tham-4-lop-cho-be-so-sinh-p94449373.html?spid=128664058,39,,Đã bán 26,dodungchobe
Nôi mây đan thoáng mát giúp chống cong lưng cho bé khi nằm võng,169.000₫,https://tiki.vn/noi-may-dan-thoang-mat-giup-chong-cong-lung-cho-be-khi-nam-vong-p33485700.html?spid=41861546,40,,Đã bán 112,dodungchobe
