title,price,link_item,index,discount,sales,brand
"Đầm suông maxi chất liệu cotton mát mẻ, thiết kế xếp tầng dáng xòe, bảng màu đa dạng AH16",199.000₫,https://tiki.vn/dam-suong-maxi-chat-lieu-cotton-mat-me-thiet-ke-xep-tang-dang-xoe-bang-mau-da-dang-ah16-p257856395.html?spid=257856403,1,-5%,,ARCTIC_HUNTER
"Áo Len Body Tay Dài Cổ Lọ 3 Màu Sexy, Áo Len Dáng Ôm Hàn Quốc ARCTIC HUNTER Al10",141.550₫,https://tiki.vn/ao-len-body-tay-dai-co-lo-3-mau-sexy-ao-len-dang-om-han-quoc-arctic-hunter-al10-p197709275.html?spid=197709277,2,-5%,,ARCTIC_HUNTER
"Đầm 2 dây, đầm ôm nữ chất thun mềm mại Arctic hunter HD09",141.550₫,https://tiki.vn/dam-2-day-dam-om-nu-chat-thun-mem-mai-arctic-hunter-hd09-p61398470.html?spid=161937446,3,,,ARCTIC_HUNTER
Đầm Voan Hoa Nữ Cổ Chữ V Tay Ngắn Đầm Đuôi Cá Dáng Xoè ARCTIC HUNTER AH177,299.000,https://tiki.vn/dam-voan-hoa-nu-co-chu-v-tay-ngan-dam-duoi-ca-dang-xoe-arctic-hunter-ah177-p191376573.html?spid=191376581,4,-5%,,ARCTIC_HUNTER
,,https://tiki.vn/ao-so-mi-nu-arctic-hunter-trang-tay-lo-co-v-xinh-ah185-p99862751.html?spid=99862759,5,-5%,,ARCTIC_HUNTER
"Váy bầu dáng suông mặc hè chất liệu linen, Đầm bầu sơ mi nữ kèm đai eo B161",249.000₫,https://tiki.vn/vay-bau-dang-suong-mac-he-chat-lieu-linen-dam-bau-so-mi-nu-kem-dai-eo-b161-p185990156.html?spid=185990158,6,,,ARCTIC_HUNTER
"Đầm bầu, đầm trơn xếp tầng đơn giản nhưng không kém phần sang trọng Db16",219.000₫,https://tiki.vn/dam-bau-dam-tron-xep-tang-don-gian-nhung-khong-kem-phan-sang-trong-db16-p196971443.html?spid=196971451,7,-5%,,ARCTIC_HUNTER
"Áo Lót Bầu Loại Trơn (Cúc Mở, Mặc Cả Sau Sinh Cho Con Bú) ALB01",189.000₫,https://tiki.vn/ao-lot-bau-loai-tron-cuc-mo-mac-ca-sau-sinh-cho-con-bu-alb01-p164582805.html?spid=164582824,8,,,ARCTIC_HUNTER
Áo Bầu Xinh Cổ Sơ Mi Pha Ren Kẻ Caro Tay Lửng Đuôi Tôm AB05,149.000,https://tiki.vn/ao-bau-xinh-co-so-mi-pha-ren-ke-caro-tay-lung-duoi-tom-ab05-p183701356.html?spid=183701358,9,,,ARCTIC_HUNTER
,,https://tiki.vn/dam-bau-suong-linen-thiet-ke-kieu-dang-so-mi-co-tui-cheo-db61-p196991992.html?spid=196992010,10,,,ARCTIC_HUNTER
"Đầm thun suông nữ cô tròn, tay loe cách điệu, họa tiết kẻ sọc ngang xinh D14",169.000₫,https://tiki.vn/dam-thun-suong-nu-co-tron-tay-loe-cach-dieu-hoa-tiet-ke-soc-ngang-xinh-d14-p270236354.html?spid=270236370,11,,,ARCTIC_HUNTER
Váy đuôi cá dáng babydoll đầm suông dáng rộng chất linen thoáng co giãn nhẹ ARCTIC HUNTER,259.000,https://tiki.vn/vay-duoi-ca-dang-babydoll-dam-suong-dang-rong-chat-linen-thoang-co-gian-nhe-arctic-hunter-p190537982.html?spid=190537984,12,,,ARCTIC_HUNTER
,,https://tiki.vn/ao-kieu-nu-ao-dui-nu-ngan-tay-co-tron-hoa-tiet-hoa-don-gian-chat-dui-mat-arctic-hunter-ah41-p269889605.html?spid=269889609,13,,,ARCTIC_HUNTER
Áo Lót Bầu Sau Sinh Cho Con Bú Chống Chảy Xệ Cao Cấp Chất Liệu Cotton Alb06,170.000₫,https://tiki.vn/ao-lot-bau-sau-sinh-cho-con-bu-chong-chay-xe-cao-cap-chat-lieu-cotton-alb06-p164582599.html?spid=164582647,14,,Đã bán 1,ARCTIC_HUNTER
Quần lót bầu cạp chéo kháng khuẩn cotton chất đẹp QL04,169.000₫,https://tiki.vn/quan-lot-bau-cap-cheo-khang-khuan-cotton-chat-dep-ql04-p164582416.html?spid=164582449,15,,,ARCTIC_HUNTER
Quần lót bầu cotton cạp cao có chun chỉnh bụng Ql02,169.000₫,https://tiki.vn/quan-lot-bau-cotton-cap-cao-co-chun-chinh-bung-ql02-p164582396.html?spid=164582450,16,,Đã bán 1,ARCTIC_HUNTER
Quần Gen Nịt BụngFREESIZEQuần Gen Bụng Chống Cuộn Viền Ren Cao Cho Bà Bầu Sau Sinh QR02,199.000,https://tiki.vn/quan-gen-nit-bung-freesize-quan-gen-bung-chong-cuon-vien-ren-cao-cho-ba-bau-sau-sinh-qr02-p164582536.html?spid=164582548,17,,,ARCTIC_HUNTER
,,https://tiki.vn/ao-vest-linen-nu-dang-lung-day-tay-2-tui-nap-tre-trung-arctichunter-thoi-trang-thuong-hieu-chinh-hang-den-p113186611.html?spid=113186613,18,,,ARCTIC_HUNTER
"Áo sơ mi nữ form rộng chất thô 2 túi ngực ArcticHunter, thời trang trẻ, phong cách Hàn Quốc, thương hiệu chính hãng",159.000₫,https://tiki.vn/ao-so-mi-nu-form-rong-chat-tho-2-tui-nguc-arctichunter-thoi-trang-tre-phong-cach-han-quoc-thuong-hieu-chinh-hang-p50194512.html?spid=67407582,19,,,ARCTIC_HUNTER
"Sơ mi nữ kẻ sọc cổ tròn hở vai ArcticHunter, vải thô mềm mát thích hợp mùa hè, thời trang trẻ, thương hiệu chính hãng",99.000₫,https://tiki.vn/so-mi-nu-ke-soc-co-tron-ho-vai-arctichunter-vai-tho-mem-mat-thich-hop-mua-he-thoi-trang-tre-thuong-hieu-chinh-hang-p46782249.html?spid=67406417,20,,Đã bán 7,ARCTIC_HUNTER
"Áo kiểu nữ vai trễ phối cổ nơ ArcticHunter, thời trang trẻ, phong cách Hàn Quốc",166.600₫,https://tiki.vn/ao-kieu-nu-vai-tre-phoi-co-no-arctichunter-thoi-trang-tre-phong-cach-han-quoc-p46308126.html?spid=58378914,21,,Đã bán 1,ARCTIC_HUNTER
"Đầm ôm dáng xòe đuôi cá ArcticHunter, thời trang trẻ, phong cách Hàn Quốc",89.000₫,https://tiki.vn/dam-om-dang-xoe-duoi-ca-arctichunter-thoi-trang-tre-phong-cach-han-quoc-p46653057.html?spid=67406425,22,,,ARCTIC_HUNTER
"Áo cardigan Linen nữ dáng dài 2 túi hộp ArcticHunter, thời trang phong cách Nhật Bản",250.000₫,https://tiki.vn/ao-cardigan-linen-nu-dang-dai-2-tui-hop-arctichunter-thoi-trang-phong-cach-nhat-ban-p73438742.html?spid=73438752,23,,Đã bán 15,ARCTIC_HUNTER
"Chân váy jeans dáng lửng khóa giữa ArcticHunter, thời trang phong cách trẻ - M",89.000₫,https://tiki.vn/chan-vay-jeans-dang-lung-khoa-giua-arctichunter-thoi-trang-phong-cach-tre-p73624028.html?spid=73624034,24,,,ARCTIC_HUNTER
"Đầm suông voan kẻ xanh trẻ trung ArcticHunter, thời trang thương hiệu chính hãng",89.000₫,https://tiki.vn/dam-suong-voan-ke-xanh-tre-trung-arctichunter-thoi-trang-thuong-hieu-chinh-hang-p75390530.html?spid=75390534,25,,Đã bán 1,ARCTIC_HUNTER
,,https://tiki.vn/dam-xoe-cong-so-ho-vai-arctichunter-thoi-trang-thuong-hieu-chinh-hang-a1066-p75376540.html?spid=75376546,26,,,ARCTIC_HUNTER
"Đầm suông linen cổ đức sang trọng ArcticHunter, thời trang công sở 2021",250.000₫,https://tiki.vn/dam-suong-linen-co-duc-sang-trong-arctichunter-thoi-trang-cong-so-2021-p90475917.html?spid=90475923,27,,Đã bán 7,ARCTIC_HUNTER
"Áo thun nữ trắng giả yếm kẻ caro, thiết kế trẻ trung điệu đà, chất thun mềm co giãn ARCTIC HUNTER AH10",139.000₫,https://tiki.vn/ao-thun-nu-trang-gia-yem-ke-caro-thiet-ke-tre-trung-dieu-da-chat-thun-mem-co-gian-arctic-hunter-ah10-p269960091.html?spid=269960101,28,,,ARCTIC_HUNTER
"Đầm len nữ cao cấp, váy xòe phối ren ARCTIC HUNTER AH06",388.700₫,https://tiki.vn/dam-len-nu-cao-cap-vay-xoe-phoi-ren-arctic-hunter-ah06-p68723131.html?spid=161937135,29,,,ARCTIC_HUNTER
"Đầm suông linen cổ tròn ngắn tay mẫu mới, thiết kế xếp li độc đáo ở trước thời trang ARCTIC HUNTER AH191",299.000,https://tiki.vn/dam-suong-linen-co-tron-ngan-tay-mau-moi-thiet-ke-xep-li-doc-dao-o-truoc-thoi-trang-arctic-hunter-ah191-p214736025.html?spid=214736035,30,,,ARCTIC_HUNTER
,,https://tiki.vn/bo-do-ngu-nu-2-day-quyen-ru-v08-p114878896.html?spid=114878915,31,,,ARCTIC_HUNTER
Quần nỉ nữ ARCTIC HUNTER AH42,141.550₫,https://tiki.vn/quan-ni-nu-arctic-hunter-ah42-p129145730.html?spid=129145734,32,,,ARCTIC_HUNTER
"Áo sơ mi nữ ARCTIC HUNTER, áo form rộng kẻ sọc vải mềm đẹp 2 túi ốp AH86",179.000₫,https://tiki.vn/ao-so-mi-nu-dai-tay-cong-so-ao-so-mi-nu-arctic-hunter-trang-phoi-mau-ke-soc-nu-xinh-ah86-p160224201.html?spid=160224202,33,,Đã bán 1,ARCTIC_HUNTER
"Váy 2 dây, váy mặc nhà, váy đuôi cá kiểu cách ngọt ngào, dễ thương AH41",141.550₫,https://tiki.vn/vay-2-day-vay-mac-nha-vay-duoi-ca-kieu-cach-ngot-ngao-de-thuong-ah41-p179721901.html?spid=179721909,34,,,ARCTIC_HUNTER
"Váy ngủ, váy thun 2 dây, váy mặc nhà hình dứa vải mềm mịn vn27",141.550,https://tiki.vn/vay-ngu-vay-thun-2-day-vay-mac-nha-hinh-dua-vai-mem-min-vn27-p113835472.html?spid=113835481,35,,,ARCTIC_HUNTER
,,https://tiki.vn/hang-nhap-cao-cap-ao-kieu-ale34-p91105463.html?spid=91105477,36,,,ARCTIC_HUNTER
"Bộ đồ ngủ lụa cao cấp, đồ ngủ 2 dây sexy, phối ren quyến rũ AH08",141.550₫,https://tiki.vn/bo-do-ngu-lua-cao-cap-do-ngu-2-day-sexy-phoi-ren-quyen-ru-ah08-p179726392.html?spid=179726394,37,,,ARCTIC_HUNTER
"Áo kiểu tay lỡ hoạ tiết kẻ sọc ,chất liệu đũi mát phong cách nữ trẻ trung ARCTIC HUNTER AH10",179.000₫,https://tiki.vn/ao-kieu-tay-lo-hoa-tiet-ke-soc-chat-lieu-dui-mat-phong-cach-nu-tre-trung-arctic-hunter-ah10-p269889661.html?spid=269889663,38,,Đã bán 1,ARCTIC_HUNTER
Áo sơ mi nữ ARCTIC HUNTER trắng trơn tay xinh AH152,193.700₫,https://tiki.vn/ao-so-mi-nu-arctic-hunter-trang-tron-tay-xinh-ah152-p99850418.html?spid=99850428,39,,,ARCTIC_HUNTER
"Đầm linen suông dáng dài, Đầm sơ mi nữ ngắn tay kèm dây thắt eo nhiều màu lựa chọn ARCTIC HUNTER AH75",299.000,https://tiki.vn/dam-linen-suong-dang-dai-dam-so-mi-nu-ngan-tay-kem-day-that-eo-nhieu-mau-lua-chon-arctic-hunter-ah75-p190320583.html?spid=190320591,40,,Đã bán 1,ARCTIC_HUNTER
