,title,price,link_item,discount,sales,category,revenue
98,Váy Đầm ngủ bầu - Đầm váy mặc nhà sau sinh cho con bú ti NHIỀU MẪU - Quần áo bà bầu thời trang đẹp mùa hè Bigsize,145000,https://tiki.vn/vay-dam-ngu-bau-dam-vay-mac-nha-sau-sinh-cho-con-bu-ti-nhieu-mau-quan-ao-ba-bau-thoi-trang-dep-mua-he-bigsize-p114404466.html?spid=263932372,,3.0,thoitrangbau,435000.0
99,Áo Lót Bầu Sau Sinh Cho Con Bú Chống Chảy Xệ Cao Cấp Chất Liệu Cotton Alb06,170000,https://tiki.vn/ao-lot-bau-sau-sinh-cho-con-bu-chong-chay-xe-cao-cap-chat-lieu-cotton-alb06-p164582599.html?spid=164582647,,1.0,thoitrangbau,170000.0
100,Quần lót bầu cotton cạp cao có chun chỉnh bụng Ql02,169000,https://tiki.vn/quan-lot-bau-cotton-cap-cao-co-chun-chinh-bung-ql02-p164582396.html?spid=164582450,,1.0,thoitrangbau,169000.0
101,Vịt Phun Nước Bánh Xe Quay Đồ Chơi Cực Kỳ Hấp Dẫn Cho Bé,135000,https://tiki.vn/vit-phun-nuoc-banh-xe-quay-do-choi-cuc-ky-hap-dan-cho-be-p198123627.html?spid=198123628,,6.0,thoitrangbau,810000.0
102,Váy bầu thiết kế cổ viền đen ( có khuy chỉnh & túi),94500,https://tiki.vn/vay-bau-thiet-ke-co-vien-den-co-khuy-chinh-tui-p146572468.html?spid=146572558,,2.0,thoitrangbau,189000.0
103,"Áo Vắt Sữa, Áo Lót Hút Sữa Rảnh Tay Và Cho Con Bú 2 Trong 1 KUNBE Mặc Được Cả Ngày Thay Áo Ngực Thông Thường",89000,https://tiki.vn/ao-vat-sua-ao-lot-hut-sua-ranh-tay-va-cho-con-bu-2-trong-1-kunbe-mac-duoc-ca-ngay-thay-ao-nguc-thong-thuong-p75313942.html?spid=75313952,-41%,33.0,thoitrangbau,2937000.0
104,QUẦN BẦU JEAN PHONG CÁCH TRẺ TRUNG QBN1199,455000,https://tiki.vn/quan-bau-jean-phong-cach-tre-trung-qbn1199-p78892646.html?spid=78892656,-14%,6.0,thoitrangbau,2730000.0
105,CHÂN VÁY BẦU MÙA HÈ DÁNG XẾP LY XÒE QBN1181,325000,https://tiki.vn/chan-vay-bau-mua-he-dang-xep-ly-xoe-qbn1181-p253264784.html?spid=78625796,,13.0,thoitrangbau,4225000.0
106,"Quần bầu dài ống rộng, dáng suông có chun chỉnh bụng - quần bầu thiết kế cao cấp QB999",74340,https://tiki.vn/quan-bau-dai-ong-rong-dang-suong-co-chun-chinh-bung-quan-bau-thiet-ke-cao-cap-qb999-p146573739.html?spid=146573823,,6.0,thoitrangbau,446040.0
107,QUẦN BẦU BÒ CO GIÃN THOẢI-Quần Bầu Xinh Quần Jean Bầu Quần Baggy Bầu Trẻ Trung Năng Động,375000,https://tiki.vn/quan-bau-bo-co-gian-thoai-quan-bau-xinh-quan-jean-bau-quan-baggy-bau-tre-trung-nang-dong-p103097978.html?spid=166319731,,1.0,thoitrangbau,375000.0
108,"Váy bầu hoa nhí phong cách vintage, đầm bầu thiết kế siêu xinh V271",162540,https://tiki.vn/vay-bau-hoa-nhi-phong-cach-vintage-dam-bau-thiet-ke-sieu-xinh-v271-p146572445.html?spid=146572498,,1.0,thoitrangbau,162540.0
109,Quần Bầu Suông Ống Rộng Cạp Chéo AZ555 Chất Liệu Thun Gân Lên Dáng Cực Xinh Mặc Hè Siêu Mát,172000,https://tiki.vn/quan-bau-suong-ong-rong-cap-cheo-az555-chat-lieu-thun-gan-len-dang-cuc-xinh-mac-he-sieu-mat-p243059729.html?spid=243059747,,10.0,thoitrangbau,1720000.0
110,QUẦN LÓT GEN BỤNG CAO CẤP NHẬT BẢN SIÊU THON GỌN,21420,https://tiki.vn/quan-lot-gen-bung-cao-cap-nhat-ban-sieu-thon-gon-p146573846.html?spid=146573880,,2.0,thoitrangbau,42840.0
111,Áo Lót Nữ ĐÚC Không Gọng Nâng ngực mềm mại thoáng mát tôn vòng 1 gợi cảm quyến rũ cho phái đẹp,45360,https://tiki.vn/ao-lot-nu-duc-khong-gong-nang-nguc-mem-mai-thoang-mat-ton-vong-1-goi-cam-quyen-ru-cho-phai-dep-p146572220.html?spid=146572274,,3.0,thoitrangbau,136080.0
112,Quần Bầu Nỉ Azuno AZ32 Dáng Bo Gấu Có Đáp và Chun Chỉnh Bụng Mặc Thu Đông,185000,https://tiki.vn/quan-bau-ni-azuno-az32-dang-bo-gau-co-dap-va-chun-chinh-bung-mac-thu-dong-p73591732.html?spid=73591740,,5.0,thoitrangbau,925000.0
113,"Ngũ cốc lợi sữa Lạc Lạc Plus mới cao cấp 39 loại hạt giúp mẹ bổ sung vitamin và khoáng chất, canxi giúp xương chắc khỏe 600g (hộp 30 gói)",257140,https://tiki.vn/ngu-coc-loi-sua-lac-lac-plus-moi-cao-cap-39-loai-hat-giup-me-bo-sung-vitamin-va-khoang-chat-canxi-giup-xuong-chac-khoe-600g-hop-30-goi-p208299975.html?spid=208299976,,1.0,thoitrangbau,257140.0
114,Bộ đồ bầu mặc nhà và sau sinh NGỐ thun cotton (có vạt chéo co bé ti),134820,https://tiki.vn/bo-do-bau-mac-nha-va-sau-sinh-ngo-thun-cotton-co-vat-cheo-co-be-ti-p146574999.html?spid=146575133,,1.0,thoitrangbau,134820.0
115,Bộ đồ bầu Pink Quảng Châu Bầu và Sau Sinh Cộc Tay(Có mở nắp),134820,https://tiki.vn/bo-do-bau-pink-quang-chau-bau-va-sau-sinh-coc-tay-co-mo-nap-p146574534.html?spid=146574711,,1.0,thoitrangbau,134820.0
116,Quần bầu cạp chéo thể thao,86940,https://tiki.vn/quan-bau-cap-cheo-the-thao-p146572107.html?spid=146572119,,1.0,thoitrangbau,86940.0
117,quần bầu ống xớ chất dệt kim cao cấp,190260,https://tiki.vn/quan-bau-ong-xo-chat-det-kim-cao-cap-p146575504.html?spid=146575731,,1.0,thoitrangbau,190260.0
118,quần bầu có đáp bụng,74340,https://tiki.vn/quan-bau-co-dap-bung-p146574409.html?spid=146574519,,1.0,thoitrangbau,74340.0
119,Quần bầu lửng nâng mông,74340,https://tiki.vn/quan-bau-lung-nang-mong-p146573585.html?spid=146573626,,1.0,thoitrangbau,74340.0
120,"Xịt răng miệng Minion Gold Dr.maya hộp/50ml, Vệ sinh răng miệng ngăn ngừa sau răng cho bé từ 6 tháng tuổi",245000,https://tiki.vn/xit-rang-mieng-minion-gold-dr-maya-hop-50ml-ve-sinh-rang-mieng-ngan-ngua-sau-rang-cho-be-tu-6-thang-tuoi-p251512328.html?spid=235896730,,30.0,thoitrangbau,7350000.0
121,"Áo Lót, Áo Ngực Bầu Và Cho Con Bú Chất Mềm Mại Thoáng Mát",55000,https://tiki.vn/ao-lot-ao-nguc-bau-va-cho-con-bu-chat-mem-mai-thoang-mat-p127455590.html?spid=127455600,,2.0,thoitrangbau,110000.0
122,COMBO 3 ÁO LÓT BẦU,99000,https://tiki.vn/combo-3-ao-lot-bau-p159241650.html?spid=159241661,,2.0,thoitrangbau,198000.0
123,Quần bầu hè thu ngố QBD1520,285000,https://tiki.vn/quan-bau-he-thu-ngo-qbn1174-p258863197.html?spid=258863199,,1.0,thoitrangbau,285000.0
124,Áo lót ngực bầu cho bé con bú LỤA TĂM không gọng nâng ngực đồ lót chip bà bầu A35,32000,https://tiki.vn/ao-lot-nguc-bau-cho-be-con-bu-lua-tam-khong-gong-nang-nguc-do-lot-chip-ba-bau-a35-p117973118.html?spid=192720943,,17.0,thoitrangbau,544000.0
125,Set Rơ Lưỡi Và Bàn Chải Đánh Răng Cho Bé Silicon,55000,https://tiki.vn/set-ro-luoi-va-ban-chai-danh-rang-cho-be-silicon-p197851409.html?spid=197851410,,7.0,thoitrangbau,385000.0
126,Dầu húng chanh Minion Gold 30mL,233000,https://tiki.vn/dau-hung-chanh-minion-gold-30ml-p235886538.html?spid=235886543,,2.0,thoitrangbau,466000.0
127,Váy bầu thiết kế cao cấp giả yếm full size 45-85kg,250000,https://tiki.vn/vay-bau-thiet-ke-cao-cap-gia-yem-full-size-45-85kg-p92320002.html?spid=273215200,,1.0,thoitrangbau,250000.0
128,Quần lót bầu cạp chéo kháng khuẩn -quần lót nữ cotton chất đẹp cao cấp CS101,31000,https://tiki.vn/quan-lot-bau-cap-cheo-khang-khuan-quan-lot-nu-cotton-chat-dep-cao-cap-cs101-p148641356.html?spid=148641383,,3.0,thoitrangbau,93000.0
129,Quần baggy bầu đủ size 45-100kg chất cao cấp,200000,https://tiki.vn/quan-baggy-bau-du-size-45-100kg-chat-cao-cap-p92320183.html?spid=92320187,,8.0,thoitrangbau,1600000.0
130,"Váy ngủ, váy mặc nhà cộc tay dáng suông chất cotton mềm mát họa tiết hoạt hình dễ thương (KHÔNG KÈM TÚI) V285",69300,https://tiki.vn/vay-ngu-vay-mac-nha-coc-tay-dang-suong-chat-cotton-mem-mat-hoa-tiet-hoat-hinh-de-thuong-khong-kem-tui-v285-p146573631.html?spid=146573663,,10.0,thoitrangbau,693000.0
131,Combo 4 Quần Lót cho Bà Bầu Và Sau Sinh Cạp Chéo Chất Cotton Mềm Mịn,148000,https://tiki.vn/combo-4-quan-lot-cho-ba-bau-va-sau-sinh-cap-cheo-chat-cotton-mem-min-p127456770.html?spid=127457281,,1.0,thoitrangbau,148000.0
132,5 chiếc quần lót giấy cao cấp - Quần lót giấy đẹp cho mẹ sau sinh,12000,https://tiki.vn/5-chiec-quan-lot-giay-cao-cap-quan-lot-giay-dep-cho-me-sau-sinh-p148640620.html?spid=148640662,,17.0,thoitrangbau,204000.0
133,"Ngũ cốc lợi sữa Lạc Lạc Plus mới cao cấp 39 loại hạt giúp mẹ bổ sung vitamin và khoáng chất, canxi giúp xương chắc khỏe 600g (hộp 30 gói)",257140,https://tiki.vn/ngu-coc-loi-sua-lac-lac-plus-moi-cao-cap-39-loai-hat-giup-me-bo-sung-vitamin-va-khoang-chat-canxi-giup-xuong-chac-khoe-600g-hop-30-goi-p209918256.html?spid=209918258,,1.0,thoitrangbau,257140.0
134,(Giá huỷ diệt) Áo sơ mi bầu HÀNG THIẾT KẾ,250000,https://tiki.vn/gia-huy-diet-ao-so-mi-bau-hang-thiet-ke-p92319506.html?spid=92319508,,1.0,thoitrangbau,250000.0
135,Đầm Bầu Tiểu Thư CB,285000,https://tiki.vn/dam-bau-tieu-thu-cb-p101747990.html?spid=101747991,,1.0,thoitrangbau,285000.0
136,Váy bầu thiết kế thời trang công sở,167000,https://tiki.vn/vay-bau-thiet-ke-thoi-trang-cong-so-p129494129.html?spid=129494145,,2.0,thoitrangbau,334000.0
137,"Quần Short, Tregging Bầu Mặc Hè Chất Liệu Thun Lạnh, Quần Tập Yoga Cho Phụ Nữ Mang Thai Có Chun Chỉnh Và Đáp Bụng",194000,https://tiki.vn/quan-short-tregging-bau-mac-he-chat-lieu-thun-lanh-quan-tap-yoga-cho-phu-nu-mang-thai-co-chun-chinh-va-dap-bung-p243058266.html?spid=243058268,,6.0,thoitrangbau,1164000.0
138,ẢNH THẬT ️Đầm cho con bú,247000,https://tiki.vn/anh-that-dam-cho-con-bu-p95173045.html?spid=95173060,,2.0,thoitrangbau,494000.0
139,Chân Váy Bầu Xếp Ly Azuno AZ44 Có Đáp Bụng Và Chun Chỉnh Bụng,185000,https://tiki.vn/chan-vay-bau-xep-ly-azuno-az44-co-dap-bung-va-chun-chinh-bung-p75330558.html?spid=75330562,,1.0,thoitrangbau,185000.0
140,"Áo bầu công sở mùa hè 2023, áo bà bầu, mleeshop",109000,https://tiki.vn/ao-bau-cong-so-mua-he-2023-ao-ba-bau-mleeshop-p254903232.html?spid=254903240,,1.0,thoitrangbau,109000.0
141,"Áo bầu xinh hàn quốc, áo babydoll bầu đẹp, MLEE SHOP",105000,https://tiki.vn/ao-bau-xinh-han-quoc-ao-babydoll-bau-dep-mlee-shop-p263589616.html?spid=254903317,,1.0,thoitrangbau,105000.0
142,Quần bầu Ngố Legging bầu cotton co giãn 4 chiều QBN1213,155000,https://tiki.vn/quan-bau-ngo-legging-bau-cotton-co-gian-4-chieu-qbn1213-p104807148.html?spid=104807162,,1.0,thoitrangbau,155000.0
