,title,price,link_item,discount,sales,category,revenue
0,"Ngũ cốc bầu siêu dinh dưỡng Lạc Lạc giảm ốm nghén, giúp xương của bé phát triển toàn diện, vào con nhiều hơn vào mẹ",257140,https://tka.tiki.vn/pixel/pixel?data=8sPtWN8jZRhjrd6L90XhgWljyD7naZJwI6JXLYerVhR0Z61YAtyQYhKxKRS9LrvwejqfbKpi7ZiAuvqXWtWMRxSl_rjI4LJildAyKle-sd26GISVI-L51fJUNhC5N1I37yK8TkkPv1-lAkSzlxppWDCz0PZMueOEq3x8HSsTz0V1ZlsqBC6qMmwTYnIEZ_ii9yHJl3CE8mk2DR-DFhIhRZ8USurHeMFUp_dIMuE90q1hx4L-BCe97SFP4LsIZBGU3ocdz4QG0vvQWpkso_2HjSySDNhkDrIxHrunSuve-JjqmC8KPsHy8uWREX57z_zAboB346LphLIsip2jsRKmaokljNYUGN5htGEl3GL0IVwpPYj-xWyjefWcdTfS7uusKu2r0H6DmJiGhRRGXqIhmRJEL1o9O9NSrOoBiNNKro-Iza5QfHPri9RSyQY3xCDYzIcALcVzyAmyvQTAG0yyHcALFQgtespu_qoDILW5D1a-Q-cjj_ayVGssKEs3LqJzRBZkQiSbC7XhocCjjlM3RBmR64Z_U0hzgSCIP4icMAKPuJBGwwYfj1bWf2NDL25M3m0XLo2OhM-9nSCp5C9KSWkEjoM4CGBQH1zWR7mbNIjsZSn0efkL1MTqBBi94qeHwl6F-ojHU1ObaOy-DNQr0OcQAxwYnuZR3SlE1u95qNZHpCpJ5Ff5kJTC1kIDupKt3ihd3UYNHN_bjbxtQVx_NWEkIlvl_CaleoYCI3ERQh5uIHLBgbWRQIgQpwzNWwud-0RNEk5jSvE4SCXlXBWbt7teWJICiHCI-ImT4RE7em-kevaYWLkivXcYQtgsYif3oLm53KaO3uRikv9fnxUz8RsmkJ8otQb_acj0yOF4SS7sgfUyoGDL_6dQ6xdORIBkHcJEIpk11ZH23pkzmfEBQj0hsz7Kc9Sq74l-xQ_F9wStTh4wgWU8kHGKzkvNdtKiRsn2VlrPouCS7vvr8yqCaObKIeayw2x_b_IXQZxj6GdDgu5iubo8yyllr4gvBXYZ7iac7eTct6GrjevIPHGU9-NBsqWRHfJZTqB0w_fhW6UrMRX4UASEKKma2Q3RKTxbuoMWcurI3ysdEV5VFpHnUwhsj8SbhH4frCcBaa0y8BvydZ7mBiWdAyR5Pd4pvVHRRuAJCTeWaEfylQLaSNj43VAxD1c&reqid=NoNwrobYJKhhqu40&type=CLICK&pos=1,-14%,30.0,thoitrangbau,7714200.0
1,COMBO 2 HỘP Ngũ Cốc Bầu Lạc Lạc Plus 30 gói 600g Tặng quà cho bé,507400,https://tka.tiki.vn/pixel/pixel?data=ma9vel95SL3FN_44jjf9kaGA_Ux7FmZufs6CWjCoX7VnvIbYgbKaKgc_oaF0XNaduP0CRmbqvTQkGz1geIjVdlIxUgybPVtN_IaKBAFxGhVJ3eazZAexAGZoe9Tle_snXbEfS719LyMqN6gvA_IfOYI6zG_VVVaLOcpAfjC-n6T4g_gciPn3z7XoLoz0EjT1_4HCbRUii0UAmqQ9PieEjDPZzCwBCeuh7NpFfylsYnmevl48U68g3s6tefgHFk8sJV_ZXK8sgfUB7q-wH7FZ_pBCx7CiAt_zBkEWhtT9Jp1XQM526Jh4QRXydFg5OvWmC6D096NutDvNJmS6Bkb_pEcZLwtoCXQmRNZmZGT4akAkugOfsJ6xob8lT4vjPcx3izJrifJw5PeWMC9HpV2qC9AmfI3B859OHfOvRaxuAam0nwiWbxOuilH2G1ZoPSwwkXxXgkMHEt9aRbadbZu2HA1KkELWtdlHytQYJ4NMmc-RvOwNgJNtlW8RdHbhd6evTUtfY77wPMaj8ZFCQPbOrNpKxU82CPQHGWLOdusCvlFUbJkhHK0m_6NS404ajTBYfq6xKUmJ5mZGm6amMDZs6xRTP8vtMxZZTOmSR7jxo7f5LmL7bIk37oUBl2HpR-EON_W7CTVkbe_jldtleDMO4fSEWJp-9x7qPxiYdifRs5MDsitbjUmaKJ_EtoKD-3l9_X49_88fEactjMO-6LM9Cnq8Zp7x6ptbgJn-pVvXezAu01TX9GXTh_1dqVrEO40HrJ1xXvhqF7jqyPR4_c3o6B2q3MjX16Far64QD4yEvIl2W5Y8CrZHCOxYIEVeZAgAzKq9bNE-5nKgVs89Sf56NKQSyypg8D4z9-hgXjISWxcu1OTrI9tgPysm_qvIN5kAwyaFpNSlyotPhqVaGun2NtTtmLnM9TAwHBfGIQDyilwF0mg1XSzOD6kuQPPvy1EJ3IiaQoDierErurPVBBXGt_jF2wkqxlJFzEQcX-3-wLb5sO3PBGfMxGfyGv5Pvh8zUcLA1ZPm1uAIbhi6Fce_7TsdPVF4cykRzDVCCuygAmu7y9tSLPV08xMz3F0IO-88xkASgP2ZU5LYxgyZXVj40Bh-BA&reqid=NoNwrobYJKhhqu40&type=CLICK&pos=2,-14%,5.0,thoitrangbau,2537000.0
2,"Ngũ cốc lợi sữa Lạc Lạc Plus mới cao cấp 39 loại hạt giúp mẹ bổ sung vitamin và khoáng chất, canxi giúp xương chắc khỏe 600g (hộp 30 gói)",515000,https://tka.tiki.vn/pixel/pixel?data=NGofehw7lDI5NmrATOkWVzRLnXGQvd1eIR91S1ZI6mTRwdTJcHiP_LobMbqqehesSTlWwVoSK9K9hXiPkhU4PPtak_wgW30Xk6QsP6VJ8LnqkxtR3s4E2Za_esOPNjWdi7Tn1JYi9Xp1ba7zAZMpxkcnsjrOVP9iSr_3tcDzXAbMlFNL7Z3KIK8QFuGbXG7KjnyQwIaXTBri198aiMHux3--hMO_ew-A40ILV6mW580XOlbOkuSq0DV1Gxg8o8eNosbOMMqgosOfLAnSLxqbINj3kOmxzc3RHsswzMolhBDj96VgvhqkwuOPNjtIyUkMp5EP95jgg_ucWSf59UBDsrGR6tpNOG88SjMY6NtX21Su47UMe7bzTT4YvUBZVw6A-RLwjNlvKvlEygXy-T121Iv8Ru4xnijyG3Rlhry9feKwP8iJyR-NVX01lEaLDMChDUEP1v6w6qaNtr_xbNHfq_Lh9Fe5YaOYARy45E8dpug_VAGCQaxeyXgINmnf-ahl3iyy4cxQ5A8IXphcLXxWOLzY0oF81Hh-tpXktvWOgDYF0PAUZF6gqz1avHPTQbOhQiQgb_dcP-TjBTU5i9ExCvZ1uExpk7aZ9bgWJZTAlQsEDkapRsQtmIxMpNDkUFZfydhpIipjcjDOi0eEs16Y5QrHrAGEnWQDheMbrMryu5sUWeroKt7PHG2jfISCkAJMJ4JWUUCjltDSCEORFRSGWYMVjVVGKzd7MjiQ_EBqkmsBqSM3IGYioc_WkIDhZ2wlho5Wo88yeQBFyYvH4GJ1XF8rW6psAJcqpS-xmfM0sx3WvoayqVKOVhpFsGjAk9lHDV1Al_0ihEFq_tYJ82pD0RJupk9ltd3op6bX9zEDlm86ldKWPENBsK6YnZXOmn08uojBf-AxZd2fJ0ArBC0htIO6WUx2K8q3Jrr2NxOb2J2EglD-zmQUXuH0gEwvT9QThvW_zkduOsQf9WVou50-I2PfNvEkGB_d64wD-DQQ672kgGl9nrPnQTWSueBE0zIrsy6vmvpXK9Bv8339ooR9YQhDLNyt1qOBLSjC0FkOC5jp9q1ayLAwnVnlDWtXr3qb8aK1p4g_fX0sNIRo9a0RnsyKdhByVJHqbfpox094CvazGNwv8Et9WGJr91NWvCXnEr-21sWU76ShPw&reqid=NoNwrobYJKhhqu40&type=CLICK&pos=3,-14%,1.0,thoitrangbau,515000.0
3,Áo lót bầu- áo lót cho con bú chống chảy xệ mặc bầu và sau sinh AL06,66000,https://tiki.vn/ao-lot-bau-ao-lot-cho-con-bu-chong-chay-xe-mac-bau-va-sau-sinh-al06-p148640368.html?spid=148640418,-13%,48.0,thoitrangbau,3168000.0
4,QUẦN BẦU CÓ ĐÁP BỤNG - QUẦN LEGGING BẦU CÓ ĐÁP BỤNG,74340,https://tiki.vn/quan-bau-co-dap-bung-quan-legging-bau-co-dap-bung-p146573650.html?spid=146573667,-14%,9.0,thoitrangbau,669060.0
5,Quần bầu dài legging cạp chéo co giãn thoải mái hàng đẹp QB1111,75000,https://tiki.vn/quan-bau-dai-legging-cap-cheo-co-gian-thoai-mai-hang-dep-qb1111-p148639723.html?spid=148639812,-2%,13.0,thoitrangbau,975000.0
6,Quần mặc váy bầu quần đùi mặc trong váy bầu cạp chéo màu đen màu da chất cotton mát,45000,https://tiki.vn/quan-mac-vay-bau-quan-dui-mac-trong-vay-bau-cap-cheo-mau-den-mau-da-chat-cotton-mat-p86050510.html?spid=147326963,,3.0,thoitrangbau,135000.0
7,Quần Bầu Ống Rộng Dáng Suông AZ29 Chất Liệu Lụa Băng Siêu Mát Cho Phụ Nữ Mang Thai Mùa Hè Có Đáp Và Chun Chỉnh Bụng Tiện Lợi,199000,https://tiki.vn/quan-bau-ong-rong-dang-suong-az29-chat-lieu-lua-bang-sieu-mat-cho-phu-nu-mang-thai-mua-he-co-dap-va-chun-chinh-bung-tien-loi-p243057726.html?spid=243057732,,5.0,thoitrangbau,995000.0
8,Quần bầu mặc trong váy dành cho bà bầu chất cotton trơn xuất xưởng loại đep,31500,https://tiki.vn/quan-bau-mac-trong-vay-danh-cho-ba-bau-chat-cotton-tron-xuat-xuong-loai-dep-p146574871.html?spid=146574907,,35.0,thoitrangbau,1102500.0
9,"Áo Lót Cho Con Bú Chống Chảy Xệ, Áo Ngực Cho Mẹ Bầu sieu hot",66780,https://tiki.vn/ao-lot-cho-con-bu-chong-chay-xe-ao-nguc-cho-me-bau-sieu-hot-p146572239.html?spid=146572531,,11.0,thoitrangbau,734580.0
10,"Quần bầu cạp chéo - Thoải mái hơn, tiện lợi hơn",74340,https://tiki.vn/quan-bau-cap-cheo-thoai-mai-hon-tien-loi-hon-p146574315.html?spid=146574330,,16.0,thoitrangbau,1189440.0
11,Quần Bầu Đùi Mặc Trong Váy Cạp Chéo Ren,39060,https://tiki.vn/quan-bau-dui-mac-trong-vay-cap-cheo-ren-p146574791.html?spid=146574869,,3.0,thoitrangbau,117180.0
12,Bộ đồ mặc nhà sau sinh MLURE cotton dài tay thiết kế lật ti tiện lợi BD943,148000,https://tiki.vn/bo-do-mac-nha-sau-sinh-mlure-cotton-dai-tay-thiet-ke-lat-ti-tien-loi-bd943-p148637233.html?spid=148637261,,2.0,thoitrangbau,296000.0
13,áo bầu thời trang mẫu mới,129000,https://tiki.vn/ao-bau-thoi-trang-mau-moi-p98367140.html?spid=191515375,,1.0,thoitrangbau,129000.0
14,Combo đồ lót bầu 2 áo thông hơi 5 quần,233100,https://tiki.vn/combo-do-lot-bau-2-ao-thong-hoi-5-quan-p146574948.html?spid=146575148,,1.0,thoitrangbau,233100.0
15,Thanh lý - Bộ sau sinh kéo khóa ngực tiện lợi cho mẹ,125000,https://tiki.vn/thanh-ly-bo-sau-sinh-keo-khoa-nguc-tien-loi-cho-me-p87270512.html?spid=87270606,,3.0,thoitrangbau,375000.0
16,5 chiếc quần lót giấy cao cấp hàng đẹp,11340,https://tiki.vn/5-chiec-quan-lot-giay-cao-cap-hang-dep-p146572401.html?spid=146572483,,15.0,thoitrangbau,170100.0
17,Quần lót bầu cạp chéo cotton nhiều màu sắc QL001,13734,https://tiki.vn/quan-lot-bau-cap-cheo-cotton-nhieu-mau-sac-ql001-p146575378.html?spid=146575443,,15.0,thoitrangbau,206010.0
18,Quần bầu ỐNG SỚ LỬNG thời trang chất đũi nhật siêu mát có chun chỉnh bụng QBOSL 1000,56700,https://tiki.vn/quan-bau-ong-so-lung-thoi-trang-chat-dui-nhat-sieu-mat-co-chun-chinh-bung-qbosl-1000-p146575276.html?spid=146575310,,4.0,thoitrangbau,226800.0
19,Bộ đồ bầu pizama cổ bẻ chất kate thái thiết kế khóa ngực cho bé ti BPJM930,124740,https://tiki.vn/bo-do-bau-pizama-co-be-chat-kate-thai-thiet-ke-khoa-nguc-cho-be-ti-bpjm930-p146572505.html?spid=146572749,,1.0,thoitrangbau,124740.0
20,Combo đồ lót bầu 3 áo thông hơi 3 quần,214200,https://tiki.vn/combo-do-lot-bau-3-ao-thong-hoi-3-quan-p146572282.html?spid=146572331,,2.0,thoitrangbau,428400.0
21,COMBO 2 HỘP Ngũ Cốc Bầu Lạc Lạc Plus 30 gói 600g Tặng quà cho bé,507400,https://tiki.vn/combo-2-hop-ngu-coc-bau-lac-lac-plus-30-goi-600g-tang-qua-cho-be-p230124352.html?spid=230124353,,5.0,thoitrangbau,2537000.0
22,"Quần lót bầu cạp chéo phối ren mềm mại siêu xinh, thoáng mát QL9090",33000,https://tiki.vn/quan-lot-bau-cap-cheo-phoi-ren-mem-mai-sieu-xinh-thoang-mat-ql9090-p148636981.html?spid=148637019,,17.0,thoitrangbau,561000.0
23,Bộ Đồ bầu thun cotton dài vạt chéo mặc bầu và sau sinh,149940,https://tiki.vn/bo-do-bau-thun-cotton-dai-vat-cheo-mac-bau-va-sau-sinh-p146574753.html?spid=146574873,,1.0,thoitrangbau,149940.0
24,Áo lót bầu thông hơi - Áo ngực mở cúc ngang mặc sau sinh AL183,34000,https://tiki.vn/ao-lot-bau-thong-hoi-ao-nguc-mo-cuc-ngang-mac-sau-sinh-al183-p148639214.html?spid=148639317,,6.0,thoitrangbau,204000.0
25,Quần bầu len giữ nhiệt sọc thể thao (1135),95760,https://tiki.vn/quan-bau-len-giu-nhiet-soc-the-thao-1135-p146572791.html?spid=146572927,,2.0,thoitrangbau,191520.0
26,"ĐỒ LÓT BẦU COMBO 3 ÁO LÓT BẦU VÀ 3 QUẦN LÓT BẦU KHÁNG KHUẨN, Đồ bầu MLEE",209000,https://tiki.vn/do-lot-bau-combo-3-ao-va-3-quan-lot-bau-khang-khuan-p159242057.html?spid=159242062,,2.0,thoitrangbau,418000.0
27,"Áo Lót Bầu và Cho Con Bú Chống Chảy Xệ, Áo Lót Cho Mẹ Bầu Siêu Hót",91000,https://tiki.vn/ao-lot-bau-va-cho-con-bu-chong-chay-xe-ao-lot-cho-me-bau-sieu-hot-p127456522.html?spid=127456998,,11.0,thoitrangbau,1001000.0
28,"Ngũ cốc bầu siêu dinh dưỡng Lạc Lạc giảm ốm nghén, giúp xương của bé phát triển toàn diện, vào con nhiều hơn vào mẹ",98000,https://tiki.vn/ngu-coc-bau-sieu-dinh-duong-lac-lac-giam-om-nghen-giup-xuong-cua-be-phat-trien-toan-dien-vao-con-nhieu-hon-vao-me-p251510055.html?spid=251510074,,30.0,thoitrangbau,2940000.0
29,Quần Lót Bà Bầu và Sau Sinh Cạp Chéo Chất Cotton Hàng Loại 1,39000,https://tiki.vn/quan-lot-ba-bau-va-sau-sinh-cap-cheo-chat-cotton-hang-loai-1-p127456365.html?spid=127456455,,3.0,thoitrangbau,117000.0
30,"ĐẦM BẦU , VÁY BẦU CÔNG SỞ YẾM HẢI QUÂN ( có kèm áo thun )",380000,https://tiki.vn/dam-bau-vay-bau-cong-so-yem-hai-quan-co-kem-ao-thun-p163581385.html?spid=163581387,,2.0,thoitrangbau,760000.0
31,Đầm cho con bú sz m l xl xxl,377000,https://tiki.vn/dam-cho-con-bu-sz-m-l-xl-xxl-p95173370.html?spid=95173416,,1.0,thoitrangbau,377000.0
32,Áo ngực bầu- Áo lót bầu và cho con bú mở cúc ngang tiện lợi AL2092,32000,https://tiki.vn/ao-nguc-bau-ao-lot-bau-va-cho-con-bu-mo-cuc-ngang-tien-loi-al2092-p148641488.html?spid=148641502,,17.0,thoitrangbau,544000.0
33,Quần bầu có chun chỉnh chất NHUNG TĂM dáng bo chân dày dặn siêu ấm kiểu dáng trẻ trung năng động QB1282,129000,https://tiki.vn/quan-bau-co-chun-chinh-chat-nhung-tam-dang-bo-chan-day-dan-sieu-am-kieu-dang-tre-trung-nang-dong-qb1282-p148639543.html?spid=148639619,,5.0,thoitrangbau,645000.0
34,Váy sơ mi lụa hàn quốc cho con bú ẢNH thật,559000,https://tiki.vn/vay-so-mi-lua-han-quoc-cho-con-bu-anh-that-p95173487.html?spid=95173507,,2.0,thoitrangbau,1118000.0
35,Quần lót bầu quần mặc váy bầu bắt chéo chất cotton cao cấp,39648,https://tiki.vn/quan-lot-bau-quan-mac-vay-bau-bat-cheo-chat-cotton-cao-cap-p120856775.html?spid=120856813,,11.0,thoitrangbau,436128.0
36,"Áo bầu CÔNG SỞ kéo khóa cánh tiên, chất cotton thấm hút mồ hôi có size 48->72kg",125000,https://tiki.vn/ao-bau-cong-so-keo-khoa-canh-tien-chat-cotton-tham-hut-mo-hoi-co-size-48-72kg-p103098404.html?spid=116458867,,1.0,thoitrangbau,125000.0
37,"Đầm Bầu Mặc Nhà, Váy Bầu Mùa Hè Pha Ren Hoạ Tiết Hình Sao DB10",219000,https://tiki.vn/dam-bau-mac-nha-vay-bau-mua-he-pha-ren-hoa-tiet-hinh-sao-db10-p164582398.html?spid=164582420,,1.0,thoitrangbau,219000.0
38,COMBO 2 QUẦN ĐÙI MẶC VÁY BÀ BẦU COTTON,86480,https://tiki.vn/combo-2-quan-dui-mac-vay-ba-bau-cotton-p83669038.html?spid=83669043,,1.0,thoitrangbau,86480.0
39,QUẦN BẦU DÀI - LEGGING BẦU DÀI HÌNH MÈO (CT 555),99540,https://tiki.vn/quan-bau-dai-legging-bau-dai-hinh-meo-ct-555-p146574442.html?spid=146574471,,3.0,thoitrangbau,298620.0
40,Váy len dáng dài khoá dọc cho con tiẢNH THẬT,318500,https://tiki.vn/vay-len-dang-dai-khoa-doc-cho-con-ti-anh-that-p95173849.html?spid=95174043,,1.0,thoitrangbau,318500.0
41,Váy cho con bú sz SML,377000,https://tiki.vn/vay-cho-con-bu-sz-sml-p95174205.html?spid=95174375,,2.0,thoitrangbau,754000.0
42,Vây hoa sang chảnh cho con bú sz S- XXL ẢNH THẬT SHOP CHỤP,377000,https://tiki.vn/vay-hoa-sang-chanh-cho-con-bu-sz-s-xxl-anh-that-shop-chup-p95172578.html?spid=95172602,,2.0,thoitrangbau,754000.0
43,A03 Áo cổ tim cho con bú SALE HOT,154700,https://tiki.vn/a03-ao-co-tim-cho-con-bu-sale-hot-p95173881.html?spid=95174059,,1.0,thoitrangbau,154700.0
44,Váy bầu suông dáng công sở chất trượt nhật màu xanh,168000,https://tiki.vn/vay-bau-suong-dang-cong-so-chat-truot-nhat-mau-xanh-p129494956.html?spid=129494963,,1.0,thoitrangbau,168000.0
45,Quần lót bầu và sau sinh cạp chéo chất su thông hơi kháng khuẩn an toàn cho mẹ bầu,41000,https://tiki.vn/quan-lot-bau-va-sau-sinh-cap-cheo-chat-su-thong-hoi-khang-khuan-an-toan-cho-me-bau-p127456413.html?spid=127457170,,2.0,thoitrangbau,82000.0
46,"Váy bầu đẹp, Đầm bầu công sở thời trang, MLEE SHOP",155000,https://tiki.vn/vay-bau-dep-size-40-80kg-p254903214.html?spid=254903221,,1.0,thoitrangbau,155000.0
47,Áo bầu thu đông dáng dài áo len dáng dài ABL49,265000,https://tiki.vn/ao-bau-thu-dong-dang-dai-ao-len-dang-dai-abl49-p141367554.html?spid=141367556,-12%,2.0,thoitrangbau,530000.0
48,QUẦN BẦU HÈ THU JEAN DÁNG NGỐ ĐÙI PHONG CÁCH TRẺ TRUNG QBN1230,365000,https://tiki.vn/quan-bau-he-thu-jean-dang-ngo-dui-phong-cach-tre-trung-qbn1230-p253281938.html?spid=253281960,,1.0,thoitrangbau,365000.0
49,"Bộ Đồ Bầu Sau Sinh, Bộ Gấu Dài Tay Mặc Nhà Cho Mẹ, Quần Chỉnh Chun, Size Rộng",150000,https://tiki.vn/bo-do-bau-sau-sinh-bo-gau-dai-tay-mac-nha-cho-me-quan-chinh-chun-size-rong-p101252738.html?spid=101252772,,1.0,thoitrangbau,150000.0
50,Đầm bầu nơ phối màu - xanh than - S (45-55kg),288000,https://tiki.vn/dam-bau-no-phoi-mau-p273590095.html?spid=273590103,,1.0,thoitrangbau,288000.0
51,Quần legging bầu lửng cạp chéo đen Ms148,99000,https://tiki.vn/quan-legging-bau-lung-cap-cheo-den-ms148-p83777096.html?spid=93268012,,2.0,thoitrangbau,198000.0
52,váy bầu đầm bầu cao cấp️mặc đi làm đi chơi đều đc️chất kẻ lanh Hàn mát mềm mịn️freesize 42-68kg,142000,https://tiki.vn/vay-bau-dam-bau-cao-cap-mac-di-lam-di-choi-deu-dc-chat-ke-lanh-han-mat-mem-min-freesize-42-68kg-p103097110.html?spid=124039487,,2.0,thoitrangbau,284000.0
53,"Áo lót bầu, áo cho con bú Haint Boutique cao cấp HB02",87000,https://tiki.vn/ao-lot-bau-ao-cho-con-bu-haint-boutique-cao-cap-hb02-p103231653.html?spid=103231682,,2.0,thoitrangbau,174000.0
54,V23 váy đuôi cá cổ thêu cho con bú,325000,https://tiki.vn/v23-vay-duoi-ca-co-theu-cho-con-bu-p95172580.html?spid=95172606,,1.0,thoitrangbau,325000.0
55,Váy bầu thiết kế đuôi cá đen trắng w128,251370,https://tiki.vn/vay-bau-thiet-ke-duoi-ca-den-trang-w128-p146574947.html?spid=146575038,,1.0,thoitrangbau,251370.0
56,Combo 2 áo lót bầu thông hơi + 5 quần chip bầu,227000,https://tiki.vn/combo-2-ao-lot-bau-thong-hoi-5-quan-chip-bau-p148641349.html?spid=148641355,,1.0,thoitrangbau,227000.0
57,váy len body cho con bú ️ẢNH THẬT SHOP CHỤP,468000,https://tiki.vn/vay-len-body-cho-con-bu-anh-that-shop-chup-p95170160.html?spid=95170206,,2.0,thoitrangbau,936000.0
58,Áo cho con ti sz m-2xl,247000,https://tiki.vn/ao-cho-con-ti-sz-m-2xl-p95172287.html?spid=95172339,,2.0,thoitrangbau,494000.0
59,VÁY BẦU CHO CON BÚ SAU SINH️KÈM ẢNH THẬT,325000,https://tiki.vn/vay-bau-cho-con-bu-sau-sinh-kem-anh-that-p95172262.html?spid=95172290,,1.0,thoitrangbau,325000.0
60,Quần lót bầu cạp chéo kháng khuẩn chất coton chất lượng loại 1 QL001,12000,https://tiki.vn/quan-lot-bau-cap-cheo-khang-khuan-chat-coton-chat-luong-loai-1-ql001-p148637521.html?spid=148637543,,4.0,thoitrangbau,48000.0
61,XẢ KHO bộ TOLE ( lanh ) bầu hàng sau sinh,135000,https://tiki.vn/xa-kho-bo-tole-lanh-bau-hang-sau-sinh-p105799352.html?spid=105799361,,1.0,thoitrangbau,135000.0
62,Quần bầu SOOC jean RÁCH cao cấp có chun và cúc điều chỉnh BSR 45,137340,https://tiki.vn/quan-bau-sooc-jean-rach-cao-cap-co-chun-va-cuc-dieu-chinh-bsr-45-p146573828.html?spid=146573849,,1.0,thoitrangbau,137340.0
63,Áo lót cho con bú cúc bấm tiện lợi A05,99000,https://tiki.vn/ao-lot-cho-con-bu-cuc-bam-tien-loi-ab05-p183700323.html?spid=183700329,,1.0,thoitrangbau,99000.0
64,Váy Đầm bầu và sau sinh cho con bú ti CỔ TIM TRƠN - Váy đầm bầu xinh công sở thời trang thiết kế đẹp sang chảnh Bigsize,280000,https://tiki.vn/vay-dam-bau-va-sau-sinh-cho-con-bu-ti-co-tim-tron-vay-dam-bau-xinh-cong-so-thoi-trang-thiet-ke-dep-sang-chanh-bigsize-p114404168.html?spid=114404571,,2.0,thoitrangbau,560000.0
65,ẢNH VIDEO THẬT️ Váy cho con ti,338000,https://tiki.vn/anh-video-that-vay-cho-con-ti-p95172048.html?spid=95172506,,2.0,thoitrangbau,676000.0
66,"Ngũ cốc lợi sữa Lạc Lạc Plus mới cao cấp 39 loại hạt giúp mẹ bổ sung vitamin và khoáng chất, canxi giúp xương chắc khỏe 600g (hộp 30 gói)",515000,https://tka.tiki.vn/pixel/pixel?data=dFNCGTrOt4tVhDDpt-79VcP2YmunV-nnjxhHwxqLOa10zsex8U5NZtlI78j3yLSKB7JjZ6wzWMd2rWZVU3dI-LRF9y8zJF9kQXhr_EgxS535amQcVe5kcduwUTM7a2r6LX_jVxXqZ5dt95WB5caV5-nHxVGJn9Y82TYExS018ZFuS4IUto8RYovlzoK5pBalod9wsb2oIXI1CIh85EqILVU2TDT1jyiJeIsWjZXd0AxszsUq2J_naz2JetIuXqFR6_EwnT1huGaWyPT681hnqkTP092rbFdFL0Cb7IwmFl4XjP51B6xjQqfGOAePGuAh9QRwmnOkEpYuCFcTW21ktAyKKifT0RBkHtj7Ael56qU88uBYxG_M89XcZkNPwNJQKm7dP0qVLQ75nF4RwPwiOpqwZscG1GVk9KChQZHiBloH7Nt1eEVaYDiR411BjUt2y0v9m-XOz2QEUJAe3Zo4_eMbOcLFhuM2DzvuXCztEmL1rKZV8sB2s7ICaSCLrLX_kTXZeVWjnD8m5VeuFrbtHaHgG9vRoc6nfpIcTQkiw2ziT1ibxGIc8gS5t-Cj2wMNgc8fW7JZjMT8zVryHywbBQR7nRtkqTS13v1peWr6SXm3mr1z_d1BL-e-r_dJMK4NvGoQja-ebxx4cwuyG0LiUFznE99fUw81zaycfq9UmHPxpsiu9wJX7Dwr91vkCHtr9V0-zxeygxalk6OTIkqddc7kvriO-0ACwue4ubBAKk7lfLFKbvRT1yDD3CG39Vj8s7J8zSaZP2JqxObgHx1pgWYqP45nOm9l8HnawfmSIFK-Uk7Nvv6LriaRghdFPiVxsiniMMVWWfMsb0sasGqDiS2xuQzbo_GNNqYcjYbdjznxVB3j971c9wuDtWv2WI2yoA2sO7kTMKiQiO3Z98tNFNrIpmEhRpf657NWSobthmEAk-D137_9FjzKPba4UJJwAFyaotnjpVPuJlrW6MDbzblf7KJ74fvqRlVQQXQOsPCgCoMtsY9BzytNKTywmozktq5IcTcQ5w7JV5sGq1lSQKXN5JQNbfLR-nRlCfVHSvqaA9Bbpo8Ts3cY1Qdr0xEvC_TWtQLCQdAeRxt68LrFnuQfXQOtSN6xEUzc9VoW-7ToyVRMSIlVqYshb2KipoclL8ZeyQUdPnow&reqid=wJevo6SUZJoqF6CM&type=CLICK&pos=41,-14%,1.0,thoitrangbau,515000.0
67,Quần mặc trong váy cho mẹ bầu,67000,https://tiki.vn/quan-mac-trong-vay-cho-me-bau-p254903405.html?spid=254903408,-43%,8.0,thoitrangbau,536000.0
68,"Quần đùi bầu cạp chéo Mặc ngủ và mặc trong váy cho bà bầu mùa hè (Hàng đẹp, cao cấp)",35000,https://tiki.vn/quan-dui-bau-cap-cheo-mac-ngu-va-mac-trong-vay-cho-ba-bau-mua-he-hang-dep-cao-cap-p148640744.html?spid=148640777,,27.0,thoitrangbau,945000.0
69,Sét 4 Quần Lót Bầu cạp chéo coton (CS 101) ) sịn siêu đáng yêu ( túi zip),137340,https://tiki.vn/set-4-quan-lot-bau-cap-cheo-coton-cs-101-sin-sieu-dang-yeu-tui-zip-p146575696.html?spid=146575750,,3.0,thoitrangbau,412020.0
70,Quần Bầu đùi ( mặc trong váy ) Phối ren ôm bụng bầu QL05,113000,https://tiki.vn/quan-bau-dui-mac-trong-vay-phoi-ren-om-bung-bau-ql05-p91105316.html?spid=91105382,,3.0,thoitrangbau,339000.0
71,Combo Gối Chặn Cho Bé Sơ Sinh Cao Cấp Chống Giật Mình Giúp Bé Ngủ Ngon Hơn 267,99000,https://tiki.vn/goi-chan-cho-be-so-sinh-cao-cap-chong-giat-minh-giup-be-ngu-ngon-hon-p207041225.html?spid=272047644,,2.0,thoitrangbau,198000.0
72,Áo ngực bầu- Áo lót bầu và cho con bú mở cúc ngang tiện lợi A02,99000,https://tiki.vn/ao-nguc-bau-ao-lot-bau-va-cho-con-bu-mo-cuc-ngang-tien-loi-ab02-p183692692.html?spid=183692705,,1.0,thoitrangbau,99000.0
73,Quần bầu dài thun cotton lạnh loại mỏng mát,99750,https://tiki.vn/quan-bau-dai-thun-cotton-lanh-loai-mong-mat-p83667360.html?spid=83667368,,6.0,thoitrangbau,598500.0
74,"Váy bầu trễ vai họa tiết hoa cúc mặc bầu và sau sinh, đầm bầu thiết kế phong cách tiểu thư sang chảnh V270",132300,https://tiki.vn/vay-bau-tre-vai-hoa-tiet-hoa-cuc-mac-bau-va-sau-sinh-dam-bau-thiet-ke-phong-cach-tieu-thu-sang-chanh-v270-p146574601.html?spid=146574665,,1.0,thoitrangbau,132300.0
75,Áo lót bầu cho con bú pha ren có cúc bấm hàng loại đẹp A07,149000,https://tiki.vn/ao-lot-bau-cho-con-bu-pha-ren-co-cuc-bam-hang-loai-dep-ab07-p183700519.html?spid=183700527,,1.0,thoitrangbau,149000.0
76,Áo bầu thu đông thun cotton kẻ ngang có chỗ cho bé ty AB1210,302000,https://tiki.vn/ao-bau-thu-dong-thun-cotton-ke-ngang-co-cho-cho-be-ty-ab1210-p141489437.html?spid=141489439,,1.0,thoitrangbau,302000.0
77,Bộ đồ sau sinh,69000,https://tiki.vn/bo-do-sau-sinh-p114682408.html?spid=114682447,,1.0,thoitrangbau,69000.0
78,QUẦN BẦU HÈ THU DÁNG NGỐ ĐÙI ÔM XINH XẮN QBN1242,195000,https://tiki.vn/quan-bau-he-thu-dang-ngo-dui-om-xinh-xan-qbn1242-p113198107.html?spid=113198116,,1.0,thoitrangbau,195000.0
79,Bộ lanh lụa cúc giữa cho mẹ bầu và sau sinh,129000,https://tiki.vn/bo-lanh-lua-cuc-giua-cho-me-bau-va-sau-sinh-p101252820.html?spid=101252824,,1.0,thoitrangbau,129000.0
80,Baggy bầu công sở cạp V mới nhất 2021,200000,https://tiki.vn/baggy-bau-cong-so-cap-v-moi-nhat-2021-p92322166.html?spid=92322201,-38%,1.0,thoitrangbau,200000.0
81,Sơ mi kẻ hàng Quảng Châu,250000,https://tiki.vn/so-mi-ke-hang-quang-chau-p92319464.html?spid=273214761,,1.0,thoitrangbau,250000.0
82,Bộ đồ bầu sau sinh cho con bú ti XÔ NHẬT thô đũi cực mát - Pijama bầu & sau sinh Quần áo bầu mặc nhà mùa hè đẹp Bigsize,248000,https://tiki.vn/bo-do-bau-sau-sinh-cho-con-bu-ti-xo-nhat-tho-dui-cuc-mat-pijama-bau-sau-sinh-quan-ao-bau-mac-nha-mua-he-dep-bigsize-p114404626.html?spid=114405600,,1.0,thoitrangbau,248000.0
83,"Đầm bầu suông linen cổ tròn ngắn tay mặc hè, chất linen tự nhiên mềm mát Haint Boutique B84",246000,https://tiki.vn/dam-bau-suong-linen-co-tron-ngan-tay-mac-he-chat-linen-tu-nhien-mem-mat-haint-boutique-b84-p185353545.html?spid=185353551,,3.0,thoitrangbau,738000.0
84,Khăn Choàng Tắm Cho Bé Sơ Sinh Có Mũ Siêu Mềm Thấm Hút Tốt An Toàn Cho Trẻ Em,99000,https://tiki.vn/khan-choang-tam-cho-be-so-sinh-co-mu-sieu-mem-tham-hut-tot-an-toan-cho-tre-em-p207033145.html?spid=207033173,,4.0,thoitrangbau,396000.0
85,Quần tất bầu dày vừa có chun chỉnh,71694,https://tiki.vn/quan-tat-bau-day-vua-co-chun-chinh-p146572990.html?spid=146573016,,1.0,thoitrangbau,71694.0
86,V37 váy hoa hotgirl 2 màu cho con bú,377000,https://tiki.vn/v37-vay-hoa-hotgirl-2-mau-cho-con-bu-p95170173.html?spid=95170207,,2.0,thoitrangbau,754000.0
87,Váy Bầu Hè Công Sở Tay Voan Đính Hoa Ngực Sang Chảnh HD2610 Honey Mommy Đầm Bầu Công Sở Hè,338000,https://tiki.vn/vay-bau-he-cong-so-tay-voan-dinh-hoa-nguc-sang-chanh-hd2610-honey-mommy-dam-bau-cong-so-he-p95584429.html?spid=95584461,,1.0,thoitrangbau,338000.0
88,"Váy bầu trễ vai phong cách tiểu thư sang chảnh , đầm bầu thiết kế CHẤM BI HỒNG V270",136080,https://tiki.vn/vay-bau-tre-vai-phong-cach-tieu-thu-sang-chanh-dam-bau-thiet-ke-cham-bi-hong-v270-p146575318.html?spid=146575339,,1.0,thoitrangbau,136080.0
89,Móc nới áo ngực (3 nấc) phù hợp với áo lót trơn cúc mở,11340,https://tiki.vn/moc-noi-ao-nguc-3-nac-phu-hop-voi-ao-lot-tron-cuc-mo-p146572957.html?spid=146572978,,1.0,thoitrangbau,11340.0
90,Bộ bầu và sau sinh Pink cổ chéo,179000,https://tiki.vn/bo-bau-va-sau-sinh-pink-co-cheo-p107279015.html?spid=107279238,,1.0,thoitrangbau,179000.0
91,Bộ đồ bầu và sau sinh LỬNG chất lanh thái siêu mát có khóa ngực cho bé ti BL836,132300,https://tiki.vn/bo-do-bau-va-sau-sinh-lung-chat-lanh-thai-sieu-mat-co-khoa-nguc-cho-be-ti-bl836-p146573520.html?spid=146573599,,1.0,thoitrangbau,132300.0
92,"QUẦN LÓT NỮ THÔNG HƠI PHA REN CẠP CAO CHẤT ĐẸP 5885, (ảnh thật phía sau các bạn nhé)",13734,https://tiki.vn/quan-lot-nu-thong-hoi-pha-ren-cap-cao-chat-dep-5885-anh-that-phia-sau-cac-ban-nhe-p146572061.html?spid=146572072,,1.0,thoitrangbau,13734.0
93,QUẦN BẦU LÓT LÔNG THU ĐÔNG,99000,https://tiki.vn/quan-bau-lot-long-thu-dong-p159241669.html?spid=159241675,,3.0,thoitrangbau,297000.0
94,QUẦN BẦU KAKI NGỐ ĐÙI QBD1510,325000,https://tiki.vn/quan-bau-kaki-ngo-dui-qbd1510-p258863170.html?spid=258863172,,1.0,thoitrangbau,325000.0
95,quần legging bầu chễ( có chun chỉnh bụng)(full size 40-90kg),150000,https://tiki.vn/quan-legging-bau-che-co-chun-chinh-bung-full-size-40-90kg-p92318982.html?spid=92319000,,1.0,thoitrangbau,150000.0
96,Áo bầu cotton da cá nơ eo,195000,https://tiki.vn/ao-bau-cotton-da-ca-no-eo-p92322549.html?spid=92322568,,3.0,thoitrangbau,585000.0
97,Áo sơ mi bầu công sở trẻ trung Korean style - Tổng kho đồ bầu,104000,https://tiki.vn/ao-so-mi-bau-cong-so-tre-trung-korean-style-tong-kho-do-bau-p98366589.html?spid=112985660,,2.0,thoitrangbau,208000.0
