title,price,link_item,index,discount,sales,category
Set bộ ngủ 2 dây ren cực SEXY T189 GIAO HOẢ TỐC HCM,108.000₫,https://tiki.vn/set-bo-ngu-2-day-ren-cuc-sexy-t189-giao-hoa-toc-hcm-p155706124.html?spid=155706149,1,,Đã bán 1,dongu
"Đầm ngủ phi lụa cao cấp WANNABE DNS40 váy ngủ 2 dây rã cúp phối ren ngực, ren eo tạo nét quyến rũ nữ tính cho bạn gái",550.000₫,https://tiki.vn/dam-ngu-phi-lua-cao-cap-wannabe-dns40-ra-cup-phoi-ren-nu-quyen-ru-nu-tinh-p197408910.html?spid=197408912,2,,,dongu
ST8712 Bộ đồ mặc nhà nữ pijamas linen SUNFLY áo tay lỡ quần dài - đỏ,485.000₫,https://tiki.vn/bo-do-mac-nha-nu-pijamas-linen-sunfly-ao-tay-lo-quan-dai-st8712-p127103514.html?spid=147874261,3,-56%,,dongu
BỘ MẶC NHÀ NHIHOUSE71 PIZAMA LỤA QUẦN DÀI TAY DÀI HỌA TIẾT DỄ THƯƠNG CÓ TÚI,179.000,https://tiki.vn/bo-mac-nha-nhihouse71-pizama-lua-quan-dai-tay-dai-hoa-tiet-de-thuong-co-tui-p92049027.html?spid=92049116,4,-23%,,dongu
,,https://tiki.vn/hisexy-vay-ngu-2-day-nu-ren-xe-lien-than-chat-lua-satin-cao-cap-du-size-duoi-75kg-md29-p124324464.html?spid=124325946,5,-48%,,dongu
"PIJAMA ĐỒ BỘ MẶC NHÀ NỮ, TAY NGẮN QUẦN CỘC, LỤA MANGO, LATIN, SATIN, TƠ TẰM CAO CẤP, HỌA TIẾT XINH XẮN PHỐI CỰC DỄ THƯƠNG, ĐÁNG YÊU",138.000₫,https://tiki.vn/pijama-do-bo-mac-nha-nu-tay-ngan-quan-coc-lua-mango-latin-satin-to-tam-cao-cap-hoa-tiet-xinh-xan-phoi-cuc-de-thuong-dang-yeu-p156189755.html?spid=156189761,6,,,dongu
Đầm ngủ hai dây+áo khoác RBI satin họa tiết,199.000₫,https://tiki.vn/dam-ngu-hai-day-ao-khoac-rbi-satin-hoa-tiet-p109589012.html?spid=109589016,7,,Đã bán 1,dongu
Đồ mặc nhà bigsize nữ phong cách bộ mặc nhà BC25,122.000₫,https://tiki.vn/do-mac-nha-bigsize-nu-phong-cach-bo-mac-nha-bc25-p147123729.html?spid=147123841,8,,Đã bán 13,dongu
"Đồ bộ mặc nhà , đồ mặc ngủ nữ hai dây lụa phối xẻ tà xinh xắn Dreamy- DN30",168.000,https://tiki.vn/do-bo-mac-nha-do-mac-ngu-nu-hai-day-lua-phoi-xe-ta-xinh-xan-dreamy-dn30-p252636890.html?spid=252636902,9,,,dongu
,,https://tiki.vn/bo-mac-nha-lanh-tole-vicci-vai-cheo-han-cao-cap-bst-086-12-quan-ong-so-hoa-tiet-hoa-nau-p16161024.html?spid=16161032,10,,,dongu
Đồ ngủ Cosplay học sinh xuyên thấu quyến rũ,149.000₫,https://tiki.vn/do-ngu-cosplay-hoc-sinh-xuyen-thau-quyen-ru-p69192823.html?spid=82861273,11,,Đã bán 11,dongu
Set cosplay cô dâu kiểu dáng sexy xinh xắn G57,254.800,https://tiki.vn/set-cosplay-co-dau-kieu-dang-sexy-xinh-xan-g57-p85905126.html?spid=85905132,12,,Đã bán 3,dongu
,,https://tiki.vn/bo-pijama-lua-tron-cho-nu-tay-dai-quan-dai-mau-hong-pastel-cao-cap-p57051037.html?spid=77947567,13,,,dongu
Bộ mặc nhà lanh (tole) Vicci BST.086.6 vải chéo Hàn cao cấp quần ống sớ hoạ tiết,349.000₫,https://tiki.vn/bo-mac-nha-lanh-tole-vicci-bst-086-6-vai-cheo-han-cao-cap-quan-ong-so-hoa-tiet-hoa-p16161641.html?spid=16161645,14,,Đã bán 19,dongu
Bộ Đồ Ngủ Lụa Cao Cấp Lady Nature Miley Lingerie CSS0202,319.000₫,https://tiki.vn/bo-do-ngu-lua-cao-cap-lady-nature-miley-lingerie-css0202-p95889480.html?spid=95889482,15,,Đã bán 4,dongu
ĐỒ BỘ CÁT HÀN PHA COTTON LOẠI 1 - 9 tất - freesize,92.000₫,https://tiki.vn/do-bo-cat-han-pha-cotton-loai-1-9-tat-freesize-p150046484.html?spid=162838957,16,,Đã bán 25,dongu
Đầm mặc nhà 2 dây Haint Boutique thiết kế đuôi cá kẻ nhỏ trẻ trung Vn07,199.000,https://tiki.vn/dam-mac-nha-2-day-haint-boutique-thiet-ke-duoi-ca-ke-nho-tre-trung-vn07-p87749250.html?spid=87749258,17,,,dongu
,,https://tiki.vn/bo-long-nu-mac-nha-dang-rong-hang-cao-cap-p194787929.html?spid=194787931,18,,,dongu
đồ nữ mặc nhà vải kate,190.000₫,https://tiki.vn/do-nu-mac-nha-vai-kate-p222568944.html?spid=222568966,19,,,dongu
Váy Ngủ Kiểu Sơ Mi Kèm Thắt Lưng Kiểu Tay Lỡ CDAN73,139.000₫,https://tiki.vn/vay-ngu-kieu-so-mi-kem-that-lung-kieu-tay-lo-cdan73-p125099955.html?spid=125099971,20,,Đã bán 2,dongu
Váy ngủ gợi cảm tphcm VNS532 - đồ ngủ siêu mỏng,98.450₫,https://tiki.vn/vay-ngu-goi-cam-tphcm-vns532-do-ngu-sieu-mong-p187387810.html?spid=187387944,21,,,dongu
Đầm ngủ đẹp gợi cảm VNS284B-Váy ngủ sexy,159.250₫,https://tiki.vn/dam-ngu-dep-goi-cam-vns284b-vay-ngu-sexy-p186447515.html?spid=186447545,22,,Đã bán 1,dongu
Bodysuit nữ dài tay lấp lánh LyLy JM072 áo liền thân tay bồng thiết kế độc quyền,450.000₫,https://tiki.vn/bodysuit-nu-dai-tay-lap-lanh-lyly-jm072-ao-lien-than-tay-bong-thiet-ke-doc-quyen-p205979958.html?spid=205979968,23,,,dongu
"Đầm 2 dây mặc nhà,đồ ngủ họa tiết Haint Boutique nhiều hình lựa chọn",119.000₫,https://tiki.vn/dam-2-day-mac-nha-do-ngu-hoa-tiet-haint-boutique-nhieu-hinh-lua-chon-p102738899.html?spid=102738931,24,,Đã bán 2,dongu
"Bộ mặc nhà nữ, bộ ngủ nữ phong cách tiểu thư siêu đẹp ( có ảnh chụp cận chất)",331.000,https://tiki.vn/bo-mac-nha-nu-bo-ngu-nu-phong-cach-tieu-thu-sieu-dep-co-anh-chup-can-chat-p131174513.html?spid=131174542,25,,,dongu
,,https://tiki.vn/vay-ngu-xuyen-thau-co-do-ho-lung-sexy-bt42223-dam-ngu-do-ngu-p204071044.html?spid=204071050,26,,,dongu
"Set cosplay nàng hầu sexy, nóng bỏng- Kèm ảnh thật T119 GIAO HOẢ TỐC HCM",169.000₫,https://tiki.vn/set-cosplay-nang-hau-sexy-nong-bong-kem-anh-that-t119-giao-hoa-toc-hcm-p155705524.html?spid=155705539,27,,Đã bán 1,dongu
"Bộ Đồ Mặc Nhà Nữ Cho Người Trung Niên, Người Lớn Tuổi NG37 - Size",290.000₫,https://tiki.vn/bo-do-mac-nha-nu-cho-nguoi-trung-nien-nguoi-lon-tuoi-ng37-p8448281.html?spid=8448285,28,,Đã bán 32,dongu
Bodystocking Tất Ngủ Toàn Thân,75.000₫,https://tiki.vn/bodystocking-tat-ngu-toan-than-p12875659.html?spid=115269640,29,,Đã bán 5,dongu
"Bộ đồ ngủ nữ vải Cotton lanh lụa tự nhiên mềm mịn mát lạnh, set đồ nữ hai dây quần đùi mặc nhà mặc mùa hè mã BD0180",139.000,https://tiki.vn/bo-do-ngu-nu-vai-cotton-lanh-lua-tu-nhien-mem-min-mat-lanh-set-do-nu-hai-day-quan-dui-mac-nha-mac-mua-he-ma-bd0180-p189686556.html?spid=189686675,30,,,dongu
,,https://tiki.vn/vay-dam-ngu-2-hai-day-mac-nha-sexy-madela-dui-lua-to-han-dam-vay-ngu-hai-day-mac-nha-vdd02-p174621828.html?spid=174621918,31,,,dongu
Bộ đùi lụa xước cao cấp mềm mát(40-60kg) bộ mặc nhà nữ có túi A12,159.000₫,https://tiki.vn/bo-dui-lua-xuoc-cao-cap-mem-mat-40-60kg-bo-mac-nha-nu-co-tui-a12-p251278851.html?spid=251278852,32,,,dongu
Váy ngủ hai dây đầm ngủ lụa có mút ngực mềm mịn đuôi xếp li ( tặng kèm bịt mắt ) MD32,139.000₫,https://tiki.vn/vay-ngu-hai-day-dam-ngu-lua-co-mut-nguc-mem-min-duoi-xep-li-tang-kem-bit-mat-md32-p124323790.html?spid=124323976,33,,Đã bán 24,dongu
đồ bộ nữ vải kate,180.000₫,https://tiki.vn/do-bo-nu-vai-kate-p210751877.html?spid=210751907,34,,Đã bán 2,dongu
Bộ ngủ nữ cotton thấm hút dễ chịu bigsize đồ mặc nhà BL03,136.000,https://tiki.vn/bo-ngu-nu-cotton-tham-hut-de-chiu-bigsize-do-mac-nha-bl03-p147123877.html?spid=147124131,35,,,dongu
,,https://tiki.vn/do-ngu-nu-bigsize-phong-cach-bo-mac-nha-thun-mat-bc23-p147123603.html?spid=147123671,36,,,dongu
Đầm ngủ cosplay sexy BT7225 - Đồ ngủ - Váy ngủ,240.000₫,https://tiki.vn/dam-ngu-cosplay-sexy-bt7225-do-ngu-vay-ngu-p203456104.html?spid=203456105,37,,,dongu
Bộ đồ ngủ Kimono phong cách Nhật Bản quyến rũ - Màu đen,135.000₫,https://tiki.vn/bo-do-ngu-kimono-phong-cach-nhat-ban-quyen-ru-mau-den-p52304518.html?spid=52304519,38,,Đã bán 21,dongu
Váy ngủ gợi cảm G30 - Váy ngủ sexy - váy ngủ ren - Váy ngủ đẹp - Đầm ngủ quyến rũ - váy ngủ đẹp - váy ngủ lụa cao cấp,147.000₫,https://tiki.vn/vay-ngu-goi-cam-g30-vay-ngu-sexy-vay-ngu-ren-vay-ngu-dep-dam-ngu-quyen-ru-vay-ngu-dep-vay-ngu-lua-cao-cap-p103360099.html?spid=103360143,39,,Đã bán 7,dongu
Bộ Đồ Ngủ Kimono In Hoa Quyến Rũ Cho Nữ,118.000,https://tiki.vn/bo-do-ngu-kimono-in-hoa-quyen-ru-cho-nu-p68962159.html?spid=68962161,40,,,dongu
