,title,price,link_item,discount,sales,category,revenue
383,"Áo kiểu nữ Linen tưng Premium tay cánh rới form rộng trẻ trung, không kén dáng mặc",250000,https://tiki.vn/ao-kieu-nu-linen-tung-premium-tay-canh-roi-form-rong-tre-trung-khong-ken-dang-mac-p192894272.html?spid=192894278,,2.0,aonu,500000.0
384,Áo kiểu tay tầng xinh xắn,144000,https://tiki.vn/ao-kieu-tay-tang-xinh-xan-p78903355.html?spid=78903368,,10.0,aonu,1440000.0
385,"Áo ngắn tay mặc nhà vải Cotton lụa thoáng mát mềm mại, áo ngủ nữ mã VAA0439 - M10 Vàng đậm",89000,https://tiki.vn/ao-ngan-tay-mac-nha-vai-cotton-lua-thoang-mat-mem-mai-ao-ngu-nu-ma-vaa0439-p270801727.html?spid=270801784,,1.0,aonu,89000.0
386,Áo Kiểu Nữ Hàn Quốc Dạng Áo Kiểu Tay Lỡ Phối Màu - Nhiều Màu GOTI 3A03,209000,https://tiki.vn/ao-kieu-nu-han-quoc-dang-ao-kieu-tay-lo-phoi-mau-nhieu-mau-goti-3a03-p73200262.html?spid=105644237,,53.0,aonu,11077000.0
387,Áo nữ tay lỡ vải đũi Sm54,158000,https://tiki.vn/ao-nu-tay-lo-vai-dui-sm54-p22944560.html?spid=50421214,,171.0,aonu,27018000.0
388,Áo Sơ Mi Nữ Công Sở,104000,https://tiki.vn/ao-so-mi-nu-cong-so-p41664061.html?spid=82221747,,1.0,aonu,104000.0
389,Áo kiểu nữ dài tay phối viền sang trọng - thích hợp mặc đi làm mang đến vẻ thanh lịch sang trọng,143000,https://tiki.vn/ao-kieu-nu-dai-tay-phoi-vien-sang-trong-thich-hop-mac-di-lam-mang-den-ve-thanh-lich-sang-trong-p61280951.html?spid=61280969,,33.0,aonu,4719000.0
390,"Áo kiểu Judy cổ vuông phối nút sang trọng - form dáng chuẩn, dễ dàng mix cùng chân váy, quần mặc dự tiệc, đi làm",180000,https://tiki.vn/ao-kieu-judy-co-vuong-phoi-nut-sang-trong-form-dang-chuan-de-dang-mix-cung-chan-vay-quan-mac-du-tiec-di-lam-p196409068.html?spid=196409076,,3.0,aonu,540000.0
391,Áo Thun Nữ Cổ Lọ Tay Dài Giữ Nhiệt Vải Thun Cao Cấp Mềm Mịn Ôm Dáng - MSP T22,65000,https://tiki.vn/ao-thun-nu-co-lo-tay-dai-giu-nhiet-vai-thun-cao-cap-mem-min-om-dang-msp-t22-p98772287.html?spid=127220042,,8.0,aonu,520000.0
392,Áo phông nữ kiểu lệch tà - Áo thun nữ dáng ôm body tay ngắn chất thun cotton mềm mại trẻ trung phong cách,99000,https://tiki.vn/ao-phong-nu-kieu-lech-ta-ao-thun-nu-dang-om-body-tay-ngan-chat-thun-cotton-mem-mai-tre-trung-phong-cach-p176288942.html?spid=176288946,,1.0,aonu,99000.0
393,Áo len nữ cộc tay kẻ ngang cổ bẻ,99000,https://tiki.vn/ao-len-nu-coc-tay-ke-ngang-co-be-p121210753.html?spid=121210764,,10.0,aonu,990000.0
394,"M182. Áo 2 dây thun gân dáng dài sẵn đệm ngực, áo kiểu nữ đẹp sang chảnh mặc trong vest cá tính (có sẵn - miễn ship)",29000,https://tiki.vn/m182-ao-2-day-thun-gan-dang-dai-san-dem-nguc-ao-kieu-nu-dep-sang-chanh-mac-trong-vest-ca-tinh-co-san-mien-ship-p217781654.html?spid=271434094,,7.0,aonu,203000.0
395,Áo sơ mi nữ tay dài 2 túi vải Manggo Cao Cấp dày mềm mịn mát êm,121000,https://tiki.vn/ao-so-mi-nu-tay-dai-2-tui-vai-manggo-cao-cap-day-mem-min-mat-em-p145760525.html?spid=145760537,,20.0,aonu,2420000.0
396,Áo kiểu nữ công sở tay ngắn cổ nơ cách điệu thời trang Eden - ASM204,279000,https://tiki.vn/ao-kieu-nu-cong-so-tay-ngan-co-no-cach-dieu-thoi-trang-eden-asm204-p254073713.html?spid=254073719,,2.0,aonu,558000.0
397,Áo kiểu nữ cổ sen xinh xắn kiểu dáng công sở sm169,159000,https://tiki.vn/ao-nu-kem-day-that-no-o-co-dieu-da-sm189-p110201731.html?spid=110201782,,1.0,aonu,159000.0
398,"Áo kiểu cho nữ Sexy tay phồng ngắn xẻ , cổ chữ U trễ vai phong cách Hàn Quốc đáng yêu",216348,https://tiki.vn/ao-kieu-cho-nu-sexy-tay-phong-ngan-xe-co-chu-u-tre-vai-phong-cach-han-quoc-dang-yeu-p143185240.html?spid=143185370,,29.0,aonu,6274092.0
399,"Áo croptop ngắn tay cổ tròn vạt lệch, áo crt nữ ôm body đẹp thun gân 100% cotton màu đen trắng dưới 50 cân",60500,https://tiki.vn/ao-croptop-ngan-tay-co-tron-vat-lech-ao-crt-nu-om-body-dep-thun-gan-100-cotton-mau-den-trang-duoi-50-can-p178509164.html?spid=178509189,,7.0,aonu,423500.0
400,Áo polo nữ màu nâu phối viền chìm ADINO vải cotton polyester mềm dáng slimfit công sở hơi ôm trẻ trung APN03,159000,https://tiki.vn/ao-polo-nu-mau-nau-phoi-vien-chim-adino-vai-cotton-polyester-mem-dang-slimfit-cong-so-hoi-om-tre-trung-apn03-p213935328.html?spid=213935338,,2.0,aonu,318000.0
401,"Áo kiểu nữ tay bồng cổ V nẹp ren xinh xăn, thời trang phong cách trẻ",138600,https://tiki.vn/ao-kieu-nu-tay-bong-co-v-nep-ren-xinh-xan-thoi-trang-phong-cach-tre-p75408213.html?spid=75408223,,5.0,aonu,693000.0
402,"Áo thun phản quang bướm tay lỡ form rộng ( Đen, Trắng )",69000,https://tiki.vn/ao-thun-phan-quang-buom-tay-lo-form-rong-den-trang-p82743249.html?spid=82743396,,5.0,aonu,345000.0
403,áo nữ - đũi xước tơ cổ tàu cho người đến dưới 80kg (A25),139000,https://tiki.vn/ao-nu-dui-xuoc-to-co-tau-cho-nguoi-den-duoi-80kg-a25-p126040429.html?spid=126041646,,32.0,aonu,4448000.0
404,Áo ba lỗ nữ thun gân dáng basic CT528,125000,https://tiki.vn/ao-ba-lo-nu-thun-gan-dang-basic-ct528-p217525282.html?spid=217525290,,5.0,aonu,625000.0
405,áo kiểu nữ áo kiểu nữ dáng babydoll,159000,https://tiki.vn/ao-kieu-nu-ao-kieu-nu-dang-babydoll-p119221504.html?spid=119221525,-40%,4.0,aonu,636000.0
406,Sơ mi nữ ngắn tay cổ trụ chui đầu 33,149000,https://tiki.vn/so-mi-nu-ngan-tay-co-tru-chui-dau-33-p35420037.html?spid=58329499,,85.0,aonu,12665000.0
407,Áo Giữ Nhiệt Nữ Cổ Thấp LAROMA | Giữ Ấm - Siêu Co Dãn - Vải Thơm - Kháng Khuẩn,259000,https://tiki.vn/ao-giu-nhiet-nu-laroma-co-tron-2-giu-am-khu-mui-co-dan-p139060303.html?spid=273060781,-16%,1.0,aonu,259000.0
408,Áo Nữ Kiểu Voan Cổ Tròn Tay Loe,139000,https://tiki.vn/ao-nu-kieu-voan-co-tron-tay-loe-p37944835.html?spid=37944837,-12%,45.0,aonu,6255000.0
409,Áo kiểu nữ dáng suông phối nút bọc thời trang Eden - ASM155,279000,https://tiki.vn/ao-kieu-nu-dang-suong-phoi-nut-boc-thoi-trang-eden-asm155-p95200387.html?spid=99037928,-6%,16.0,aonu,4464000.0
410,Áo polo nữ ADINO màu xanh đen phối viền xẻ lai vải cotton co giãn dáng slimfit trẻ trung APN02,139000,https://tiki.vn/ao-polo-nu-adino-mau-xanh-den-phoi-vien-xe-lai-vai-cotton-co-gian-dang-slimfit-tre-trung-apn02-p146230660.html?spid=146230668,-28%,97.0,aonu,13483000.0
411,Áo phông nam nữ form rộng 2N Unisex thun cotton in hình gấu Panda thêu lông màu trắng/xanh,119000,https://tiki.vn/ao-phong-nam-nu-form-rong-2n-unisex-thun-cotton-in-hinh-gau-panda-theu-long-mau-trang-xanh-p271419705.html?spid=271419707,-16%,1.0,aonu,119000.0
412,Áo Kiểu Nữ Phối Ren,300000,https://tiki.vn/ao-kieu-nu-phoi-ren-p15778466.html?spid=15778530,,7.0,aonu,2100000.0
413,"Áo croptop tay ngắn nữ ôm body Madela cổ tròn, chất liệu cotton mềm mịn thoải mái , kiểu dáng basic trẻ trung, năng động - ACTN03",59000,https://tiki.vn/ao-croptop-tay-ngan-nu-om-body-madela-croptop-nu-tron-ngan-tay-co-tron-dang-om-co-tron-actn03-p174622128.html?spid=174622201,,14.0,aonu,826000.0
414,Áo thun dệt kim nữ tay ngắn kiểu kẻ sọc ngũ sắc sinh động thiết kế Quảng Châu cao cấp,112000,https://tiki.vn/ao-thun-det-kim-nu-tay-ngan-kieu-ke-soc-ngu-sac-sinh-dong-thiet-ke-quang-chau-cao-cap-p191506467.html?spid=191506471,,9.0,aonu,1008000.0
415,Áo Sơ Mi Nữ Trắng,127400,https://tiki.vn/ao-so-mi-nu-trang-p15778396.html?spid=59377217,,35.0,aonu,4459000.0
416,Áo Sơ Mi Nữ Công Sở Căn Bản - trắng - NG001,115000,https://tiki.vn/ao-so-mi-nu-cong-so-can-ban-trang-ng001-p41622540.html?spid=41622542,,6.0,aonu,690000.0
417,ÁO VOAN TRỄ VAI NƠ TO ÁO TRỄ VAI,57000,https://tiki.vn/ao-voan-tre-vai-no-to-ao-tre-vai-p148701217.html?spid=148701218,,17.0,aonu,969000.0
418,Áo nữ phối ren hoa vai và cánh tay Haint Boutique sm107,131000,https://tiki.vn/ao-nu-phoi-ren-hoa-vai-va-canh-tay-haint-boutique-sm107-p14517336.html?spid=14517344,,390.0,aonu,51090000.0
419,"Áo cổ nữ cổ V sang chảnh - nhiều size và màu, form dáng chuẩn thích hợp mặc đi làm, dự tiệc",148000,https://tiki.vn/ao-co-nu-co-v-sang-chanh-nhieu-size-va-mau-form-dang-chuan-thich-hop-mac-di-lam-du-tiec-p94902348.html?spid=91512272,,14.0,aonu,2072000.0
420,"Áo Thun Nữ Cổ Tim Tay ngắn , Trẻ Trung, Mẫu Mới nhất",74260,https://tiki.vn/ao-thun-nu-co-tim-tay-ngan-tre-trung-mau-moi-nhat-p138753770.html?spid=138757597,,22.0,aonu,1633720.0
421,"Áo trễ vai, áo hở vai nữ đẹp bèo tay phồng rộng dễ thương, mặc đi chơi, siêu hot trend, aloha - Đen",57000,https://tiki.vn/ao-tre-vai-ao-ho-vai-nu-dep-beo-tay-phong-rong-de-thuong-mac-di-choi-sieu-hot-trend-aloha-p192182771.html?spid=192182775,,1.0,aonu,57000.0
422,(HÀNG SẴN) Áo Sơ Mi Voan Che Bụng Giảm Tuổi Trẻ Trung SM69 - Hàng Quảng Châu Cao Cấp,245000,https://tiki.vn/hang-san-ao-so-mi-voan-che-bung-giam-tuoi-tre-trung-sm69-hang-quang-chau-cao-cap-p253102850.html?spid=253102852,,1.0,aonu,245000.0
423,Áo Thun Nữ Sát Nách Cách Điệu 1 Bên Dây Bản To Dễ Thương Vải Cotton 65/35 Co Giãn Tốt Sally Boutique-3L03,90200,https://tiki.vn/ao-thun-nu-sat-nach-cach-dieu-1-ben-day-ban-to-de-thuong-vai-cotton-65-35-co-gian-tot-sally-boutique-3l03-p252603395.html?spid=252603397,,3.0,aonu,270600.0
424,"Áo dệt kim nữ thời trang vạt chéo ,tay bồng giả sơ mi kiểu Hàn Quốc chất đẹp, form to cho bạn gái từ 45-70kg",160000,https://tiki.vn/ao-det-kim-nu-thoi-trang-vat-cheo-tay-bong-gia-so-mi-kieu-han-quoc-chat-dep-form-to-cho-ban-gai-tu-45-70kg-p208658034.html?spid=208658040,,4.0,aonu,640000.0
425,áo sơ mi caro tay ngắn nữ,59000,https://tiki.vn/ao-so-mi-caro-tay-ngan-nu-p170876622.html?spid=170876623,,10.0,aonu,590000.0
426,Áo sơ mi caro phối năng động – MS0059A,175000,https://tiki.vn/ao-so-mi-caro-phoi-nang-dong-ms0059a-p14436071.html?spid=14436073,,21.0,aonu,3675000.0
427,Áo Thun Ngắn Tay Cổ Tròn Nữ Giordano 05322246,229000,https://tiki.vn/ao-thun-ngan-tay-co-tron-nu-giordano-05322246-p217473799.html?spid=217473809,,5.0,aonu,1145000.0
428,Áo Kiểu Nữ Cổ V Bèo Thân Tà Peplum Chất Tuytsi Hàn Mềm Mịn 53ANS8002PT,309000,https://tiki.vn/ao-kieu-nu-co-v-beo-than-ta-peplum-chat-tuytsi-han-mem-min-53ans8002pt-p229715982.html?spid=229715992,,82.0,aonu,25338000.0
429,Áo Croptop Nữ UNI Tay Ngắn Form Rộng Ulzzang (ẢNH THẬT),69000,https://tiki.vn/ao-croptop-nu-uni-tay-ngan-form-rong-ulzzang-anh-that-p85011303.html?spid=109533191,,163.0,aonu,11247000.0
430,Áo sơ mi nữ kẻ caro dáng ngắn cộc tay cổ viền bèo,89000,https://tiki.vn/ao-so-mi-nu-ke-caro-dang-ngan-coc-tay-co-vien-beo-p111695241.html?spid=111695247,-18%,51.0,aonu,4539000.0
431,ÁO TRỄ VAI THUN GÂN TAY DÀI - Đen,59000,https://tiki.vn/ao-tre-vai-thun-gan-tay-dai-p170881326.html?spid=170881328,-55%,4.0,aonu,236000.0
432,"Áo kiểu nữ form rộng fullsize M đến 2XL, áo đũi nữ thêu hoa họa tiết dễ mix đồ Haint Boutique ALe17",131000,https://tiki.vn/ao-kieu-nu-form-rong-fullsize-m-den-2xl-ao-dui-nu-theu-hoa-hoa-tiet-de-mix-do-haint-boutique-ale17-p160897585.html?spid=160897605,-13%,23.0,aonu,3013000.0
433,Áo Kiểu Phối Màu Bella,115000,https://tiki.vn/ao-kieu-phoi-mau-bella-p14841783.html?spid=14841795,,5.0,aonu,575000.0
434,Áo croptop nữ xoắn ngực siêu đẹp,84000,https://tiki.vn/ao-croptop-nu-xoan-nguc-sieu-dep-p67862731.html?spid=92224705,,95.0,aonu,7980000.0
435,"Áo sơ mi nữ trắng tay dài, đồng phục học sinh, đồng phục công sở, size từ 40-80kg, chất liệu KT Silk mềm mại",114000,https://tiki.vn/ao-so-mi-nu-trang-tay-dai-dong-phuc-hoc-sinh-dong-phuc-cong-so-size-tu-40-80kg-chat-lieu-kt-silk-mem-mai-p147896804.html?spid=147896808,,6.0,aonu,684000.0
436,Áo 2 dây cổ V thon chất len lụa dệt kim tuyến mùa hè thoải mái HD01 Free size,87000,https://tiki.vn/ao-2-day-co-v-thon-chat-len-lua-det-kim-tuyen-mua-he-thoai-mai-hd01-free-size-p15319361.html?spid=27834024,,17.0,aonu,1479000.0
437,Áo Thun DirtyCoins x One Piece Ace T-shirt - Cream,390000,https://tiki.vn/ao-thun-dirtycoins-x-one-piece-ace-t-shirt-cream-p262910011.html?spid=262910021,,1.0,aonu,390000.0
438,Áo Vol Nữ Sọc Tay Loe MS0109A,150000,https://tiki.vn/ao-vol-nu-soc-tay-loe-ms0109a-p7595750.html?spid=7595758,,35.0,aonu,5250000.0
439,Áo sơ mi công sở nữ đẹp kiểu Hàn Quốc form rộng tay dài chất lụa cao cấp,235000,https://tiki.vn/ao-so-mi-cong-so-nu-dep-kieu-han-quoc-form-rong-tay-dai-chat-lua-cao-cap-p155308604.html?spid=155308610,,4.0,aonu,940000.0
440,Áo sơ mi nữ form rộng tay bồng,129000,https://tiki.vn/ao-so-mi-nu-form-rong-tay-bong-p35229590.html?spid=57031373,,32.0,aonu,4128000.0
441,GIGI - Áo sơ mi nữ tay ngắn phom suông phối túi hiện đại G1108T212264,290000,https://tiki.vn/gigi-ao-so-mi-nu-tay-ngan-phom-suong-phoi-tui-hien-dai-g1108t212264-63-p192358089.html?spid=192358102,-81%,1.0,aonu,290000.0
442,"Áo thun tay lỡ form rộng unisex, phông nam nữ oversize Einsicht 2N Unisex",49000,https://tiki.vn/ao-thun-tay-lo-form-rong-unisex-phong-nam-nu-oversize-einsicht-2n-unisex-p217176677.html?spid=217176689,-38%,10.0,aonu,490000.0
443,"Áo kiểu nữ tay buộc nơ cổ V xinh xắn - mặc đi làm, đi tiệc (2 màu) form dáng chuẩn - M",185000,https://tiki.vn/ao-kieu-nu-tay-buoc-no-co-v-xinh-xan-mac-di-lam-di-tiec-2-mau-form-dang-chuan-p109089209.html?spid=109089213,,6.0,aonu,1110000.0
444,Áo hai dây COTTON mặc trong áo Vest,50000,https://tiki.vn/ao-hai-day-cotton-mac-trong-ao-vest-p75661432.html?spid=89745374,,3.0,aonu,150000.0
445,"áo sơ mi nữ nam form rộng tay dài trắng 1 túi basic kiểu hàn, áo sơ mi unisex năng động trẻ trung",69000,https://tiki.vn/ao-so-mi-nu-nam-form-rong-tay-dai-trang-1-tui-basic-kieu-han-ao-so-mi-unisex-nang-dong-tre-trung-p242620496.html?spid=242620498,,1.0,aonu,69000.0
446,"Áo thun Nam Nữ Không cổ VOI VỚI THỎ CIMT-0024 mẫu mới cực đẹp, có size bé cho trẻ em / áo thun Anime Manga Unisex Nam Nữ, áo phông thiết kế cổ tròn basic cộc tay thoáng mát",50000,https://tiki.vn/ao-thun-nam-nu-khong-co-voi-voi-tho-cimt-0024-mau-moi-cuc-dep-co-size-be-cho-tre-em-ao-thun-anime-manga-unisex-nam-nu-ao-phong-thiet-ke-co-tron-basic-coc-tay-thoang-mat-p112707558.html?spid=112708631,-37%,14.0,aonu,700000.0
447,Áo Kiểu Nữ Phối Ren Hở Vai Tay Loe NT6278N1,165000,https://tiki.vn/ao-kieu-nu-phoi-ren-ho-vai-tay-loe-nt6278n1-p13582490.html?spid=56688789,,2.0,aonu,330000.0
448,Set áo len lưới cổ tim kèm áo yếm hàng QC mùa thu đông 2022,155000,https://tiki.vn/set-ao-len-luoi-co-tim-kem-ao-yem-hang-qc-mua-thu-dong-2022-p201802760.html?spid=201802766,,2.0,aonu,310000.0
449,Áo Thun Có Cổ Andromeda Cá Sấu 4 Chiều Màu Xanh Đen Nam Nữ,89000,https://tiki.vn/ao-thun-co-co-andromeda-ca-sau-4-chieu-mau-xanh-den-nam-nu-p184826684.html?spid=184826712,,4.0,aonu,356000.0
450,Áo thun tết gia đình màu đỏ đồng phục gia đình 3/4/5 người nổi bật thun cotton mềm mịn SGY156D,49000,https://tiki.vn/ao-thun-tet-xuan-mau-do-thun-cotton-day-dan-unisex-du-size-sgy156d-sgstore1-p132139806.html?spid=132140183,,1.0,aonu,49000.0
451,Áo Thun Andromeda Nam Nữ Phom Rộng Nhiều Màu Ngắn Tay Cổ Tròn,49000,https://tiki.vn/ao-thun-andromeda-nam-nu-phom-rong-nhieu-mau-ngan-tay-co-tron-p184823350.html?spid=184823465,,5.0,aonu,245000.0
452,áo croptop dệt kim len nữ tay ngắn cổ vuông phối màu thiết kế Quảng Châu trẻ trung phong cách,125000,https://tiki.vn/ao-croptop-det-kim-len-nu-tay-ngan-co-vuong-phoi-mau-thiet-ke-quang-chau-tre-trung-phong-cach-p189750154.html?spid=189750156,,3.0,aonu,375000.0
453,"Áo len nữ cổ tròn dài tay, áo len cardigan nữ chất len mềm mịn co giãn thời trang Hàn Quốc mặc mùa thu đông mã VAA0260",139000,https://tiki.vn/ao-len-nu-co-tron-dai-tay-ao-len-cardigan-nu-chat-len-mem-min-co-gian-thoi-trang-han-quoc-mac-mua-thu-dong-ma-vaa0260-p155792292.html?spid=273958013,,41.0,aonu,5699000.0
454,Áo thun tay lỡ form rộng - phông nam nữ cotton oversize - T shirt chữ unoffcall - 2N Unisex,79000,https://tiki.vn/ao-thun-tay-lo-form-rong-phong-nam-nu-cotton-oversize-t-shirt-chu-unoffcall-2n-unisex-p217176739.html?spid=217176743,,20.0,aonu,1580000.0
455,Áo thun tăm ba lỗ UNI.QLO Quảng Châu cho nữ ATN877,19000,https://tiki.vn/ao-thun-tam-ba-lo-uni-qlo-quang-chau-cho-nu-atn877-p270854151.html?spid=271726336,,12.0,aonu,228000.0
456,Áo ba lỗ croptop Ulzzang Quảng Châu ATB18,35000,https://tiki.vn/ao-ba-lo-croptop-ulzzang-quang-chau-atb18-p73390971.html?spid=95002653,,549.0,aonu,19215000.0
457,Áo thun cờ Việt Nam Áo Cờ Đỏ Sao Vàng Chất ĐẸP,30000,https://tiki.vn/ao-thun-co-viet-nam-ao-co-do-sao-vang-chat-dep-p70283690.html?spid=70283724,,247.0,aonu,7410000.0
458,"Áo Thun Nữ Cổ Tim Tay ngắn , Trẻ Trung, Mẫu Mới nhất",29000,https://tiki.vn/ao-thun-nu-co-tim-tay-ngan-tre-trung-mau-moi-nhat-p192216746.html?spid=271727488,,9.0,aonu,261000.0
459,"Áo phông, áo thun nam nữ form rộng tay lỡ Unisex BÉ GÁI CÔ ĐƠN Từ 50-70kg",49000,https://tiki.vn/ao-phong-ao-thun-nam-nu-form-rong-tay-lo-unisex-be-ga-i-co-do-n-tu-50-70kg-p95940103.html?spid=193639636,,512.0,aonu,25088000.0
460,Áo Thun Nữ Slepless Hàn Quốc,46400,https://tiki.vn/ao-thun-nu-slepless-han-quoc-p95010919.html?spid=95010929,,333.0,aonu,15451200.0
461,Áo thun nữ cổ tim trơn,29000,https://tiki.vn/ao-thun-nu-co-tim-tron-p82291729.html?spid=94483630,,109.0,aonu,3161000.0
462,Áo đũi nữ thêu họa tiết sao - trẻ trung năng động - cổ tàu thích hợp cả đi chơi và đi làm (SP18),188000,https://tiki.vn/ao-dui-nu-theu-hoa-tiet-sao-tre-trung-nang-dong-co-tau-thich-hop-ca-di-choi-va-di-lam-sp18-p179420435.html?spid=179420474,,42.0,aonu,7896000.0
463,"Áo kiểu nữ, áo phông in họa tiết hoa thời trang Haint Boutique,kín đáo,điệu đà,4 màu thanh nhã ALe18",131000,https://tiki.vn/ao-kieu-nu-ao-phong-in-hoa-tiet-hoa-thoi-trang-haint-boutique-kin-dao-dieu-da-4-mau-thanh-nha-ale18-p160545090.html?spid=160545104,,9.0,aonu,1179000.0
464,"Áo ba lỗ croptop nữ cổ bẻ khoét, dáng ôm nhẹ co dãn thoáng mát, áo sát nách dệt kim hot 2022",69000,https://tiki.vn/ao-ba-lo-croptop-nu-co-be-khoet-dang-om-nhe-co-dan-thoang-mat-ao-sat-nach-det-kim-hot-2022-p201672925.html?spid=201672933,,5.0,aonu,345000.0
465,"<BST Mới> Áo thun giữ nhiệt nữ dài tay cổ tròn Vicci vải Premium Cotton cao cấp co giãn, mềm mịn ôm dáng nhiều màu",119000,https://tiki.vn/bst-moi-ao-thun-giu-nhiet-nu-dai-tay-co-tron-vicci-vai-premium-cotton-cao-cap-co-gian-mem-min-om-dang-nhieu-mau-p198795306.html?spid=198795330,,8.0,aonu,952000.0
466,"Áo thun nữ cổ tim tay dài vải cotton đẹp, dễ mặc dễ phối đồ, mặc bốn mùa",49000,https://tiki.vn/ao-thun-nu-co-tim-tay-dai-vai-cotton-dep-de-mac-de-phoi-do-mac-bon-mua-p192216666.html?spid=271476035,,9.0,aonu,441000.0
467,Áo thun tay dài nữ form rộng - phông dài tay oversize thêu chữ xẻ tà - 2N Unisex,99000,https://tiki.vn/ao-thun-tay-dai-nu-form-rong-phong-dai-tay-oversize-theu-chu-xe-ta-2n-unisex-p249694129.html?spid=249694133,,6.0,aonu,594000.0
468,"Bộ Quần Áo Blouse CỘC TAY, Dáng Dài Ngang Mông NAM NỮ Cho Điều Dưỡng, Y tá ,Dược Sĩ, Vải Lon Nhật Và Thô Cotton (Giá Sỉ)",99000,https://tiki.vn/bo-quan-ao-blouse-coc-tay-dang-dai-ngang-mong-nam-nu-cho-dieu-duong-y-ta-duoc-si-vai-lon-nhat-va-tho-cotton-gia-si-p196184595.html?spid=196185525,,13.0,aonu,1287000.0
469,Áo Thun Nữ Phối Ren Thời Trang MS0084A,170000,https://tiki.vn/ao-thun-nu-phoi-ren-thoi-trang-ms0084a-p7595959.html?spid=7595961,-54%,116.0,aonu,19720000.0
470,"Áo phông ngắn tay, áo thun nữ cộc tay Vicci AP.01.4 chất liệu cotton vân gỗ in chữ Bee Kind",78000,https://tiki.vn/ao-phong-ngan-tay-ao-thun-nu-coc-tay-vicci-ap-01-4-chat-lieu-cotton-van-go-in-chu-bee-kind-p91456942.html?spid=91456980,-55%,23.0,aonu,1794000.0
471,Áo sơ mi nữ dài tay form rộng rút eo chất vải kate mềm mát ArcticHunter,220000,https://tiki.vn/ao-so-mi-nu-dai-tay-form-rong-rut-eo-chat-vai-kate-mem-mat-arctichunter-p197084448.html?spid=197084456,-16%,2.0,aonu,440000.0
472,"Áo sơ mi nữ công sở thời trang SURI vải lụa thời trang cao cấp,cổ tròn nhún tay phồng rất thanh lịch",95550,https://tiki.vn/ao-so-mi-nu-cong-so-thoi-trang-suri-vai-lua-thoi-trang-cao-cap-co-tron-nhun-tay-phong-rat-thanh-lich-p144629269.html?spid=144629279,,2.0,aonu,191100.0
473,Áo sơ mi nữ công sở thời trang SURI vải tơ Ý màu xanh tiểu thư cổ cánh sen xếp ly tay ngắn-XANHCOBAN,103950,https://tiki.vn/ao-so-mi-nu-cong-so-thoi-trang-suri-vai-to-y-mau-xanh-tieu-thu-co-canh-sen-xep-ly-tay-ngan-xanhcoban-p144629584.html?spid=144629601,,3.0,aonu,311850.0
474,Áo len lưới nữ tay dài dáng rộng khoác dệt kim kiểu cổ V đi biển thời trang hàng đẹp thiết kế Quảng Châu cao cấp,115000,https://tiki.vn/ao-len-luoi-nu-tay-dai-dang-rong-khoac-det-kim-kieu-co-v-di-bien-thoi-trang-hang-dep-thiet-ke-quang-chau-cao-cap-p193055701.html?spid=193055703,,3.0,aonu,345000.0
475,"Áo sơ mi nữ cổ trụ linen tay lỡ trẻ trung, chất liện linen mềm mát, thời trang phong cách trẻ",219000,https://tiki.vn/ao-so-mi-nu-co-tru-linen-tay-lo-tre-trung-lahstore-chat-lien-linen-mem-mat-thoi-trang-phong-cach-tre-p76454379.html?spid=108643800,,57.0,aonu,12483000.0
476,Áo Thun Nữ Hình TRIHAL | Chất Liệu Cotton 65/35 | Phong Cách Hàn Quốc,35000,https://tiki.vn/ao-thun-nu-hinh-trihal-chat-lieu-cotton-65-35-phong-cach-han-quoc-p21306397.html?spid=146385527,,7.0,aonu,245000.0
477,Áo thun tay lỡ form rộng - phông nam nữ cotton oversize - T shirt hồng pastel a - 2N Unisex,99000,https://tiki.vn/ao-thun-tay-lo-form-rong-phong-nam-nu-cotton-oversize-t-shirt-ho-ng-pastel-a-2n-unisex-p187659504.html?spid=187659505,,7.0,aonu,693000.0
478,áo kiểu nữ buộc nơ cổ duyên dáng,139000,https://tiki.vn/ao-kieu-nu-buoc-no-co-duyen-dang-p67488156.html?spid=67488158,,26.0,aonu,3614000.0
479,"Áo thun nữ cổ tim tay dài , áo thun trơn cotton đẹp, dễ mặc dễ phối đồ, mặc bốn mùa",39000,https://tiki.vn/ao-thun-nu-co-tim-tay-dai-ao-thun-tron-cotton-dep-de-mac-de-phoi-do-mac-bon-mua-p138755770.html?spid=271434080,,4.0,aonu,156000.0
480,Áo kiểu họa Tiết xinh xắn HATI - AK845611,168000,https://tiki.vn/ao-kieu-hoa-tiet-xinh-xan-hati-ak845611-p49034125.html?spid=49034129,,52.0,aonu,8736000.0
481,Áo thun tay lỡ form rộng unisex - phông nam nữ oversize - T shirt Share your talent,99000,https://tiki.vn/ao-thun-tay-lo-form-rong-unisex-phong-nam-nu-oversize-t-shirt-share-your-talent-p141835567.html?spid=141835619,,30.0,aonu,2970000.0
482,Áo Thun Tay Lỡ Unisex SADBOIZ màu ĐEN �/Nam nữ unisex ️ Jaystoree Kiểu áo phông cổ tròn form rộng,148000,https://tiki.vn/ao-thun-tay-lo-unisex-sadboiz-mau-den-nam-nu-unisex-jaystoree-kieu-ao-phong-co-tron-form-rong-p130866028.html?spid=182980935,,27.0,aonu,3996000.0
483,"Áo len nữ, áo len vải dày ấm áp nữ Al40",249000,https://tiki.vn/ao-len-nu-ao-len-vai-day-am-ap-nu-al40-p133888871.html?spid=133888882,,1.0,aonu,249000.0
484,Áo Thun Trơn Nam Nữ vải dày không xù lông nhiều màu,39000,https://tiki.vn/ao-thun-tron-nam-nu-vai-day-khong-xu-long-nhieu-mau-p82749646.html?spid=82750886,,44.0,aonu,1716000.0
485,"Áo sơ mi nữ lụa công sở thời trang SURI cổ bèo chạy dọc theo 2 bên đường tà,tay ngắn thật trẻ trung",93450,https://tiki.vn/ao-so-mi-nu-lua-cong-so-thoi-trang-suri-co-beo-chay-doc-theo-2-ben-duong-ta-tay-ngan-that-tre-trung-p144629406.html?spid=144629425,,8.0,aonu,747600.0
486,Áo ren thêu hoa ngắn tay,170000,https://tiki.vn/ao-ren-theu-hoa-ngan-tay-p144045708.html?spid=144045726,-28%,2.0,aonu,340000.0
487,"Áo kiểu nữ Hàn Quốc dáng cánh dơi Thu Hà chất liệu đũi mềm mát, form rộng bigsize che khuyết điểm AKH.45",159000,https://tiki.vn/ao-kieu-nu-han-quoc-dang-canh-doi-thu-ha-chat-lieu-dui-mem-mat-form-rong-bigsize-che-khuyet-diem-akh-45-p181689820.html?spid=181689882,-46%,2.0,aonu,318000.0
488,"Áo kiểu nữ cổ tầu chất thô đũi form rộng, thời trang trẻ, phong cách Nhật Bản",159000,https://tiki.vn/ao-kieu-nu-co-tau-chat-tho-dui-form-rong-thoi-trang-tre-phong-cach-nhat-ban-p78959210.html?spid=78959212,-12%,42.0,aonu,6678000.0
489,"Áo Ngực Không Gọng Chất Liệu Cotton Cao Cấp, Áo Bra Cổ Yếm Kèm Mút Ngực Mẫu Mới Siêu Đẹp Thương Hiệu Baw Mã ANM15",142000,https://tiki.vn/ao-nguc-khong-gong-chat-lieu-cotton-cao-cap-ao-bra-co-yem-kem-mut-nguc-mau-moi-sieu-dep-thuong-hieu-baw-ma-anm15-p187659507.html?spid=187659511,-14%,8.0,aonu,1136000.0
490,(HÀNG SẴN) Áo Sơ Mi Nữ Cotton Thêu Tay Họa Tiết SM150 - Hàng Quảng Châu Cao Cấp,245000,https://tiki.vn/hang-san-ao-so-mi-nu-cotton-theu-tay-hoa-tiet-sm150-hang-quang-chau-cao-cap-p167543332.html?spid=167543349,-50%,17.0,aonu,4165000.0
491,Áo Sơ Mi Nữ Trơn Dài Tay Giordano 05343004,784000,https://tiki.vn/ao-so-mi-nu-tron-dai-tay-giordano-05343004-p219147139.html?spid=219147149,-46%,1.0,aonu,784000.0
492,"áo trễ vai tay dài, áo bánh bèo trễ vai nơ hở lưng điệu đà",62000,https://tiki.vn/ao-tre-vai-tay-dai-ao-banh-beo-tre-vai-no-ho-lung-dieu-da-p152567356.html?spid=152567360,,37.0,aonu,2294000.0
