,title,price,link_item,discount,sales,category,revenue
0,"I love you, mã G98. Hãy tỏa sáng như kim cương, qua chiếc áo thun Goking siêu hot cho nam nữ trẻ em, áo phông cặp đôi, gia đình, đội nhóm",119000,https://tka.tiki.vn/pixel/pixel?data=AlfD2ri5-mKfgIBpVfrhJeTLWl4OjTBC2JcS1AucVL-kndfwRrLR9HkzQKp-Q-hMfjDFoqZG5Gok2J2Iuj0PYUBh5J4kTuh3uGvjxutbzRCv57ANcx3S9lmOef7FKXNaxY0Uz2YbFr_3uFwCWuCZTWDNn4fXDfUfFae8aGYG8C1577b8fSUTVkjAVTwnCo1tlI-MvmwcO1hnb7F6TfZ6s0b3jGV4FOGY9SiYTp2nfq5vmRAcvCvbjoH-QNHFSdDq59a9jAsgXmtZynsHPyIrpIEO1niQoRrGqrsgBclF3Yww0MtH_LxX4PnI1S9pusuI7hBNME9-Egbj7uNe4MoBweFf_Ja923gEgmSIlmQXbWXkCXRFhddJGZGtj0ufSEcqfgQIjswoEom4xlwmdN1WlkNUZ0If4WNw68KYRdjmFse8iGPgPnmVtvJp5xSOOK0Fs9opc9Dk-jYZCgbr7CamLIrhyCRsE6nfC7DbD4GgQ6GvbWooP7MBhJDMB2cJ1BhDdrBVUAZ9lkZq5bbbvRUr5pSb3wnCPGWLuOZVAzTj5j2mo6AZkYcU3TAJ0TWFBuNEADznnHBumZK7IDNTUCc4iRzNe-y6J9Cl29agZl89yOmwI1nveBNkJ0oamKFEmm4g28CPFj8LUhVYxYVWutbySJcPlaNKsGgiXKLs5Zr4IkBJIX1ZqLjHxPpCTmIYdgOkH6_feDlR_mk0nfUQsGetiK5rRoOIFCCk0_0ooHEy1XPmnt0VOoEBlWkBeAev4IbWjUYMjWtwZCt1Uzcba1CXSC4ropyUxlhxYjDizIMjXWk6pPazCehun_rUuiN9UxhMQeJgZ9qaRAwwIrsPnraRdB6JhsdN0Pm2mCRrRUzH5ziIxEruv2W907bVbVrgckI5wgtF1htgXTSER1J-4spsNwmE_7gtZg7LgspcWbw-QOMyoseky_hJW-PqCD-dBkmknPo-saVrHPqoBLoE51vfhjQCJwoC5l5mzIvHkIAoYAfcCSUoYK_MYiN6Tpuqwrn6rKxxg-5ouzxfWIQVUmL41EVuJbOWMt337Unpi536RhVgBJTSolckWf1YbH0YXcLHOVMyjdY8rUKenbeXjdOL1uOJM0X3xwVRfRjUOeYNcxuQQTRyWSO_Fv6loegVvtppSnPbXJy4BrzsnDNIH0Knse-K1C1joGq-pFD_zP1vc9Axn37ppVM&reqid=YJRsZ4raK1QeU29F&type=CLICK&pos=1,,35.0,aonu,4165000.0
1,"Chim cú nghệ thuật, mã G24. Hãy tỏa sáng như kim cương, qua chiếc áo thun Goking siêu hot cho nam nữ trẻ em, áo phông cặp đôi, gia đình, đội nhóm",69000,https://tka.tiki.vn/pixel/pixel?data=urVAt8VRpADnDdSHyZSatm1hzNrB9upcmhIUFj9EP9JsdR5RQLwSWuCyaJA7L-VcZ2hM7fnPXj6JPGqXiYhafEiBj-9hvMCbEZBs374-oydgmAwLTp_rWSGn0lrh5SxdgF3vwrAWIJDHuelRUFNl_xnSsVphINd_1qhFbNAW0Udno5zgnXgfq7Ugu3j8Uca9r-K_YlJwJ4XnFj10VitbP5vOGBLfd8lKy3Pkq4yiiTcN3kZuMtdKwXoo59xwjp9a7nVX7pwMyGbaaTU-CeQRimJ3X4AbYbDi4QAcOX3qT_mhie3vz98QHA096dI-W9UjHolmGCbryMDV0sxfw963ISzxfR1bFsEKn76G31Vy4vBhGjoXsBbWvAyYAtvGdqo7mHcV7CGQv_-1NXD9nGIpwfZwhZQvxIpKsfzxm28NAfGRlukNcMos0NR17HdAnpl5ikhk57wGWVDU1tT72y9Y03g6VOk0ZrPN-KLZXNE7Mm-AfuMXHW2P5VkfMAJUmfywENfLD7dXLClcr3t5xF7Hk6wOxJkzNibebPYB6Scr56s6VyxigLS1zTjwo3BXX7tsrsDCVHp8FERerXgSfPKGTi_Tv4jqIqVLEBumE9uxfBfqUZnONfvomLqpg-lA-wZVUDqDVuRa-UXz21R7XeldaXjwt-3M5jtT8chuE2FTNclBflrWwWP75Cc6KtoK8qD30fTnEvhUqh-4Ko0XRnsY5DvdngT9afHJoW639ktqp_RrIp28o4_JOgNZLaO6GucmmNvzGydvcn9lvPFr4mvRGwuDQqxcFLGS1fFCTp9XMWJ17WDUoRyXpJG03hZJAHfGX6sTmhbKprRDQg6kk8Y4XTSebyqKXswKVcetUvve3yXYuHzG8Ny6Hb49EksQF3vJFH_FOKgwNzFIsD2h9YKeX7JEDaNIVK65wGmhCj7pN8G2Z7uR1M-feyDB8qhw0XWRZkPcp61Xs4Ma_AdAMlmIDeKivALa2n_0nob2DaXAdh2xSwKLoOiUkQGPM46T4M_eeXpBopsbMTARiPR2FaKLR5D3uBHQuieOF_hha2-TxM4S-x3YscDBziMIcYSqWoVzGyLnSS6RYr-c4Sz1itEMiYbRjm5E8MvSsxk6UQoMV5TEhrw1beJ-1Pnx_-hBTBefpNbzzJh6LP2h0cQxMzF3giaPRtPCRb_QOfwmWrIkn18doRiircCai72bwHwx0_cDlnuFLHoDAkYxYCxmaBSHRD_MZC0jW08fEmVum46wnc2Ee4dIw7kSPO9D_pXP-K-ri_zDSK-cuxoIiCRpRzi1VqL8Ardz56MRJ-j-1-P7WKrLi00OTca5BBhVU0ufHLo3eg&reqid=YJRsZ4raK1QeU29F&type=CLICK&pos=2,-37%,5.0,aonu,345000.0
2,Áo len nữ cổ tròn ngắn tay hiện đại trẻ trung len dệt kim mềm mịn co giãn dán mã VAA0316,139000,https://tiki.vn/ao-len-nu-co-tron-ngan-tay-hien-dai-tre-trung-len-det-kim-mem-min-co-gian-dan-ma-vaa0316-p196378693.html?spid=196378726,,60.0,aonu,8340000.0
3,Áo len nữ cao cổ dài tay len dệt kim Quảng Châu mềm mịn co giãn mã VAA0348,159000,https://tiki.vn/ao-len-nu-cao-co-dai-tay-len-det-kim-quang-chau-mem-min-co-gian-ma-vaa0348-p204985388.html?spid=204985408,-31%,24.0,aonu,3816000.0
4,Áo thun nữ MXM cổ tròn form ôm body thun 4 chiều cực tôn dáng thêu chữ ( ANU012 ),87000,https://tiki.vn/ao-thun-nu-co-tron-form-om-body-thun-4-chieu-cuc-ton-dang-theu-chu-anu0012-p273249491.html?spid=55099670,-37%,176.0,aonu,15312000.0
5,"Áo giữ nhiệt nữ, áo thun dài tay thu đông cho nữ cổ cao màu đen ấm áp",35000,https://tiki.vn/ao-giu-nhiet-nu-ao-thun-dai-tay-thu-dong-cho-nu-co-cao-mau-den-am-ap-p130452530.html?spid=130452536,,226.0,aonu,7910000.0
6,Áo thun tay lỡ form rộng - phông nam nữ cotton oversize - T shirt gatin - 2N Unisex,79000,https://tiki.vn/ao-thun-tay-lo-form-rong-phong-nam-nu-cotton-oversize-t-shirt-gatin-2n-unisex-p217176740.html?spid=217176745,,81.0,aonu,6399000.0
7,"Life is a journey, mã G83. Hãy tỏa sáng như kim cương, qua chiếc áo thun Goking siêu hot cho nam nữ trẻ em, áo phông cặp đôi, gia đình, đội nhóm",69000,https://tiki.vn/life-is-a-journey-ma-g83-ao-thun-nu-nam-in-sieu-dep-ao-phong-thoat-nhiet-goking-hang-hieu-cao-cap-p164549480.html?spid=250964069,,20.0,aonu,1380000.0
8,"Đâu cũng được, miễn là đi cùng nhau, mã LV5. Hãy tỏa sáng như kim cương, qua chiếc áo thun Goking siêu hot cho nam nữ trẻ em, áo phông cặp đôi, gia đình, đội nhóm",129000,https://tka.tiki.vn/pixel/pixel?data=r90uXWsR22RJpCwlcrVdco96IVfeI02tJsKXY5_ZZ5WxYfWIYzWGzFlK3AmnW7xYY8SLnkO6EIWVqeY9lBgpPbT_cduuSJiG_bfO7RhS8Cvwvkq80p0pBvWQDSyrboSCVJRoWyAsVIXckssxwV1-RwLFxWOp8NWkGIsexSUBAVzTQhDxkAmWuYp--vevJbD9iscGewxjNQyLo8jh7bbz7krEr56SezfbhN6ACEoIZic_Gh4OKECt4kPVKe_bzdYzP-wtTBnZprPU2cC4yZ3J_LBVC04CRhmm0A8A3ejiyHFwu-toi3T2tzZbyiNlJLQC3qRQZ560kkgaF7ATFLp5B9kWEstIzmrSyHXL0NozoyrjJibe-F16d9PMBlrngVqEdSYUQbuanES4Q8t-ki5QKMJCU-toIf8tCpHmG8_2coUXgN60MX9FAfAABFkfFPj1gxylBX0PQ6OfXvwhqNCK0rX3gmxWWiFuyPdOCVQ-2Oo1LfNxFh5f2QjYTHsGqT52exs29qULMhh64NGj3_4QX-tdn3BFauQKn5gQAhCOCO3Hb-daJI6iq7OVqFi3ZP_GCxrKvtpSS0WX3OrkmlkIiWv-Va1FaS9c2j4QveFrwR6UPDSv0pO1nFuEBejOsPRMGdAU0-19sy-DUlP9bBXlVtendGhOXgcPHt_c_aIpEirvo2axQnt2JftvXRFN1mpF_LVFOTOSGKjaGYu_pS2RVgWucG9gzmSZ1OcwQk12SoTNwa066F67QkxYxBefcKmj1iyg3tsPUoJXc-HwEyXX9LP6guiD9cqd2Xp_cufAPO_EROUrnS1SLz_POn6n0jrkKNqLSqB7s_21ij-c76yE7b7N0iSEwZ0xeMFBrDqshjynPOQOTC_mKKWZqqBQPBT0qCHGZriskvLWG8o-dq2Ecn5n0xeXLVjqyIoUKfo82J2z-8vj-bnRvM-DDYUWphgvg_D8rFO6uO1q7wYWZ6eu5bTm1CYgoygOSwsLT9lB27oEtt2fzq8W11p2TehWIRsHQAYX1tUtdzykrOFgkMg87mjJNZx3-9NFMOnlBdwEtpLJZBm1ovGUj0hUKbgAd-5TncdF1HEymAcbnenWLxFHvQLo6ixo-mXVm5QPci6F0wj6Yy5LB3GFdDxIKij0xNHS0XuvMr5pDan0txNnijs1yzkkzf50jLwsNm4xyFNvWwuMgTaoYlcRRvn6pRWmttdPGtMITwiY_FrW2oXr_hjShsJLk4dRVlSigF13KRrxpnJZHsuLihHylDYCMCc7hC2Wi5xWDwCZGPu2ci4WMjCwqFgKPjLRmnGsZ_sDqLfO26EV9gS3vJixwmoN0dtVaiiqPN0fWPFdJLbmnmbwWNvFp6aN7f9Na4ZjUY9V_IpeLYXyjPg&reqid=YJRsZ4raK1QeU29F&type=CLICK&pos=22,,41.0,aonu,5289000.0
9,"This Girl Rules the World, mã G129. Hãy tỏa sáng như kim cương, qua chiếc áo thun Goking siêu hot cho nam nữ trẻ em, áo phông cặp đôi, gia đình, đội nhóm",188000,https://tka.tiki.vn/pixel/pixel?data=BoKB3NDptz2sxJ3Wa45lMtNX5D2tYewCU_N2W7jpCQrHXC0ldJsgkYdEH-ACuKHiOyvKzDCzLpadA-arhfz_KYJt7ybJw7bODP-Zg46DwgZZTCTDgR0h4qhQUAFv8BA5Gpw2AbSHFdr_3tv9cgJB3yODSxBuDW1Fm-empZbdxXS0S0kyIgpiNla1LBhb8YTONIsgj4iE1dC8aw8B5oJ_tzPZ-9Gd-ztIzKDCONwd0KkJJA_p5u0LrN3wzztyy2G0FRsyowFm0bGrh6R-QaSlIca7E16RgHQ_zc6vKATKeTQ3yanCaroqs60Hv400zJLRVBhPUUp8IWva9llrmLjgS_JzE_MGFg6z1OxculjqkeahNCu0y54-adcDtjWLsKkH7fsn4mDaDF5nQLDMakhnF8eXZHEoDEhTxpUDE7Rz2TDlIdZzyUv3nJrGIgrPI3399D87v0lgCmdqkaKcTUXJ3BpzQGnuWM3rdBIND455IQrQBkTgoUmP92AXICResIqYUifqE1yxZIlVO80Z8Wrxg5jpJCuRDijsg2ZT0fNzKmHchnDRhsulsHKzlfQl_4Hmm35q8kLkU61xut3D9-hrFECDFvZsaR2Qqc38x8o70nbrBLFEtbad7zUeaiP5DbhoxrCKy9cSfb_RylY--mV6GMc2sVPyMIhcU4Dqbh7xEEaTpwt5UGLm-oupygpO7TWAyJKjNHeofZCgdG3Z_ufm0E53gxsWddWQwFBFw2ZWQxSNiAGKcfq6LU-E2gLOfWh9HnrZXVIqDw2bkPjItK-wjotBWWhtF9epT7TSnGnIWARjPwWSbdnNGC3MkGFAQx4y1TZjSIaxWlMaebG45BkrLSYjeXgcfj4cK4Thmk4skV1dvlP4Kddz93i22H7WtcsROVcuHghVoaGOtzFUwrXPpXDT_fwthIMseipx_moRQJSy35cflxc6ag6NH3lQMVn2olJ1UO7WroZV_hzPj_I5PnKJrkrcUVPJl8uScCIWkiGtJ93lQFk-aFnyyr1kx4JMi75HW6ZVNq5UH-kMfbGY351SgUI6EsDiMLxwBO4lvHDjMsgZyLWuXENvXAUYD-a5VtSwawK5q_MhJHzGYguX_0B33ZrePz6BIsyF60bQfXIiaHITO-y9_xJGJgAVUkwax_Bv3XPH-wZI34E58HQ_EUDjyAMHDPSaR5jsG4uPnzi7-IdjOSTyjn9b0yU5eWUPav2gGgoOKE9UmQHMNctckOSbOpmBL6LQnQ98Oj9L-NLqyXR2W5HNZIyiSuBfMMMnEu_blp3XekFmOFLLqPK7IxVUzRusCEDQbCnae6s9AQjcA0mLQRxvJfpZFm2cVC1-huQHPI6YN-r6S2EKI5d_059PvWEGTN4&reqid=YJRsZ4raK1QeU29F&type=CLICK&pos=23,,7.0,aonu,1316000.0
10,Áo giữ nhiệt nữ thu đông cổ lọ vải cotton co giãn,30000,https://tiki.vn/ao-giu-nhiet-nu-thu-dong-co-lo-vai-cotton-co-gian-p145114938.html?spid=200719886,,13.0,aonu,390000.0
11,Áo thun giữ nhiệt lót nỉ cổ cao 3 phân hàng loại 1 - Màu,76000,https://tiki.vn/ao-thun-giu-nhiet-lot-ni-co-cao-3-phan-hang-loai-1-p72957463.html?spid=72957473,,54.0,aonu,4104000.0
12,Áo croptop cổ tròn dài tay chất thun co giãn dễ mix đồ freesize,39000,https://tiki.vn/ao-croptop-co-tron-dai-tay-chat-thun-co-gian-de-mix-do-freesize-p146252181.html?spid=203499455,,12.0,aonu,468000.0
13,GOTI - Áo Sơ Mi Công Sở Nữ Kiểu Áo Nữ Hàn Quốc Cổ Chữ V Kèm Phụ Kiện Ở Cổ - THỜI TRANG CÔNG SỞ 3A25,159000,https://tiki.vn/goti-ao-so-mi-cong-so-nu-kieu-ao-nu-han-quoc-co-chu-v-kem-phu-kien-o-co-thoi-trang-cong-so-3a25-p143687625.html?spid=143687661,,67.0,aonu,10653000.0
14,Áo thun unisex tay lỡ form rộng - Áo phông trái bơ,49000,https://tiki.vn/co-anh-that-ao-thun-unisex-tay-lo-form-rong-ao-phong-trai-bo-p73929481.html?spid=73929485,,117.0,aonu,5733000.0
15,Áo 2 Dây cotton Dáng Ôm Cho Nữ,50000,https://tiki.vn/ao-2-day-cotton-dang-om-cho-nu-p72478789.html?spid=95011568,,53.0,aonu,2650000.0
16,"Áo giữ nhiệt Motie siêu ấm co giãn tốt, kèm túi zip vàng",49500,https://tiki.vn/ao-giu-nhiet-motie-sieu-am-co-gian-tot-kem-tui-zip-vang-p105531738.html?spid=105531782,,3.0,aonu,148500.0
17,Áo thun tay dài form rộng unisex - Sweater cầu vòng,59000,https://tiki.vn/ao-thun-tay-dai-cau-vong-p68919015.html?spid=68919019,,34.0,aonu,2006000.0
18,Áo thun nữ ngắn tay đệm ngực nâng đỡ vải Viscose (gỗ tự nhiên) mềm mại thoáng mát mặc nhà mùa hè mã VAA0096,149000,https://tiki.vn/ao-thun-nu-ngan-tay-dem-nguc-nang-do-vai-viscose-go-tu-nhien-mem-mai-thoang-mat-mac-nha-mua-he-ma-vaa0096-p202622361.html?spid=202622393,,6.0,aonu,894000.0
19,Áo thun nữ MXM form rộng cổ tim in chữ Love Vacation thun 4 chiều từ 45-60kg ( ANU010 ),95000,https://tiki.vn/ao-thun-nu-mxm-form-rong-co-tim-in-chu-love-vacation-thun-4-chieu-tu-45-60kg-anu010-p249253365.html?spid=272368415,,19.0,aonu,1805000.0
20,"Áo Thun Nữ Cao Cấp Premium Cotton Sure Fashion, Mềm mại, Thoả mái, Thoáng khí, Nhẹ tênh, Kháng khuẩn, An toàn cho làn da, Bạn sẽ cảm nhận rất rõ ràng khi mặc sản phẩm Organic 100% cotton này",268000,https://tiki.vn/ao-thun-premium-cotton-sure-ao-thun-organic-cotton-thuong-hang-sieu-thoang-mat-sieu-tham-hut-sang-trong-va-lich-lam-cho-nam-va-nu-gia-san-pham-giam-den-50-cho-thoi-gian-trai-nghiem-san-pham-va-tang-ngay-1-uu-dai-tri-gia-100k-p273369075.html?spid=273369086,,10.0,aonu,2680000.0
21,"áo sơ mi nữ form rộng tay dài kiểu hàn, áo sơ mi nữ trắng 1 túi basic điệu đà",69000,https://tiki.vn/ao-so-mi-nu-form-rong-tay-dai-kieu-han-ao-so-mi-nu-trang-1-tui-basic-dieu-da-p152560118.html?spid=152560120,,97.0,aonu,6693000.0
22,Áo Thun Trơn Nam Nữ Nhiều Màu - THUN COTTON - Đủ Size ATT,50000,https://tiki.vn/ao-thun-tron-nam-nu-nhieu-mau-thun-cotton-du-size-att-p132131949.html?spid=132137238,,162.0,aonu,8100000.0
23,Áo thun tay lỡ form rộng - phông nam nữ cotton oversize - T shirt gấu đan len a - 2N Unisex,79000,https://tiki.vn/ao-thun-tay-lo-form-rong-phong-nam-nu-cotton-oversize-t-shirt-ga-u-dan-len-a-2n-unisex-p187644026.html?spid=187644032,,75.0,aonu,5925000.0
24,Áo đũi nữ form rộng fullsize M đến 2XL họa tiết thêu dễ mix đồ Đũi Việt DV17,131000,https://tiki.vn/ao-dui-nu-form-rong-fullsize-m-den-2xl-hoa-tiet-theu-de-mix-do-dui-viet-dv17-p160897698.html?spid=160897704,,27.0,aonu,3537000.0
25,"Bột màu nhuộm áo, quần, vải cotton 100",34000,https://tiki.vn/bot-mau-nhuom-ao-quan-vai-cotton-100-p263576709.html?spid=263576717,,40.0,aonu,1360000.0
26,Ngũ Cốc Bầu Lạc Lạc Plus 30 gói 600g Tặng quà cho bé,257140,https://tiki.vn/ao-ngu-coc-bau-lac-lac-plus-30-goi-p207290544.html?spid=207290545,,142.0,aonu,36513880.0
27,Áo Thun Nữ DOGA M116 Tone Màu Ngọt Ngàu Kiểu dáng Dễ Thương Phong Cách Hàn Quốc,99000,https://tiki.vn/m116-ao-thun-nu-tone-mau-ngot-ngao-p193760633.html?spid=193760637,,2.0,aonu,198000.0
28,Áo polo nữ ADINO màu ghi phối viền xẻ lai vải cotton co giãn dáng slimfit trẻ trung APN02,139000,https://tiki.vn/ao-polo-nu-adino-mau-ghi-phoi-vien-xe-lai-vai-cotton-co-gian-dang-slimfit-tre-trung-apn02-p146229717.html?spid=146229725,,63.0,aonu,8757000.0
29,Áo 2 Dây len Tăm có mút Mặc Trong Áo Vest Chất Vải đẹp Oxatyl M120,100000,https://tiki.vn/ao-2-day-len-tam-co-mut-mac-trong-ao-vest-chat-vai-dep-oxatyl-m120-p254141244.html?spid=254141250,,1.0,aonu,100000.0
30,"Áo 2 dây chất su lụa mát mịn kèm mút ngực, thiết kế siêu tinh tế - Áo tank top phong cách quý cô sành điệu",93000,https://tiki.vn/ao-2-day-chat-su-lua-mat-min-kem-mut-nguc-thiet-ke-sieu-tinh-te-ao-tank-top-phong-cach-quy-co-sanh-dieu-p152892655.html?spid=152892662,,1.0,aonu,93000.0
31,Áo sơ mi cổ nơ hoạ tiết chú ngựa dài tay siêu hót,282100,https://tiki.vn/ao-so-mi-co-no-hoa-tiet-chu-ngua-dai-tay-sieu-hot-p162601274.html?spid=162601280,,1.0,aonu,282100.0
32,Áo Thun 3 Lỗ Nữ 2 Chiếc Lá Vải Cotton Co Giãn 4 Chiều Mặc Đẹp Tôn Dáng Phong Cách Hàn Quốc SN121 Sally Boutique,135000,https://tiki.vn/ao-thun-tank-top-nu-2-chiec-la-vai-cotton-co-gian-4-chieu-mac-dep-thoai-mai-phong-cach-han-quoc-sally-sn121-p197742573.html?spid=197742692,,9.0,aonu,1215000.0
33,Áo thun tank top nữ - hàng nhập khẩu thương hiệu Everlast,150000,https://tiki.vn/ao-thun-tank-top-nu-hang-nhap-khau-thuong-hieu-everlast-p60749773.html?spid=60749817,,8.0,aonu,1200000.0
34,Áo Polo Nữ Coolmax Cộc Tay Cổ Dệt Dmax PL1S126-V909,425000,https://tiki.vn/ao-polo-nu-coolmax-coc-tay-co-det-dmax-pl1s126-v909-p252126089.html?spid=252126097,,1.0,aonu,425000.0
35,Áo hai dây nữ chất đẹp cực xinh ( ÁO 2 DÂY COTTON),38000,https://tiki.vn/ao-hai-day-nu-chat-dep-cuc-xinh-ao-2-day-cotton-p70895791.html?spid=138607955,,10.0,aonu,380000.0
36,"Crazy sale. Áo thun trơn nữ thoát nhiệt Nhật Bản GOKING, 100% cotton siêu thoáng mát, đánh bay cơn nóng mùa hè. Áo phông hàng hiệu cao cấp",99000,https://tiki.vn/ao-thun-tron-nu-thoat-nhiet-nhat-ban-goking-100-cotton-sieu-thoang-mat-danh-bay-con-nong-mua-he-p63057237.html?spid=63057249,,79.0,aonu,7821000.0
37,Áo sơ mi nữ cổng sở kiểu áo cột nơ cổ chữ v tay lật GOTI 3091,219000,https://tiki.vn/ao-so-mi-nu-cong-so-kieu-ao-cot-no-co-chu-v-tay-lat-goti-3091-p28700363.html?spid=105781848,,263.0,aonu,57597000.0
38,Áo Sơ Mi Nữ Kiểu Cổ Đức Mở V Phối Khăn Chất Lụa Mềm Mịn 53SNL2005ST,609000,https://tiki.vn/ao-so-mi-nu-kieu-co-duc-mo-v-phoi-khan-chat-lua-mem-min-53snl2005st-p247855788.html?spid=247855796,,1.0,aonu,609000.0
39,Áo sơ mi nữ cộc tay phồng cổ sen kiểu croptop siêu xinh,69000,https://tiki.vn/ao-so-mi-nu-coc-tay-phong-co-sen-kieu-croptop-sieu-xinh-p230202572.html?spid=230202576,,2.0,aonu,138000.0
40,Áo Sơ Mi Nữ Sọc Thêu Mùa Thu MS0111A,185000,https://tiki.vn/ao-so-mi-nu-soc-theu-mua-thu-ms0111a-p7595728.html?spid=7595730,,18.0,aonu,3330000.0
41,Áo phông nam nữ form rộng 2N Unisex thun cotton in hình thỏ raglan màu trắng/xám đất,109000,https://tiki.vn/ao-phong-nam-nu-form-rong-2n-unisex-thun-cotton-in-hinh-tho-raglan-mau-trang-xam-dat-p271421536.html?spid=271421540,-25%,1.0,aonu,109000.0
42,Áo thun Unisex 20We Basic Tee phông trơn nam nữ RP_01 tay lỡ oversize form rộng 4 màu,24000,https://tiki.vn/ao-thun-unisex-phong-tron-nam-nu-rp_01-tay-lo-oversize-form-rong-4-mau-p110751447.html?spid=115772036,,276.0,aonu,6624000.0
43,áo nữ cổ bẻ - phong cách trẻ trung năng động cho các chị nhà mình (T51),129000,https://tiki.vn/ao-nu-co-be-phong-cach-tre-trung-nang-dong-cho-cac-chi-nha-minh-t51-p134381351.html?spid=134383438,-6%,32.0,aonu,4128000.0
44,Áo Sơ Mi Trắng Nữ Tay Ngắn Cộc Tay Mola Somi Công Sở Đi Học ĐI Làm Màu Trắng Đen Kem Hàng Thiết Kế Cao Cấp Không Nhăn,180000,https://tiki.vn/ao-so-mi-trang-nu-tay-ngan-coc-tay-mola-somi-cong-so-di-hoc-di-lam-mau-trang-den-kem-hang-thiet-ke-cao-cap-khong-nhan-p165236773.html?spid=165236909,-67%,15.0,aonu,2700000.0
45,Áo ba lỗ cổ V dệt kim mềm mịn áo thun Quảng Châu 2022 cao cấp,85000,https://tiki.vn/ao-ba-lo-co-v-det-kim-mem-min-ao-thun-quang-chau-2022-cao-cap-p189750140.html?spid=189750142,,3.0,aonu,255000.0
46,Áo Sơ Mi Nữ Ngắn Tay Công Sở Thời Trang PONIVA Cao Cấp Không Nhăn Không Xù,125000,https://tiki.vn/ao-so-mi-nu-ngan-tay-cong-so-khong-nhan-khong-xu-p105951430.html?spid=105952210,-16%,8.0,aonu,1000000.0
47,Áo Sơ Mi Nữ Nơ Cổ Viền Nổi Bật MS0075A,190000,https://tiki.vn/ao-so-mi-nu-no-co-vien-noi-bat-ms0075a-p7618176.html?spid=7618178,,18.0,aonu,3420000.0
48,Áo Thun Ba Lỗ Nữ Sát Nách Cotton 4 Chiều In Hình Con Mèo SN105 Sally Boutique,135000,https://tiki.vn/ao-thun-ba-lo-nu-sat-nach-cotton-4-chieu-in-con-meo-cat-sally-sn105-mac-dep-ton-dang-ket-hop-voi-nhieu-trang-phuc-khac-p197743338.html?spid=197743369,,2.0,aonu,270000.0
49,ÁO SƠ MI TRUNG NIÊN CAO CẤP- ÁO KIỂU TRUNG NIÊN IN HOA SANG TRONG_ÁO NỮ TRUNG NIÊN,199000,https://tiki.vn/ao-so-mi-trung-nien-cao-cap-ao-kieu-trung-nien-in-hoa-sang-trong_ao-nu-trung-nien-p126524410.html?spid=126524441,,2.0,aonu,398000.0
50,Áo Sơ Mi Tay Dài Nữ Giordano 05340038,887000,https://tiki.vn/ao-so-mi-tay-dai-nu-giordano-mau-tim-05340038-p139603365.html?spid=249287983,,30.0,aonu,26610000.0
51,Áo sơ mi cổ trụ tay lỡ dáng xuông thời trang Hàn Quốc ( mã A25),186000,https://tiki.vn/ao-so-mi-co-tru-tay-lo-dang-xuong-thoi-trang-han-quoc-ma-a25-p179418058.html?spid=179418195,,20.0,aonu,3720000.0
52,"áo kiểu nữ cổ yếm hở vai 2 lớp kèm dây đai, áo babydoll bánh bèo trẻ trung",74000,https://tiki.vn/ao-kieu-nu-co-yem-ho-vai-2-lop-kem-day-dai-ao-babydoll-banh-beo-tre-trung-p230229959.html?spid=230229961,,12.0,aonu,888000.0
53,Áo Sơ Mi Linen Nữ Giordano 05340005,310000,https://tiki.vn/ao-so-mi-linen-nu-giordano-05340005-p249291533.html?spid=249291539,,1.0,aonu,310000.0
54,Áo phông kẻ nhỏ_áo thun nữ,44000,https://tiki.vn/ao-phong-ke-nho_ao-thun-nu-p115770370.html?spid=115770400,,1.0,aonu,44000.0
55,Áo thun nữ form rộng tay lỡ oversize hoa mất cánh peace unisex - thời trang nam nữ hot trend,21000,https://tiki.vn/ao-thun-nu-form-rong-tay-lo-oversize-hoa-mat-canh-peace-unisex-thoi-trang-nam-nu-hot-trend-p52051393.html?spid=108968076,,27.0,aonu,567000.0
56,Áo kiểu công sở cổ vuông phối hoa thời trang Eden - ASM216,279000,https://tiki.vn/ao-kieu-cong-so-co-vuong-phoi-hoa-thoi-trang-eden-asm216-p271392849.html?spid=271392851,,1.0,aonu,279000.0
57,"Áo ba lỗ croptop cá tính có mút ngực, áo bra nữ",79000,https://tiki.vn/ao-ba-lo-croptop-ca-tinh-co-mut-nguc-ao-bra-nu-p217765397.html?spid=217765404,,2.0,aonu,158000.0
58,Áo len dệt kim nữ tay ngắn - Áo thun nữ kiểu kẻ sọc ngũ sắc sinh động trẻ trung hàng thiết kế Quảng Châu cao,118000,https://tiki.vn/ao-len-det-kim-nu-tay-ngan-ao-thun-nu-kieu-ke-soc-ngu-sac-sinh-dong-tre-trung-hang-thiet-ke-quang-chau-cao-p201422968.html?spid=201422994,,4.0,aonu,472000.0
59,Áo kiểu nữ thời trang Eden cổ xếp li - ASM163,279000,https://tiki.vn/ao-kieu-nu-thoi-trang-eden-co-xep-li-asm163-p146267358.html?spid=146267362,,28.0,aonu,7812000.0
60,Áo sơ mi nữ Giấu Nút tay dài phối voan mỏng,151000,https://tiki.vn/ao-so-mi-nu-giau-nut-tay-dai-phoi-voan-mong-p70607255.html?spid=70607267,,40.0,aonu,6040000.0
61,"Áo sơ mi linen nữ form rộng trẻ trung ArcticHunter, thời trang thương hiệu chính hãng",250000,https://tiki.vn/ao-so-mi-linen-nu-form-rong-tre-trung-arctichunter-thoi-trang-thuong-hieu-chinh-hang-p182601565.html?spid=182601571,,27.0,aonu,6750000.0
62,Áo Sơ Mi Nữ Ngắn Tay Màu Trơn Thời Trang Công Sở Thanh Lịch PONIVA Chất Liệu Mềm Mại Thấm Hút Mồ Hôi Tốt,90000,https://tiki.vn/ao-so-mi-nu-ngan-tay-mau-tron-thoi-trang-cong-so-thanh-lich-poniva-chat-lieu-mem-mai-tham-hut-mo-hoi-tot-p140465042.html?spid=140465049,,8.0,aonu,720000.0
63,Áo Croptop Nữ Thun Trơn 3 Lỗ Ôm Body Sát Nách Kiểu Khoét Hở Lưng Có Độn Mút Ngực Không Tay Sexy Crop Top CRT 2021 Ba Lỗ,89000,https://tiki.vn/ao-croptop-nu-thun-tron-3-lo-om-body-sat-nach-kieu-khoet-ho-lung-co-don-mut-nguc-khong-tay-sexy-crop-top-crt-2021-ba-lo-p113617402.html?spid=113617419,,1.0,aonu,89000.0
64,áo sơ mi nữ áo sơ mi dài tay vạt tôm nhiều màu chất đũi,90000,https://tiki.vn/ao-so-mi-nu-ao-so-mi-dai-tay-vat-tom-nhieu-mau-chat-dui-p113926163.html?spid=113926165,,40.0,aonu,3600000.0
65,"Áo kiểu nữ họa tiết hoa nhí tay phồng cổ tròn sang trọng - nhiều size và màu, form dáng chuẩn thích hợp mặc đi làm hoặc dự tiệc",178000,https://tiki.vn/ao-kieu-nu-hoa-tiet-hoa-nhi-tay-phong-co-tron-sang-trong-nhieu-size-va-mau-form-dang-chuan-thich-hop-mac-di-lam-hoac-du-tiec-p89153420.html?spid=89153432,,28.0,aonu,4984000.0
66,"Áo hai dây cổ tim nữ vải Modal tự nhiên 100% thân thiện, mặc thoáng mát co giãn thoải mái mã VAA0072",159000,https://tiki.vn/ao-hai-day-co-tim-nu-vai-modal-tu-nhien-100-than-thien-mac-thoang-mat-co-gian-thoai-mai-ma-vaa0072-p163927418.html?spid=209350798,-23%,16.0,aonu,2544000.0
67,Áo Polo Nữ YODY Phối Nẹp Thoải Mái Năng Động Chất Liệu Cafe Khử Mùi Tốt - APN3700,299000,https://tiki.vn/ao-polo-nu-yody-phoi-nep-thoai-mai-nang-dong-chat-lieu-cafe-khu-mui-tot-apn3700-p116150095.html?spid=116150839,-50%,235.0,aonu,70265000.0
68,Áo nữ trắng tinh kiểu cổ oval tay phồng xinh xắn,115000,https://tiki.vn/ao-nu-trang-tinh-kieu-co-oval-tay-phong-xinh-xan-p53206600.html?spid=171508934,,5.0,aonu,575000.0
69,"Áo sơ mi nữ dài tay công sở in hoa ArcticHunter, thời trang trẻ, thương hiệu chính hãng",99000,https://tiki.vn/ao-so-mi-nu-dai-tay-cong-so-in-hoa-arctichunter-thoi-trang-tre-thuong-hieu-chinh-hang-p46695130.html?spid=67406469,-17%,9.0,aonu,891000.0
70,Áo polo nữ màu trắng phối viền chìm ADINO vải cotton polyester mềm dáng slimfit công sở hơi ôm trẻ trung APN03,159000,https://tiki.vn/ao-polo-nu-adino-mau-trang-phoi-vien-chim-vai-cotton-co-gian-dang-slimfit-tre-trung-apn03-p121258407.html?spid=121258411,,256.0,aonu,40704000.0
71,"Siêu giảm giá. Áo thun nữ thoát nhiệt Nhật Bản Goking, form ôm eo, chất liệu tự nhiên 100% cotton thấm hút mồ hôi tốt. Áo phông trơn nữ hàng hiệu cao cấp",99000,https://tiki.vn/ao-thun-nu-thoat-nhiet-nhat-ban-goking-form-om-chat-lieu-tu-nhien-100-cotton-tham-hut-mo-hoi-tot-p31597593.html?spid=44557959,-52%,483.0,aonu,47817000.0
72,"Áo Thun Nam nữ Họa Tiết lá Cờ Mỹ - USA , hàng Xuất dư chất liệu Cotton 100",20000,https://tiki.vn/ao-thun-nam-nu-hoa-tiet-la-co-my-usa-mau-ao-hot-nam-2020-hang-xuat-du-cotton-100-p72016777.html?spid=93156981,,380.0,aonu,7600000.0
73,Áo kiểu Bigsize 60-85 ký,125000,https://tiki.vn/ao-kieu-bigsize-60-85-ky-p95136752.html?spid=95136780,,14.0,aonu,1750000.0
74,"Áo thun nữ vải cá sấu co giãn 4 chiều, kiểu may cao cấp cổ bẻ, tay bo, có xẻ lai - Màu hồng",81900,https://tiki.vn/ao-thun-nu-vai-ca-sau-co-gian-4-chieu-kieu-may-cao-cap-co-be-tay-bo-co-xe-lai-mau-hong-p105104035.html?spid=137951819,,2.0,aonu,163800.0
75,Áo thun dệt kim nữ tay ngắn cổ V kẻ sọc thời trang Hàn Quốc 2021,119000,https://tiki.vn/ao-thun-det-kim-nu-tay-ngan-co-v-ke-soc-thoi-trang-han-quoc-2021-p177315216.html?spid=177315218,,4.0,aonu,476000.0
76,"Áo thun nữ tay lỡ dáng rộng MẶT CƯỜI cute ( Vàng, Trắng )",69000,https://tiki.vn/ao-thun-nu-tay-lo-dang-rong-mat-cuoi-cute-vang-trang-p82748320.html?spid=82748508,,1.0,aonu,69000.0
77,Áo thun croptop form rộng tay lở Unisex màu trắng / đen CRA023,61750,https://tiki.vn/ao-thun-croptop-form-rong-tay-lo-unisex-mau-trang-den-cra023-p155182902.html?spid=155182912,,14.0,aonu,864500.0
78,Áo sơ mi nữ form rộng tay phồng ArcticHunter chất Linen tưng Hàn mềm mát,289000,https://tiki.vn/ao-so-mi-nu-form-rong-tay-phong-arctichunter-chat-linen-tung-han-mem-mat-p247407796.html?spid=247407808,,9.0,aonu,2601000.0
79,Áo Thun Tay Lỡ Nữ Growig Cực Đẹp Form Rộng Dưới 85kg Mặc Đẹp,55000,https://tiki.vn/ao-thun-tay-lo-nu-growig-cuc-dep-form-rong-duoi-85kg-mac-dep-p48881240.html?spid=56388933,,112.0,aonu,6160000.0
80,Áo Sơ Mi Nữ Trơn Dài Tay Công Sở CV088 Chất Kate Mềm Mịn Chuẩn Form Thời trang nữ cao cấp,138000,https://tiki.vn/ao-so-mi-nu-tron-dai-tay-cong-so-cv088-chat-kate-mem-min-chuan-form-thoi-trang-nu-cao-cap-p70087428.html?spid=70087438,,74.0,aonu,10212000.0
81,Áo kiểu nữ công sở cổ nơ phối nút thời trang Eden - ASM210,279000,https://tiki.vn/ao-kieu-nu-cong-so-co-no-phoi-nut-thoi-trang-eden-asm210-p270213896.html?spid=270213906,,2.0,aonu,558000.0
82,áo xoắn vai chất zip cotton điệu đà,68000,https://tiki.vn/ao-xoan-vai-chat-zip-cotton-dieu-da-p68197263.html?spid=108502161,,31.0,aonu,2108000.0
83,Áo sơ mi nữ tay dài form rộng phong cách trẻ trung hàn quốc vải lụa mềm mịn mát -MURD04,100000,https://tiki.vn/ao-so-mi-nu-tay-dai-form-rong-phong-cach-tre-trung-han-quoc-vai-lua-mem-min-mat-murd04-p189527267.html?spid=189527275,,6.0,aonu,600000.0
